en,tr,es,title,speaker,duration,tags
"
","
","
",Where in the world is it easiest to get rich?,Harald Eia,15:42,"global issues,capitalism,global development,economics,government"
