en,es,tr,fr,de,title,speaker,duration,tags
"
","
","
","
","
",How do we smell?,Rose Eveleth,4:04,"TED-Ed,animation,smell,human body,science,biology,physiology"
