es,tr,fr,de,title,speaker,duration,tags
"
											Me siento como Hank Aaron. Barry Bonds puede reemplazarme en cualquier momento.
											Saquemos otra enfermedad de la lista de cosas terribles de las que tenemos que preocuparnos.
											Hace poco estuve en India trabajando en el programa contra el polio.
											El programa de vigilancia contra el polio supone cuatro millones de personas yendo de puerta en puerta.
											Ese es el sistema de vigilancia.
											Pero necesitamos conseguir detección temprana, respuesta temprana.
											Lo mismo con la ceguera. La clave para descubrir la ceguera
											es hacer inspecciones epidemiológicas y encontrar las causas de la ceguera
											para poder ofrecer un respuesta correcta.
									","
											Kendimi Hank Aaron gibi hissediyorum. Barry Bonds her an yerimi alabilir.
											Haydi listeden endişelenmemiz gereken bir hastalığı daha çıkaralım.
											Hindistan'da çocuk felci programında çalışıyordum.
											Çocuk felci gözetim programı dört milyon insanın kapı kapı dolaşması demektir.
											Gözetleme sistemi buydu.
											Ama bizim erken teşhis ve erken tedavi yapmamız gerek.
											Körlük, aynı şey. Körlüğü keşfetmenin püf noktası
											epidemiyolojik anketler yapmak ve körlük nedenlerini bulmaktır
											bu sayede doğru tepki verebilirsiniz.
									","
											J'ai l'impression d'être Hank Aaron. Barry Bonds peut me remplacer à tout moment.
											Rayons une autre maladie de cette liste de choses terribles dont nous devons nous inquiéter.
											Je reviens d'Inde où je travaillais sur le programme contre la polio.
											Le programme de surveillance de la polio, c'est 4 millions de gens qui vont de porte en porte.
											Voilà le programme de surveillance.
											Mais nous devons avoir une détection précoce et une réponse rapide.
											La cécité, c'est pareil. La clé pour découvrir la cécité
											est de faire des enquêtes et découvrir les causes de la cécité
											pour pouvoir mettre en place la réponse adéquate.
									","
											Ich fühle mich wie Hand Aaron. Barry Bonds kann mich jederzeit ersetzen.
											Lasst uns eine weitere Krankheit von unserer Sorgenliste streichen.
											Ich war gerade in Indien, um am Programm gegen Polio zu arbeiten.
											Das Programm gegen Polio beinhaltet vier Millionen Menschen, die von Tür zu Tür gehen.
											Das ist das Überwachungssystem.
											Aber wir brauchen die Früherkennung und schnelle Reaktion.
											Dasselbe mit Blindheit. Der Schlüssel, Erblindung zu erkennen,
											sind epidemiologische Umfragen und das Finden der Ursachen,
											so dass man die richtige Behandlung anwenden kann.
									",My wish: Help me stop pandemics,Larry Brilliant,25:50,"TED Prize,collaboration,disease,ebola,global issues,health,science,technology"
"
","
","
","
",My wish: Help me stop pandemics,Larry Brilliant,25:50,"TED Prize,collaboration,disease,ebola,global issues,health,science,technology"
"
											La Fundación Seva la iniciaron un grupo de ex alumnos
											del programa de erradicación de la viruela quienes
											habiendo escalado la montaña más alta,
											saborearon el elixir del éxito de haber erradicado una enfermedad,
											y querían hacerlo de nuevo.
											Y durante los últimos 27 años, los pogramas de Seva en 15 países
											han devuelto la vista a más de dos millones de personas ciegas.
											Seva se inició porque queríamos aplicar esas lecciones
											de vigilancia y epidemiología
											a algo que nadie consideraba
											un problema de salud pública: la ceguera,
											que hasta ese momento se había considerado solamente como una enfermedad clínica.
									","
											The Seva Kuruluşu çiçek hastalığıyla savaşma programından
											mezun olanların başlattığı bir eylemdir,
											bu kişiler en yüksek dağlara tırmanıp
											hastalığı yenme iksirini tattıkları için tekrar
											yapmak istiyorlar.
											Geçen 27 yıldan sonra, Seva'nın programları 15 ülkede
											iki milyardan fazla kör insana görme yetisini kazandırdı.
											Seva girişime başladı çünkü takip ve epidemiyolojik
											derslerini hiç kimsenin bakmadığı
											toplumsal bir sağlık konusuna yani
											körlüğe uygulmak istiyorduk,
											körlük bu zamana kadar sadece klinik bir hastalık olarak bilinirdi.
									","
											La fondation Seva a commencé avec un groupe d'anciens étudainst
											du programme d'éradication de la variole qui,
											ayant escaladé la montagne la plus haute,
											ont goûté à l'élixir du succès d'avoir éradiqué une maladie,
											voulaient le refaire.
											Et ces 27 années, les programmes Seva dans 15 pays
											ont rendu la vue à plus de deux millions de personnes aveugles.
											Seva a commencé parce que nous voulions appliquer ces leçons
											de surveillance et d'épidémiologie
											à quelque chose que personne d'autre ne considérait
											comme un problème de santé publique : la cécité,
											qu'on pensait jusqu'ici être seulement une maladie clinique.
									","
											Die Seva Stiftung wurde von einer Gruppe Ehemaliger
											aus dem Pocken-Ausrottungsprogramm gegründet,
											die, nachdem sie den höchsten Berg bestiegen hatten
											und auf den Geschmack des Erfolges gekommen waren,
											dasselbe nochmals tun wollten.
											In den letzten 27 Jharen haben Seva-Programme in 15 Ländern
											mehr als zwei Millionen blinden Menschen das Augenlicht wiedergegeben.
											Seva kam zustande, weil wir die Lektionen über Überwachung
											und Epidemiologie anwenden wollten
											auf etwas, das kaum als Thema der öffentlichen Gesundheit
											angesehen wurde: Blindheit,
											die zuvor immer nur als klinische Krankheit betrachtet worden war.
									",My wish: Help me stop pandemics,Larry Brilliant,25:50,"TED Prize,collaboration,disease,ebola,global issues,health,science,technology"
"
","
","
","
",My wish: Help me stop pandemics,Larry Brilliant,25:50,"TED Prize,collaboration,disease,ebola,global issues,health,science,technology"
"
											En 1980 Steve Jobs me dio esa computadora, que es la Apple número 12,
											y todavía está en Kathmandu, y todavía está funcionando,
											y deberíamos ir a conseguirla y subastarla para conseguir más dinero para Seva.
											Y realizamos el primer estudio de la salud en Nepal,
											y el primer estudio nacional de ceguera realizado en el mundo,
											y tuvimos resultados sorprendentes.
											En lugar de encontrar lo que pensábamos —
											que la ceguera era causada en su mayoría por glaucoma y tracoma —
											nos sorprendimos al encontrar que la ceguera era en realidad causada por cataratas.
											No puedes curar o prevenir lo que no sabes que está ahí.
									","
											1980'de, Steve Jobs bana bu bilgisayarı, Apple 12 numara, verdi
											ve şu an hala Kathmandu'da çalışır durumda
											ve onu alıp açık artırmada satıp Seva için para toplamamız gerek.
											Sağlık ve ülke çapındaki körlük hakkında bir anket
											yaptık, bu anket ilk defa yapılmıştı
											ve biz şaşırtıcı sonuçlara ulaştık.
											Konuda tahmin ettiğimiz şeyin yerine —
											körlük çoğunlukla glokom ve trahom'dan dolayı ortaya çıkıyordu —
											körlüğün kartarakt'ten başka bir nedenden dolayı çıktığına çok şaşırdık.
											Ne olduğunu bilmeden ne engelleyebilirsin ne de tedavi edebilirsin.
									","
											En 1980, Steve jobs m'a donné cet ordinateur, qui est un Apple numéro 12,
											et il est encore à Katmandou, et il marche encore,
											et nous devrions aller le chercher et le vendre aux enchères et gagner plus d'argent pour Seva.
											Et nous avons mené au Népal la première enquête jamais faite pour la santé,
											et la première enquête nationale sur la cécité jamais faite,
											et nous avons eu des résultats étonnants.
											Au lieu de trouver ce que nous pensions être le cas —
											que la cécité étaient causée essentiellement par le glaucome et le trachome —
											nous avons été stupéfaits de découvrir que la cécité était causée en fait par la cataracte.
											Vous ne pouvez ni guérir ni prévenir ce dont vous ignorez la présence.
									","
											1980 gab Steve Jobs mir diesen Computer, einen Apple Nummer 12,
											er ist immer noch in Kathmandu, er funktioniert noch
											und wir sollten ihn herbringen und versteigern, um Geld für Seva zu sammeln.
											Wir führten in Nepal die erste Gesundheitsumfrage überhaupt durch,
											ebenso wie die erste nationale Umfrage zu Blindheit,
											und wir hatten erstaunliche Ergebnisse.
											Anstelle der Ergebnisse, die wir erwartet hatten –
											dass Erblindung meist durch Grünen Star und Körnerkrankheit ausgelöst würde –
											waren wir erstaunt zu sehen, dass die Blindheit stattdessen vom Altersstar kam.
											Man kann nichts heilen oder vorbeugen, von dessen Existenz man nicht weiss.
									",My wish: Help me stop pandemics,Larry Brilliant,25:50,"TED Prize,collaboration,disease,ebola,global issues,health,science,technology"
"
","
","
","
",My wish: Help me stop pandemics,Larry Brilliant,25:50,"TED Prize,collaboration,disease,ebola,global issues,health,science,technology"
"
											En sus paquetes de TED hay un DVD, ""Visión Infinita""
											sobre el Dr. V y el Hospital de la Vista de Aravind.
											Espero que lo miren.
											Aravind, que comenzó como un proyecto del Seva,
											es ahora el mejor y más grande hospital de la vista del mundo.
											Este año, ese hospital por sí solo, le devolverá la vista
											a más de 300 000 personas en Tamil Nadu, India.
											(Aplausos)
											Gripe aviar. Yo me paro aquí como un representante de todas las cosas terribles —
											esta podría ser la peor.
											La clave para prevenir o mitigar una gripe aviar pandémica
											es la detección temprana y la respuesta temprana.
											No tendremos una vacuna o suministros suficientes de antivirales
											para combatir la gripe aviar si ocurre en los próximos tres años.
											La OMS establece niveles en el desarrollo de una pandemia.
											En este momento estamos en el nivel tres en la escala de alerta pandémica,
											con solo un poco de transmisión humano-a-humano,
											pero sin transmisión sostenida de humano-a-humano-a-humano.
									","
											Bizim TED paketlerimizide Sonsuz Görüş (Infinite Vision) adında
											Aravind Göz Hastanesinden Dr. V'nin DVD'si vardı.
											Umarım ona bir göz atarsınız.
											Seva projesi olarak başlaya Aravind
											şimdi dünyanın en büyük ve iyi hastanesidir.
											Bu yıl,Hindistan Tamil Nadu'da 300,000'den fazla
											kişi tekrar görme yeteneğini geri kazandı.
											(Alkışlar)
											Kuş gribi. Burda hep kötü şeylerin temsilcisi gibi duruyorum —
											bu en kötüsü olabilir.
											Evrensel kuş gribini engellemenin püf noktası
											erken tanı erken tedavidir.
											Önümüzdeki üç yıl içinde kuş gribi çıkarsa, elimizde
											aşı ve yeterince antiviral olmayacaktır.
											DSÖ (WHO) hastalığın ilerleyişini sıraladı.
											Şimdi üçüncü aşamadayız, insan-insan iletimi adlı
											evrensel alarm aşamasındayız
											ama insan-insan-insan iletimi şu an yaşanmıyor.
									","
											Dans vos sacs TED, il y a un DVD, ""vision Infinie,""
											qui parle du Docteur V. et de l'Hôpital pour les Yeux Aravind.
											J'espère que vous le regarderez.
											Aravind, qui a commencé en tant que projet Seva,
											est maintenant le plus grand et le meilleur hôpital pour les yeux.
											Cette année, cet hôpital rendra la vue
											à plus de 300 000 personnes dans le Tamil Nadu, en Inde.
											(Applaudissements)
											La grippe aviaire. Je suis ici en tant que représentant de ces terribles choses —
											celles-ci pourrait être la pire.
											La clé de la prévention ou de la réduction de la pandémie de grippe aviaire
											est la détection précoce et la réponse rapide.
											Nous n'aurons pas de vaccin ou de stocks adéquats d'un antiviral
											pour combattre la grippe aviaire si elle survient dans les trois prochaines années.
											l'OMS simule la progression de la pandémie.
											Nous en sommes à présent au stade 3 sur l'échelle d'alerte de la pandémie,
											avec seulement un peu de transmission d'humain à humain,
											mais pas de transmission soutenue d'humain à humain.
									","
											In Ihrem TED Paket ist eine DVD, ""Unendliche Sicht"",
											über Dr. V und die Aravind Augenklinik.
											Ich hoffe, Sie werden es sich ansehen.
											Aravind, das als Seva Projekt gestartet wurde,
											ist jetzt die grösste und beste Augenklinik der Welt.
											Dieses Jahr wird dieses eine Krankhenhaus mehr als
											300.000 Menschen in Tamil Nadu, Indien, das Augenlicht zurück geben.
											(Applaus)
											Vogelgrippe. Ich stehe hier als Vertreter aller schrecklichen Dinge –
											das könnte das schlimmste sein.
											Der Schlüssel zur Prävention oder Milderung der Vogelgrippe
											ist Früherkennung und schnelle Reaktion.
											Wir werden keine Impfung oder ausreichende antivirale Versorgung haben,
											um die Vorgelgrippe zu bekämpfen, wenn Sie in den kommenden drei Jahren kommt.
											Die WHO etappiert das Fortschreiten einer Pandemie.
											Wir sind jetzt in Phase drei der pandemischen Notfalletappen,
											mit erst wenig Mensch-zu-Mensch Übertragung,
											aber noch keiner ununterbrochenen Mensch-zu-Mensch-zu-Mensch Übertragung.
									",My wish: Help me stop pandemics,Larry Brilliant,25:50,"TED Prize,collaboration,disease,ebola,global issues,health,science,technology"
"
","
","
","
",My wish: Help me stop pandemics,Larry Brilliant,25:50,"TED Prize,collaboration,disease,ebola,global issues,health,science,technology"
"
											En el momento en que la OMS diga que nos hemos movido a la categoría cuatro,
											esto no será como Katrina. El mundo como lo conocemos se detendrá.
											No habrá aviones volando.
											¿Te subirías a un avión con 250 personas que no conoces,
											tosiendo y estornudando, cuando sabes que algunos de ellos
											podrían portar una enfermedad que te podría matar,
											para la cual no tienes drogas antivirales o vacunas?
											Realicé un estudio de los epidemiólogos más importantes del mundo en octubre.
											Les pregunté — todos investigadores de la gripe y especialistas en gripe —
											y les hice las preguntas que a ustedes les gustaría hacerles.
											¿Cuál es la probabilidad de que haya una pandemia?
											Si ocurre, ¿qué tan terrible cree que sea?
									","
											WHO dördüncü seviyeye geçtiğimizi söyledi anda,
											bu Katrina durumu gibi olmayacak. Bir nevi bu dünya duracak.
											Havada uçan uçak kalmayacak.
											Hiç tanımadığınız 250 öksüren, hapşıran kişinin bulduğu
											bir uçağa bazılarının bu hastalığı taşıdığını, bu
											hastalığın sizi öldürebileceğini ve aşısının
											olmadığını bilerek biner misiniz?
											Ekim ayında dünyanın en iyi epidemiyolojistleri ile çalıştım.
											Onlara — burdakiler nezle ve grip konusunda uzman kişler —
											ve onlara sizin sormak istediğiniz soruları sordum.
											Yaygın olma olasılığı hakkında ne düşünüyorsunuz?
											Eger gerçekleşirse, ne kadar kötü olacağını düşünüyorsunuz?
									","
											Quand l'OMS dira que nous sommes passés au niveau 4,
											ce ne sera pas comme pour Katrina. Le monde tel que nous le connaissons s'arrêtera.
											Il n'y aura pas d'avion dans le ciel.
											Prendriez-vous un avion avec 250 personnes que vous ne connaissez pas,
											qui toussent et éternuent, quand vous savez que certaines d'entre elles
											pourraient être porteuses d'une maladie qui pourrait vous tuer,
											pour laquelle vous n'avez ni antiviraux ni vaccin?
											J'ai fait une étude des meilleurs épidémiologistes dans le monde en Octobre,
											je leur ai demandé — ce sont tous des spécialistes de la grippe —
											et je leur ai posé les questions que vous aimeriez leur poser.
											Quelles sont selon vous les chances qu'il y ait une pandémie?
											Si cela arrive, quel en serait le degré de gravité?
									","
											Sobald die WHO sagt, dass wir in Phase vier angekommen sind,
											wird das nicht wie Katrina sein. Die Welt, wie wir sie kennen, wird gestoppt werden.
											Es wird keine Flugzeuge in der Luft geben.
											Würden Sie sich mit 250 unbekannten Menschen in ein Flugzeug setzen,
											die husten und schniefen, wenn Sie wissen, das manche von ihnen
											möglicherweise eine für sIe tödliche Krankheit tragen,
											für die Sie keine Medizin oder Impfung haben?
											Ich habe im Oktober eine Studie gemacht mit den führenden Epidemiologen.
											Ich fragte sie – es sind alles Grippespezialisten –
											und ich stellte ihnen jene Fragen, die Sie ihnen stellen möchten.
											Für wie wahrscheinlich halten Sie eine Pandemie?
											Wenn es geschieht, wie schlimm denken Sie, wird es sein?
									",My wish: Help me stop pandemics,Larry Brilliant,25:50,"TED Prize,collaboration,disease,ebola,global issues,health,science,technology"
"
","
","
","
",My wish: Help me stop pandemics,Larry Brilliant,25:50,"TED Prize,collaboration,disease,ebola,global issues,health,science,technology"
"
											El 15% dijo que pensaban que habría una pandemia dentro de los próximos tres años.
											Pero mucho peor que eso,
											el 90% dijo que pensaba que habría una pandemia
											durante la vida de sus hijos o sus nietos.
											Y ellos pensaban que si había una pandemia,
											mil millones de personas se enfermarían.
											Y 165 millones morirían.
											Habría una recesión y depresión global
											mientras nuestro sistema de inventarios justo-a-tiempo
											y el tenso elástico de la globalización se rompían,
											y el costo para nuestra economía de uno a tres millones de millones de dólares
											sería mucho peor para todos que los solamente 100 millones de muertos
											porque mucha más gente perdería su trabajo
											y sus beneficios de salud
											que las consecuencias son casi impensables.
											Y está empeorando, porque viajar está siendo cada vez mejor.
									","
											Yüzde 15'i üç yıl içinde salgın olacağını düşündüğünü söyledi.
											Ama bundan da kötüsü,
											yüzde 90'ı çocuklarınızın veya torunlarınızın ömrü
											süresinde bir salgın olacağını düşündüğünü söyledi.
											Ve onlara göre, eğer bir salgın olursa,
											bir milyar insan hasta olacak.
											165 milyon kişi kadarı da ölecek.
											Piyasada küresel bir durgunluk ve depresyon yaşanacak
											çünkü bizim tam vakitinde envanter sistemimiz
											ve sıkı global bağlarımız bozulacak
											ve bunun ekonomiye zararı bir ila üç trilyon dolar kadar
											olacak ve bu 100 milyon insanın ölmesinden daha zararlı olacak
											çünkü bu kadar insan işini kaybedecek
											ve sağlık durumlarının nasıl
											olacağını düşünmek çok zor olacak.
											Ve daha da kötüye gidecek çünkü hastalık daha fazla yayılacak.
									","
											15% d'entre eux ont dit qu'ils pensaient qu'il y aurait une pandémie dans les trois ans.
											Mais pire que ça,
											90% ont dit qu'ils pensaient qu'il y aurait une pandémie
											au cours de la vie de vos enfants ou de vos petits enfants.
											Et ils pensaient que s'il y a une pandémie,
											un milliard de gens tomberaient malades.
											Jusqu'à 165 millions de gens en mourraient.
											il y aurait une récession mondiale et une dépression
											alors que notre système d'inventaire réglé
											et le mince bandeau élastique de la mondialisation se casseraient,
											et le coût pour notre économie de 1 à 3 milliards de $
											serait bien pire pour tout le monde que simplement 100 millions de morts
											parce que tant de gens perdraient leur emploi
											et leurs couverture de santé
											que les conséquences en seraient presque inimaginables.
											Et cela empire parce que les voyages s'améliorent tellement.
									","
											15 % sagten, sie rechnen innerhalb der nächsten drei Jahre mit einer Pandemie.
											Aber schlimmer als das ist,
											90 % sagten, sie rechnen mit einer Pandemie
											innerhalb der Lebenszeit Ihrer Kinder oder Enkelkinder.
											Und sie meinten, wenn es eine Pandemie gäbe,
											würden eine Milliarde Menschen erkranken.
											Bis zu 165 Millionen Menschen würden sterben.
											Es gäbe eine weltweite Rezession und Depression,
											weil unser just-in-time Versorgungssystem
											und das enge Gummiband der Globalisierung zerbräche,
											und die Kosten für unsere Wirtschaft von ein bis drei Billionen Dollars
											wären weitaus schlimmer für alle als nur 100 Millionen Tote,
											denn soviel mehr Menschen würden ihre Jobs verlieren
											und ihre Gesundheitsleistungen,
											dass die Konsequenzen davon fast undenkbar sind.
											Und es wird schlimmer, weil das Reisen soviel besser wird.
									",My wish: Help me stop pandemics,Larry Brilliant,25:50,"TED Prize,collaboration,disease,ebola,global issues,health,science,technology"
"
","
","
","
",My wish: Help me stop pandemics,Larry Brilliant,25:50,"TED Prize,collaboration,disease,ebola,global issues,health,science,technology"
