es,pt,tr,fr,de,title,speaker,duration,tags
"
											La posibilidad de diagnosticar universalmente
											usando el genoma
											es posible hoy en día.
											Hoy, ya es posible.
											Y la importancia de esto para todos nosotros
											es que todos los aquí presentes podríamos vivir unos 5, 10 ó 20 años más de vida
											y todo gracias al genoma.
											Es una noticia estupenda,
											a menos que consideremos nuestra huella ecológica sobre el planeta
											y nuestra capacidad para mantener la producción de alimentos.
											Resulta
											que esta misma tecnología
											está siendo usada para crear nuevas variedades
											de maíz, trigo, soja y otros cultivos
											que sean mucho más resistentes a la sequías, a las inundaciones,
											a las plagas y a los pesticidas.
											Ahora bien, mientras siga aumentando la población mundial,
											vamos a tener que seguir desarrollando y comiendo alimentos genéticamente modificados,
											y esa es mi postura hoy día.
											A menos que haya un voluntario en la audiencia
											que se ofrezca a dejar de comer.
											No, no hay ninguno.
									","
											Apresenta-se-nos hoje
a expetativa de usar o genoma
											como um diagnóstico universal.
											Hoje, está aqui.
											Significa para todos nós
											que todos, nesta sala,
podemos viver 5, 10, 20 anos extra
											por causa desta única coisa.
											O que é uma história fantástica,
											a menos que pensemos na pegada
da humanidade sobre o planeta
											e na nossa capacidade de continuar
a produzir alimentos.
											Acontece que está a ser usada
exatamente a mesma tecnologia
											para cultivar novas linhas
											de milho, trigo, soja e outras culturas
											que são altamente resistentes
à seca, às inundações,
											às pestes e aos pesticidas.
											Agora vejam, enquanto continuarmos
a aumentar a população,
											vamos ter que continuar a cultivar e comer
alimentos geneticamente modificados,
											e é a única posição que vou assumir hoje.
											A não ser que haja alguém, no público,
											que queira deixar de comer?
											Ninguém, nem um.
									","
											Gen haritasını
											genel bir teşhis yöntemi olarak kullanacağımız
											günler artık çok yakın.
											Bugün bu aşamadayız.
											Bu aslında buradaki herkesin
											sadece bu gen haritası sayesinde
											5, 10, 20 sene daha uzun yaşayabileceği anlamına gelmektedir.
											Eğer dünya üzerindeki bir insanın hayatı boyunca tükettiklerini ve
											gıda ihtiyacını karşılayabilme kapasitemizi düşünmezseniz
											bu olağan üstü bir gelişmedir.
											Şu da var ki,
											aynı teknoloji
											kuraklığa ve sele, zararlı böceklere ve
											zirai ilaçlara karşı oldukça dayanıklı,
											yeni mısır, buğday, soya fasulyesi ve diğer
											tahıl cinslerini yetiştirmek için de kullanılıyor.
											Bakın, nüfusun artmasını sağladığımızda
											genetiği değiştirilmiş gıdalar yetiştirmek ve yemek zorunda kalacağız
											ve bugün ben bunun destekçilerindenim.
											Bu izleyici grubu içinde
											bundan sonra yemek yememeye gönüllü birileri varsa başka tabii, var mı?
											Yok değil mi? Bir kişi bile yok.
									","
											La perspective d'utiliser la génétique
											comme un diagnostic universel
											est désormais d'actualité.
											C'est déjà là.
											Cela signifie pour chacun de nous
											que, tous ici, nous pourrions vivre 5, 10 ou 20 ans de plus,
											juste grâce à cela.
											C'est une histoire fantastique,
											sauf si on pense à l'empreinte de l'humanité sur la terre
											et à notre capacité à maintenir la production de nourriture.
											Il se trouve
											que la même technologie
											est également utilisée pour créer des espèces
											de maïs, de blé, de soja et d’autres
											hautement résistantes à la sécheresse, aux inondations,
											aux insectes et aux pesticides.
											Écoutez, si on continue à croître en nombre,
											on devra continuer à faire pousser et à manger des OGM,
											c'est la seule position que je vais tenir aujourd'hui.
											A moins qu'il y ait quelqu'un dans la salle
											qui soit volontaire pour arrêter de manger?
											Non, personne.
									","
											Die Chance, das Genom
											als unversale Diagnose zu verwenden,
											liegt heute in unseren Händen.
											Heute ist sie hier.
											Und was das für uns alle bedeutet
											ist, dass alle in diesem Raum 5, 10 oder 20 Jahre länger leben könnten,
											nur wegen dieser einen Sache.
											Dies sind grandiose Aussichten,
											es sei denn, Sie bedenken die durch Menschen verursachte Umweltverschmutzung
											und unsere Fähigkeit, die Nahrungsproduktion aufrechtzuerhalten.
											So stellt es sich heraus,
											dass die genau gleiche Technologie
											auch gebraucht wird, um neue
											Mais-, Soja- und andere Nutzpflanzenarten anzubauen,
											die sehr resistent gegen Dürre, Hochwasser,
											Schädlinge und Pestizide sind.
											Sehen Sie, solange die Erdbevölkerung weiter wächst,
											müssen wir weiterhin genetisch veränderte Lebensmittel anbauen und essen,
											und das ist der einzige Standpunkt, den ich heute einnehme.
											Es sei denn, es gäbe jemanden im Publikum,
											der freiwillig aufhören möchte zu essen.
											Keiner, nicht einer.
									",Welcome to the genomic revolution,Richard Resnick,11:02,"DNA,TEDx,biotech,health care,science,technology,bioethics"
"
","
","
","
","
",Welcome to the genomic revolution,Richard Resnick,11:02,"DNA,TEDx,biotech,health care,science,technology,bioethics"
"
											Esta es una máquina de escribir,
											imprescindible en el escritorio por décadas.
											Pues la máquina de escribir fue eliminada por esto.
											Y después, por las primeras versiones de los procesadores de palabras.
											Pero finalmente, desapareció debido a las tecnologías disruptivas.
											Fue gracias a que Bob Metcalfe inventó Ethernet
											y a las conexiones de todos los equipos
											que todo cambió radicalmente.
											Y de repente tuvimos Netscape, tuvimos Yahoo
											y tuvimos, de hecho, toda la burbuja punto com.
											(Risas)
											Pero no se preocupen,
											que fuimos rescatados por el iPod, por Facebook
											y, por supuesto, por Angry Birds.
											(Risas)
									","
											Esta é uma máquina de escrever,
											uma parte essencial de todas
as secretárias durante décadas.
											A máquina de escrever foi eliminada
essencialmente por esta coisa.
											E depois apareceram versões mais gerais
de processadores de texto.
											Mas por fim, houve rotura sobre rotura.
											Foi a invenção da Ethernet
por Bob Metcalfe
											e a ligação entre todos estes computadores
											que fundamentalmente mudou tudo.
											De repente, tivemos a Netscape
e tivemos o Yahoo.
											E também tivemos
toda a bolha ""dot.com"" inteira.
											(Risos)
											Nada com que nos preocupar,
											isso foi rapidamente salvo
pelo iPod, pelo Facebook
											e, claro, pelos Angry Birds.
											(Risos)
									","
											Bu gördüğünüz bir daktilo.
											Yıllarca her masada yer almış olan demirbaşlardan biri.
											Aslında daktilo, gördüğünüz bu şey yüzünden yerinden oldu.
											Ve daha sonra da kelime işlemcilerinin daha bilinen modelleri ortaya çıktı.
											Ama sonuçta bunların herbiri bir sonrakine birşeyler ekledi.
											Ethernet'i ve bütün bilgisayarları birbirine bağlamayı bularak
											herşeyi temelinden değiştiren kişi
											Bob Metcalfe idi.
											Sonra aniden Netscape geldi, hemen sonra Yahoo
											ve daha sonra da bütün ""noktacom""lar.
											(Gülüşmeler)
											Fazla endişelenmeye gerek kalmadan bunların imdadına
											iPod, Facebook
											ve tabii ki 'Kızgın Kuşlar' yetişti.
											(Gülüşmeler)
									","
											Voici une machine à écrire,
											essentielle au bureau pendant des décennies.
											En fait, la machine à écrire a été remplacée par ça.
											Puis, des versions plus larges des traitements de texte sont apparues.
											Mais finalement, c'était une révolution par-dessus une révolution.
											C'est Bob Metcalfe en inventant l'Ethernet
											et la connexion à tous ces ordinateurs
											qui a fondamentalement tout changé.
											Tout d'un coup, on a eu Netscape, puis Yahoo
											puis, en fait, toute la bulle Internet.
											(Rires)
											Pas de quoi s'inquiéter,
											on a été rapidement sauvé par l'iPod, Facebook
											et, en fait, les Angry Birds.
											(Rires)
									","
											Dies ist eine Schreibmaschine,
											ein unverzichtbares Gerät für jeden Arbeitsplatz während Jahrzehnten.
											Und in der Tat wurde die Schreibmaschine im Wesentlichen durch diese Sache ausgelöscht.
											Und die allgemeinere Version von Textverarbeitung kam auf.
											Aber letztendlich war es ein Verschwinden neben einem Verschwinden.
											Es waren Bob Metcalfes Erfindung des Ethernet
											und die Verbindung all dieser Computer,
											die alles fundamental veränderten.
											Und plötzlich hatten wir Netscape, und wir hatten Yahoo,
											und wir hatten, tatsächlich, die ganze Dotcom-Blase.
											(Lachen)
											Keine Sorge,
											die Situation wurde bald von iPod, Facebook
											und, tatsächlich, verärgerten Vögeln gerettet.
											(Lachen)
									",Welcome to the genomic revolution,Richard Resnick,11:02,"DNA,TEDx,biotech,health care,science,technology,bioethics"
"
","
","
","
","
",Welcome to the genomic revolution,Richard Resnick,11:02,"DNA,TEDx,biotech,health care,science,technology,bioethics"
"
											Este es nuestro estado actual.
											Esta es la revolución genómica hoy día. Así estamos ahora.
											Lo que me gustaría que consideraran es lo siguiente:
											¿Qué significado tiene
											que estos puntos no solo representan las bases individuales de su genoma,
											sino que se conectan con genomas de todos lados del planeta?
											Tuve que comprar un seguro de vida recientemente.
											Y tenía que responder la siguiente pregunta:
											A. Nunca me he hecho un examen genético, B. Me he hecho uno y acá lo tengo,
											y C. Me he hecho uno y prefiero no mostrarlo.
											Afortunadamente, pude contestar A,
											y lo digo con toda honestidad, en caso de que mi asegurador me esté escuchando.
											Pero, ¿Qué hubiese pasado de haber contestado C?
									","
											Isto é onde estamos hoje.
											Esta é a revolução genómica, hoje.
É aqui que estamos.
											Considerem o seguinte:
											O que significa quando estes pontos
											não representarem as bases
individuais do nosso genoma,
											mas se ligarem a genomas
por todo o planeta?
											Recentemente, tive que fazer
um seguro de vida.
											E pediram-me que respondesse:
											A. Nunca fiz um teste genético,
											B. Fiz um (cá vamos nós),
											e C. Fiz um e não estou a dizer.
											Felizmente, pude dar a resposta A,
											e digo-o honestamente, não vá
o meu agente de seguros estar a ouvir.
											Mas o que teria acontecido
se eu tivesse dito C?
									","
											Bakın bu gün biz buradayız.
											Bugün genomik devrimi yaşıyoruz. İşte bugün buradayız.
											Şunu gözardı etmemenizi istiyorum:
											Eğer bu noktalar sadece genomunuzun baz çiftlerini değil de
											bütün gezegendeki genomları birleştiriyorsa
											bu ne anlama gelir?
											Ben geçenlerde hayat sigortası yaptırdım.
											Ve bir yerde şu seçeneklerden birini işaretlemem bekleniyordu:
											A. Hiç genetik test yaptırmadım, B. Yaptırdım ve işte sonuçlar burada
											C. Yaptırdım fakat sizinle sonuçları paylaşmak istemiyorum.
											""A"" seçeneğini işaretleyebildiğim için mutluyum ve
											eğer burada sigorta şirketimden bir mümessil varsa bilsin ki bunu gerçekten samimiyetle söylüyorum.
											Peki ""C"" seçeneğini işaretleseydim ne olurdu?
									","
											Voici où l'on est aujourd'hui.
											Voici la révolution génomique aujourd'hui. Voici où l'on en est.
											J'aimerais que vous réfléchissiez à ceci :
											Qu'est-ce que cela signifierait
											si ces points ne représentaient pas les bases de votre génome,
											mais les connexions à des génomes sur toute la planète?
											Je voulais récemment souscrire une assurance-vie.
											On m'a demandé de répondre :
											A. Je n'ai jamais fait de test génétique. B. J'en ai fait un, le voilà.
											et C. J'en ai fait un, mais je ne le montre pas.
											Heureusement, j'ai pu répondre A,
											je le dis honnêtement au cas où mon agent d'assurance serait en train d'écouter.
											Mais que se serait-il passé si j'avais répondu C?
									","
											Schauen Sie, hier sind wir heute.
											Dies ist die genomische Revolution heute. Dies ist, wo wir sind.
											Was ich Ihnen zu bedenken geben möchte, ist:
											Was bedeutet es,
											wenn diese Punkte nicht die einzelnen Basen von Ihrem Genom darstellen,
											sondern mit Genomen auf der ganzen Welt verbunden sind?
											Erst vor kurzem musste ich eine Lebensversicherung abschliessen.
											Und ich musste zwischen folgenden Antworten wählen:
											A. Ich hatte nie einen genetischen Test, B. Ich hatte einen, und jetzt kommts:
											C. Ich hatte einen, und ich verrate es nicht.
											Zum Glück konnte ich die Antwort A ankreuzen,
											und ich bin ehrlich, falls mein Versicherungsvertreter zuhört.
											Aber was wäre passiert, wenn ich C gesagt hätte?
									",Welcome to the genomic revolution,Richard Resnick,11:02,"DNA,TEDx,biotech,health care,science,technology,bioethics"
"
","
","
","
","
",Welcome to the genomic revolution,Richard Resnick,11:02,"DNA,TEDx,biotech,health care,science,technology,bioethics"
"
											Florecerían las aplicaciones genómicas para el público.
											¿Quieres saber si eres genéticamente compatible
											con tu novia? Hecho.
											¿Secuenciación de ADN en tu iPhone? Ya hay una aplicación para eso.
											(Risas)
											¿Alguien quiere un masaje genómicamente personalizado?
											Ya hay un laboratorio
											que hace exámenes para encontrar el alelo 334 del gen AVPR1,
											el así llamado gen de la infidelidad.
											Así que todo el que esté aquí con su pareja,
											solo tiene que acercarse y tomar una muestra de su boca,
											mandarla al laboratorio y así salir de dudas.
											(Risas)
											¿Uds. elegirían a un presidente
											con un genoma que indique miocardiopatía?
											Imagínense que estamos en el año 2016
											y la candidata favorita no solo lanza
											su propuesta para reducir impuestos en los próximos 4 años
											sino también su genoma personal.
											Es un genoma muy bueno.
											Entonces llega y desafía a sus oponentes a que hagan lo mismo.
											¿Creen que es algo que no va a pasar?
											¿Será que hubiese ayudado a John McCain?
									","
											Vão florescer aplicações
de consumo para a genómica.
											Querem ver se são geneticamente 
compatíveis com a namorada? Claro.
											Sequência do ADN no iPhone?
Há uma aplicação para isso.
											(Risos)
											Alguém quer uma massagem
genómica personalizada?
											Já há hoje um laboratório que faz o teste
do alelo 334 do gene AVPR1
											o chamado gene da infidelidade.
											(Risos)
											Qualquer um que esteja aqui
com a sua cara-metade
											vire-se para ele, passe-lhe
um cotonete pela boca,
											envie-o para o laboratório
e saberá com toda a certeza.
											Vocês querem realmente
eleger um presidente
											cujo genoma sugira cardiomiopatia?
											Pensem nisto, estamos em 2016
											e a principal candidata divulga
											as declarações de impostos
dos últimos quatro anos,
											mas também o seu genoma pessoal.
											Parece realmente bom.
											Então ela desafia os outros candidatos
a fazerem o mesmo.
											Pensam que isso não vai acontecer?
											Pensam que teria ajudado o John McCain?
									","
											Genom bilimine yönelik tüketici uygulamaları anında ortaya çıkmaya başlayacaktı.
											Kız arkadaşınızla genetik olarak uyumlu olup olmadığınızı
											bilmek ister misiniz? Tabii ki.
											iPhone'unuzda DNA diziliminizi görmek ister misiniz? Bunun için bir uygulamamız var.
											(Gülüşmeler)
											Kişiye özel genom masajı isteyen var mı?
											Daha şimdiden, aldatma geni olarak da bilinen
											AVPR1 geninin 334 gen çiftini test eden
											bir laboratuvar var.
											Eğer burada partneri ile birlikte olanlar varsa emin olmak için
											hemen onlara dönün ve bir tükürük numunesi alın,
											sonra da laboratuvara gönderin.
											(Gülüşmeler)
											Gen haritasından kardiyomiyopati olma ihtimali tespit edilen
											bir başkan seçmek ister miydiniz?
											Şimdi bir düşünün. Yıl 2016 ve
											önde giden aday sadece son dört seneye ait
											vergi bilgilerini değil
											aynı zamanda kişisel genom bilgilerini de açıklıyor.
											Ve sonuçlar gerçekten iyi görünüyor.
											Ve kendisi rakiplerini de aynı şeyi yapmaya davet ediyor.
											Olmayacağını mı sanıyorsunuz?
											Bu John McCain'in işine yarar mıydı sizce?
									","
											Les applications commerciales de la génomique vont fleurir.
											Voulez-vous savoir si vous êtes génétiquement compatible
											avec votre copine? Sûrement.
											Le séquencement ADN sur votre iPhone? Il y a une application.
											(Rires)
											Un massage génomique personnalisé?
											Il existe déjà un laboratoire
											qui teste l'allèle 334 du gène AVPR1,
											le gène de l'adultère.
											Quiconque ici présent avec sa moitié,
											peut se tourner vers elle, lui frotter la bouche,
											envoyer le coton-tige au laboratoire et être sûr.
											(Rires)
											Voudriez-vous vraiment élire un président
											dont le génome décèle une cardiomyopathie?
											Pensez-y, nous sommes en 2016
											et la candidate en tête publie
											pas seulement ses réductions d'impôts depuis 4 ans,
											mais aussi son génome personnel.
											Il a l'air vraiment super.
											Et elle défie ses compétiteurs de faire la même chose.
											Que pensez-vous qu'il adviendra?
											Pensez-vous que cela aurait aidé John McCain?
									","
											Verbraucheranwendungen für die Genomik werden florieren.
											Wollen Sie sehen, ob Sie genetisch kompatibel
											mit Ihrer Freundin sind? Sicher.
											DNA-Sequenzierung auf Ihrem iPhone? Es gibt eine App dafür.
											(Lachen)
											Personalisierte genomische Massage gefällig?
											Es gibt bereits heute ein Labor,
											das auf das Allel 334 des AVPR1-Gens prüft,
											das sogenannte Betrüger-Gen.
											Alle, die heute mit ihrer besseren Hälfte hier sind,
											wenden sich einfach zu ihr hin und entnehmen eine Speichelprobe,
											senden diese an ein Labor, und Sie haben Gewissheit.
											(Lachen)
											Wollen Sie wirklich jemandem zum Präsidenten wählen,
											dessen Genome auf Kardiomyopathie hindeuten?
											Stellen Sie sich vor, im Jahr 2016
											veröffentlicht die führende Kandidatin
											nicht nur ihre vier Jahre zurückliegenden Steuereinnahmen,
											sondern auch ihr persönliches Genom.
											Und es schaut wirklich gut aus.
											Und dann fordert sie alle Konkurrenten auf, dasselbe zu tun.
											Glauben Sie, dass das nicht passieren wird?
											Glauben Sie, es hätte John McCain geholfen?
									",Welcome to the genomic revolution,Richard Resnick,11:02,"DNA,TEDx,biotech,health care,science,technology,bioethics"
"
","
","
","
","
",Welcome to the genomic revolution,Richard Resnick,11:02,"DNA,TEDx,biotech,health care,science,technology,bioethics"
"
											(Risas)
									","
											(Risos)
									","
											(Gülüşmeler)
									","
											(Rires)
									","
											(Lachen)
									",Welcome to the genomic revolution,Richard Resnick,11:02,"DNA,TEDx,biotech,health care,science,technology,bioethics"
"
","
","
","
","
",Welcome to the genomic revolution,Richard Resnick,11:02,"DNA,TEDx,biotech,health care,science,technology,bioethics"
