en,es,pt,tr,fr,title,speaker,duration,tags
"
","
","
","
","
",Sugar: Hiding in plain sight,Robert Lustig,3:48,"health,public health,food,animation,TED-Ed,human body,physiology"
"
											Sugar is playing hide and seek with you.
											You'd think it would be pretty easy for you to win,
											considering all the sugar in
											sodas, ice cream, candy, and big white bags labeled sugar.
											People get about half of their added sugars
											from those drinks and treats,
											so it might seem like sugar
											is hiding in plain sight,
											but like someone in the witness protection program,
											the other half is hidden in places you'd least suspect.
											Check the ingredients on ketchup, bologna,
											spaghetti sauce, soy milk, sports drinks,
											fish sticks, and peanut butter.
											You'll find sugar hiding in most of those products.
											In fact, you'll find added sugars
											in three-quarters of the more than 600,000 items
											available in grocery stores.
											But how is sugar hiding?
											Can't you just look on food labels?
											It's not that easy.
											Just like your friend Robert
											might go by Bob, Robby, Rob, Bobby, or Roberto,
											added sugar has a lot of aliases.
											And by a lot, we don't mean five or six,
											try fifty-six.
											There's brown rice syrup, barley malt,
											demerara, Florida Crystals, muscovado,
											and, of course, high fructose corn syrup,
											sometimes called HFCS, or corn sugar.
											Even sugar's tricky nicknames have nicknames.
											Grape or apple concentrate has the same effects on your body
											as its 55 sugary twins.
											And even though organic evaporated cane juice sounds healthy,
											when you evaporate it,
											you get sugar!
											Chemically speaking, it's all the same.
											And even trickier,
											when multiple added types of sugars
											are used in one type of product,
											they get buried down in a long list of ingredients,
											so the sugar content might appear to be okay,
											but when you add them all together,
											sugar can be the single biggest ingredient.
											Currently, the FDA doesn't suggest
											a recommended daily limit for sugar,
											so it's hard to tell if this 65 grams in a bottle of soda
											is a little or a lot.
											But the World Health Organization recommends
											limiting sugar to just 5% of your total calories,
											or about 25 grams per day.
											So, 65 grams is well over twice that amount.
											But just what is sugar?
											What's the difference between glucose and fructose?
											Well, both are carbohydrates
											with the same chemical composition
											of carbon, hydrogen, and oxygen.
											But they have very different structures
											and behave quite differently in our bodies.
											Glucose is the best source of energy
											for nearly all organisms on Earth.
											It can be metabolized by all organs in the body.
											Fructose, on the other hand,
											is metabolized primarily in the liver,
											and when your liver gets overloaded
											with sweet, sweet fructose,
											the excess is metabolized to fat.
											Fresh fruits actually contain fructose,
											but it's naturally occurring
											and doesn't cause an overload
											because the fiber in fruit slows its absorption.
											This gives your liver the time it needs
											to do its job.
											It's sugar that makes cookies chewy
											and candy crunchy.
											It even turns bread crust a beautiful, golden brown.
											It's also a great preservative;
											it doesn't spoil or evaporate,
											so the foods it's added to are easier
											to store and ship long distances
											and tend to be cheaper.
											That's why sugar is hiding everywhere.
											Actually, it might be easier to list the foods
											that added sugar isn't hiding in,
											things like: vegetables, eggs, meats,
											fish, fruit, raw nuts, even your kitchen sink.
											Simply choosing water over soda, juices, and sports drinks
											is a great way to avoid hidden added sugar.
											At the very least,
											try to pay attention to food labels,
											so you can keep your sugar intake at a healthy level.
											Because in this game of hide and seek,
											every time you don't find added sugar,
											you win!
									","
											El azúcar está jugando 
a las escondidas contigo.
											Podrías pensar que es fácil ganar,
											teniendo en cuenta el azúcar
											que hay en refrescos, helados, 
dulces y en las bolsas de azúcar.
											Las personas obtienen la mitad 
de los azúcares añadidos
											de esas bebidas y golosinas,
											por eso podría parecer 
que el azúcar
											está a simple vista,
											pero como si estuviese en 
un programa de protección de testigos,
											la otra mitad se oculta en 
los lugares menos sospechosos.
											Revisa los ingredientes: 
ketchup, mortadela,
											salsa de espagueti, leche de soja, 
bebidas para deportistas,
											palitos de pescado 
y mantequilla de maní.
											Encontrarás azúcar oculta en 
la mayoría de esos productos.
											De hecho, encontrarás 
azúcares añadidos
											en tres cuartas partes 
de los más de 600 000 artículos
											disponibles en las tiendas.
											Pero, ¿cómo se oculta el azúcar?
											¿No se puede mirar 
las etiquetas de los alimentos?
											No es tan fácil.
											Como tu amigo Roberto,
											Beto, Robi, Rob, Betito, o Robert,
											el azúcar añadido tiene muchos alias.
											Y muchos no son 5 o 6,
											son 56.
											Hay jarabe de arroz integral, 
cebada malteada,
											azúcar moreno, azúcar 
de Florida, mascabado,
											y, por supuesto, el jarabe 
de maíz de alta fructosa,
											a veces llamado JMAF 
o azúcar de maíz.
											Incluso los apodos difíciles 
del azúcar tienen apodos.
											El extracto de uva o de manzana tiene 
los mismos efectos en el cuerpo
											que sus 55 gemelos azucarados.
											Y aunque el jugo de caña orgánico 
evaporado suena saludable,
											al evaporarlo,
											¡tienes azúcar!
											Químicamente hablando, 
es todo lo mismo.
											Y aún más difícil,
											cuando múltiples tipos 
de azúcares añadidos
											se usan en un tipo de producto,
											quedan enterradas 
en una larga lista de ingredientes,
											por lo que el contenido de azúcar 
puede parecer bien,
											pero juntándolos a todos,
											el azúcar puede ser 
el ingrediente principal y único.
											Actualmente, la FDA no sugiere
											un límite diario 
recomendado de azúcar,
											por eso es difícil saber si estos 
65 gramos de una botella de refresco
											son poco o mucho.
											Pero la Organización Mundial 
de la Salud recomienda
											limitar el azúcar a solo 
el 5 % del total de calorías,
											o unos 25 gramos por día.
											65 gramos es mucho más 
del doble de esa cantidad.
											Pero, ¿qué es el azúcar?
											¿Cuál es la diferencia entre 
la glucosa y la fructosa?
											Bueno, ambos son hidratos de carbono
											con la misma composición química
											de carbono, hidrógeno y oxígeno.
											Pero tienen estructuras muy diferentes
											y se comportan de manera 
muy diferente en nuestros cuerpos.
											La glucosa es la mejor 
fuente de energía
											para casi todos 
los organismos del planeta.
											Puede ser metabolizada 
por todos los órganos del cuerpo.
											La fructosa, por otra parte,
											se metaboliza principalmente 
en el hígado,
											y cuando el hígado se sobrecarga
											con dulce, dulce fructosa,
											el exceso se metaboliza en grasa.
											Las frutas frescas contienen fructosa,
											pero es de origen natural
											y no provoca sobrecarga
											porque la fibra de la fruta 
ralentiza su absorción.
											Esto le da a tu hígado 
el tiempo que necesita
											para hacer su trabajo.
											El azúcar hace a las galletas fibrosas
											y a los dulces crujientes.
											Incluso le da a la corteza de pan 
un hermoso y dorado marrón.
											Es también un gran conservante;
											no se descompone ni evapora,
											y los alimentos que 
la tienen son fáciles
											de almacenar y enviar 
a grandes distancias
											y tienden a ser más baratos.
											Por eso el azúcar 
se oculta por todos lados.
											En realidad, podría ser más fácil 
enumerar los alimentos
											en los que el azúcar 
añadido no está oculto;
											a saber: vegetales, huevos, carnes,
											pescado, frutas, frutos secos, 
incluso el lavaplatos de la cocina.
											Elegir agua en vez de refresco, 
jugos y bebidas deportivas
											es una gran forma de evitar 
el azúcar añadido oculto.
											Por lo menos,
											trata de prestar atención a las etiquetas
											para mantener el consumo 
de azúcar en un nivel saludable.
											Porque en este juego de las escondidas,
											cada vez que no encuentras 
el azúcar añadido,
											¡ganas!
									","
											O açúcar brinca às escondidas connosco.
											Podíamos pensar
que seria fácil ganhar-lhe,
											considerando todo o açúcar que há
											nos refrigerantes, nos gelados, nos doces
e nos pacotes com a etiqueta ""açúcar"".
											Consumimos metade 
dos açúcares adicionados
											nessas bebidas e coisas doces,
											por isso pode parecer que o açúcar
está escondido à vista desarmada.
											Mas, tal como no programa
de proteção de testemunhas,
											a outra metade está escondida
em locais onde menos esperamos.
											Verifiquem os ingredientws
no ""ketchup"", na bolonhesa,
											no molho do esparguete, no leite de soja,
nas bebidas desportivas,
											nos palitos de peixe,
na manteiga de amendoim.
											Encontramos açúcar escondido
na maior parte destes produtos.
											Na verdade, encontramos
açúcares adicionados
											em três quartos de mais
dos 600 000 produtos
											disponíveis nas mercearias.
											Como é que se esconde o açúcar?
											Não basta ler os rótulos dos alimentos?
											Não é assim tão fácil.
											Tal como o nosso amigo Robert
											pode ser conhecido por Bob,
Robby, Rob, Bobby ou Roberto,
											o açúcar adicionado
tem muitos pseudónimos.
											E quando dizemos muitos,
não estamos a dizer cinco ou seis,
											mas cinquenta e seis!
											Há o xarope de arroz integral,
o malte de cevada,
											o demerara, os cristais da Flórida,
o mascavado,
											e, claro, o xarope de milho
rico em frutose,
											por vezes chamado açúcar de milho.
											Até as alcunhas astuciosas do açúcar
têm alcunhas.
											O concentrado de uva ou de maçã
tem os mesmos efeitos no nosso corpo
											que os seus 55 gémeos açucarados.
											Embora o sumo de cana orgânico
evaporado pareça saudável,
											se o evaporamos,
obtemos açúcar!
											Quimicamente falando, 
é tudo a mesma coisa.
											Mais enganador ainda,
											quando se usam múltiplos
tipos de açúcares adicionados
											num só produto,
											eles ficam soterrados
numa longa lista de ingredientes.
											Assim, o conteúdo em açúcar
parece satisfatório
											mas quando os adicionamos a todos,
											o açúcar pode ser o maior ingrediente.
											Atualmente, a FDA não sugere
											um limite diário
recomendado para o açúcar,
											por isso é difícil dizer se os 65 gramas
numa garrafa de refrigerante
											é pouco ou é muito.
											Mas a Organização Mundial
de Saúde recomenda
											que se limite o açúcar
a 5% das calorias totais
											ou seja, cerca de 25 gramas por dia.
											Portanto, 65 gramas é muito mais
do dobro dessa quantidade.
											Mas, afinal, o que é o açúcar?
											Qual é a diferença
entre a glucose e a frutose?
											Ambas são carboidratos
											com a mesma composição química
											de carbono, hidrogénio e oxigénio.
											Mas têm estruturas muito diferentes
											e comportam-se de modo
muito diferente no nosso corpo.
											A glucose é a melhor fonte de energia
											para quase todos os organismos na Terra.
											Pode ser metabolizada
por quase todos os órgãos do corpo.
											A frutose, por outro lado,
											é metabolizada principalmente pelo fígado.
											Quando o fígado fica sobrecarregado
											com frutose muito doce,
											o excesso é metabolizado em gordura.
											Os frutos frescos contêm frutose,
											mas são produtos naturais
											e isso não provoca sobrecarga
											porque as fibras dos frutos
retardam a sua absorção.
											Isso dá ao fígado o tempo necessário
para fazer o seu trabalho.
											É o açúcar que torna os biscoitos macios
											e os doces estaladiços.
											Até transforma a côdea do pão
num belo castanho dourado.
											Também é um ótimo preservativo;
											não se estraga, nem se evapora.
											Assim, os alimentos a que se adicionam
											são mais fáceis de guardar 
e de enviar a longas distâncias
											e saem mais baratos.
											É por isso que o açúcar
se esconde por todo o lado.
											Na verdade, seria mais fácil
listar os alimentos
											em que não há açúcar adicionado escondido,
											coisas como: vegetais, ovos, carnes,
											peixe, fruta, frutos secos, 
até o nosso lava-loiças.
											Optar por água em vez de refrigerantes,
de sumos e de bebidas desportivas
											é uma boa forma de evitar
o açúcar adicionado escondido.
											No mínimo,
											prestem atenção aos rótulos dos alimentos,
											para poderem manter o consumo de açúcar
a um nível saudável.
											Porque, neste jogo das escondidas,
											sempre que não encontrarmos
açúcar adicionado,
											ganhamos!
									","
											Şeker sizinle saklambaç oynuyor.
											Gazozları, dondurmayı, şekerlemeyi ve üstünde
											şekerf ibaresi olan büyük beyaz paketleri
											düşününce, oyunu kazanmanın kolay olduğunu düşünebilirsiniz.
											İnsanlar, ilave şekerlerin yarısını bu içeceklerden
											ve abur cuburdan alıyor,
											o nedenle şeker yalnızca
											görünürde saklanıyormuş gibi gelebilir,
											fakat şahit koruma programındaki kişi gibi,
											diğer yarısı en az şüpheleneceğiniz yerlerde saklanıyor.
											Ketçapın, sosisin, makarna sosunun, soya sütünün,
											spor içeceklerin, parmak balıkların ve yer fıstığı ezmesinin
											içeriklerini bir kontrol edin.
											Bu ürünlerin çoğunda gizlenmis şeker bulacaksınız.
											Hatta, marketlerdeki
											600,000 ürünün dörtte üçünde ilave şeker
											bulabilirsiniz.
											Peki şeker nasıl gizleniyor?
											Ürünlerin etiketine bakmak yetmez mi?
											O kadar kolay değil.
											Aynı arkadaşınız Robert'a
											Bob, Robby, Bobby veya Roberto diye seslenebileceğiniz gibi
											ilave şekerin de bir sürü takma ismi vardır.
											Çok derken, 5 ya da 6 taneden bahsetmiyoruz,
											56 tane desek.
											Kahverengi pirinç şurubu, arpa maltı,
											demerara, Florida Kristalleri, muscovado (kahverengi şeker),
											ve tabii ki yüksek fruktozlu mısır şurubu var,
											bazen HFCS veya mısır şurubu olarak da adlandırılır.
											Şekerin aldatıcı takma adlarının bile takma adları var.
											Üzüm veya elma konsantrasyonu da, 55 şeker ikizi gibi
											vücudunuzda benzer etkiye sahiptir.
											Buharlaştırılmış organik şeker kamışı suyu kulağa sağlıklı da gelse
											siz onu buharlaştırdığınızda,
											şeker elde edersiniz!
											Kimyasalligi olarak degerlendirdigimizde, hepsi aynı.
											Daha da aldatıcı tarafı,
											bir üründe çeşitli ilave şekerler
											kullanıldığı zaman,
											ürünün uzun içindekiler listesinde kaybolurlar,
											böylece şeker içeriği sorun değilmiş gibi görünebilir,
											ama hepsini biraraya koydugunuzda
											şeker başlı başına en büyük içerik olabilir.
											şu anda, FDA (Gida ve ilac kurulu), günlük tavsiye edilen
											şeker tüketimine dair bir limit vermiyor,
											bu nedenle bir şişe gazozun içindeki 65 gram şekerin
											az mı çok mu olduğunu söylemek zor.
											Ama Dünya Sağlık Örgütü günlük şeker tüketim
											limitinin, toplan kalorinizin %5'i ya da toplamda
											25 gram olması gerektiğini söylüyor.
											Yani 65 gram bu değerin iki katından fazla.
											Peki, şeker nedir?
											Glikozla fruktoz arasında fark nedir?
											İkisi de karbonhidrattır
											ve karbon, hidrojen ve oksijenden oluşan
											aynı kimyasal bileşime sahiptir.
											Ama ikisi de farklı yapıya sahiptir
											ve vücudumuzda çok farklı etki gösterirler.
											Glikoz, yeryüzündeki nerdeyse tüm canlılar için
											en iyi enerji kaynağıdır.
											Vücuttaki tüm organlar tarafından metabolize edilebilir.
											Diğer yandan fruktoz,
											başlıca karaciğer tarafından metabolize edilir
											ve karaciğeriniz bu tatlı, tatlı fruktozla
											aşırı yüklendiğinde,
											fazlalıklar yağa çevrilir.
											Taze meyveler de aslında fruktoz içerir,
											fakat dogaldirlar,
											ve meyvede bulunan fiberin hazmı yavaşlatması
											sayesinde aşırı yüklenmeye sebep olmazlar.
											Bu da karaciğerinize, işini yapması için gereken
											zamanı verir.
											Kurabiyeleri sert, şekerlemeleri kıtır
											yapan şey şekerdir.
											Ekmek kabuğuna bile güzel rengini veren şekerdir.
											Aynı zamanda harika bir koruyucudur;
											çürümez veya buharlaşmaz,
											böylece eklendiği yiyecekler, daha kolay
											saklanır, uzun yolculuklara dayanır
											ve daha ucuz olmaya yatkındır.
											İşte bu nedenle şeker her yerde gizleniyor.
											Aslında, ilave şekerin konmadigi yiyeceklerin
											listesini yapmak çok daha kolay:
											Bunlar sebzeler, yumurtalar, etler,
											balık, meyve, çiğ fındık, evyeniz bile.
											Basitçe gazoz ve spor içecekleri yerine su tercih etmek
											gizli ilave şekerden kaçınmak için harika bir yoldur.
											En azından,
											yiyecek etiketlerine dikkat etmeyi deneyin,
											böylece şeker alımınızı sağlıklı bir düzeyde tutabilirsiniz.
											Çünkü bu saklambaç oyununda,
											her ilave şeker görmeyişinizde,
											siz kazanırsınız!
									","
											Le sucre joue à cache-cache avec vous.
											Vous pensez qu'il vous serait 
assez facile de gagner,
											compte tenu de tout le sucre 
dans les sodas, les glaces,
											les bonbons, et de grands sacs blancs 
avec une étiquette <i>sucre</i>.
											Les gens absorbent environ la moitié 
de leurs sucres ajoutés
											dans ces boissons et friandises,
											il peut donc sembler que le sucre
											se cache à la vue de tous,
											mais comme quelqu'un dans 
le programme de protection des témoins,
											l'autre moitié se cache dans 
les endroits qu'on soupçonne le moins.
											Vérifiez les ingrédients 
sur le ketchup, la sauce bolognaise,
											la sauce spaghetti, le lait de soja, 
les boissons pour sportifs,
											les bâtonnets de poisson, 
et le beurre de cacahuète.
											Vous trouverez que le sucre se cache
dans la plupart de ces produits.
											En fait, vous trouverez 
des sucres ajoutés
											dans les trois quarts 
des plus de 600 000 articles
											disponibles dans les épiceries.
											Mais comment le sucre se cache-t-il ?
											Ne peut-on pas se contenter de regarder
sur les étiquettes des aliments ?
											Ce n'est pas si facile.
											Tout comme on pourrait appeler
votre ami Robert
											Bob, Robby, Rob, Bobby, ou Roberto,
											le sucre a beaucoup d'alias.
											Et beaucoup, ce n'est pas cinq ou six,
											plutôt cinquante-six.
											Il y a le sirop de riz brun, 
de malt d'orge,
											le demerara, les cristaux de Floride, 
le muscovado,
											et, bien sûr, le sirop de maïs 
riche en fructose,
											parfois appelé HFCS, 
ou sucre de maïs.
											Même les surnoms astucieux du sucre
ont des surnoms.
											le concentré de pomme ou de raisin
a le même effet sur votre corps
											que ses 55 jumeaux sucrés.
											Et même si le jus de canne évaporé 
semble sain sous un tel nom,
											lorsque vous l'évaporez,
											vous obtenez du sucre !
											Du point de vue chimique, 
c'est la même chose.
											Et encore plus astucieux,
											lorsque de multiples types 
de sucres ajoutés
											sont utilisés dans un type de produit,
											ils sont enterrés dans 
une longue liste d'ingrédients,
											de sorte que la teneur en sucre 
pourrait sembler acceptable.
											mais lorsque vous les additionnez tous,
											le sucre peut être l'ingrédient
le plus important.
											Actuellement, la FDA ne suggère pas
											une limite quotidienne 
recommandée pour le sucre,
											il est donc difficile de dire si ces 
65 grammes dans une bouteille de soda
											sont un peu ou beaucoup.
											Mais l'Organisation Mondiale
de la Santé recommande
											de limiter le sucre à seulement
5% de vos calories totales,
											ou environ 25 grammes par jour.
											Donc, 65 grammes, c'est 
plus de deux fois cette quantité.
											Mais au fait, qu'est-ce que le sucre ?
											Quelle est la différence 
entre le glucose et le fructose ?
											Eh bien, les deux sont 
des hydrates de carbone
											avec la même composition chimique
											de carbone, d'hydrogène et d'oxygène.
											Mais ils ont des structures 
très différentes
											et se comportent très 
différemment dans notre corps.
											Le glucose est la meilleure 
source d'énergie
											pour presque tous 
les organismes sur la Terre.
											Il peut être métabolisé par 
l'ensemble des organes du corps.
											Le fructose, par contre,
											est métabolisé 
principalement dans le foie,
											et quand votre foie est surchargé
											de doux fructose,
											l'excès est métabolisé en graisse.
											Les fruits frais contiennent 
en fait du fructose,
											mais il est d'origine naturelle
											et ne provoque pas de surcharge
											parce que la fibre dans les fruits 
ralentit son absorption.
											Cela donne à votre foie 
le temps qu'il faut
											pour faire son travail.
											C'est le sucre qui rend 
les biscuits moelleux
											et les bonbons croquants.
											Il donne même à la croûte du pain
une belle couleur dorée.
											C'est aussi un excellent 
agent de conservation ;
											il ne se gâte pas, ne s'évapore pas,
											les aliments auxquels on l'ajoute 
sont donc plus faciles
											à stocker et expédier 
sur de longues distances
											et ont tendance à être moins cher.
											C'est pourquoi le sucre se cache partout.
											En fait, il serait peut-être plus facile
de dresser la liste des aliments
											où le sucre ajouté ne se cache pas,
											des choses comme : les légumes, 
les oeufs, les viandes, les poissons,
											les fruits, les noix brutes, 
même votre évier de cuisine.
											Il suffit de choisir l'eau plutôt que
le soda, les jus de fruits,
											et les boissons pour sportifs
pour éviter le sucre ajouté caché.
											À tout le moins,
											essayez de faire attention 
aux étiquettes des aliments,
											pour pouvoir maintenir votre 
consommation de sucre à un niveau sain.
											Parce que dans ce jeu de cache-cache,
											chaque fois que vous ne trouvez pas 
de sucre ajouté,
											vous gagnez !
									",Sugar: Hiding in plain sight,Robert Lustig,3:48,"health,public health,food,animation,TED-Ed,human body,physiology"
"
","
","
","
","
",Sugar: Hiding in plain sight,Robert Lustig,3:48,"health,public health,food,animation,TED-Ed,human body,physiology"
