en,tr,fr,es,pt,title,speaker,duration,tags
"
","
","
","
","
",Why do we itch?,Emma Bryce,4:29,"health,psychology,public health,human body,animals,TED-Ed,animation,health care,healthcare,biology,physiology,science,evolution"
"
											You're standing at 
the ready inside the goal
											when suddenly, you feel an intense itch
on the back of your head.
											We've all experienced the annoyance 
of an inconvenient itch,
											but have you ever pondered why
we itch in the first place?
											The average person experiences
dozens of individual itches each day.
											They can be triggered by all sorts
of things,
											including allergic reactions,
											dryness,
											and even some diseases.
											And then there are the mysterious ones
that pop up for no reason at all,
											or just from talking about itching.
											You're scratching your head right now,
aren't you?
											Anyhow, let's take one of the most
common sources: bug bites.
											When a mosquito bites you,
											it releases a compound into your body
called an anticoagulant
											that prevents your blood from clotting.
											That compound, 
which we're mildly allergic to,
											triggers the release of histamine,
											a chemical that makes 
our capillaries swell.
											This enables increased blood flow,
											which helpfully accelerates 
the body's immune response
											to this perceived threat.
											That explains the swelling,
											and it's the same reason pollen
can make your eyes puff up.
											Histamine also activates the nerves
involved in itching,
											which is why bug bites make you scratch.
											But the itchy sensation itself
isn't yet fully understood.
											In fact, much of what we do know
											comes from studying 
the mechanics of itching in mice.
											Researchers have discovered that
itch signals in their skin
											are transmitted via a subclass of
the nerves that are associated with pain.
											These dedicated nerves produce a molecule
called natriuretic polypetide B,
											which triggers a signal that's carried
up the spinal cord to the brain,
											where it creates the feeling of an itch.
											When we scratch, the action of our
fingernails on the skin
											causes a low level pain signal
that overrides the itching sensation.
											It's almost like a distraction,
which creates the sensation of relief.
											But is there actually an evolutionary
purpose to the itch,
											or is it simply there to annoy us?
											The leading theory is that our skin
has evolved to be acutely aware of touch
											so that we're equipped to deal with risks
from the outside world.
											Think about it.
											Our automatic scratching response
would dislodge anything harmful
											that's potentially lurking on our skin,
											like a harmful sting,
											a biting insect,
											or the tendrils of a poisonous plant.
											This might explain why we don't
feel itching inside our bodies,
											like in our intestines,
											which is safe from these external threats,
											though imagine how 
maddening that would be.
											In some people, glitches in the pathways
responsible for all of this
											can cause excessive itching
that can actually harm their health.
											One extreme example is a psychological
condition called delusory parasitosis
											where people believe their bodies
are infested with mites or fleas
											scurrying over and under their skin,
											making them itch incessantly.
											Another phenomenon 
called phantom itching
											can occur in patients 
who've had amputations.
											Because this injury has 
so severely damaged the nervous system,
											it confuses the body's normal 
nerve signaling
											and creates sensations in limbs
that are no longer there.
											Doctors are now finding ways
to treat these itching anomalies.
											In amputees, mirrors are used to reflect
the remaining limb,
											which the patient scratches.
											That creates an illusion 
that tricks the brain
											into thinking the imaginary 
itch has been satisfied.
											Oddly enough, that actually works.
											Researchers are also searching
for the genes involved in itching
											and developing treatments to try
and block the pathway of an itch
											in extreme cases.
											If having an unscratchable itch
feels like your own personal hell,
											Dante agreed.
											The Italian poet wrote about
a section of hell
											where people were punished by being
left in pits to itch for all eternity.
									","
											Hedefin tam durduğu
yerde bekliyorsun ki
											kafanın arkasına aniden 
yoğun bir kaşıntı hissi geliyor.
											Zamansız bir kaşıntının verdiği
rahatsızlığı hepimiz yaşamışızdır,
											peki hiç neden kaşındığımıza
kafa yordunuz mu?
											Ortalama bir insan her gün
düzinelerce kaşıntıya maruz kalır.
											Kaşıntı pek çok sebepten kaynaklanabilir;
											alerjik reaksiyonlar,
											kuruluk
											ve hatta hastalıklar dâhil.
											Bir de hiçbir neden yokken
oluşan ya da sadece bahsi açılınca
											ortaya çıkan gizemli kaşıntılar var.
											Şu anda kafanı kaşıyorsun, değil mi?
											Neyse, şimdi en yaygın nedenlerden
birini ele alalım: Böcek ısırıkları.
											Bir sinek seni ısırdığında,
											kanın pıhtılaşmasını engelleyen
bir bileşim olan
											antikoagülanı vücuduna salgılar.
											Hepimizin hafif alerjik olduğu o bileşen,
											kılcal damarlarımızı şişiren 
bir kimyevi olan
											histaminin salgılanmasını tetikler.
											Bu, algılanan tehditle
											vücudun bağışıklık tepkisinin
hızlanmasını sağlayan
											hızlanmış kan akışına olanak sağlar.
											Bu şişmeyi açıklar
											ve polenin gözleri şişirmesiyle de
aynı nedendir.
											Histamin ayrıca kaşınmada
rol oynayan sinirleri harekete geçirir
											ki bu böcek ısırıkları 
kaşınmasını açıklar.
											Yine de bu kaşıntı hissi tamamem
anlaşılamamıştır.
											Hatta, bildiğimiz çoğu şey
											farenin kaşıntı mekanizmasının
araştırılmasından gelmektedir.
											Araştırmacılar, derilerindeki 
kaşıntı sinyallerinin
											acı ile ilişkili alt-sınıf sinirler
aracılığıyla iletildiğini keşfetmiştir.
											Bu söz konusu sinirler, 
omurilikten beyne uzanan,
											kaşıntı hissinin tetiklendiği
											natriüretik polipeptid B molekülü üretir.
											Kaşıdığımızda, tırnaklarımızın
cildimizde yaptığı hareket
											kaşınma hissini bastıran düşük 
seviyeli bir acı sinyaline neden olur.
											Rahatlama hissini yaratan
bir oyalama gibidir bu.
											Yani, kaşıntının altında gerçekten de 
evrimsel bir amaç mı yatıyor,
											yoksa sadece bizi sinir etmek için mi var?
											Başlıca teori, derimizin, bizi dış 
dünyadaki tehlikelerden korumak için
											temastan hemen haberdar olacak
hâle ulaşmış olmasıdır.
											Biraz düşünün.
											Otomatik kaşıntı tepkimiz
cildimizde gizlenen zararlı
											herhangi bir şeyi kovabilir;
											mesela zararlı bir sokma,
											ısıran bir böcek
											ya da zehirli bir bitkinin filizleri gibi.
											Bu dışarıdaki tehditlerden güvende olan
											vücutlarımızın içinde, örneğin
bağırsaklarda,
											neden kaşıntı hissetmediğimizi 
açıklayabilir;
											yine de nasıl delirtici
bir şey olabileceğini hayal edin.
											Bazı insanlar için, 
sinir yollarındaki aksaklıklar,
											sağlıklarına zarar verebilecek aşırı 
bir kaşıntıya sebep olabilir.
											Bir uç örnek, insanların
vücutlarının mayt veya pirelerle
											dolu olduklarını, derilerinin üstünde 
ve altında gezdiklerini sandıkları,
											aralıksız olarak kaşınmalarına neden olan
											delüzyonel parazitoz adında
psikolojik bir durumdur.
											Hayali kaşıntı adı verilen
diğer bir olay da
											ampütasyon geçirmiş
hastalarda meydana gelmektedir.
											Çünkü bu yaralanma, sinir sistemine
o kadar ağır bir zarar verir ki
											vücudun normal sinir 
sinyallerini karıştırır
											ve artık orada olmayan 
uzuvlarda hisler yaratır.
											Doktorlar, artık bu kaşıntı
bozuklukları için tedavi yolları buluyor.
											Hastalara, geride kalan uzvu kaşırken
											bir ayna yansıtılır.
											Bu da beyinde hayali kaşıntının
											giderildiğine dair bir yanılsama yaratır.
											İşin tuhafı, bu gerçekten de işe yarar.
											Araştırmacılar ayrıca kaşınmayla
ilgili genleri araştırıyor
											ve aşırı vakalarda görülen,
kaşıntının yolunu kesecek
											tedaviler geliştiriyorlar.
											Eğer geçmeyen bir kaşıntı
şahsi cehenneminiz gibi hissettiriyorsa,
											bilin ki Dante de sizinle aynı fikirde.
											İtalyan şair, insanların sonsuza kadar
kaşınacakları çukurlarda
											cezalandırıldıkları cehennemin 
bir bölümü hakkında yazmıştı.
									","
											Vous êtes là, debout, dans les buts,
											quand soudain, ça vous démange
vivement derrière la tête.
											Nous connaissons tous cette gêne
due à une démangeaison,
											mais vous êtes-vous déjà demandé
pourquoi ça nous gratte ?
											Chaque personne ressent des dizaines
de démangeaisons chaque jour.
											Il existe de nombreux déclencheurs,
											comme les réactions allergiques,
											la sécheresse
											et même certaines maladies.
											Et puis il y a
les démangeaisons mystérieuses
											qui surviennent sans aucune raison,
											ou juste parce qu'on en parle.
											Vous vous grattez la tête là, non ?
											Mais bon, parlons de la raison
la plus courante : la piqûre d'insecte.
											Quand un moustique vous pique,
											il envoie dans votre corps
un produit appelé anticoagulant
											qui empêche votre sang de coaguler.
											Ce produit, auquel nous sommes 
légèrement allergiques,
											déclenche la libération d'histamine,
											un produit chimique qui fait gonfler
nos capillaires.
											Ceci augmente le flux sanguin,
											ce qui va aider à accélérer
											la réponse immunitaire de notre corps
											qui perçoit la menace.
											Voilà pourquoi ça enfle
											et c'est la même chose pour le pollen
qui irrite les yeux.
											L'histamine active aussi les nerfs
concernés par la démangeaison,
											c'est pourquoi les piqures d'insectes
vous font vous gratter.
											Mais on a encore du mal à comprendre
la sensation de démangeaison.
											En fait, l'essentiel de ce que nous savons
											vient d'études faites sur les souris,
sur le mécanisme de la démangeaison.
											Les chercheurs ont découvert
											que les signaux de démangeaison
sur leur peau
											sont transmis via une sous-classe
de nerfs liés à la douleur.
											Ces mêmes nerfs produisent une molécule
appelée le polypeptide natriurétique B,
											qui envoie un signal via la moelle
épinière jusqu'au cerveau
											où sera créée la sensation
de démangeaison.
											Quand on se gratte, l'action
de nos doigts sur la peau
											provoque un signal peu douloureux
qui annihile la sensation de démangeaison.
											C'est comme une diversion, qui provoque
une sensation de soulagement.
											Mais les démangeaisons sont-elles liées
à un principe d'évolution
											ou existent-elles juste
pour nous ennuyer ?
											La théorie qui prévaut est que notre peau
est devenue hypersensible au toucher
											afin de nous permettre de résister
aux attaques du monde extérieur.
											Pensez-y.
											Se gratter est une réponse automatique
pour supprimer tout danger
											qui rôde potentiellement sur notre peau,
											comme une morsure toxique,
											une piqure d'insecte,
											ou les vrilles d'une plante vénéneuse.
											Cela pourrait expliquer pourquoi
ça ne nous démange pas
											à l'intérieur de notre corps,
											comme dans nos intestins,
											qui est à l'abri de ces menaces
extérieures.
											Cela pourrait nous rendre fou sinon.
											Chez certains, des problèmes de santé
responsables de tout cela
											peuvent provoquer
des démangeaisons extrêmes
											pouvant être dangereuses pour la santé.
											Un des pires cas est une maladie
psychologique, la parasitose illusoire,
											où les gens pensent que leur corps
est infecté de mites ou de mouches
											grouillant sur et sous leur peau,
											ce qui les fait se gratter sans cesse.
											Un autre phénomène,
les démangeaisons fantômes,
											apparaît chez des patients
ayant subi une amputation.
											La blessure ayant sévèrement
endommagé le système nerveux,
											les signaux des cellules sont brouillés
											et créent des sensations dans des membres 
qui ne sont plus là.
											Les docteurs ont trouvé des solutions
pour soigner ces démangeaisons anormales.
											Chez les amputés, on utilise des miroirs
pour réfléchir le membre restant
											que gratte le patient.
											Cela crée une illusion leurrant
le cerveau
											en lui faisant croire que l'on a gratté
au bon endroit.
											Bizarrement, cela fonctionne.
											Des chercheurs s'intéressent aussi
aux gènes concernés par les démangeaisons
											et développent des traitements
pour essayer de stopper
											la sensation de démangeaison
dans des cas extrêmes.
											Si vous pensez que de ne pouvoir
se gratter où ça démange est un enfer,
											Dante le pense aussi.
											Le poète italien a parlé
d'une section de l'enfer
											où les gens sont mis dans des fosses
et condamnés à se gratter pour l'éternité.
									","
											Está de pie ante la portaría
											cuando de repente sientes 
un picor intenso detrás de la cabeza.
											Todos hemos experimentado 
la molestia de un picor inconveniente,
											pero ¿alguna vez has reflexionado sobre 
por qué sentimos picor?
											La persona promedio experimenta 
docenas de picores individuales cada día.
											Pueden ser activados 
por todo tipo de cosas,
											incluyendo reacciones alérgicas,
											sequedad,
											e incluso algunas enfermedades.
											Y luego están los picores misteriosos 
que aparecen sin causa en absoluto,
											o simplemente si se habla de picores.
											Te estás rascando 
la cabeza en este momento, ¿no?
											Veamos una de las fuentes 
más comunes: las picaduras de insectos.
											Cuando un mosquito te pica,
											libera un compuesto en su cuerpo 
llamado anticoagulante
											que evita que la sangre se coagule.
											Ese compuesto, 
al que somos ligeramente alérgicos,
											desencadena la liberación de histamina,
											una sustancia química que hace 
que nuestros capilares se hinchen.
											Esto permite un mayor flujo sanguíneo,
											que acelera útilmente 
la respuesta inmune del cuerpo
											a la amenaza percibida.
											Eso explica la hinchazón,
											y por la misma razón el polen 
puede hacer que se te hinchen los ojos.
											La histamina también activa 
los nervios implicados en el picor,
											que es el porqué hace rascarte 
en las picaduras de insecto.
											Pero la sensación de picor en sí 
todavía no se entiende completamente.
											De hecho, gran parte de lo que sabemos
											viene de estudiar la mecánica 
del picor en ratones.
											Los investigadores han descubierto 
que las señales de picor de la piel
											se transmiten a través de una subclase 
de los nervios asociados con el dolor.
											Estos nervios producen una molécula 
llamada polipéptido natriurético B,
											que desencadena una señal 
que va hasta la médula espinal al cerebro,
											donde crea la sensación de picor.
											Cuando nos rascamos, 
la acción de nuestras uñas en la piel
											causa una señal de dolor de bajo nivel 
que anula la sensación del picor.
											Es casi como una distracción, 
que crea la sensación de alivio.
											Pero ¿existe realmente un propósito 
evolutivo para el picor,
											o existe simplemente para molestarnos?
											La teoría principal es que 
nuestra piel ha evolucionado
											para ser agudamente consciente al tacto.
											Por eso estamos equipados 
para enfrentarnos a los riesgos del mundo.
											Piénsalo.
											Nuestra respuesta de rascado automática 
desalojaría cualquier cosa perjudicial
											que esté potencialmente 
al acecho sobre nuestra piel,
											como una picadura perjudicial,
											un insecto mordiente,
											o los zarcillos de una planta venenosa.
											Esto podría explicar por qué no sentimos 
picor dentro de nuestros cuerpos,
											como en nuestros intestinos,
											que están a salvo 
de estas amenazas externas,
											aunque imagina lo enloquecedor que sería.
											En algunas personas, los fallos 
en las vías responsables de todo esto
											puede causar picor excesivo 
que incluso puede dañar su salud.
											Un ejemplo extremo es una condición 
psicológica llamada parásitos ilusorios
											donde la gente cree que sus cuerpos 
están infestados de ácaros o pulgas
											corriendo sobre y bajo la piel,
											teniendo picor incesantemente.
											Otro fenómeno llamado picor fantasma
											puede ocurrir en pacientes 
que han tenido amputaciones.
											Debido a que esta lesión ha dañado 
gravemente el sistema nervioso,
											confunde la señalización 
nerviosa normal del cuerpo
											y crea sensaciones 
en los miembros que ya no están allí.
											Los médicos están encontrando maneras 
de tratar estas anomalías de picazón.
											En amputados, los espejos se utilizan 
para reflejar el resto del miembro,
											que le pica al paciente.
											Eso crea una ilusión que engaña el cerebro
											en el pensamiento 
el rascar imaginario se ha satisfecho.
											Curiosamente, eso realmente funciona.
											Los investigadores también están 
buscando los genes implicados en el picor
											y están desarrollando tratamientos 
para bloquear el camino de una picazón
											en casos extremos.
											Si tener un picor inmanejable parece 
algo propio de un infierno personal,
											Dante estuvo de acuerdo.
											El poeta italiano escribió 
sobre una sección del infierno
											donde a la gente se le aplicó el castigo 
de sentir picor por toda la eternidad.
									","
											Estamos em frente da baliza,
na expetativa,
											quando, de repente, sentimos
uma intensa comichão na nuca.
											Todos já experimentámos o incómodo
duma comichão inconveniente,
											— mas já pensaram porque é
que temos comichões?
											Uma pessoa vulgar sente dezenas
de comichões todos os dias.
											Podem ser provocadas
por todo o tipo de coisas,
											incluindo reações alérgicas,
											secura,
											e até algumas doenças.
											Depois, há as misteriosas
que aparecem sem qualquer razão
											ou só por estarmos a falar de comichões.
											Estão a coçar a cabeça,
neste momento, não estão?
											Adiante, vamos olhar para
uma das razões mais comuns:
											mordidelas de insetos.
											Quando um mosquito nos morde,
											liberta um composto no nosso corpo,
chamado anticoagulante,
											que impede que o sangue coagule.
											Esse composto, a que somos
ligeiramente alérgicos,
											provoca a libertação de histamina,
											um produto químico
que faz inchar os vasos capilares.
											Isso aumenta o fluxo sanguíneo,
											o que acelera favoravelmente
a reação imunitária do corpo
											àquela ameaça pressentida.
											Isso explica o inchaço
											e é a mesma razão por que o pólen
pode fazer-nos inchar os olhos.
											A histamina também ativa os nervos
envolvidos na comichão
											e é por isso que as mordidelas
dos insetos nos obrigam a coçarmo-nos.
											Mas ainda não compreendemos bem
a sensação de comichão.
											Na verdade, muito do que sabemos
											provém do estudo dos mecanismos
da comichão em ratos.
											Os investigadores descobriram
que os sinais de comichão na pele deles
											se transmitem através duma subclasse
dos nervos associados com a dor.
											Estes nervos produzem uma molécula
chamada polipéptido natriurético B,
											que desencadeia um sinal que é transmitido
pela espinal medula até ao cérebro,
											onde cria a sensação de comichão.
											Quando nos coçamos,
a ação das unhas na pele
											provoca um sinal de dor de baixo nível
que suplanta a sensação da comichão.
											É quase como uma distração
que cria a sensação de alívio.
											Mas haverá um objetivo evolutivo
na comichão
											ou existe apenas para nos incomodar?
											A principal teoria
é que a nossa pele evoluiu
											para ser extremamente sensível ao toque
											de modo a podermos lidar
com os riscos do mundo exterior.
											Pensem nisso.
											A nossa reação automática de nos coçarmos
afastaria qualquer coisa prejudicial
											que possivelmente estaria
escondida na pele,
											como um ferrão prejudicial,
											um inseto parasita
											ou as gavinhas duma planta venenosa.
											Isso pode explicar porque
não sentimos comichão dentro do corpo,
											como nos intestinos,
											que estão a salvo
dessas ameaças exteriores.
											Mas imaginem como isso
seria de enlouquecer.
											Nalgumas pessoas, as falhas
nas vias responsáveis por tudo isto
											podem causar uma comichão excessiva
que pode prejudicar a saúde.
											Um exemplo extremo
											é uma situação psicológica
chamada delírio de parasitose
											em que as pessoas creem que têm o corpo
infestado de insetos ou pulgas,
											e não param de arranhar a pele,
											fazendo com que ela arda sem cessar.
											Outro fenómeno
chamado comichão fantasma
											pode ocorrer em doentes
que sofreram amputações.
											Como essa situação danificou
gravemente o sistema nervosa,
											este confunde a sinalização normal
dos nervos do corpo
											e cria sensações em membros
que já não existem.
											Os médicos estão a encontrar formas
de tratar estas anomalias de comichões.
											Nos amputados, usam-se espelhos
para refletir o membro restante
											que o doente coça.
											Isso cria uma ilusão que engana o cérebro
											fazendo-o crer que a comichão
imaginária está a ser eliminada.
											Por incrível que pareça,
funciona mesmo.
											Os investigadores também estão a procurar
os genes que envolvem a comichão
											e a desenvolver tratamentos
para bloquear o caminho de uma comichão
											em casos extremos.
											Se acham que seria um inferno pessoal
ter uma comichão impossível de coçar,

											Dante concorda convosco.
											O poeta italiano escreveu
sobre uma secção do inferno
											onde as pessoas são castigadas
a ficar em poços,
											cheios de comichão,
por toda a eternidade.
									",Why do we itch?,Emma Bryce,4:29,"health,psychology,public health,human body,animals,TED-Ed,animation,health care,healthcare,biology,physiology,science,evolution"
"
","
","
","
","
",Why do we itch?,Emma Bryce,4:29,"health,psychology,public health,human body,animals,TED-Ed,animation,health care,healthcare,biology,physiology,science,evolution"
