en,fr,pt,tr,de,title,speaker,duration,tags
"
											In the killer whale’s environment,
											every new calf is another mouth to feed
											on limited, shared resources.
											An older female can further her genes
without burdening her family
											by supporting her adult sons,
											who sire calves other families will raise.
											This might be why the females have evolved
											to stop reproducing entirely 
in middle age.
									","
											Dans l'environnement des orques,
											chaque nouveau baleineau
est une autre bouche à nourrir
											avec des ressources limitées et partagées.
											Une femelle plus âgée peut promouvoir
ses gènes sans accabler sa famille
											en supportant ses fils adultes,
											qui engendrent des baleineaux
qui seront élevés par d'autres familles.
											Cela pourrait être la raison
pour laquelle les femelles ont évolué
											pour arrêter de se reproduire
complètement dans l'âge mûr.
									","
											No ambiente das orcas,
											cada nova cria é mais uma boca a alimentar
											com recursos limitados, escassos.
											Uma fêmea mais velha pode 
transmitir os seus genes
											sem sobrecarregar a família
											sustentando os filhos adultos,
											que produzem as crias
que outras famílias criarão.
											Pode ser esta a razão
por que as fêmeas evoluíram
											para deixarem de se reproduzir
na meia idade.
									","
											Katil balina çevresinde
											her yeni yavru sınırlı, 
bölüşülen kaynaklarla
											yeni bir can beslemektir.
											Yaşlı dişi ailesine yük olmadan 
genlerini yetişkin oğullarını
											destekleyerek geçirebilir,
											bu oğullar diğer ailelerin
yetiştireceği yavrulara baba olur.
											Bu, dişilerin orta yaşta 
tamamen üremeyi durdurmak üzere
											evrim geçirmelerinin nedeni olabilir.
									","
											In der Welt eines Schwertwals
ist jedes Kalb ein weiterer Esser,
											der die begrenzten,
gemeinsamen Mittel beansprucht.
											Um die Familie nicht zu belasten,
verbreiten ältere Weibchen ihre Gene,
											indem sie für ihre
erwachsenen Söhne sorgen,
											deren Junge von anderen Familien
großgezogen werden.
											Das könnte der Grund sein,
											warum sich Weibchen mittleren Alters
nicht mehr fortpflanzen.
									",Inside the killer whale matriarchy,Darren Croft,4:49,"TED-Ed,oceans,climate change,nature,water,animals,animation,natural resources"
"
","
","
","
","
",Inside the killer whale matriarchy,Darren Croft,4:49,"TED-Ed,oceans,climate change,nature,water,animals,animation,natural resources"
"
											Even with the grandmothers’ contributions,
											the Southern Resident killer whales 
are critically endangered,
											largely due to a decline in salmon.
											We urgently need to invest in restoring 
salmon populations
											to save them from extinction.
											In the long term, we’ll need more studies 
like the Center for Whale Research’s.
											What we’ve learned about 
the Southern Residents
											may not hold true for other groups.
											By studying other populations closely,
											we might uncover more 
startling adaptations,
											and anticipate their vulnerabilities 
to human interference
											before their survival is at risk.
									","
											Même avec les contributions
des grand-mères,
											les orques résidentes du sud
sont menacées d'extinction
											surtout à cause
d'une diminution du saumon.
											Il faut s'investir d'urgence pour rétablir
les populations de saumon
											pour les sauver de l'extinction.
											Sur le long terme, on aura besoin d'autres
études comme le Center for Whale Research.
											Ce que nous avons appris
sur les résidentes du sud
											pourrait ne pas être valable
pour d'autres groupes.
											En étudiant de près d'autres populations,
											on pourrait découvrir d'autres
adaptations surprenantes
											et anticiper leurs vulnérabilités
à l'interférence humaine
											avant que leur survie soit en danger.
									","
											Apesar das contribuições das avós,
											as orcas residentes do sul
estão fortemente ameaçadas,
											em parte devido à diminuição dos salmões.
											Precisamos urgentemente de investir
na reposição das populações de salmões
											para as salvar da extinção.
											A longo prazo, precisamos de mais estudos
											como os do Centro
para a Investigação das Baleias.
											O que aprendemos com as residentes do sul
											pode não se verificar com outros grupos.
											Ao estudar outras populações
aprofundadamente,
											podemos descobrir
mais adaptações surpreendentes
											e prever as suas vulnerabilidades
perante a interferência humana,
											antes de a sobrevivência delas
correr perigo.
									","
											Büyükannelerin katkıları olsa bile
											Güney Sakinleri katil balinaların 
çoğunlukla somon düşüşünden
											dolayı türleri tehlike altındadır.
											Onları yok oluştan kurtarmak 
için somon popülasyonlarını
											eski hâline getirmek üzere
acilen yatırım yapmalıyız.
											Uzun vadede Balina Araştırma Merkezi 

											gibi çalışmalara
daha çok ihtiyacımız olacak.
											Güney Sakinleri hakkında öğrendiklerimiz
											diğer gruplar için geçerli olmayabilir.
											Diğer popülasyonları yakından gözleyerek
											daha fazla şaşırtıcı 
adaptasyonlar keşfedebiliriz
											ve yaşamları risk altına girmeden 
önce insan müdahalesine
											hassaslıklarını tahmin edebiliriz.
									","
											Selbst mit Unterstützung der Großmütter
											sind die südlichen Ortstreuen
stark gefährdet,
											vor allem wegen der Abnahme
der Lachsbestände.
											Wir müssen dringend
für gesunde Lachsbestände sorgen,
											um die Wale vor dem Aussterben zu retten.
											Langfristig benötigen wir weitere Studien
wie die des Zentrums für Walforschung.
											Unsere Erkenntnisse
über die südlichen Ortstreuen
											müssen nicht für andere Gruppen gelten.
											Durch die genaue Erforschung
anderer Populationen
											könnten wir weitere
verblüffende Anpassungen entdecken
											und ihre Beeinträchtigung
durch menschliche Einflüsse erkennen,
											bevor ihr Überleben auf dem Spiel steht.
									",Inside the killer whale matriarchy,Darren Croft,4:49,"TED-Ed,oceans,climate change,nature,water,animals,animation,natural resources"
"
","
","
","
","
",Inside the killer whale matriarchy,Darren Croft,4:49,"TED-Ed,oceans,climate change,nature,water,animals,animation,natural resources"
