en,es,tr,fr,de,title,speaker,duration,tags
"
											On a larger scale, this is a mash-up
											of the data which was released about the Afghan elections.
											It allows you to set your own criteria
											for what sort of things you want to look at.
											The red circles are polling stations,
											selected by your criteria.
											And then you can select also other things on the map
											to see what other factors, like the threat level.
											So, that was government data.
									","
											A mayor escala, este es un 'mash-up'
											de los datos publicados sobre las elecciones afganas.
											Te permite definir criterios propios
											para la clase de cosas que te interese examinar.
											Los círculos rojos son centros de votación
											seleccionados por tus criterios.
											Y luego uno puede seleccionar otras cosas en el mapa
											para ver otros factores como el nivel de amenaza.
											Esos eran datos del gobierno.
									","
											Büyük skalada ise bu Afganistan Seçimleriyle
											ilgili olarak yayınlanan bir veri karışımıdır.
											Bakmak istediğiniz şeylerle ilgili
											kendi kriterlerinizi oturtmanıza izin verir.
											Kırmızı yuvarlaklar seçim istasyonları,
											kriterinize göre seçin.
											Daha sonra haritada, örneğin tehdit seviyesi gibi
											faktörlerden de seçim yapıp kıyaslayabilirsiniz.
											Yani, bu hükümet verisiydi.
									","
											A une plus grand échelle, voici un mash-up
											des données publiées au sujet des élections afghanes.
											Ça vous permet de choisir vos propres critères
											sur le genre de choses que vous voulez regarder.
											Les cercles en rouge sont des centres de vote,
											sélectionnés selon vos critères.
											Et ensuite vous pouvez sélectionner également d'autres choses sur la carte
											pour voir d'autres facteurs comme le niveau de menace.
											Donc, ça c'était pour les données gouvernementales.
									","
											Wenn man das etwas ausweitet, ist dies ein Mash-Up
											der Daten welche über die Afghanischen Wahlen veröffentlicht wurden.
											Man kann seine eigenen Kriterien anwenden,
											je nach dem was man sich ansehen will.
											Die roten Kreise sind Wahlbüros,
											ausgewählt nach Ihren Kriterien.
											Und dann kann man auch noch andere Dinge auf der Karte auswählen,
											um zu sehen welche anderen Faktoren es gibt - wie etwa das Gefahrenlevel.
											Das waren also Regierungsinformationen.
									",The year open data went worldwide,Tim Berners-Lee,5:33,"Internet,computers,statistics,visualizations,web"
"
","
","
","
","
",The year open data went worldwide,Tim Berners-Lee,5:33,"Internet,computers,statistics,visualizations,web"
"
											I also talked about community-generated data — in fact I edited some.
											This is the wiki map, this is the Open Street Map.
											""Terrace Theater"" I actually put
											on the map because it wasn't on the map before TED last year.
											I was not the only person editing the open street map.
											Each flash on this visualization —
											put together by ITO World —
											shows an edit in 2009
											made to the Open Street Map.
											Let's now spin the world during the same year.
											Every flash is an edit. Somebody somewhere
											looking at the Open Street Map, and realizing it could be better.
											You can see Europe is ablaze with updates.
											Some places, perhaps not as much as they should be.
									","
											También hablé de datos comunitarios, de hecho yo editaba,
											este es el mapa wiki, el mapa abierto de calles
											El Teatro Terrace, de hecho lo puse
											en el mapa porque no estaba antes de las TED del año pasado.
											No era el único que edita los mapas libres.
											Cada destello de esta visualización
											elaborado por ITO World
											muestra una edición de 2009
											realizada en el mapa abierto de calles.
											Veamos ahora al mundo durante ese mismo año.
											Cada destello es una edición. Alguien que
											mira el mapa abierto y se da cuenta que podría mejorarse.
											Pueden ver que Europa está llena de actualizaciones.
											En algunos lugares, quizá no tantas como debería haber.
									","
											Ayrıca toplum tarafından oluşturulan—aslında düzelttim de—
											wiki haritasından bahsettim, bu açık sokak haritası.
											Terrace Theater, özellikle haritaya
											ekledim çünkü geçen sene TED de konuştuğumda haritada yoktu.
											Bu açık sokak haritasını düzelten sadece ben değildim.
											Bu görselde ITO dünya tarafından
											konulan her bir flash
											2009'da açık sokak haritasına
											yapılmış bir düzeltmeyi gösteriyor.
											Şimdi aynı sene içinde dünyayı bir döndürelim.
											Her bir flash bir düzeltme. Birileri bir yerden bakmış
											ve açık sokak haritasının daha iyi olabileceğini farketmiş.
											Avrupanın güncellemelerle yanıp durduğunu görebilirsiniz.
											Bazı yerler de olması gereken kadar çok değil.
									","
											J'ai aussi parlé des données générées par les communautés — en fait j'ai coupé la vidéo —
											voici la carte wiki, c'est la carte libre d'OpenStreetMap
											Le Terrace Theater, en fait je l'ai mis
											sur le plan parce qu'il n'y était pas avant le TED de l'an dernier.
											Je n'étais pas le seul à modifier la carte libre d'OpenStreetMap
											Chaque flash sur cette visualisation
											assemblée par ITO World
											montre une modification apportée en 2009
											sur la carte libre d'OpenStreetMap.
											Faisons maintenant tourner le globe au cours de la même année.
											Chaque flash est une mise à jour. Quelqu'un quelque part
											en train de regarder le plan d'OpenStreetMap, et de réaliser qu'on pourrait l'améliorer.
											Vous voyez que l'Europe est embrasée de mises à jour.
											D'autres endroits, peut-être pas autant qu'ils le devraient.
									","
											Ich habe auch über community-generierte Daten geredet — ich habe sogar welche bearbeitet.
											Dies ist die Wiki-Karte, dies ist die Open Street Karte.
											""Terrace Theater""? Eigentlich habe ich das
											auf die Karte gepackt, weil es vor TED im letzten Jahr nicht darauf war.
											Ich war nicht die einzige Person, welche die Open Street Karte bearbeitet hat.
											Jeder Blitz auf dieser Visualisierung —
											zusammengestellt von ITO World —
											zeigt eine Bearbeitung im Jahr 2009,
											die auf der Open Street Karte gemacht wurde.
											Lassen Sie uns nun die Welt im gleichen Jahr drehen.
											Jeder Blitz zeigt eine Bearbeitung. Irgendjemand irgendwo,
											der die Open Street Karte anguckt und merkt, dass sie besser sein könnte.
											Man sieht das Europa lichterloh mit Bearbeitungen überzogen ist.
											Manche Orte vielleicht nicht so viel wie sie sein sollten.
									",The year open data went worldwide,Tim Berners-Lee,5:33,"Internet,computers,statistics,visualizations,web"
"
","
","
","
","
",The year open data went worldwide,Tim Berners-Lee,5:33,"Internet,computers,statistics,visualizations,web"
"
											Here focusing in on Haiti.
											The map of Port au-Prince at the end
											of 2009 was not all it could be,
											not as good as the map of California.
											Fortunately, just after the earthquake,
											GeoEye, a commercial company,
											released satellite imagery
											with a license, which allowed
											the open-source community to use it.
											This is January, in time lapse,
											of people editing ... that's the earthquake.
											After the earthquake, immediately,
											people all over the world, mappers
											who wanted to help, and could,
											looked at that imagery, built the map, quickly building it up.
									","
											Y aquí, enfocándonos en Haiti
											El mapa de Puerto Príncipe a finales
											de 2009 no era todo lo que podría ser
											no tan bueno como el mapa de California.
											Por suerte, luego del terremoto
											GeoEye, una compañía comercial,
											lanzó imágenes satelitales
											con una licencia que le permite
											su uso a la comunidad de código abierto.
											Este es el período de enero
											personas editando, ese es el terremoto
											Inmediatamente después del terremoto
											la gente de todo el mundo, los cartógrafos,
											que querían y podían ayudar
											miraron las imágenes, construyeron el mapa rápidamente.
									","
											Burada Haiti'ye odaklanalım.
											Au-Prince limanının 2009 haritası
											olabileceği harita gibi değil,
											yani California haritası gibi değil.
											Şansımıza, depremden sonra,
											GeoEye, bir reklam şirketidir,
											uydu görüntülerini yayınladı
											ve toplumun kullanımına açacak
											şekilde de lisanslamasını yaptı.
											Bu Ocak ayı dönemi,
											insanlar düzeltiyorlar, işte deprem.
											Depremden hemen sonrası
											dünyanın her yerinden insanlar, haritacılar
											yardımcı olmak isteyip yardım edebilenler
											bu görüntüye bakarak, hemen haritayı kurgulayıp oturttular.
									","
											Zoomons ici sur Haïti.
											La carte de Port-au-Prince à la fin
											de 2009 n'était pas complète,
											pas aussi bonne que celle de la Californie.
											Heureusement, juste après le tremblement de terre,
											GeoEye, une entreprise commerciale,
											a sorti des images satellite
											avec une licence qui permettait
											à la communauté open-source de les utiliser.
											Voici la durée du mois de janvier,
											les gens font des modifications, voilà le tremblement de terre.
											Après le tremblement de terre, immédiatement,
											des gens partout dans le monde, des mappers
											qui voulaient aider, et le pouvaient,
											ont regardé ces images, construit la carte, qui se développe rapidement.
									","
											Um hier mal auf Haiti zu fokussieren.
											Die Karte von Port au-Prince am Ende
											von 2009 war nicht so gut wie sie hätte sein können,
											nicht so gut wie die Karte von Kalifornien.
											Glücklicherweise, gerade nach dem Erdbeben,
											veröffentlichte GeoEye, eine kommerzielle Firma,
											Satellitenaufnahmen
											mit einer Lizens, welche der
											Open-Source Community erlaubte, sie zu benutzen.
											Dies ist der Januar im Bearbeitungszeitraffer
											... das ist das Erdbeben.
											Direkt nach dem Erdbeben
											guckten Leute überall auf der Welt, Kartographen,
											die helfen wollten und konnten
											auf diese Aufnahmen, bearbeiteten die Karte und bauten sie schnell auf.
									",The year open data went worldwide,Tim Berners-Lee,5:33,"Internet,computers,statistics,visualizations,web"
"
","
","
","
","
",The year open data went worldwide,Tim Berners-Lee,5:33,"Internet,computers,statistics,visualizations,web"
"
											We're focusing now on Port-au-Prince.
											The light blue is refugee camps these volunteers had spotted from the [satellite images].
											So, now we have, immediately, a real-time map
											showing where there are refugee camps —
											rapidly became the best map
											to use if you're doing relief work in Port-au-Prince.
											Witness the fact that it's here on this Garmin device
											being used by rescue team in Haiti.
									","
											Ahora estamos sobre Puerto Príncipe.
											En azul los campos de refugiados que los voluntarios observaron desde el aire.
											Así que ahora tenemos de inmediato un mapa en tiempo real
											indicando dónde están los campos de refugiados
											pronto se volvió el mejor mapa
											para usar en trabajos de socorro en Puerto Príncipe.
											Vean que está ahí en ese aparato Garmín
											siendo usado por un equipo de rescate.
									","
											Şimdi au-Prince limanına bakıyoruz.
											Maviler sığınma kampları, gönüllü kişiler havadan tespit etmişler.
											Şimdi, anında elimize geçen bir eş zamanlı harita var.
											bu sığınma kamplarının yerlerini gösteriyor,
											ve eğer au-Prince limanında kurtarma işi
											için elinizde mükemmel bir harita olmuş oluyor.
											İşte Gramin aleti içine yerleştirimiş ve kurtarma
											ekibi tarafından kullanıldığını görüyorsunuz.
									","
											Nous nous centrons à présent sur Port-au-Prince.
											La couleur bleue indique les camps de réfugiés que ces bénévoles avaient repérés depuis le ciel.
											Donc, maintenant nous avons, immédiatement, une carte en temps réel
											qui montre où il y a des camps de réfugiés,
											et qui rapidement est devenue la meilleure carte
											à utiliser si vous faites un travail de secours à Port-au-Prince.
											Vous êtes témoins du fait qu'elle est là, sur l'appareil Garmin
											utilisé par une équipe de secours.
									","
											Wir fokussieren uns jetzt auf Port au-Prince.
											Das Hellblaue sind Flüchtlingslager, welche die Freiwilligen von den [Satellitenaufnahmen] gesehen hatten.
											Jetzt haben wir direkt eine Echtzeit-Karte,
											welche zeigt wo Flüchtlingslager sind
											und schnell wurde es die beste Karte,
											die man benutzen konnte, wenn man Notstandsarbeit in Port au-Prince machte.
											Bemerken Sie, dass sie hier auf diesem Garmin Positionierungsgerät verfügbar ist,
											welches von Rettungsteams vor Ort benutzt wird.
									",The year open data went worldwide,Tim Berners-Lee,5:33,"Internet,computers,statistics,visualizations,web"
"
","
","
","
","
",The year open data went worldwide,Tim Berners-Lee,5:33,"Internet,computers,statistics,visualizations,web"
"
											There's the map showing,
											on the left-hand side,
											that hospital — actually that's a hospital ship.
											This is a real-time map that shows blocked roads,
											damaged buildings, refugee camps —
											it shows things that are needed [for rescue and relief work].
									","
											Y Haití... ahí está el mapa que muestra
											a la izquierda,
											el hospital, en realidad es un buque hospital.
											Es un mapa en tiempo real que muestra caminos bloqueados
											edificios dañados, campos de refugiados.
											Muestra las cosas que se necesitan.
									","
											Haiti'de sol tarafı gösteren
											bu haritaya bir göz atın,
											bu hastane aslında bir hastane gemisi.
											Bu kapalı yolları gösteren eş zamanlı harita
											hasarlı binalar, sığınma kampları.
											İhtiyaç duyulan şeyleri gösteriyor.
									","
											Et pour Haïti, voici la carte qui montre
											sur le côté gauche là,
											cet hôpital, en fait c'est un navire-hôpital.
											Voici une carte en temps réel qui montre les routes bloquées
											les bâtiments endommagés, les camps de réfugiés.
											Elle montre des choses dont on a besoin.
									","
											Hier zeigt die Karte
											auf der linken Seite
											ein Krankenhaus — in Wirklichkeit ist das ein Krankenhausschiff.
											Dies ist eine Echtzeit-Karte, welche blockierte Straßen zeigt,
											beschädigte Gebäude und Flüchtlingslager.
											Es zeigt Dinge die für Rettungs- und Notstandsarbeiten gebraucht werden.
									",The year open data went worldwide,Tim Berners-Lee,5:33,"Internet,computers,statistics,visualizations,web"
"
","
","
","
","
",The year open data went worldwide,Tim Berners-Lee,5:33,"Internet,computers,statistics,visualizations,web"
"
											So, if you've been involved in that at all,
											I just wanted to say: Whatever you've been doing,
											whether you've just been chanting, ""Raw data now!""
											or you've been putting government or scientific data online,
											I just wanted to take this opportunity to say: Thank you very much,
											and we have only just started!
											(Applause)
									","
											Así que si han estado involucrados en ésto
											sólo quería decirles, sea cual fuere la tarea realizada,
											ya sea que hayan estado graficando datos primarios
											o subiendo datos gubernamentales o científicos
											sólo quería aprovechar esta oportunidad para agradecerles mucho
											y recién hemos comenzado.
											(Aplausos)
									","
											Eğer bu işe bir şekilde müdahilseniz,
											şunu söylemek isterim ki, ne yapıyor olursanız olun,
											işlenmemiş veri olarak neyi çizelgeye ekliyor olursanız olun,
											veya hükümet veya bilimsel datalarınızı açıyor olun,
											size teşekkür etme fırsatını buldum demektir,
											ve henüz yeni başlıyoruz.
											(alkışlar)
									","
											Alors, si vous avez participé à ça de près ou de loin,
											je voulais juste dire que quoi que vous ayez fait,
											que vous ayez juste mis en forme des données brutes,
											ou que vous ayez mis en ligne des données gouvernementales ou scientifiques,
											je voulais profiter de cette occasion pour vous dire un grand merci,
											et ce n'est pour nous que le début.
											(Applaudissements)
									","
											Wenn Sie also in all dem involviert waren,
											ich will einfach nur sagen: Was auch immer Sie gemacht haben,
											egal ob Sie einfach nur ""Rohe Daten jetzt!"" gerufen haben
											oder Sie Regierungs- oder wissenschaftliche Daten online gestellt haben,
											wollte ich diese Gelegenheit einfach nutzen um Danke zu sagen
											und wir haben gerade erst angefangen!
											(Applaus)
									",The year open data went worldwide,Tim Berners-Lee,5:33,"Internet,computers,statistics,visualizations,web"
"
","
","
","
","
",The year open data went worldwide,Tim Berners-Lee,5:33,"Internet,computers,statistics,visualizations,web"
