en,es,tr,fr,de,title,speaker,duration,tags
"
											HC: So we had been creating
											all of these dishes out of a
											kitchen that was more like
											a mechanic's shop than a kitchen, and
											the next logical step for us was to install
											a state-of-the-art laboratory,
											and that's what we have here.
											So we put this in the basement, and we
											got really serious about food, like
											serious experimentation.
											BR: One of the really cool things about
											the lab, besides that we have a new
											science lab in the kitchen, is that,
											you know, with this new equipment, and
											this new approach, all these
											different doors to creativity that we never
											knew were there began to open, and so the
											experiments and the food and the dishes
											that we created, they just kept going
											further and further out there.
									","
											HC: Hemos creado
											todos estos platos en
											una cocina más parecida
											a un taller mecánico que a una cocina
											El siguiente paso fue instalar
											un laboratorio de vanguardia
											y eso es lo que tenemos aquí.
											Pusimos esto en el sótano,
											nos tomamos muy en serio la comida,
											experimentamos en serio.
											BR: Una de las cosas apasionantes
											del laboratorio, aparte de tener
											un laboratorio en la cocina, es que
											con este nuevo equipo,
											con este nuevo enfoque, empezaron
											a abrirse distintas fuentes de creatividad
											que no sabíamos que existían, y entonces
											los experimentos, la comida, los platos
											que creamos, siguieron
											multiplicándose por ahí.
									","
											HC: Bütün bu yemekleri
											bir mutfaktan çok tamirci
											dükkanına benzeyen bir mutfakta
											oluşturuyorduk ve bizim için
											bir sonraki mantıklı adım en son teknoloji
											ürünü bir laboratuvar kurmaktı,
											ve işte sahip olduğumuz şey burada.
											Bunu bodruma koyduk ve yemek
											hakkında gerçekten ciddileştik,
											ciddi deneyler falan yaptık.
											BR: Laboratuvara dair harika şeylerden
											biri, mutfakta yeni bir bilim laboratuvarımız
											olmasının yanısıra, bilirsiniz, bu yeni
											teçhizatla, ve bu yeni yaklaşımla
											varolduğunu hiç bilmediğimiz
											yaratıcılığa açılan bu çeşitli kapılar açılmaya
											başladı, ve böylece yarattığımız deneyler
											ve yiyecekler ve yemekler giderek daha
											öteye gitmeye
											başladı.
									","
											HC : Donc, on avait créé
											tous ces plats dans
											une cuisine qui ressemblait plus à
											un atelier de mécanicien qu'à une cuisine, et
											l'étape suivante logique pour nous était d'installer
											le nec plus ultra du laboratoire,
											et c'est ce que nous avons ici.
											Nous avons donc mis cela dans la cave, et nous
											sommes devenus vraiment sérieux au sujet de la nourriture,
											et avons fait des expérimentations sérieuses.
											BR : L'une des choses vraiment cool à propos
											du laboratoire, outre le fait que nous avons un nouveau
											laboratoire de science dans la cuisine, c'est que,
											avec ce nouvel équipement, et
											cette nouvelle approche, toutes ces
											différentes portes vers la créativité dont nous
											ignorions l'existence, ont commencé à s'ouvrir, et donc
											les expériences et la nourriture et les plats
											que nous avons créés sont juste allés
											de plus en plus loin.
									","
											HC: Wir haben also all diese Gerichte
											in einer Küche erschaffen,
											die eher eine Werkstatt
											als eine Küche ist, und
											der nächste logische Schritt war für uns
											die Installation eines hochmodernes Labors,
											und das haben wir hier.
											Wir haben das also in den Keller gestellt,
											und das mit dem Essen wurde richtig ernst,
											also richtige Experimente.
											BR: Eine der richtig coolen Sachen im Labor,
											abgesehen davon, dass wir ein neues
											wissenschaftliches Labor in der Küche haben,
											ist, dass sich mit diesen neuen Geräten und
											dieser neuen Herangehensweise all die
											verschiedenen Türen zur Kreativität, die wir bislang
											nicht kannten, zu öffnen begannen, und so
											die Experimente und das Essen und die Gerichte,
											die wir erschufen, immer weiter
											und darüber hinaus führten.
									",Cooking as alchemy,Homaro Cantu + Ben Roche,9:34,"agriculture,business,creativity,culture,food"
"
","
","
","
","
",Cooking as alchemy,Homaro Cantu + Ben Roche,9:34,"agriculture,business,creativity,culture,food"
"
											HC: Let's talk about flavor transformation,
											and let's actually make some cool stuff.
											You see a cow with its tongue hanging out.
											What I see is a cow about to eat something
											delicious. What is that cow eating?
											And why is it delicious?
											So the cow, basically, eats three basic
											things in their feed: corn, beets, and barley,
											and so what I do is I actually
											challenge my staff with these crazy,
											wild ideas. Can we take what the cow
											eats, remove the cow, and then make
											some hamburgers out of that?
											And basically the reaction tends to be
											kind of like this. (Laughter)
											BR: Yeah, that's our chef de cuisine,
											Chris Jones. This is not the only guy
											that just flips out when we assign
											a ridiculous task, but a lot of these ideas,
											they're hard to understand.
											They're hard to just get automatically.
									","
											HC: Hablemos de la transformación de sabores
											y hagamos algo realmente interesante.
											Allí ven una vaca con la lengua fuera.
											Yo veo una vaca a punto de comer algo
											delicioso. ¿Qué come esa vaca?
											¿Por qué es delicioso?
											Básicamente, la vaca come tres cosas
											en su alimentación: maíz, remolacha y cebada,
											por eso yo desafío
											a mi personal con estas ideas locas.
											¿Podemos extraer lo que come la vaca
											quitar la vaca, y hacer con eso
											algunas hamburguesas?
											La reacción suele ser
											como ésta. (Risas)
											BR: Sí, ese es nuestro jefe de cocina,
											Chris Jones. No es el único tipo
											que se vuelve loco si le asignamos
											una tarea ridícula. Muchas de estas ideas
											son difíciles de entender.
											Son difíciles de automatizar.
									","
											HC: Lezzet dönüşümünden bahsedelim,
											ve biraz gerçekten harika şeyler yapalım.
											Dili dışarı sarkmış bir inek görüyorsunuz.
											Benim gördüğüm lezzetli birşey yemek üzere
											olan bir inek. O inek ne yiyiyor?
											Ve o neden lezzetli?
											İnek, esasında, üç temel şey yer:
											mısır, pancar ve arpa,
											ve benim yaptığım şey de
											personelime bu çılgın, uçuk fikirlerle
											meydan okumak. İneğin yediğini alıp,
											ineği çıkartıp, ve sonra ondan
											hamburger yapabilir miyiz?
											Ve temel olarak tepki genellikle
											şöyle birşey oluyor. (Kahkahalar)
											BR: Evet, o şef aşçımız, Chris Jones.
											O çılgınca bir görev verdiğimizde
											kelimenin tam anlamıyla zıvanadan çıkan
											tek adam değil, ama bu fikirlerin birçoğu
											anlaşılması güç.
											Otomatik olarak anlamak zor.
									","
											HC : Parlons de la transformation du goût,
											et nous allons réellement faire des trucs cool.
											Vous voyez une vache avec sa langue pendante.
											Ce que je vois c'est une vache sur le point de manger quelque chose
											de délicieux. Qu'est-ce que cette vache mange?
											Et pourquoi est-ce délicieux?
											La vache, en gros, mange trois choses de base
											dans son alimentation : du maïs, des betteraves, et de l'orge,
											et donc ce que je fais, c'est qu'en fait
											je défie mon personnel avec ces idées folles,
											insensées. Pouvons-nous prendre ce que la vache
											mange, retirer la vache, et ensuite en faire
											des hamburgers?
											Et dans le fond la réaction tend à
											ressembler à ça. (Rires)
											BR : Oui, c'est notre chef de cuisine,
											Chris Jones. Ce n'est pas le seul gars
											qui flippe quand nous assignons
											une tâche ridicule, mais beaucoup de ces idées,
											sont difficiles à comprendre.
											Elles sont dures à comprendre automatiquement.
									","
											HC: Lassen Sie uns über die Geschmacksverwandlung sprechen,
											und lassen Sie uns noch mehr coole Sachen machen.
											Sie sehen eine Kuh mit heraushängender Zunge.
											Was ich sehe, ist eine Kuh, die gleich etwas köstliches
											essen wird. Was isst diese Kuh?
											Und wieso ist es köstlich?
											Nun die Kuh, grundsätzlich, isst drei wesentliche
											Dinge in ihrem Futter: Getreide, Rüben und Gerste,
											und was ich nun mache, ist,
											meine Angestellten mit diesen verrückten,
											wilden Ideen herauszufordern. Können wir das nehmen,
											was die Kuh isst, die Kuh entfernen, und dann
											daraus Hamburger machen?
											Und hauptsächlich tendiert die Reaktion
											in eine Richtung wie diese. (Gelächter)
											BR: Ja, das ist unser Küchenchef,
											Chris Jones. Er ist nicht der einzige,
											der ausflippt, wenn wir ihm
											eine absurde Aufgabe übertragen, aber viele dieser Ideen
											sind schwer zu verstehen.
											Es ist schwierig, sie automatisch zu verstehen.
									",Cooking as alchemy,Homaro Cantu + Ben Roche,9:34,"agriculture,business,creativity,culture,food"
"
","
","
","
","
",Cooking as alchemy,Homaro Cantu + Ben Roche,9:34,"agriculture,business,creativity,culture,food"
"
											There's a lot of research and a lot of
											failure, trial and error — I guess, more error —
											that goes into each and every dish,
											so we don't always get it right, and it takes
											a while for us to be able to explain that
											to people.
											HC: So, after about a day of Chris and I
											staring at each other, we came up with
											something that was pretty close
											to the hamburger patty, and as you can
											see it basically forms like hamburger meat.
											This is made from three ingredients:
											beets, barley, corn, and so it
											actually cooks up like hamburger meat,
											looks and tastes like hamburger meat,
											and not only that, but it's basically
											removing the cow from the equation.
											So replicating food, taking it into that
											next level is where we're going.
											(Applause)
									","
											Hay mucha investigación y mucho
											error, prueba y error -supongo que más error-
											en la preparación de cada plato.
											No siempre nos sale bien y lleva
											tiempo poder explicárselo
											a la gente.
											HC: Así, a Chris y a mí luego de un día entero
											de mirarnos el uno al otro, se nos ocurrió
											algo bastante cercano
											a la hamburguesa y, como pueden ver,
											tiene forma de carne vacuna.
											Está hecha de tres ingredientes:
											remolacha, cebada, maíz, y así
											se cocina como carne de hamburguesa,
											parece y sabe a carne de hamburguesa
											y no sólo eso, sino que se elimina
											a la vaca de la ecuación.
											La réplica culinaria, hacia ese
											lado nos dirigimos.
											(Aplausos)
									","
											Her bir yemek üzerinde yapılan
											o kadar araştırma, başarısızlık, deneme
											ve yanılma — sanırım daha çok yanılma —
											her zaman sonuç başarılı olmuyor, ve insanlara
											bunu açıklamak bizim için biraz zaman
											alıyor.
											HC: Chris ve benim birbirimize boş boş
											baktığımız yaklaşık bir günden sonra
											hamburger köftesine çok yakın
											birşey ortaya çıkardık, ve gördüğünüz gibi
											şekli tıpkı hamburger etine benziyor.
											Üç malzemeden yapıldı:
											pancar, arpa, mısır ve sahiden
											hamburger eti gibi pişiyor,
											görüntüsü ve tadı aynı hamburger eti gibi,
											ve sırf onunla kalmayıp, temel olarak
											ineği denklemden çıkarıyor.
											Yani yemeği kopyalamak, bir sonraki
											seviyeye çıkarmak bizim ilerlediğimiz yol.
											(Alkışlar)
									","
											Il y a beaucoup de recherche et beaucoup
											d'échec, d'essais et d'erreurs - je suppose, plus d'erreurs -
											qui vont dans chaque plat,
											donc nous ne réussissons pas toujours, et il nous faut
											un certain temps pour être capables d'expliquer ça
											aux gens.
											HC : Donc, après environ une journée que Chris et moi
											avons passée à nous regarder l'un l'autre, nous sommes arrivés à
											quelque chose qui était assez proche
											de la galette de bœuf haché, et comme vous pouvez
											voir ça a en gros la forme de la viande à hamburger.
											Ceci est fait de trois ingrédients:
											des betteraves, de l'orge, du maïs, et donc ça
											se cuit vraiment comme de la viande à hamburger,
											ça ressemble et ça a le goût de la viande à hamburger,
											et non seulement ça, mais il s'agit essentiellement
											de retirer la vache de l'équation.
											Donc répliquer la nourriture, l'amener
											au niveau suivant, c'est là où nous allons.
											(Applaudissements)
									","
											Es braucht viel Recherche und viel
											Versagen und Ausprobieren - mehr Fehler, denke ich –
											die mit jedem einzelnen Gericht einher gehen,
											wir kriegen es also nicht immer gut hin, und es braucht
											eine Weile, um das den Leuten
											zu erklären.
											HC: Nachdem Chris und ich uns also etwa
											einen Tag lang angestarrt hatten, entwickelten
											wir etwas, das der Hamburger-Frikadelle
											ziemlich nah kam, und wie Sie sehen können,
											formt es sich grundsätzlich auch wie Hackfleisch.
											Es ist aus drei Zutaten gemacht:
											Rüben, Gerste, Getreide, und es lässt sich
											tatsächlich wie Hackfleisch zubereiten,
											sieht aus und schmeckt wie Hackfleisch,
											und nicht nur das, es entfernt auch noch
											die Kuh aus der Gleichung.
											Nahrung zu kopieren, es auf diese nächste Ebene
											zu bringen, das ist unser Streben.
											(Applaus)
									",Cooking as alchemy,Homaro Cantu + Ben Roche,9:34,"agriculture,business,creativity,culture,food"
"
","
","
","
","
",Cooking as alchemy,Homaro Cantu + Ben Roche,9:34,"agriculture,business,creativity,culture,food"
"
											BR: And it's definitely the world's first
											bleeding veggie burger,
											which is a cool side effect.
											And a miracle berry, if you're not familiar
											with it, is a natural ingredient, and it
											contains a special property.
											It's a glycoprotein called miraculin,
											a naturally occurring thing. It still freaks
											me out every time I eat it, but it has a
											unique ability to mask certain taste
											receptors on your tongue, so that primarily
											sour taste receptors, so normally things
											that would taste very sour or tart,
											somehow begin to taste very sweet.
											HC: You're about to eat a lemon,
											and now it tastes like lemonade.
											Let's just stop and think about the
											economic benefits of something like that.
											We could eliminate sugar across the board
											for all confectionary products and sodas,
											and we can replace it with
											all-natural fresh fruit.
									","
											BR: Definitivamente, es la primera
											hamburguesa vegetal, que es
											un efecto secundario genial.
											Y una baya milagrosa, si no están familiarizados
											con esto, es un ingrediente natural
											que tiene una propiedad especial.
											Es una glicoproteína llamada miraculina,
											algo natural. Todavía me alucina
											cada vez que la como, pues tiene una
											capacidad única para actuar sobre
											ciertas papilas gustativas, y hacer que
											los receptores de lo amargo, esas cosas
											de sabor muy amargo o agrio,
											de algún modo se tornen muy dulces.
											HC: Están por comer un limón
											y ahora sabe a limonada.
											Detengámonos a pensar en
											los beneficios económicos de algo así.
											Podríamos eliminar todo el azúcar
											de los productos de confitería y las gaseosas,
											y podemos reemplazarlo
											por frutas naturales.
									","
											BR: Ve kesinlikle dünyanın ilk kanayan
											sebze köftesi, ve bu da
											harika bir yan etki.
											Ve bir mucize meyvesi, aşina değilseniz,
											doğal bir malzeme ve özel bir niteliğe
											sahip.
											Miraculin adlı bir glikoprotein,
											doğal olarak oluşan birşey. Hala her yediğimde
											beni aşırı heyecanlandırıyor, ama
											diliniz üzerindeki belirli tat reseptörlerini
											maskeleme gibi eşsiz bir yeteneğe sahip,
											ekşi tat reseptörlerini maskeliyor, böylece
											normalde çok ekşi ya da mayhoş
											tatlı şeyler her nedense çok tatlı oluyor.
											HC: Bir limon yemek üzeresiniz,
											ve şimdi tadı limonata gibi.
											Biraz duralım ve bu gibi birşeyin
											ekonomik faydalarını düşünelim.
											Tüm şekerli ürünler ve gazlı içeceklerdeki
											şekeri çıkarabiliriz ve yerine
											tamamen doğal taze meyve
											koyabiliriz.
									","
											BR : Et c'est certainement le premier
											hamburger végétarien qui saigne,
											qui est un effet secondaire cool.
											Et un fruit miracle, si vous ne le connaissez pas,
											est un ingrédient naturel, et il
											contient une propriété particulière.
											Il s'agit d'une glycoprotéine appelée miraculine,
											une chose naturelle. Ça me fait encore flipper
											à chaque fois que j'en mange, mais elle a une
											capacité unique de masquer certains récepteurs du goût
											sur votre langue, de sorte que surtout
											les récepteurs de goût amer, donc normalement les choses
											qui aurait un goût très amer ou acide,
											en quelque sorte commencent à avoir un goût très sucré.
											HC : Vous êtes sur le point de manger un citron,
											et maintenant il a un goût comme de la citronnade.
											Arrêtons-nous pour réfléchir
											aux avantages économiques d'une chose comme ça.
											Nous pourrions éliminer le sucre complètement
											de tous les produits de confiserie et les sodas,
											et nous pouvons le remplacer par
											des fruits frais 100% naturels.
									","
											BR: Und es ist definitiv der weltweite erste
											blutige vegetarische Hamburger,
											was eine coole Begleiterscheinung ist.
											Und eine Wunderbeere, falls Sie sie nicht
											kennen, ist eine natürliche Zutat, und sie
											beinhaltet eine besondere Eigenschaft.
											Ein Glycoprotein namens Miraculin,
											eine natürlich vorkommende Sache. Ich flippe noch immer
											jedes Mal aus, wenn ich sie esse, aber sie hat
											eine einzigartige Fähigkeit, gewisse Geschmacksrezeptoren
											auf der Zunge zu verbergen, und zwar hauptsächlich
											saure Rezeptoren, normalerweise beginnen
											dann also Dinge, die sehr sauer oder herb schmecken,
											irgendwie sehr süss zu schmecken.
											HC: Sie sind also gerade im Begriff, eine Zitrone zu essen,
											und jetzt schmeckt sie wie Limonade.
											Hören wir nun auf und denken wir an die
											wirtschaftlichen Vorzüge einer solchen Sache.
											Wir könnten Zucker in allen Konditoreiwaren
											und Limonaden flächendeckend beseitigen,
											und wir können ihn mit naturreinen,
											frischen Früchten ersetzen.
									",Cooking as alchemy,Homaro Cantu + Ben Roche,9:34,"agriculture,business,creativity,culture,food"
"
","
","
","
","
",Cooking as alchemy,Homaro Cantu + Ben Roche,9:34,"agriculture,business,creativity,culture,food"
