en,es,tr,fr,de,title,speaker,duration,tags
"
											Over time, more photos came in, thankfully,
											and more retouchers were needed,
											and so I reached out again on Facebook and LinkedIn,
											and within five days, 80 people wanted to help
											from 12 different countries.
											Within two weeks, I had 150 people
											wanting to join in.
											Within Japan, by July, we'd branched out
											to the neighboring town of Rikuzentakata,
											further north to a town called Yamada.
											Once a week, we would set up our scanning equipment
											in the temporary photo libraries that had been set up,
											where people were reclaiming their photos.
											The older ladies sometimes hadn't seen a scanner before,
											but within 10 minutes of them finding their lost photo,
											they could give it to us, have it scanned,
											uploaded to a cloud server, it would be downloaded
											by a gaijin, a stranger,
											somewhere on the other side of the globe,
											and it'd start being fixed.
									","
											Con el paso del tiempo, llegaron por suerte más fotos
											y se necesitaron más retocadores
											así es que entré nuevamente en Facebook y LinkedIn
											y cinco días más tarde 80 personas de
											12 países se ofrecieron a ayudar.
											Al cabo de dos semanas tenía 150 personas
											deseosas de unirse.
											En Japón, en julio, nos movilizamos
											a Rijuzentakata, un pueblo vecino
											al norte de Yamada.
											Una vez a la semana usábamos nuestro escáner
											en las bibliotecas fotográficas temporales que se habían instalado,
											donde la gente iba a reclamar sus fotos.
											Algunas de las mujeres más ancianas nunca antes habían visto un escáner,
											pero en unos 10 minutos encontraban sus fotos,
											nos las daban, las escanéabamos,
											las subíamos a un servidor alojado en internet, y se las bajaba
											un extranjero, un extraño,
											alguien al otro lado del mundo
											para retocarlas.
									","
											Zamanla, neyse ki, daha çok fotoğraf geldi
											ve daha çok rötuşçuya ihtiyaç vardı,
											yine Facebook ve Linkedin üzerinden insanlara ulaştım
											ve beş gün içinde, 12 farklı ülkeden 80 kişi
											yardım etmek istedi.
											İki hafta içinde, katılmak isteyen kişi
											sayısı 150 olmuştu.
											Temmuz'a kadar, Japonya'da büyüdük ve
											komşu kasaba Rikuzentakata'ya, daha kuzeyde
											Yamada adlı kasabaya yayıldık.
											Haftada bir gün kurulan ve insanların fotoğraflarını
											düzelttirdikleri geçici fotoğraf kitaplıklarında
											tarama ekipmanlarımızı hazırlıyorduk.
											Yaşlı kadınların bazıları daha önce tarayıcı görmemiş oluyorlardı,
											fakat kayıp fotoğraflarını bulduktan 10 dakika sonra
											bunları bize verip taratıyor,
											bir bulut sunucuya yükletiyorlardı; bunlar dünyanın diğer
											tarafında bir yerde bir gaijin,
											yani yabancı tarafından indiriliyor ve düzeltilmeye
											başlanıyordu.
									","
											Au fil du temps, on a vu arriver plus de photos, heureusement,
											il fallait plus de retoucheurs,
											j'ai à nouveau lancé un appel sur Facebook et LinkedIn,
											et en cinq jours, 80 personnes voulaient nous aider,
											de 12 pays différents.
											En deux semaines, j'ai eu 150 personnes
											qui voulaient participer.
											Au Japon, en juillet, nous avons étendu notre activité
											à la ville voisine de Rikuzentakata,
											plus au nord à une ville appelée Yamada.
											Une fois par semaine, nous installions nos scanners
											dans les bibliothèques temporaires qui avaient été mises en place,
											où les personnes venaient récupérer leurs photos.
											Les dames âgées, parfois, n'avaient jamais vu un scanner avant,
											mais 10 minutes après avoir trouvé leur photo perdue,
											elles pouvaient nous la donner pour qu'on la scanne,
											qu'on la télécharge vers un serveur distant, où
											un gaijin, un inconnu,
											quelque part de l'autre côté de la planète,
											commencerait à la réparer.
									","
											Mit der Zeit kamen glücklicherweise 
immer mehr Fotos herein,
											und wir brauchten mehr Retuscheure,
											und so fragte ich wieder auf 
Facebook und LinkedIn,
											und innerhalb von fünf Tagen 
wollten 80 Leute
											aus zwölf verschiedenen Ländern helfen.
											Innerhalb von zwei Wochen hatte ich 150 Leute,
											die mitmachen wollten.
											Innerhalb Japans hatten wir uns
im Juli inzwischen ausgeweitet
											auf die Nachbarstadt Rikuzentakata,
											weiter nördlich auf eine Stadt namens Yamada.
											Einmal in der Woche bauten wir 
unsere Scanausrüstung
											in den provisorischen Fotoarchiven auf, 
die eingerichtet worden waren,
											wo Leute ihre Fotos abholten.
											Die älteren Damen hatten teilweise noch 
nie einen Scanner gesehen,
											aber innerhalb von 10 Minuten nachdem sie 
ihr verschollenes Foto gefunden hatten,
											konnten sie es uns geben, es einscannen lassen,
											es wurde auf einen Cloud Server hochgeladen, 
es wurde heruntergeladen
											von einem <i>gaijin</i>, einem Fremden,
											irgendwo auf der anderen Seite der Erde,
											und dieser würde damit anfangen, 
es auszubessern.
									",(Re)touching lives through photos,Becci Manson,9:49,"Asia,culture,disaster relief,memory,photography,storytelling"
"
","
","
","
","
",(Re)touching lives through photos,Becci Manson,9:49,"Asia,culture,disaster relief,memory,photography,storytelling"
"
											The time it took, however, to get it back
											is a completely different story,
											and it depended obviously on the damage involved.
											It could take an hour. It could take weeks.
											It could take months.
											The kimono in this shot pretty much had to be hand-drawn,
											or pieced together, picking out the remaining parts of color
											and detail that the water hadn't damaged.
											It was very time-consuming.
									","
											El tiempo que tardaban en entregarlas
											es una historia diferente,
											dependía por supuesto del desperfecto de las fotos.
											Podía implicar una hora. Podía implicar semanas.
											Podía implicar meses.
											Este kimono se tuvo que dibujar prácticamente a mano
											usando como guía las áreas cuyo color
											y detalle el agua no había destruido.
											Tomó mucho tiempo.
									","
											Ancak, bunları geri almanın ne kadar sürdüğü
											tamamen farklı bir hikaye,
											ve açıkça ne kadar hasarlı olduğuna göre değişiyordu.
											Bir saat sürebilirdi, Haftalarca sürebilirdi.
											Aylarca sürebilirdi.
											Bu fotoğrafta kimono'nun sudan hasar görmeyen detayları ve renginin
											geri kalan bölümleri ortaya çıkarılarak, büyük ölçüde elle çizilmesi
											veya tamamlanması gerekiyordu.
											Bu oldukça zaman alıcıydı.
									","
											Le temps qu'il a fallu, cependant, pour la ravoir
											est une toute autre histoire,
											cela dépendait évidemment des dégâts.
											Ça pouvait prendre une heure. Ça pouvait prendre des semaines.
											Ça pouvait prendre des mois.
											Le kimono sur cette photo a quasiment dû être dessiné à la main,
											ou reconstitué, à partir ce qu'il restait de la couleur
											et du détail que l'eau n'avait pas endommagé.
											C'est très chronophage.
									","
											Mit der Zeit, die es dauerte, 
um es zurückzubekommen,
											sah es allerdings ganz anders aus,
											und das hing natürlich vom jeweiligen Schaden ab.
											Es konnte eine Stunde dauern. 
Es konnte Wochen dauern.
											Es konnte Monate dauern.
											Der Kimono in dieser Aufnahme musste 
so ziemlich handgemalt werden,
											oder zusammengesetzt werden aus Farbresten
											und Details, die das Wasser 
nicht beschädigt hatte.
											Es war sehr zeitaufwendig.
									",(Re)touching lives through photos,Becci Manson,9:49,"Asia,culture,disaster relief,memory,photography,storytelling"
"
","
","
","
","
",(Re)touching lives through photos,Becci Manson,9:49,"Asia,culture,disaster relief,memory,photography,storytelling"
"
											Now, all these photos had been damaged by water,
											submerged in salt water, covered in bacteria,
											in sewage, sometimes even in oil, all of which over time
											is going to continue to damage them,
											so hand-cleaning them was a huge part of the project.
											We couldn't retouch the photo unless it was cleaned,
											dry and reclaimed.
									","
											El agua destruyó todas estas fotos
											sumergidas en agua salada, cubiertas de bacterias,
											con algas, incluso con aceite, todo ello junto con el paso del tiempo
											continúo destruyéndolas,
											por eso limpiarlas a mano era una parte importante del proyecto.
											No podíamos retocar la foto a menos que estuviera limpia,
											seca y hubiera sido reclamada por su dueño.
									","
											Bütün bu fotoğraflar sudan hasar görmüştü, tuzlu
											suya batmıştı, bakterilerle kaplanmıştı,
											bazen kanalizasyonda, hatta akaryakıt içinde; tüm bunlar zamanla
											fotoğraflara zarar vermeye devam edecekti;
											dolayısıyla bunları elle temizleme, projenin büyük bir bölümüydü.
											Fotoğraf temizlenmeden, kurumadan ve iyileştirilmeden
											rötuş yapamıyorduk.
									","
											Toutes ces photos avaient été endommagées par l'eau,
											immergées dans l'eau salée, couvertes de bactéries,
											dans les égouts, parfois même dans du pétrole, ce qui au fil du temps
											va continuer à les abîmer,
											les nettoyer à la main a donc été une grande part du projet.
											Nous ne pouvions pas retoucher la photo sans qu'elle ait été nettoyée,
											séchée et récupérée.
									","
											All diese Fotos waren durch Wasser beschädigt,
											von Salzwasser überschwemmt, 
von Bakterien überzogen,
											von Abwasser, manchmal sogar 
von Öl, und all dies
											fügt ihnen mit der Zeit 
mehr und mehr Schaden zu.
											Sie von Hand zu reinigen
war ein großer Teil des Projekts.
											Wir konnten kein Foto retuschieren, 
das nicht sauber,
											trocken und zugeordnet war.
									",(Re)touching lives through photos,Becci Manson,9:49,"Asia,culture,disaster relief,memory,photography,storytelling"
"
","
","
","
","
",(Re)touching lives through photos,Becci Manson,9:49,"Asia,culture,disaster relief,memory,photography,storytelling"
"
											Now, we were lucky with our hand-cleaning.
											We had an amazing local woman who guided us.
											It's very easy to do more damage to those damaged photos.
											As my team leader Wynne once said,
											it's like doing a tattoo on someone.
											You don't get a chance to mess it up.
									","
											Tuvimos suerte con la limpieza a mano.
											Contamos con la guía de una vecina admirable.
											Es muy fácil dañar aún más las fotos ya dañadas.
											Como dijo una vez Wynne, la líder de mi grupo
											es como hacer un tatuaje.
											No puedes cometer errores.
									","
											Elle temizleme işinde şanslıydık.
											Bizi yönlendiren inanılmaz bir yerli kadın vardı.
											Hasar görmüş bu fotoğraflara daha fazla zarar vermek çok kolaydı.
											Takım liderim Wynne'in bir keresinde dediği gibi,
											bu birine dövme yapmak gibidir.
											Bunu berbat etme şansınız yoktur.
									","
											Nous avons eu de la chance avec le nettoyage à la main.
											Une autochtone incroyable nous guidait.
											Il est très facile de faire plus de dégâts à ces photos abîmées.
											Comme l'a une fois dit mon chef d'équipe Wynne,
											c'est comme faire un tatouage sur une personne.
											Vous ne pouvez pas vous louper.
									","
											Wir hatten Glück mit dem Handreinigen.
											Es gab eine wundervolle 
einheimische Frau, die uns anleitete.
											Man kann leicht diese beschädigten Fotos 
noch weiter beschädigen.
											Meine Teamleiterin Wynne sagte einmal:
											""Es ist, als würde man 
jemanden tätowieren.
											Es gibt keine zweite Chance.""
									",(Re)touching lives through photos,Becci Manson,9:49,"Asia,culture,disaster relief,memory,photography,storytelling"
"
","
","
","
","
",(Re)touching lives through photos,Becci Manson,9:49,"Asia,culture,disaster relief,memory,photography,storytelling"
"
											The lady who brought us these photos was lucky,
											as far as the photos go.
											She had started hand-cleaning them herself and stopped
											when she realized she was doing more damage.
											She also had duplicates.
											Areas like her husband and her face, which otherwise
											would have been completely impossible to fix,
											we could just put them together in one good photo,
											and remake the whole photo.
									","
											La mujer que nos trajo estas fotos tuvo suerte
											en relación a las fotos.
											Había empezado a limpiarlas ella misma pero se detuvo
											al darse cuenta que las dañaba aún más.
											También tenía duplicados.
											Sin ellos, las imágenes de su esposo y de su propia cara
											no se habrían podido reconstruir,
											pudimos solapar las imágenes en una sola foto
											y retocar la foto completa.
									","
											Bize bu fotoğrafları getiren kadın şanslıydı,
											yani fotoğraf anlamında.
											Bunları kendisi elle temizlemeye başlamış fakat daha çok zarar
											verdiğini fark ettiğinde bırakmıştı.
											Fotoğrafın ikinci kopyası da vardı.
											Kocasının ve kadının yüzü gibi, aksi takdirde düzeltmemizin
											tamamen imkansız olacağı yerlerde
											biz, sadece ikisini bir fotoğrafta birleştirerek
											tüm fotoğrafı yeniden oluşturabildik.
									","
											La dame qui nous a apporté ces photos a eu de la chance
											avec elles.
											Elle avait commencé à les nettoyer à la main elle-même et s'est arrêtée
											quand elle s'est rendue compte qu'elle aggravait les dégâts.
											Elle avait également des doubles.
											Des zones comme son mari et son visage, qu'il aurait été autrement
											impossible à arranger,
											nous pouvions tout rassembler en une bonne photo,
											et refaire entièrement la photo.
									","
											Die Dame, die uns 
diese Fotos brachte, hatte Glück
											mit Hinsicht auf die Fotos.
											Sie hatte angefangen, sie selbst 
zu reinigen, und wieder aufgehört,
											als ihr klar wurde, dass sie 
noch mehr Schaden anrichtete.
											Außerdem hatte sie Duplikate.
											Wir konnten Flächen 
wie die Gesichter, die sonst
											unmöglich hätten ausgebessert werden können,
											einfach in einem guten Foto 
zusammensuchen
											und das ganze Foto wiederherstellen.
									",(Re)touching lives through photos,Becci Manson,9:49,"Asia,culture,disaster relief,memory,photography,storytelling"
"
","
","
","
","
",(Re)touching lives through photos,Becci Manson,9:49,"Asia,culture,disaster relief,memory,photography,storytelling"
"
											When she collected the photos from us,
											she shared a bit of her story with us.
											Her photos were found by her husband's colleagues
											at a local fire department in the debris
											a long way from where the home had once stood,
											and they'd recognized him.
											The day of the tsunami, he'd actually been in charge
											of making sure the tsunami gates were closed.
											He had to go towards the water as the sirens sounded.
											Her two little boys, not so little anymore, but her two boys
											were both at school, separate schools.
											One of them got caught up in the water.
											It took her a week to find them all again
											and find out that they had all survived.
									","
											Cuando recogió sus fotos
											compartió algo de su historia con nosotros.
											Unos colegas de su esposo encontraron las fotos
											en una estación de bomberos entre los escombros
											bastante lejos de donde solía estar su casa,
											pero sus colegas lo reconocieron.
											El día del tsunami, su marido fue el encargado
											de cerrar las barreras a la ola.
											Tuvo que ir dentro del agua mientras las sirenas sonaban.
											Sus hijos pequeños, no tan pequeños ahora, pero sus dos hijos
											estaban en el colegio, en colegios diferentes.
											Uno de ellos quedó atrapado en el agua.
											Le llevó una semana encontrar a toda su familia
											y saber que todos habían sobrevivido.
									","
											Fotoğrafları almaya geldiğinde,
											hikayesinin bir bölümünü bizimle paylaştı.
											Fotoğraflar, yerel bir itfaiyede enkazın içinde
											bir zamanlar evlerinin bulunduğu yerden
											çok uzakta, kocasının iş arkadaşları tarafından bulunmuştu
											ve kocasını tanımışlardı.
											Tsunami'nin olduğu gün, tsunami kapaklarının kapalı
											olmasını sağlamaktan sorumluydu.
											Sirenler çaldığında, suya doğru gitmesi gerekiyordu.
											İki küçük oğlu, artık o kadar küçük değiller ama iki küçük oğlu
											okuldaydı, farklı okullarda.
											Bir tanesi suya yakalandı.
											Hepsini tekrar bulması ve hepsinin
											hayatta olduğu bulması bir hafta sürdü.
									","
											Quand elle récupérait les photos auprès de nous,
											elle nous racontait un peu de son histoire.
											Ses photos ont été trouvées par des collègues de son mari
											dans les ruines d'une caserne de pompiers
											loin de l'endroit où sa maison se dressait autrefois,
											et ils l'avaient reconnu, lui.
											Le jour du tsunami, il avait la responsabilité de s'assurer
											que les barrières anti-tsunami étaient fermées.
											Il a dû aller vers l'eau quand les sirènes ont retenti.
											Ses deux petits garçons, plus si petits, mais ses deux garçons
											étaient tous les deux à l'école, dans des écoles différentes.
											L'un d'eux a été emporté dans l'eau.
											Il lui a fallu une semaine pour tous les retrouver
											et savoir qu'ils avaient tous survécu.
									","
											Als sie die Fotos bei uns abholte,
											erzählte sie uns einen 
Teil ihrer Geschichte.
											Die Kollegen ihres Mannes 
hatten ihre Fotos
											bei der örtlichen Feuerwehr 
im Schutt gefunden,
											weit weg von dort, 
wo ihr Haus gestanden hatte,
											und sie hatten ihn erkannt.
											Am Tag des Tsunamis war es 
seine Aufgabe gewesen,
											sicherzustellen, dass die Tsunami-Schleusen 
geschlossen waren.
											Er musste Richtung Wasser gehen, 
als die Sirenen ertönten.
											Ihre zwei kleinen Jungs, 
die gar nicht mehr so klein waren,
											waren in verschiedenen Schulen.
											Das Wasser erfasste einen von Ihnen.
											Es dauerte eine Woche, bis sie 
sie alle wiedergefunden
											und herausgefunden hatte, 
dass alle noch lebten.
									",(Re)touching lives through photos,Becci Manson,9:49,"Asia,culture,disaster relief,memory,photography,storytelling"
"
","
","
","
","
",(Re)touching lives through photos,Becci Manson,9:49,"Asia,culture,disaster relief,memory,photography,storytelling"
"
											The day I gave her the photos also happened to be
											her youngest son's 14th birthday.
											For her, despite all of this, those photos
											were the perfect gift back to him,
											something he could look at again, something he remembered from before
											that wasn't still scarred from that day in March
											when absolutely everything else in his life had changed
											or been destroyed.
									","
											El día que le entregué sus fotos
											su hijo menor cumplía 14 años.
											Para ella, a pesar de todo esto, esas fotos
											eran el mejor regalo que podía hacerle,
											algo que él podía volver a mirar, algo que pudiera recordar del pasado
											que no hubiera sido marcado por aquel día de marzo
											cuando todo en su vida cambió
											o fue destruido.
									","
											Ona fotoğrafları verdiğim gün en küçük oğlunun
											14. doğum günüydü.
											Ona göre, olan her şeye rağmen, bu fotoğraflar
											oğluna verilecek mükemmel hediyeydi,
											tekrar bakacağı bir şey, hayatındaki her şeyin tamamen değişmediği
											veya yıkılmadığı Mart'ın o gününden,
											hala korkmadığını hatırladığı
											geçmişten bir şey.
									","
											Le jour où je lui a donné les photos s'est trouvé être aussi
											du 14e anniversaire de son plus jeune fils.
											Pour elle, malgré tout, ces photos
											étaient le cadeau idéal à lui faire,
											une chose qu'il pourrait regarder à nouveau, une chose dont il se souvenait d'avant
											et qui n'était pas encore marquée par ce jour de mars
											où absolument tout le reste de sa vie avait changé
											ou avait été détruit.
									","
											Ich gab ihr die Fotos
											am 14. Geburtstag 
ihres jüngsten Sohnes.
											Trotz allem waren diese Fotos für sie
											das beste Geschenk an ihn,
											etwas, das er sich wieder anschauen konnte, 
woran er sich von davor erinnerte,
											das nicht noch immer gezeichnet war
von diesem Tag im März
											als alles andere in seinem Leben 
sich plötzlich verändert hatte
											oder zerstört worden war.
									",(Re)touching lives through photos,Becci Manson,9:49,"Asia,culture,disaster relief,memory,photography,storytelling"
"
","
","
","
","
",(Re)touching lives through photos,Becci Manson,9:49,"Asia,culture,disaster relief,memory,photography,storytelling"
