en,es,tr,fr,de,title,speaker,duration,tags
"
											That's a challenge for 21st-century science.
											If my research group had a logo, it would be this picture here:
											an ouroboros, where you see the micro-world on the left —
											the world of the quantum — and on the right
											the large-scale universe of planets, stars and galaxies.
											We know our universes are united though —
											links between left and right.
											The everyday world is determined by atoms,
											how they stick together to make molecules.
											Stars are fueled by how the nuclei in those atoms react together.
											And, as we've learned in the last few years, galaxies are held together
											by the gravitational pull of so-called dark matter:
											particles in huge swarms, far smaller even than atomic nuclei.
											But we'd like to know the synthesis symbolized at the very top.
											The micro-world of the quantum is understood.
											On the right hand side, gravity holds sway. Einstein explained that.
											But the unfinished business for 21st-century science
											is to link together cosmos and micro-world
											with a unified theory — symbolized, as it were, gastronomically
											at the top of that picture. (Laughter)
											And until we have that synthesis,
											we won't be able to understand the very beginning of our universe
											because when our universe was itself the size of an atom,
											quantum effects could shake everything.
									","
											Ese es un desafío para la ciencia del siglo 21.
											Si mi grupo de investigación tuviera un logo, sería esta imagen aquí:
											un Uroboros, donde pueden ver el micro-mundo a la izquierda —
											el mundo cuántico — y a la derecha
											el universo a gran-escala, de planetas, estrellas y galaxias.
											Sabemos que nuestros universos están unidos —
											vínculos entre izquierda y derecha.
											El mundo cotidiano está determinado por átomos,
											cómo se adhieren juntos para formar moléculas.
											Las estrellas se alimentan por cómo reaccionan los núcleos de esos átomos entre ellos.
											Y como hemos aprendido en estos últimos años, las galaxias se mantienen juntas
											por la atracción gravitacional de la 'materia oscura':
											partículas en inmensas aglomeraciones, mucho más pequeñas incluso que el núcleo atómico.
											Pero nos gustaría saber la síntesis simbolizada en lo más alto.
											El micro-mundo cuántico está entendido.
											En la mano derecha, la gravedad las mantiene unidas. Einstein explicó eso.
											Pero la asignatura pendiente para la ciencia del siglo veintiuno
											es la de unir el cosmos y el micro-mundo
											en una teoría unificada — simbolizada, gastronómicamente
											por sobre encima de esa imagen. (Risas)
											Y hasta que tengamos esa síntesis
											no podremos entender el mismísimo comienzo de nuestro universo
											porque cuando nuestro universo era del tamaño de un átomo,
											los efectos cuánticos podían mezclarlo todo.
									","
											Bu 21nci-yüzyıl bilimi için bir uğraş konusu.
											Eğer benim araştırma grubum bir logo yapsaydı, buradaki resim gibi olurdu:
											kendi kuyruğunu ısıran bir ejderha, sol tarafta mikro-dünyayı görüyorsunuz—
											quantumun dünyasını— ve sağ tarafta
											galaksilerin, yıldızların ve gezegenlerin geniş-ölçekli kainatını.
											Buna rağmen biliyoruz ki bizim evrenlerimiz bir bütün
											solu ve sağı birbirine bağlıyor.
											Alışılmış dünya atomlar tarafından belirleniyor,
											onların birbirine yapışıp molekülleri oluşturmaları tarzında.
											Yıldızlar atomların nükleusları arasında reaksiyonlara benzer biçimde besleniyorlar.
											Ve son bir kaç yıl içinde öğrendiğimiz üzere, galaksiler
											karanlık madde diye anılan çekim gücü sayesinde birarada tutuluyorlar :
											ki bu, atom nükleuslarından bile daha küçük, dev parçacık bulutlarından oluşuyor.
											Ama en tepede sembolize edilen sentezi bilmek isterdik.
											Kuantumun mikro-dünyası anlaşılmış durumda.
											Sağ tarafta, yerçekimi emir veriyor. Einstein bunu açıklamıştı.
											Fakat 21 nci-yüzyıl bilimi için bitmemiş vazife
											birleştirici bir teoriyle kozmozu ve mikro-dünyayı
											birbirine bağlamaktır.—fotoğrafın tepesinde önceden olduğu şekilde
											gastronomik olarak sembolize edilmiş. (Gülüşmeler)
											Ve bu senteze ulaşana kadar,
											kainatımızın başlangıcını anlama şansımız olamayacak
											çünkü bizim kainatımız eğer bir atom boyutunda olsaydı
											kuantum etkileri o zaman her şeyi açıklayabilirdi.
									","
											C'est un challenge pour la science du 21ème siècle.
											Si mon groupe de recherche avait un logo, ce serait celui-ci:
											un ouroboros, avec le monde microscopique à gauche —
											le monde des quanta — et à droite
											l'univers macroscopique des planètes, des étoiles et des galaxies.
											Nous savons que ces deux univers sont unis —
											il y a un lien entre la gauche et la droite.
											Notre réalité physique est déterminée par les atomes,
											et leur assemblage en molécules.
											Les étoiles fonctionnent grâce aux réactions des noyaux de ces atomes.
											Et nous savons depuis quelques années que les galaxies forment un tout aggloméré
											par la force gravitationnelle de la fameuse matière sombre:
											Immenses masses de particules beaucoup plus petites que les noyaux atomiques.
											Mais nous aimerions bien faire la synthèse de ces deux mondes, symbolisée en haut.
											Nous comprenons le micro-monde des quantas.
											A droite vous avez le royaume de la gravité, comme décrit par Einstein.
											Mais l'enjeu pour la science du 21ème siècle
											est de réunir le cosmos et le monde microscopique
											par une théorie unifiée — symbolisée en haut
											gastronomiquement, si l'on peut dire. (Rires)
											Et tant que nous n'arriverons pas à cette synthèse,
											nous ne pourrons pas comprendre les premiers moments de notre univers,
											car à cette époque où notre univers lui-même était réduit à la taille d'un atome,
											les effets quantiques peuvaient tout ébranler.
									","
											Das ist eine Aufgabe für die Wissenschaft des 21. Jahrhunderts.
											Wenn meine Forschungsgruppe ein Logo hätte, würde dies so aussehen:
											ein Ouroboros, die Welt des Kleinen ist links sichtbar –
											die Welt der Quanten – und auf der rechten
											die Welt des Großen, der Universen, der Galaxien und Sterne.
											Wir wissen, dass unsere Universen vereint sind durch Verbindungen
											zwischen den Dingen auf der Linken und der Rechten.
											Unsere gegenwärtige Welt wird bestimmt durch Atome
											und die Art, wie sie sich zu Molekülen zusammenschließen.
											Sterne ziehen ihre Energie aus der Reaktion der Kerne in den Atomen miteinander.
											In der jüngsten Vergangenheit haben wir gelernt, dass die Galaxien durch
											die Gravitation der so genannten dunklen Materie zusammengehalten werden:
											Partikel in riesigen Schwärmen, viel kleiner als Atomkerne.
											Aber wir würden gern die im Bild symbolisierte Synthese verstehen.
											Wir verstehen die Welt des Mikrokosmos, der Quanten
											Auf der rechten Seite herrscht die Gravitation. Einstein hat das erklärt.
											Die ungelöste Aufgabe für die Wissenschaft des 21. Jahrhundert ist es,
											eine Verbindung zwischen Kosmos und Mikrokosmos herzustellen,
											durch eine einheitliche Theorie, die die sich selbst verspeisende
											Schlange auf dem Bild symbolisiert. (Lachen)
											Und bis wir diese Synthese haben,
											werden wir nicht den Anfang unseres Universums verstehen,
											denn als das Universum selbst nur die Größe eines Atoms hatte,
											konnten Quanteneffekte alles durcheinanderbringen.
									",Is this our final century?,Martin Rees,17:26,"astronomy,climate change,complexity,cosmos,science,social change,technology,time,universe"
"
","
","
","
","
",Is this our final century?,Martin Rees,17:26,"astronomy,climate change,complexity,cosmos,science,social change,technology,time,universe"
"
											And so we need a theory that unifies the very large and the very small,
											which we don't yet have.
											One idea, incidentally —
											and I had this hazard sign to say I'm going to speculate from now on —
											is that our Big Bang was not the only one.
											One idea is that our three-dimensional universe
											may be embedded in a high-dimensional space,
											just as you can imagine on these sheets of paper.
											You can imagine ants on one of them
											thinking it's a two-dimensional universe,
											not being aware of another population of ants on the other.
											So there could be another universe just a millimeter away from ours,
											but we're not aware of it because that millimeter
											is measured in some fourth spatial dimension,
											and we're imprisoned in our three.
											And so we believe that there may be a lot more to physical reality
											than what we've normally called our universe —
											the aftermath of our Big Bang. And here's another picture.
											Bottom right depicts our universe,
											which on the horizon is not beyond that,
											but even that is just one bubble, as it were, in some vaster reality.
											Many people suspect that just as we've gone from believing
											in one solar system to zillions of solar systems,
											one galaxy to many galaxies,
											we have to go to many Big Bangs from one Big Bang,
											perhaps these many Big Bangs displaying
											an immense variety of properties.
									","
											Y por eso necesitamos una teoría que unifique lo muy grande y lo muy pequeño,
											que aún no tenemos.
											Una idea, incidente —
											y voy a correr el riesgo de especular de aquí en adelante —
											— es que nuestro Big Bang no fue el único.
											Una idea es que nuestro universo tridimensional
											pueda estar embebido en un espacio polidimensional
											así como ustedes pueden imaginar acerca de estas hojas de papel.
											Pueden imaginar homrigas en uno de ellas
											pensando que es un universo bidimensional,
											sin estar concientes de otra población de hormigas en la otra.
											Así puede haber otro universo a un milímetro de nosotros,
											pero no podríamos percibirlo, porque ese milímetro
											está contenido en una cuarta dimensión espacial,
											y nosotros estamos atrapados en nuestras tres.
											Y por eso creemos que que puede haber mucho más sobre la realidad física
											que lo que comunmente hemos llamado nuestro universo —
											el resultado de nuestro Big Bang. Y he aquí otra imagen.
											La parte inferior derecha respresenta nuestro universo,
											que en el horizonte no pasa de eso,
											pero eso es sólo una burbuja, de alguna manera, en una realidad más vasta.
											Muchas personas sospechan que así como pasamos de creer
											en un solo sistema solar a zillones de sistemas solares,
											de una galaxia a muchas galaxias,
											tenemos que pasar de un solo Big Bang a muchos Big Bangs.
											Quizas estos Big Bangs muestren
											una inmensa variedad de propiedades.
									","
											Ve çok küçükle çok büyüğü birleştiren bir teoriye ihtiyacımız var
											ki ona henüz sahip değiliz.
											Bu arada bir düşünce—
											ve tehlikeyi göze almış biçimde şu andan itibaren speküle etmek istiyorum—
											—- bizim Big Bang' imiz tek değildi.
											Bir ihtimal şu ki bizim üç-boyutlu kainatımız
											çok-boyutlu bir uzay içinde gömülüdür,
											bu kağıt katmanları üzerinde düşünebileceğiniz gibi.
											Bunlardan biri üzerinde karıncalar düşünün
											bu onun iki-boyutlu bir kainat olduğunu düşündürüyor,
											diğeri üzerinde farklı bir karınca popülasyonu olduğunun farkında olmadan.
											Böylece bizlerden sadece bir milimetre uzakta diğer bir kainat olabilirdi,
											fakat bu milimetre bizim içine hapsolduğumuz
											üç boyutun dışında kalan
											bir dördüncüsü tarafından ölçülmüş olabilirdi.
											Ve böylelikle inanabiliriz ki, bizim kendimize ait olarak kabul ettiğimiz
											kainattan başka—bizim Big Bang'in dışında—fiziksel gerçekliği
											olan bir çok şey olabilir. Ve bu da diğer bir resim.
											Sağ alt köşe bizim evrenimizi temsil ediyor,
											ki ufukta göründüğü kadarıyla sınırlı ötesiyle alakalı değil.
											Ama o bile sanki daha devasa bir gerçeklik içinde yer alan bir baloncuk.
											Bir çok insan
											bir solar sistemden zilyonlarca solar sisteme,
											bir galaksiden bir çok galaksiye doğru inanç değiştirmemiz gibi
											bir Big Bang'tan bir çok Big Bang'a doğru ilerlememiz konusunda düşünüyor.
											Belki de bu bir çok Big Bang'ler çok sayıda
											özelliğin çeşitliliğini gösteriyordur.
									","
											Donc nous avons besoin d'une théorie qui unifie le très grand et le très petit,
											dont nous ne disposons pas encore.
											Une des idées —
											et j'affiche ce panneau danger car ce ne sont que des spéculations —
											— est que notre Big Bang ne serait pas unique.
											L'idée est que notre univers en 3 dimensions
											pourrait être imbriqué dans un espace de dimension supérieure,
											comme on pourrait l'imaginer avec ces feuilles de papier.
											Imaginez des fourmis sur l'une de ces feuilles,
											pensant faire partie d'un univers à deux dimensions,
											n'ayant pas conscience de l'existence d'autres fourmis sur l'autre feuille.
											Il pourrait donc y avoir un autre univers séparé du nôtre par juste un millimètre,
											mais dont nous ne pouvons avoir conscience car ce millimètre
											est mesuré sur une quatrième dimension spatiale,
											alors que nous sommes emprisonnés dans nos trois.
											Nous pensons donc qu'il pourrait y avoir beaucoup d'autres réalités physiques
											que celles qu'on appelle normalement notre univers —
											résultant de notre Big Bang. Et voici une autre image.
											En bas à droite figure notre univers
											dont l'horizon ne s'étend pas au-delà,
											et même ne serait qu'une bulle, en quelque sorte, dans une réalité plus vaste.
											Beaucoup de gens suspectent que, tout comme nous sommes passés
											d'une idée d'un système solaire unique à celle de milliards de milliards de systèmes solaires,
											d'une idée d'une galaxie unique à celle d'une multitude de galaxies,
											nous devons passer d'une idée d'un seul Big Bang à celle de plusieurs Big Bangs.
											Peut-être que ces nombreux Big Bangs arborent
											une immense variété de propriétés.
									","
											Wir brauchen also eine Theorie, die diese beiden Welten miteinander vereint,
											die haben wir allerdings noch nicht.
											Eine Idee, übrigens –
											und ich zeige das Warnschild um zu sagen, dass ich von jetzt an spekuliere –
											ist die, dass es nicht nur einen Urknall gab.
											Eine Idee besagt, dass unser dreidimensionales Universum
											in einem n-dimensionalen Raum eingeschlossen sein könnte.
											Sie können sich dies so vorstellen wie mit diesen Blättern.
											Stellen Sie sich Ameisen auf einem von ihnen vor,
											die das Blatt für ein zweidimensionales Universum halten,
											und sich der Ameisenpopulation auf dem zweiten Papier nicht bewusst sind.
											Es könnte also ein anderes Universum nur einen Millimeter von unserem entfernt existieren
											aber wir können es nicht erkennen, denn dieser Millimeter
											wird gemessen in einer vierten Raumdimension,
											und wir sind gefangen in unser Dreidimensionalität.
											Aus diesem Grund glauben wir, dass die physikalische Realität umfassender ist
											als das, was wir unser Universum nennen –
											die Nachwehen unseres Urknalls. Und hier ist noch ein Bild.
											Unten rechts zeigt es unser Universum,
											das am Horizont begrenzt wird.
											Aber selbst dieses ist nur eine kleine Blase in einer größeren Realität.
											Viele Leute vermuten, dass wir, so wie wir von einem
											Sonnensystem zu Myriaden von Sonnensystemen
											von einer Galaxie zu vielen Galaxien gekommen sind,
											von einem Urknall zu vielen Urknalls kommen müssen.
											wobei vielleicht diese vielen Urknalls eine
											riesige Vielzahl von Eigenschaften haben werden.
									",Is this our final century?,Martin Rees,17:26,"astronomy,climate change,complexity,cosmos,science,social change,technology,time,universe"
"
","
","
","
","
",Is this our final century?,Martin Rees,17:26,"astronomy,climate change,complexity,cosmos,science,social change,technology,time,universe"
