en,es,tr,fr,de,title,speaker,duration,tags
"
											This is one substitution that I believe
											all of us, in design management, are guilty of.
											And this idea that there is more to love,
											more to design, when it gets down to your neighbor, your other,
											it can be physical like this, and maybe in the future it will be.
											But right now it's in dealing with our own people,
											our own teams who are doing the creating. So, to my story.
											The idea of people-work is what we work with here,
											and I have to make a bond with my designers when we're creating BMWs.
											We have to have a shared intimacy, a shared vision —
											that means we have to work as one family;
											we have to understand ourselves that way.
											There's good times; there's interesting times;
											and there's some stress times too.
											You want to do cars, you've got to go outside.
											You've got to do cars in the rain; you've got to do cars in the snow.
											That's, by the way, is a presentation we made to our board of directors.
											We haul their butts out in the snow, too. You want to know cars outside?
											Well, you've got to stand outside to do this.
											And because these are artists, they have very artistic temperaments.
											All right? Now one thing about art is, art is discovery,
											and art is discovering yourself through your art. Right?
											And one thing about cars is we're all a little bit like Pygmalion,
											we are completely in love with our own creations.
											This is one of my favorite paintings, it really describes our relationship with cars.
											This is sick beyond belief.
									","
											Esta es una sustitución de la que creo
											que todos nosotros, en la gestión del diseño, somos culpables.
											Y esta idea de que hay más que amar,
											más que diseñar, cuando llega hasta tu vecino, tu otro,
											puede ser física como esto, y puede que en el futuro lo sea.
											Pero ahora mismo es en el trato con nuestra propia gente,
											nuestros propios equipos que están creando. Así que, a mi historia.
											Aquí abordamos la idea de trabajo en equipo
											y tengo que establecer lazos con mis diseñadores cuando estamos creando BMWs.
											Tenemos que tener una intimidad compartida, una visión compartida
											Lo que quiere decir que tenemos que trabajar como una familia,
											tenemos que vernos a nosotros mismos de ese modo.
											Hay momentos buenos, momentos interesantes,
											y también momentos estresantes.
											Quieres hacer coches, tienes que salir afuera.
											Tienes que hacer coches bajo la lluvia, tienes que hacer coches en la nieve.
											Esa, por cierto, es una presentación que hicimos a nuestra junta de directores.
											Arrastramos sus traseros hasta la nieve también. ¿Quieres conocer a los coches en el exterior?
											Bien, tienes que estar en el exterior para ello.
											Y dado que estos son artistas, tienen temperamentos muy artísticos.
											¿De acuerdo? Bien una cosa sobre el arte es, el arte es descubrimiento,
											y el arte es descubrirte a ti mismo a través de tu arte. ¿Verdad?
											Y una cosa sobre los coches es que todos somos un poco como Pigmalión,
											estamos completamente enamorados de nuestras creaciones.
											Esta es una de mis pinturas favoritas, describe verdaderamente nuestra relación con los coches.
											Esto es increíblemente morboso.
									","
											Bu tasarım yönetimi içinde yer alan
											herkesin suçu olduğuna inandığım bir değişim.
											Sevilecek ve tasarlanacak daha o kadar çok şey var ki,
											komşularımız söz konusu olduğunda ya da sizinle ilgili başka bir şey,
											böyle somut bir şey de olabilir, belki de gelecekte olacak.
											Ama şu anda bu bizim kendi insanlarımızla ilgili
											yaratma işini yapan ekibimizle ilgili. Benim hikayeme gelirsek.
											Bizim burada üzerinde durduğumuz konu insan-iş düşüncesi,
											ve BMW'leri üretirken tasarımcılarımla aramda bir bağ kurmak zorundayım.
											Karşılıklı bir samimiyet ve bakış açımız olmalı.
											Bu şu demek, aile gibi çalışmalıyız,
											kendimizi öyle görmeliyiz.
											İyi zamanlarımız, ilginç zamanlarımız oluyor,
											ve tabi bazen sıkıntılı zamanlarımız da.
											Araba yapmak istiyorsun, dışarıda çalışmak zorundasın.
											Arabaları yağmur yağarken, kar yağarken yapman gerekiyor.
											Bu, bu arada, yönetim kuruluna da yaptığımız bir sunum.
											Onları da dışarıya karın altına çıkardık. Dışardaki arabaları görmek istemez misiniz?
											Evvela, bunu yapmak için dışarıda durmanız gerekiyor.
											Ve bunlar sanatçı oldukları için, sanatsal yaradılışlıdırlar.
											Anlaşıldı mı? Sanatla ilgili diğer bir şey ise, sanatın bir keşif olduğu,
											ve insanın sanatı aracılığıyla kendini keşfetmesi. Değil mi?
											Arabalarla ilgili diğer bir şey ise hepimiz biraz Pygmalion gibiyiz.
											tasarımlarımıza tamamen aşığız.
											Bu benim beğendiğim tablolardan biridir, bizim arabalarla olan ilişkimizi mükemmel bir şekilde anlatıyor.
											bizim arabalarla olan ilişkimizi mükemmel bir şekilde anlatıyor.
									","
											Il s'agit d'une substitution dont je crois
											que chacun d'entre nous, dans la gestion du design, est coupable.
											Et cette idée qu'il y a plus à aimer,
											plus à designer, quand il s'agit de votre voisin, votre personne,
											ça peut être physique comme ça, et peut-être que dans l'avenir, ça le sera.
											Mais maintenant ce qui compte c'est de s'occuper des nôtres,
											de nos propres équipes qui font la création. Donc, venons-en à mon histoire.
											L'idée de gens au travail est ce avec quoi nous travaillons ici,
											et je dois établir un lien avec mes designers lorsque nous créons des BMW.
											Il nous faut une intimité partagée, une vision partagée
											Cela signifie que nous devons travailler comme une seule famille,
											nous devons nous comprendre de cette façon.
											Il y a de bons moments, il y a des moments intéressants,
											et il y a parfois un peu de stress aussi.
											Vous voulez faire des voitures, vous devez sortir.
											Vous devez faire des voitures sous la pluie, vous devez faire des voitures dans la neige.
											C'est, soit dit en passant, une présentation que nous avons faite devant notre conseil d'administration.
											Nous les avons trainés dans la neige aussi. Vous voulez connaitre les voitures à l'extérieur?
											Eh bien, vous devez être dehors pour faire ça.
											Et parce que ce sont des artistes, ils ont des tempéraments très artistiques.
											Pas vrai? Maintenant une chose à propos de l'art, l'art c'est la découverte,
											et l'art c'est vous découvrir vous-même à travers votre art. Vous voyez?
											Et une chose à propos des voitures, c'est que nous sommes tous un peu comme Pygmalion,
											nous sommes complètement amoureux de nos propres créations.
											C'est un de mes tableaux préférés, il décrit vraiment notre relation avec les voitures.
											C'est incroyablement écoeurant.
									","
											Ich glaube, das ist eine Substituierung,
											der wir uns alle im Designmanagement schuldig gemacht haben.
											Und dann diese Idee, dass es mehr zu lieben gibt,
											mehr zu designen, wenn es um Ihren Nachbarn geht, Ihren Nächsten,
											das kann physisch sein, und vielleicht wird es das in der Zukunft.
											Aber im Moment geht es darum,sich mit unseren eigenen Leuten zu beschäftigen,
											unseren eigenen Teams, die für das kreative Schaffen zuständig sind. So, und nun zu meiner Geschichte.
											Wir arbeiten hier mit der Idee der Arbeit mit Menschen
											und dazu muss ich mit meinen Designern ein Band knüpfen, wenn wir BMWs entwerfen.
											Wir müssen eine gemeinsame Intimität aufbauen, eine gemeinsame Vision.
											Das bedeutet, dass wir als Familie zusammenarbeiten müssen,
											wir müssen uns als solche auffassen.
											Es gibt gute Zeiten, es gibt interessante Zeiten
											und es gibt auch manchmal stressige Zeiten.
											Wenn man Autos bauen will, muss man nach draußen gehen.
											Man muss Autos im Regen machen, man muss Autos im Schnee machen.
											Das ist übrigens eine Präsentation, die wir unserem Vorstand vorgeführt haben.
											Wir rasen auch wie verrückt draußen im Schnee. Wollen Sie wissen, wie Autos sich draußen verhalten?
											Nun, dazu muss man draußen stehen.
											Und weil das hier alles Künstler sind, haben sie auch ein künstlerisches Temperament.
											Alles klar? Eine Sache zum Thema Kunst: Kunst ist Entdeckung
											und Kunst ist es, sich selbst durch seine Kunst zu entdecken. Richtig?
											Und was Autos betrifft, sind wir alle ein bisschen wie Pygmalion,
											wir sind völlig verliebt in unsere eigenen Geschöpfe.
											Dies hier ist eines meiner Lieblingsgemälde, das wirklich unsere Beziehung zu Autos beschreibt.
											Das ist unglaublich krank.
									",Great cars are great art,Chris Bangle,20:04,"business,cars,design,industrial design,invention,technology,transportation,art"
"
","
","
","
","
",Great cars are great art,Chris Bangle,20:04,"business,cars,design,industrial design,invention,technology,transportation,art"
"
											(Laughter)
									","
											(Risas)
									","
											Bu anlaşılanın ötesinde bir hastalık.
									","
											(Rires)
									","
											(Gelächter)
									",Great cars are great art,Chris Bangle,20:04,"business,cars,design,industrial design,invention,technology,transportation,art"
"
","
","
","
","
",Great cars are great art,Chris Bangle,20:04,"business,cars,design,industrial design,invention,technology,transportation,art"
"
											But because of this, the intimacy with which we work together as a team
											takes on a new dimension, a new meaning.
											We have a shared center; we have a shared focus —
											that car stays at the middle of all our relationships.
											And it's my job, in the competitive process, to narrow this down.
											I heard today about Joseph's death genes
											that have to go in and kill cell reproduction.
											You know, that's what I have to do sometimes.
											We start out with 10 cars; we narrow it down to five cars,
											down to three cars, down to two cars, down to one car,
											and I'm in the middle of that killing, basically.
											Someone's love, someone's baby.
											This is very difficult, and you have to have a bond with your team
											that permits you to do this, because their life is wrapped up in that too.
											They've got that gene infected in them as well,
											and they want that to live, more than anything else.
									","
											Pero debido a esto, la intimidad con la que trabajamos juntos como equipo
											adquiere una nueva dimensión, un nuevo significado.
											Tenemos un centro compartido, tenemos un foco común,
											de que el coche permanece en el centro de todas nuestras relaciones.
											Y es mi trabajo, en el proceso competitivo, limitar esto.
											Hoy escuché hablar de los genes de la muerte de Joseph
											que tienen que entrar y matar la reproducción de las células.
											Sabes, es lo que tengo que hacer a veces.
											Empezamos con diez coches, lo reducimos a cinco,
											a tres coches, a dos coches, a un coche,
											y yo estoy en el medio de esa matanza, básicamente.
											El amor de alguien, el bebé de alguien.
											Esto es muy difícil, y tienes que tener un vínculo con tu equipo
											que te permite hacerlo, porque su vida está también contenida en ello.
											Tienen ese gen contagiado dentro de ellos también,
											y quieren que viva, más que cualquier otra cosa.
									","
											Bu nedenle, grup olarak çalışmamızı sağlayan samimiyet
											yeni bir boyut ve anlam kazanıyor.
											Ortak bir odak noktamız ve hedefimiz var,
											arabalar ilişkimizin tam ortasında duruyor.
											Ve benim işim rekabet sürecinde, bu mesafeyi daraltmak.
											Bugün Joseph'in ölü genleriyle ilgili bir şey duydum
											ki bunlar içeri girip hücrelerin yeniden oluşmasını engelliyorlarmış.
											Bilirsiniz, bazen benim de yapmam gereken şey bu.
											10 arabayla başlarız, sonra 5'e indiririz,
											sonra 3, sonra iki ve sonra bire,
											ve ben bu ortadan kaldırma işinin tam ortasındayım.
											Başkasının aşkı, başkasının bebeği.
											Bu çok zor, ve ekibinizle aranızda bir bağ olması lazım
											ki bunu yapabilesiniz, çünkü onların hayatları da bundan ibaret.
											Bu hastalıklı genlerden onlarda da var,
											ve bu genler yaşamayı herşeyden daha fazla istiyor.
									","
											Mais de ce fait, l'intimité avec laquelle nous travaillons ensemble comme une équipe
											prend une nouvelle dimension, un sens nouveau.
											Nous avons un centre commun, nous avons tous un objectif commun,
											que la voiture reste au centre de toutes nos relations.
											Et c'est mon travail, dans le processus concurrentiel, de restreindre ça.
											J'ai entendu aujourd'hui parler des gènes de mort de Joseph
											qui doivent entrer et tuer la reproduction cellulaire.
											Vous savez, c'est ce que je dois faire parfois.
											Nous commençons avec 10 voitures, nous réduisons à cinq voitures,
											à trois voitures, à deux voitures, à une voiture,
											et je suis au milieu de cette mise à mort, au fond.
											L'amour de quelqu'un, le bébé de quelqu'un.
											C'est très difficile, et vous devez avoir un lien avec votre équipe
											qui vous permet de faire cela, parce que leur vie tourne autour de ça aussi.
											Ils ont ce gène infecté en eux aussi,
											et ils veulent que cela vive, plus que toute autre chose.
									","
											Aber gerade deswegen nimmt die Intimität, mit der wir als Team zusammenarbeiten
											eine neue Dimension an, eine neue Bedeutung.
											Wir haben ein gemeinsames Zentrum, einen gemeinsamen Fokus,
											das Auto bildet den Mittelpunkt unserer Beziehungen.
											Und in diesem Prozess des Wettbewerbs ist es mein Job, das einzuengen.
											Ich habe heute von Josephs Todesgenen gehört,
											die reingehen und die Zellproduktion töten müssen.
											Wissen Sie, genau das muss ich auch manchmal tun.
											Wir fangen mit 10 Autos an, grenzen es auf 5 Autos ein,
											auf drei, auf zwei, auf eins,
											und ich bin gewissermaßen mittendrin in dieser Schlachterei.
											Jemandes Geliebte, jemandes Baby.
											Das ist sehr schwierig, und man braucht dazu dieses Band mit dem Team,
											damit man das tun kann, denn auch das Leben der Teammitglieder dreht sich ganz darum.
											Auch auch sie tragen dieses infizierte Gen in sich,
											und sie wollen, dass es lebt, mehr als alles andere.
									",Great cars are great art,Chris Bangle,20:04,"business,cars,design,industrial design,invention,technology,transportation,art"
"
","
","
","
","
",Great cars are great art,Chris Bangle,20:04,"business,cars,design,industrial design,invention,technology,transportation,art"
"
											Well, this project, Deep Blue, put me in contact with my team
											in a way that I never expected, and I want to pass it on to you,
											because I want you to reflect on this, perhaps in your own relationships.
											We wanted to a do a car which was a complete leap of faith for BMW.
											We wanted to do a team which was so removed from the way we'd done it,
											that I only had a phone number that connected me to them.
											So, what we did was: instead of having a staff of artists that are just your wrist,
											we decided to free up a team of creative designers and engineers
											to find out what's the successor to the SUV phenomenon in America.
											This is 1996 we did this project. And so we sent them off with this team name,
											Deep Blue. Now many people know Deep Blue from IBM —
											we actually stole it from them because we figured
											if anybody read our faxes they'd think we're talking about computers.
											It turned out it was quite clever because Deep Blue,
											in a company like BMW, has a hook — ""Deep Blue,"" wow, cool name.
											So people get wrapped up in it. And we took a team of designers,
											and we sent them off to America. And we gave them a budget,
											what we thought was a set of deliverables,
											a timetable, and nothing else.
											Like I said, I just had a phone number that connected me to them.
									","
											Bien, este proyecto, Deep Blue me puso en contacto con mi equipo
											de un modo que nunca esperé, y quiero compartirlo con vosotros,
											porque quiero que reflexionéis sobre esto, tal vez en vuestras propias relaciones.
											Queríamos hacer un coche que fuese un completo acto de fe para BMW.
											Queríamos crear un equipo que estuviese tan alejado del modo en que lo habíamos hecho,
											que sólo tenía un número de teléfono que me conectaba a ellos.
											Así que, lo que hicimos fue que en lugar de tener a un grupo de artistas que son básicamente tu muñeca,
											decidimos liberar un equipo de diseñadores creativos e ingenieros
											para encontrar el suceso del fenómeno 4x4 en EE.UU.
											Es en 1996 cuando hicimos este proyecto. Así que los enviamos con su nombre de equipo,
											Deep Blue. Ahora mucha gente conoce Deep Blue por IBM,
											en realidad lo robamos de ellos porque pensamos
											que si alguien leía nuestros faxes pensarían que estábamos hablando de ordenadores.
											Resultó ser bastante inteligente porque Deep Blue,
											en una compañía como BMW, tiene gancho — Deep Blue, guau, buen nombre.
											Así que la gente se involucró en él. Y cogimos a un equipo de diseñadores,
											y los enviamos a EE.UU. Y les dimos un presupuesto,
											lo que pensamos que era un conjunto de entregas,
											un calendario, y nada más.
											Como dije, sólo tenía un número de teléfono que me conectaba a ellos.
									","
											Yani, bu proje, Deep Blue, ekibimle aramda bağlantı kurdu
											bu hiç ummadığım bir şeydi ve bunu size aktarmak istiyorum,
											çünkü bunu ilişkilerinize yansıtmanızı, dahası uyarlamanızı istiyorum.
											BMW için tam bir inanç sıçraması olacak bir araba yapmak istedik.
											Daha önce yaptıklarımızdan arınmış çok daha farklı bir ekip kurmak istedik,
											beni onlara bağlayan tek şey bir telefon numarasıydı.
											Böylece, yaptığımız, sadece bileğiyle çalışan sanatçılardan oluşan bir ekip yerine
											Amerika daki Arazi araçları fenomeninin varisini bulmak için
											yaratıcı tasarımcılar ve mühendislerden oluşan özgür bir ekip yaratmak oldu.
											Bu 1996 yılında gerçekleştirdiğimiz bir projeydi. Ve onları Deep Blue ismiyle uğurladık.
											Şimdi pek çok insan Deep Blue adını IBM sayesinde biliyor,
											aslına bakılırsa bu ismi onlardan çaldık çünkü düşündük ki
											eğer birisi fakslarımızı okursa bizim bilgisayarlardan bahsettiğimizi zanneder.
											Bunun çok akıllıca olduğunu gördük çünkü Deep Blue,
											BMW gibi bir firma için çok akılda kalıcı — Deep Blue, vay, harika isim.
											İnsanlar buna çabucak alıştı. Sonra tasarımcılardan oluşan bir ekip kurup
											onları Amerika'ya gönderdik. Ve onlara sadece bir bütçe,
											bir dizi bilgisayar çıktısı,
											bir zaman çizelgesi verdik.
											Dediğim gibi, beni onlara bağlayan tek şey bir telefon numarasıydı.
									","
											Eh bien, ce projet, Deep Blue, m'a mis en contact avec mon équipe
											d'une manière que je n'attendais pas, et je tiens à vous le transmettre,
											parce que je veux que vous réfléchissiez à ça , peut-être dans vos propres relations.
											Nous voulions faire une voiture qui soit un acte de foi complet pour BMW.
											Nous voulions faire une équipe qui soit tellement éloignée de la façon dont nous l'avions fait,
											que je n'avais qu'un numéro de téléphone qui me reliait à eux.
											Donc, ce que nous avons fait au lieu d'avoir un groupe d'artistes qui soient vos exécutants,
											nous avons décidé de libérer une équipe de designers et d'ingénieurs créatifs
											pour savoir quel serait le successeur du phénomène SUV en Amérique.
											C'est en 1996 que nous avons fait ce projet. Et nous les avons donc envoyés avec ce nom d'équipe,
											Deep Blue. Maintenant, beaucoup de gens connaissent Deep Blue d'IBM,
											nous leur avons volé le nom parce que nous avons pensé
											que si quelqu'un lisait nos télécopies ils penseraient que nous parlions d'ordinateurs.
											Il s'est avéré que c'était très futé parce que Deep Blue,
											dans une entreprise comme BMW, a une accroche - Deep Blue, wow, cool comme nom.
											Donc, les gens se sont investis. Et nous avons pris une équipe de designers,
											et nous les avons envoyés en Amérique. Et nous leur avons donné un budget,
											ce que nous pensions être un ensemble de choses à faire,
											un calendrier, et rien d'autre.
											Comme je l'ai dit, je n'avais qu'un numéro de téléphone qui me reliait à eux.
									","
											Nun, dieses Projekt Deep Blue brachte mich mit meinem Team in Kontakt
											auf eine Weise, die ich niemals erwartet hätte, und ich möchte das an Sie weitergeben,
											weil ich möchte, dass Sie darüber nachdenken, vielleicht in ihren eigenen Beziehungen.
											Wir wollten ein Auto machen, das ein vollkommenes Glaubensbekenntnis für BMW sein würde.
											Wir wollten ein Team zusammenstellen, das so weit weg sein sollte von der Art, wie wir sonst arbeiten,
											dass ich nur eine Telefonnummer hatte, die mich mit den Mitgliedern verband.
											Wir taten also Folgendes: Anstelle einer Belegschaft von Künstlern lediglich als eine Art Handgelenk zu beschäftigen,
											entschieden wir, ein Team von kreativen Designern und Ingenieuren loszulassen,
											um herauszufinden, was der Nachfolger des SUV-Phänomens in Amerika sein würde.
											Dieses Projekt haben wir 1996 gemacht. Und so schickten wir sie los mit diesem Teamnamen
											Deep Blue. Nun, viele kennen Deep Blue von IBM.
											Genau genommen haben wir den Namen von IBM gestohlen, weil wir dachten,
											dass, sollte jemand tatsächlich unsere Faxnachrichten lesen, er denken würde, wir redeten über Computer.
											Es stellte sich heraus, dass das recht schlau war, denn Deep Blue
											wurde in einem Unternehmen wie BMW ein echter Gassenhauer — Deep Blue, wow, cooler Name.
											Und so wurden wir ganz in die Sache verstrickt. Wir nahmen ein Designerteam
											und schickten es nach Amerika. Wir gaben Ihnen ein Budget,
											etwas, von dem wir dachten, dass es sich um Vorgaben handelte,
											einen Zeitplan und sonst nichts.
											Wie gesagt, ich hatte nur eine Telefonnummer, um mich mit ihnen in Verbindung zu setzen.
									",Great cars are great art,Chris Bangle,20:04,"business,cars,design,industrial design,invention,technology,transportation,art"
"
","
","
","
","
",Great cars are great art,Chris Bangle,20:04,"business,cars,design,industrial design,invention,technology,transportation,art"
