en,tr,pt,title,speaker,duration,tags
"
											Education is one side of a coin.
											The other is family planning:
											access to high-quality,
voluntary reproductive health care.
											To have children by choice
rather than chance
											is a matter of autonomy and dignity.
											Yet in the US,
											45 percent of pregnancies are unintended.
											Two hundred and fourteen million women
in lower-income countries
											say they want to decide whether
and when to become pregnant
											but aren't using contraception.
											Listening to women's needs,
											addressing those needs,
											advancing equity and well-being:
											those must be the aims
of family planning, period.
											Curbing the growth of our human population
											is a side effect, though a potent one.
											It could dramatically reduce demand
for food, transportation, electricity,
											buildings, goods and all the rest,
											thereby reducing emissions.
											Close the gaps on access
to education and family planning,
											and by mid-century, we may find
one billion fewer people inhabiting earth
											than we would if we do nothing more.
											According to Project Drawdown,
											one billion fewer people
could mean we avoid
											nearly 120 billion tons of emissions.
											At that level of impact,
											gender equity is a top solution
to restore a climate fit for life.
											At that level of impact,
											gender equity is on par with wind turbines
											and solar panels and forests.
											There is life force in learning
											and life force in choice.
									","
											Eğitim paranın bir yüzü.
											Diğer yüzü ise aile planlaması:
											yüksek kalitede, gönüllü 
doğum kontrolüne ulaşım.
											Kazaradan ziyade
isteyerek çocuk sahibi olmak
											bağımsızlık ve itibar meselesi.
											Fakat ABD'de,
											gebeliklerin %45'i istek dışı.
											Düşük gelirli ülkelerde 240 milyon kadın
gebe kalmak isteyip istemediğine
											ve ne zaman gebe kalmak
istediğine karar vermek istiyor
											fakat kontrasepsiyon kullanmıyor.
											Kadınların ihtiyaçlarını dinlemek,
											bu ihtiyaçlara dikkat çekmek,
											eşitliği ve refahı sağlamak:
											Bunlar aile planlamasında eğilinmesi
gereken temel esaslar.
											Etkili olmasına rağmen 
nüfus artışının frenlenmesi
											bir tür yan etki.
											Besin, ulaşım, elektrik, konut, ürünler
ve diğer her şeye olan ihtiyacı
											ve buna bağlı olarak da salınımı
											büyük ölçüde azaltabilir.
											Eğitimin ve aile planlamasının önündeki
engelleri kaldırın bu sayede hiçbir şey
											yapılmadığı takdirde dünyaya gelecek
bir milyar insanın
											dünyaya gelmesinin önüne geçebiliriz.
											Drawdown projesine göre
											bir milyar daha az insan
yaklaşık 120 milyar ton daha az
											salınıma neden olabilir.
											Bu düzeyde bir etkide
											cinsiyet eşitliği yaşam için iklim
düzenini yenilemekte temel çözüm.
											Bu düzeyde bir etkide
											cinsiyet eşitliği rüzgar türbinleri,
güneş panelleri
											ve ormanlarda aynı düzeyde öneme sahip.
											Öğrenmede ve seçim yapmakta
											hayat enerjisi vardır.
									","
											ainda há 130 milhões de raparigas
sem direito a frequentar a escola.
											As lacunas são maiores
nas salas de aula do ensino secundário.
											Muitas raparigas estão a perder
uma base vital para a vida.
											A educação significa melhor saúde
para as mulheres e seus filhos,
											uma segurança financeira melhor,
											uma maior atuação em casa e na sociedade,
											uma maior capacidade de navegar
num mundo com um clima em mudança.
											A educação pode significar opções,
adaptabilidade, força.
											Também pode significar menos emissões.
											Por uma série de razões,
											quando temos mais anos de educação,
											habitualmente optamos
por nos casarmos mais tarde
											e termos menos filhos.
											Então, as nossas famílias
acabam por ser mais pequenas.
											O que acontece a nível individual
afeta o mundo ao longo do tempo.
											Um por um, por um,
											o direito de ir à escola tem impacto
na quantidade de seres humanos no planeta
											e afeta os seus sistemas vivos.
											Não é por isso que as raparigas
devem ser educadas.
											É um resultado significativo.
											A educação é um dos lados da moeda.
									",How empowering women and girls can help stop global warming,Katharine Wilkinson,13:48,"climate change,biosphere,nature,women,education,science,sustainability,policy,farming,communication"
"
","
","
",How empowering women and girls can help stop global warming,Katharine Wilkinson,13:48,"climate change,biosphere,nature,women,education,science,sustainability,policy,farming,communication"
"
											Now, let me be clear:
											this does not mean women and girls
are responsible for fixing everything.
									","
											İzninizle daha açık olayım:
											Bu kadınların ve kızların her şeyi
düzeltmesi gerektiği anlamına gelmiyor.
									","
											O outro é o planeamento familiar:
											o acesso a cuidados de saúde
reprodutiva, de alta qualidade.
											Ter filhos por escolha
em vez de por acaso
											é uma questão de autonomia e dignidade.
											Contudo, nos EUA, 45% das gravidezes
não são intencionais.
											Uns 214 milhões de mulheres
nos países de baixos rendimentos
											dizem que querem decidir
se querem engravidar e quando,
											mas não usam métodos de contraceção.
											Ouvir as necessidades das mulheres,
											abordar essas necessidades,
											avançar com igualdade e bem-estar:
											esses devem ser os objetivos
do planeamento familiar, ponto final.
											Reprimir o crescimento da população humana
											é um efeito colateral, embora potente.
											Poderia reduzir drasticamente a procura
de comida, transportes, eletricidade,
											edifícios, bens e todo o resto,
											reduzindo assim as emissões.
											Fechemos as lacunas do acesso
à educação e ao planeamento familiar
											e em meados do século, podemos encontrar
menos mil milhões de pessoas na Terra
											do que encontraríamos
se não fizermos nada.
											De acordo com o Projeto Drawdown,
									",How empowering women and girls can help stop global warming,Katharine Wilkinson,13:48,"climate change,biosphere,nature,women,education,science,sustainability,policy,farming,communication"
"
","
","
",How empowering women and girls can help stop global warming,Katharine Wilkinson,13:48,"climate change,biosphere,nature,women,education,science,sustainability,policy,farming,communication"
"
											(Laughter)
									","
											(Kahkahalar)
									","
											mil milhões de pessoas a menos
poderia significar que evitássemos
											quase 120 mil milhões
de toneladas de emissões.
											Nesse nível de impacto,
											a igualdade de género
é uma solução de ponta
											para restaurar um clima apto para a vida.
											Nesse nível de impacto,
											a igualdade de género está
a par das turbinas eólicas,
											dos painéis solares e das florestas.
											Há força vital na aprendizagem
											e uma força vital na escolha.
											Agora, deixem-me ser clara:
									",How empowering women and girls can help stop global warming,Katharine Wilkinson,13:48,"climate change,biosphere,nature,women,education,science,sustainability,policy,farming,communication"
"
","
","
",How empowering women and girls can help stop global warming,Katharine Wilkinson,13:48,"climate change,biosphere,nature,women,education,science,sustainability,policy,farming,communication"
"
											Though we probably will.
									","
											Fakat muhtemelen biz yapacağız.
									","
											isso não significa que as mulheres
são responsáveis por consertar tudo.
											(Risos)
									",How empowering women and girls can help stop global warming,Katharine Wilkinson,13:48,"climate change,biosphere,nature,women,education,science,sustainability,policy,farming,communication"
"
","
","
",How empowering women and girls can help stop global warming,Katharine Wilkinson,13:48,"climate change,biosphere,nature,women,education,science,sustainability,policy,farming,communication"
"
											(Laughter)
									","
											(Kahkahalar)
									","
											Embora provavelmente o façamos.
									",How empowering women and girls can help stop global warming,Katharine Wilkinson,13:48,"climate change,biosphere,nature,women,education,science,sustainability,policy,farming,communication"
"
","
","
",How empowering women and girls can help stop global warming,Katharine Wilkinson,13:48,"climate change,biosphere,nature,women,education,science,sustainability,policy,farming,communication"
"
											(Applause)
									","
											(Alkış)
									","
											(Risos)
									",How empowering women and girls can help stop global warming,Katharine Wilkinson,13:48,"climate change,biosphere,nature,women,education,science,sustainability,policy,farming,communication"
"
","
","
",How empowering women and girls can help stop global warming,Katharine Wilkinson,13:48,"climate change,biosphere,nature,women,education,science,sustainability,policy,farming,communication"
"
											Equity for women in agriculture,
education and family planning:
											these are solutions within a system
of drawdown solutions.
											Together, they comprise
a blueprint of possibility.
											And let me be even clearer about this:
											population cannot be seen in isolation
from production or consumption.
											Some segments of the human family
cause exponentially greater harm,
											while others suffer outsized injustice.
											The most affluent —
											we are the most accountable.
											We have the most to do.
									","
											Tarımda, eğitimde ve aile planlamasında
kadınlar için eşitlik:
											Bunlar Drowdown projesi
içerisindeki çözümler.
											Hep birlikte ihtimal
tasarımlarını içeriyorlar.
											Bu konuda daha da açık
olmama izin verin:
											Toplum üretimden
ve tüketimden soyutlanamaz.
											Bazı aile segmentleri üssel
bir zarara neden olurken
											diğerleri aşırı düzeyde
adaletsizliğe maruz kalıyor.
											En zengini —
											en sorumlu olan biziz.
											En çok yapılacak şeye
sahip olan biziz.
									","
											(Aplausos)
											A igualdade para as mulheres
											na agricultura, na educação
e no planeamento familiar:
									",How empowering women and girls can help stop global warming,Katharine Wilkinson,13:48,"climate change,biosphere,nature,women,education,science,sustainability,policy,farming,communication"
"
","
","
",How empowering women and girls can help stop global warming,Katharine Wilkinson,13:48,"climate change,biosphere,nature,women,education,science,sustainability,policy,farming,communication"
"
											The gender-climate connection
extends beyond negative impacts
											and beyond powerful solutions.
											Women are vital voices
and agents for change on this planet,
											and yet we're too often missing
or even barred from the proverbial table.
											We're too often ignored
or silenced when we speak.
											We are too often passed over
											when plans are laid or investments made.
											According to one analysis,
											just 0.2 percent of philanthropic funds
											go specifically towards women
and the environment,
											merely 110 million dollars globally,
											the sum spent by one man
on a single Basquiat painting last year.
											These dynamics are not only unjust,
they are setting us up for failure.
											To rapidly, radically reshape society,
											we need every solution and every solver,
											every mind,
											every bit of heart,
											every set of hands.
									","
											Cinsiyetle iklimin bağlantısı negatif
etkilerin ve güçlü çözümlerin
											ötelerine uzanıyor.
											Kadınlar dünyanın değişimi için
hayati önem arz ediyorlar fakat
											biz sıklıkla dillere destan bu masadan
onları men ediyor veya kaçırıyoruz.
											Bizler sıklıkla susturuluyor 
veya göz ardı ediliyoruz.
											Planlar ortaya serildiğinde
											veya yatırımlar yapıldığında
sıklıkla boş veriliyoruz.
											Bir analize göre:
											İnsani yardım fonlarından yalnızca %0,2'si
											kadınlara ve çevreye gidiyor,
											dünya çapında yalnızca
110 milyon dolar olan bu para
											tek bir adam tarafından bir Basquiat 
tablosuna harcanan paraya eşdeğer.
											Bu dinamikler sadece adaletsiz değil,
aynı zamanda bizi başarısızlığa götürüyor.
											Toplumu hızlı ve kökten 
yeniden tasarlayabilmemiz için
											her çözüme ve çözücüye,
											her fikre,
											her bir kalbe,
											her bir ele ihtiyacımız var.
									","
											estas são soluções dentro de um sistema
de soluções de redução.
											Juntas, elas englobam
um modelo de possibilidade.
											E deixem-me ser ainda mais clara:
											a população não pode ser vista
isoladamente da produção ou do consumo.
											Alguns segmentos da família humana
causam danos exponencialmente maiores,
											enquanto outros
sofrem uma injustiça desmedida.
											Os mais ricos, somos os mais responsáveis.
											Nós temos mais possibilidades de agir.
											A ligação género-clima
vai além dos impactos negativos
									",How empowering women and girls can help stop global warming,Katharine Wilkinson,13:48,"climate change,biosphere,nature,women,education,science,sustainability,policy,farming,communication"
"
","
","
",How empowering women and girls can help stop global warming,Katharine Wilkinson,13:48,"climate change,biosphere,nature,women,education,science,sustainability,policy,farming,communication"
"
											We often crave a simple call to action,
											but this challenge demands
more than a fact sheet
											and more than a checklist.
											We need to function
more like an ecosystem,
											finding strength in our diversity.
											You know what your superpowers are.
											You're an educator, farmer, healer,
creator, campaigner, wisdom-keeper.
											How might you link arms where you are
											to move solutions forward?
									","
											Biz harekete geçmek için
ufak bir çağrı için can atıyoruz
											ama bu yarış bir bilgi
formundan veya bir listeden
											daha fazlasını istiyor.
											Gücü kendi faklılığında bulan 
ekosistem gibi
											hareket etmemiz gerekiyor.
											Özel güçlerimizin neler
olduğunu biliyorsunuz.
											Sizler bir eğitimci, çiftçi, sağlıkçı,
tasarımcı, özgürlük savaşçısısınız.
											Çözüm odaklı yürüyebilmek için
											nasıl omuz omuza vermelisiniz?
									","
											e além de soluções poderosas.
											As mulheres são vozes vitais
e agentes de mudança neste planeta,
											contudo, muitas vezes estamos ausentes
											ou somos mesmo afastadas
da mesa das decisões.
											Somos muitas vezes ignoradas
ou silenciadas quando falamos.
											Nós somos muitas vezes preteridas
											quando são lançados projetos
ou são feitos investimentos.
											De acordo com uma análise,
											apenas 0,2% dos fundos filantrópicos
											vão especificamente para as mulheres
e para o meio ambiente,
											uns meros 110 milhões de dólares
em todo o mundo,
											a soma gasta por um homem
numa pintura de Basquiat, no ano passado.
											Estas dinâmicas não são apenas injustas,
											elas estão a preparar-nos para o fracasso.
											Para reformular a sociedade,
rápida e radicalmente,
											precisamos de todas as soluções
e de todos os solucionadores
											todas as mentes
											todos os pedaços de coração
											todos os conjuntos de mãos.
											Nós geralmente ansiamos
por um simples chamamento à ação,
									",How empowering women and girls can help stop global warming,Katharine Wilkinson,13:48,"climate change,biosphere,nature,women,education,science,sustainability,policy,farming,communication"
"
","
","
",How empowering women and girls can help stop global warming,Katharine Wilkinson,13:48,"climate change,biosphere,nature,women,education,science,sustainability,policy,farming,communication"
"
											There is one role I want to ask
that all of you play:
											the role of messenger.
											This is a time of great awakening.
											We need to break the silence
around the condition of our planet;
											move beyond manufactured debates
about climate science;
											share solutions;
											speak truth with a broken-open heart;
											teach that to address climate change,
we must make gender equity a reality.
											And in the face of
a seemingly impossible challenge,
											women and girls are
a fierce source of possibility.
									","
											Hepinizin oynadığı bir rol hakkında 
istirhamda bulunuyorum:
											elçi rolü.
											Bu harika bir uyanış zamanı.
											Gezegenimizin durumu etrafındaki
sessizliği yıkmamız gerekiyor;
											iklim bilimi hakkında hazırdaki
tartışmaların ilerisine gitmeli;
											çözümleri paylaşmalı;
											açık bir kaple doğruları konuşmalı;
iklim değişikliğinin üzerine gitmek için
											bunu öğretmeliyiz, bizler cinsiyet
eşitliğini bir gerçek haline getirmeliyiz.
											İmkânsız gibi görünen bir yarışın eşiğinde
											kadınlar ve kızlar
müthiş bir çözüm ihtimali.
									","
											mas este desafio exige
mais do que uma folha de factos
											e mais do que uma lista de verificação.
											Nós precisamos de funcionar
como um ecossistema,
											encontrando força na nossa diversidade.
											Vocês sabem quais são
os vossos superpoderes.
											Vocês são professoras,
agricultoras, curadoras,
											criadoras, ativistas,
defensores da sabedoria.
											Como podem estender as mãos
onde vocês estão
											para levar as soluções para a frente?
											Há um papel que eu gostaria
que todos desempenhassem:
									",How empowering women and girls can help stop global warming,Katharine Wilkinson,13:48,"climate change,biosphere,nature,women,education,science,sustainability,policy,farming,communication"
"
","
","
",How empowering women and girls can help stop global warming,Katharine Wilkinson,13:48,"climate change,biosphere,nature,women,education,science,sustainability,policy,farming,communication"
"
											It is a magnificent thing to be alive
											in a moment that matters so much.
											This earth,
											our home,
											is calling for us to be bold,
											reminding us we are all
in this together —
											women, men,
											people of all gender identities,
											all beings.
											We are life force,
											one earth,
											one chance.
											Let's seize it.
									","
											Çok şey ifade eden böyle bir zamanda
											hayatta olmak muhteşem bir şey.
											Bu dünya,
											evimiz
											cesaretli olmamamızı istiyor,
											hepimizin bir bütün olduğunu
hatırlatıyor—
											kadınlar, erkekler,
											her cinsiyet kimliğinden insan,
											bütün varlıklar.
											Bizler yaşam enerjisiyiz
											tek bir dünya,
											tek bir şans.
											Bu şansı değerlendirelim.
									","
											o papel do mensageiro.
											Este é um momento de grande despertar.
											Precisamos de quebrar o silêncio
em torno da situação do nosso planeta;
											ir além dos debates fabricados
sobre a ciência do clima;
											partilhar soluções;
											falem a verdade com o coração aberto;
											para lidar com a mudança climática,
											devemos tornar realidade`
a igualdade de género.
											E perante um desafio
aparentemente impossível,
											as mulheres e as raparigas
são uma forte fonte de possibilidade.
											É uma coisa magnífica estar vivo
									",How empowering women and girls can help stop global warming,Katharine Wilkinson,13:48,"climate change,biosphere,nature,women,education,science,sustainability,policy,farming,communication"
"
","
","
",How empowering women and girls can help stop global warming,Katharine Wilkinson,13:48,"climate change,biosphere,nature,women,education,science,sustainability,policy,farming,communication"
"
											Thank you.
									","
											Teşekkür ederim.
									","
											num momento tão importante.
											Esta Terra,
											a nossa casa,
											está a chamar-nos para sermos ousadas,
											lembrando a todos nós
que estamos juntos nisto,
											mulheres, homens,
											pessoas de todas as identidades de género,
											todos os seres.
											Nós somos uma força vital,
											uma Terra,
											uma probabilidade.
											Vamos aproveitar isso.
											Obrigada.
									",How empowering women and girls can help stop global warming,Katharine Wilkinson,13:48,"climate change,biosphere,nature,women,education,science,sustainability,policy,farming,communication"
"
","
","
",How empowering women and girls can help stop global warming,Katharine Wilkinson,13:48,"climate change,biosphere,nature,women,education,science,sustainability,policy,farming,communication"
"
											(Applause)
									","
											(Alkışlar)
									","
											(Aplausos)
									",How empowering women and girls can help stop global warming,Katharine Wilkinson,13:48,"climate change,biosphere,nature,women,education,science,sustainability,policy,farming,communication"
"
","
","
",How empowering women and girls can help stop global warming,Katharine Wilkinson,13:48,"climate change,biosphere,nature,women,education,science,sustainability,policy,farming,communication"
