en,es,tr,fr,de,title,speaker,duration,tags
"
											It's the first sense you use
when you're born.
											One out of every fifty of your genes
is dedicated to it.
											It must be important, right?
											Okay, take a deep breath
through your nose.
											It's your sense of smell,
											and it's breathtakingly powerful.
											As an adult, you can distinguish
about 10,000 different smells.
											Here's how your nose does it.
											Smell starts when you sniff molecules
from the air into your nostrils.
											95% of your nasal cavity
											is used just to filter that air
before it hits your lungs.
											But at the very back of your nose
											is a region called
the olfactory epithelium,
											a little patch of skin
that's key to everything you smell.
											The olfactory epithelium has
a layer of olfactory receptor cells,
											special neurons that sense smells,
											like the taste buds of your nose.
											When odor molecules hit
the back of your nose,
											they get stuck in a layer of mucus
covering the olfactory epithelium.
											As they dissolve, they bind
to the olfactory receptor cells,
											which fire and send signals
through the olfactory tract
											up to your brain.
											As a side note, you can tell a lot
											about how good
an animal's sense of smell is
											by the size of its olfactory epithelium.
											A dog's olfactory epithelium
											is 20 times bigger
than your puny human one.
											But there's still a lot we don't know
about this little patch of cells, too.
											For example, our olfactory
epithelium is pigmented,
											and scientists don't really know why.
											But how do you actually tell
the difference between smells?
											It turns out that your brain has
											40 million different
olfactory receptor neurons,
											so odor A might trigger
											neurons 3, 427, and 988,
											and odor B might trigger
											neurons 8, 76, and 2,496,678.
											All of these different combinations
											let you detect a staggeringly
broad array of smells.
											Olfactory neurons are always fresh
and ready for action.
											They're the only neuron in the body
that gets replaced regularly,
											every four to eight weeks.
											Once they are triggered,
the signal travels through a bundle
											called the olfactory tract
											to destinations all over your brain,
making stops in the amygdala,
											the thalamus, and the neocortex.
											This is different from how sight
and sound are processed.
											Each of those signals goes first
to a relay center
											in the middle of the cerebral hemisphere
											and then out to other
regions of the brain.
											But smell, because it evolved
before most of your other senses,
											takes a direct route
to these different regions of the brain,
											where it can trigger
your fight-or-flight response,
											help you recall memories,
or make your mouth water.
											But even though we've all got
the same physiological set-up,
											two nostrils and millions
of olfactory neurons,
											not everybody smells the same things.
											One of the most famous examples of this
											is the ability to smell
so-called ""asparagus pee.""
											For about a quarter of the population,
											urinating after eating asparagus
											means smelling a distinct odor.
											The other 75% of us don't notice.
											And this isn't the only case
of smells differing from nose to nose.
											For some people, the chemical
androstenone smells like vanilla;
											to others, it smells like sweaty urine,
											which is unfortunate
											because androstenone is commonly found
in tasty things like pork.
											So with the sweaty urine smellers in mind,
											pork producers will castrate male pigs
											to stop them from making androstenone.
											The inability to smell a scent
is called anosmia,
											and there are about 100 known examples.
											People with allicin anosmia
can't smell garlic.
											Those with eugenol anosmia
can't smell cloves.
											And some people can't smell anything
											at all.
											This kind of full anosmia
could have several causes.
											Some people are born
without a sense of smell.
											Others lose it after an accident
or during an illness.
											If the olfactory epithelium
gets swollen or infected,
											it can hamper your sense of smell,
											something you might have experienced
when you were sick.
											Not being able to smell anything
can mess with your other senses, too.
											Many people who can't smell at all
											also can't really taste
the same way the rest of us do.
											It turns out that how something tastes
is closely related to how it smells.
											As you chew your food,
air is pushed up your nasal passage,
											carrying with it the smell of your food.
											Those scents hit your olfactory epithelium
											and tell your brain a lot
about what you're eating.
											Without the ability to smell,
you lose the ability to taste
											anything more complicated
than the five tastes
											your taste buds can detect:
											sweet, salty,
											bitter, sour, and savory.
											So, the next time you smell exhaust fumes,
											salty sea air, or roast chicken,
											you'll know exactly how you've done it
											and, perhaps, be a little more
thankful that you can.
									","
											Es el primer sentido 
que usas cuando naces.
											Uno de cada cincuenta de tus genes
											se dedica a ello.
											Debe ser importante, ¿verdad?
											Muy bien, respira profundo
											a través de tu nariz.
											Es el sentido del olfato,
											y es increíblemente poderoso.
											Como adulto puedes distinguir
											unos 10 000 olores diferentes.
											Así es como lo hace la nariz.
											El olor comienza 
cuando aspiras las moléculas
											del aire que pasan a las fosas nasales.
											El 95% de tu cavidad nasal
											se utiliza para filtrar el aire
											antes de que llegue a tus pulmones.
											Pero en el fondo de la nariz
											hay una región llamada 
el epitelio olfativo,
											un pequeño parche de piel
											que es la clave para todo lo que hueles.
											El epitelio olfativo tiene una capa
											de células receptoras olfativas,
											neuronas especiales que perciben olores,
											como las papilas gustativas de tu nariz.
											Cuando las moléculas de olor 
llegan a la parte posterior de tu nariz,
											se quedan atrapadas en una capa de moco
											que cubre el epitelio olfativo.
											Conforme se disuelven,
											se unen a las células receptoras olfativas,
											que se activan y envían señales
											a través del tracto olfativo
											hasta tu cerebro.
											Como nota adicional,
											se puede predecir
											el buen sentido del olfato de un animal
											por el tamaño de su epitelio olfativo.
											El epitelio olfativo de un perro
											es 20 veces mayor
											que tu débil epitelio humano.
											Pero todavía hay mucho que no sabemos
											sobre este pequeño parche de células.
											Por ejemplo, nuestro epitelio olfativo 
está pigmentado,
											y los científicos 
no saben realmente por qué.
											Pero en realidad, ¿cómo diferencias
											los olores?
											Resulta que tu cerebro tiene
											40 millones de neuronas receptoras 
olfativas diferentes,
											así que el olor A podría desencadenar 
las neuronas 3, 427 y 988,
											y el olor B podría activar 
las neuronas 8, 76 y 2 496 678.
											Todas estas combinaciones diferentes
											te permiten detectar 
una asombrosamente amplia gama de olores.
											Además, las neuronas olfativas 
están siempre frescas
											y listas para la acción.
											Son las únicas neuronas en el cuerpo
											que se reemplazan con regularidad,
											cada cuatro a ocho semanas.
											Una vez que estas neuronas se activan,
											la señal viaja a través de un haz
											llamado el tracto olfativo
											a destinos en todo el cerebro,
											haciendo paradas en la amígdala,
											el tálamo,
											y el neocórtex.
											Esto es diferente
											de cómo se procesa la visión y el sonido.
											Cada una de esas señales primero va
											a un centro de retransmisión
											en medio del hemisferio cerebral
											y luego a otras regiones del cerebro.
											Pero el sentido del olfato 
como evolucionó
											antes que la mayoría 
de los otros sentidos,
											toma una ruta directa
											a estas diferentes regiones del cerebro
											dónde puede desencadenar 
la respuesta de lucha o huida,
											ayudar a remontar recuerdos
											o hacerte salivar.
											Pero a pesar de que todos tenemos
											la misma configuración fisiológica,
											dos orificios nasales 
y millones de neuronas olfativas,
											no todo el mundo huele las mismas cosas.
											Uno de los ejemplos más famosos
											es la capacidad de oler 
la llamada ""orina de espárragos"".
											Para alrededor 
de un cuarto de la población,
											la orina después de comer espárragos
											tiene un olor inconfundible.
											El restante 75% de nosotros no lo nota.
											Y este no es el único caso
											de olores que cambian de nariz a nariz.
											Para algunas personas,
											el químico androstenona huele a vainilla;
											para otros, huele a orina sudada,
											lo que es desafortunado
											porque comúnmente 
se encuentra androstenona
											en cosas suculentas
como la carne de cerdo.
											Así que con los olfateadores 
de orina sudada en mente,
											los productores de cerdo 
castran a los cerdos machos
											para impedirles producir androstenona.
											La incapacidad para percibir un aroma
											se llama anosmia,
											y hay unos 100 ejemplos conocidos.
											Personas con anosmia alicina 
no pueden oler el ajo.
											Aquéllos con anosmia eugenol 
no pueden oler el clavo.
											Y algunas personas no pueden oler nada
											en absoluto.
											Este tipo de anosmia absoluta
											puede tener varias causas.
											Algunas personas nacen 
sin sentido del olfato.
											Otros lo pierden después de un accidente
											o durante una enfermedad.
											Si el epitelio olfativo 
se inflama o se infecta,
											puede obstaculizar tu sentido del olfato,
											algo que podrías haber experimentado
											cuando te enfermas.
											Y no ser capaz de oler nada
											puede también interferir 
con los otros sentidos.
											Mucha gente que no puede oler
											realmente tampoco puede degustar
											como el resto de nosotros.
											Resulta que como sabe algo
											está estrechamente relacionado 
con como huele.
											Mientras masticas la comida,
											el aire es empujado hacia arriba 
a tu tabique nasal,
											llevando consigo el olor de los alimentos.
											Esos aromas llegan a tu epitelio olfativo
											y le dicen mucho a tu cerebro
											acerca de lo que estás comiendo.
											Sin la habilidad de oler,
											pierdes la posibilidad de saborear
											algo más complejo
											que los cinco sabores
											que tus papilas gustativas 
pueden detectar:
											dulce,
											salado,
											amargo
											agrio
											y sabroso o umami.
											Así que la próxima vez que huelas 
el humo de escapes,
											el mar salado,
											o un pollo asado,
											sabrás exactamente cómo lo has hecho,
											y tal vez estés un poco más agradecido 
de que puedas hacerlo.
									","
											Doğduğunuzda kullandığınız ilk duyu.
											Her elli geninizden birisi bu
											duyuya ait.
											Önemli bir duyu olmalı değil mi?
											Burnunuzdan derin bir
											nefes alın.
											Koku duyunuzdan bahsediyorum.
											Bu duyu müthiş bir şekilde güçlü.
											Yetişkin birisi olarak on bin
											farklı kokuyu ayırt edebilirsiniz.
											Burnunuzun bunu nasıl yaptığına bir bakalım.
											Koku, havadaki molekülleri burun
											deliklerinize çektiğinizde başlar.
											Burun boşluğunuzun %95'i
											havayı akciğerlerinize ulaşmadan
											filtrelemek için kullanılır.
											Fakat burnunuzun en gerisinde,
											ufak bir deri parçası bulunduğu olfaktör epitel
											adı verilen bir bölge vardır.
											Bu bölge kokladığınız her şeyin anahtarıdır.
											Olfaktör epitel üzerinde olfaktör algılayıcı
											hücrelerden oluşan bir tabaka bulunur.
											Bu hücreler kokuku alan özel nöronlardır.
											Bir bakıma burnunuzun tat alma organı.
											Koku molekülleri burnunuzun gerisine çarptığında
											olfaktör epiteli kaplayan mukus
											tabakasına yapışırlar.
											Koku molekülleri dağıldıkça
											olfaktör algılayıcı hücrelere bağlanırlar.
											Bu hücreler olfaktör yol boyunca
											beyine kadar sinyalleri
											ateşler ve gönderir.
											Ayrıca
											olfaktör epitelinin
											boyutuna bakarak bir hayvanın koku duyusunun
											ne kadar iyi olduğunu anlayabilirsiniz.
											Bir köpeğin olfaktör epiteli
											cılız insan burnundakine
											oranla 20 kat daha büyüktür.
											Fakat bu ufak deri parçası hakkında
											hala bilmediğimiz birçok şey vardır.
											Örneğin, bizdeki olfaktör epitel pigmentlidir ve
											bilim adamları bunun nedenini bilmezler.
											Fakat nasıl oluyor da kokular arasındaki farkı
											ayırt edebiliyoruz?
											Beyninizde kırk milyon farklı
											olfaktör algılayıcı nöron bulunmaktadır. Yani
											A kokusu 3., 427. ve 988. nöronları tetiklerken
											B kokusu 8.,76., ve 2.496.678. nöronları tetikleyebilir.
											Tüm bu farklı kombinasyonlar şaşılacak
											kadar geniş bir koku yelpazesini algılamanızı sağlar.
											Ayrıca olfaktör nöronlar her zaman canlı ve
											işe hazırdırlar.
											Olfaktör nöronlar vücutta her 4-8
											haftada bir düzenli olarak
											yenilenen tek nöronlardır.
											Bu nöronlar harekete geçirildiğinde
											sinyal, olfaktör yolu adı verilen
											bir demetten
											beyindeki bütün noktalara doğru hareket eder.
											Bu arada amigdaladan
											talamustan
											ve neokorteksten geçer.
											Bu, görme ve
											duyma duyularının işleyişinden farklıdır.
											Bu sinyallerin her biri önce
											serebral yarımkürenin
											ortasındaki röle merkezinden geçer ve
											ardından beyindeki diğer bölgelere dağılır.
											Fakat koku, çoğu diğer duyudan
											önce evrimleştiği için bu farklı beyin
											bölgelerine doğrudan ulaşır.
											Koku bu bölgelerde 'dövüş ya da kaç'
											tepkisini tetikleyebilir, hatıraları
											hatırlamanıza yardımcı olabilir
											veya ağzınızı sulandırabilir.
											Fakat hepimizdeki fizyolojik kurgunun
											aynı olmasına; hepimizde iki burun
											deliği ve milyonlarda olfaktör nöronları olmasına rağmen
											herkes aynı kokuları almaz.
											En ünlü örneklerinden biri sözde
											asparagus idrağını koklama becerisidir.
											Nüfusun yaklaşık olarak çeyreği
											asparagus yedikten sonra idrara
											çıktığında belirgin bir koku alır.
											Diğer %75'imiz bu kokuyu almaz.
											Ayrıca bu, burundan buruna değişen
											kokular için tek örnek değildir.
											Bazıları için
											kimyasal androstenon vanilla gibi kokarken
											diğerleri için ağır idrar gibi kokar.
											Bu talihsiz bir durumdur;
											çünkü androstenon genellikle domuz eti gibi lezzetli
											yemeklerde bulunur.
											Ağır idrar kokusu nedeniyle
											et üreticileri androstenon salgısını
											engellemek için erkek domuzları kısırlaştırır.
											Bir kokuyu alamama durumuna
											anozmi adı verilir.
											Anozmiye ilişkin bilinen yüz civarı örnek vardır.
											Allicin anozmisi olan kişiler sarımsak kokusunu duymaz.
											Öjenol anozmisi olanlar karanfil kokusunu duymaz.
											Bazıları ise hiçbir kokuyu
											almaz.
											Bu tür tam anozminin
											birçok nedeni olabilir.
											Bazı insanlar koku duyusu olmadan doğarlar.
											Diğerleri bu duyuyu bir kazadan sonra
											veya hastalık nedeniyle kaybeder.
											Olfaktör epitel şişerse veya iltihaplanırsa
											koku duyunuzu engelleyebilir.
											Bu durumu hastayken deneyimlemiş
											olabilirsiniz.
											Hiçbir kokuyu alamama diğer
											duyularınızı da etkileyebilir.
											Hiçbir koku alamayan birçok kişi
											aynı zamanda diğerlerimiz gibi tat
											duyusunu da alamaz.
											Bir şeyin tadı, kokusu ile
											yakından ilişkilidir.
											Yemeğinizi çiğnerken
											yemeğinizin kokusunu taşıyan hava
											burun yolunuzdan yukarıya doğru itilir.
											Bu kokular olfaktör epitelinize çarpar ve
											beyninize yediğiniz şey
											hakkında birçok bilgi verir.
											Koku yeteneğiniz yoksa
											beş tattan daha karmaşık
											tatları alma yeteneğinizi de
											kaybedersiniz.
											Tat alma organınız
											tatlıyı
											tuzluyu, acıyı
											ve baharatlıyı
											ekşiyi
											algılayabilir.
											Bir dahaki sefer egzoz dumanını, tuzlu deniz
											havasını veya
											fırında tavuğu kokladığınızda
											bu nasıl yaptığınızı tam olarak bileceksiniz ve
											belki de koku duyunuz için biraz daha minnettar olacaksınız.
									","
											C'est le premier sens 
qu'on utilise dès la naissance.
											Un de vos gènes sur 50
											y est consacré.
											Ça doit être important, n'est-ce pas ?
											Bon, respirez un grand coup
											par le nez.
											C’est votre odorat,
											et c'est extrêmement puissant.
											Un adulte peut faire la différence
											entre près de 10 000 odeurs différentes.
											Voilà comment fait votre nez.
											L'odorat commence 
quand vous reniflez des molécules
											parmi l'air dans vos narines
											95 pour cent de la cavité nasale
											ne sert qu'à filtrer cet air
											avant qu'il n'atteigne les poumons,
											mais tout au fond de votre nez
											se trouve l'épithélium olfactif,
											une petite zone de peau
											qui est la clé vers tout 
ce que vous pouvez sentir.
											L'épithélium olfactif a une couche
											de cellules olfactives réceptrices,
											des neurones spécifiques 
qui détectent les odeurs,
											comme les papilles gustatives 
de votre nez.
											Quand les molécules touchent 
le fond de votre nez,
											elles sont coincées 
dans une couche de mucus
											qui recouvre l'épithélium olfactif.
											En se dissolvant,
											elles se fixent aux cellules réceptrices,
											qui s'activent et envoient des signaux
											via le pédoncule olfactif
											jusqu'au cerveau.
											Par ailleurs, on peut savoir
											assez précisément
											la qualité de l'odorat d'un animal
											d'après la taille 
de son épithélium olfactif.
											Celui d'un chien
											est 20 fois plus grand
											que le nôtre, tout petit.
											Mais il y a encore beaucoup 
de choses à découvrir
											dans ce petit amas de cellules.
											Par exemple, notre épithélium olfactif 
est pigmenté,
											et les scientifiques 
ne savent pas vraiment pourquoi.
											Mais comment fait-on la différence
											entre deux odeurs ?
											En fait, notre cerveau possède
											40 millions de neurones récepteurs olfactifs,
											Une odeur A va déclencher 
les neurones 3, 427, et 988,
											alors que B va déclencher 
les neurones 8, 76, et 2 496 678.
											Toutes ces différentes combinaisons
											vous permettent de détecter 
un nombre impressionnant d'odeurs.
											En plus, vos neurones récepteurs 
sont toujours neufs
											et prêts à l'action.
											Ce sont les seuls neurones
											à être remplacés régulièrement,
											toutes les 4 à 8 semaines.
											Une fois ces neurones activés,
											le signal est transmis par un axone
											appelé le pédoncule olfactif
											vers différentes régions du cerveau,
											en passant par l'amygdale,
											le thalamus,
											et le néocortex.
											C'est différent
											pour le son et la vue.
											Chacun de ces signaux passe d'abord
											par un centre relais
											au milieu de l'hémisphère cérébral
											puis vers les autres régions du cerveau.
											Mais l'odorat, qui a évolué
											avant la plupart de nos autres sens,
											arrive directement
											dans ces différentes parties du cerveau,
											où il peut déclencher 
la réponse combat-fuite,
											vous aider à retrouver des souvenirs
											ou vous faire saliver.
											Mais même si nous avons tous
											la même configuration physiologique,
											deux narines 
et des millions de neurones olfactifs,
											nous ne sentons pas les mêmes choses.
											Un des exemples les plus connus est
											de pouvoir sentir 
l'odeur ""d'asperge"" de l'urine.
											Pour près d'un quart de la population,
											uriner après avoir mangé des asperges
											a une odeur spécifique.
											Les 75 pour cent restants ne remarquent rien.
											Et ce n'est pas le seul cas d'odeurs
											qui diffèrent d'un nez à l'autre.
											Pour certains,
											la molécule androstérone 
sent la vanille ;
											pour d'autres, 
elle sent l'urine,
											ce qui est dommage,
											car l'androstérone 
est souvent présente
											dans de bonnes choses 
comme la viande de porc.
											Donc, pour ceux qui sentent l'urine,
											les éleveurs castrent les porcs
											pour les empêcher 
de produire de l'androstérone.
											Le fait de ne pouvoir sentir une odeur
											est appelé anosmie,
											et on en connaît près de 100 exemples.
											L'anosmie de l'allicine 
vous empêche de sentir l'ail.
											Celle de l'eugénol : 
les clous de girofle.
											Et certaines personnes 
ne sentent rien
											du tout.
											Ce genre d'anosmie complète
											peut avoir plusieurs causes.
											Certains naissent sans odorat.
											D'autres le perdent après un accident
											ou une maladie.
											Si l'épithélium olfactif est enflé ou infecté,
											cela peut gêner votre odorat,
											ce que vous avez peut être constaté
											quand vous étiez malade.
											Ne pas pouvoir sentir
											peut aussi gêner vos autres sens.
											Beaucoup de ceux qui n'ont pas d'odorat
											n'ont pas le même goût
											que les autres.
											Le goût d'un aliment est
											intimement lié à son odeur.
											Quand on mâche son repas,
											on pousse de l'air en arrière du palais,
											qui transporte l'odeur des aliments.
											Ces odeurs atteignent 
l'épithélium olfactif
											et donne à votre le cerveau 
beaucoup d'informations
											sur ce que vous mangez.
											Sans odorat,
											on ne perçoit rien de plus
											complexe que
											les cinq saveurs
											que les papilles gustatives reconnaissent :
											le sucré,
											le salé,
											acide,
											l'amer,
											et le savoureux, ou umami.
											Alors, la prochaine fois que 
vous sentirez des pots d'échappement,
											l'air iodé de la mer,
											ou un poulet rôti,
											vous saurez exactement 
comment vous avez fait
											et peut-être apprécierez-vous 
encore plus de pouvoir le faire.
									","
											Er ist der erste Sinn,
den wir bei der Geburt verwenden.
											Eines von fünfzig Genen
											widmet sich diesem Sinn.
											Also muss er wichtig sein, stimmt's?
											Gut. Atme tief
											durch deine Nase ein.
											Das ist dein Geruchssinn
											und der ist atemberaubend kraftvoll.
											Als Erwachsener kannst du
											ungefähr 10 000 verschiedene
Gerüche unterscheiden.
											So funktioniert es.
											Geruch beginnt, wenn du Moleküle
											aus der Luft in deine 
Nasenhöhlen schnüffelst.
											95 % deiner Nasenhöhlen
											werden allein darauf verwendet,
Luft zu filtern,
											bevor sie in deine Lunge dringt.
											Aber ganz weit hinten in deiner Nase
											findet sich eine Region, die sich
""olfaktorisches Epithel"" nennt,
											ein kleiner Hautbereich,
											der der Schlüssel zu allem ist,
was du riechst.
											Das olfaktorische Epithel
besitzt eine Schicht
											olfaktorischer Rezeptoren,
											spezielle Neuronen,
die Gerüche wahrnehmen,
											quasi die Geschmacksknospen 
deiner Nase.
											Wenn Duftmoleküle auf den
hinteren Bereich deiner Nase treffen,
											bleiben sie in einer 
Schleimschicht kleben,
											die das olfaktorische Epithel bedeckt.
											Wenn sie sich auflösen,
											binden sie sich an die
olfaktorischen Rezeptoren,
											die losfeuern und Signale senden
											durch den olfaktorischen Trakt
											hinauf ins Gehirn.
											Nebenbei bemerkt,
											kann man anhand der Größe des
olfaktorischen Epithels
											viel darüber erfahren,
											wie gut der Geruchssinn eines Tieres ist.
											Das olfaktorische Epithel eines Hundes
											ist 20 Mal größer
											als dein mickriges menschliches.
											Aber es gibt auch noch vieles, 
das wir noch nicht
											über diesen kleinen Zellteppich wissen.
											Unser olfaktorisches Epithel
ist beispielsweise pigmentiert
											und Wissenschaftler wissen 
auch nicht, warum das so ist.
											Aber wie kann man eigentlich
den Unterschied
											zwischen Gerüchen erkennen?
											Wie sich gezeigt hat,
verfügt das Gehirn
											über 40 Millionen verschiedene
olfaktorische Rezeptorneuronen,
											Geruch A könnte also die Neuronen
3, 427 und 988 auslösen,
											und Geruch B könnte die Neuronen
8, 76 und 2 496 678 auslösen.
											All diese verschiedenen Kombinationen
											lassen dich ein gigantisches Spektrum
an Gerüchen wahrnehmen.
											Deine olfaktorischen Neuronen
sind immer frisch
											und bereit, in Aktion zu treten.
											Sie sind das einzige Neuron im Körper,
											das regelmäßig ausgetauscht wird,
											alle vier bis acht Wochen.
											Werden diese Neuronen einmal ausgelöst,
											wandert das Signal durch ein Bündel,
											den olfaktorischen Trakt,
											hin zu Zielorten überall im Gehirn
											mit Zwischenhalten in der Amygdala,
											dem Thalamus
											und dem Neocortex.
											Das funktioniert anders
											als die Verarbeitung 
des Sehens und Hörens.
											Jedes dieser Signale gelangt zunächst
											zu einer Schaltzentrale
											im Zentrum der zerebralen Hemisphäre
											und dann hinaus zu
anderen Regionen des Gehirns.
											Aber der Riechsinn — weil er sich
											vor den meisten unserer anderen Sinnen 
herausgebildet hat —
											nimmt den Direktweg
											zu diesen verschiedenen
Regionen im Gehirn,
											in denen es deine
											Kampf-oder-Flucht-Reaktion auslösen kann,
											dir hilft, Erinnerungen hervorzurufen,
											oder das Wasser in deinem Mund
zusammenlaufen lässt.
											Aber selbst, wenn wir alle
											die gleichen körperlichen
Voraussetzungen haben,
											zwei Nasenlöcher und
Millionen olfaktorische Neuronen,
											riecht nicht jeder das gleiche.
											Eines der bekanntesten Beispiele dafür
											ist die Fähigkeit, den sogenannten
""Spargelpinkel"" zu riechen.
											Für etwa ein Viertel der Bevölkerung,
											heißt Urinieren nach dem Spargelverzehr
											das Riechen eines bestimmten Geruchs.
											Die anderen 75 % von uns
nehmen ihn nicht wahr.
											Das ist nicht der einzige Fall,
											in dem sich Gerüche
von Nase zu Nase unterscheiden.
											Für manche Menschen
											riecht dieses chemische
Androstenon nach Vanille;
											für andere riecht es
nach schwitzigem Urin,
											was sehr schade ist,
											denn Androstenon
findet sich üblicherweise
											in schmackhaften Dingen
wie Schweinefleisch.
											Mit Rücksicht auf die Urin-Riecher
											werden Schweinefleischhersteller
also Eber kastrieren,
											um sie davon abzuhalten,
Androstenon zu produzieren.
											Die Unfähigkeit, 
einen Duft riechen zu können,
											nennt sich ""Anosmie""
											und es gibt ca. 100 bekannte Muster.
											Menschen mit Allicin-Anosmie
können keinen Knoblauch riechen.
											Solche mit Eugenol-Anosmie
können keine Gewürznelken riechen.
											Und manche Menschen
können gar nichts riechen,
											absolut nichts.
											Diese Art der vollständigen Anosmie
											könnte mehrere Ursachen haben.
											Manche Menschen werden
ohne Geruchssinn geboren.
											Andere verlieren ihn
nach einem Autounfall
											oder während einer Krankheit.
											Wenn das olfaktorische Epithel 
anschwillt oder sich infiziert,
											kann dies deinen Geruchssinn 
einschränken,
											wie du vielleicht schon erlebt hast,
											als du krank warst.
											Und nicht in der Lage zu sein,
irgendetwas zu riechen,
											kann auch deine 
anderen Sinne beeinflussen.
											Viele Menschen, die überhaupt
nichts riechen können,
											können auch nicht so gut schmecken
											wie der Rest von uns.
											Es hat sich gezeigt, dass der
Geschmack einer Sache
											eng mit dessen Geruch zusammenhängt.
											Wenn du dein Essen kaust,
											wird Luft durch 
deinen Nasenrachen gedrückt,
											der den Geruch deiner Nahrung 
in sich trägt.
											Diese Düfte treffen auf dein
olfaktorisches Epithel
											und erzählen deinem Gehirn 
einiges darüber,
											was du gerade isst.
											Ohne die Fähigkeit zu riechen,
											verlierst du die Fähigkeit,
etwas zu schmecken,
											das komplexer ist
											als die fünf
Geschmacksrichtungen,
											die deine Geschamcksknospen
wahrnehmen können:
											süß,
											salzig,
											sauer,
											bitter
											und herzhaft.
											Das nächste Mal also,
wenn du Abgase riechst,
											salzige Seeluft,
											oder gebratenes Hähnchen,
											dann weißt du jetzt genau,
wie das funktioniert
											und bist vermutlich etwas 
dankbarer dafür, dass du es kannst.
									",How do we smell?,Rose Eveleth,4:04,"TED-Ed,animation,smell,human body,science,biology,physiology"
