en,es,title,speaker,duration,tags
"
","
",How peer educators can transform sex education,Thea Holcomb,4:23,"sex,gender,education,youth,relationships"
"
											Greetings audience,
I'm Thea, I'm a high school student,
											and today we're going to talk about sex.
											[It won't be too scary.]
											Operating on the assumption you're human,
you've certainly heard of sex.
											In case you haven't, 
to get you up to speed,
											sex is the process
by which many organisms
											ensure their continued existence.
											Here's the thing though:
											sex is more complicated than that
											because - spoiler alert! -
humans are complicated.
											So how do we learn about sex
if it's so complicated?
											You might remember
sex education like this:
											[Don't have sex;
you will get PREGNANT and die.]
											Urban Dictionary - your source
for news and information
											about the 21st century zeitgeist -
describes sex education as:

											"".. where they try to
scare you out of having sex
											with pictures of diseased genitals...""
											A more hopeful description
of sex education would be something like:
											a lifelong process of learning
about sex and sexuality,
											exploring values and beliefs
and gaining skills
											to navigate relationships
and manage your sexual health.
											This, as far as I'm concerned,
is a solid definition.
											So what can we do to make
sex education something
											that teens find
actually, like, educational.
											Clearly, teens need answers
to their questions.
											Where do people go
when they have questions?
											[The Internet]
											Listen, I love the Internet.
											It's one of the greatest developments
in human information exchange.
											[Yes. Thanks Internet.]
											But what it says about sexual health
											is not accurate by any
stretch of the imagination
											or is so laden with bias that it feels
more like being pelted with judgement
											than actually receiving information.
											Unfortunately, not every teen
is willing and able
											to chat it up with
their parents about sex.
											So if not always the Internet,
where can teens turn?
											Enter the peer educator.
											People my age do, indeed,
talk to each other about sex.
											So when teens are sources
of accurate information,
											it spreads among us quickly.
											As a peer educator, I belong to a program
											that gives me the tools
to learn about everything
											from STIs and safe sex
to contraception and consent.
											Basically, I can tell you more about
human sexuality than the average adult.
											When teens see someone like me
instead of someone older,
											they're quite open to the information
I have to offer them.
											At lunch once, some friends
wanted to know the difference
											between hormonal and copper IUDs.
											So I brought this to the table.
											Another day, my teacher didn't understand
how emergency contraception works.
											So I explained it to the class.
											What does it look like when teens
ask me questions about sexual health?
											It goes something like this.
											Venereal disease, STD, STI?
This terminology, it baffles me.
											STI stands for sexually
transmitted infection.
											We used to say STD, which stood
for sexually transmitted disease,
											but it was changed recently
											because STI is a more
medically accurate term,
											and taking away
the big scary word ""disease""
											helps decrease stigma.
											What the heck is trichomoniasis?
											Well, trichomoniasis is a STI usually
spread through vaginal intercourse.
											It's curable with just
one dose of an oral drug.
											Common symptoms,
regardless of a person's sex,
											are unusual discharge,
painful urination and itching.
											But it spreads really quickly
											because most of the time
it's asymptomatic,
											which means people
don't realize they have it.
											That's why it's so important
to get tested regularly.
											Is it OK to be gay?
											Yes, all people of all identities
and backgrounds,
											including on the LGBTQ+ spectrum,
											can live healthy and productive lives.
											Regardless of your beliefs,
											everyone has the right to explore
and express their sexuality
											without the fear of shame or judgement.
											Thanks!
											So often, when my peers approach me
with questions like these,
											seeking this or that piece of information,
											at least a sliver of what they're
wondering is: ""Am I normal?""
											So let's talk about normal.
											Part of the point of peer education
											is to give teens
the opportunity to understand
											that there is no such thing
as the elusive ""normal.""
											Peer educators are here to say
they're armed with information
											that empowers you
to make informed decisions;
											you are going to be OK.
											""Normal"" isn't really necessary.
											When you can get accurate,
											judgement-free information
from your peers,
											you realize that sex-ed
doesn't have to be scary.
											So instead of striving to be normal,
											let's talk to each other.
											Since peer education allows sex-ed
to reach the community
											in ways that go far beyond
pictures of diseased genitals,
											it turns out to be pretty brilliant.
											An idea that, unlike trichomoniasis,
is certainly worth spreading.
									","
											Saludos a todos. Hola, soy Thea, 
estudiante de secundaria,
											y hoy, vamos a hablar de sexo.
											[NO SERÁ MUY ESTREMECEDOR]
											Teniendo en cuenta que son humanos,
seguramente han escuchado hablar de sexo.
											En caso contrario, para ponerles al día,
											es el proceso por el cual
muchos organismos
											garantizan su continuidad.
											Sin embargo, la cosa es
											que el sexo es algo más complejo
											porque —advertencia—
los humanos somos complicados.
											Así que, ¿cómo aprendemos
de sexo si es tan difícil?
											Seguro que recuerdan
la educación sexual como:
											[NO TENGAS SEXO. QUEDARÁS
EMBARAZADA Y MORIRÁS]
											Diccionario Urbano: su fuente
de información y noticias
											del espíritu del siglo XXI, 
describe la educación sexual como:
											""... una forma de asustarte,
por tener sexo,
											con fotos de genitales infectados...""
											Una descripción más esperanzadora
de la educación sexual sería:
											un modo de aprendizaje de por vida
sobre sexo y sexualidad,
											explorando valores y creencias
y ganando destrezas
											para entender las relaciones
y manejar su salud sexual.
											Esto, en mi opinión,
es una definición consolidada.
											¿Y qué podemos hacer
para que la educación sexual
											les parezca, de hecho,
instructiva a los adolescentes?
											Está claro, que ellos necesitan respuestas.
											¿Adónde acude la gente que tiene preguntas?
											[INTERNET]
											A ver, me encanta internet.
											Uno de los mayores desafíos
en el intercambio de información humana.
											[SÍ. GRACIAS INTERNET]
											Pero lo que dice de la salud sexual,
											no es exacto por mucha imaginación
que se echara
											o está tan repleto de prejuicios
que parece más bien que nos juzgan
											en vez de darnos información.
											Por desgracia, hay
adolescentes que ni quieren
											ni tratan de hablar
de sexo con sus padres.
											Y si no es siempre en Internet,
¿dónde pueden mirar?
											El método de educadores entre pares.
											La gente de mi edad,
de hecho, habla de sexo.
											Y cuando los jóvenes son
fuente de información,
											esta se extiende enseguida.
											Educando a otros jóvenes,
estoy en un programa
											que me proporciona
las herramientas para aprender
											sobre las ITS, el sexo seguro,
la anticoncepción y el consentimiento.
											En esencia, puedo contarles más de 
la sexualidad que un adulto corriente.
											Los adolescentes, al verme a mí
y no a alguien más mayor,
											están muy receptivos
ante la información que les ofrezco.
											Una vez comiendo, unos amigos
querían saber la diferencia
											entre el DIU hormonal y el de cobre.
											Así que les comenté mi perspectiva.
											Otra, mi profesor no sabía cómo funcionaba
un anticonceptivo de emergencia.
											Y yo se lo expliqué a la clase.
											¿Qué les parece cuando los adolescentes
me preguntan sobre la salud sexual?
											Es de la forma siguiente:
											¿Enfermedades venéreas, ETS, ITS?
Toda esta terminología me desconcierta.
											ITS significa infección
de transmisión sexual.
											Se solía decir ETS, que significa
enfermedad de transmisión sexual,
											pero lo cambiaron hace poco
											porque ITS es un término
médicamente más preciso
											y eliminar la alarmante 
palabra ""enfermedad"",
											ayuda a reducir el estigma.
											¿Qué narices es tricomoniasis?
											Bueno, tricomoniasis es una ITS que suele
transmitirse a través del coito vaginal.
											Se puede curar con solo una dosis
de un medicamento por vía oral.
											Los síntomas comunes,
independientemente del sexo,
											son secreción inusual,
dolor al orinar y comezón.
											Pero se extiende rápidamente
											porque la mayoría de las veces
es asintomática,
											o sea, la gente no se da cuenta
de que la tiene.
											Por eso, es muy importante
hacerse pruebas a menudo.
											¿Está bien ser gay?
											Sí, todo el mundo,
de cualquier identidad y origen,
											incluyendo el espectro LGBTQ+,
											puede vivir una vida 
saludable y productiva.
											Al margen de sus creencias,
											todo el mundo tiene derecho
a explorar y mostrar su sexualidad
											sin miedo a ser avergonzado o juzgado.
											¡Gracias!
											A menudo, cuando mis compañeros
se me acercan con este tipo de preguntas
											buscando cualquier información,
											en parte, lo que se están
preguntando es: ""¿Soy normal?""
											Hablemos, pues, de lo normal.
											Parte de la educación entre pares
											es darle a los adolescentes
la oportunidad de entender
											que no existe tal cosa
como la elusiva ""normalidad"".
											Los educadores de pares
disponemos de la información
											que les faculta a Uds. a tomar
decisiones informadas.
											Les irá bien.
											La ""normalidad"" no se necesita en realidad.
											Al lograr información veraz
											y sin juicios morales de otros compañeros,
											ven que la educación sexual
no ha de ser temerosa.
											Así que en vez de esforzarse
por ser normal,
											hablemos entre nosotros.
											La educación entre pares, al dar acceso
a la comunidad a una educación sexual
											en formas que van más allá
de las fotos de genitales infectados,
											resulta ser bastante excepcional.
											A diferencia de la tricomoniasis,
es una idea que vale la pena difundir.
									",How peer educators can transform sex education,Thea Holcomb,4:23,"sex,gender,education,youth,relationships"
"
","
",How peer educators can transform sex education,Thea Holcomb,4:23,"sex,gender,education,youth,relationships"
