en,es,fr,title,speaker,duration,tags
"
","
","
",How we can predict the next financial crisis,Didier Sornette,17:01,"business,economics,global issues,prediction,markets"
"
											Once upon a time
											we lived in an economy of financial growth and prosperity.
											This was called the Great Moderation,
											the misguided belief by most economists,
											policymakers and central banks
											that we have transformed into a new world
											of never-ending growth and prosperity.
											This was seen by robust and steady GDP growth,
											by low and controlled inflation,
											by low unemployment,
											and controlled and low financial volatility.
									","
											Érase una vez
											una economía en la que vivíamos con crecimiento financiero y prosperidad.
											Se le llamó la Gran Moderación,
											la creencia equivocada de la mayoría de los economistas,
											las autoridades y los bancos centrales
											de que habíamos logrado un nuevo mundo
											de incesante crecimiento y prosperidad.
											Esto se creyó por el crecimiento robusto y estable del PIB,
											por una inflación baja y controlada,
											por bajo desempleo,
											y por una volatilidad financiera controlada y baja.
									","
											Il était une fois,
											nous vivions dans une économie 
de croissance financière et de prospérité.
											C'est ce qu'on appelait
la Grande Modération,
											la croyance erronée qu'avaient 
la plupart des économistes,
											des décideurs et des banques centrales
											que nous étions devenus 
un nouveau monde
											de croissance et de prospérité sans fin.
											C'était avéré par la croissance 
robuste et stable du PIB,
											par une inflation faible et contrôlée,
											par un faible taux de chômage,
											et une volatilité financière 
contrôlée et faible.
									",How we can predict the next financial crisis,Didier Sornette,17:01,"business,economics,global issues,prediction,markets"
"
","
","
",How we can predict the next financial crisis,Didier Sornette,17:01,"business,economics,global issues,prediction,markets"
"
											But the Great Recession in 2007 and 2008,
											the great crash, broke this illusion.
											A few hundred billion dollars of losses in the financial sector
											cascaded into five trillion dollars
											of losses in world GDP
											and almost $30 trillion losses
											in the global stock market.
									","
											Pero la gran recesión del 2007 y 2008,
											la gran crisis, rompió esta ilusión.
											Unas pérdidas de 100 mil millones de dólares en el sector financiero
											llevó a detrimentos en cascada de
											5 billones de dólares en el PIB mundial
											y casi 30 billones de pérdidas
											en los mercados de valores mundiales.
									","
											Mais la Grande Récession 
en 2007 et 2008,
											le grand krach, a brisé cette illusion.
											Quelques 100 milliards de dollars de pertes 
dans le secteur financier
											se sont transformées en 5 000 milliards de dollars
											de pertes dans le PIB mondial
											et presque 30 000 milliards de pertes
											dans le marché boursier mondial.
									",How we can predict the next financial crisis,Didier Sornette,17:01,"business,economics,global issues,prediction,markets"
"
","
","
",How we can predict the next financial crisis,Didier Sornette,17:01,"business,economics,global issues,prediction,markets"
"
											So the understanding of this Great Recession
											was that this was completely surprising,
											this came out of the blue,
											this was like the wrath of the gods.
											There was no responsibility.
											So, as a reflection of this,
											we started the Financial Crisis Observatory.
											We had the goal to diagnose in real time
											financial bubbles
											and identify in advance their critical time.
									","
											Como explicación de esta gran recesión
											se dijo que era completamente sorprendente,
											que vino de la nada,
											que provenía de la ira de los dioses.
											No hubo ninguna responsabilidad.
											Por lo tanto, como respuesta a esto,
											empezamos el Observatorio de Crisis Financieras.
											Teníamos el objetivo de diagnosticar en tiempo real
											las burbujas financieras
											e identificar con anticipación su momento crítico.
									","
											On a interprété cette grande récession
											comme une surprise totale,
											arrivée à l'improviste,
											comme si c'était la colère des dieux.
											Personne n'était responsable.
											Alors, après avoir réfléchi,
											nous avons créé 
l'Observatoire des crises financières.
											Nous avions pour objectif 
de diagnostiquer en temps réel
											les bulles financières
											et d'identifier à l'avance leur moment critique.
									",How we can predict the next financial crisis,Didier Sornette,17:01,"business,economics,global issues,prediction,markets"
"
","
","
",How we can predict the next financial crisis,Didier Sornette,17:01,"business,economics,global issues,prediction,markets"
"
											What is the underpinning, scientifically, of this financial observatory?
											We developed a theory called ""dragon-kings.""
											Dragon-kings represent extreme events
											which are of a class of their own.
											They are special. They are outliers.
											They are generated by specific mechanisms
											that may make them predictable,
											perhaps controllable.
									","
											¿Cuál es el sustento científico, de este observatorio financiero?
											Desarrollamos la teoría llamada ""dragones reyes"".
											Los dragones reyes representan eventos extremos
											que son de una clase particular.
											Son especiales, atípicos.
											Se generan por mecanismos específicos
											que pueden hacerlos predecibles,
											y tal vez controlables.
									","
											Quel est le fondement, scientifique, 
de cet Observatoire financier ?
											Nous avons développé une théorie 
appelée « rois-dragons ».
											Les rois-dragons représentent 
les événements extrêmes
											qui sont d'une classe à part.
											Ils sont spéciaux. 
Ce sont des valeurs aberrantes.
											Ils sont générés 
par des mécanismes spécifiques
											qui peuvent les rendre prévisibles,
											peut-être contrôlables.
									",How we can predict the next financial crisis,Didier Sornette,17:01,"business,economics,global issues,prediction,markets"
"
","
","
",How we can predict the next financial crisis,Didier Sornette,17:01,"business,economics,global issues,prediction,markets"
"
											Consider the financial price time series,
											a given stock, your perfect stock,
											or a global index.
											You have these up-and-downs.
											A very good measure of the risk of this financial market
											is the peaks-to-valleys that represent
											a worst case scenario
											when you bought at the top and sold at the bottom.
											You can look at the statistics, the frequency of the occurrence
											of peak-to-valleys of different sizes,
											which is represented in this graph.
											Now, interestingly, 99 percent
											of the peak-to-valleys of different amplitudes
											can be represented by a universal power law
											represented by this red line here.
											More interestingly, there are outliers, there are exceptions
											which are above this red line,
											occur 100 times more frequently, at least,
											than the extrapolation would predict them to occur
											based on the calibration of the 99 percent remaining
											peak-to-valleys.
											They are due to trenchant dependancies
											such that a loss is followed by a loss
											which is followed by a loss which is followed by a loss.
											These kinds of dependencies
											are largely missed by standard risk management tools,
											which ignore them and see lizards
											when they should see dragon-kings.
											The root mechanism of a dragon-king
											is a slow maturation towards instability,
											which is the bubble,
											and the climax of the bubble is often the crash.
											This is similar to the slow heating of water
											in this test tube reaching the boiling point,
											where the instability of the water occurs
											and you have the phase transition to vapor.
											And this process, which is absolutely non-linear —
											cannot be predicted by standard techniques —
											is the reflection of a collective emergent behavior
											which is fundamentally endogenous.
											So the cause of the crash, the cause of the crisis
											has to be found in an inner instability of the system,
											and any tiny perturbation will make this instability occur.
									","
											Consideren las series temporales de precios financieros,
											de una acción determinada, su acción preferida,
											o un índice global.
											Verán estos altibajos.
											Una muy buena medida del riesgo de este mercado financiero
											es la tendencia de pico a valle que representa
											uno de los peores escenarios
											cuando se compra en la parte superior y se vende en la parte inferior.
											Se pueden ver las estadísticas, la frecuencia de la ocurrencia
											del pico a valle de diferentes tamaños,
											representada en este gráfico.
											Ahora, curiosamente, el 99%
											de los pico a valles de diferentes amplitudes
											cumplen una ley universal de la energía
											representada por esta línea roja.
											Más interesante aún, hay comportamientos atípicos, excepciones,
											que están por encima de la línea roja,
											y que son por lo menos 100 veces más frecuentes,
											de lo que la extrapolación predeciría
											basado en una calibración del 99%
											del resto de pico a valles.
											Se deben a dependencias críticas
											como una pérdida seguida por otra pérdida
											seguida por otra, seguida por otra.
											Este tipo de dependencias
											se omiten en las herramientas de gestión de riesgo estándar,
											que las ignoran y ven lagartos
											cuando deberían ver dragones reyes.
											El mecanismo raíz de un dragón rey
											es una maduración lenta hacia la inestabilidad,
											que es la burbuja,
											y el punto culminante de la burbuja es a menudo el desplome.
											Es similar al lento calentamiento del agua,
											en este tubo de ensayo, para llegar al punto de ebullición,
											cuando se produce inestabilidad
											y se tiene la transición de fase a vapor.
											Este proceso, que es absolutamente no lineal,
											no se puede predecir por técnicas convencionales.
											Es el reflejo de un comportamiento colectivo emergente
											fundamentalmente endógeno.
											La causa del desplome, la causa de la crisis,
											tiene que buscarse en una inestabilidad interna del sistema.
											Cualquier pequeña perturbación producirá esta inestabilidad.
									","
											Considérons la série chronologique
des prix financiers,
											une action donnée, l'action parfaite,
											ou un indice mondial.
											Vous avez ces hauts et ces bas.
											Une très bonne mesure du risque 
de ce marché financier,
											ce sont les écarts qui représentent
											le scénario du pire
											quand vous avez acheté sur une crête
et vendu sur un creux.
											Vous pouvez consulter les statistiques, 
la fréquence de l'occurrence
											des écarts de différentes tailles,
											qui est représenté dans ce graphique.
											Ce qui est intéressant, c'est que 99 %
											des écarts d'amplitudes différentes
											peut être représenté 
par une loi de puissance universelle
											représentée par cette ligne rouge ici.
											Plus intéressant encore, il y a 
des valeurs aberrantes, il existe des exceptions
											qui sont au-dessus de cette ligne rouge,
											qui sont 100 fois plus fréquentes, au moins,
											que l'extrapolation ne les prédirait
											d'après l'étalonnage
											des 99 % d'écarts restants.
											Ils sont dus aux dépendances incisives
											telle qu'une perte est suivie d'une perte
											qui est suivie d'une perte 
qui est suivie d'une perte.
											Ces types de dépendances
											sont en grande partie laissés de côté
par les outils de gestion des risques standards,
											qui les ignorent et voient des lézards
											quand ils devraient voir des rois-dragons
											Le mécanisme racine d'un roi-dragon
											est une lente maturation vers l'instabilité,
											qui est la bulle,
											et le point culminant de la bulle 
est souvent le krach.
											C'est similaire à l'échauffement lent de l'eau
											dans ce tube à essai 
pour atteindre le point d'ébullition,
											où l'instabilité de l'eau se produit
											et vous avez la transition vers la vapeur.
											Et ce processus, qui n'est absolument pas linéaire,
											et ne peut être prédit par 
les techniques habituelles,
											est le reflet d'un comportement 
émergent collectif
											qui est fondamentalement endogène.
											Si on doit trouver la cause du krach, 
la cause de la crise,
											dans une instabilité interne du système,
											et toute perturbation minuscule 
déclenchera cette instabilité.
									",How we can predict the next financial crisis,Didier Sornette,17:01,"business,economics,global issues,prediction,markets"
"
","
","
",How we can predict the next financial crisis,Didier Sornette,17:01,"business,economics,global issues,prediction,markets"
"
											Now, some of you may have come to the mind
											that is this not related to the black swan concept
											you have heard about frequently?
											Remember, black swan is this rare bird
											that you see once and suddenly shattered your belief
											that all swans should be white,
											so it has captured the idea of unpredictability,
											unknowability, that the extreme events
											are fundamentally unknowable.
											Nothing can be further
											from the dragon-king concept I propose,
											which is exactly the opposite, that most extreme events
											are actually knowable and predictable.
											So we can be empowered and take responsibility
											and make predictions about them.
											So let's have my dragon-king burn this black swan concept.
									","
											Algunos de ustedes podrían pensar:
											¿no está esto relacionado con el concepto del cisne negro
											del que se oye hablar con frecuencia?
											Recuerden, el cisne negro es este pájaro raro
											que aparece repentinamente y destroza la creencia
											de que todos los cisnes son blancos;
											refleja la idea de imprevisibilidad,
											de desconocimiento, de que los acontecimientos extremos
											son fundamentalmente incognoscibles.
											Nada puede ser más alejado
											del concepto de dragón rey que propongo,
											que es exactamente lo contrario; los fenómenos más extremos
											son realmente cognoscibles y predecibles.
											Así que podemos sentirnos autorizados, asumir la responsabilidad
											y hacer predicciones sobre ellos.
											Hagamos que mi dragón rey desaparezca el concepto del cisne negro.
									","
											Il a pu venir à l'esprit 
de certains d'entre vous
											que ce n'est pas lié 
au concept de cygne noir
											dont vous avez souvent entendu parler ?
											Rappelez-vous, 
le cygne noir est cet oiseau rare
											que vous voyez une fois et
qui d'un coup fait voler en éclat votre conviction
											que tous les cygnes devraient être blancs,
											ce qui a saisi l'idée d'imprévisibilité,
											de non-connaissance, 
que les événements extrêmes
											sont fondamentalement inconnaissables.
											Rien ne peut être plus éloigné
											du concept de roi-dragon que je propose,
											qui est exactement le contraire, 
que les événements les plus extrêmes
											sont en réalité connaissables et prévisibles.
											Donc on peut être avoir le pouvoir, 
assumer la responsabilité
											et faire des prédictions à leur sujet.
											Observons mon roi-dragon brûler
ce concept de cygne noir.
									",How we can predict the next financial crisis,Didier Sornette,17:01,"business,economics,global issues,prediction,markets"
"
","
","
",How we can predict the next financial crisis,Didier Sornette,17:01,"business,economics,global issues,prediction,markets"
"
											(Laughter)
									","
											(Risas)
									","
											(Rires)
									",How we can predict the next financial crisis,Didier Sornette,17:01,"business,economics,global issues,prediction,markets"
"
","
","
",How we can predict the next financial crisis,Didier Sornette,17:01,"business,economics,global issues,prediction,markets"
"
											There are many early warning signals
											that are predicted by this theory.
											Let me just focus on one of them:
											the super-exponential growth with positive feedback.
											What does it mean?
											Imagine you have an investment
											that returns the first year five percent,
											the second year 10 percent, the third year 20 percent,
											the next year 40 percent. Is that not marvelous?
											This is a super-exponential growth.
											A standard exponential growth corresponds
											to a constant growth rate, let's say, of 10 percent
											The point is that, many times during bubbles,
											there are positive feedbacks which can be of many times,
											such that previous growths enhance,
											push forward, increase the next growth
											through this kind of super-exponential growth,
											which is very trenchant, not sustainable.
											And the key idea is that the mathematical solution
											of this class of models exhibit finite-time singularities,
											which means that there is a critical time
											where the system will break, will change regime.
											It may be a crash. It may be just a plateau, something else.
											And the key idea is that the critical time,
											the information about the critical time is contained
											in the early development of this super-exponential growth.
									","
											Hay muchas señales tempranas de advertencia
											que esta teoría predice.
											Déjenme enfocarme en una de ellas:
											el crecimiento súper exponencial con retroalimentación positiva.
											¿Qué significa?
											Imaginen que tienen una inversión
											que el primer año produce un 5%,
											el segundo año el 10%, el tercer año el 20%,
											el siguiente año el 40%. ¿No es maravilloso?
											Esto es un crecimiento súper exponencial.
											Un crecimiento exponencial estándar sería
											a una tasa de crecimiento constante, digamos, del 10%.
											El punto es que, muchas veces, en las burbujas,
											hay retroalimentaciones positivas que pueden
											superar los crecimientos anteriores,
											impulsar y aumentar el siguiente
											con este tipo de crecimiento súper exponencial,
											que es muy agudo y no es sostenible.
											La idea clave es que la solución matemática
											para esta clase de modelos presenta singularidades de tiempo finito,
											lo que significa que hay un momento crítico
											cuando el sistema colapsa, cambia el régimen.
											Puede ser un desplome. Puede ser solo una meseta o algo diferente.
											La idea clave es que el momento crítico,
											la información sobre el tiempo crítico está contenida
											en el desarrollo inicial del crecimiento súper exponencial.
									","
											Il y a de nombreux signaux d'alerte précoces
											qui sont prédits par cette théorie.
											Je voudrais juste m'attarder sur l'un d'eux :
											la croissance super-exponentielle 
avec des retours positifs.
											Qu'est-ce que ça signifie ?
											Imaginez que vous avez un investissement
											qui rapporte la première année 5%,
											la deuxième année 10 %, 
la troisième année 20 %
											l'année suivante 40 %. 
N'est-ce pas merveilleux ?
											Il s'agit d'une croissance 
super-exponentielle.
											Une croissance exponentielle standard 
correspond
											à un taux de croissance constant, 
disons, de 10 %.
											Le fait est que, souvent au cours de bulles,
											il y a des retours positifs 
qui peuvent revenir plusieurs fois,
											tels que les croissances précédentes 
améliorent,
											poussent vers l'avant, augmentent 
la croissance suivante
											grâce à ce type de croissance 
super-exponentielle,
											qui est très tranchante, non durable.
											Et l'idée maîtresse est que 
la solution mathématique
											de cette classe de modèles présente 
des singularités de temps fini,
											ce qui signifie qu'il y a un moment critique
											où le système sera en panne, 
changera de régime.
											Ça peut être un krach. Ça peut être 
seulement un plateau, quelque chose d'autre.
											Et l'idée maîtresse 
est que le moment critique,
											les informations sur le moment critique
sont contenues
											au début du développement
de cette croissance super-exponentielle.
									",How we can predict the next financial crisis,Didier Sornette,17:01,"business,economics,global issues,prediction,markets"
"
","
","
",How we can predict the next financial crisis,Didier Sornette,17:01,"business,economics,global issues,prediction,markets"
"
											We have applied this theory early on, that was our first success,
											to the diagnostic of the rupture of key elements
											on the iron rocket.
											Using acoustic emission, you know, this little noise
											that you hear a structure emit, sing to you
											when they are stressed, and reveal the damage going on,
											there's a collective phenomenon of positive feedback,
											the more damage gives the more damage,
											so you can actually predict,
											within, of course, a probability band,
											when the rupture will occur.
											So this is now so successful that it is used
											in the initial phase of [unclear] the flight.
									","
											Aplicamos esta teoría desde el principio, ese fue nuestro primer éxito,
											al diagnóstico de la ruptura de elementos clave en
											un cohete de acero.
											Con emisión acústica, ustedes saben, ese ruidito
											que emiten las estructuras. Cantan
											cuando se estresan y revelan el daño.
											Es un fenómeno colectivo de retroalimentación positiva;
											cuanto mayor el daño, mayor el que sigue.
											Entonces realmente se puede predecir,
											dentro de, por supuesto, una banda de probabilidad,
											cuándo se producirá la ruptura.
											Esto es tan exitoso que se utiliza
											en la fase inicial [no es claro] del vuelo.
									","
											Nous avons appliqué cette théorie dès le départ,
c'était notre premier succès,
											pour le diagnostic de la rupture des éléments clés
											sur la fusée de fer.
											À l'aide d'émission acoustique, vous savez, 
ce petit bruit
											que vous entendez une structure émettre, 
chanter pour vous
											quand elles sont stressés 
et révèlent les dégâts en cours,
											il y a un phénomène collectif 
de retour positif,
											le plus de dégâts donne le plus de dégâts,
											alors vous pouvez réellement prédire,
											dans les limites, bien sûr, 
d'une bande de probabilité,
											quand la rupture se produira.
											Donc, ça a maintenant tellement 
de succès qu'on s'en sert
											dans la phase initiale de [pas clair] de vol.
									",How we can predict the next financial crisis,Didier Sornette,17:01,"business,economics,global issues,prediction,markets"
"
","
","
",How we can predict the next financial crisis,Didier Sornette,17:01,"business,economics,global issues,prediction,markets"
