en,tr,fr,de,title,speaker,duration,tags
"
											Let's stop and think about this for a minute,
											because this is a very important point.
											This new wave of innovation is fundamentally
											changing the way we work.
											And I know that many of you will be concerned 
about the impact that innovation might have on jobs.
											Unemployment is already high,
											and there is always a fear 
that innovation will destroy jobs.
											And innovation is disruptive.
											But let me stress two things here.
											First, we've already lived through
											mechanization of agriculture,
automation of industry,
											and employment has gone up,
											because innovation is fundamentally about growth.
											It makes products more affordable.
											It creates new demand, new jobs.
											Second, there is a concern that in the future,
											there will only be room for engineers,
											data scientists, and other highly-specialized workers.
											And believe me, as an economist, I am also scared.
											But think about it:
											Just as a child can easily figure out
											how to operate an iPad,
											so a new generation of mobile and intuitive
											industrial applications will make life easier
											for workers of all skill levels.
											The worker of the future will be more like Iron Man
											than the Charlie Chaplin of ""Modern Times.""
											And to be sure, new high-skilled jobs will be created:
											mechanical digital engineers who understand
											both the machines and the data;
											managers who understand their industry
											and the analytics and can reorganize the business
											to take full advantage of the technology.
									","
											Bir dakika durup bunu düşünelim,
											çünkü bu çok önemli bir nokta.
											Bu yenilik dalgası esasen
											çalışma şeklimizi değiştiriyor.
											Biliyorum çoğunuz bu yeniliğin mesleklere olabilecek etkisi hakkında endişe duyuyorsunuz.
											İşsizlik zaten yüksek
											ve her zaman yeniliğin meslekleri öldüreceğine dair bir korku var.
											Ve yenilik yıkıcıdır.
											Ama iki konuyu vurgulamama izin verin.
											İlki, biz zaten
											tarımın makineleşmesini, endüstri otomasyonunu yaşadık
											ve istihdam yükseldi.
											Çünkü yenilik esasen gelişmeyle ilgilidir.
											Ürünlerin daha kolay edinilebilir olmasını sağlar.
											Yeni talep ve yeni meslekler oluşturur.
											İkincisi, geleceğe dair bir endişe var,
											sadece mühendisler, data bilimcileri
											ve diğer ileri derecede uzmanlaşmış işçilere yer olacağına dair.
											İnanın bana, bir ekonomist olarak, ben de korkuyorum.
											Ama şunu düşünün:
											Sadece bir çocuk bile iPad'in
											nasıl çalışacağını çözebiliyor,
											yani yeni nesil taşınabilir ve sezgisel
											endüstriyel uygulamalar her beceri seviyesindeki
											işçilerin hayatını kolaylaştıracak.
											Gelecekteki işçi Charlie Chaplin'in ""Modern Times"" dakinin yerine
											Iron Man'deki gibi olacak.
											Ve eminim ki, yeni yüksek becerili işler de oluşacak:
											hem makinelerden hem veriden anlayabilen
											mekanik dijital mühendisler;
											endüstrilerini anlayan ve
											analiz ederek işlerini tekrar organize edip
											teknolojinin tüm avantajlarını kullanan yöneticiler.
									","
											Réfléchissons une minute à cela,
											car c'est un point très important.
											Cette nouvelle vague d'innovation change
											notre façon de travailler en profondeur.
											Beaucoup d'entre vous se préoccupent
de l'impact de l'innovation sur l'emploi.
											Le chômage est déjà très haut,
											et il y a cette peur 
que l'innovation détruira nos emplois.
											L'innovation est perturbatrice.
											Mais laissez-moi préciser deux choses ici.
											De un, nous l'avons déjà survécu
											la mécanisation de l'agriculture, 
l'automatisation de l'industrie,
											et l'emploi a augmenté,
											car l'innovation c'est de la croissance.
											ça rend les produits plus abordables.
											ça crée de nouvelles demandes, 
de nouveaux emplois.
											De deux, 
il y a une inquiétude que dorénavant,
											Il n'y aura du travail que pour les ingénieurs,
											les scientifiques 
et autres travailleurs très qualifiés.
											Et croyez-moi, en tant qu'économiste, 
je suis aussi effrayé.
											Mais réfléchissez-y :
											de la même façon 
qu'un enfant comprend aisément
											comment utiliser un iPad,
											de nouvelles applications industrielles
											mobiles et intuitives 
rendront la vie plus facile
											pour les travailleurs 
de toutes qualifications.
											Le travailleur du futur 
ressemblera plus à Iron Man
											qu'à Charlie Chaplin 
dans ""Les temps modernes"".
											Et de nouveaux métiers spécialisés 
seront créés :
											Ingénieur mécanumérique qui comprend
											et les machines et les données;
											des responsables 
qui comprennent leur industrie
											et les analyses
et pourront réorganiser l'entreprise
											pour profiter pleinement de la technologie.
									","
											Stoppen wir kurz und denken 
eine Minute darüber nach,
											denn dies ist ein sehr wichtiger Punkt.
											Diese neue Innovationswelle verändert fundamental
											die Art und Weise, in der wir arbeiten.
											Viele von Ihnen sind besorgt, was die Auswirkungen der Innovation auf Jobs sein könnten.
											Die Arbeitslosigkeit ist bereits hoch,
											und es besteht immer die Furcht, 
dass Innovation Jobs zerstören wird.
											Innovation ist Unruhe stiftend.
											Aber lassen Sie mich zwei Dinge betonen.
											Wir haben bereits die Mechanisierung
											der Agrikultur und Automation der Industrie miterlebt,
											und Arbeitsplätze wuchsen,
											denn Innovation hat fundamental 
mit Wachstum zu tun.
											Sie macht Produkte erschwinglich.
											Sie kreiert neue Nachfrage, neue Jobs.
											Zweitens besteht die Sorge, dass in der Zukunft
											nur Raum für Ingenieure ist,
											Datenwissenschaftler und 
andere hoch-spezialisierte Arbeiter.
											Ich als Ökonom fürchte mich ebenfalls.
											Aber denken Sie darüber nach:
											Genau so wie ein Kind einfach herausfinden kann,
											wie es ein iPad bedienen kann,
											wird eine neue Generation von mobilen und intuitiven
											industriellen Applikationen 
das Leben einfacher machen,
											für Arbeiter jeder Kompetenz.
											Die Arbeiter der Zukunft 
werden mehr wie Iron Man,
											und weniger wie Charlie Chaplin 
aus ""Modern Times"" sein.
											Und um sicherzugehen, neue Jobs 
von hohem Tätigkeitsniveau werden kreiert:
											Digitale Maschinenbauingenieure,
											die beides verstehen, Maschinen und Daten;
											Manager, die ihre Gewerbe verstehen,
											wie auch die Analytik, und entsprechend 
ihr Business reorganisieren können,
											um vollen Nutzen aus der 
Technologie ziehen zu können.
									",Welcome to the age of the industrial internet,Marco Annunziata,12:36,"economics,technology,infrastructure"
"
","
","
","
",Welcome to the age of the industrial internet,Marco Annunziata,12:36,"economics,technology,infrastructure"
"
											But now let's take a step back.
											Let's look at the big picture.
											There are people who argue that today's innovation
											is all about social media and silly games,
											with nowhere near the transformational power
											of the Industrial Revolution.
											They say that all the growth-enhancing innovations
											are behind us.
											And every time I hear this, I can't help thinking that
											even back in the Stone Age,
											there must have been a group of cavemen
											sitting around a fire one day
											looking very grumpy,
											and looking disapprovingly
at another group of cavemen
											rolling a stone wheel up and down a hill,
											and saying to each other,
											""Yeah, this wheel thing,
											cool toy, sure, but compared to fire,
											it will have no impact.
											The big discoveries are all behind us.""
											(Laughter)
									","
											Şimdi bir adım geriye atalım.
											Büyük resme bakalım.
											Günümüz yeniliğinin sosyal medya
											ve aptalca oyunlardan oluştuğunu,
											endüstriyel devrimin değişim gücünün yanından geçemediğini
											savunan insanlar var.
											Gelişimi artıran yeniliklerin geçmişte kaldığını
											söylüyorlar.
											Bunu her duyduğumda, Taş Devri'ni düşünmekten
											kendimi alıkoyamıyorum.
											Bir grup mağara adamı olmalı
											bir gün bir ateşin çevresinde oturuyorlar
											somurtkan gözüküyorlar
											ve tepenin birinden aşağı ve yukarı taş yuvarlayan
											bir başka gruba tasvip etmeyerek bakıyorlar,
											ve birbirlerine,
											""Evet, bu tekerlek denen şey,
											güzel oyuncak, ama ateşe karşı
											hiçbir etkisi yok.
											Büyük yenilikler geride kaldı.""
											(Gülüşmeler)
									","
											Mais maintenant, prenons un peu de recul.
											Regardons la vue d'ensemble.
											Certains discutent que
l'innovation de nos jours
											n'est que réseaux sociaux et jeux stupides,
											loin du pouvoir de transformation
											de la Révolution Industrielle.
											Ils disent que l'innovation 
qui favorise la croissance
											est derrière nous.
											Chaque fois que j'entends ça,
je ne peux pas m'empêcher de penser
											que même à l'Age de Pierre,
											il devait y avoir un groupe de Cro-Magnons,
											un jour, assis autour d'un feu
											ayant l'air très grognons,
											désapprouvant 
un autre groupe d'hommes de Cro-Magnon
											faisant rouler une roue en pierre
											du haut d'une colline et se disant,
											« Ouais, cette chose, cette roue,
											chouette joujou, bien sûr, 
mais comparé au feu,
											ça changera rien.
											Les grandes découvertes sont derrière nous. »
											(Rires)
									","
											Aber treten wir mal einen Schritt zurück.
											Betrachten wir das Gesamtbild.
											Es gibt Leute, die behaupten, 
dass heutige Technologie
											sich nur um Social Media oder alberne Spiele dreht,
											mit keiner transformativen Gewalt
											der Industriellen Revolution.
											Sie sagen, dass die ganze 
wachstumsfördernden Innovationen
											hinter uns liegen.
											Und jedes Mal, wenn ich das höre, 
denke ich unweigerlich daran,
											dass es, sogar in der Steinzeit,
											eine Gruppe von Höhlenbewohnern 
gegeben haben muss,
											die eines Tages um ein Feuer gesessen hat,
											mürrisch blickend
											und abwertend einer anderen Gruppe 
von Höhlenbewohnern zuschauend,
											die ein Steinrad einen Hügel 
hoch und runter rollten.
											und sich einander sagen,
											""Ja, schau mal dieses Rad-Ding an,
											cooles Spielzeug, aber im Vergleich zu Feuer
											wird es keinen Einfluss haben.
											Die grossen Entdeckungen liegen bereits hinter uns.""
											(Gelächter)
									",Welcome to the age of the industrial internet,Marco Annunziata,12:36,"economics,technology,infrastructure"
"
","
","
","
",Welcome to the age of the industrial internet,Marco Annunziata,12:36,"economics,technology,infrastructure"
"
											This technological revolution
											is as inspiring and transformational
											as anything we have ever seen.
											Human creativity and innovation
have always propelled us forward.
											They've created jobs.
											They've raised living standards.
											They've made our lives
											healthier and more rewarding.
											And the new wave of innovation
											which is beginning to sweep through industry
											is no different.
											In the U.S. alone, the industrial Internet
											could raise average income by 25 to 40 percent
											over the next 15 years,
											boosting growth to rates we
haven't seen in a long time,
											and adding between 10 and 15
trillion dollars to global GDP.
											That is the size of the entire U.S. economy today.
									","
											Bu teknolojik devrim
											gördüğümüzün hepsi kadar
											ilham verici ve değiştirici.
											İnsan yaratıcılığı ve yenilikler bizi her zaman ileri itti.
											Meslekler yarattılar.
											Yaşam standartlarını arttırdılar.
											Yaşamımızı daha sağlıklı
											ve daha tatmin edici hale getirdiler.
											Ve endüstri vasıtasıyla
											yayılmaya başlayan bu yenilik dalgası da
											farklı değil.
											Sadece A.B.D'de, endüstriyel internet
											önümüzdeki 15 yıl içerisinde ortalama geliri
											yüzde 25 ile yüzde 40 arasında artırabilir,
											uzun zamandır görmediğimiz büyüme oranlarını destekleyebilir,
											Global anlamda GSYİH'i 10 ila 15 trilyon dolar arasında yükseltebilir.
											Bu, bugünki tüm A.B.D ekonomisinin büyüklüğüne eşit.
									","
											Cette révolution technologique
											est aussi inspirante et transformante
											que tout ce que l'on a déjà vu.
											La créativité et l'innovation 
nous ont toujours propulsé vers l'avant.
											Elles ont créé des emplois,
											amélioré le niveau de vie.
											Elles ont fait nos vies
											plus saines et plus gratifiantes.
											Cette nouvelle innovation
											qui se propage au travers de l'industrie
											n'est pas moins différente.
											Rien qu'aux USA, l'Internet Industriel
											pourrait augmenter 
les salaires moyens de 25 à 40 pour cent
											sur les 15 prochaines années,
											stimulant la croissance comme auparavant,
											et ajoutant entre 10 et 15 
mille milliard de dollars au PIB mondial.
											C'est l'équivalent 
de toute l'économie des USA aujourd'hui.
									","
											Diese technologische Revolution
											ist so inspirierend und transformativ
											wie nichts, was wir je gesehen haben.
											Die Kreativität und Innovation von Menschen, 
hat uns immer nach vorne befördert.
											Sie haben Jobs kreiert.
											Sie haben Lebensstandards erhöht.
											Sie haben unsere Leben
											gesünder und erfüllender gemacht.
											Und die neue Innovationswelle,
											die anfängt durch die Industrie zu fegen,
											ist nicht anders.
											Alleine in den USA könnte das industrielle Internet
											das Durchschnittseinkommen zu 25 bis 40 Prozent
											in den nächsten 15 Jahren erhöhen,
											was das Wachstum in nie vorher 
gesehener Art und Weise ankurbelt
											und dem globalen BIP 7 bis 11 Billionen Euro zufügt.
											Das ist die Grösse der gesamten 
heutigen Wirtschaft der USA.
									",Welcome to the age of the industrial internet,Marco Annunziata,12:36,"economics,technology,infrastructure"
"
","
","
","
",Welcome to the age of the industrial internet,Marco Annunziata,12:36,"economics,technology,infrastructure"
"
											But this is not a foregone conclusion.
											We are just at the beginning of this transformation,
											and there will be barriers to break,
											obstacles to overcome.
											We will need to invest in the new technologies.
											We will need to adapt organizations
and managerial practices.
											We will need a robust cybersecurity approach
											that protects sensitive information
and intellectual property
											and safeguards critical infrastructure
from cyberattacks.
											And the education system will need to evolve
											to ensure students are equipped with the right skills.
											It's not going to be easy,
											but it is going to be worth it.
											The economic challenges facing us are hard,
											but when I walk the factory floor,
											and I see how humans and brilliant machines
											are becoming interconnected,
											and I see the difference this makes
											in a hospital, in an airport,
											in a power generation plant, I'm not just optimistic,
											I'm enthusiastic.
											This new technological revolution is upon us.
									","
											Ama bu önceden belli olabilecek bir sonuç değil.
											Daha dönüşümün başlangıcındayız,
											ve yıkmamız gereken bariyerler,
											aşmamız gereken engeller olacak.
											Yeni teknolojilere yatırım yapmamız gerekecek.
											Organizasyonları uyarlamaya ve idari uygulamalara ihtiyacımız olacak.
											Hassas bilgileri ve fikri mülkiyeti, aynı zamanda
											kritik altyapıyı siber saldırılara karşı koruyacak
											güçlü bir siber güvenlik yaklaşımına ihtiyacımız olacak.
											Öğrencilerin doğru becerilerle donanmış olması için
											eğitim sisteminin de evrim geçirmesi gerekecek.
											Kolay olmayacak,
											ancak değecek.
											Karşı karşıya kaldığımız ekonomik mücadeleler zorlayıcı,
											ama bir fabrikada yürürken
											insanlarla becerikli makinaların
											nasıl birbirine bağlı çalıştıklarını görüyorum,
											ve bunun yarattığı farkı görüyorum,
											bir hastanede, bir havalimanında,
											bir enerji santralinde. Sadece optimist değilim,
											iştahlıyım da.
											Bu yeni teknolojik devrime çok az kaldı.
									","
											Mais ce n'est pas conclu d'avance.
											Ce n'est que le début,
											et il y aura des épreuves à surmonter,
											des obstacles à franchir.
											Il faudra investir 
dans les nouvelles technologies.
											Il faudra adapter les organisations 
et les méthodes de management.
											Il nous faudra 
une approche robuste de la cyber-sécurité
											qui protège les informations sensibles 
et la propriété intellectuelle
											des infrastructures avec des garanties 
contre les cyber-attaques.
											Et le système éducatif devra évoluer
											pour que les étudiants aient 
les bonnes compétences.
											Ça ne sera pas facile,
											mais ça en vaudra la peine.
											Les défis économiques 
qui nous font face sont difficiles,
											mais quand je marche dans une usine,
											et que je vois comment les hommes
											et ces brillantes machines s'interconnectent,
											et que je vois la différence que ça fait
											dans un hôpital, dans un aéroport,
											dans une centrale électrique, 
je suis plus qu'optimiste,
											Je suis enthousiaste.
											Cette nouvelle révolution technologique 
est devant nous.
									","
											Aber das ist nicht ein vorherbestimmtes Fazit.
											Wir sind erst am Anfang dieser Veränderung,
											und es wird Grenzen zu sprengen
											und Hindernisse zu überwinden geben.
											Wir werden in neue Technologien investieren müssen.
											Wir werden Organisations- und 
Verwaltungsstrategien anpassen müssen.
											Wir werden robuste Cyber-Sicherheitskonzepte erstellen müssen,
											die vertrauliche Daten und 
geistiges Eigentum schützen,
											sowie Schutzmassnahmen, um wichtige 
Infrastruktur vor Cyber-Attacken zu bewahren.
											Und das Bildungssystem 
wird sich weiterentwickeln müssen,
											um sicherzustellen, dass Schüler 
die richtigen Fähigkeiten besitzen.
											Es wird nicht einfach sein,
											aber es wird es wert sein.
											Die ökonomischen Herausforderungen, 
die sich uns stellen sind gross,
											aber wenn ich durch Fabrikhallen laufe,
											und sehe wie Menschen und brillante Maschinen
											miteinander verbunden werden,
											und sehe, was dies für einen Unterschied macht,
											in einem Krankenhaus, in einem Flughafen,
											in einem Kraftwerk, bin ich nicht nur optimistisch,
											ich bin enthusiastisch.
											Die neue technologische Revolution steht uns bevor.
									",Welcome to the age of the industrial internet,Marco Annunziata,12:36,"economics,technology,infrastructure"
"
","
","
","
",Welcome to the age of the industrial internet,Marco Annunziata,12:36,"economics,technology,infrastructure"
"
											So think about the future —
it will be here soon enough.
									","
											Gelecek hakkında düşünün, yakında burada olacak.
									","
											Alors pensez au futur, 
il sera ici bien assez vite.
									","
											Also, denken Sie an die Zukunft — 
sie wird früh genug da sein.
									",Welcome to the age of the industrial internet,Marco Annunziata,12:36,"economics,technology,infrastructure"
"
","
","
","
",Welcome to the age of the industrial internet,Marco Annunziata,12:36,"economics,technology,infrastructure"
"
											Thank you.
									","
											Teşekkür ederim.
									","
											Merci
									","
											Vielen Dank.
									",Welcome to the age of the industrial internet,Marco Annunziata,12:36,"economics,technology,infrastructure"
"
","
","
","
",Welcome to the age of the industrial internet,Marco Annunziata,12:36,"economics,technology,infrastructure"
"
											(Applause)
									","
											(Alkışlar)
									","
											(Applaudissements)
									","
											(Applaus)
									",Welcome to the age of the industrial internet,Marco Annunziata,12:36,"economics,technology,infrastructure"
"
","
","
","
",Welcome to the age of the industrial internet,Marco Annunziata,12:36,"economics,technology,infrastructure"
