en,es,tr,fr,de,title,speaker,duration,tags
"
											In fact, some years ago, Bill Joy wrote an article
											expressing tremendous concern about robots taking us over, etc.
											I don't go along with all that,
											but it's interesting that he had a simple solution.
											It was what he called ""fine-grained relinquishment.""
											He wanted to give up the dangerous kind of science
											and keep the good bits. Now, that's absurdly naive for two reasons.
											First, any scientific discovery has benign consequences
											as well as dangerous ones.
											And also, when a scientist makes a discovery,
											he or she normally has no clue what the applications are going to be.
											And so what this means is that we have to accept the risks
											if we are going to enjoy the benefits of science.
											We have to accept that there will be hazards.
											And I think we have to go back to what happened in the post-War era,
											post-World War II, when the nuclear scientists
											who'd been involved in making the atomic bomb,
											in many cases were concerned that they should do all they could
											to alert the world to the dangers.
									","
											De hecho, hace unos años, Bill Joy escribió un artículo
											expresando tremenda preocupación acerca de que los robots nos conquistaran, etc.
											Yo no comparto todo eso,
											pero es interesante que él tuvo una simple solución.
											Lo que él llamó renunciamiento fino.
											Quería abandonar los tipos peligrosos de ciencia
											y conservar los buenos. Bien, eso es absurdamente ingenuo por dos razones:
											Primero, cualquier descubrimiento científico tiene consequencias tanto benignas
											como malignas.
											Y además, cuando un científico hace un descubrimiento,
											él o ella normalmente no tienen idea de las aplicaciones que va a tener.
											Y lo que esto sifnifica, es que debemos aceptar los riesgos
											si vamos a disfrutar de los beneficios de la ciencia.
											Tenemos que aceptar que van a haber riesgos.
											Y yo creo que vamos a volver a lo que sucedió en la época de post-guerra,
											post-segunda guerra mundial, cuando los científicos nucleares
											que habían estado envueltos en realizar la bomba atómica,
											en muchos casos estuvieron preocupados de hacer todo lo que pudieran
											para alertar al mundo de los peligros.
									","
											Hakikaten, bir süre önce Bill Joy bir makale yazarak robotların
											bize hükmetmesi ve sonrası konusundaki detaylı ilgisini dile getirmişti.
											Bununla devam etmeyeceğim,
											ama basit bir çözüm önermesi ilginçtir.
											O da kendisinin tabiriyle küçük çaplı fedakarlık.
											O bilimden tehlikeli olabilecek şeyleri atmak ve iyi şeyleri tutmak istedi.
											Şimdi bu düşünce, iki nedenle şaçmalık derecesinde kırılgan.
											Birincisi,her bilimsel keşfin tehlikeli olduğu kadar
											iyi de sonuçları vardır.
											Ve aynı zamanda,bir bilim insanı bir keşif yaptığı zaman,
											onun bu keşiflerin nasıl kullanılacağı konusunda bir fikri yoktur.
											Ve bunun anlamı şudur ki, eğer bilimin faydalarından
											yararlanmak istiyorsak riskleri de kabul etmeliyiz.
											Kabul etmeliyiz ki tehlikeler olacaktır.
											Ve İkinci Dünya Savaşından sonraki ortamda ne olduğunu anlamak için
											geri gitmemiz gerektiğini düşünüyorum, atom bombasını
											bir çok nedenle yapma işinde rol almış bilimciler
											ellerinden tek gelen şey olarak onun tehlikeleri konusunda
											dünyayı uyarmak zorunda olduklarını düşündüler.
									","
											En fait, il y a quelques années, Bill Joy a écrit un article
											où il exprimait sa grande inquiétude à l'idée que des robots pourraient nous contrôler, etc.
											Je ne suis pas d'accord avec lui,
											mais ce qui est intéressant c'est qu'il proposait une solution simple.
											Il appelait cela la renonciation minutieuse.
											Il voulait qu'on abandonne les sciences dangereuses
											et qu'on ne garde que les bon aspects. C'est d'une naïveté absurde pour deux raisons.
											D'abord, toute découverte scientifique a des conséquences à la fois bénéfiques
											et à la fois dangereuses.
											Ensuite, quand un scientifique fait une découverte,
											il ou elle n'a en général aucune idée des applications qui vont en découler.
											Cela signifie que nous devons accepter les risques
											si nous voulons profiter des bienfaits de la science.
											Nous devons accepter le fait qu'il y a des dangers.
											Et je pense que nous pouvons nous inspirer de ce qui s'est passé
											juste après la seconde guerre mondiale, lorsque les scientifiques du nucléaire
											qui ont participé à l'élaboration de la bombe atomique,
											souvent, ont été les premiers à déployer leurs efforts
											pour alerter le monde des dangers de ces armes.
									","
											Vor einigen Jahren äußerte Bill Joy in einem Artikel
											erhebliche Befürchtungen, dass Roboter die Herrschaft übernehmen könnten usw.
											Daran glaube ich zwar nicht,
											aber interessanterweise hatte er eine einfache Lösung.
											Er nannte sie ""feinkörnigen Verzicht"".
											Er wollte, dass wir jede Art gefährlicher Wissenschaft aufgeben,
											und nur die guten Teile übrig lassen. Nun, das ist aus zwei Gründen absolut naiv:
											Erstens hat jede wissenschaftliche Entdeckung sowohl gutartige
											als auch gefährliche Konsequenzen.
											Zudem hat ein Wissenschaftler, wenn er oder sie eine Entdeckung macht,
											normalerweise keine Ahnung, welche Anwendungen daraus hervorgehen könnten.
											Das wiederum bedeutet, dass wir die Risiken akzeptieren müssen,
											wenn wir die Vorteile der Wissenschaft genießen wollen.
											Wir müssen akzeptieren, dass es Risiken geben wird.
											Lassen Sie uns auf das zurückblicken, was in der Nachkriegszeit passiert ist.
											Nach dem zweiten Weltkrieg waren viele Atomphysiker,
											die am Bau der Atombombe beteiligt waren,
											in vielen Fällen damit beschäftigt, alles in ihrer Macht Stehende zu tun,
											um die Welt auf die Gefahren hinzuweisen.
									",Is this our final century?,Martin Rees,17:26,"astronomy,climate change,complexity,cosmos,science,social change,technology,time,universe"
"
","
","
","
","
",Is this our final century?,Martin Rees,17:26,"astronomy,climate change,complexity,cosmos,science,social change,technology,time,universe"
"
											And they were inspired not by the young Einstein,
											who did the great work in relativity, but by the old Einstein,
											the icon of poster and t-shirt,
											who failed in his scientific efforts to unify the physical laws.
											He was premature. But he was a moral compass —
											an inspiration to scientists who were concerned with arms control.
											And perhaps the greatest living person
											is someone I'm privileged to know, Joe Rothblatt.
											Equally untidy office there, as you can see.
											He's 96 years old, and he founded the Pugwash movement.
											He persuaded Einstein, as his last act,
											to sign the famous memorandum of Bertrand Russell.
											And he sets an example of the concerned scientist.
											And I think to harness science optimally,
											to choose which doors to open and which to leave closed,
											we need latter-day counterparts of people like Joseph Rothblatt.
									","
											Y estaban inspirados no sólo por el joven Einstein,
											que hizo el gran trabajo en relatividad, sino también en el viejo Einstein,
											el icono de posters y camisetas,
											que falló en sus esfuerzos de unificar las leyes de la física.
											Fue prematuro. Pero fue una brújula moral —
											inspiración para científicos que estaban preocupados por el control de las armas.
											Y quizás la mejor persona viviente,
											es alguien a quien tengo el privilegio de conocer, Joe Rothblatt.
											Igual de desordenada es su oficina, como pueden ver.
											Tiene 96 años de edad, y es fundador del movimiento Pugwash.
											Persuadió a Einstein, como último acto,
											para que firmara el famoso memorandum de Bertrand Russell.
											Y el da el ejemplo de científico preocupado.
											Yo creo que hay que maniobrar a la ciencia de manera óptima,
											elegir qué puertas abrir y cuáles dejar cerradas,
											necesitamos más contrapartes de gente como Joseph Rothblatt.
									","
											Ve onlar rölativite konusunda büyük katkısı olan genç Einstein'ı
											değil de fizik kanunlarını birleştirme konusunu
											halledememiş,poster ve tişört sembolü
											ihtiyar Einstein'ı ilham kaynağı olarak gördüler.
											O zamanından önce doğmuş birisiydi. Fakat silahların kontrolu
											konusuyla ilgilenen bilimcilere ilham veren bir moral faktördü.
											Ve (bu konuda) belki de yaşayan en büyük insan
											benim de tanıma fırsatı bulduğum Joe Rothblatt'tır.
											Gördüğünüz gibi aynı derecede dağınık ofisin içinde.
											96 yaşındadır ve Pugwash hareketini kuran kişi.
											Einstein'ın son eylemi olmak üzere onu
											Bertrand Russell'ın ünlü bildirisini imzalamak için ikna etti
											Ve sorumlu bir bilim adamı örneği oluşturdu.
											Ve bilimi iyimser biçimde kontrol altında tutmakta,bunun için de
											hangi kapıları açık hangilerinin kapalı olacağını seçmede
											Joseph Rothblatt türünden zor gün dostlarına ihtiyacımız var
									","
											Ils s'inspiraient non pas du jeune Einstein,
											qui nous a apporté la Relativité, mais du vieux Einstein,
											l'icône des posters et des T-Shirts,
											dont les efforts scientifiques n'ont pas réussi à aboutir à l'unification des lois physiques.
											Il était en avance sur son temps. Mais il servait de guide moral,
											d'inspiration pour les scientifiques qui souhaitaient un contrôle des armements nucléaires.
											Et peut-être l'un des êtres les plus admirables,
											une personne que j'ai eu le privilège de connaître, Joe Rotblat.
											Son bureau est tout autant en désordre, comme vous pouvez le constater.
											Il a 96 ans, et a fondé le mouvement Pugwash.
											Il a persuadé Einstein, peu avant sa mort,
											de signer le fameux mémorandum de Bertrand Russel.
											Il est à lui seul un modèle pour la conscience scientifique.
											Et je pense que pour maîtriser les avancées scientifiques,
											pour choisir quelles portes ouvrir et quelles portes laisser fermer,
											il nous faut des personnes aujourd'hui à l'image de Joseph Rotblat.
									","
											Sie wurden nicht vom jungen Einstein inspiriert,
											der so viel zur Relativität geleistet hatte, sondern vom alten Einstein,
											jenem auf den Postern und T-Shirts,
											der im seinem wissenschaftlichen Tun, die physikalischen Gesetze zu vereinen, versagt hatte.
											dafür war es noch zu früh, aber er war ein moralischer Wegweiser,
											eine Inspiration für Wissenschaftler, die besorgt über die Kontrolle der Waffen waren.
											Und die vielleicht großartigste lebende Person,
											die ich kennenlernen durfte, ist Joe Rothblatt.
											Sie sehen ihn hier in einem sehr unordentlichen Büro.
											Er ist 96 Jahre alt und gründete die Pugwash-Bewegung.
											Er überredete Einstein, als letzten Akt
											das berühmte Memorandum von Bertrand Russell zu unterschreiben.
											Und er setzt ein Beispiel als ein besorgter Wissenschaftler.
											Und um die Wissenschaft optimal nutzbar zu machen,
											um zu wählen, welche Türen wir schließen und welche wir öffnen sollten,
											brauchen wir heute Gegenstücke von Leuten wie Joseph Rothblatt.
									",Is this our final century?,Martin Rees,17:26,"astronomy,climate change,complexity,cosmos,science,social change,technology,time,universe"
"
","
","
","
","
",Is this our final century?,Martin Rees,17:26,"astronomy,climate change,complexity,cosmos,science,social change,technology,time,universe"
"
											We need not just campaigning physicists,
											but we need biologists, computer experts
											and environmentalists as well.
											And I think academics and independent entrepreneurs
											have a special obligation because they have more freedom
											than those in government service,
											or company employees subject to commercial pressure.
											I wrote my book, ""Our Final Century,"" as a scientist,
											just a general scientist. But there's one respect, I think,
											in which being a cosmologist offered a special perspective,
											and that's that it offers an awareness of the immense future.
											The stupendous time spans of the evolutionary past
											are now part of common culture —
											outside the American Bible Belt, anyway —
											(Laughter)
											but most people, even those who are familiar with evolution,
											aren't mindful that even more time lies ahead.
									","
											No necesitamos sólo físicos en campaña,
											necesitamos biólogos, expertos en computación,
											y ambientalistas por igual.
											Creo que los académicos y emprendedores independientes,
											tienen una obligación especial porque tienen mayor libertad
											que esos al servicio del gobierno,
											o empleados de compañías sujetas a la presión comercial.
											Escribí mi libro 'Nuestro Siglo Final' como científico,
											sólo un científico general. Pero hay un aspecto, creo,
											en que el ser un cosmólogo me dió una perspectiva especial,
											y es que eso ofrece una conciencia del inmenso futuro.
											Los estupendos períodos de tiempo del pasado evolutivo
											son ahora parte de la cultura común —
											fuera del Cinturón Bíblico Americano, esto es —
											(Risas)
											pero mucha gente, incluso quienes sí reconocen la teoría de la evolución,
											no se percatan que aún más tiempo yace adelante.
									","
											Sadece kampanya yapan fizikçilere değil,
											ama aynı zamanda biyologlara, bilgisayar uzmanlarına
											ve çevrecilere ihtiyacımız var.
											Ve akademisyenler ve bağımsız girişimciler,
											devlet hizmetinde çalışanlara ve
											ticari baskılar altındaki şirket çalışanlarına oranla
											daha özgür olduklarından özel bir sorumluluğa sahiptirler.
											Ben kitabım ""Bizim Son Yüzyılımız"" kitabını bir bilimci
											sadece genel bir bilimci olarak yazdım. Ama bence bir şey daha var
											o da kozmolog olmanın sağladığı özel bir bakış açısı
											ve o uzak gelecek için farkındalık öneriyor.
											Evrimsel geçmişin müthiş zaman dilimleri
											şimdi artık ortak kültürün bir parçası—
											Amerikadaki dini bölge koridorunun dışında tabii ki—
											(Gülüşmeler)
											Fakat bir çok insan hatta evrim düşüncesine yakın olanlar,
											önümüzde daha uzun bir zaman olduğu konusunda düşünceli değiller.
									","
											Nous avons besoin non seulement de physiciens engagés,
											mais également de biologistes, d'experts informatiques,
											et d'écologistes.
											Et je pense que les entrepreneurs diplômés et indépendants
											ont une obligation particulière car ils disposent de plus de liberté
											que ceux au service d'un gouvernement,
											ou que les employés d'une société sujets à la pression commerciale.
											J'ai écrit mon livre, ""Notre dernier siècle""
											en tant que scientifique de manière générale. Mais il y a un point, je pense,
											qui, rédigé en tant que cosmologue, offre une perspective speciale,
											c'est qu'il offre une conscience de notre immense futur.
											L'incroyable longueur du temps nécessaire à l'évolution passée
											fait maintenant partie de la culture populaire —
											en dehors des communautés américaines créationnistes, tout du moins —
											(rires)
											mais la plupart des gens, même ceux qui connaissent bien l'évolution,
											ne se doutent pas que nous avons encore plus de temps devant nous.
									","
											Wir benötigen aber nicht nur mitkämpfende Physiker,
											sondern auch Biologen, Computerexperten
											und Umweltwissenschaftler.
											Dabei denke ich, dass Akademiker und unabhängige Unternehmer
											eine besondere Verpflichtung haben, da sie größere Freiheiten haben
											als solche, die für Regierungen arbeiten
											oder Firmenangestellte, die kommerziellem Druck unterliegen.
											Ich habe mein Buch ""Unsere letzte Stunde"" als Wissenschaftler geschrieben,
											nur als ein allgemeiner Wissenschaftler. Aber in einer Hinsicht, denke ich,
											ergibt sich aus der Sicht des Kosmologen eine spezielle Perspektive,
											und das ist die Wahrnehmung einer gewaltigen Zukunft.
											Der gewaltige Zeitraum der vergangenen Evolution
											ist heute Allgemeingut –
											zumindest außerhalb des amerikanischen ""Bible Belt"" –
											(Lachen)
											aber die wenigsten Menschen, auch solche, die sich mit der Evolution auskennen,
											sind sich bewusst, dass sogar noch mehr Zeit vor uns liegt.
									",Is this our final century?,Martin Rees,17:26,"astronomy,climate change,complexity,cosmos,science,social change,technology,time,universe"
"
","
","
","
","
",Is this our final century?,Martin Rees,17:26,"astronomy,climate change,complexity,cosmos,science,social change,technology,time,universe"
"
											The sun has been shining for four and a half billion years,
											but it'll be another six billion years before its fuel runs out.
											On that schematic picture, a sort of time-lapse picture, we're halfway.
											And it'll be another six billion before that happens,
											and any remaining life on Earth is vaporized.
											There's an unthinking tendency to imagine that humans will be there,
											experiencing the sun's demise,
											but any life and intelligence that exists then
											will be as different from us as we are from bacteria.
											The unfolding of intelligence and complexity
											still has immensely far to go, here on Earth and probably far beyond.
											So we are still at the beginning of the emergence of complexity
											in our Earth and beyond.
											If you represent the Earth's lifetime by a single year,
											say from January when it was made to December,
											the 21st-century would be a quarter of a second in June —
											a tiny fraction of the year.
											But even in this concertinaed cosmic perspective,
											our century is very, very special,
											the first when humans can change themselves and their home planet.
									","
											El Sol ha brillado por cuatro billones de años y medio,
											pero deberán pasar otros seis billones antes de que se quede sin combustible.
											En esa esquemática imagen, una especie de imagen sin tiempo, estamos por la mitad del camino.
											Y serán otros seis billones de años hasta que eso ocurra,
											y toda vida en la Tierra sea vaporizada.
											Hay una tendencia ignorante de imaginar que los humanos van a estar allí,
											contemplando el ocaso del Sol,
											pero cualquier vida e inteligencia que exista entonces
											va a ser tan diferente de nosotros como nosotros lo somos de las bacterias.
											El desarrollo de la inteligencia y complejidad
											aún tiene un camino inmenso por recorrer, aquí en la Tierra y más allá.
											Así que aún estamos en el comienzo del surgimiento de la complejidad
											de nuestra Tierra y más allá.
											Si usted representa la vida de la Tierra con un solo año,
											digamos, de Enero cuando fue creada hasta Diciembre,
											el siglo 21 sería un cuarto de segundo en Junio —
											una ínfima fracción de año.
											Pero incluso en esta perspectiva cósmica,
											nuestro siglo es muy, muy especial.
											El primero en que los humanos se pueden cambiar a sí mismos y a su planeta primario.
									","
											Güneş dört buçuk milyar yıldır parlıyor,
											fakat sıcaklığını kaybedene kadar bir altı milyar yıl daha var.
											Şematik olarak, zamansız bir resim içinde yarı yoldayız.
											Ve yeryüzünde herhangi bir hayat kalmamasına
											bir diğer altı milyar yıl var.
											Güneş söndüğü zaman insanların hala orada olacağını sanan
											bir düşünceden yoksun eğilim var,
											fakat ondan sonra ortaya çıkacak herhangi bir yaşam ve zeka türü
											bizim bakterilerden farklı olduğumuz kadar bizden farklı olacak.
											Zekanın ve karmaşıklığın açıklığa kavuşması için hala önümüzde
											muazzam bir yol var,burada yeryüzünde ve muhtemelen çok ötesinde.
											Yani yeryüzünün ve ötesinin karmaşıklığının (anlaşılnasında)
											hala başlangıçtayız.
											Eğer yeryüzünün hayatını bir tek yıl olarak düşünürseniz,
											diyelim Ocak'tan Aralığa kadar,
											21.yüzyıl sadece Haziran'ın içindeki bir saniyenin çeyreği olurdu—
											bir yılın çok ufak bir parçası.
											Ama yine de bu çok büyük kozmik bakış açısında bile
											yüzyılımız çok, çok özel.
											En başta insanlar kendi kendilerini ve kendi gezegenlerini değiştirebilebilirler.
									","
											Le soleil brille depuis 4,5 milliards d'années,
											mais il brillera de cette manière encore 6 milliards d'années, avant d'épuiser son énergie.
											Sur ce schéma, nous sommes à mi-chemin.
											Nous avons donc encore 6 milliards d'années avant que
											toute vie sur Terre soit vaporisée.
											On a tendance à penser que des humains seront là,
											et assisteront à la mort du soleil,
											mais la vie et l'intelligence qui existeront à ce moment-là
											seront aussi différentes de nous que nous sommes différents des bactéries.
											L'intelligence et la complexité
											ont encore d'immenses développements à venir, sur Terre et probablement bien au-delà.
											Nous sommes donc au début de l'émergence de la complexité
											sur notre planète et au-delà.
											Si on ramène la vie de la Terre à une seule année,
											Disons de sa création en Janvier jusqu'à Décembre,
											le 21ème siècle représente un quart de seconde en Juin —
											une toute petite fraction de l'année.
											Mais même dans cette perspective cosmique condensée,
											notre siècle est très, très spécial.
											C'est le premier où les humains peuvent se transformer eux-même et leur planète.
									","
											Die Sonne scheint seit viereinhalb Milliarden Jahren,
											und sie wird noch weitere sechs Milliarden Jahre scheinen, bevor ihr der Brennstoff ausgeht.
											Auf dieser schematischen Darstellung, einer Art Zeitverlauf, sind wir in der MItte.
											Es werden weitere sechs Milliarden Jahre vergehen, bevor das passiert,
											und alles verbleibende Leben auf der Erde ausgelöscht wird.
											Die gedankenlose Vorstellung, dass Menschen noch da sein werden,
											um den Abgang der Sonne zu erleben, existiert.
											Aber das Leben und die Intelligenz, die dann existieren werden,
											werden sich so von uns unterscheiden wie wir von Bakterien.
											Die Entfaltung von Intelligenz und Komplexität
											hat noch weit zu gehen. Auf der Erde und wohl auch weit darüber hinaus.
											Wir sind also gerade erst am Beginn der Erscheinung der Komplexität
											auf unserer Erde und jenseits von ihr.
											Wenn Sie sich die Lebensdauer der Erde als ein Jahr vorstellen,
											also von Januar, als sie gemacht wurde, bis zum Dezember,
											dann wäre das 21. Jahrhundert eine Viertelsekunde im Juni –
											ein sehr kleiner Teil eines Jahres.
											Aber selbst aus dieser besonderen kosmischen Perspektive
											ist unser Jahrhundert wirklich eine ganz große Besonderheit,
											das erste, in dem Menschen sich und ihren Heimatplaneten ändern können.
									",Is this our final century?,Martin Rees,17:26,"astronomy,climate change,complexity,cosmos,science,social change,technology,time,universe"
"
","
","
","
","
",Is this our final century?,Martin Rees,17:26,"astronomy,climate change,complexity,cosmos,science,social change,technology,time,universe"
