es,pt,tr,en,fr,title,speaker,duration,tags
"
","
","
","
","
",4 pillars of college success in science,Freeman Hrabowski,15:10,"education,inequality,math,science,technology,psychology,history,race,engineering,curiosity,community,medical research,social change"
"
											En segundo lugar, la idea de construir 
una comunidad entre los estudiantes.
											Uds. saben que bastante a menudo 
en ciencias e ingeniería
											tendemos a pensar ferozmente.
											A los estudiantes no se les 
enseña a trabajar en grupo.
											Y eso es en lo que 
trabajamos con ese grupo
											para hacer que 
se entiendan unos con otros,
											para fomentar la confianza entre 
ellos, y apoyarse mutuamente,
											para aprender a 
hacer buenas preguntas,
											pero también para aprender a 
explicar los conceptos con claridad.
											Como saben, una cosa es
 ganarse una A uno mismo,
											y otra es ayudar a 
alguien a hacerlo.
											Y así percibir ese sentido de responsabilidad 
marca toda la diferencia del mundo.
											Así que construir comunidad entre 
los estudiantes es muy importante.
									","
											Segundo, a ideia de construir 
uma comunidade entre os alunos.
											Todos sabem que, geralmente, 
em ciência e engenharia
											tendemos para o pensamento competitivo.
											Os estudantes não são ensinados 
a trabalhar em grupo.
											E é isso que trabalhamos
com cada grupo
											para os fazer compreender-se
mutuamente,
											para construir confiança 
entre eles, apoiando-se,
											aprendendo a colocar boas questões,
											mas também aprendendo 
como explicar conceitos com clareza.
											Como sabem, uma coisa 
é alguém merecer Excelente,
											outra coisa é ajudar alguém 
a conseguir bons resultados.
											Sentir essa responsabilidade 
faz toda a diferença do mundo.
											Então, construir comunidade entre
esses estudantes, é muito importante.
									","
											İkincisi, öğrenciler arasında bir birlik oluşturmak.
											Bilirsiniz, bilim ve mühendislikte sıklıkla
											acımasızca düşünürüz.
											Öğrenciler grup çalışmasına yatkın değildir.
											Ve bu grupla başarmak istediğimiz şey
											birbirlerini anlamalarını sağlamak,
											aralarında güven oluşturmak, birbirlerini desteklemelerine,
											güzel sorular sormayı,
											diğer yandan da kavramları net bir şekilde açıklamayı öğrenmelerine yardımcı olmak.
											Bildiğiniz üzere, kendi başına A almak bir şey,
											başkasının notunu da iyileştirmek ayrı bir şey.
											Ve sorumluluk hissinin dünyadaki tüm farkları oluşturduğunu hissetmek ayrı bir şey.
											Bu yüzden bu öğrenciler arasında birlik oluşturmak çok önemli.
									","
											Secondly, the idea of building community among the students.
											You all know that so often in science and engineering
											we tend to think cutthroat.
											Students are not taught to work in groups.
											And that's what we work to do with that group
											to get them to understand each other,
											to build trust among them, to support each other,
											to learn how to ask good questions,
											but also to learn how to explain concepts with clarity.
											As you know, it's one thing to earn an A yourself,
											it's another thing to help someone else do well.
											And so to feel that sense of responsibility makes all the difference in the world.
											So building community among those students, very important.
									","
											Deuxièmement, l'idée de construire 
une communauté parmi les étudiants.
											Vous savez tous que si souvent en science et en ingénierie
											on a tendance a penser à la compétition.
											Les élèves n’apprennent pas à travailler en groupe.
											C'est ce que nous voulons faire avec ce groupe,
											les amener à se comprendre mutuellement,
											pour établir la confiance entre eux, 
se soutenir mutuellement,
											pour apprendre à poser les bonnes questions,
											mais aussi apprendre à expliquer
les concepts avec clarté.
											Comme vous le savez, c'est une chose 
d'avoir un A vous-même,
											c'en est une autre chose d'aider 
quelqu'un d'autre à réussir.
											Ressentir ce sentiment de responsabilité 
fait toute la différence au monde.
											Construire une communauté 
parmi les étudiants est donc vraiment important.
									",4 pillars of college success in science,Freeman Hrabowski,15:10,"education,inequality,math,science,technology,psychology,history,race,engineering,curiosity,community,medical research,social change"
"
","
","
","
","
",4 pillars of college success in science,Freeman Hrabowski,15:10,"education,inequality,math,science,technology,psychology,history,race,engineering,curiosity,community,medical research,social change"
"
											En tercer lugar, la idea de emplear 
investigadores para producir investigadores.
											Ya sea que hablemos de artistas 
que producen artistas
											o de personas que ingresen 
a las ciencias sociales,
											en cualquier disciplina —y sobre todo en 
ciencias e ingeniería, como en arte, por ejemplo—
											se necesitan científicos para 
empujar a los alumnos al trabajo.
											Así nuestros estudiantes están 
trabajando normalmente en laboratorios.
									","
											Terceiro, a ideia de que são necessários 
investigadores para formar investigadores.
											Fala-se de artistas que formam artistas
											ou de pessoas a enveredar pelas ciências 
sociais, qualquer que seja a disciplina
											— especialmente na ciência e engenharia, 
como nas artes, por exemplo —
											são necessários cientistas 
para colocar estudantes a trabalhar.
											Pelo que os nossos estudantes trabalham 
regularmente nos laboratórios.
									","
											Üçüncüsü, şu fikir: araştırmacı yetiştirmek için araştırmacılar gerekir.
											İster sanatçı yetiştiren sanatçılardan bahsedin,
											ister insanların sosyal bilimlerle ilgilenmeye başlamasından,
											disiplin ne olursa olsun — ve özellikle sanatta olduğu gibi bilim ve mühendislik alanlarında örneğin —
											öğrencileri konuya çekmek için bilim adamlarına ihtiyaç duyarsınız.
											Bu yüzden bizim öğrencilerimiz düzenli olarak laboratuvarlarda çalışıyor.
									","
											Third, the idea of, it takes researchers to produce researchers.
											Whether you're talking about artists producing artists
											or you're talking about people getting into the social sciences,
											whatever the discipline — and especially in science and engineering, as in art, for example —
											you need scientists to pull the students into the work.
											And so our students are working in labs regularly.
									","
											En troisième lieu, il faut des chercheurs 
pour produire des chercheurs.
											Si vous parlez d'artistes produisant des artistes
											ou que vous parlez des gens 
qui entrent dans les sciences sociales,
											quelque soit la discipline, en particulier en sciences et en génie, comme en art, par exemple,
											vous avez besoin de scientifiques pour pousser les élèves dans le travail.
											Et si nos élèves travaillent dans 
des laboratoires régulièrement.
									",4 pillars of college success in science,Freeman Hrabowski,15:10,"education,inequality,math,science,technology,psychology,history,race,engineering,curiosity,community,medical research,social change"
"
","
","
","
","
",4 pillars of college success in science,Freeman Hrabowski,15:10,"education,inequality,math,science,technology,psychology,history,race,engineering,curiosity,community,medical research,social change"
"
											Un gran ejemplo que apreciarán:
											Durante una tormenta de nieve 
en Baltimore hace varios años,
											el hombre en nuestro campus con una 
subvención del Instituto Howard Hughes Medical
											de hecho regresó a trabajar en 
su laboratorio después de varios días,
											y todos los estudiantes se negaban 
a abandonar el laboratorio.
											Tenían comida que 
habían acumulado.
											Trabajaban en el laboratorio,
											y veían el trabajo, no como trabajo 
escolar, sino como sus vidas.
											Ellos sabían que estaban trabajando 
en la investigación del SIDA.
											Observaban ese diseño 
de proteínas increíble.
											Y lo interesante era que todos 
se concentraban en ese trabajo.
											Y decían: ""Nada mejor que esto"".
									","
											E um grande exemplo que irão apreciar:
											Durante uma tempestade de neve 
em Baltimore, há alguns anos,
											um rapaz no nosso ""campus"" com uma
bolsa do Instituto Médico Howard Hughes
											voltou para trabalhar 
no laboratório após vários dias.
											Todos os estudantes tinham-se recusado 
a deixar o laboratório.
											Tinham comida que haviam embalado.
											Estavam no laboratório a trabalhar,
											e viam o trabalho, não como tarefa
escolar, mas como as suas vidas.
											Eles sabiam que estavam a trabalhar 
na pesquisa da SIDA.
											Observavam a espantosa configuração 
de uma proteína.
											O interessante é como cada um 
se focava nesse trabalho.
											Disse ele: 
""Não se consegue melhor do que isto.""
									","
											Ve yine hoşunuza gidecek bir başka güzel örnek:
											Birkaç yıl önce Baltimore'daki bir kar fırtınası sırasında,
											kampüsümüzde Howard Hughes Tıp Enstitüsü bursu alan öğrencilerimizden biri
											birkaç gün sonra laboratuvarında çalışmak üzere geri döndü,
											ve tüm bu öğrenciler laboratuvardan çıkmayı reddetmişti.
											Önceden yanlarına yiyecek almışlardı.
											Laboratuvarda çalışıyorlardı,
											ve işi okul ödevi olarak değil, yaşamlarının bir parçası olarak görüyorlardı.
											AIDS araştırmasında yer aldıklarını biliyorlardı.
											Proteinin muhteşem tasarımını inceliyorlardı.
											Ve ilginç olan, hepsinin bu işe odaklanmış olmasıydı.
											Ve o öğrenci: ""Bundan daha iyi olamaz"" dedi.
									","
											And one great example that you'll appreciate:
											During a snowstorm in Baltimore several years ago,
											the guy on our campus with this Howard Hughes Medical Institute grant
											literally came back to work in his lab after several days,
											and all these students had refused to leave the lab.
											They had food they had packed out.
											They were in the lab working,
											and they saw the work, not as schoolwork, but as their lives.
											They knew they were working on AIDS research.
											They were looking at this amazing protein design.
											And what was interesting was each one of them focused on that work.
											And he said, ""It doesn't get any better than that.""
									","
											Un grand exemple que vous apprécierez :
											Au cours d'une tempête de neige à 
Baltimore il y a plusieurs années.
											le gars sur notre campus avec sa subvention de l'institut médical Howard Hughes
											est revenu travailler dans son labo après plusieurs jours
											et tous ses élèves avaient refusé de quitter le laboratoire.
											Ils avaient de la nourriture qu'ils avaient amenée.
											Ils étaient dans le laboratoire à travailler
											et ils ont vu le travail, non pas comme le travail scolaire, mais comme leur vie.
											Ils savaient qu'ils travaillaient 
sur la recherche sur le sida.
											Ils regardaient cette conception 
étonnante de protéine.
											Et ce qui était intéressant est que chacun d'eux 
se concentrait sur son travail.
											Et, il a dit, « Ça ne peux pas être meilleur que ça. »
									",4 pillars of college success in science,Freeman Hrabowski,15:10,"education,inequality,math,science,technology,psychology,history,race,engineering,curiosity,community,medical research,social change"
"
","
","
","
","
",4 pillars of college success in science,Freeman Hrabowski,15:10,"education,inequality,math,science,technology,psychology,history,race,engineering,curiosity,community,medical research,social change"
"
											Y por último, si tenemos la comunidad
											y las expectativas altas e investigadores 
que produzcan investigadores,
											tiene que haber gente 
que está dispuesta a
											involucrarse con los estudiantes, 
incluso en la sala de clases.
											Nunca olvidaré a un miembro del 
profesorado llamando al personal y diciendo:
											""Tengo a este joven negro en clase
											y al parecer no está 
entusiasmado con el trabajo.
											No toma notas. 
Tenemos que hablar con él"".
											Lo importante fue que el profesor 
observaba a cada estudiante
											para descubrir en qué 
se involucraba y en qué no.
											Decía: ""Veamos cómo 
puedo trabajar con ellos.
											Permítanme conseguir 
el personal que me asista"".
											Era esa conexión.
											Hoy ese joven es profesor con posgrados
en neuroingeniería en Duke.
											Démosle un gran aplauso.
									","
											E finalmente, se conseguem a comunidade
											e têm altas expectativas e têm
investigadores a formar investigadores,
											têm de ter pessoas dispostas, 
enquanto faculdade,
											a envolver-se com esses alunos, 
mesmo na sala de aula.
											Nunca esquecerei um membro da faculdade 
que foi ter com funcionários, e disse:
											""Tenho um jovem na aula, um jovem negro,
											""que não parece entusiasmado
com o trabalho.
											""Não tira notas. Temos de falar com ele.""
											O significativo foi que o membro da 
faculdade observava cada estudante
											para compreender quem estava mesmo 
envolvido e quem não estava e dizia:
											""Vejamos como posso trabalhar com eles.
											""Deixem-me conseguir a ajuda
dos funcionários."" Era assim a ligação.
											Esse jovem é hoje membro de 
Neuroengenharia
											na faculdade de Medicina em Duke.
											Um grande aplauso para ele por isso.
									","
											Ve son olarak, birlik sağlamışsanız
											ve yüksek beklentileriniz ve araştırmacı yetiştiren araştırmacılara sahipseniz,
											fakülte olarak sınıfta bile bu öğrencilerle ilgilenmek için
											istekli olacak insanlara sahip olmalısınız.
											Bir fakülte üyesinin personeli çağırıp,
											""Sınıfta genç bir çocuk var, genç bir siyahi öğrenci,
											ve iş için yeterli hevesi yakalayamamış gibi görünüyor.
											Not almıyor. Onunla konuşmamız lazım"" dediğini unutmayacağım.
											Önemli nokta şuydu; fakülte üyesi her öğrenciyi gözlemliyordu, çünkü
											kimin ilgili olup kimin olmadığını anlamaya çalışıyordu
											ve şunu diyordu: ""Bakalım onlarla nasıl çalışabilirim.
											Bana yardım etmeleri için personeli toplamalıyım.""
											Bu kadar birleştiriciydi.
											Bugün o genç adam Duke Üniversitesi'nde neromühendislik alanında doktora sahibi bir fakülte üyesi.
											Ona da büyük bir alkış alayım.
									","
											And then finally, if you've got the community
											and you've got the high expectations and you've got researchers producing researchers,
											you have to have people who are willing as faculty
											to get involved with those students, even in the classroom.
											I'll never forget a faculty member calling the staff and saying,
											""I've got this young man in class, a young black guy,
											and he seems like he's just not excited about the work.
											He's not taking notes. We need to talk to him.""
											What was significant was that the faculty member was observing every student
											to understand who was really involved and who was not
											and was saying, ""Let me see how I can work with them.
											Let me get the staff to help me out.""
											It was that connecting.
											That young man today is actually a faculty member M.D./Ph.D. in neuroengineering at Duke.
											Give him a big hand for that.
									","
											Et puis enfin, si vous avez la communauté
											et vous avez de hautes attentes, et vous avez des chercheurs produisant des chercheurs,
											vous devez avoir des gens qui sont prêts
											à s'impliquer avec les élèves, 
même dans la salle de classe.
											Je n'oublierai jamais un membre de la faculté appelant le personnel et dire:
											« J'ai ce jeune homme dans ma classe, un jeune noir.
											Il ne semble pas intéressé par le travail.
											Il ne prends pas de notes. Nous avons besoin de lui parler. »
											Ce qui était important était que le membre du corps professoral observait tous les étudiants
											pour comprendre qui était vraiment impliqué et qui ne l'était pas
											et disait, « Je voudrais voir comment 
je peux travailler avec eux.
											Permettez-moi d'avoir accès au personnel pour m'aider. »
											C'était cette connexion.
											Ce jeune homme est maintenant chargé de cours au doctorat en neuro-ingénierie à Duke
											Vous pouvez l'applaudir pour ça.
									",4 pillars of college success in science,Freeman Hrabowski,15:10,"education,inequality,math,science,technology,psychology,history,race,engineering,curiosity,community,medical research,social change"
"
","
","
","
","
",4 pillars of college success in science,Freeman Hrabowski,15:10,"education,inequality,math,science,technology,psychology,history,race,engineering,curiosity,community,medical research,social change"
"
											(Aplausos)
									","
											(Aplausos)
									","
											(Alkışlar)
									","
											(Applause)
									","
											(Applaudissements)
									",4 pillars of college success in science,Freeman Hrabowski,15:10,"education,inequality,math,science,technology,psychology,history,race,engineering,curiosity,community,medical research,social change"
"
","
","
","
","
",4 pillars of college success in science,Freeman Hrabowski,15:10,"education,inequality,math,science,technology,psychology,history,race,engineering,curiosity,community,medical research,social change"
"
											Entonces lo importante es que 
hemos desarrollado este modelo
											que nos ayuda en la evaluación 
de lo que funciona.
											Lo que aprendimos fue que se necesitamos 
pensar sobre el rediseño de los cursos.
											Por eso rediseñamos química y física.
											Pero ahora estamos considerando el rediseño 
de las humanidades y ciencias sociales.
											Debido a que tantos 
alumnos se aburren en clase.
											¿Saben eso?
											Muchos estudiantes de educación 
básica y universitarios,
											no quieren solo sentarse 
ahí y escuchar a alguien.
											Necesitan participar.
									","
											O significado é que 
desenvolvemos este modelo
											que nos está a ajudar não só na avaliação,
mas a perceber o que funciona.
											O que aprendemos foi que tínhamos 
de pensar em reestruturar as cadeiras.
											Reestruturámos a Química, 
reestruturámos a Física.
											Mas agora estamos a pensar reestruturar
as Ciências Sociais e Humanas.
											Porque muitos alunos 
estão aborrecidos na aula.
											Sabiam isso?
											Muitos alunos, no ensino básico 
e nas universidades,
											não querem sentar-se ali 
e ouvir alguém falar.
											Têm de ser envolvidos.
									","
											Ve önemli olan şey bu modeli geliştirmiş olmamız
											ki bu model sadece değer biçmede değil, neyin işe yaradığını değerlendirmede de yardımcı oluyor.
											Ve şunu öğrendik ki dersleri yeniden tasarlama üzerine kafa yormalıyız.
											Ve böylece kimyayı yeniden tasarladık, fiziği yeniden tasarladık.
											Fakat şu an gözümüzü beşeri ve sosyal bilimleri yeniden tasarlamaya dikmiş durumdayız.
											Çünkü derslerde birçok öğrenci sıkılıyor.
											Bunu biliyor musunuz?
											Birçok öğrenci, K-12'de ve üniversitelerde,
											sadece yerlerinde oturup konuşan birisini dinlemek istemiyor.
											Olaya dahil olmak istiyorlar.
									","
											And so the significance is that we have now developed this model
											that is helping us, not only finally with evaluation, assessing what works.
											And what we learned was that we needed to think about redesigning courses.
											And so we redesigned chemistry, we redesigned physics.
											But now we are looking at redesigning the humanities and social sciences.
											Because so many students are bored in class.
											Do you know that?
											Many students, K-12 and in universities,
											don't want to just sit there and listen to somebody talk.
											They need to be engaged.
									","
											Et donc l'important, c'est que 
nous avons développé ce modèle
											qui nous aide, pas seulement avec l'évaluation, 
mais évaluer ce qui fonctionne.
											Et ce que nous avons appris c'est qu'il fallait réfléchir à la refonte des cours.
											Et donc nous avons repensé la chimie, 
nous avons repensé la physique.
											Mais maintenant nous nous penchons sur la refonte des sciences humaines et sociales.
											Parce qu'il y tant d'étudiants qui s'ennuient en classe.
											Savez-vous ça ?
											Beaucoup d'étudiants, pré-universitaires et universitaires,
											ne veulent pas juste s'asseoir et écouter quelqu'un parler.
											Ils doivent s'engager.
									",4 pillars of college success in science,Freeman Hrabowski,15:10,"education,inequality,math,science,technology,psychology,history,race,engineering,curiosity,community,medical research,social change"
"
","
","
","
","
",4 pillars of college success in science,Freeman Hrabowski,15:10,"education,inequality,math,science,technology,psychology,history,race,engineering,curiosity,community,medical research,social change"
