en,es,tr,fr,de,title,speaker,duration,tags
"
											And so we had our first meeting, after three months, in Tiburon,
											which is just up the road from here — you know Tiburon?
											And the idea was after the first three months of this independent research
											they would present it all to Dr. Goschel —
											who is now my boss, and at that time he was co-mentor on the project —
											and they would present their results.
											We would see where we were going,
											we would see the first indication of what could be
											the successive phenomenon to the SUV in America.
											And so I had these ideas in my head, that this is going to be great.
											I mean, I'm going to see so much work, it's so intense —
											I know probably Las Vegas meant a lot about it,
											and I'm not really sure where the Grand Canyon came in either —
											but somehow all this is going to come together,
											and I'm going to see some really great product.
											So we went to Tiburon, after three months,
											and the team had gotten together the week before,
											many days ahead of time.
											The engineers flew over, and designers got together with them,
											and they put their presentation together.
									","
											Así que tuvimos nuestra primera reunión, después de tres meses, en Tiburón,
											que está un poco más arriba de aquí por la carretera — ¿conocéis Tiburón?
											Y la idea era que después de los tres primeros meses de esta investigación independiente
											presentarían todo al Dr. Goschel
											(que ahora es mi jefe, y que en aquella época era mi co-mentor en el proyecto)
											y que presentarían sus resultados.
											Veríamos hacía donde estábamos yendo,
											veríamos el primer indicio de lo que podría ser
											el fenómeno sucesor del 4x4 en EE.UU.
											Así que tenía estas ideas en mi cabeza, que esto iba a ser genial.
											Quiero decir, voy a ver tanto trabajo, es tan intenso —
											sé que probablemente Las Vegas tuvo un montón de importancia,
											y no estoy del todo seguro donde entra el Gran Cañón tampoco —
											pero de algún modo todo esto se va a unir,
											y voy a ver algún producto realmente genial.
											Así que fuimos a Tiburón, después de tres meses,
											y el equipo se había juntado la semana anterior,
											bastantes días antes de tiempo.
											Los ingenieros volaron allí, y los diseñadores se reunieron con ellos,
											y juntos prepararon su presentación.
									","
											Ve böylece, üç ay sonra Tiburon'da ilk toplantımızı yaptık,
											hemen buradaki yolun yukarısında — Tiburon'u biliyorsunuz değil mi?
											Ve bu bağımsız araştırmanın ilk üç ayından sonra ortaya çıkan fikri
											bütünüyle Dr. Goschel 'e sunacaklardı —
											kendisi benim şimdiki patronum, o zamanda projenin fikir ortağıydı —
											ve elde ettikleri sonuçları bildireceklerdi.
											Nereye gittiğimizi ve
											Amerika'nın arazi aracı fenomeninin varisinin
											ne olabileceğinin ilk ipuçlarını görecektik.
											Kafamda bunlar vardı ve muhteşem olacaktı.
											Yani, çok fazla çalışma görecektim, çok yoğun—
											Las Vegas""ın bu işte çok şey demek olduğunu biliyorum,
											ve Büyük Kanyon tam olarak bu işe nerede dahil oldu gerçekten emin değilim —
											ama bunlar bir şekilde bir araya gelecekti,
											ve ben gerçekten muhteşem ürünler görecektim.
											Üç ay sonra Tiburon'a gittik,
											ve ekip bir hafta öncesinden bir araya gelmişti,
											zamanından çok önce.
											Mühendisler uçakla geldiler ve tasarımcılar onlarla buluştu,
											ve sunumlarını bir araya getirdiler.
									","
											Et donc nous avons eu notre première réunion, au bout de trois mois, à Tiburon,
											qui est à deux pas d'ici - vous connaissez Tiburon?
											Et l'idée était qu'au bout des trois premiers mois de ces recherches indépendantes
											ils présenteraient le tout à M. Goschel -
											qui est maintenant mon patron, et à cette époque, était le co-mentor sur le projet -
											et ils présenteraient leurs résultats.
											Nous pourrions voir où nous allions,
											nous verrions la première indication de ce qui pourrait être
											le phénomène qui succèderait au SUV en Amérique.
											Et j'avais donc ces idées dans ma tête, que ça allait être génial.
											Je veux dire, je vais voir tant de travail, c'est si intense -
											Je sais que probablement Las Vegas y était pour beaucoup,
											et je ne suis pas vraiment sûr de ce qu'apportait le Grand Canyon -
											mais de toute façon tout cela allait s'assembler,
											et j'allais voir un produit vraiment super.
											Donc nous sommes allés à Tiburon, après trois mois,
											et l'équipe s'était réunie la semaine précédente,
											plusieurs jours à l'avance.
											Les ingénieurs étaient venus en avions, et les designers se sont réunis avec eux,
											et ils ont préparé leur présentation ensemble.
									","
											Und so hatten wir nach drei Monaten unser erstes Treffen in Tiburon,
											das gleich hier um die Ecke ist — kennen Sie Tiburon?
											Der Plan war, dass sie nach drei Monaten dieser unabhängigen Forschung
											alles Dr. Goschel präsentieren würden —
											der jetzt mein Chef ist und zu jener Zeit Co-Mentor des Projektes war —
											und sie würden ihre Resultate zeigen.
											Wir würden sehen, wo es langging,
											wir würden die ersten Zeichen dessen sehen, was
											die Nachfolge des SUV-Phänomens sein könnte.
											Also ging ich an die Sache mit der Erwartung, dass alles ganz großartig laufen würde.
											Ich meine, ich würde so viel Arbeit sehen, es ist so intensiv —
											Ich weiss, dass Las Vegas dabei wahrscheinlich eine große Rolle spielen würde —
											ich bin auch nicht wirklich sicher, wo der Grand Canyon ins Spiel kam —
											aber irgendwie würde sich alles zusammenfinden
											und ich würde ein wirklich herausragendes Produkt sehen.
											Also gingen wir nach drei Monaten nach Tiburon,
											und das Team hatte sich die Woche vorher getroffen,
											lange vor der Zeit.
											Die Ingenieure flogen herüber, und die Designer trafen sich mit ihnen
											und sie stellten ihre Präsentation zusammen.
									",Great cars are great art,Chris Bangle,20:04,"business,cars,design,industrial design,invention,technology,transportation,art"
"
","
","
","
","
",Great cars are great art,Chris Bangle,20:04,"business,cars,design,industrial design,invention,technology,transportation,art"
"
											Well, it turns out that the engineers hadn't done anything.
											And they hadn't done anything because —
											kind of, like in car business, engineers are there to solve problems,
											and we were asking them to create a problem.
											And the engineers were waiting for the designers to say,
											""This is the problem that we've created, now help us solve it.""
											And they couldn't talk about it. So what happened was,
											the engineers showed up with nothing.
											And the engineers told the designers,
											""If you go in with all your stuff, we'll walk out,
											we'll walk right out of the project.""
									","
											Bien, resulta que los ingenieros no habían hecho nada.
											Y no habían hecho nada porque —
											un poco, digamos que en el negocio de los coches, los ingenieros están ahí para resolver problemas,
											y les estábamos pidiendo que creasen un problema.
											Y los ingenieros estaban esperando a que los diseñadores dijesen,
											""Este es el problema que hemos creado, ahora ayudadnos a resolverlo"".
											Y no pudieron hablar de ello. Así que lo que sucedió fue,
											que los ingenieros aparecieron sin nada.
											Y los ingenieros le dijeron a los diseñadores,
											""Si entráis con todo lo vuestro, nos vamos,
											abandonamos directamente el proyecto"".
									","
											Sanki mühendisler hiç bir şey yapmamışlardı.
											Hiçbir şey yapmamışlardı çünkü —
											araba işinde mühendisler problemleri çözmek için vardır,
											ve biz onlardan problem yaratmalarını istiyorduk.
											Mühendisler tasarımcıların şöyle demesini bekliyordu,
											""Yarattığımız problem bu, şimdi çözmemiz için yardım edin.""
											Ve bununla ilgili konuşamadılar. Dolayısıyla da
											mühendislerin sunacak hiçbir şeyi yoktu.
											Mühendisler tasarımcılara,
											""Elinizdekilerle sunum yaparsanız, biz çekip gideriz,
											projeyi tamamıyla bırakırız.""
									","
											Eh bien, il s'est avéré que les ingénieurs n'avaient rien fait.
											Et ils n'avaient rien fait parce que -
											comme dans l'industrie automobile, les ingénieurs sont là pour résoudre des problèmes,
											et nous leur demandions de créer un problème.
											Et les ingénieurs attendaient que les designeurs leur disent,
											""Voici le problème que nous avons créé, maintenant aidez-nous à le résoudre.""
											Et ils ne pouvaient pas en parler. Donc ce qui s'est passé,
											les ingénieurs se sont pointé avec rien.
											Et les ingénieurs ont dit aux designers ,
											""Si vous arrivez avec tous vos trucs, nous partons,
											nous nous retirerons du projet. ""
									","
											Nun, es stellte sich heraus, dass die Ingenieure nichts getan hatten.
											Und sie hatten deshalb nichts getan, weil —
											sozusagen, wie das in der Autobranche so ist, Ingenieure zum Lösen von Problemen da sind,
											und wir hatten sie gebeten, ein Problem zu schaffen.
											Und die Ingenieure warteten darauf, dass die Designer sagen würden:
											""Hier ist das Problem, das wir geschaffen haben, nun helft uns, es zu lösen.""
											Und sie konnten nicht darüber reden. Es kam also so weit,
											dass die Ingenieure mit leeren Händen ankamen.
											Und die Ingenieure sagten zu den Designern:
											""Wenn ihr all diesen Kram einbringt, dann gehen wir,
											dann werden wir dieses Projekt verlassen.""
									",Great cars are great art,Chris Bangle,20:04,"business,cars,design,industrial design,invention,technology,transportation,art"
"
","
","
","
","
",Great cars are great art,Chris Bangle,20:04,"business,cars,design,industrial design,invention,technology,transportation,art"
"
											So I didn't know any of this,
											and we got a presentation that had an agenda, looked like this.
											There was a whole lot of dialog.
											We spent four hours being told all about vocabulary
											that needs to be built between engineers and designers.
											And here I'm expecting at any moment, ""OK, they're going to turn the page,
											and I'm going to see the cars, I'm going to see the sketches,
											I'm going to see maybe some idea of where it's going.""
											Dialog kept on going, with mental maps of words, and pretty soon
											it was becoming obvious that instead of being dazzled with brilliance,
											I was seriously being baffled with bullshit.
											And if you can imagine what this is like,
											to have these months of postcard indication of how great this team is working,
											and they're out there spending all this money, and they're learning,
											and they're doing all this stuff.
											I went fucking ballistic, right? I went nuts.
											You can probably remember Tiburon, it used to look like this.
									","
											Así que yo no sabía nada de todo esto,
											y tuvimos una presentación que tenía una agenda, que tenía este aspecto.
											Hubo mucho diálogo.
											Nos pasamos cuatro horas escuchando todo acerca del vocabulario
											que necesita crearse entre ingenieros y diseñadores.
											Y yo aquí esperando que en cualquier momento, ""Bien, van a pasar la página,
											y voy a ver los coches, voy a ver los bocetos,
											voy a ver tal vez una idea de a dónde se dirige"".
											La conversación seguía adelante, con mapas mentales de palabras, y bastante pronto
											se estaba volviendo obvio que en lugar de ser deslumbrado por la brillantez,
											estaba siendo seriamente distraído con minucias.
											Y os podéis imaginar lo que es esto,
											tener todos estos meses de indicaciones por postales de lo bien que este equipo está trabajando,
											y están ahí fuera gastando todo este dinero, y están aprendiendo,
											y están haciendo todas estas cosas.
											Me enfadé mucho, ¿vale? Me volví loco.
											Probablemente podéis recordar Tiburón, solía tener este aspecto.
									","
											Benim bunların hiçbirinden haberim yoktu,
											ve bize yapılacak işlerin yazılı olduğu buna benzer bir sunum yaptılar.
											Dünya kadar görüşme oldu.
											Dört saat boyunca bize
											mühendisler ve tasarımcılar arasında oluşması gereken jargondan bahsedildi.
											Ve her an için beklentim şuydu, ""Tamam, şimdi sayfayı çevirecekler,
											ve ben arabaları göreceğim, çizim taslaklarını göreceğim,
											işin nereye gittiğine dair bazı fikirler edineceğim.""
											Konuşmalar sürdü gitti, kelimelerin zihinsel haritaları vardı ve çok geçmeden
											anlaşıldı ki dahilikleri karşısında şaşırmaktansa
											ben ciddi şekilde saçmalıklara maruz kalıyordum.
											Nasıl olduğunu tahmin edebilirsiniz,
											bu ekibin nasıl muhteşem işler yaptığına dair izler taşıyan kartpostallar alarak aylar geçirmek,
											ve onların orada para harcayıp öğrendiklerini
											ve iş yaptığını düşünmek.
											Beynime kan sıçramıştı, anlıyor musunuz? Deliye döndüm.
											Tiburon'u muhtemelen hatırlarsınız, normalde böyle bir yerdir.
									","
											Donc, je ne savais rien de tout cela,
											et nous avions une présentation qui avait un ordre du jour, et tout ça.
											Il y avait beaucoup de dialogue.
											Nous avons passé quatre heures à entendre parler du vocabulaire
											qu'il faut construire entre les ingénieurs et les designers.
											Et là, je m'attends à tout moment, ""OK, on va tourner la page,
											et je vais voir les voitures, je vais voir les croquis,
											Je vais peut-être voir une idée de la direction où on va.""
											Le dialogue continue , avec des cartes mentales de mots, et bientôt
											il est devenu évident que, au lieu d'être ébloui par la brillance,
											j'ai été sérieusement dérouté par les conneries.
											Et si vous pouvez imaginer à quoi ça ressemble,
											d'avoir pendant des mois des indications par cartes postales de la super façon dont l'équipe travaille,
											et ils sont là dehors à dépenser tout cet argent, et ils apprennent,
											et ils font tous ces trucs.
											J'ai pété les plombs, vous comprenez? Ça m'a rendu fou.
											Vous vous souvenez probablement de Tiburon, ça ressemblait à ça.
									","
											Ich wusste davon nichts,
											und wir bekamen eine Präsentation mit einer Agenda, die so aussah.
											Es gab eine Menge Dialog.
											Geschlagene vier Stunden wurde uns alles über das Vokabular erzählt,
											das zwischen Designern und Ingenieuren geschaffen werden muss.
											Und ich rechne jeden Moment damit: ""Okay, sie werden die Seite umschlagen,
											und ich werde Autos sehen, ich werde die Zeichnungen sehen.
											Ich werde vielleicht eine Ahnung davon bekommen, wo es langgeht.""
											Der Dialog ging weiter und weiter, mit mentalen Bildern für Worte, und es stellte
											sich recht bald heraus, dass ich nicht von Brillanz überwältigt wurde, sondern
											dass ich ganz ernsthaft von einer Menge Mist überhäuft wurde.
											Wenn Sie sich vorstellen können, wie das ist,
											all diese Monate mit Postkartenhinweisen, wie großartig das Team arbeitet,
											und dann geben sie all das Geld aus und lernen
											und sie machen all diesen Kram.
											Ich fuhr völlig aus der Haut, wissen Sie? Ich wurde irre.
											Sie können sich wahrscheinlich an Tiburon erinnern, früher sah es einmal so aus.
									",Great cars are great art,Chris Bangle,20:04,"business,cars,design,industrial design,invention,technology,transportation,art"
"
","
","
","
","
",Great cars are great art,Chris Bangle,20:04,"business,cars,design,industrial design,invention,technology,transportation,art"
"
											After four hours of this, I stood up, and I took this team apart.
											I screamed at them, I yelled at them, ""What the hell are you doing?
											You're letting me down, you're my designers,
											you're supposed to be the creative ones,
											what the hell is going on around here?""
											It was probably one of my better tirades, I have some good ones,
											but this was probably one of my better ones. And I went into these people;
											how could they take BMW's money,
											how could they have a holiday for three months and produce nothing, nothing?
											Because of course they didn't tell us that they had three station wagons
											full of drawings, model concepts, pictures — everything I wanted,
											they'd locked up in the cars, because they had shown solidarity with the engineers —
											and they'd decided not to show me anything,
											in order to give the chance for problem solving a chance to start,
											because they hadn't realized, of course,
											that they couldn't do problem creating.
											So we went to lunch —
									","
											Después de cuatro horas de esto, me levanté, e hice pedazos a este equipo.
											Les abronqué, les grité, ""¿Qué demonios estáis haciendo?
											Me estáis decepcionando, sois mis diseñadores,
											se supone que tenéis que ser los creativos,
											¿qué coño está pasando aquí?""
											Fue probablemente una de mis mejores broncas, tengo algunas buenas,
											pero esta probablemente fue una de las mejores. Y le dije a esta gente;
											¿cómo podían coger el dinero de BMW,
											cómo podían tomarse tres meses de vacaciones y no tener nada, nada?
											Porque por supuesto no nos dijeron que tenían tres furgonetas
											llenas de dibujos, modelos de prototipos, fotos — todo lo que quería
											lo habían guardado en los coches, porque habían mostrado solidaridad con los ingenieros —
											y habían decidido no enseñarme nada,
											para darle a la oportunidad de resolver los problemas una oportunidad de comenzar,
											porque no se habían dado cuenta, por supuesto,
											que no podían crear problemas.
											Así que nos fuimos a comer —
									","
											Bu dört saatten sonra, ayağa kalktım ve bu ekibi darmadağın ettim.
											Onlara bağırıp çağırdım, ""Ne halt ediyorsunuz?
											Beni hayal kırıklığına uğratıyorsunuz, siz benim tasarımcılarımsınız,
											sizin yaratıcı olmanız gerekiyor,
											burada dönen saçmalıkta ne?""
											Bu muhtemelen benim en iyi tiradlarımdan biriydi, birkaç tane iyi tiradım vardır,
											ama bu muhtemelen en iyilerinden biriydi. Ve bu insanların içine işlemiştim;
											BMW'nin parasını nasıl alabilirlerdi,
											nasıl üç ay boyunca tatil yapıp hiçbir şey üretmezlerdi, hiçbir şey?
											Çünkü tartışma nedeniyle bize üç tane pikapın
											çizimler, modeller ve resimlerle —yani istediğim her şeyle dolu olduğunu söylememişlerdi,
											arabaların içinde kilitliydiler, çünkü mühendislerle dayanışma içindeydiler —
											ve bana hiç bir şey göstermemeye karar vermişlerdi.
											problem çözümü için yapılacak başlangıç adına bir şans vernek için,
											çünkü, ki bu normal,
											problem yaratamadıklarını fark edememişlerdi.
											Böylece öğlen yemeğine gittik —
									","
											Après quatre heures, je me suis levé et j'ai mis cette équipe en miette.
											J'ai leur ai crié dessus, j'ai hurlé, «Qu'est-ce que vous fichez?
											Vous me laisser tomber, vous êtes mes designers,
											vous êtes censés être les créatifs,
											bon sang, qu'est-ce qui se passe ici? ""
											C'était probablement une de mes meilleures tirades, j'en ai de bonnes,
											mais ce fut probablement une de mes meilleurs. Et je leur suis rentré dedans;
											comment pouvaient-ils prendre l'argent de BMW,
											comment pouvaient-ils avoir des vacances pendant trois mois et ne rien produire, rien?
											Parce que bien sûr, ils ne nous disaient pas qu'ils avaient trois breaks
											plein de dessins, de modèles, de photos - tout ce que je voulais,
											qu'ils avaient enfermés dans les voitures, parce qu'ils avaient manifesté leur solidarité avec les ingénieurs -
											et ils avaient décidé de ne pas me montrer quoi que ce soit,
											afin de donner à la résolution des problèmes une chance de commencer,
											parce qu'ils ne s'étaient pas rendus compte, bien sûr,
											qu'ils ne pouvaient pas créer de problème.
											Donc nous sommes allés déjeuner -
									","
											Nach vier Stunden stand ich auf und stauchte das Team zusammen.
											Ich schrie sie an. Ich brüllte: ""Was zur Hölle macht ihr hier?
											Ihr habt mich im Stich gelassen, ihr seid meine Designer,
											ihr sollt hier die Kreativen sein.
											Was in aller Welt ist hier los?""
											Das war wahrscheinlich eine meiner besseren Tiraden, ich habe schon ein paar ganz gute,
											aber das war wahrscheinlich eine der besseren. Und ich drang in diese Leute ein,
											wie konnten sie einfach das Geld von BMW nehmen,
											wie konnten sie drei Monate Urlaub machen und nichts produzieren, einfach nichts?
											Weil sie uns natürlich nicht erzählt hatten, dass sie drei Kombiwagen voller
											Zeichnungen, Modellkonzeptionen, Bilder hatten — alles, was ich wollte,
											die sie in ihren Autos eingeschlossen hatten, weil sie ihre Solidarität mit den Ingenieuren gezeigt hatten
											und sie hatten entschieden, mir nichts zu zeigen,
											um der Gelegenheit, mit der Problemlösung zu beginnen eine Chance zu geben,
											weil ihnen natürlich nicht klar war,
											dass sie keine Probleme schaffen konnten.
											Wir gingen also zum Mittagessen —
									",Great cars are great art,Chris Bangle,20:04,"business,cars,design,industrial design,invention,technology,transportation,art"
"
","
","
","
","
",Great cars are great art,Chris Bangle,20:04,"business,cars,design,industrial design,invention,technology,transportation,art"
"
											(Laughter)
									","
											(Risas)
									","
											Ve söylemeliyim ki
									","
											(Rires)
									","
											(Gelächter)
									",Great cars are great art,Chris Bangle,20:04,"business,cars,design,industrial design,invention,technology,transportation,art"
"
","
","
","
","
",Great cars are great art,Chris Bangle,20:04,"business,cars,design,industrial design,invention,technology,transportation,art"
