en,fr,tr,title,speaker,duration,tags
"
											You heard me say
											that respect for science
started to improve in Canada in 2015.
											How did we get here?
											What lessons might we have to share?
											Well, it actually goes back
to my time as a professor.
											I watched while agencies, governments
and industries around the world
											suppressed information on climate change.
											It infuriated me.
											It kept me up at night.
											How could politicians
twist scientific fact for partisan gain?
											So I did what anyone
appalled by politics would do:
											I ran for office, and I won.
									","
											J'ai dit tout à l'heure
											que le respect envers la science a
commencé à s'améliorer au Canada en 2015.
											Comment avons-nous fait ?
											Quelles leçons pouvons-nous partager ?
											Eh bien, cela remonte
à l'époque où j'étais professeur.
											J'ai observé comment les agences,
											les gouvernements
et les industries du monde entier
											ont étouffé l'information
sur le changement climatique.
											Cela m'a mise en fureur.
											Cela m'a empêchée de dormir.
											Comment les politiciens pouvaient-ils
tordre les faits scientifiques
											à des fins partisanes ?
											J'ai fait ce que quiconque de consterné
par la politique aurait fait :
											je me suis présentée
aux élections et j'ai été élue.
									","
											Size Kanada'da
											bilime olan saygının 2015 yılında
ilerlediğini söyledim.
											Bu aşamaya nasıl geldik?
											Paylaşmamız gereken dersler ne?
											Benim akademisyen olduğum
zamana gidiyor aslında.
											Kurumlar, hükûmetler ve endüstri
iklim değişikliği haberlerini bastırırken
											bunlara seyirci kaldım.
											Beni çileden çıkardı.
											Gece uykularım kaçtı.
											Siyasetçiler daha fazla oy için
nasıl bilimsel gerçekleri çarpıtabilir?
											Ben de siyasetin dehşete düşürdüğü
herkesin yaptığı şeyi yaptım:
											Aday oldum ve kazandım.
									","Scientists must be free to learn, to speak and to challenge",Kirsty Duncan,13:55,"discovery,science,failure,education,social change,society,government"
"
","
","
","Scientists must be free to learn, to speak and to challenge",Kirsty Duncan,13:55,"discovery,science,failure,education,social change,society,government"
"
											(Applause)
									","
											(Applaudissements)
									","
											(Alkışlar)
									","Scientists must be free to learn, to speak and to challenge",Kirsty Duncan,13:55,"discovery,science,failure,education,social change,society,government"
"
","
","
","Scientists must be free to learn, to speak and to challenge",Kirsty Duncan,13:55,"discovery,science,failure,education,social change,society,government"
"
											I thought I would use my new platform
											to talk about the importance of science.
											It quickly became a fight
for the freedom of science.
											After all, I was a scientist,
I came from the world under attack,
											and I had personally felt the outrage.
											I could be a voice
for those who were being silenced.
											But I quickly learned
that scientists were nervous,
											even afraid to talk to me.
									","
											Je voulais utiliser
cette nouvelle plateforme
											pour évoquer l'importance de la science.
											C'est rapidement devenu une bataille
pour la liberté de la science.
											Après tout, j'étais une scientifique,
venant d'un monde qui était attaqué
											et j'avais personnellement
ressenti cette indignation.
											Je pouvais être la voix de ceux
qu'on réduisait au silence.
											Mais j'ai vite compris
que les scientifiques étaient nerveux,
											même inquiets à l'idée de me parler.
									","
											Bu yeni platformu
											bilimin önemi hakkında konuşarak
kullanacağımı sanıyordum.
											Konu hızlı bir şekilde
bilimin bağımsızlığı kavgasına dönüştü.
											Ancak ben zaten bir bilim insanıydım,
saldırıya uğramış bir dünyadan geliyordum
											ve bu öfkeyi bizzat hissettim.
											Susturulan o insanların sesi olabilirdim.
											Öğrendiğim şey ise
bilim insanlarının korktuğuydu,
											hatta benimle konuşmaktan bile.
									","Scientists must be free to learn, to speak and to challenge",Kirsty Duncan,13:55,"discovery,science,failure,education,social change,society,government"
"
","
","
","Scientists must be free to learn, to speak and to challenge",Kirsty Duncan,13:55,"discovery,science,failure,education,social change,society,government"
"
											One government scientist,
a friend of mine,
											we'll call him McPherson,
											was concerned about the impact
											government policies
were having on his research
											and the state of science
deteriorating in Canada.
											He was so concerned, he wrote to me
											from his wife's email account
											because he was afraid
a phone call could be traced.
											He wanted me to phone
his wife's cell phone
											so that call couldn't be traced.
											I only wish I were kidding.
											It quickly brought what was happening
in Canada into sharp focus for me.
											How could my friend of 20 years
be that afraid to talk to me?
											So I did what I could at the time.
											I listened and I shared what I learned
											with my friend in Parliament,
											a man who was interested
in all things environment, science,
											technology, innovation.
											And then the 2015 election rolled around
											and our party won.
											And we formed government.
											And that friend of mine
											is now the Prime Minister
of Canada, Justin Trudeau.
									","
											Un scientifique travaillant
pour le gouvernement, un ami —
											appelons-le McPherson —
											avait des inquiétudes quant à l'impact
											que les politiques gouvernementales
avaient sur ses recherches
											et quant à la détérioration
de l'état de la science au Canada.
											Il était si inquiet qu'il m'a écrit
											en utilisant l'adresse e-mail de sa femme
											parce qu'il avait peur
qu'un appel téléphonique soit tracé.
											Il voulait que je l'appelle
sur le numéro de sa femme,
											pour que son appel ne soit pas tracé.
											J'aimerais que ce soit une blague.
											Cela m'a rapidement fait comprendre
ce qu'il se passait au Canada.
											Combien un ami de 20 ans pouvait
être aussi effrayé de me parler ?
											J'ai donc fait ce que
je pouvais faire à l'époque.
											Je l'ai écouté et j'ai partagé
ce que j'avais appris
											avec mon ami au parlement,
											un homme qui s'intéressait à tout :
l'environnement, la science,
											la technologie, l'innovation.
											Puis, en 2015, les élections ont eu lieu
											et notre parti a gagné.
											Nous avons formé un gouvernement.
											Et cet ami au parlement
											est désormais Premier ministre —
c'est Justin Trudeau.
									","
											Hükûmet çalışanı
bir bilim insanı arkadaşım
											ona McPherson diyeceğim,
											devlet politikalarının
araştırması üzerindeki etkisi
											ve Kanada'da kötüye gitmekte olan
											bilimin mevcut durumu hakkında
bilhassa endişeliydi.
											O kadar endişeliydi ki
											eşinin eposta adresinden bana yazdı
											çünkü telefon konuşmasının
takip edilebileceğinden korkuyordu.
											Konuşabilmek için eşini aramamı istedi,
											arama takibi yapılmasın diye.
											Keşke bunlar gerçek olmasaydı.
											Bu olay Kanada'da olanlara 
derinlemesine odaklanmamı sağladı.
											20 yıllık arkadaşım benimle
konuşmaktan nasıl korkabilirdi?
											O zaman yapabileceğimi yaptım.
											Dinledim ve öğrendiklerimi
											meclisten bir arkadaşımla paylaştım,
											çevre, bilim, teknoloji, inovasyon
gibi konularda
											oldukça ilgili biriydi.
											Sonra 2015 seçimleri yapıldı
											ve partimiz kazandı.
											Ve hükûmeti kurduk.
											Bahsettiğim bu arkadaşım,
											şimdi Kanada Başbakanı Justin Trudeau.
									","Scientists must be free to learn, to speak and to challenge",Kirsty Duncan,13:55,"discovery,science,failure,education,social change,society,government"
"
","
","
","Scientists must be free to learn, to speak and to challenge",Kirsty Duncan,13:55,"discovery,science,failure,education,social change,society,government"
"
											(Applause)
									","
											(Applaudissements)
									","
											(Alkışlar)
									","Scientists must be free to learn, to speak and to challenge",Kirsty Duncan,13:55,"discovery,science,failure,education,social change,society,government"
"
","
","
","Scientists must be free to learn, to speak and to challenge",Kirsty Duncan,13:55,"discovery,science,failure,education,social change,society,government"
"
											And he asked if I would serve
as his Minister of Science.
											Together, with the rest of the government,
											we are working hard to restore
science to its rightful place.
											I will never forget that day
in December 2015
											when I proudly stood in Parliament
											and proclaimed,
											""The war on science is now over.""
									","
											Et il m'a demandé si je voulais devenir
son ministre des Sciences.
											Ensemble, avec tout le gouvernement,
											nous travaillons dur pour redonner
sa juste place à la science.
											Je n'oublierai jamais ce jour
de décembre 2015,
											où j'ai parlé devant le parlement
											et proclamé :
											« La guerre contre la science
est terminée ».
									","
											Benden Bilim Bakanı olmamı istedi.
											Kabinenin geri kalanıyla birlikte
											bilimi hak ettiği yere 
geri taşımak için çok çalışıyoruz.
											2015 Aralık ayındaki
o günü hiç unutmayacağım,
											mecliste gururla durdum
											ve şu sözleri haykırdım:
											''Bilime açılan savaş sona ermiştir.''
									","Scientists must be free to learn, to speak and to challenge",Kirsty Duncan,13:55,"discovery,science,failure,education,social change,society,government"
"
","
","
","Scientists must be free to learn, to speak and to challenge",Kirsty Duncan,13:55,"discovery,science,failure,education,social change,society,government"
"
											(Applause)
									","
											(Applaudissements)
									","
											(Alkışlar)
									","Scientists must be free to learn, to speak and to challenge",Kirsty Duncan,13:55,"discovery,science,failure,education,social change,society,government"
"
","
","
","Scientists must be free to learn, to speak and to challenge",Kirsty Duncan,13:55,"discovery,science,failure,education,social change,society,government"
"
											And I have worked hard
to back up those words with actions.
											We've had many successes.
											There's still more work to do,
											because we're building this culture shift.
											But we want our government scientists
to talk to the media, talk to the public.
											It'll take time, but we are committed.
											After all, Canada is seen
as a beacon for science internationally.
											And we want to send a message
											that you do not mess
with something so fundamental,
											so precious, as science.
									","
											Et j'ai travaillé dur pour que
ces paroles soient suivies d'actes.
											Nous avons connu de nombreuses réussites.
											Il y a encore tant de travail,
											nous construisons
ce changement de mentalité.
											Nous voulons que nos scientifiques
parlent avec les media, avec le public.
											Ça prendra du temps,
mais nous sommes déterminés.
											Après tout, le Canada est perçu
comme un phare pour la science
											dans le monde entier.
											Nous voulons envoyer le message
											qu'il ne faut pas interférer
avec quelque chose d'aussi fondamental,
											d'aussi précieux que la science.
									","
											Ve bu sözlere arka çıkmak için
çok sıkı çalışıyorum.
											Çok başarı elde ettik.
											Hâlâ yapılacaklar var
											çünkü kültürel bir değişim
gerçekleştiriyoruz.
											Devlet için çalışan bilim insanlarımızın
basın ve kamuyla konuşmalarını istiyoruz.
											Zaman alacak ama biz kararlıyız.
											Kanada uluslararası platformda
bilime bir ilham kaynağı oldu.
											Ve biz dünyaya şu mesajı gönderiyoruz,
											bilim gibi bu kadar köklü
ve bu kadar değerli bir şeyi
											altüst edemezsiniz.
									","Scientists must be free to learn, to speak and to challenge",Kirsty Duncan,13:55,"discovery,science,failure,education,social change,society,government"
"
","
","
","Scientists must be free to learn, to speak and to challenge",Kirsty Duncan,13:55,"discovery,science,failure,education,social change,society,government"
"
											So, for Dr. Bothwell, for Claire and Vera,
											for McPherson and all those other voices,
											if you see that science is being stifled,
suppressed or attacked,
											speak up.
											If you see that scientists
are being silenced, speak up.
											We must hold our leaders to account.
											Whether that is
by exercising our right to vote,
											whether it is by penning
an op-ed in a newspaper
											or by starting a conversation
on social media,
											it is our collective voice
that will ensure the freedom of science.
											And after all, science is for everyone,
											and it will lead to a better,
brighter, bolder future for us all.
									","
											Donc, pour le Dr Bothwell,
pour Claire et Vera,
											pour McPherson et tous les autres,
											si vous voyez que la science est
muselée, étouffée ou attaquée,
											faites-le savoir.
											Si vous voyez que des scientifiques
sont réduits au silence, faites-le savoir.
											Nous devons tenir nos leaders
pour responsables.
											Que ce soit en exerçant
notre droit de vote,
											en signant une tribune dans un journal
											ou en lançant une conversation
sur les réseaux sociaux,
											seule notre voix collective
garantira la liberté de la science.
											Et après tout,
la science appartient à tous,
											elle nous mènera tous vers un avenir
meilleur, plus éclatant, plus audacieux.
									","
											Dr. Bothwell için,
Claire ve Vera için,
											McPherson ve tüm diğer sesler için,
											bilimin bastırıldığını, 
bilime saldırı olduğunu görüyorsanız
											sesinizi çıkarın.
											Bilim insanlarının susturulduğunu
görüyorsanız, sesinizi çıkarın.
											Liderlerimizi sorumlu tutmalıyız.
											Bu yeri geldiğinde 
oy verme hakkımızı kullanarak
											yeri geldiğinde bir köşe yazısı olarak
											veya sosyal medyada
bir sohbet başlatarak olabilir.
											Bilimin bağımsızlığını mümkün kılacak şey
bizim beraberlik içindeki sesimiz.
											Çünkü bilim herkes için
											ve hepimizi daha iyi, daha parlak
ve daha kararlı bir geleceğe yönlendirir.
									","Scientists must be free to learn, to speak and to challenge",Kirsty Duncan,13:55,"discovery,science,failure,education,social change,society,government"
"
","
","
","Scientists must be free to learn, to speak and to challenge",Kirsty Duncan,13:55,"discovery,science,failure,education,social change,society,government"
"
											Thank you.
									","
											Merci.
									","
											Teşekkür ederim.
									","Scientists must be free to learn, to speak and to challenge",Kirsty Duncan,13:55,"discovery,science,failure,education,social change,society,government"
"
","
","
","Scientists must be free to learn, to speak and to challenge",Kirsty Duncan,13:55,"discovery,science,failure,education,social change,society,government"
"
											(Applause)
									","
											(Applaudissements)
									","
											(Alkışlar)
									","Scientists must be free to learn, to speak and to challenge",Kirsty Duncan,13:55,"discovery,science,failure,education,social change,society,government"
"
","
","
","Scientists must be free to learn, to speak and to challenge",Kirsty Duncan,13:55,"discovery,science,failure,education,social change,society,government"
