en,es,tr,fr,de,title,speaker,duration,tags
"
											BR: So you see us here cutting up
											some watermelon. The idea with this
											is that we're going to eliminate tons of
											food miles, wasted energy,
											and overfishing of tuna by creating tuna,
											or any exotic produce or item
											from a very far-away place,
											with local, organic produce;
											so we have a watermelon from Wisconsin.
											HC: So if miracle berries take sour things
											and turn them into sweet things,
											we have this other pixie dust
											that we put on the watermelon, and it
											makes it go from sweet to savory.
											So after we do that, we put it into
											a vacuum bag, add a little bit of seaweed,
											some spices, and we roll it, and this
											starts taking on the appearance of tuna.
											So the key now is to make it
											behave like tuna.
											BR: And then after a quick dip into some
											liquid nitrogen to get that perfect sear,
											we really have something that looks,
											tastes and behaves like the real thing.
									","
											BR: Aquí estamos cortando
											una sandía. La idea es
											eliminar toneladas de
											alimentos, el derroche de energía
											y la sobrepesca del atún mediante la creación
											de atún o cualquier producto exótico
											de lugares remotos
											con productos orgánicos locales;
											así que tenemos una sandía de Wisconsin.
											HC: Así como las bayas milagrosas vuelven
											dulces las cosas agrias,
											tenemos este otro polvo mágico
											que le ponemos a la sandía que la
											hace pasar de dulce a salada.
											Después la ponemos en una bolsa
											al vacío, le añadimos algunas algas marinas,
											unas especias, lo enrollamos y esto
											empieza a parecerse al atún.
											La clave ahora es hacer que se
											comporte como atún.
											BR: Y después de un chapuzón en
											nitrógeno líquido para lograr ese aire de mar,
											realmente tenemos algo que parece,
											sabe y actúa como si fuera verdadero.
									","
											BR: Burada bizi karpuz keserken
											görüyorsunuz. Amaçladığımız şey
											yiyecek millerini, israf edilen
											enerjiyi ve ton balığının
											aşırı avlanmasını azaltmak, yerel, organik ürünle
											ton balığı ya da çok uzak bir
											yerden gelen herhangi bir
											egzotik ürünü yaratmak;
											elimizde Wisconsin'dan gelen bir karpuz var.
											HC: Eğer mucize meyveleri ekşi şeyleri alıp,
											onları tatlı bir hale getiriyorsa,
											karpuza koyduğumuz başka bir
											peri tozumuz var ve onu tatlıdan
											tuzluya dönüştürüyor.
											Bunu yaptıktan sonra, bir vakum
											torbasına koyuyoruz, biraz deniz yosunu,
											biraz baharat ekliyoruz ve sarıyoruz ve
											ton balığı görümünü almaya başlıyor.
											Şimdi kilit nokta onun ton balığı
											gibi davranmasını sağlamak.
											BR: Ve sonra o mükemmel kabuğu oluşturmak için
											sıvı nitrojene hızlı bir şekilde batırdıktan sonra,
											görüntü, tat ve yapı bakımından gerçeği ile
											aynı olan birşeye sahip oluyoruz.
									","
											BR : Vous nous voyez ici découper
											une pastèque. L'idée est
											que nous allons éliminer des tonnes de
											kilomètres parcourus par la nourriture, d'énergie gaspillée,
											et de la surpêche du thon en créant du thon,
											ou tout autre produit exotique ou élément
											originaire d'un endroit très lointain,
											en les remplaçant par des produits locaux et bios ;
											nous avons donc une pastèque du Wisconsin.
											HC : Alors, si le fruit miracle transforme ce qui est aigre
											en des choses sucrées,
											nous avons cette autre poudre de fée
											que nous mettons sur la pastèque, et elle
											la fait passer du sucré au salé.
											Donc, après avoir fait ça, nous la mettons dans
											un sac vide, ajoutons un peu d'algues,
											quelques épices, et nous formons un rouleau, et
											ça commence à prendre l'apparence de thon.
											Donc, la clé est maintenant de le faire
											se comporter comme le thon.
											BR : Et puis après une immersion rapide dans
											l'azote liquide pour obtenir cet aspect saisi,
											nous avons vraiment quelque chose qui ressemble,
											a le goût et se comporte comme le vrai thon.
									","
											BR: Hier sehen Sie uns also Wassermelonen
											aufschneiden. Die Idee ist, dass wir
											sehr viele Nahrungsketten beseitigen werden,
											verschwendete Energie, und
											die Überfischung von Thunfisch, indem wir Thunfisch kreieren,
											oder irgendein exotisches Produkt oder eine Sache,
											die von weither stammt,
											mit lokalen, natürlichen Produkten;
											so haben wir hier eine Wassermelone aus Wisconsin.
											HC: Wenn also Wunderbeeren Saures
											in Süsses umwandeln,
											haben wir diesen anderen Feenstaub,
											den wir auf die Wassermelone stäuben, und
											der sie von süss zu pikant umwandelt.
											Nachdem wir das gemacht haben, legen wir sie
											in einen Vakuumbeutel, fügen wenige Meeresalgen hinzu,
											Gewürze, und rollen sie, und sie nimmt
											das Aussehen eines Thunfischs an.
											Entscheidend ist nun also, dass sie
											sich auch wie Thunfisch verhält.
											BR: Und dann, nach einem kurzen Tauchbad in
											flüssigem Stickstoff, um diesen perfekten Brateffekt zu erhalten,
											haben wir wirklich etwas, das aussieht,
											schmeckt und sich verhält wie das Original.
									",Cooking as alchemy,Homaro Cantu + Ben Roche,9:34,"agriculture,business,creativity,culture,food"
"
","
","
","
","
",Cooking as alchemy,Homaro Cantu + Ben Roche,9:34,"agriculture,business,creativity,culture,food"
"
											HC: So the key thing to remember here is,
											we don't really care
											what this tuna really is.
											As long as it's good for you and good for
											the environment, it doesn't matter.
											But where is this going?
											How can we take this idea of tricking your
											tastebuds and leapfrog it into something
											that we can do today that could be
											a disruptive food technology?
											So here's the next challenge.
											I told the staff, let's just take a bunch
											of wild plants, think of them as
											food ingredients. As long as they're
											non-poisonous to the human body,
											go out around Chicago sidewalks,
											take it, blend it, cook it and then
											have everybody flavor-trip on it at Moto.
											Let's charge them a boatload of cash for this
											and see what they think. (Laughter)
									","
											HC: Lo importante a recordar aquí
											es que no nos importa
											de qué es este atún.
											Mientras sea bueno para uno y para
											el medio ambiente, no importa.
											¿A dónde va esto?
											¿Cómo podemos usar esta idea de engañar
											a las papilas gustativas y hacer algo
											que revolucione la tecnología
											alimenticia actual?
											Ese es el próximo desafío.
											Ya le dije al personal que tomemos un puñado
											de plantas silvestres y las pensemos
											como ingredientes, siempre que no sean
											venenosas para el cuerpo humano,
											y que vayan por las aceras de Chicago
											las tomen, las mezclen, las cocinen
											para que todos las degusten en Moto.
											Cobremos una fortuna por esto
											y veamos que piensan. (Risas)
									","
											HC: Burada hatırlamak gereken kilit nokta,
											bu ton balığının gerçekten
											ne olduğu umrumuzda değil.
											Sizin için ve çevre için iyi olduğu sürece
											gerisi hiç önemli değil.
											Ama bu nereye gidiyor?
											Damak tadınızı kandırma fikrini alıp,
											nasıl bugün yenilikçi bir yiyecek
											teknolojisi olabilecek birşeye
											dönüştürebiliriz?
											İşte bir sonraki görev.
											Personele bir sürü yabani ot alalım ve
											onları yemek malzemesi olarak
											düşünelim dedim. İnsan vücudu için
											zehirli olmadıkları sürece,
											Şikago kaldırımlarında dolaşın,
											alın, karıştırın, pişirin ve sonra
											Moto'da herkesin lezzet yolculuğu yapmasını sağlayın.
											Fiyatları yüksek tutalım ve ne düşündüklerine
											bakalım. (Kahkahalar)
									","
											HC : Donc, l'essentiel à retenir ici est,
											peu importe
											ce que le thon est vraiment.
											Tant que c'est bon pour vous et bon pour
											l'environnement, ça n'a pas d'importance.
											Mais où est-ce que ça va?
											Comment pouvons-nous prendre cette idée de tromper vos
											papilles et lui faire faire un bond dans
											ce que nous pouvons faire aujourd'hui qui pourrait être
											une technologie alimentaire révolutionnaire?
											Alors, voici le prochain défi.
											J'ai dit au personnel, nous allons juste prendre un tas
											de plantes sauvages, considérez-les comme
											des ingrédients alimentaires. Tant qu'ils sont
											non toxiques pour le corps humain,
											faites les trottoirs de Chicago,
											prenez-les, mélangez-les, faites-les cuire et ensuite
											faites faire un voyage gustatif à tout le monde à Modo.
											Facturons-leur ça un paquet
											et voyons ce qu'ils en pensent. (Rires)
									","
											HC: Entscheidend hier ist daran zu denken,
											dass uns nicht wirklich kümmert,
											was dieser Thunfisch in Wirklichkeit ist.
											So lange er für Sie und die Umwelt gut ist,
											spielt das keine Rolle.
											Aber wohin führt das?
											Wie können wir die Idee, Ihre Geschmacksknospen
											auszutricksen, mit einem grossen Sprung
											ins Heute bringen und daraus eine
											durchbrechende Lebensmitteltechnologie machen?
											Hier ist also die nächste Herausforderung.
											Ich sagte den Angestellten: Lasst uns einen Strauss
											wilder Pflanzen nehmen und sie als
											Nahrungszutaten sehen. So lange sie
											ungiftig sind für den menschlichen Körper,
											geht Chicagos Bürgersteige entlang,
											nehmt sie, püriert sie, kocht sie und
											schickt alle im Moto auf einen Geschmacks-Trip.
											Verrechnet ihnen dafür eine ordentliche Summe
											und seht, was sie davon halten. (Gelächter)
									",Cooking as alchemy,Homaro Cantu + Ben Roche,9:34,"agriculture,business,creativity,culture,food"
"
","
","
","
","
",Cooking as alchemy,Homaro Cantu + Ben Roche,9:34,"agriculture,business,creativity,culture,food"
"
											BR: Yeah, so you can imagine, a task
											like this — this is another one of those
											assignments that the kitchen staff
											hated us for. But we really had to almost
											relearn how to cook in general,
											because these are ingredients, you know,
											plant life that we're, one, unfamiliar with,
											and two, we have no reference for how
											to cook these things because
											people don't eat them.
											So we really had to think about new, creative ways
											to flavor, new ways to cook
											and to change texture — and that was
											the main issue with this challenge.
									","
											BR: Sí, imaginen, una tarea
											como esta... otra tarea de ésas que
											hace que el personal de cocina
											nos deteste. Casi tuvimos que aprender
											nuevamente a cocinar
											porque estos son ingredientes,
											plantas que no nos resultan familiares
											y de las que no tenemos referencias
											de cómo cocinarlas porque
											la gente no las come.
											Así que tuvimos que pensar nuevas maneras creativas
											de condimentar, de cocinar
											y de cambiar texturas; ese fue
											el desafío principal.
									","
											BR: Evet, sandığınız gibi, bunun gibi bir görev
											— mutfak personelinin bizden nefret
											etmesine neden olan görevlerden
											bir başkası bu. Ama gerçekten yemek yapmayı
											neredeyse silbaştan öğrenmek zorunda kaldık,
											çünkü bu malzemeler, biliyorsunuz,
											birincisi aşina olmadığımız bitkiler,
											ve ikincisi, nasıl pişiriceğimize dair hiçbir
											önbilgimiz yok çünkü insanlar
											onları yemiyor.
											Tat vermek için yeni, yaratıcı yöntemler,
											pişirmek ve dokuyu değiştimek için
											yeni yollar hakkında düşünmemiz gerekiyordu —
											ve esas sorun buydu.
									","
											BR : Oui, alors vous pouvez l'imaginer, une tâche
											comme ça - c'est encore une de ces missions
											pour lesquelles le personnel de cuisine
											nous déteste. Mais nous avons vraiment eu presque à
											réapprendre à cuisiner, en général,
											parce que ce sont des ingrédients,
											des plantes, que nous connaissons mal d'une part,
											et d'autre part, pas de référence
											quant au mode de cuisson parce que
											les gens ne les mangent pas.
											Donc nous avons vraiment eu à réfléchir à de nouvelles façons créatives
											de donner du goût, de nouvelles façons de cuisiner
											et de changer la texture - et ça a été
											le problème principal de ce défi.
									","
											BR: Ja, Sie können sich also vorstellen, eine Aufgabe
											wie diese – das ist eine andere dieser
											Aufgaben, für die uns das Küchenpersonal
											hasste. Aber wir mussten wirklich beinahe
											neu lernen, wie man überhaupt kocht,
											denn das sind Zutaten aus der Pflanzenwelt,
											mit denen wir erstens nicht vertraut sind,
											und von denen wir zweitens nicht wissen,
											wie sie gekocht werden, denn
											Menschen essen sie nicht.
											So mussten wir an neue, kreative Möglichkeiten denken,
											sie zu würzen, neue Wege, sie zu kochen
											und die Beschaffenheit zu ändern – und das war
											das Hauptthema dieser Herausforderung.
									",Cooking as alchemy,Homaro Cantu + Ben Roche,9:34,"agriculture,business,creativity,culture,food"
"
","
","
","
","
",Cooking as alchemy,Homaro Cantu + Ben Roche,9:34,"agriculture,business,creativity,culture,food"
"
											HC: So this is where we step into the future
											and we leapfrog ahead.
											So developing nations
											and first-world nations,
											imagine if you could take these wild plants
											and consume them, food miles would
											basically turn into food feet.
											This disruptive mentality of what food is
											would essentially open up the encyclopedia
											of what raw ingredients are, even if we just
											swapped out, say, one of these for flour,
											that would eliminate so much energy
											and so much waste.
											And to give you a simple example here as to
											what we actually fed these customers,
											there's a bale of hay there
											and some crab apples.
											And basically we took hay and crab apples
											and made barbecue sauce out of those two ingredients.
											People swore they were eating
											barbecue sauce, and this is free food.
											BR: Thanks, guys.
									","
											HC: Ahí es donde nos adentramos en el futuro
											y damos un gran paso adelante.
											Países en desarrollo,
											países desarrollados,
											imaginen si pudieran tomar estas plantas silvestres
											y consumirlas, el bio-regionalismo
											pasaría de kilómetros a metros.
											Esta manera novedosa de ver la comida
											abriría la enciclopedia
											de los ingredientes, con sólo intercambiar
											digamos, uno de éstos, por la harina
											eso eliminaría mucha energía y por ende
											muchos residuos.
											Para darles un ejemplo simple
											de lo que servimos a estos clientes,
											allí hay un fardo de heno
											y unas manzanas silvestres.
											Básicamente, con heno y manzanas silvestres
											hacemos salsa de barbacoa.
											La gente jura que está comiendo
											salsa de barbacoa, y esto es comida gratis.
											BR: Gracias, chicos.
									","
											HC: Geleceğe adım attığımız ve ileriye yürüdüğümüz
											nokta burası.
											Gelişen ülkelerde,
											ve gelişmiş ülkelerde,
											bu yabani bitkileri aldığınızı ve tükettiğinizi
											düşünün, biyo-bölgeselcilik
											kilometrelerden metrelere düşer.
											Yiyeceğin ne olduğu hakkındaki bu
											yenilikçi zihniyet taze malzemeler hakkındaki
											ansiklopediyi açıp, un yerine bunlardan
											birini kullansak bile,
											enerji ve israfı
											yok eder.
											Ve sizlere müşterilere aslında ne yedirdiğimize
											dair basit bir örnek vermek gerekirse,
											burada bir saman balyası ve
											biraz yaban elması var.
											Ve saman ve yaban elmalarını aldık ve
											o iki malzemeden barbekü sosu yaptık.
											İnsanlar barbekü sosu yediklerinden
											emindi, ve bu yiyecek bedava.
											BR: Herkese teşekkürler.
									","
											HC : C'est donc là que nous entrons dans l'avenir
											et que nous faisons un bond en avant.
											Les pays en développement
											et les nations du premier monde,
											imaginez si vous pouviez prendre ces plantes sauvages
											et les consommer, les kilomètres parcouru par la nourriture
											deviendraient en gros des centimètres.
											Cette mentalité révolutionnaire de ce que la nourriture est
											ouvrirait essentiellement l'encyclopédie
											de ce que sont les ingrédients crus, même si nous venons
											d'échanger, disons, une de ces choses contre de la farine,
											ce qui permettrait d'éliminer tant d'énergie
											et tant de déchets.
											Et pour vous donner un exemple simple ici de
											ce que nous faisons manger à ces clients,
											il y a une botte de foin là
											et quelques pommes sauvages.
											Et essentiellement, nous avons pris des pommes sauvages et du foin
											et en avons fait de la sauce barbecue.
											Les gens ont juré qu'ils mangeaient
											de la sauce barbecue, et c'est de la nourriture gratuite.
											BR: Merci, les gars.
									","
											HC: Hier treten wir also in die Zukunft
											und machen einen grossen Sprung.
											Entwicklungsländer
											und Erste-Welt-Länder, stellen Sie sich vor,
											Sie nähmen diese wildwachsenden Pflanzen
											und konsumierten sie, Nahrungsketten würden
											sich in ""Nahrungsfüsse"" umwandeln.
											Diese durchbrechende Denkweise über Nahrung
											würde uns eine Enzyklopädie der rohen Zutaten
											erschliessen, und sogar wenn wir nur
											eine von ihnen durch Mehl ersetzen würden,
											würde das soviel Energie eliminieren,
											und soviel Abfall.
											Und um Ihnen ein Beispiel zu geben,
											was wir diesen Gästen tatsächlich servierten,
											sind hier ein Ballen Heu
											und einige Holzäpfel.
											Und hauptsächlich nahmen wir Heu und Holzäpfel
											und stellten eine Barbecue Sauce aus diesen zwei Zutaten her.
											Die Menschen schworen, sie ässen
											Barbecue Sauce, und das ist kostenloses Essen.
											BR: Vielen Dank, Leute.
									",Cooking as alchemy,Homaro Cantu + Ben Roche,9:34,"agriculture,business,creativity,culture,food"
"
","
","
","
","
",Cooking as alchemy,Homaro Cantu + Ben Roche,9:34,"agriculture,business,creativity,culture,food"
"
											(Applause)
									","
											(Aplausos)
									","
											(Alkışlar)
									","
											(Applaudissements)
									","
											(Applaus)
									",Cooking as alchemy,Homaro Cantu + Ben Roche,9:34,"agriculture,business,creativity,culture,food"
"
","
","
","
","
",Cooking as alchemy,Homaro Cantu + Ben Roche,9:34,"agriculture,business,creativity,culture,food"
