en,es,tr,fr,de,title,speaker,duration,tags
"
											So let me share with you our values.
											We believe in risk awareness.
											What does that mean?
											We believe that you should always understand the risks that you're taking,
											and we will not invest
											in things we don't understand.
											Not a complicated thing.
											But in 2007,
											at the height of the sub-prime
											and all the complicated financial structures,
											it was quite opposite
											to the reckless risk-taking behaviors
											that we saw on the market.
											We also believe in straight-talking,
											telling it as it is,
											using simple language that people understand,
											telling people about the downsides
											as well as the potential upsides,
											and even telling the bad news that no one wants to utter,
											like our lack of belief in the sustainability
											of the Icelandic financial sector
											that already we had
											months before the collapse hit us.
											And, although we do work in the financial sector,
											where Excel is king,
											we believe in emotional capital.
											And we believe
											that doing emotional due diligence
											is just as important
											as doing financial due diligence.
											It is actually people
											that make money and lose money,
											not Excel spreadsheets.
									","
											Por eso voy a compartirlos con Uds.
											Creemos en la conciencia del riesgo.
											¿Qué significa eso?
											Creemos que siempre se deben entender los riesgos que se están tomando,
											y no vamos a invertir
											en cosas que no entendemos.
											No es algo complicado.
											Pero en 2007,
											en la cumbre de las hipotecas de alto riesgo
											y de las estructuras financieras complejas,
											era todo lo contrario:
											se corría imprudentemente mucho riesgo;
											eso veíamos en el mercado.
											También creemos en hablar claro,
											en decir las cosas como son,
											usando lenguaje llano que la gente entienda,
											contándole a la gente las desventajas
											así como los pros potenciales
											e incluso las malas noticias que nadie quiere dar
											como nuestra falta de confianza en la sostenibilidad
											del sector financiero islandés
											que ya habíamos tenido
											meses antes de la crisis.
											Y si bien trabajamos en el sector financiero,
											donde el Excel es rey,
											creemos en el capital emocional.
											Y creemos que
											hacer la debida diligencia emocional
											es tan importante
											como hacer la debida diligencia financiera.
											En realidad son personas
											las que ganan y pierden dinero,
											no planillas de Excel.
									","
											O zaman sizlerle değerlerimizi paylaşmama izin verin.
											Biz risk bilincine inanıyoruz.
											Bunun anlamı ne?
											Biz, almakta olduğunuz riskleri her zaman anlamanız gerektiğine inanıyoruz.
											Bu yüzden anlamadığımız şeylere
											yatırım yapmıyoruz.
											Bu karışık bir mevzu değil.
											Ama 2007'de
											mortgage ve finansal krizinin
											en ağır olduğu dönemde
											markette gözlemlediğimiz
											davranışlar bunun tam aksine
											pervasızca ve riskliydi.
											Biz ayrıca açık sözlülüğe inanıyoruz.
											Olayları olduğu gibi,
											insanların anlayabileceği basit bir dille;
											iyi taraflarının olduğu kadar
											potansiyel kötü taraflarını da anlatıyor ve
											hatta kisenin söylemek istemediği kötü haberleri bile söylüyoruz.
											Örneğin İzlanda'nın finansal sektörününün sürdürülemeyeğine
											karşı olan inancımız gibi—
											hem de finansal çöküş başlamazdan
											aylar önce bile.
											Ve her ne kadar da Excel'in kral olduğu
											finans sektöründe çalışıyor olsak da,
											biz duygusal kapitale inanıyoruz.
											Ve inanıyoruz ki,
											duygusal hizmet
											finansal hizmet kadar
											önemlidir.
											Çünkü para kazanan ve kaybedenler
											Excel dökümanlarının değil
											insanlardır.
									","
											Et donc permettez-moi de partager nos valeurs avec vous..
											Nous croyons à la conscience du risque.
											Qu'est-ce que ça signifie?
											Nous croyons que vous devriez toujours comprendre le risque que vous prenez,
											et nous n'investirons pas
											dans des choses que nous ne comprenons pas.
											Ce n'est pas compliqué.
											Mais en 2007,
											au plus fort des sub-primes
											et de toutes les structures financières compliquées,
											c'était tout l'opposé
											des comportements à risque imprudents
											que nous voyions sur le marché.
											Nous croyons aussi au franc parler,
											dire les choses comme elles sont,
											en employant un langage simple que tout le monde comprend,
											en annonçant aux gens les mauvais côtés
											comme les bons côtés potentiels,
											et même en annonçant les mauvaises nouvelles que personne ne veut dire,
											comme notre incrédulité quant à la durabilité
											du secteur financier islandais
											qu nous avions déjà
											des mois avant que la crise ne nous frappe.
											Et bien que nous travaillions dans le secteur financier,
											où Excel est roi
											nous croyons dans un capital émotionnel.
											Et nous croyons
											que de faire diligence raisonnable émotionnelle
											est tout aussi important
											que de faire diligence raisonnable financière.
											Ce sont en fait des gens
											qui gagnent et perdent de l'argent,
											pas des tableaux Excel
									","
											Lassen Sie mich Ihnen also von unseren Werten berichten.
											Wir glauben an Gefahrenbewusstsein.
											Was bedeutet das?
											Wir glauben, dass man immer verstehen sollte, welches Risiko man eingeht,
											und nicht investiert
											in Dinge, die man nicht versteht.
											Keine komplizierte Sache.
											Aber 2007,
											während des Höhepunkts der Subprime-Krise
											und all der komplizierten Finanzstrukturen,
											war das so ziemlich das Gegenteil
											von dem rücksichtlosen, risikofreudigen Verhalten,
											das wir am Markt beobachteten.
											Wir glauben auch an offene Kommunikation,
											Dinge beim Namen nennen,
											den Gebrauch einfacher Sprache, die von Menschen verstanden wird,
											den Menschen die Nachteile aufzeigen,
											genauso wie die möglichen Vorteile,
											und auch die schlechten Nachrichten verkünden, die niemand zur Sprache bringen will,
											z.B. unser mangelndes Vertrauen in die Zukunftsfähigkeit
											des isländischen Finanzsektors,
											das wir bereits vor Monaten verloren hatten,
											als die Auswirkungen des Zusammenbruchs spürbar wurden.
											Und obwohl wir im Finanzsektor arbeiten,
											wo Excel regiert,
											glauben wir an emotionales Kapital.
											Wir glauben,
											dass es genauso wichtig ist, der emotionalen
											Sorgfaltsspflicht nachzukommen
											wie der finanziellen Sorgfaltspflicht.
											Es sind schließlich Menschen,
											die Geld verdienen oder verlieren,
											nicht Excel-Tabellen.
									",A feminine response to Iceland's financial crash,Halla Tómasdóttir,9:45,"business,feminism,politics,women,women in business"
"
","
","
","
","
",A feminine response to Iceland's financial crash,Halla Tómasdóttir,9:45,"business,feminism,politics,women,women in business"
"
											(Applause)
									","
											(Aplausos)
									","
											(Alkışlar)
									","
											(Applaudissements)
									","
											(Applaus)
									",A feminine response to Iceland's financial crash,Halla Tómasdóttir,9:45,"business,feminism,politics,women,women in business"
"
","
","
","
","
",A feminine response to Iceland's financial crash,Halla Tómasdóttir,9:45,"business,feminism,politics,women,women in business"
"
											Last, but not least,
											we believe in profit with principles.
											We care how we make our profit.
											So while we want to make economic profit for ourselves and our customers,
											we are willing to do it with a long-term view,
											and we like to have a wider definition of profits
											than just the economic profit in the next quarter.
											So we like to see profits,
											plus positive social
											and environmental benefits, when we invest.
									","
											Por último, pero no menos importante,
											creemos en las ganancias con principios;
											nos preocupa cómo obtenemos la ganancia.
											Por eso si bien queremos una ganancia para nosotros y para nuestros clientes,
											estamos dispuestos a hacerlo con una visión de largo plazo.
											Y nos gusta tener una definición más amplia de las ganancias
											que sólo el beneficio económico del próximo trimestre.
											Por eso nos gusta ver ganancias
											más beneficios sociales
											y ambientales positivos cuando invertimos.
									","
											Son olarak,
											biz prensiplere dayalı kâr'a inanıyoruz;
											nasıl kâr yaptığımıza özen gösteriyoruz.
											Yani kendimiz ve müşterilerimiz için ekonomik kazanç sağlmak isterken,
											bunu uzun vadeli bir vizyonla yapmaktan çekinmiyoruz.
											Ve biz ¨kâr¨ kavramına gelen çeyrekteki ekonomik kârdan
											daha geniş anlamlar vermekten hoşlanıyoruz.
											Kısacası biz kazançların
											yatırım yaptığımızda pozitif sosyal ve
											çevresel faydaları olduğunu görmeyi seviyoruz.
									","
											Enfin et surtout,
											nous croyons au profit avec des principes;
											nous nous soucions de comment nous faisons du profit
											Donc tout en voulant faire un profit économique pour nous mêmes et pour nos clients,
											nous voulons le faire avec une vision à long terme.
											Et nous aimons avoir une définition des profits plus large
											que le simple profit économique au cours du prochain trimestre.
											Nous aimons voir des profits,
											plus des bénéfices sociaux
											et environnementaux quand nous investissons.
									","
											Zu guter Letzt
											glauben wir an Profit mit Prinzipien;
											uns ist es nicht egal, wie wir unseren Gewinn machen.
											Wenn wir also wirtschaftlichen Erfolg für uns und unsere Kunden wollen,
											sind wir gewillt, das mit Blick auf die Nachhaltigkeit zu tun.
											Wir ziehen eine breitere Definition des Profits vor
											als nur den wirtschaftlichen Erfolg des nächsten Quartals.
											Wir möchten also Profite sehen
											inklusive positiver sozialer
											und ökologischer Auswirkungen unserer Investitionen.
									",A feminine response to Iceland's financial crash,Halla Tómasdóttir,9:45,"business,feminism,politics,women,women in business"
"
","
","
","
","
",A feminine response to Iceland's financial crash,Halla Tómasdóttir,9:45,"business,feminism,politics,women,women in business"
"
											But it wasn't just about the values,
											although we are convinced that they matter.
											It was also about a business opportunity.
											It's the female trend, and it's the sustainability trend,
											that are going to create
											some of the most interesting investment opportunities
											in the years to come.
											The whole thing about the female trend
											is not about women being better than men;
											it is actually about
											women being different from men,
											bringing different values and different ways to the table.
											So what do you get? You get better decision-making,
											and you get less herd behavior,
											and both of those things hit your bottom line
											with very positive results.
									","
											Pero no se trataba sólo de los valores,
											aunque estamos convencidos de su importancia.
											También se trataba de una oportunidad comercial.
											La tendencia femenina y la tendencia de sostenibilidad
											van a constituir
											una de las oportunidades de inversión más interesantes
											en los próximos años.
											La cuestión de la tendencia femenina
											no es que las mujeres sean mejores que los hombres
											sino que se trata de que
											las mujeres son diferentes de los hombres,
											de que aportan valores y formas diferentes a la mesa.
											¿Qué aportan? Aportan mejor toma de decisiones.
											Y menos comportamiento de rebaño.
											Y ambas cosas golpean la línea de fondo
											con resultados muy positivos.
									","
											Ama bu sadece değerlerimizle ilgili değildi,
											her ne kadar biz bu değerlerin önemli olduğuna ikna olmuşsak da.
											Bu bir iş fırsatıyla alakalı.
											Bu bir kadın trendi, sürdürülebilirlik trendi,
											ve bu trendler
											ileride karşılaşacağımız en ilginç
											yatırım fırsatlarını beraberlerinde getirecek.
											Bu kadın trendiyle ilgili şey
											kadınların erkeklerden daha iyi olmasıyla ilgili bişey değil,
											aslında bu
											kadınların erkeklerden farklı olmasıyla ilgili.
											Masaya farklı bakış açıları ve değerler getirmeleriyle ilgili.
											Peki ne elde edersiniz? Daha iyi kararlar elde edersiniz.
											Dolayısıyla daha az ¨sürü¨ davranışı sergilenir.
											Ve bu iki şey sayesinde
											çok pozitif sonuçlar elde edersiniz.
									","
											Mais ce n'était pas qu'une question de valeurs,
											bien que nous soyons convaincues qu'elles ont de l'importance.
											Il s'agissait aussi d'une opportunité de business.
											C'est la tendance féminine, et c'est la tendance durable,
											qui vont créer
											certaines des opportunités d'investissement les plus intéressantes
											dans les années à venir.
											Toute l'histoire de la tendance féminine
											ne tourne pas autour du fait que les femmes soient meilleures que les hommes,
											en réalité, c'est que les femmes sont
											différentes des hommes
											et apportent à la table des valeurs différentes et des manières différentes.
											Alors qu'est-ce que ça vous apporte? Ça vous apporte une meilleure prise de décision.
											Et vous avez moins de comportement grégaire.
											Et en fin de compte ces deux choses
											vous apportent des résultats très positifs.
									","
											Es ging aber nicht nur um die Werte,
											obwohl wir von ihrem Einfluss überzeugt sind.
											Es ging auch um eine Unternehmens-Chance.
											Es sind der weibliche Trend und der Nachhaltigkeitstrend,
											die einige der interessantesten
											Investititions-Gelegenheiten schaffen werden
											im Laufe der kommenden Jahre.
											Die ganze Sache mit dem weiblichen Trend
											hat nichts damit zu tun, dass Frauen besser als Männer wären,
											es geht vielmehr darum,
											dass Frauen sich von Männern unterscheiden
											und andere Werte und Verhaltensweisen mitbringen.
											Was erreicht man dadurch? Eine bessere Entscheidungsfindung.
											Und weniger Herdenverhalten.
											Und beides zeitigt unterm Strich
											sehr positive Ergebnisse.
									",A feminine response to Iceland's financial crash,Halla Tómasdóttir,9:45,"business,feminism,politics,women,women in business"
"
","
","
","
","
",A feminine response to Iceland's financial crash,Halla Tómasdóttir,9:45,"business,feminism,politics,women,women in business"
"
											But one has to wonder,
											now that we've had this financial sector collapse upon us in Iceland —
											and by the way, Europe looks pretty bad right now,
											and many would say that you in America
											are heading for some more trouble as well.
											Now that we've had all that happen,
											and we have all this data out there
											telling us that it's much better to have diversity
											around the decision-making tables,
											will we see business and finance change?
											Will government change?
									","
											Pero uno tiene que preguntarse,
											ahora que tuvimos esta crisis en el sector financiero islandés...
											y a propósito, ahora Europa se ve bastante mal.
											Y muchos dirían que Estados Unidos
											se encamina a algunos problemas más también.
											Ahora que hemos pasado por todo eso
											y tenemos todos estos datos por ahí
											que nos dicen que es mucho mejor la diversidad
											en torno a las mesas de decisión,
											¿veremos un cambio en los negocios y las finanzas?
											¿Cambiará el gobierno?
									","
											Ama yine de şunu düşünmek gerek:
											İzlanda'da bu krizi geçirttik ya...
											— ve bu arada Avrupa şu anda hiç iyi görünmüyor—
											Ve Amerika'daki birçoğunuz da hala daha
											sorun yaşayacağa benziyor...
											Şimdi, bütün bunları yaşadıktan sonra ve
											elimizde, karar masalarında çeşitliliğin
											olmasının çok daha iyi sonuçlar doğuracağını söyleyen
											bu kadar veri varken,
											işletmelerin ve finans sektörünün değişeceğini görecek miyiz?
											Hükümet değişecek mi?
									","
											Mais on doit se demander,
											maintenant que nous avons le secteur financier qui s'effondre sur nous en Islande —
											et d'ailleurs ça se présente mal pour l'Europe en ce moment.
											Et beaucoup diraient que vous en Amérique
											vous allez aussi tout droit vers des problèmes.
											Maintenant que tout ça nous est arrivé,
											et que nous avons toutes ces données publiées
											qui nous disent qu'il vaut mieux avoir de la diversité
											autour des tables où on prend des décisions,
											verrons-nous les affaires et la finance changer ?
											Le gouvernement changera-t-il?
									","
											Man muss sich jedoch Folgendes fragen:
											Nun, da wir diesen Finanzsektor in Island über uns zusammenbrechen sahen
											und Europa übrigens auch nicht gerade gut aussieht -
											und viele sind der Meinung, dass Ihr in Amerika
											euch auch auf größere Schwierigkeiten zubewegt -
											nun, da das alles passiert ist,
											und wir die ganzen Daten haben,
											die uns sagen, dass es viel besser ist, Vielfalt
											an den Tischen der Entscheidungsfindung zu haben,
											werden wir nun erleben, dass Unternehmen und Finanzen sich ändern?
											Wird sich die Regierung verändern?
									",A feminine response to Iceland's financial crash,Halla Tómasdóttir,9:45,"business,feminism,politics,women,women in business"
"
","
","
","
","
",A feminine response to Iceland's financial crash,Halla Tómasdóttir,9:45,"business,feminism,politics,women,women in business"
"
											Well I'll give you my straight talk about this.
											I have days that I believe,
											but I have days that I'm full of doubt.
											Have you seen the incredible urge out there
											to rebuild the very things that failed us?
											(Applause)
											Einstein said
											that this was the definition of insanity —
											to do the same things
											over and over again,
											hoping for a different outcome.
											So I guess the world is insane,
											because I see entirely too much
											of doing the same things over and over again,
											hoping that this time it's not going to collapse upon us.
											I want to see more revolutionary thinking,
											and I remain hopeful.
											Like TED, I believe in people.
											And I know that consumers
											are becoming more conscious,
											and they are going to start voting with their wallets,
											and they are going to change the face
											of business and finance from the outside,
											if they don't do it from the inside.
									","
											Bueno voy a darles mi versión franca sobre esto.
											Hay días en los que creo,
											pero hay días en los que estoy llena de dudas.
											¿Han visto la increíble prisa por reconstruir
											las mismas cosas que nos fallaron?
											(Aplausos)
											Einstein dijo
											que esta era la definición de locura:
											hacer las mismas cosas
											una y otra vez
											esperando un resultado diferente.
											Así que supongo que el mundo está loco,
											porque veo mucho el hecho de
											hacer las mismas cosas una y otra vez,
											esperando que esta vez no se derrumbe sobre nosotros.
											Quiero ver más pensamiento revolucionario.
											Y sigo optimista.
											Como TED, creo en las personas.
											Y sé que los consumidores
											son cada vez más conscientes
											y que van a empezar a votar con sus billeteras
											y le van a cambiar la cara
											a los negocios y a las finanzas desde afuera
											si no lo hacen desde adentro.
									","
											Sizle açık konuşacağım.
											İnandığım günler de var,
											şüpheyle dolduğum günler de.
											Dışardaki o büyük, bizi yıkan şeyleri
											yeniden yerine koyma dürtüsünü gördünüz mü?
											(Alkışlar)
											Einstein demişti ki
											deliliğin anlamı
											aynı şeyleri
											tekrar tekrar yaparak
											farklı bir sonuca ulaşmayı ummak
											o zaman sanırım bütün dünya delidir.
											Çünkü ben aynı şeylerin devamlı tekrarlanıp durduğunu
											ve bu defa üstümüze yıkılmacağını umduğumuz zamanları
											çok fazla görür oldum.
											Ben biraz daha radikal düşünce görmek istiyorum.
											Ve benim hala umudum var.
											TED gibi, ben de insanlara inanıyorum.
											Ve biliyorum ki, tüketiciler
											daha bilinçli oluyor
											ve yakında cüzdanlarıyla seçim yapacak ve
											işletmelerin ve finansın iç yüzünü olmasa da
											dış yüzünü
											değiştirecekler.
									","
											Et bien je vais vous le dire avec mon franc parler.
											Certains jours, j'y crois,
											mais d'autres jours j'en doute.
											Avez-vous vu l'incroyable précipitation à
											reconstruire précisément ces choses qui nous ont trahies ?
											(Applaudissements)
											Einstein a dit
											que c'était la définition de la folie —
											de refaire les même choses
											encore et encore
											en espérant un résultat différent.
											Alors je présume que le monde est fou,
											parce que je vois beaucoup trop
											de choses identiques refaites encore et encore,
											avec l'espoir que cette fois ça ne va pas s'effondrer sur nous.
											Je veux voir une réflexion plus révolutionnaire.
											Et je garde espoir.
											Comme TED, je crois dans les gens.
											Et je sais que les consommateurs
											deviennent plus conscients,
											et ils vont commencer à voter avec leurs porte-monnaie,
											et ils vont commencer à changer le visage
											des affaires et de la finance de l'extérieur,
											s'ils ne le font pas de l'intérieur.
									","
											Ich sage Ihnen dazu geradeheraus:
											An manchen Tagen will ich es glauben,
											aber es gibt auch Tage des Zweifels.
											Haben Sie den unglaublichen Drang dort draußen beobachtet,
											genau diejenigen Dinge, die versagt haben, erneut aufzubauen?
											(Applaus)
											Einstein sagte,
											dass dies die Definition von Schwachsinn sei,
											die gleichen Dinge
											wieder und wieder zu tun
											und auf ein anderes Ergebnis zu hoffen.
											Ich denke also, die Welt ist geisteskrank,
											denn ich sehe ganz und gar zuviel
											Wiederholung der gleichen Dinge,
											in der Hoffnung, dass es diesmal nicht über uns zusammenbricht.
											Ich möchte mehr revolutionäres Denken erleben.
											Und ich bleibe hoffnungsvoll.
											Wie TED, glaube ich an Menschen.
											Und ich weiß, dass die Konsumenten
											bewusster werden
											und beginnen, mit ihren Brieftaschen zu wählen.
											Sie werden das Gesicht der Geschäftswelt
											und der Finanzwelt von außen verändern,
											wenn man es nicht von innen tut.
									",A feminine response to Iceland's financial crash,Halla Tómasdóttir,9:45,"business,feminism,politics,women,women in business"
"
","
","
","
","
",A feminine response to Iceland's financial crash,Halla Tómasdóttir,9:45,"business,feminism,politics,women,women in business"
