en,es,tr,fr,de,title,speaker,duration,tags
"
											The last chapter is about present, and president Obama,
											and the other is about the past,
											where you cover everything from Washington
											to Eisenhower.
											Because Washington to Eisenhower,
											that is what we find in the developing world.
											We could actually go to Mayflower
											to Eisenhower,
											and that would be put together into a developing world,
											which is rightly growing its cities in a very amazing way,
											which have great entrepreneurs,
											but also have the collapsing countries.
									","
											El último capítulo es sobre el presente y la presidencia de Obama.
											Y el otro es sobre el pasado,
											donde se cubre todo desde Washington
											hasta Eisenhower.
											Porque lo que hubo entre Washington y Eisenhower
											es lo que encontramos en el mundo en desarrollo.
											En realidad podríamos tomar desde el Mayflower
											hasta Eisenhower,
											y ponerlo todo junto en un mundo en desarrollo,
											que está haciendo crecer sus ciudades de una manera increíble,
											que tiene grandes empresarios,
											pero que también tiene países en quiebra.
									","
											Son bölüm Başkan Obama ile ilgili,
											diğeri ise geçmişle
											Washington'dan Eisenhover'a
											her şeyi kavrayan kısım.
											Çünkü Washington'dan Eisenhover'a
											gelişmekte olan dünyada gördüklerimiz.
											Mayflower'dan Eisenhover'a
											gidebiliriz
											ve bunu gelişmekte olan dünya olarak tanımlayabiliriz,
											çünkü inanılmaz olarak yeni şehirlerin büyüdüğü,
											harika girişimcilerin olduğu,
											ama aynı zamanda çökmekte olan ülkeler.
									","
											Le dernier chapitre concerne le présent, et le président Obama.
											Et l'autre concerne le passé,
											qui couvre tout, à partir de Washington
											jusqu'à Eisenhower.
											Parce que de Washington à Eisenhower,
											c'est là qu'on retrouve les pays en développement.
											On pourrait même aller du Mayflower
											à Eisenhower,
											et ce serait englober le tout dans les pays en développement.
											Qui, à juste titre, font progresser ses villes de façon impressionnante.
											Qui ont des entrepreneurs formidables,
											mais qui ont aussi des pays qui s'écroulent.
									","
											Und das letzte Kapitel ist über die Gegenwart und über Präsident Obama.
											Und das andere ist über die Vergangenheit,
											das alles über Washington
											bis Eisenhower einschließt.
											Denn die Geschichte von Washington bis Eisenhower
											finden wir in den Entwicklungsländern wieder.
											Wir könnten sogar von der Mayflower
											bis Eisenhower gehen
											und das würde alles als ein Entwicklungsland zusammenfassen.
											Die zu Recht ihre Städte auf eine großartige Art und Weise wachsen lassen.
											Die gute Unternehmer haben,
											aber die auch die Krisenländer beinhaltet.
									",Let my dataset change your mindset,Hans Rosling,19:56,"medicine,presentation,science,technology,data,statistics,global development,math,global issues,Asia,visualizations,Africa"
"
","
","
","
","
",Let my dataset change your mindset,Hans Rosling,19:56,"medicine,presentation,science,technology,data,statistics,global development,math,global issues,Asia,visualizations,Africa"
"
											So, how could we make better sense about this?
											Well, one way of trying is to see whether we could
											look at income distribution.
											This is the income distribution of peoples in the world,
											from $1. This is where you have food to eat.
											These people go to bed hungry.
											And this is the number of people.
											This is $10, whether you have a public or a private
											health service system. This is where you can
											provide health service for your family and school for your children,
											and this is OECD countries:
											Green, Latin America, East Europe.
											This is East Asia, and the light blue there is South Asia.
									","
											Así que, ¿cómo podríamos hacer que esto tuviera más sentido?
											Bueno, una forma de intentarlo es ver si podríamos
											observar la distribución salarial.
											Esta es la distribución salarial mundial,
											desde un dólar. Aquí tienes comida para vivir.
											Estas personas se van a dormir hambrientas.
											Y este es el número de personas.
											Aquí es 10 dólares, ya tengas un sistema de salud
											público o privado. Aquí es donde puedes
											proveer servicio de salud a tu familia, y escuela para tus hijos.
											Y aquí están los países de la OCDE.
											Groenlandia, Latinoamérica, Europa del Este.
											Aquí está Asia. Y en azul claro, Asia del Sur.
									","
											Peki bunu nasıl daha iyi değerlendirebiliriz?
											Denemenin bir yolu
											gelir dağılımkına bakmak.
											Bunu dünyadaki insanların 1 dolardan
											gelir dağılımı. Burası yiyecek yemek bulunabilen yerler.
											Bu insanlar aç yatıyorlar.
											Bu, insan sayısı.
											Bu 10 dolar, toplu ya da özel sağlık sistemi.
											Burası aileniz için sağlık, çocuklarınız için okul
											sağlayabildiğiniz yer.
											Burası da OECD (Ekonomik İşbirliği ve Kalkınma Örgütü) ülkeleri:
											Yeşil, Güney Amerika, Doğu Avrupa.
											Burası Doğu Asya, orada gördüğünüz açık mavi ise Güney Asya.
									","
											Comment pourrions-nous donc mieux comprendre tout ça ?
											Un moyen est d'essayer de voir s'il est possible
											d'analyser la répartition des revenus.
											Voici la répartition des revenus dans le monde,
											à partir d'un dollar. C'est le niveau où vous avez de quoi manger.
											Ces gens ont faim quand ils vont se coucher.
											Et voici le nombre de gens.
											Ça c'est 10 dollars, où vous ayez un service de santé
											public ou privé. C'est le niveau où vous pouvez
											fournir un service de santé à votre famille, et l'école à vos enfants.
											Et voici les pays de l'OCDE.
											En vert, l'Amérique latine, l'Europe de l'Est.
											Ça c'est l'Asie de l'Est. Et en bleu clair, on a l'Asie du Sud.
									","
											Also wie können wir das besser verstehen?
											Eine Möglichkeit wäre
											die Verteilung der Einkommen zu betrachten.
											Das ist die Einkommensverteilung der Menschen in der Welt
											von einem Dollar. Ab da hat man etwas zu essen.
											Diese Menschen gehen hungrig ins Bett.
											Und das ist die Anzahl von Menschen,
											das sind 10 Dollar, ob man ein öffentliches oder privates
											Gesundheitssystem hat. Hier kann man
											sich eine Krankenversicherung für seine Familie leisten und seine Kinder in die Schule schicken.
											Das sind die OECD Länder.
											Griechenland, Lateinamerika, Osteuropa.
											Das ist Ostasien. Und die hellblaue Blase hier ist Südasien.
									",Let my dataset change your mindset,Hans Rosling,19:56,"medicine,presentation,science,technology,data,statistics,global development,math,global issues,Asia,visualizations,Africa"
"
","
","
","
","
",Let my dataset change your mindset,Hans Rosling,19:56,"medicine,presentation,science,technology,data,statistics,global development,math,global issues,Asia,visualizations,Africa"
"
											And this is how the world changed.
											It changed like this.
											Can you see how it's growing? And how hundreds of millions
											and billions is coming out of poverty in Asia?
											And it goes over here?
											And I come now, into projections,
											but I have to stop at the door of Lehman Brothers there, you know, because —
											(Laughter)
											that's where the projections are not valid any longer.
											Probably the world will do this.
											and then it will continue forward like this.
											But more or less, this is what will happen,
											and we have a world which cannot be looked upon as divided.
									","
											Y así es como cambió el mundo.
											Cambió así.
											¿Pueden ver cómo crece? ¿Y cómo cientos de millones
											y billones están saliendo de la pobreza en Asia?
											Y llega hasta aquí.
											Y voy ahora hacia los pronósticos.
											Pero tengo que parar en la puerta de Lehman Brothers ahí. Ya saben, porque...
											(Risas)
											Porque allí los pronósticos ya no son válidos.
											Probablemente, el mundo hará esto.
											Y luego continuará así.
											Pero más o menos esto es lo que ocurrirá.
											Y tenemos un mundo que no se podrá considerar tan dividido.
									","
											Bu, dünyanın nasıl değiştiği.
											Böyle değişti.
											Nasıl büyüdüğünü görebiliyor musunuz? Yüz milyonlarca
											ve milyarlarca insanın fakirlikten çıkmasını?
											Ve buraya gittiğini?
											Şimdi buraya, tahminlere geliyorum,
											ama burada Lehman Brothers'ın kapısında durmam gerekiyor, biliyorsununz, çünkü,
											(Gülüşmeler)
											buradan itibaren tahminler geçerli değil.
											Büyük olasılıkla dünya böyle devam edecek,
											sonra böyle ilerleyecek.
											Ama aşağı yukarı olacaklar bunlar
											ve artık dünyayı bölünmüş olarak değerlendiremeyiz.
									","
											Et voici comment le monde a changé.
											Il a changé comme ça.
											Vous voyez comment il grandit ? Et comment des centaines de millions
											et des milliards de gens sortent de la pauvreté en Asie ?
											Et ça bouge par ici.
											Et j'arrive maintenant aux projections.
											Mais je dois m'arrêter aux portes de Lehman Brothers ici. Vous savez. Parce que…
											(Rires)
											Parce qu'à partir de là les projections ne sont plus valides.
											Le monde va probablement faire ça.
											Et puis il va continuer à avancer comme ça.
											Mais c'est plus ou moins ce qui va arriver.
											Et nous avons un monde que l'on ne peut considérer comme divisé.
									","
											Und so hat sich die Welt verändert.
											So hat es sich verändert.
											Sehen Sie wie sie wächst? Und wie hunderte von Millionen
											und Milliarden Menschen der Armut in Asien entkommen?
											Und es geht dort hinüber.
											Hier aber beginnen die Prognosen.
											Ich muss hier bei den Lehman Brothers aufhören. Weil, Sie wissen ja...
											(Lachen)
											Die Vorhersagen sind hier nicht mehr länger gültig.
											Vielleicht erledigt das die Welt.
											Und dann wird sie sich so weiter vorwärts entwickeln.
											Das wird mehr oder weniger geschehen.
											Wir haben eine Welt, die nicht mehr länger als geteilt betrachtet werden kann.
									",Let my dataset change your mindset,Hans Rosling,19:56,"medicine,presentation,science,technology,data,statistics,global development,math,global issues,Asia,visualizations,Africa"
"
","
","
","
","
",Let my dataset change your mindset,Hans Rosling,19:56,"medicine,presentation,science,technology,data,statistics,global development,math,global issues,Asia,visualizations,Africa"
"
											We have the high income countries here,
											with the United States as a leading power;
											we have the emerging economies in the middle,
											which provide a lot of the funding for the bailout;
											and we have the low income countries here.
											Yeah, this is a fact that from where the money comes,
											they have been saving, you know, over the last decade.
											And here we have the low income countries
											where entrepreneurs are.
											And here we have the countries in collapse and war,
											like Afghanistan, Somalia, parts of Congo, Darfur.
											We have all this at the same time.
									","
											Tenemos a los países con ingresos altos aquí,
											con los EE.UU. como poder destacado.
											Tenemos las economías emergentes en el medio,
											que proveen muchos de los fondos para el rescate financiero.
											Y tenemos los países con ingresos bajos aquí.
											Sí, esto es un hecho, es de donde viene el dinero.
											Ellos han estado ahorrando durante la última década, ¿saben?
											Y aquí tenemos los países con ingresos bajos
											donde están los empresarios.
											Y aquí tenemos los países en quiebra y en guerra,
											como Afganistán, Somalia, partes de Congo, Darfur.
											Tenemos todo esto al mismo tiempo.
									","
											Burada yüksek gelirli ülkeler var,
											önde gelen bir güç olarak Birleşik Devletler var;
											mali yardım için para sağlayan ülkeleri oluşturan
											ilerlemekte olan ekonomiler ortada,
											burada da düşük gelirli ülkeler var.
											Aslında paranın asıl geldiği yerler buraları,
											biliyorsunuz, son on yıldır paralarını biriktiriyorlar.
											Burada da girişimcilerin olduğu
											düşük gelirli ülkeleri görüyoruz.
											Burada ise Afganistan, Somali, Kongo'nın bazı kısımları, Darfur gibi
											yıkılmakta olan ve savaşta olan ülkeleri görüyoruz.
											Bütün bunlar aynı zamanda oluyor.
									","
											Nous avons les pays à haut revenu ici,
											avec les États-Unis en tant que puissance dominante.
											Nous avons les économies émergentes au milieu,
											qui payent une grande partie du renflouement.
											Et nous avons les pays à bas revenu ici.
											Oui, en fait c'est d'ici que vient l'argent.
											Ils ont épargné, vous savez, pendant dix ans.
											Et ici nous avons les pays à faibles revenus
											où sont les entrepreneurs.
											Et ici nous avons les pays en ruine et en guerre,
											comme l'Afghanistan, la Somalie, des parties du Congo, le Darfour.
											Nous avons tout ça en même temps.
									","
											Wir haben die Länder mit hohen Einkommen hier,
											mit den Vereinigten Staaten als Führungsmacht.
											Wir haben die Schwellenländer in der Mitte,
											die über viel Geld für die Rettung aus der Finanzkrise verfügen.
											Und wir haben die Länder mit niedrigem Einkommen hier.
											Tatsächlich kommt hier das Geld her.
											Sie haben viel gespart im letzten Jahrzehnt.
											Und hier in den Ländern mit geringem Einkommen
											gibt es auch Unternehmer.
											Und wir haben die Krisenländer und die Länder im Krieg,
											wie Afghanistan, Somalia, Teile des Kongo, Darfur.
											Das alles geschieht gleichzeitig.
									",Let my dataset change your mindset,Hans Rosling,19:56,"medicine,presentation,science,technology,data,statistics,global development,math,global issues,Asia,visualizations,Africa"
"
","
","
","
","
",Let my dataset change your mindset,Hans Rosling,19:56,"medicine,presentation,science,technology,data,statistics,global development,math,global issues,Asia,visualizations,Africa"
"
											That's why it's so problematic to describe what has happened
											in the developing world.
											Because it's so different, what has happened there.
											And that's why I suggest
											a slightly different approach of what you would call it.
											And you have huge differences within countries also.
											I heard that your departments here were by regions.
											Here you have Sub-Saharan Africa, South Asia,
											East Asia, Arab states,
											East Europe, Latin America, and OECD.
											And on this axis, GDP.
											And on this, heath, child survival,
											and it doesn't come as a surprise
											that Africa south of Sahara is at the bottom.
									","
											Y por eso es tan problemático describir lo que ha ocurrido
											en el mundo en desarrollo.
											Porque es muy diferente lo que ha ocurrido allí.
											Y por eso yo sugiero
											un enfoque ligeramente diferente a como lo llamarían ustedes.
											Y también tienen grandes diferencias dentro de los países.
											He oído que los departamentos aquí se hacían por regiones.
											Aquí tienen el África subsahariana, Asia del sur,
											Asia del este, los Estados Árabes,
											Europa del este, Latinoamérica y la OCDE.
											Y en este eje, el PIB.
											Y aquí, salud, supervivencia infantil.
											Y no es una sorpresa
											que África, el sur del Sahara, está abajo.
									","
											O yüzden gelişmekte olan dünyada olanları
											açıklamak sorunlu.
											Çünkü orada olanlar oldukça farklı.
											Bu yüzden onu tanımlamaya yeni bir
											bakış açısı getirmek istiyorum.
											Ülkeler arasında da oldukça büyük farklılıklar var.
											Buradaki bölümlerinizin bölgelere göre ayrıldığını duydum.
											Sahara Çölü'nün güneyindeki Afrika, Güney Asya,
											Doğu Asya, Arap devletleri,
											Doğu Avrupa, Güney Amerika ve OECD.
											Bu eksende GSYH.
											Bunun üzerine sağlık, çocuk yaşama oranları
											ve Sahara'nın güneyindeki Afrika ülkelerinin
											en aşağıda yer alması sürpriz olmuyor.
									","
											C'est pourquoi c'est si problématique de décrire ce qui s'est passé
											dans les pays en développement.
											Parce que c'est tellement différent, ce qui s'est passé là.
											C'est pourquoi je suggère
											une approche légèrement différente en terme de nomenclature.
											Vous avez aussi des différences immenses à l'intérieur des pays.
											J'ai entendu dire que vos départements étaient structurés par régions.
											Ici l'Afrique sub-saharienne, l'Asie du Sud,
											l'Asie de l'Est, les états arabes,
											l'Europe de l'Est, l'Amérique latine, et l'OCDE.
											Et sur cet axe le PIB.
											Et ici, la santé, le taux de survie infantile.
											Et il n'est pas surprenant
											que l'Afrique sub-saharienne soit en bas.
									","
											Deshalb ist es so schwierig zu beschreiben, was
											mit den Entwicklungsländer passiert ist.
											Weil es so unterschiedlich ist, was dort geschehen ist.
											Das ist der Grund, weshalb ich vorschlage
											einen etwas anderen Ansatz zu finden, oder wie würden Sie das nennen?
											Es gibt auch eine riesige Differenz innerhalb der Länder.
											Ich habe gehört, dass sich ihre Abteilungen nach Regionen richten.
											Hier haben Sie das Sub-Saharische Afrika, Südasien,
											Ostasien, die arabischen Staaten
											Osteuropa, Lateinamerika und die OECD.
											Auf dieser Achse ist das Bruttoinlandsprodukt.
											Und auf dieser, Gesundheit, Kindersterblichkeit.
											Es überrascht nicht,
											dass Afrika, südlich der Sahara, ganz unten liegt.
									",Let my dataset change your mindset,Hans Rosling,19:56,"medicine,presentation,science,technology,data,statistics,global development,math,global issues,Asia,visualizations,Africa"
"
","
","
","
","
",Let my dataset change your mindset,Hans Rosling,19:56,"medicine,presentation,science,technology,data,statistics,global development,math,global issues,Asia,visualizations,Africa"
"
											But when I split it, when I split it
											into country bubbles,
											the size of the bubbles here is the population.
											Then you see Sierra Leone and Mauritius, completely different.
											There is such a difference within Sub-Saharan Africa.
											And I can split the others. Here is the South Asian,
											Arab world.
											Now all your different departments.
											East Europe, Latin America, and OECD countries.
											And here were are. We have a continuum in the world.
											We cannot put it into two parts.
									","
											Pero cuando los separo
											en burbujas por país,
											el tamaño de la burbuja aquí es la población,
											y entonces ven que Sierra Leona y Mauricio son completamente diferentes.
											Existen diferencias de este tipo dentro del África subsahariana.
											Y puedo separar los demás. Aquí está el sur de Asia,
											el mundo árabe.
											Ahora todos los departamentos diferentes.
											Europa del Este, Latinoamérica y los países de la OCDE.
											Y aquí estamos. Tenemos un mundo continuo.
											No podemos dividirlo en dos.
									","
											Ama bunu
											ükle baloncuklarına ayırdığımda,
											buradaki baloncukların büyüklükleri nüfusu temsil ediyor.
											Sonra Sierra Leone ve Mauritius'un ne kadar farklı olduklarını görüyorsunuz.
											Sahara'nın güneyindeki Afrika'nın kendi içinde o kadar farklılıklar var.
											Diğerlerini de ayırabilirsiniz. Burada Güney Asyalı,
											Arap dünyası var.
											Sizin farklı bölümlerinizin tamamı.
											Doğu Avrupa, Güney Afrika ve OECD ülkeleri.
											Buradayız. Dünyada bir devamlılık var.
											Onu iki parçaya ayıramayız.
									","
											Mais quand je l'éclate
											en bulles représentant les pays,
											la taille d'une bulle est la population,
											alors vous voyez que la Sierra Leone et L'Ile Maurice sont complètement différentes.
											Il y a tant de différence à l'intérieur d'Afrique sub-saharienne.
											Et je peux diviser les autres. Ici l'Asie du Sud,
											le monde arabe.
											Ici tous les départements différents.
											L'Europe de l'Est, L'Amérique latine, les pays OCDE.
											Nous voilà. Nous avons un continuum dans le monde.
											Nous ne pouvons pas le diviser en deux parties.
									","
											Aber wenn ich das aufspalte
											in Blasen der einzelnen Länder,
											die Größe der Blase hier ist die Einwohnerzahl.
											Sie sehen, dass Sierra Leone und Mauritius völlig verschieden sind.
											Es gibt eine solch große Differenz innerhalb des sub-saharischen Afrika.
											Ich kann auch die anderen aufspalten. Hier Südasien,
											die arabischen Länder.
											Jetzt sehen Sie die verschiedenen Abteilungen.
											Osteuropa, Lateinamerika, und die OECD Länder.
											Hier sind wir. Wir haben eine Kontinuität in der Welt.
											Wir können sie nicht in zwei Teile teilen.
									",Let my dataset change your mindset,Hans Rosling,19:56,"medicine,presentation,science,technology,data,statistics,global development,math,global issues,Asia,visualizations,Africa"
"
","
","
","
","
",Let my dataset change your mindset,Hans Rosling,19:56,"medicine,presentation,science,technology,data,statistics,global development,math,global issues,Asia,visualizations,Africa"
