en,es,tr,fr,de,title,speaker,duration,tags
"
											Now this little quote about sculpture from Henry Moore,
											I believe that that ""pressure within"" that Moore's talking about —
											at least when it comes to cars —
											comes right back to this idea of the mean.
											It's that will to live, that need to survive, to express itself,
											that comes in a car, and takes over people like me.
											And we tell other people, ""Do this, do this, do this,"" until this thing comes alive.
											We are completely infected. And beauty can be the result
											of this infectiousness; it's quite wonderful.
											This sculpture is, of course, at the heart of all of it,
											and it's really what puts the craftsmanship into our cars.
											And it's not a whole lot different, really, when they're working like this,
											or when somebody works like this.
											It's that same kind of commitment, that same kind of beauty.
									","
											Ahora esta pequeña cita de Henry Moore sobre la escultura,
											creo que esa ""presión interna"" de la que Moore está hablando —
											al menos en lo que se refiere a los coches —
											vuelve directamente a esta idea del medio.
											Es esa voluntad de vivir, esa necesidad de sobrevivir, de expresarse a sí mismo,
											que viene con un coche, y se apodera de gente como yo.
											Y le decimos a otra gente, ""Haz esto, haz esto, haz esto"", hasta que esta cosa toma vida.
											Estamos completamente contagiados. Y la belleza puede ser el resultado
											de este contagio, es bastante maravilloso.
											Esta escultura está, por supuesto, en el centro de todo,
											y es realmente lo que pone la artesanía en nuestros coches.
											Y no es muy diferente, en realidad, cuando están trabajando de este modo,
											o cuando alguien trabaja de este modo.
											Es el mismo tipo de compromiso, el mismo tipo de belleza.
									","
											Bu da Henry Moore'dan kısa bir alıntı,
											bence burada Moore'un ""içindeki baskı"" ile bahsettiğini
											arabalara uyarlarsak
											tam olarak bu anlam olayına geri dönüyoruz.
											İşte bu yaşama isteği , hayatta kalma ve kendini ifade etme ihtiyacı,
											arabayla buluşuyor ve benim gibi insanları ele geçiriyor.
											Ve biz diğer insanlara bu şey hayata geçene kadar ""Bunu yap, bunu yap, bunu yap,"" diyoruz.
											Bulaşıcı bir hastalık gibi. Ve güzellik
											bunun bir sonucu olabilir, bu harika bir şey.
											Heykeltraşlık da elbette, bütün bunların can damarı
											el emeğinin arabalarımızda yerini almasını sağlayan da o.
											Bu veya şu şekilde çalışmaları o kadar da
											önemli değil.
											O aynı kendini adamışlık, aynı güzellik.
									","
											Maintenant cette petite citation sur la sculpture de Henry Moore,
											Je crois que cette ""pression à l'intérieur"" dont Moore parle -
											au moins quand il s'agit de voitures -
											ramène à cette idée de la moyenne.
											C'est cette volonté de vivre, ce besoin de survivre, de s'exprimer,
											qui vient dans une voiture, et s'empare de gens comme moi.
											Et nous disons aux autres, «Faites ceci, faites ceci, faites cela», jusqu'à ce que cette chose prenne vie.
											Nous sommes complètement infectés. Et la beauté peut être le résultat
											de cette contagion, c'est tout à fait merveilleux.
											Cette sculpture est, bien sûr, au cœur de tout cela,
											et c'est vraiment ce qui met le savoir-faire dans nos voitures.
											Et ce n'est pas vraiment très différent, quand ils travaillent comme ça,
											ou lorsque quelqu'un travaille comme ça.
											C'est ce même genre d'engagement, ce même genre de beauté.
									","
											Nun ein kleines Zitat über die Skulptur von Henry Moore,
											Ich glaube, dass ""der Druck im Innern"", von dem Moore spricht —
											zumindest im Hinblick auf Autos —
											geradeswegs zurück führt zu dieser Idee des Gemeinen.
											Es ist dieser Wille zu leben, dieser Drang zum Überleben, sich auszudrücken,
											der einem in einem Auto kommt, und von Leuten wie mir Besitz ergreift.
											Und wir erzählen anderen Leuten ""Tu dies, mach das"", bis das Ding zum Leben erwacht ist.
											Wir sind völlig infiziert. Und dabei kann Schönheit herauskommen,
											aus dieser Infiziertheit, es ist ganz wunderbar.
											Natürlich ist die Skulptur das Herz des Ganzen,
											und tatsächlich das, was die Handwerkskunst in unsere Autos bringt.
											Und der Unterschied, ob jemand so oder so arbeitet
											ist tatsächlich nicht besonders groß.
											Es ist dieselbe Art der Hingabe, dieselbe Art der Schönheit.
									",Great cars are great art,Chris Bangle,20:04,"business,cars,design,industrial design,invention,technology,transportation,art"
"
","
","
","
","
",Great cars are great art,Chris Bangle,20:04,"business,cars,design,industrial design,invention,technology,transportation,art"
"
											Now, now I get to the point. I want to talk about cars as art.
											Art, in the Platonic sense, is truth; it's beauty, and love.
											Now this is really where designers in car business diverge from the engineers.
											We don't really have a problem talking about love.
											We don't have a problem talking about truth or beauty in that sense.
											That's what we're searching for —
											when we're working our craft, we are really trying to find that truth out there.
											We're not trying to find vanity and beauty.
											We're trying to find the beauty in the truth.
											However, engineers tend to look at things a little bit more Newtonian,
											instead of this quantum approach.
											We're dealing with irrationalisms,
											and we're dealing with paradoxes that we admit exist,
											and the engineers tend to look things a little bit more like
											two and two is four, and if you get 4.0 it's better, and 4.000 is even better.
											And that sometimes leads to bit of a divergence
											in why we're doing what we're doing.
											We've pretty much accepted the fact, though,
											that we are the women in the organization at BMW —
											BMW is a very manly type business, — men, men, men; it's engineers.
											And we're kind of the female side to that. That's OK,
											that's cool. You go off and be manly. We're going to be a little bit more female.
											Because what we're interested in is finding form that's more than just a function.
									","
											Bien, vale, voy al grano. Quiero hablar de los coches como arte.
											El Arte, en el sentido platónico, es verdad, es belleza, y amor.
											Ahora aquí es donde realmente los diseñadores en el negocio de los coches se separan de los ingenieros.
											No tenemos en realidad problemas para hablar de amor.
											No tenemos problemas para hablar de la verdad o la belleza en ese sentido.
											Eso es lo que estamos buscando —
											cuando estamos trabajando en nuestro oficio, estamos en realidad tratando de encontrar la verdad ahí fuera.
											No estamos tratando de encontrar vanidad y belleza.
											Estamos tratando de encontrar la belleza en la verdad.
											Por el contrario, los ingenieros tienden a mirar las cosas de un modo más newtoniano,
											en lugar de este enfoque cuántico.
											Estamos tratando con cosas irracionales,
											y estamos tratando con paradojas que admitimos que existen,
											y los ingenieros tienden a mirar las cosas un poco más como
											dos más dos son cuatro, y si obtienes 4.0 es mejor, y 4.0000 es todavía mejor.
											Y eso a veces lleva a una cierta divergencia
											en por qué hacemos lo que hacemos.
											Hemos aceptado en gran medida, no obstante, el hecho
											de que somos las mujeres en la organización de BMW —
											BMW es un tipo de negocio muy masculino, — hombres, hombres, hombres, son ingenieros.
											Y somos un poco el lado femenino de eso. Está bien,
											es estupendo, tú vas y eres masculino, nosotros vamos a ser un poco más femeninos.
											Porque lo que nos interesa es encontrar forma que sea más que una simple función.
									","
											O halde, şimdi konuya geliyorum. Bir sanat olarak arabalardan bahsetmek istiyorum.
											Sanat, Eflatun'a göre doğruluk, güzellik ve aşktır.
											İşte araba sektöründeki tasarımcıları mühendislerden ayıran nokta aslında budur.
											Aşk hakkında konuşmakla ilgili bir sorunumuz yok.
											Bu açıdan güzellik ve doğruluk hakkında konuşmak ile de bir problemimiz yok.
											Aradığımız şey de bu aslında—
											sanatımızla uğraşırken, gerçekten de doğruluğu bulmaya çalışıyoruz.
											Gösterişi veya güzelliği bulmaya çalışmıyoruz.
											Doğruluğun içindeki güzelliğini arıyoruz.
											Bununla birlikte, mühendisler konulara bu anlayışla bakmak yerine
											daha çok Newton vari bir açıdan yaklaşma eğilimindeler.
											Uğraştığımız şey akıldışılık,
											ve varlığını kabullendiğimiz çıkmazlarla uğraşıyoruz,
											ama mühendisler olaylara daha çok iki kere iki dört eder,
											4.0 iyidir ama 4.0000 daha da iyidir matığıyla yaklaşıyorlar.
											Ve bazen bu farklar
											neden yapıyoruz ve ne yapıyoruza dönüşüyor.
											Gerçi şu gerçeği fazlasıyla kabullendik ki
											biz, BMW çatısı altında çalışan hanımlarız.
											BMW çok erkeksi bir iş yeri — erkekler, erkekler, erkekler, mühendisler işte.
											Biz de bir açıdan bu işin dişi kısmıyız. Bu sorun değil,
											bu gayet havalı, sen git ve erkek ol, biz de biraz daha fazla dişi gibi davranalım.
											Çünkü bizim ilgimizi çeken işlevsellikten de öte bir şey olan biçimi bulabilmek.
									","
											Maintenant, j'en viens au fait. Je veux parler de voitures en tant qu'art.
											L'art, au sens platonicien, c'est la vérité, la beauté, et l'amour.
											Maintenant, c'est vraiment là que les designers de l'industrie automobile s'écartent des ingénieurs.
											Parler d'amour ne pose pas vraiment de problème.
											Parler de la vérité ou de la beauté ne nous pose pas vraiment de problème dans ce sens.
											C'est ce que nous recherchons -
											lorsque nous faisons notre métier, nous essayons vraiment de trouver cette vérité cachée.
											Nous n'essayons pas de trouver la vanité et la beauté.
											Nous essayons de trouver la beauté dans la vérité.
											Cependant, les ingénieurs ont tendance à regarder les choses un peu plus selon Newton,
											au lieu de cette approche quantique.
											Nous avons affaire à des irrationalismes,
											et nous avons affaire à des paradoxes dont nous admettons l'existence,
											et les ingénieurs ont tendance à regarder les choses un peu plus peu comme
											deux et deux font quatre, et si vous obtenez 4,0 c'est mieux, et 4,0000, c'est encore mieux.
											Et cela conduit parfois à une certaine divergence
											quant à savoir pourquoi nous faisons ce que nous faisons.
											Nous avons à peu près accepté le fait, cependant,
											que nous sommes les femmes dans l'organisation chez BMW -
											BMW est une entreprise de type très viril, - les hommes, les hommes, les hommes, ce sont des ingénieurs.
											Et nous sommes en quelque sorte le côté féminin. C'est d'accord,
											c'est cool, tu la joues viril, nous allons être un peu plus féminines.
											Parce que ce qui nous intéresse est de trouver la forme qui est plus qu'une simple fonction.
									","
											Nun, wollen wir zum Punkt kommen. Ich möchte über Autos als Kunst sprechen.
											Kunst, im platonischen Sinne, ist Wahrheit, Schönheit und Liebe.
											Genau an diesem Punkt gehen die Designer und die Ingenieure in der Automobilindustrie getrennte Wege.
											Wir haben nicht wirklich ein Problem damit, über Liebe zu sprechen.
											Wir haben kein Problem damit, in diesem Sinne über Wahrheit und Schönheit zu sprechen.
											Danach suchen wir —
											wenn wir in unserem Handwerk arbeiten, sind wir tatsächlich dabei, dort draußen Wahrheit zu finden.
											Wir versuchen nicht, Eitelkeit und Schönheit zu finden.
											Wir versuchen, Schönheit in der Wahrheit zu finden.
											Im Gegensatz dazu neigen Ingenieure dazu, die Dinge etwas mehr im Sinne Newtons zu betrachten,
											anstelle dieser Quantenmethode.
											Wir befassen uns mit dem Irrationalen,
											wir befassen uns mit Widersprüchen, deren Existenz wir uns eingestehen,
											und die Ingenieure tendieren dazu, Dinge etwas mehr im Sinne von
											zwei und zwei ist vier, und wenn man 4,0 heraus bekommt, dann ist das besser, und 4,0000 sogar noch besser.
											Und manchmal führt das zu einer gewissen Abweichung in Bezug
											auf den Grund unseres Tuns.
											Im Großen und Ganzen haben wir dennoch die Tatsache akzeptiert,
											dass wir bei BMW die Frauen sind —
											BMW ist ein sehr männlich orientiertes Unternehmen — überall Männer, Männer, Männer, das sind die Ingenieure.
											Und wir sind in gewisser Weise die weibliche Seite davon. Das ist in Ordnung,
											das ist cool, geht ihr einfach und seid männlich, wir sind dann ein bisschen weiblicher.
											Denn was uns interessiert, ist das Finden von Form, die mehr ist als nur eine Funktion.
									",Great cars are great art,Chris Bangle,20:04,"business,cars,design,industrial design,invention,technology,transportation,art"
"
","
","
","
","
",Great cars are great art,Chris Bangle,20:04,"business,cars,design,industrial design,invention,technology,transportation,art"
"
											We're interested in finding beauty that's more than just an aesthetic;
											it's really a truth.
											And I think this idea of soul, as being at the heart of great cars,
											is very applicable. You all know it. You know a car when you've seen it,
											with soul. You know how strong this is.
											Well, this experience of love, and the experience of design, to me,
											are interchangeable. And now I'm coming to my story.
									","
											Estamos interesados en encontrar belleza que sea más que una simple estética,
											que sea en realidad una verdad.
											Y creo que esta idea del alma, como corazón de los grandes coches,
											es muy aplicable. Todos lo sabéis. Reconocéis un coche cuando lo habéis visto,
											con alma. Sabéis lo fuerte que es esto.
											Bien, esta experiencia del amor, y la experiencia del diseño, para mí,
											son intercambiables. Y ahora llego a mi historia.
									","
											Biz güzelliği bulmanın peşindeyiz, sade estetik değil.
											doğrusu da bu zaten.
											Bu ruhun fikri de bu sanırım, mükemmel arabaların kalbinde yer alma,
											çok da yerinde bir düşünce. Hepiniz bunu biliyorsunuz.
											Ruhu olan bir arabayı görünce tanırsınız. Bunun ne kadar güçlü olduğunu bilirsiniz.
											Aslında, sevginin deneyimi ve tasarımın deneyimi bana göre
											birbirleriyle değiş tokuş edilebilir. Ve şimdi kendi hikayeme geliyorum.
									","
											Ce qui nous intéresse c'est de trouver la beauté qui est plus qu'une simple esthétique,
											c'est vraiment une vérité.
											Et je pense que cette idée de l'âme, comme étant au cœur de superbes voitures,
											est très valable. Vous le savez tous. Vous reconnaissez une voiture quand vous l'avez vue,
											avec l'âme. Vous savez comment c'est fort.
											Eh bien, cette expérience de l'amour, et l'expérience de la conception, selon moi,
											sont interchangeables. Et maintenant j'en viens à mon histoire.
									","
											Unser Interesse ist es, Schönheit zu finden, die mehr als nur ästhetisch ist,
											sondern tatsächlich eine Wahrheit.
											Und ich denke, dass dieser Gedanke, dass großartigen Autos eine Seele innewohnt,
											sehr brauchbar ist. Sie alle wissen das. Sie erkennen ein Auto mit Seele
											beim ersten Anblick. Sie wissen, wie stark es ist.
											Nun, für mich sind die Erfahrung von Liebe und die Erfahrung von Design
											austauschbar. Und jetzt komme ich gleich bei meiner Geschichte an.
									",Great cars are great art,Chris Bangle,20:04,"business,cars,design,industrial design,invention,technology,transportation,art"
"
","
","
","
","
",Great cars are great art,Chris Bangle,20:04,"business,cars,design,industrial design,invention,technology,transportation,art"
"
											I discovered something about love and design through a project called Deep Blue.
											And first of all, you have to go with me for a second, and say,
											you know, you could take the word ""love"" out of a lot of things in our society,
											put the word ""design"" in, and it still works,
											like this quote here, you know. It kind of works, you know?
											You can understand that. It works in truisms.
											""All is fair in design and war.""
											Certainly we live in a competitive society.
											I think this one here, there's a pop song
											that really describes Philippe Starck for me, you know, this is like
											you know, this is like puppy love, you know, this is cool right?
											Toothbrush, cool.
											It really only gets serious when you look at something like this. OK?
									","
											Descubrí algo acerca del amor y el diseño a través de un proyecto llamado Deep Blue.
											Y lo primero de todo, tenéis que seguirme durante un segundo, y decir,
											sabes, podrías quitar la palabra amor de un montón de cosas en nuestra sociedad,
											poner la palabra diseño en su lugar, y seguiría funcionando,
											como esta cita de aquí, sabes. Más o menos funciona, ¿sabes?
											Puedes entender eso. Funciona en perogrulladas.
											""Todo está permitido en el diseño y en la guerra"".
											Por supuesto que vivimos en una sociedad competitiva.
											Creo que esta de aquí, hay una canción pop
											que para mí describe verdaderamente a Philippe Starck, sabes, es como,
											sabes, es como el cariño hacia un cachorro, sabes, esto está bien ¿no?
											Cepillo de dientes, estupendo.
											Sólo se vuelve serio cuando miras a algo como esto, ¿de acuerdo?
									","
											""Deep Blue"" adlı bir projede sevgi ve tasarım ile ilgili bir şeyi fark ettim.
											Her şeyden önce, şunda hemfikir olmalı ve demeliyiz ki, bilirsiniz,
											bizim toplumumuzda sevgi sözcüğü pek çok şeyin içinden çekip alınabilir,
											ve yerine tasarım sözcüğünü koyabilirsiniz, yine de bir şey değişmez,
											tıpkı bu alıntı gibi. İşe yarıyor değil mi, bilirsiniz işte.
											Bunu anlayabilirsiniz. Herkesin bildiği gerçekler.
											""Tasarımda ve savaşta her şey mübahtır.""
											Şu kesin ki rekabetçi bir toplumda yaşıyoruz.
											Sanırım buradaki, bir pop şarkısı vardı,
											Philippe Starck'ı tam manasıyla anlatıyordu, anlarsınız, şey gibi
											bilirsiniz işte, yavru köpek sevgisi gibi, güzel değil mi?
											Diş fırçası, harika.
											Böyle bir şeye baktığınızda olay daha da ciddileşiyor.
									","
											J'ai découvert quelque chose à propos de l'amour et du design au travers d'un projet appelé Deep Blue.
											Et d'abord, vous devez venir avec moi pendant une seconde, et disons,
											vous pouvez sortir le mot amour d'un tas de choses dans notre société,
											le remplacer par le mot design, et ça marchera encore,
											comme cette citation ici, vous savez. Ça fonctionne, vous savez?
											Vous pouvez comprendre cela. Ça marche en truismes.
											""Tout est juste dans le design et la guerre.""
											Certes, nous vivons dans une société compétitive.
											Je pense que celui-là, il y a une chanson pop
											qui décrit vraiment Philippe Starck pour moi, c'est comme
											'puppy love' l'amour d'un chiot, c'est cool, non?
											Brosse à dents, cool.
											Ça ne devient grave que quand on regarde quelque chose comme ça. OK?
									","
											Ich entdeckte etwas über Liebe und Design durch ein Projekt mit Namen Deep Blue.
											Und zuallererst müssen Sie ein Weilchen folgen und, sagen wir,
											Sie wissen schon, wir könnten das Wort Liebe aus einer Menge Dinge in unserer Gesellschaft herausnehmen
											und durch das Wort Design ersetzen, und es funktioniert immer noch.
											Wie dieses Zitat hier. Irgendwie funktioniert es doch, oder nicht?
											Man kann es verstehen. Es funktioniert in Binsenweisheiten.
											""Im Krieg und im Design ist alles erlaubt.""
											Wir leben gewiss in einer wettbewerbsorientierten Gesellschaft.
											Das hier zum Beispiel, es gibt einen Popsong,
											der Philippe Starck wirklich für mich beschreibt, wissen Sie, das ist wie,
											Sie wissen schon, das ist eine Schwärmerei, richtig cool, oder?
											Zahnbürste, cool.
											Ernsthaft wird es erst, wenn man sich so etwas anschaut. Okay?
									",Great cars are great art,Chris Bangle,20:04,"business,cars,design,industrial design,invention,technology,transportation,art"
"
","
","
","
","
",Great cars are great art,Chris Bangle,20:04,"business,cars,design,industrial design,invention,technology,transportation,art"
"
											(Laughter)
									","
											(Risas)
									","
											Değil mi?
									","
											(Rires)
									","
											(Gelächter)
									",Great cars are great art,Chris Bangle,20:04,"business,cars,design,industrial design,invention,technology,transportation,art"
"
","
","
","
","
",Great cars are great art,Chris Bangle,20:04,"business,cars,design,industrial design,invention,technology,transportation,art"
