es,tr,fr,de,title,speaker,duration,tags
"
											Y Al Gore dijo que la imagen más fotografiada del mundo,
											la imagen que más se ha impreso en el mundo,
											era la de la Tierra. Pero esto era en 1974,
											y, desde ese momento, esta foto fue la foto
											que más se imprimió,
											porque nosotros imprimimos dos mil millones de copias de esta foto,
											y las llevamos de mano a mano, puerta a puerta,
											para mostrarla a la gente y preguntarles si tenían la viruela
											porque ese era nuestro sistema de vigilancia. No teníamos Google,
											no teníamos arañas web, no teníamos computadoras.
									","
											Ve Al Gore'nin önceden dediği gibi, dünyadaki en çok çekilen fotoğraf,
											dünyada en çok basılan resim,
											Ama bu 1974'te idi,
											ve bu fotoğrafın çekildiği zamanlarda
											en geniş çapta basıldı
											insanlara göstermek ve evlerinde çiçek hastalığı taşıyan
											olup olmadığını sormak için bu fotoğraftan
											iki milyar tane bastırdık ve elden ele, kapı kapı dolaşarak dağıttık
											çünkü bizim denetleme sistemimiz buydu. Google yoktu,
											internet erişimimiz ve bilgisayarımız da yoktu.
									","
											Et Al Gore a dit auparavant que l'image la plus photographiée au monde,
											l'image la plus imprimée au monde,
											était celle de la Terre. Mais c'était en 1974,
											et à ce moment cette photographie était la photographie
											qui était la plus imprimée
											parce que nous en avons imprimé 2 milliards de copies de cette photo,
											et nous les avons distribuées de mains en mains, de porte à porte,
											pour montrer aux gens et leur demander s'il y avait la variole dans leur maison
											parce que c'était notre système de surveillance. Nous n'avions pas Google,
											nous n'avions pas de moteurs de recherche, nous n'avions pas d'ordinateurs.
									","
											Al Gore hat vorher gesagt, dass das am meisten fotografierte Bild der Welt,
											das am meisten gedruckte Bild
											das der Erde sei. Aber das war 1974,
											und von diesem Moment an war dieses Bild das eine Foto,
											welches am meisten gedruckt wurde,
											denn wir druckten zwei Milliarden Abzüge dieses Fotos
											und reichten sie von Hand zu Hand, von Tür zu Tür,
											um sie den Menschen zu zeigen und sie zu fragen, ob es in ihrem Haus Pocken gab,
											denn das war unser Überwachungssystem. Wir hatten kein Google,
											wir hatten keine Webcrawler, keine Computer.
									",My wish: Help me stop pandemics,Larry Brilliant,25:50,"TED Prize,collaboration,disease,ebola,global issues,health,science,technology"
"
","
","
","
",My wish: Help me stop pandemics,Larry Brilliant,25:50,"TED Prize,collaboration,disease,ebola,global issues,health,science,technology"
"
											Para el día nueve, ustedes miran está foto y están horrorizados.
											Yo miro esta foto y digo, ""Gracias a Dios""
											porque está claro que este es solamente un caso ordinario de viruela,
											y sé que esta niño vivirá.
											Y para el día trece, se están formando costras en las lesiones, sus párpados están inflamados,
											pero ya se sabe que esta niño no tiene una infección secundaria.
											Y para el día 20, a pesar de que tendrá cicatrices de por vida, vivirá.
									","
											Dokuzuncu günde, şu resme bakın ve korkun.
											Bu resme bakıp diyorum ki, ""Teşekkürler Allah'ım""
											çünkü açıkça görünüyor ki bu normal bir çiçek vakası ve
											biliyorum, bu çocuk yaşıyacak.
											On üçüncü günde, yaralar kabuk bağlar, göz kapakları şişer,
											ama biliyorsunuz ki bu çocuğun ikinci bir enfeksiyonu yoktur.
											20'ince günde, yaşam için yaralı olsada bu çocuk yaşıyacak.
									","
											Au 9ème jour, vous voyez cette image, et vous êtes horrifié.
											Je regarde cette image et je dis, ""Merci mon Dieu""
											parce qu'il est clair qu'il s'agit seulement d'un cas ordinaire de variole,
											et je sais que cet enfant vivra.
											Et au 13ème jour, les lésions font des croûtes, ses paupières son enflées,
											mais vous savez que cet enfant n'a pas d'infection secondaire.
											Et au 20ème jour, alors qu'il gardera des cicatrices toute sa vie, il vivra.
									","
											Am neunten Tag sehen Sie dieses Bild und sind erschüttert.
											Ich sehe das Bild an und sage, ""Gott sei Dank"",
											denn es ist klar, dass dies nur ein gewöhnlicher Pockenfall ist
											und ich weiss, dieses Kind wird überleben.
											Am Tag 13 verschorfen die Wunden, die Augenlider sind geschwollen,
											aber man weiss, dieses Kind hat keine andere, sekundäre Infektion.
											Am Tag zwanzig wird er fürs Leben von Narben gezeichnet sein, aber er wird überleben.
									",My wish: Help me stop pandemics,Larry Brilliant,25:50,"TED Prize,collaboration,disease,ebola,global issues,health,science,technology"
"
","
","
","
",My wish: Help me stop pandemics,Larry Brilliant,25:50,"TED Prize,collaboration,disease,ebola,global issues,health,science,technology"
"
											Hay otros tipos de viruela que no son así.
											Esta es la viruela confluente,
											en la cual no hay lugar alguno en el cuerpo donde puedas poner un dedo
											y no estar cubierto de lesiones.
											Viruela plana, que mató al 100% de los que la padecieron.
											Y viruela hemorrágica, la más cruel de todas,
											que tenía una predilección por las mujeres embarazadas.
											Yo probablemente haya tenido 50 mujeres que murieron. Todas tenían viruela hemorrágica.
											Yo no he visto a nadie morir de ella sin ser una mujer embarazada.
									","
											Bunun gibi olmayan çiçek hastalıkları da var.
											Bu konfluent çiçek hastalığı,
											vücutta parmağını dokunuracak doku bozukluğu olmayan
											yer bırakmamıştır.
											Normal çiçek hastalığı, hastalığı kapan isanları yüzde yüz öldürür.
											Ve kanamalı çiçek, içlerinde en kötüsü,
											hamile bayanlarda daha çok görülür.
											Tahminen 50 kadını kaybettik. Hepsi de kanamalı çiçek hastalığı olmuştu.
											Bu hastalıktan ölen ama hamile olmayan bayan görmedim.
									","
											Il y a d'autres types de variole qui ne sont pas de ce type.
											Il s'agit de la variole confluente,
											avec laquelle il n'y a pas un seul endroit du corps où mettre le doigt
											sans être couvert de lésions.
											La variole maligne, qui a tué 100% des gens qui l'ont contractée.
											Et la variole hémorragique, la plus cruelle de toutes,
											qui avait une prédilection pour les femmes enceintes.
											J'ai probablement vu mourir 50 femmes. Elles avaient toutes la variole hémorragique.
											Je n'ai jamais vu personne d'autres que des femmes enceintes en mourir.
									","
											Es gibt andere Arten von Pocken, die nicht so sind.
											Das hier sind konfluierende Pocken,
											bei denen es keine einzige Stelle am Körper gibt, die man mit einem Finger berühren könnte,
											ohne dass sie mit Wunden übersäht ist.
											Flache Pocken, die 100 Prozent der infizierten Menschen umbringen.
											Und blutige Pocken, die grausamste Form von allen,
											die eine Vorliebe für schwangere Frauen hatte.
											Ich habe wahrscheinlich 50 Frauen sterben sehen. Sie hatten alle blutige Pocken.
											Ich habe ausschliesslich schwangere Frauen daran sterben sehen.
									",My wish: Help me stop pandemics,Larry Brilliant,25:50,"TED Prize,collaboration,disease,ebola,global issues,health,science,technology"
"
","
","
","
",My wish: Help me stop pandemics,Larry Brilliant,25:50,"TED Prize,collaboration,disease,ebola,global issues,health,science,technology"
"
											En 1967 la OMS se embarcó en lo que era un impresionante programa
											para erradicar una enfermedad.
											En ese año había 34 países afectados por la viruela.
											Para 1970, habíamos bajado a 18 países.
											En 1974, habíamos bajado a 5 países.
											Pero en ese año, la viruela explotó a lo largo de toda la India.
											Y India fue el lugar donde la viruela libró su última batalla.
											En 1974, India tenía una población de 600 millones.
											Existen 21 lenguas en India,
											que es como decir 21 países distintos.
											Hay 20 millones de personas en las calles en todo momento, en buses
											y trenes, caminando, 500 000 aldeas, 120 millones de hogares,
											y ninguno de ellos quería reportar si habían tenido un caso de viruela en su casa
											porque ellos creían que la viruela era la visita de una deidad,
											Shitala Mata, la madre frío,
											y estaba mal traer a extraños dentro de tu hogar
											cuando una deidad está en casa. No había incentivo para reportar la viruela.
									","
											1967 de, WHO (Dünya Sağlık Örgütü) hastalığı ortadan kaldırmak
											için ciddi bir girişim yaptı.
											O yılda, çiçek hastalığı 34 ülkeyi etkilemişti.
											1970'ye kadar, 18 ülkeye düşürdük.
											1974'te 5 ülke kaldı.
											Ama o yıl hastalık, Hindistan'da ortaya çıktı.
											Ve Hindistan, hastalığın en son ayakta kaldığı yer oldu.
											1974'te, Hindistan'ın nüfusu 600 milyon oldu.
											Hindistan'da 21 dil konuşan yer vardı,
											bu bir bakıma 21 ülke demektir.
											Herhangi bir anda 20 milyon insan yolda, otobüste,
											trende, veya yürüyordur, 500,000 köy ve 120 milyon hane vardır,
											ve hiçbiri de evlerinde çiçek hastalığı olduğunu bildirmek istemezler
											çünkü onlara göre çiçek hastalığı serinlik annesi Shila Mata'nın
											dini bir ziyaretidir
											ve evde ilahi bir ziyaret varken yabancıları
											davet etmek yanlıştır. Hastalığı bildirme girişiminde bulunmadılar.
									","
											En 1967, l'OMS s'est engagée dans un programme exorbitant
											pour éradiquer une maladie.
											Cette année-là, 34 pays ont été affectés par la variole.
											En 1970, nous étions descendus à 18 pays.
											1974, on en était à 5 pays.
											Mais cette année-là, la variole a explosé dans toute l'Inde.
											Et l'Inde était un endroit où la variole livrait sa dernière bataille.
											En 1974, l'Inde avait une population de 600 millions d'individus.
											Il y a 21 langues parlées en Inde,
											cela revient à dire 21 pays différents.
											Il y a 20 millions de gens sur la route à tout le temps dans les bus
											et les trains, qui marchent, 500 000 villages, 120 millions de foyers,
											et aucun d'entre eux ne voulait signaler s'ils avait un cas de variole chez eux
											parce qu'ils pensaient que la variole était la visite d'une divinité,
											Shitala Mata, la mère froide,
											et c'était mal d'amener des étrangers à la maison
											quand la divinité était chez vous. Pas incitant à signaler la variole.
									","
											1967 begann die WHO ein unfassbares Programm,
											eine Kranheit auszurotten.
											In diesem Jahr gab es 34 von Pockeln betroffene Länder.
											1970 waren es noch 18 Länder.
											1974 waren wir bei fünf Ländern.
											Aber in diesem Jahr explodierte die Pockenausbreitung in Indien.
											Und Indien war der Ort, wo die Pocken zum letzten Mal Widerstand leisteten.
											1974 hatte Indien eine Bevölkerung von 600 Millionen.
											Es gibt in Indien 21 Sprachstaaten,
											das ist, als ob es 21 verschiedene Länder wären.
											Es sind zu jeder Zeit 20 Millionen auf Strassen unterwegs, in Bussen
											und Zügen, zu Fuss, 500.000 Dörfer, 120 Millionen Haushalte
											und keiner von ihnen wollte melden, ob sie einen Fall von Pocken im Haus hätten,
											weil sie dachten, Pocken seien die Heimsuchung einer Gottheit,
											Shitala Mata, die kühlende Mutter,
											und es war falsch für sie, Fremde ins Haus zu lassen,
											währenddem die Gottheit darin weilte. Kein Anreiz, Pocken zu melden.
									",My wish: Help me stop pandemics,Larry Brilliant,25:50,"TED Prize,collaboration,disease,ebola,global issues,health,science,technology"
"
","
","
","
",My wish: Help me stop pandemics,Larry Brilliant,25:50,"TED Prize,collaboration,disease,ebola,global issues,health,science,technology"
"
											No solo era India la que tenía deidades de la viruela,
											prevalecían alrededor de todo el mundo.
											Así, la forma como erradicamos la viruela fue —las vacunaciones masivas no funcionarían.
											Podías vacunar a todos en India,
											pero un año más tarde habrán 21 millones de nuevos bebés,
											que en esa época era la población de Canadá.
											Simplemente no sería suficiente vacunar a todo el mundo.
											Tenías que encontrar cada caso de viruela en el mundo
											al mismo tiempo y dibujar un círculo de inmunidad alrededor de él.
											Y eso fue lo que hicimos.
											Solamente en India, mis 150 000 mejores amigos y yo
											fuimos de puerta en puerta con la misma fotografía
											a cada casa en la India. Hicimos más de mil millones de visitas.
									","
											Bu çiçek hastalığı olayı sadece Hindistan'da değil
											tüm dünyada yaygın bir olaydı.
											Bu yüzden, hastalığı bitirmek için herkesi aşılamak da işe yaramaz.
											Hindistan'daki herkesi aşılayabilirsiniz,
											fakat bir yıl sonra 21 milyon yeni bebek doğuyor
											ki bu, Kanada'nın nüfusu kadardır.
											Bu herkesi aşılayarak yapılabilecek bir şey değildi.
											Dünyadaki tüm çiçek hastalığı vakalarını aynı anda bulup
											bir bağışıklık çemberi çizmeniz gerekir.
											İşte biz bunu yaptık.
											Sadece Hindistan'da, ben ve 150,000 dostum
											kapı kapı aynı resimle dolaştık.
											Bir milyardan fazla evi telefonla aradık.
									","
											Il n'y avait pas que l'Inde à avoir des divinités,
											les divinités de la variole étaient prévalentes dans le monde entier.
											Donc, voilà comment nous avons éradiqué la variole - une campagne de vaccination massive n'aurait pas marché.
											On ne pouvait pas vacciner tout le monde en Inde,
											mais un an plus tard il y aurait 21 millions de nouveaux nés,
											ce qui était alors l'équivalent de la population du Canada
											ça ne marcherait pas de vacciner tout le monde.
											Il fallait trouver chaque cas de variole dans le monde
											en même temps et dessiner un cercle d'immunité autour.
											Et c'est ce que nous avons fait.
											Rien qu'en Inde, mes 150 000 meilleurs amis et moi
											sommes allés de porte en porte avec la même image
											dans chaque maison en Inde. Nous avons fait plus d'un milliard de visites à domicile.
									","
											Nicht nur in Indien gab es Pocken-Gottheiten,
											sie waren überall auf der Welt verbreitet.
											Wie wir die Pocken also aurotteten war – Impfungen hätten nicht funktioniert.
											Man könnte jeden Menschen in Indien impfen,
											aber ein Jahr später sind da 21 Millionen neue Babys,
											das entsprach zu der Zeit der Bevölkerung von Kanada.
											Es würde nicht reichen, einfach jeden zu impfen.
											Wir mussten weltweit jeden einzelnen Pockenfall gleichzeitig finden
											und einen Kreis von Immunität darum ziehen.
											Und das taten wir.
											Allein in Indien gingen meine 150.00 besten Freunde und ich
											von Tür zu Tür mit diesem selben Bild,
											zu jedem einzelnen Haus in Indien. Wir machten über eine Milliarde Hausbesuche.
									",My wish: Help me stop pandemics,Larry Brilliant,25:50,"TED Prize,collaboration,disease,ebola,global issues,health,science,technology"
"
","
","
","
",My wish: Help me stop pandemics,Larry Brilliant,25:50,"TED Prize,collaboration,disease,ebola,global issues,health,science,technology"
"
											Y en el proceso, aprendí algo muy importante.
											Cada vez que hacíamos una búsqueda de casa en casa,
											teníamos un pico en el número de reportes de viruela
											Cuando no buscábamos, teníamos la ilusión de que no había enfermedad.
											Cuando buscábamos, teníamos la ilusión de que había más enfermedad.
											Un sistema de vigilancia era necesario
											porque lo que necesitábamos era detección temprana y respuesta temprana.
											Así, buscamos y buscamos, y encontramos
											cada caso de viruela en India. Ofrecimos una recompensa.
											Subimos la recompensa. Volvimos a subir la recompensa.
											Teníamos una hoja de puntajes que escribíamos en cada casa.
											Y, mientras hacíamos eso, el número de casos reportados en el mundo bajó a cero,
											y en 1980 declaramos al mundo libre de viruela.
									","
											Bu aşamada, çok önemli birşey öğrendim.
											Evleri teker tekrer dolaştığım sırada,
											çiçek hastalığı bildirenlerin sayısı arttı.
											Aramadığımız zamanda, sanki hastalığın durdurma sihiri yaptık.
											Arama yaptığımız zaman da, sanki çok daha fazla hastalık sihri yaptık.
											Gözetim sistemi gerekliydi
											çünkü yapmamız gereken erken tanı, erken tedaviydi.
											Araştırdık, araştırdık ve Hindistan'da bulunan
											tüm çiçek hastalıklarını bulduk. Karşılığını aldık.
											Ödülümüzü artırdık. Daha da artırmaya devam ettik.
											Her evde yazdığım bir sayı kartı vardı.
											Bunu yaptığımızda, dünyada bildirilen hastalık vakaları sıfıra indi,
											ve 1980'de çiçek hastalığının evrensel bitişini bildirdik.
									","
											Et dans la démarche, j'ai appris quelque chose de très important.
											Chaque fois que nous avons recherché de maison en maison,
											nous avions une pointe dans les signalements de variole.
											Quand nous ne cherchions pas, nous avions l'illusion qu'il n'y avait pas de maladie.
											Quand nous avons cherché, nous avions l'illusion qu'il y avait plus de maladie.
											Un système de surveillance était nécessaire
											parce que ce qu'il nous fallait, c'était une détection précoce, une réponse rapide.
											Alors, nous avons cherché et cherché, et nous avons trouvé
											chaque cas de variole en Inde. Nous avons avions une récompense.
											Nous avons augmenté la récompense. Nous avons continué à augmenter la récompense.
											Nous avions une carte de pointage que nous écrivions sur chaque maison.
											Et en faisant cela, le nombre de cas signalés dans le monde est tombé à zéro.
											et en 1980 nous avons déclaré la planète débarrassée de la variole.
									","
											Im Laufe dieses Prozesses habe ich etwas sehr wichtiges gelernt.
											Jedes Mal, wenn wir eine Haus-zu-Haus Suche machten,
											gab es eine Steigerung der Pockenmeldungen.
											Wenn wir nicht suchten, hatten wir die Illusion, es gebe keine Krankheit.
											Wenn wir suchten, hatten wir die Illusion, es gebe mehr davon.
											Ein Überwachungssystem war notwendig,
											wir brauchten Früherkennung und schnelle Reaktion.
											Also suchten und suchten wir, und wir fanden
											jeden Pockenfall in Indien. Wir hatten eine Belohnung.
											Wir hoben die Belohnung an, immer weiter.
											Es gab eine Bewertungsliste über jedes Haus.
											Und wie wir das taten, sank die Anzahl der gemeldeten Fälle auf null
											und 1980 erklärten wir die Welt als pockenfrei.
									",My wish: Help me stop pandemics,Larry Brilliant,25:50,"TED Prize,collaboration,disease,ebola,global issues,health,science,technology"
"
","
","
","
",My wish: Help me stop pandemics,Larry Brilliant,25:50,"TED Prize,collaboration,disease,ebola,global issues,health,science,technology"
"
											Fue la campaña más grande en la historia de las Naciones Unidas hasta la guerra de Iraq.
											150 000 personas de todo el mundo,
											médicos de todas las razas, religiones, culturas y naciones,
											que pelearon lado a lado, hermanos y hermanas, uno con otro,
											no uno contra otro, en una causa común de hacer un mundo mejor.
											Pero la viruela fue la cuarta enfermedad que se pretendía erradicar.
											Fallamos otras tres veces.
											Fallamos en contra de la malaria, la fiebre amarilla y la frambesia (pian).
											Pero puede que pronto veamos erradicado el polio.
											Pero la clave para erradicar el polio es la detección temprana y la respuesta temprana.
											Este podría ser el año que erradiquemos el polio —
											eso la haría la segunda enfermedad en la Historia.
											Y David Heymann, quién está viendo esto en el webcast —
											David, sigue avanzando. Estamos cerca. Estamos en los últimos cuatro países.
									","
											Birleşmiş Millet'lerin Irak savaşına kadar yaptığı en büyük çalışmaydı.
											Dünyanın her yerinden 150,000 insan,
											her kökenden, dinden, kültür ve milletten doktorlar
											omuz omuza, kardeşçe bir arada ortak bir neden için,
											dünyayı daha iyi hale getirmek için savaştılar.
											Ama çiçek hastalığı yok edilmeye çalışılan dördüncü hastalıktı.
											İlk üçünde yapamadık.
											Sıtma, sarı humma ve ekvator frengisinde başarısız olduk.
											Ama yakında çocuk felcinin de bitişini görebiliriz.
											Ama çocuk felcini yenmenin kilit noktası erken teşhis, erken tedavidir.
											Bu yıl çocuk felcinin sonu olabilir —
											bu tarihteki ikinci hastalık olacaktır.
											Ve David Heymann, şu an internetten bizi izliyor —
											David, devam et. Çok yakınız. Dört ülkeye kadar indik.
									","
											Ce fut la plus grande campagne dans l'histoire des Nations Unies jusqu'à la guerre en Iraq.
											150 000 personnes du monde entier,
											des médecins de toutes races, religions, cultures et nations,
											qui ont combattu côte à côte, frères et soeurs, les uns avec les autres,
											et pas les uns contre les autres, pour une cause commune pour rendre le monde meilleur.
											Mais la variole était la quatrième maladie à éradiquer.
											Nous avons échoué trois autres fois.
											Nous avons échoué contre le paludisme, la fièvre jaune et le pian.
											Mais bientôt nous pourrons peut-être voir la polio éradiquée.
											Mais la clé de l'éradication de la polio est une détection précoce, une réponse rapide.
											C'est peut-être cette année que nous allons éradiquer la polio —
											ça en fera la deuxième maladie de l'histoire.
											et David Heymann, qui nous regarde en webcast —
											David, continue. Nous y sommes presque. Il nous reste 4 pays.
									","
											Bis zum Irakkrieg war das die grösste Kampagne in der UN-Geschichte.
											150.000 Menschen aus der ganzen Welt,
											Ärzte jeder Rasse, Religion, Kultur und Nation,
											die gemeinsam als Brüder und Schwestern kämpften,
											nicht gegeneinander, sondern für das gemeinsame Ziel, die Welt besser zu machen.
											Aber die Pocken waren die vierte Krankheit, die zur Ausrottung bestimmt war.
											Drei weitere Male sind wir gescheitert.
											Wir scheiterten gegen Malaria, Gelbfieber und Frambösie.
											Aber bald könnte Polio eliminiert sein.
											Der Schlüssel zur Ausrottung von Polio ist Früherkennung und schnelle Reaktion.
											Das könnte das Jahr sein, in dem wir Polio ausrotten –
											das wäre dann die zweite Krankheit in der Geschichte.
											David Heymann, der das über den Webcast sieht –
											David, mach weiter. Wir sind nah dran. Wir haben nur noch vier Länder.
									",My wish: Help me stop pandemics,Larry Brilliant,25:50,"TED Prize,collaboration,disease,ebola,global issues,health,science,technology"
"
","
","
","
",My wish: Help me stop pandemics,Larry Brilliant,25:50,"TED Prize,collaboration,disease,ebola,global issues,health,science,technology"
"
											(Aplausos)
									","
											(Alkışlar)
									","
											(Applaudissements)
									","
											(Applaus)
									",My wish: Help me stop pandemics,Larry Brilliant,25:50,"TED Prize,collaboration,disease,ebola,global issues,health,science,technology"
"
","
","
","
",My wish: Help me stop pandemics,Larry Brilliant,25:50,"TED Prize,collaboration,disease,ebola,global issues,health,science,technology"
