es,pt,tr,en,fr,title,speaker,duration,tags
"
											Y así, la verdadera pregunta es, 
¿cuál es el desafío?
											Bien, en parte por supuesto es el 
K-12 [educación básica].
											Tenemos que fortalecer el K-12.
											Pero por otra parte tiene 
que ver con la cultura
											en ciencias e ingeniería 
en nuestros campus.
											Por si no lo saben, un elevado número 
de alumnos con altos SATs
											y un gran número con créditos A.P.
											que concurren a las universidades 
más prestigiosas de nuestro país
											empiezan en pre-medicina, pre-ingeniería o 
ingeniería, y luego cambian sus especialidades.
											Y la principal razón que hallamos
											es que no tuvieron éxito en el primer 
año de los cursos de ciencias.
											De hecho, a los cursos de ciencias e ingeniería 
de primer año, en EE. UU., los llamamos
											cursos eliminadores o cursos barrera.
									","
											Então, a questão central é: 
""Qual é o desafio?""
											Uma parte dele, claro, é o ensino básico.
											Temos de melhorar o ensino básico.
											Mas a outra parte tem a ver
											com a cultura de ciências e engenharias 
nos nossos espaços universitários.
											Saibam ou não, grande parte dos estudantes
com altas médias de exame
											e bons currículos pré-universitários,
											que vão para as mais prestigiadas 
universidades nacionais,
											começam em pré-medicina ou pré-engenharia 
e engenharia, e acabam por mudar de curso.
											Achamos que a principal razão
											é que não vingaram no primeiro ano 
dos seus cursos científicos.
											Chamamos ao primeiro ano em
Ciência e Engenharia, em toda a América,
											provas de eliminação 
ou provas de obstáculos.
									","
											Peki sorulması gereken soru, zor olan kısım ne?
											Bunun bir parçası, tabi ki, K-12.
											K-12'yi güçlendirmeliyiz.
											Fakat diğer kısım da kampüslerimizdeki bilim
											ve mühendislik kültürüyle yakından ilgili.
											Bilmem biliyor musunuz, yüksek SAT puanı ve
											yüksek A.P. puanı alan ve ülkemizin en prestijli
											üniversitelerine kayıt hakkı kazanan birçok öğrenci
											tıp hazırlık, mühendislik hazırlık veya mühendislik bölümlerine başlayıp, sonradan alan değiştiriyor.
											Ve bulduğumuz sebeplerden en büyük olanı, açıkçası,
											ilk yıllarında aldıkları bilim derslerinde başarısız olmalarıdır.
											Aslında Amerika'da genel olarak ilk yılda alınan bilim ve mühendislik derslerini
											eleme veya bariyer dersleri olarak nitelendiririz.
									","
											And so, the real question is, what is the challenge?
											Well a part of it, of course, is K-12.
											We need to strengthen K-12.
											But the other part has to do with the culture
											of science and engineering on our campuses.
											Whether you know it or not, large numbers of students with high SAT's
											and large numbers of A.P. credits
											who go to the most prestigious universities in our country
											begin in pre-med or pre-engineering and engineering, and they end up changing their majors.
											And the number one reason, we find, quite frankly,
											is they did not do well in first year science courses.
											In fact, we call first year science and engineering, typically around America,
											weed-out courses or barrier courses.
									","
											Donc, la vraie question est : quel est le défi ?
											Et bien, une partie de ça, est bien sûr, 
la maternelle jusqu'au secondaire.
											Nous devons renforcer le pré-universitaire.
											Mais l'autre partie a à voir avec la culture
											des sciences et du génie sur nos campus.
											Que vous le sachiez ou non, 
un grand nombre d'étudiants avec de hauts résultats au Bac
											et un grand nombre de crédits de placement anticipé
											qui vont aux universités 
les plus prestigieuses de notre pays
											commencent leur première année de médecine ou d'ingéniérie et finissent par changer de programme.
											La raison numéro un, que nous avons trouvé, 
nous le pensons franchement,
											est qu'ils n'ont pas bien réussi en cours 
de science de première année.
											En fait, la première année en sciences et ingénierie, généralement en Amérique, est appelée
											cours de désherbage ou cours barrières.
									",4 pillars of college success in science,Freeman Hrabowski,15:10,"education,inequality,math,science,technology,psychology,history,race,engineering,curiosity,community,medical research,social change"
"
","
","
","
","
",4 pillars of college success in science,Freeman Hrabowski,15:10,"education,inequality,math,science,technology,psychology,history,race,engineering,curiosity,community,medical research,social change"
"
											¿Cuántos de Uds. conocen a alguien
											que habiendo comenzado 
en pre-medicina o ingeniería
											haya cambiado la especialidad 
en el término de 1 o 2 años?
											Es un desafío americano. 
La mitad de Uds. en esta sala.
											Lo sé. Lo sé. Lo sé.
											Y lo que es interesante de esto
											es que hay muchos estudiantes 
que son inteligentes y pueden hacerlo.
											Tenemos que encontrar 
la manera de hacer que suceda.
									","
											Quem, nesta plateia, conhece alguém
											que começou em Medicina ou Engenharia
											e mudou de curso nos primeiros anos?
											É um problema americano. Metade de vocês.
											Eu sei. Eu sei. Eu sei.
											O que é interessante nisto
											é que muitos estudantes 
são inteligentes e conseguem-no.
											Temos de encontrar formas 
de fazer isto acontecer.
									","
											İçinizden kaç kişi tıp veya mühendislik hazırlıkla başlayıp
											bir veya iki yıl içerisinde
											uzmanlık alanını değiştiren birini tanıyor?
											Bu Amerika'nın bir gerçeği. Salonun yarısı tanıyor.
											Biliyorum. Biliyorum. Biliyorum.
											Ve ilginç olan şu ki
											birçok öğrenci zeki ve bunu başarabilir.
											Gerçekleştirmenin yollarını bulmalıyız.
									","
											How many of you in this audience know somebody
											who started off in pre-med or engineering
											and changed their major within a year or two?
											It's an American challenge. Half of you in the room.
											I know. I know. I know.
											And what is interesting about that
											is that so many students are smart and can do it.
											We need to find ways of making it happen.
									","
											Combien d'entre vous dans cet auditoire connait quelqu'un
											qui a débuté ses cours préparatifs
											et a changé de domaine en un an ou 2 ?
											C'est un défi américain. La moitié d'entre vous dans la salle.
											Je sais. Je sais. Je sais.
											Et ce qui est intéressant à ce sujet
											c'est que tant d'élèves sont intelligents 
et ils peuvent le faire.
											Nous devons trouver des moyens pour que ça se produise.
									",4 pillars of college success in science,Freeman Hrabowski,15:10,"education,inequality,math,science,technology,psychology,history,race,engineering,curiosity,community,medical research,social change"
"
","
","
","
","
",4 pillars of college success in science,Freeman Hrabowski,15:10,"education,inequality,math,science,technology,psychology,history,race,engineering,curiosity,community,medical research,social change"
"
											¿Cuáles son las cuatro cosas que hicimos 
para ayudar a los estudiantes de minorías
											que ahora les sirven a 
los estudiantes en general?
											Número uno: altas expectativas.
											Se necesita una comprensión de la 
preparación académica de los estudiantes,
											sus calificaciones, 
el rigor del trabajo del curso,
											sus habilidades en 
la toma de pruebas, su actitud,
											el fuego en su vientre, la pasión 
por el trabajo, para realizarlo.
											Es importante hacer cosas que ayuden a 
los estudiantes a prepararse en esa posición.
											Pero igualmente importante, se necesita entender 
que es un trabajo difícil que marca la diferencia.
											No me importa lo inteligente que eres 
o lo inteligente que crees que eres.
											Inteligente, simplemente significa 
que estás listo para aprender.
											Estás emocionado por aprender y 
quieres hacer buenas preguntas.
									","
											Fizemos quatro coisas para ajudar 
as minorias estudantis,
											que agora ajudam
os estudantes em geral.
											Número um: altas expectativas.
											É necessário compreender 
a preparação académica de estudantes
											— as suas notas, 
o rigor do seu trabalho de curso,
											as suas competências 
em testes, a sua atitude,
											o fogo no seu âmago, 
a paixão pelo trabalho, para consegui-lo.
											Fazer coisas para ajudar os estudantes
											a preparar-se para estarem 
nessa posição é muito importante.
											Mas igualmente importante
											é compreender que é o trabalho árduo
que faz a diferença.
											Não interessa se és inteligente 
ou se pensas que és inteligente.
											Inteligência significa apenas 
que estás pronto para aprender.
											Estás entusiasmado por aprender 
e colocar boas questões.
									","
											Peki azınlıktaki öğrencilere ve şu an öğrencilerin geneline
											yardımcı olmak için yarattığımız dört unsur nedir?
											Bir numara: yüksek beklentiler
											Bunu başarmak için öğrencilerin akademik hazırlanma anlayışı —
											notları, ödevlerin güçlüğü,
											test yetenekleri, tutumları,
											başarma istekleri, işe yönelik tutkuları oldukça önemli.
											Ve öğrencilere bu konuma gelmeleri için el uzatmak büyük önem taşıyor.
											Fakat aynı şekilde önemli olan bir başka şey de farkı yaratanın sıkı çalışma olduğu gerçeği.
											Ne kadar zeki olduğunuz veya ne kadar zeki olduğunuzu düşündüğünüz önemli değil.
											Zeki olmanız, basitçe, öğrenmeye hazır olmanız demektir.
											Öğrenmeye heveslisiniz ve güzel sorular sormak istiyorsunuz.
									","
											So what are the four things we did to help minority students
											that now are helping students in general?
											Number one: high expectations.
											It takes an understanding of the academic preparation of students —
											their grades, the rigor of the course work,
											their test-taking skills, their attitude,
											the fire in their belly, the passion for the work, to make it.
											And so doing things to help students prepare to be in that position, very important.
											But equally important, it takes an understanding that it's hard work that makes the difference.
											I don't care how smart you are or how smart you think you are.
											Smart simply means you're ready to learn.
											You're excited about learning and you want to ask good questions.
									","
											Quelles sont donc les quatre choses que nous avons fait pour aider les élèves de la minorité
											qui maintenant aident les étudiants en général ?
											Numéro un : des attentes élevées.
											Il faut comprendre la préparation 
académique des étudiants:
											leurs notes, la rigueur de la charge du cours,
											leurs compétences en examens, leur attitude,
											le feu dans leurs yeux, la passion pour le travail, 
pour le réaliser.
											Donc faire des choses qui préparent les étudiants à ces situations, est très important.
											Mais tout aussi important, il faut comprendre que c'est le fait de travailler dur qui fait la différence.
											Je me fous à quel point vous êtes brillants 
ou que vous penser l'être.
											Être brillant veut seulement dire 
que vous êtes prêts à apprendre.
											Vous êtes excité au sujet de l'apprentissage 
et vous voulez poser les bonnes questions.
									",4 pillars of college success in science,Freeman Hrabowski,15:10,"education,inequality,math,science,technology,psychology,history,race,engineering,curiosity,community,medical research,social change"
"
","
","
","
","
",4 pillars of college success in science,Freeman Hrabowski,15:10,"education,inequality,math,science,technology,psychology,history,race,engineering,curiosity,community,medical research,social change"
"
											I. I. Rabi, premio Nobel, dijo que 
cuando él era niño, en Nueva York,
											los padres de sus amigos 
les preguntaban:
											""¿Qué aprendiste hoy en la escuela?""
											En cambio, su madre judía decía:
											""Izzy, ¿hiciste una buena pregunta hoy?""
											Entonces las altas expectativas 
tienen que ver con la curiosidad
											y alentar a los jóvenes a ser curiosos.
											Y como resultado de 
las altas expectativas,
											empezamos a encontrar estudiantes 
con los que queríamos trabajar
											para ver qué podíamos 
hacer para ayudarlos,
											no simplemente para sobrevivir 
en ciencias e ingeniería,
											sino para convertirse en 
lo mejor, para sobresalir.
									","
											I. I. Rabi, um Nobel, disse que, 
enquanto crescia em Nova Iorque,
											todos os pais dos seus amigos 
lhes perguntavam:
											""O que aprendeste na escola?"" 
no fim do dia.
											Ele disse que a sua mãe judia, 
pelo contrário, lhe perguntava:
											""Izzy, colocaste hoje alguma boa questão?""
											Então, altas expectativas 
têm a ver com curiosidade
											e encorajar os jovens a ser curiosos.
											Como resultado
destas altas expectativas,
											começámos a procurar estudantes 
com quem queríamos trabalhar
											para ver como os poderíamos ajudar,
											não apenas a sobreviver 
em Ciência e Engenharia,
											mas a tornar-se os melhores, 
a serem excelentes.
									","
											Nobel sahibi I.I. Rabi, New York'ta büyürken arkadaşlarının anne babalarının
											onlara günün sonunda
											""Okulda ne öğrendiniz?"" sorusunu yönelttiğini söyledi.
											Ve bu sorunun aksine Musevi olan annesinin kendisine
											""Izzy, bugün güzel bir soru sordun mu?"" diye sorduğunu anlattı.
											Yani yüksek beklentiler merak ve genç insanları
											meraklı olmaya itmekle ilgilidir.
											Ve bu büyük beklentilerin sonucu olarak,
											beraber çalışmak istediğimiz öğrencileri bulmaya başladık
											onlara nasıl yardım edebileceğimizi düşündük,
											sadece fen ve mühendislik derslerini geçmeleri için değil,
											en iyi olmaları, sivrilmeleri için.
									","
											I. I. Rabi, a Nobel laureate, said that when he was growing up in New York,
											all of his friends' parents would ask them
											""What did you learn in school?"" at the end of a day.
											And he said, in contrast, his Jewish mother would say,
											""Izzy, did you ask a good question today?""
											And so high expectations have to do with curiosity
											and encouraging young people to be curious.
											And as a result of those high expectations,
											we began to find students we wanted to work with
											to see what could we do to help them,
											not simply to survive in science and engineering,
											but to become the very best, to excel.
									","
											I. I. Rabi, un lauréat du prix Nobel, 
a dit que quand il a grandi à New York,
											tous les parents de ses amis leur demandaient
											« Qu'avez-vous appris à l'école? » à la fin d'une journée.
											Il a dit qu'en revanche, sa mère juive lui disait :
											« Izzy, as-tu posé une bonne question aujourd'hui ? »
											Donc des attentes élevées sont liées à la curiosité
											et au fait d'encourager les jeunes à être curieux.
											A la suite de ces attentes élevées,
											nous avons commencé à trouver 
des étudiants avec qui nous voulions travailler
											et voir ce que nous pourrions faire pour les aider,
											pas simplement pour survivre en science et en génie,
											mais pour devenir le meilleur, pour exceller.
									",4 pillars of college success in science,Freeman Hrabowski,15:10,"education,inequality,math,science,technology,psychology,history,race,engineering,curiosity,community,medical research,social change"
"
","
","
","
","
",4 pillars of college success in science,Freeman Hrabowski,15:10,"education,inequality,math,science,technology,psychology,history,race,engineering,curiosity,community,medical research,social change"
"
											Un ejemplo interesante:
											A un joven que obtuvo una C en el primer curso 
y que quería ingresar a la escuela de medicina,
											le dijimos: ""Queremos que 
vuelvas a tomar el curso,
											porque necesitas una base sólida 
para pasar al siguiente nivel"".
											Tener buenas bases es importante 
para afrontar el nivel siguiente.
											Volvió a tomar el curso.
											Ese joven se graduó en la UMBC,
											para convertirse en el primer negro en obtener el 
con posgrados de la Universidad de Pennsylvania.
											En la actualidad 
trabaja en Harvard.
											Linda historia. Aplaudámoslo también.
									","
											Curiosamente, um exemplo:
											A um jovem que teve Satisfaz 
na sua primeira cadeira
											e queria ir para Medicina, dissemos:
											""É preciso que repitas a cadeira,
											""porque precisas de alicerces fortes 
se vais passar ao nível superior.
											""Cada alicerce faz a diferença 
no nível superior"".
											Ele repetiu a cadeira.
											Esse jovem licenciou-se na UMBC.
											Foi o primeiro negro 
a conseguir licenciar-se
											em Medicina pela 
Universidade da Pensilvânia.
											Trabalha agora em Harvard.
											Bela história. 
Uma salva de palmas para ele.
									","
											Yeterince ilginç bir örnek var:
											İlk derste C alan ve tıp bölümüne başlamak isteyen genç bir adam vardı,
											ona, ""Dersi yeniden alman gerekiyor,
											çünkü sonraki seviyeye çıkacaksan sağlam temellere basmanı istiyoruz"" dedik.
											Her sağlam temel, sonraki seviyede fark yaratır.
											Dersi yeniden aldı.
											O genç adam UMBC'den mezun olup
											Pennsylvania Üniversitesi'nden doktora derecesi alan ilk siyahi insan oldu.
											Şu an Harvard'da çalışıyor.
											Güzel bir öykü. Bunun da hakkını verelim.
									","
											Interestingly enough, an example:
											One young man who earned a C in the first course and wanted to go on to med school,
											we said, ""We need to have you retake the course,
											because you need a strong foundation if you're going to move to the next level.""
											Every foundation makes the difference in the next level.
											He retook the course.
											That young man went on to graduate from UMBC,
											to become the first black to get the M.D./Ph.D. from the University of Pennsylvania.
											He now works at Harvard.
											Nice story. Give him a hand for that too.
									","
											Fait intéressant, un exemple :
											Un jeune homme a eu un C dans le premier cours 
et voulais aller en l'école de médecine,
											nous lui avons dit, « Nous devons 
vous demander de recommencer le cours
											parce que vous avez besoin de bases solides 
si vous voulez passer au niveau suivant. »
											Chaque base fait la différence 
dans le niveau suivant.
											Il reprit le cours.
											Ce jeune homme a été diplômé de UMBC
											pour devenir le premier noir à obtenir le doctorat 
de médecine à l'Université de Pennsylvanie.
											Il travaille actuellement à l'Université Harvard.
											Belle histoire. Il mérite bien 
des applaudissements pour ça.
									",4 pillars of college success in science,Freeman Hrabowski,15:10,"education,inequality,math,science,technology,psychology,history,race,engineering,curiosity,community,medical research,social change"
"
","
","
","
","
",4 pillars of college success in science,Freeman Hrabowski,15:10,"education,inequality,math,science,technology,psychology,history,race,engineering,curiosity,community,medical research,social change"
"
											(Aplausos)
									","
											(Aplausos)
									","
											(Alkışlar)
									","
											(Applause)
									","
											(Applaudissements)
									",4 pillars of college success in science,Freeman Hrabowski,15:10,"education,inequality,math,science,technology,psychology,history,race,engineering,curiosity,community,medical research,social change"
"
","
","
","
","
",4 pillars of college success in science,Freeman Hrabowski,15:10,"education,inequality,math,science,technology,psychology,history,race,engineering,curiosity,community,medical research,social change"
"
											En segundo lugar, no se trata solo 
de los resultados en las pruebas.
											Los resultados de los exámenes importan, 
pero no es lo más importante.
											Una joven tenía buenas notas, pero 
el puntaje de las pruebas no era tan alto.
											Pero había un factor 
que es muy importante.
											Ella nunca perdió 
un día de escuela K-12.
											Había fuego en su vientre.
											Esa joven continuó, y actualmente 
es tiene posgrados de Hopkins.
											Es profesora titular en psiquiatría 
con doctorado en neurociencia.
											Ella y su asesor tienen una patente sobre 
otro uso de Viagra para pacientes con diabetes.
											Gran aplauso para ella. 
Gran aplauso para ella.
											(Aplausos)
											Entonces grandes expectativas, 
muy importante.
									","
											Segundo, não é apenas 
acerca das classificações.
											As notas são importantes, 
mas não o mais importante.
											Uma jovem teve altas classificações,
mas nos testes não tinha notas tão altas.
											Mas tinha um factor muito importante.
											Nunca faltou a um dia de aulas
no ensino básico.
											Havia fogo no seu âmago.
											Essa jovem continuou e hoje
é licenciada em Medicina pela Hopkins.
											Está na faculdade, 
com cargo provisório em psiquiatria
											e doutoramento em neurociência.
											Ela e o seu orientador
detêm uma patente.
											num uso secundário do Viagra 
para doentes diabéticos.
											Um grande aplauso para ela. 
Palmas para ela.
											(Aplausos)
											Altas expectativas, é muito importante.
									","
											İkincisi, konu sadece sınav puanı değil.
											Sınav puanları önemli, fakat en önemli konu değil.
											Genç bir kadının çok güzel notları vardı, fakat sınav puanları o kadar yüksek değildi.
											Fakat oldukça önemli bir etmeni vardı.
											Okula yani K-12'ye bir gün bile gitmemezlik yapmadı.
											Bu kadın hevesle doluydu.
											Bu kadın eğitimine devam etti ve bugün Hopkins'ten doktora derecesine sahip.
											Fakültede psikiyatri bölümünde daimi kadrolu çalışıyor, sinirbilim alanında doktora sahibi.
											O ve danışman hocasının diyabet hastaları üzerinde Viagra'nın ikincil kullanımına dair patenti var.
											Ona büyük bir alkış. Büyük alkış.
											(Alkışlar)
											Yani büyük beklentiler, çok önemli.
									","
											Secondly, it's not about test scores only.
											Test scores are important, but they're not the most important thing.
											One young woman had great grades, but test scores were not as high.
											But she had a factor that was very important.
											She never missed a day of school, K-12.
											There was fire in that belly.
											That young woman went on, and she is today with an M.D./Ph.D. from Hopkins.
											She's on the faculty, tenure track in psychiatry, Ph.D. in neuroscience.
											She and her adviser have a patent on a second use of Viagra for diabetes patients.
											Big hand for her. Big hand for her.
											(Applause)
											And so high expectations, very important.
									","
											Deuxièmement, tout n'est pas seulement 
à propos des résultats.
											Les résultats sont importants, mais ils ne sont pas la chose la plus importante.
											Une jeune femme avait de très bonnes 
connaissances, mais ses résultats 
n'étaient pas aussi élevés.
											Mais il y avait un facteur très important.
											Elle n'a jamais manqué un jour d'école, 
de la maternelle à la terminale.
											Il y avait le feu dans ses yeux.
											Cette jeune femme a continué et elle a maintenant 
un doctorat de médecine de l'Université Hopkins.
											Elle est à la faculté, en pré-titularisation en psychiatrie, doctorat en neurosciences.
											Elle et son conseiller ont un brevet sur une deuxième utilisation du Viagra pour les patients diabétiques.
											Des applaudissements pour elle. 
Des applaudissements pour elle.
											(Applaudissements)
											Donc de grandes attentes, c'est très important.
									",4 pillars of college success in science,Freeman Hrabowski,15:10,"education,inequality,math,science,technology,psychology,history,race,engineering,curiosity,community,medical research,social change"
