en,es,pt,tr,fr,de,title,speaker,duration,tags
"
											David Milch, creator of ""Deadwood"" and other amazing TV shows,
											has a really good description for this.
											He swore off creating
											contemporary drama,
											shows set in the present day,
											because he saw that when people fill their mind
											with four hours a day of, for example, ""Two and a Half Men,"" no disrespect,
											it shapes the neural pathways, he said,
											in such a way that they expect simple problems.
											He called it, ""an impatience with irresolution.""
											You're impatient with things that don't resolve quickly.
											You expect sitcom-sized problems that wrap up in 22 minutes,
											three commercial breaks and a laugh track.
											And I'll put it to all of you,
											what you already know, that no problem worth solving is that simple.
											I am very concerned about this
											because I'm going to retire in a world that my students will run.
											I'm doing bad things
											to my own future and well-being
											when I teach this way.
											I'm here to tell you that the way our textbooks — particularly
											mass-adopted textbooks — teach math reasoning
											and patient problem solving,
											it's functionally equivalent to turning on ""Two and a Half Men"" and calling it a day.
									","
											David Milch, creador de varias series de televisión fascinantes,
											tiene una excelente descripción para este caso.
											David renunció a crear
											dramas contemporáneos,
											tramas que se lleven a cabo en la actualidad,
											porque ha visto que, cuando la gente llena su mente
											con dos horas diarias de, por ejemplo, ""Dos hombres y medio"", sin ofender,
											esto moldea las conexiones neuronales, él dice,
											de manera que la gente espera problemas sencillos.
											Él le llama, ""una impaciencia ante la irresolución"".
											Nos ponemos impacientes con cosas que no se resuelven rápido.
											Esperamos problemas del tamaño de los programas se resulevan en 22 minutos,
											con tres cortes comerciales y risas de fondo.
											Mi comentario para ustedes es que,
											todos ustedes saben, que ningún problema que valga la penar resolver es así de simple.
											Estoy muy preocupados por esto,
											porque voy a retirarme en un mundo que mis estudiantes dirigirán.
											Estoy atentando contra
											mi propio futuro y bienestar
											cuando enseño de esta manera.
											Estoy aquí para decirles que la manera en la los libros, particularmente
											los que adopta la mayoría de las escuelas, enseñan razonamiento matemático
											y resolución de problemas
											es el equivalente funcional de ver ""Dos hombres y medio"" y dar por finalizada la jornada.
									","
											David Milch, criador da série ""Deadwood"" e de outras séries de TV fantásticas,
											tem uma descrição muito boa para isto.
											Ele jurou que ia criar
											séries de drama contemporâneo
											adaptadas aos dias de hoje,
											porque viu que quando as pessoas enchem as suas cabeças
											com quatro horas por dia de, por exemplo, ""Two and a Half Men"", sem ofensas,
											isso molda as activações neuronais, segundo ele,
											de uma forma em que as pessoas esperam problemas fáceis.
											Ele chamou a isto: ""uma impaciência com a irresolução"".
											Somos impacientes com coisas que não se resolvem rapidamente.
											Estamos à espera de problemas com a duração das séries de 22 minutos,
											três anúncios comerciais e um padrão de gargalhadas.
											E vou confrontar-vos com aquilo que todos já sabem:
											nenhum problema que valha a pena resolver é tão simples.
											Estou muito preocupado com isto,
											porque vou reformar-me num mundo que vai ser gerido pelos meus alunos.
											Estou a prejudicar
											o meu próprio futuro e bem-estar
											quando ensino desta forma.
											Estou aqui para dizer-vos que o modo como os manuais, em particular,
											os manuais adoptados em massa, ensinam o raciocínio matemático
											e a resolução de problemas de forma paciente,
											é equivalente, em termos práticos, a ficar a ver ""Two and a Half Men"" e ficar por aí.
									","
											""Deadwood"" ve benzeri TV programlarının yaratıcısı, David Milch'in
											bu konuda güzel bir açıklaması var.
											Çağdaş dramı,
											günümüz şovlarını,
											bırakacağına yemin etti,
											çünkü fark etti ki insanlar günde dört saat boyunca
											kafalarını ""Two and a Half Men""le doldurunca, aşağılamıyoum, sadece örnek,
											bu onların sinir ağları yapısını değiştiriyor,
											ve hep basit sorunlar beklemelerine sebep oluyor diyor.
											O buna ""belirsizliğe karşı sabırsızlık"" diyor.
											Hemen çözülmeyen şeylere karşı sabırsızsınız.
											22 dakikalık sitcom dizileri, üç reklam arası ve bir kahkaha sesiyle
											olup biten sorunlar bekliyorsunuz.
											Ve lafım hepinize,
											ki zaten biliyorsunuz, çözülmeye değer hiçbir problem bu kadar basit değildir.
											Bu konuda çok endişeliyim,
											çünkü benim emekli olduğum bir dünyayı öğrencilerim yönetecek.
											Bu şekilde öğretince
											kendi geleceğim ve sağlığım adına
											kötü şeyler yapıyorum.
											Burada size anlatacağım şey, ders kitaplarının, özellikle de,
											herkesçe kabul gören ders kitaplarının matematiksel muhakemeyi
											ve sabırlı problem çözmeyi nasıl öğrettiğidir,
											yaptıkları şey ""Two and a Half Men""i açmak ve bugün dersimiz bu demekten ibaret.
									","
											David Milch, créateur de ""Deadwood"" et d'autres très bonnes séries,
											a une très bonne description du phénomène.
											Il a renoncé à créer
											des drames contemporains,
											des séries se passant de nos jours,
											parce qu'il a constaté que, quand les gens
											regardent 4 heures par jour une série comme ""Mon oncle Charlie"", sans mépris de ma part,
											leur manière de réfléchir est câblée, dit-il,
											de manière à ne s'attendre qu'à des problèmes simples.
											Il appelle cela ""une impatience face à la complexité"".
											Vous êtes impatient face à ce qui ne se résout pas rapidement.
											Vous vous attendez à des problèmes de sitcom qui se résolvent en 22 minutes,
											trois coupures publicitaires et des rires enregistrés.
											Je le dirai à vous tous,
											qui le savez déjà, aucun problème digne d'être résolu n'est aussi simple.
											Je suis très préoccupé par ceci,
											car je serai retraité dans un monde que mes étudiants vont diriger.
											Je dégrade
											mon futur et mon bien-être
											en enseignant de cette manière.
											Je suis içi pour vous dire que la manière dont nos livres d'école, surtout
											les livres largement diffusés, enseignent le raisonnement mathématique
											et la résolution de problèmes,
											c'est, en gros, équivalent à regarder ""Mon oncle Charlie"", point final.
									","
											David Milch, der Macher von ""Deadwood"" und anderen erstaunlichen
											TV Sendungen, hat dafür eine recht gute Beschreibung.
											Er schwor dem zeitgenössischen
											Drama ab,
											Shows, die in der Gegenwart spielen,
											denn er sah, dass wenn Leute ihren Kopf täglich
											vier Stunden mit z.B. ""Mein cooler Onkel Charlie"" füllen, bei allem Respekt,
											es formt ihre Nervenbahnen solchermaßen,
											so sagt er, sodass sie leichte Probleme erwarten.
											Er nannte es ""Ungeduldigkeit mit Unschlüssigkeit"".
											Sie sind ungeduldig mit Dingen, die sich nicht schnell klären.
											Sie erwarten Sitcom-große Probleme die in 22 Minuten,
											drei Werbepausen und einer Lachkonserve zum Abschluss kommen.
											Un ich sage Ihnen, wie Sie bereits wissen,
											dass kein lösenswertes Problem so einfach ist.
											Ich bin sehr besorgt darüber,
											denn ich werde in einer Welt in Rente gehen, die meine Schüler leiten werden.
											Ich tue etwas schlechtes
											für mein eigenes zukünftiges Wohl
											wenn ich in dieser Weise lehre.
											Ich bin hier um Ihnen zu sagen, dass die Art wie unsere Textbücher,
											insbesondere Massen-adaptierte Textbücher, mathematisches Denken
											und geduldiges Problemlösen lehren,
											praktisch so ist, wie das Einschalten von ""Mein cooler Onkel Charlie"" und Feierabend zu machen.
									",Math class needs a makeover,Dan Meyer,11:39,"TEDx,children,education,math,teaching"
"
","
","
","
","
","
",Math class needs a makeover,Dan Meyer,11:39,"TEDx,children,education,math,teaching"
"
											(Laughter)
									","
											(Risas)
									","
											(Risos)
									","
											(Gülüşmeler)
									","
											(Rires)
									","
											(Gelächter)
									",Math class needs a makeover,Dan Meyer,11:39,"TEDx,children,education,math,teaching"
"
","
","
","
","
","
",Math class needs a makeover,Dan Meyer,11:39,"TEDx,children,education,math,teaching"
"
											In all seriousness. Here's an example from a physics textbook.
											It applies equally to math.
											Notice, first of all here,
											that you have exactly three pieces of information there,
											each of which will figure into a formula
											somewhere, eventually,
											which the student will then compute.
											I believe in real life.
											And ask yourself, what problem have you solved, ever,
											that was worth solving
											where you knew all of the given information in advance;
											where you didn't have a surplus of information and you had to filter it out,
											or you didn't have sufficient information
											and had to go find some.
											I'm sure we all agree that no problem worth solving is like that.
											And the textbook, I think, knows how it's hamstringing students
											because, watch this, this is the practice problem set.
											When it comes time to do the actual problem set,
											we have problems like this right here
											where we're just swapping out numbers and tweaking the context a little bit.
											And if the student still doesn't recognize the stamp this was molded from,
											it helpfully explains to you
											what sample problem you can return to to find the formula.
											You could literally, I mean this,
											pass this particular unit without knowing any physics,
											just knowing how to decode a textbook. That's a shame.
									","
											Ya hablando en serio, este es un ejemplo de un libro de física.
											Y se aplica de igual manera a los de matemáticas.
											Vean primero aquí
											que tienen exactamente tres piezas de información,
											cada una de las cuales irá en una fórmula
											en alguna parte, eventualmente,
											que el estudiante terminará calculando.
											Creo en la Vida Real.
											Pregúntense ustedes mismos, qué problema han resuelto, alguna vez,
											que fuera importante resolver,
											y que tuvieran toda la información anticipadamente,
											o que no tuvieran muchísima información, y que tuvieran que filtrarla,
											o que no tuvieran suficiente información,
											y tuvieran que conseguir alguna.
											Estoy seguro de que estarán de acuerdo en que ningún problema importante es como este.
											Y el libro, yo creo, sabe como atontar a los estudiantes.
											Porque, vean esto, este es el juego de problemas de práctica.
											Cuando llega la hora de hacer los verdaderos juegos de problemas,
											tenemos problemas como este aquí
											donde simplemente intercambiamos los números y modificamos un poco el contexto.
											Y si el alumno todavía no reconoce el molde del problema,
											siempre puede ayudar
											que le digan en qué ejemplo puede encontrar la fórmula.
											Podrían literalmente, y lo digo sinceramente,
											pasar esta unidad en particular sin saber nada de física,
											simplemente sabiendo como entenderle al libro. Esto es una pena.
									","
											A sério, aqui temos um exemplo de um manual escolar de física.
											O mesmo se passa com os de matemática.
											Reparem primeiro que
											o problema tem três dados no enunciado,
											cada um dos quais vai ser usado numa fórmula
											algures, eventualmente,
											que o aluno vai então calcular.
											Eu acredito na vida real.
											Perguntem a vocês próprios que problema alguma vez resolveram,
											que tenha valido a pena,
											onde tivessem todos os dados à priori;
											ou onde não tivessem informação a mais e a tivessem que filtrar,
											ou onde não tivessem informação suficiente
											e tivessem que descobrir alguma.
											Estou certo que todos concordam que nenhum problema desses é assim.
											E o manual, sabe que está a levar os alunos ao colo,
											porque, vejam isto, este é o exercício de treino.
											Quando chega a hora resolver o verdadeiro problema proposto,
											temos problemas como este mesmo aqui
											onde apenas trocámos uns números e alterámos um pouco o contexto.
											E se o aluno mesmo assim não reconhecer as semelhanças,
											o livro diz-nos a que
											problema exemplo se pode recorrer para descobrir a fórmula.
											Sendo assim, podia-se perfeitamente
											passar nesta lição sem saber nada de física,
											basta saber descodificar o manual. É uma vergonha.
									","
											Şaka bir yana, burada bir fizik ders kitabından bir örnek var.
											Aynısı matematik için geçerli.
											Dikkatinizi çekerim
											burada tam olarak üç adet veri var elinizde,
											herbiri eninde sonunda bir formülün
											bir yerine konulacak,
											ve ardından öğrenci bunu hesaplayacak.
											Ben gerçek hayata inanırım.
											Ve kendinize sorun, hiç çözmeye değer bir sorunu
											çözdüğünüzde,
											lazım olan tüm bilgilerin önceden size verildiği,
											veya bilgi fazlalığı olmadığı için süzüp ayırmanızın gerekmediği,
											veya elinizde yeterli bilgi olduğu için bir yerden
											bulmanız gerekmediği oldu mu?
											Hepimiz böyle bir sorunun çözmeye değer olmadığı konusunda hemfikiriz.
											Ve bence, ders kitabı öğrencileri nasıl sakat bıraktığının farkında.
											Çünkü, şuna bakın, bu çalışma kitabı seti.
											Söz konusu gerçek problem seti olunca,
											burada bunun gibi problemler var
											orada da sadece numaraları ve bağlamı değiştiyoruz.
											Ve öğrenci halen bu sorunun benzerini çözdüğünü hatırlayamazsa,
											hangi örnek soruya bakıp
											formülü bulabileceğini yardımcı bir şekilde anlatıyor.
											Demek istediğim, bu konuyu
											hiç fizik bilmeden sadece kitabın yönlendirmesiyle
											bile geçersiniz. Bu bir ayıptır.
									","
											Sérieusement, voici un exemple de livre de physique.
											Cela s'applique également aux maths.
											Remarquez d'abord ici
											que l'on donne exactement trois renseignements, içi,
											chacun servant dans une formule,
											à un moment ou un autre,
											que l'étudiant pourra ensuite calculer.
											Je crois en la réalité.
											Demandez-vous quel est le problème que vous ayez jamais
											résolu, qui ait été utile,
											dont vous connaissiez toutes les composantes à l'avance,
											ou sans information inutile que vous ayez dû éliminer,
											ou pour lequel il vous manquait des hypothèses,
											que vous avez dû aller chercher.
											Je suis sûr que nous sommes d'accord qu'aucun problème n'est ainsi.
											Et le livre, je pense, sait comment il paralyse les étudiants.
											Parce que — regardez ceci — voici l'ensemble du problème.
											Quand il s'agit de résoudre effectivement le problème,
											ils ont des soucis comme celui-ci
											juste en intervertissant les nombres et en déformant un peu le contexte.
											Si l'étudiant n'arrive toujours pas à reconnaître le modèle qui a servi,
											le livre lui explique gentiment
											quel problème modèle il doit consulter pour trouver la formule.
											Vous pouvez littéralement, je le pense vraiment,
											réussir cet examen sans connaître la physique,
											juste en sachant décoder le livre. C'est une honte.
									","
											Bei allem Ernst, hier ist ein Beispiel von einem Physik Textbuch.
											Es gilt gleichermaßen für Mathematik.
											Beachten Sie vor allem, dass Sie hier
											genau drei Informationen haben,
											von denen jede eine Formel formen wird,
											irgendwo, letzendlich,
											welche die Schüler dann berechnen werden.
											Ich glaube an das wirkliche Leben.
											Fragen Sie sich, welches Problem Sie je gelöst haben,
											das es Wert war, gelöst zu werden,
											wo Sie alle gegebenen Informationen im Vorhinein wussten,
											oder wo Sie keinen Überschuss an Information hatten und es herausfiltern mussten,
											oder wo Sie nicht genügend Daten hatten
											und diese erst finden mussten.
											Ich bin sicher wir sind uns einig, dass es für kein lösenswertes Problem so ist.
											Und ich denke das Textbuch weiss, wie es Schüler lähmt.
											Denn sehen Sie her, das ist eine Reihe von Übungsaufgaben.
											Wenn es Zeit ist, die eigentlichen Aufgaben zu lösen,
											haben wir Aufgaben wie diese hier,
											wo wir einfach die Zahlen austauschen und den Kontext etwas justieren.
											Und wenn der Schüler noch immer nicht erkennt, von welchem Stempel es gestanzt wurde,
											erklärt es Ihnen hilfreicherweise
											zu welcher Beispielaufgabe Sie sich für die Formel wenden können.
											Sie könnten buchstäblich, und ich meine das,
											diese Einheit ohne jegliche Physikkenntnis absolvieren,
											wenn Sie nur wissen, wie man ein Textbuch dekodiert. Das ist eine Schande.
									",Math class needs a makeover,Dan Meyer,11:39,"TEDx,children,education,math,teaching"
"
","
","
","
","
","
",Math class needs a makeover,Dan Meyer,11:39,"TEDx,children,education,math,teaching"
"
											So I can diagnose the problem a little more specifically in math.
											Here's a really cool problem. I like this.
											It's about defining steepness and slope
											using a ski lift.
											But what you have here is actually four separate layers,
											and I'm curious which of you can see the four separate layers
											and, particularly, how when they're compressed together
											and presented to the student all at once,
											how that creates this impatient problem solving.
											I'll define them here: You have the visual.
											You also have the mathematical structure,
											talking about grids, measurements, labels,
											points, axes, that sort of thing.
											You have substeps, which all lead to what we really want to talk about:
											which section is the steepest.
									","
											Así que puedo diagnosticar el problema un poco más específicamente en matemáticas.
											Este es un problema genial. Me gusta.
											Es acerca de definir la inclinación y la pendiente
											usando un teleférico para esquí.
											Pero lo que hay aquí son cuatro capas separadas.
											Y es muy interesante ver lo que hay en cada una de esas capas,
											particularmente cuando están todas juntas
											y se le presentan al estudiante al mismo tiempo,
											cómo esto crea la impaciencia para resolver problemas.
											Las voy a definir aquí. Tenemos la visual.
											También la estructura matemática,
											hablando acerca de mallas, mediciones, etiquetas,
											puntos, ejes y ese tipo de cosas.
											Tenemos sub-etapas, que nos llevan al punto del que queremos hablar,
											cuál sección es la más empinada.
									","
											Eu consigo diagnosticar o problema de forma mais específica na matemática.
											Aqui está um problema muito fixe. Gosto deste.
											É sobre definir inclinação e declive
											usando um teleférico.
											Mas, na verdade, o que temos aqui são quatro camadas distintas.
											E estou curioso sobre quem é que consegue ver as quatro camadas,
											em particular quando estão comprimidas
											e são apresentadas ao aluno todas de uma vez,
											como é que isso cria a resolução impaciente do problema.
											Vou defini-las aqui: Vocês têm a ilustração.
											Também têm a estrutura matemática,
											estou a falar das grelhas, medições, legendas,
											pontos, eixos, esse tipo de coisas.
											Temos os passos, que nos levam àquilo que se quer saber
											que é: que troço é o mais inclinado.
									","
											Sorunu matematikte biraz daha detaylı tespit edebilirim.
											Burada çok hoş bir soru var. Bunu seviyorum.
											Diklik ve eğimi bir
											teleferik yardımıyla tanımlıyor.
											Fakat aslında burada dört ayrı katman var.
											Hanginizin bu dört katmanı göreceğini merak ediyorum,
											özellikle de böyle birbiri içine girmiş ve öğrenciye
											tek seferde sunulmuşken bunun öğrenciyi nasıl
											sabırsızca problem çözmeye ittiğini görebilecek misiniz.
											Onları tanımlayacağım. Görseli görüyorsunuz.
											Ayrıca matematiksel yapı da var,
											Koordinat sistemi, ölçüler, etiketler,
											noktalar, eksenler ve benzeri.
											Ön adımlar hazır, bunlar bizi asıl konuşmak istediğimiz konuya götürüyor:
											hangi bölüm en diktir.
									","
											Je sais diagnostiquer le problème plus spécifiquement en maths.
											Voici un problème sympa. J'aime bien.
											Il s'agit de définir la pente
											en utilisant un téléski.
											Mais vous avez ici en fait quatre niveaux séparés.
											Je serais curieux de savoir qui voit les quatre niveaux,
											et, particulièrement, comment ils sont rassemblés
											et présentés à l'étudiant d'un seul coup,
											pour créer la résolution impatiente du problème.
											Je vais les définir. Voici le graphique.
											Voici aussi la structure mathématique,
											qui parle de grilles, de mesures, d'étiquettes,
											de points, d'axes, etc.
											Il y a des étapes, qui mènent toutes vers ce dont nous voulons parler,
											quelle section est la plus pentue.
									","
											In der Mathematik kann ich das Problem etwas gezielter diagnostizieren.
											Hier ist eine wirklich coole Aufgabe. Ich mag sie.
											Es geht um das Bestimmen von Steilheit und Steigung
											bei einem Skilift.
											Aber Sie haben hier eigentlich vier separate Ebenen.
											Ich bin gespannt, wer von Ihnen die ver Ebenen erkennen kann,
											und, insbesondere, wie sie das ungeduldige Problemlösen verursachen,
											wenn sie, zusammengepresst,
											auf einmal dem Schüler präsentiert werden.
											Ich werde sie hier definieren. Sie haben das Visuelle.
											Sie haben auch die mathematische Struktur,
											die von Rastern, Messungen, Beschriftungen,
											Punkten, Achsen usw. spricht.
											Sie haben Unterschritte, welche zu dem eigentlichen Thema führen,
											nämlich welcher Teil der steilste ist.
									",Math class needs a makeover,Dan Meyer,11:39,"TEDx,children,education,math,teaching"
"
","
","
","
","
","
",Math class needs a makeover,Dan Meyer,11:39,"TEDx,children,education,math,teaching"
