en,es,tr,fr,de,title,speaker,duration,tags
"
											We don't replace teachers, by the way.
											We believe that teachers should be empowered, not replaced.
									","
											No reemplazamos a los maestros, por cierto.
											Creemos en facultar a los maestros, no en reemplazarlos.
									","
											Bu arada öğretmenlerin yerine geçmiyoruz.
											Öğretmenlerin güçlendirilmesine
inanıyoruz, yerine geçilmesine değil.
									","
											Au fait, nous ne remplaçons pas les enseignants.
											Nous croyons que les enseignants devraient gagner en pouvoir, non pas être remplacés.
									","
											Wir wollen die Lehrer übrigens nicht ersetzen.
											Wir glauben, dass man die Lehrer ermutigen 
und nicht ersetzen sollte.
									",The self-organizing computer course,Shimon Schocken,16:25,"computers,education,open-source,technology,code"
"
","
","
","
","
",The self-organizing computer course,Shimon Schocken,16:25,"computers,education,open-source,technology,code"
"
											Moving along, what about the area of a triangle?
											So after some guided trial and error,
											the child will discover, with or without help,
											that he or she can duplicate the original figure
											and then take the result, transpose it,
											glue it to the original and then proceed [with] what we did before:
											cut, rearrange, paste — oops— paste and glue,
											and tile.
											Now this transformation has doubled the area
											of the original figure, and therefore we have just learned
											that the area of the triangle equals the area of this rectangle
											divided by two.
											But we discovered it by self-exploration.
									","
											Siguiendo, ¿qué pasa con el área del triángulo?
											Luego de un ensayo y error dirigido
											se descubre, con o sin ayuda,
											que se puede duplicar la figura original
											para luego transponerla,
											pegarla a la figura original y después proceder como hicimos antes:
											cortamos, reagrupamos, pegamos — uy— pegamos
											y cuadriculamos.
											Pero esta transformación ha duplicado el área
											de la figura original, y por lo tanto acabamos de aprender
											que el área del triángulo equivale al área de este rectángulo
											dividido por dos.
											Lo descubrimos mediante autoexploración.
									","
											Devam edersek, peki ya üçgenin alanı?
											Rehber eşliğindeki bazı
deneme yanılmalardan sonra,
											yardım alarak veya yardımsız,
çocuk şunu keşfedecek;
											asıl şekli kopyalayabilecek
											ve sonra çıktıyı alabilecek,
ters çevirebilecek,
											onu aslına yapıştırabilecek
ve sonra eskisi gibi ilerleyecek:
											Kes, tekrar düzenle, yapıştır, tuttur
											ve kapla.
											Bu dönüşüm asıl şeklin
alanını ikiye katladı
											ve dolayısıyla şunu öğrendik ki;
											üçgenin alanı, dikdörtgenin alanının
											ikiye bölünmesine denktir.
											Fakat biz bunu kendi başına
keşfetmeyle bulduk.
									","
											Continuons, que pouvons-nous dire de l'aire d'un triangle ?
											Après un peu d'apprentissage guidé par expérimentation,
											l'enfant va découvrir, avec ou sans aide,
											qu'il ou elle peut dupliquer la figure initiale,
											puis prendre le résultat, le transposer,
											le recoller sur l'original 
et ensuite refaire ce que nous avons fait auparavant:
											couper, réarranger, coller - oups - coller,
											et morceler.
											Cette transformation a doublé l'aire
											de la figure originelle, et donc nous venons d'apprendre
											que l'aire du triangle équivaut à celle de ce rectangle
											divisée par deux.
											Mais nous l'avons découvert par auto-exploration.
									","
											Was ist nun mit der Fläche eines Dreiecks?
											Also, nach etwas unterstütztem 
Versuch und Irrtum
											wird das Kind 
mit oder ohne Hilfe entdecken,
											dass es die ursprüngliche Figur 
duplizieren kann,
											diese Figur bewegen
											und an das Original kleben und 
dann fortfahren wie bisher:
											schneiden, verschieben, anfügen — 
uups — anfügen und kleben
											und in Kästchen aufteilen.
											Diese Veränderung hat nun 
den doppelten Flächeninhalt
											der Original-Figur und so 
haben wir gerade gelernt,
											dass die Fläche des Dreiecks gleich groß ist 
wie die Fläche dieses Rechtecks
											geteilt durch zwei.
											Aber wir haben es 
durch Selbsterfahrung entdeckt.
									",The self-organizing computer course,Shimon Schocken,16:25,"computers,education,open-source,technology,code"
"
","
","
","
","
",The self-organizing computer course,Shimon Schocken,16:25,"computers,education,open-source,technology,code"
"
											So, in addition to learning some useful geometry,
											the child has been exposed to some pretty sophisticated
											science strategies, like reduction,
											which is the art of
											transforming a complex problem into a simple one,
											or generalization, which is at the heart
											of any scientific discipline,
											or the fact that some properties are invariant
											under some transformations.
											And all this is something that a very young child
											can pick up using such mobile apps.
											So presently, we are doing the following:
											First of all, we are decomposing the K-12 math curriculum
											into numerous such apps.
											And because we cannot do it on our own,
											we've developed a very fancy authoring tool
											that any author, any parent or actually anyone
											who has an interest in math education,
											can use this authoring tool to develop similar apps
											on tablets without programming.
											And finally, we are putting together an adaptive ecosystem
											that will match different learners
											with different apps according to their evolving learning style.
									","
											Así, además de aprender algo útil de geometría
											se aprenden estrategias científicas bastante sofisticadas
											como la reducción
											que es el arte
											de transformar un problema complejo en uno simple,
											o la generalización que es el centro
											de cualquier disciplina científica,
											o el hecho de que algunas propiedades son invariables
											bajo ciertas transformaciones.
											Y todo esto es algo que los pequeños pueden
											aprender con sus aplicaciones móviles.
											Actualmente, hacemos lo siguiente.
											Primero, descomponemos el plan de estudios de matemática inicial y primaria
											en muchas de estas aplicaciones.
											Y, como no podemos hacerlo por nuestra cuenta,
											hemos desarrollado una herramienta muy elegante
											que cualquier autor, padre o, de hecho cualquier persona
											interesada en enseñar matemática,
											puede usar esta herramienta para desarrollar aplicaciones similares
											en tabletas, sin programación.
											Y, por último, estamos armando un ecosistema adaptativo
											que se ajustará a diferentes alumnos
											con aplicaciones diferentes de acuerdo a su evolución en el aprendizaje.
									","
											Bazı faydalı geometrileri
öğrenmenin yanında,
											çocuk bazı çok yönlü bilimsel
taktiklere de maruz kaldı,
											karmaşık problemleri
											basit bir tanesine dönüştürme sanatı olan
											indirgeme gibi
											veya herhangi bir bilimsel
öğretinin temelinde olan
											genelleştirme gibi
											veya bazı özelliklerin
bazı dönüşümler altında
											sabit olduğu gerçeği gibi.
											Bütün bunlar, bunun gibi
mobil uygulamaları kullanarak,
											küçük bir çocuğun kapabileceği şeyler.
											Şu anda, sıradakileri yapıyoruz:
											Öncelikle K-12 matematik müfredatını
											birçok uygulamaya ayrıştırıyoruz.
											Bunu kendi başımıza
yapamayacağımızdan dolayı,
											çok süslü bir yazarlık aracı geliştirdik.
											Herhangi bir yazar, ebeveyn
											ya da aslında matematik eğitimiyle
ilgilenen herhangi birisi,
											kodlama olmaksızın tabletler üzerinde
											benzer uygulamalar geliştirmek için
bu aracı kullanabilecek.
											Son olarak, farklı öğrenenlerle
gelişen öğrenme tarzlarına göre
											farklı uygulamaları eşleştirecek olan
											uyarlanabilen bir ekosistem oluşturuyoruz.
									","
											Ainsi, en plus d'apprendre des principes utiles de géométrie,
											l'enfant a été exposé à des stratégies scientifiques
											plutôt sophistiquées, comme la réduction,
											qui est l'art de
											transformer un problème complexe en un problème simple,
											ou la généralisation, qui est au coeur
											de toute discipline scientifique,
											ou encore le fait que quelques propriétés sont invariantes
											sous certaines transformations.
											Et tout ceci est quelque chose qu'un jeune enfant
											peut comprendre en utilisant de telles applications mobiles.
											Actuellement, nous faisons les choses suivantes:
											D'abord, nous décomposons le programme de math jusqu'au niveau lycée
											en de nombreuses applications comme celle-ci.
											Et comme nous ne pouvons le faire tout seuls,
											nous avons développé un très bel outil de création
											que n'importe quel auteur, n'importe quel parent, 
ou même quiconque
											intéressé par l'enseignement des mathématiques,
											puisse utiliser cet outil de création pour développer des applications similaires
											sur des tablettes sans devoir programmer.
											Et finalement, nous mettons en place un écosystème adaptatif
											qui s'harmonise aux différents apprenants
											avec différentes applications adaptées à l'évolution de leur style d'apprentissage.
									","
											Das Kind hat also nicht nur 
ein wenig sinnvolle Geometrie gelernt,
											sondern wurde auch mit 
einigen ziemlich anspruchsvollen
											wissenschaftlichen Strategien konfrontiert, 
wie die Reduzierung
											also die Kunst,
											eine komplizierte Aufgabe 
in eine einfachere umzuwandeln,
											oder die Generalisierung, 
die im Zentrum aller
											wissenschaftlichen Lehrfächer steht,
											oder die Tatsache, 
dass manche Eigenschaften
											nach bestimmten Veränderungen 
unverändert bleiben.
											Und all das kann ein kleines Kind
											mit einem solchen Mobile-App 
selbständig lernen,
											im Moment tun wir also folgendes:
											Zunächst teilen wir den Lehrplan
											in viele dieser Apps auf.
											Und da wir das nicht allein machen können,
											haben wir ein schickes 
Autorenwerkzeug entwickelt,
											das jeder Autor, also auch Eltern 
oder eigentlich jeder,
											der ein Interesse 
an der Mathematikausbildung hat,
											nutzen kann, um ähnliche Apps auf Tablet-PCs
											zu entwickeln, ohne zu programmieren.
											Und schließlich stellen wir 
ein sich anpassendes Ökosystem zusammen,
											das verschiedenen Lernenden
											je nach ihrem sich entwickelnden Lernstil 
verschiedene Apps zuordnet.
									",The self-organizing computer course,Shimon Schocken,16:25,"computers,education,open-source,technology,code"
"
","
","
","
","
",The self-organizing computer course,Shimon Schocken,16:25,"computers,education,open-source,technology,code"
"
											The driving force behind this project
											is my colleague Shmulik London,
											and, you see, just like
											Salman did about 90 years ago,
											the trick is to surround yourself with brilliant people,
											because at the end,
											it's all about people.
											And a few years ago, I was walking in Tel Aviv
											and I saw this graffiti on a wall,
											and I found it so compelling
											that by now I preach it to my students,
											and I'd like to try to preach it to you.
											Now, I don't know how many people here are familiar
											with the term ""mensch.""
											It basically means to be human
											and to do the right thing.
											And with that, what this graffiti says is,
											""High-tech schmigh-tech.
											The most important thing is to be a mensch."" (Laughter)
											Thank you. (Applause)
											(Applause)
									","
											La fuerza subyacente que impulsa este proyecto
											es mi colega Shmulik London,
											y, ya ven, igual que hizo
											Salman hace unos 90 años,
											el truco es rodearse de personas brillantes,
											porque al final,
											en todo están las personas.
											Hace unos años caminaba por Tel Aviv,
											vi este graffiti en una pared
											y me pareció tan convincente
											que ahora lo predico a mis estudiantes,
											y me gustaría hacerlo con Uds.
											No sé cuántos de los aquí presentes están familiarizados
											con el término ""Mensch"".
											Básicamente significa ""ser humano""
											y hacer lo correcto.
											Dicho esto, este graffiti dice:
											""Alta tecnología, tecnología 'schmigh'.
											Lo más importante es ser un 'Mensch'"". (Risas)
											Gracias. (Aplausos)
											(Aplausos)
									","
											Bu projenin arkasındaki itici güç
											meslektaşım Shumulik London
											ve görüyorsunuz ki,
											tıpkı Salman’ın 90 yıl önce yaptığı gibi
											işin sırrı etrafınızı parlak
insanlarla çevrelemek.
											Çünkü en sonunda,
											her şey insanlarla ilgili.
											Birkaç yıl önce, Tel Aviv'de yürüyordum
											ve bir duvarda bu yazıyı gördüm
											ve şimdiye kadar öğrencilerime
aktardığım bir şey.
											Çok etkileyici buldum
											ve size de aktarmak istiyorum.
											Buradaki kaç kişinin
'mensch' ifadesine
											aşina olduğunu bilmiyorum.
											Temel olarak insan olmak
											ve doğru şeyi yapmak anlamına geliyor.
											Bunun üzerine, duvar yazısının
söylediği şey ise,
											''Yüksek schmigh teknolojisi.
											En önemli şey mensch olmak."" (Gülüşmeler)
											Teşekkürler. (Alkışlar)
											(Alkışlar)
									","
											La force motrice derrière ce projet
											est mon collègue Shmulik London,
											et vous voyez, exactement comme
											Salman l'a fait il y a environ 90 ans,
											l'astuce est de s'entourer de gens brillants,
											parce qu'au final,
											tout ce qui compte, ce sont les gens.
											Il y a quelques années, je marchais dans Tel Aviv,
											et j'ai vu ce graffiti sur un mur,
											et je l'ai trouvé tellement envoûtant,
											que désormais je le fais découvrir à mes élèves,
											et j'aimerais vous le faire découvrir.
											Je ne sais pas combien de personnes ici connaissent
											le terme ""mensch"".
											Il signifie simplement être humain
											et agir correctement.
											Et ce que ce graffiti dit, c'est
											""High-tech, schmigh tech.
											Le plus important c'est d'être un mensch."" (Rires)
											Merci. (Applaudissements)
											(Applaudissements)
									","
											Die treibende Kraft hinter diesem Projekt
											ist mein Kollege Shmulik London,
											und, wie Sie sehen, genauso wie
											es Salman vor ungefähr 90 Jahren tat,
											besteht der Trick darin, sich mit 
hervorragenden Menschen zu umgeben,
											denn am Ende
											geht es nur um Menschen.
											Vor einigen Jahren, 
als ich eine Rede in Tel Aviv hielt,
											sah ich dieses Graffiti auf einer Wand,
											und ich fand es so bedeutend,
											dass ich es jetzt meinen Studenten zeige,
											und jetzt will ich es auch Ihnen zeigen.
											Ich weiß nicht, 
wie viele von Ihnen mit
											dem jiddischen Ausdruck ""mensch"" vertraut sind.
											Er bedeutet im Grunde menschlich zu sein,
											und das Richtige zu tun.
											Und so sagt dieses Graffiti:
											""High-tech schmigh-tech.
											Das Wichtigste ist, 
Mensch zu sein."" (Gelächter)
											Vielen Dank. (Applaus)
											(Applaus)
									",The self-organizing computer course,Shimon Schocken,16:25,"computers,education,open-source,technology,code"
"
","
","
","
","
",The self-organizing computer course,Shimon Schocken,16:25,"computers,education,open-source,technology,code"
