en,es,pt,tr,fr,de,title,speaker,duration,tags
"
											So I hope you can see.
											I really hope you can see how what we're doing here
											is taking a compelling question, a compelling answer,
											but we're paving a smooth, straight path
											from one to the other
											and congratulating our students for how well
											they can step over the small cracks in the way.
											That's all we're doing here.
											So I want to put to you that if we can separate these in a different way
											and build them up with students,
											we can have everything we're looking for in terms of patient problem solving.
									","
											Espero que puedan verlo.
											Espero que puedan apreciar ahora, lo que estamos haciendo aquí
											estamos hablando de una pregunta relevante, y una respuesta relevante
											estamos creando un camino suave y recto
											de un punto al otro,
											y felicitando a nuestros alumnos por lo bien
											que pueden rodear las piedras en el camino.
											Eso es todo lo que estamos haciendo.
											Así que quiero mostrarles, si podemos separar estos de una manera diferente
											e irlos construyendo junto con los estudiantes
											podemos tener todo lo que buscamos en términos de resolución de problemas.
									","
											Espero que todos consigam ver.
											Espero mesmo que todos consigam ver como, o que estamos a fazer aqui,
											é pegar numa questão interessante e dar uma resposta interessante,
											mas estando a construir um caminho suave e sério
											de uma ponta à outra,
											e a dar os parabéns aos alunos pelo quão bem
											eles conseguem ultrapassar os obstáculos pelo caminho.
											É tudo o que estamos aqui a fazer.
											Quero dizer-vos que, se pudermos separar isto de forma diferente,
											e construir os problemas com os alunos,
											podemos ter tudo o que procuramos em termos de resolução paciente de problemas.
									","
											Umarım görürsünüz.
											Umarım burada neyi nasıl yaptığımızı,
											zor bir soruyu ve cevabını ele alıp, çözüme giden yolu
											bir noktadan ötekine düz ve pürüzsüz
											şekilde bağlayarak
											ve her adımda sorunların üstesinden gelen
											öğrencilerimizi kutlayarak nasıl çizdiğimizi görürsünüz.
											Burada tüm yaptığımız bu.
											Şimdi sizden bunları farklı bir şekilde ayırıp, sonra öğrencilerle
											birlikte bir araya getirip
											sabırlı problem çözme için gerekli olan her şeyi oluşturmanızı isteyeceğim.
									","
											J'espère que vous le voyez.
											J'espère réellement que vous voyez comment — nous prenons
											une question difficile, une réponse difficile,
											mais nous pavons un chemin facile, direct,
											de l'un à l'autre,
											et nous félicitons nos étudiants pour leur
											capacité à enjamber les fissures du chemin.
											C'est tout ce que nous faisons.
											Réfléchissez à ceci : si nous savons les séparer d'une autre manière
											et les construire avec les étudiants,
											nous disposons de tout ce dont nous avons besoin pour résoudre des problèmes complexes.
									","
											Ich hoffe Sie können es sehen.
											Ich hoffe wirklich, Sie sehen, dass wir hier eigentlich
											ein fesselndes Problem und eine fesselnde Antwort nehmen,
											aber wir bereiten einen ebenen, geraden Weg
											von einem zum anderen,
											und gratulieren unseren Schülern für wie gut
											sie über die kleinen Risse auf dem Weg steigen.
											Das ist alles was wir hier machen.
											Ich möchte Ihnen zeigen, wenn wir diese auf eine andere Weise trennen
											und sie mit den Schülern ausgestalten,
											haben wir alles, was wir bezüglich geduldigem Problemlösen erwarten.
									",Math class needs a makeover,Dan Meyer,11:39,"TEDx,children,education,math,teaching"
"
","
","
","
","
","
",Math class needs a makeover,Dan Meyer,11:39,"TEDx,children,education,math,teaching"
"
											So right here I start with the visual,
											and I immediately ask the question:
											Which section is the steepest?
											And this starts conversation
											because the visual is created in such a way where you can defend two answers.
											So you get people arguing against each other,
											friend versus friend,
											in pairs, journaling, whatever.
											And then eventually we realize
											it's getting annoying to talk about
											the skier in the lower left-hand side of the screen
											or the skier just above the mid line.
											And we realize how great would it be
											if we just had some A, B, C and D labels
											to talk about them more easily.
											And then as we start to define what does steepness mean,
											we realize it would be nice to have some measurements
											to really narrow it down, specifically what that means.
											And then and only then,
											we throw down that mathematical structure.
											The math serves the conversation,
											the conversation doesn't serve the math.
											And at that point, I'll put it to you that nine out of 10 classes
											are good to go on the whole slope, steepness thing.
											But if you need to,
											your students can then develop those substeps together.
									","
											Por ejemplo aquí, empezamos con una ilustración,
											e inmediatamente hacemos la pregunta:
											¿Cuál sección es la más empinada?
											Y esto da inicio a la conversación
											porque la ilustración esta creada de tal manera que podrían defender cualquiera de las respuestas.
											Así que de pronto tenemos equipos argumentando uno contra otro,
											amigos contra amigos,
											por parejas, por escrito, de cualquier manera.
											Y finalmente nos damos cuenta
											que se vuelve tedioso hablar del
											teleférico en el lado izquierdo de la pantalla
											o el teleférico que esta por encima.
											Y nos damos cuenta de lo fantástico que seria
											si tuviéramos algunos nombres com A, B, C y D
											para poder referirlos fácilmente.
											Y después, cuando empezamos a definir lo que significa ""empinado"",
											nos damos cuenta de que sería genial tener algunas medidas
											para realmente centrarnos, específicamente en lo que buscamos.
											Y es entonces, y solo entonces,
											que mostramos toda la estructura matemática.
											Las matemáticas están al servicio de la conversación.
											La conversación no está al servicio de las matemáticas.
											En este punto, les apuesto que 9 de 10 grupos
											son capaces de llegar a la pendiente, lo ""empinado"" del asunto.
											Pero si se necesita,
											los estudiantes pueden desarrollar estas sub-etapas juntas.
									","
											Aqui, começo por introduzir a ilustração do problema
											e pergunto imediatamente:
											Qual é o troço mais inclinado?
											E isto dá início ao debate
											porque a ilustração é criada para que se possam defender duas respostas.
											Assim conseguimos pôr as pessoas a debaterem o problema,
											os amigos contra os amigos,
											em pares, em equipa, não importa.
											E às tantas apercebemo-nos de que
											está a ficar incomodativo falar sobre
											o esquiador no canto inferior esquerdo do ecrã
											ou no esquiador acima da linha média.
											E apercebemo-nos de quão bom seria
											se tivéssemos umas legendas A, B, C e D
											para falar mais facilmente dos esquiadores.
											E depois, quando começamos a definir o que significa a inclinação,
											apercebemo-nos de que seria bom ter algumas medidas
											para focar o problema, e perceber o que realmente significa.
											E aí e apenas aí,
											mostramos a estrutura matemática envolvida.
											A matemática serve o debate.
											Não é o debate que serve a matemática.
											E, nessa altura, digo-vos que 9 das 10 turmas
											são capazes de fazer o problema sobre a inclinação e os declives.
											Mas se precisarem,
											os vossos alunos conseguem realizar os passos em conjunto.
									","
											Burada, görselle başlıyorum,
											ve hemen soruyu soruyorum:
											Hangi bölüm en diktir?
											Ve bu sohbeti başlatıyor
											çünkü görsel öyle bir şekilde hazırlanmış ki sadece iki cevabı savunabilirsiniz.
											Bakıyorsunuz ki millet tartışıyor bile,
											arkadaş arkadaşa,
											çiftler halinde, yazarak, vs.
											Ve sonunda fark ediyoruz ki
											sol alttaki veya orta çizginin
											üstündeki kayakçı hakkında konuşmak
											artık can sıkıcı olmaya başlıyor.
											Onları A, B, C, D diye etiketlemenin
											tartışmayı ne kadar rahatlatacağının
											farkına varıyouz.
											Dikliğin ne olduğunu tanımladıktan sonra, anlıyoruz ki,
											elimizde bir ölçü olsa da şıkları daraltsak
											ve tam olarak ne anlama geldiğini belirlesek diyoruz.
											Ve işte ancak o zaman,
											matematiksel yapıyı ortaya atıyoruz.
											Matematik sohbete hizmet eder.
											Sohbet matematiğe hizmet etmez.
											Ve bu noktada her 10 sınıftan dokuzu bu diklik, eğim vs
											konusunu artık anlamaya hazırdır.
											Fakat eğer gerekiyorsa
											öğrencileriniz bu ön adımları beraber geliştirebilirler.
									","
											Ici, je commence avec un graphique,
											et immédiatement je pose la question :
											Quelle section est la plus pentue?
											Ceci démarre une conversation
											car le dessin est créé de manière à pouvoir proposer deux réponses.
											Les gens commencer à argumenter les uns contre les autres,
											ami contre ami,
											par paire, tout seul, etc.
											Et finalement nous réalisons
											qu'il devient ennuyant de parler
											du skieur en bas à gauche de l'écran,
											ou du skieur juste au-dessus du milieu.
											Nous réalisons à quel point ce serait bien
											si nous avions des étiquettes A, B, C et D
											pour en parler plus facilement.
											Et au moment où on commence à définir ce que signifie ""pentu"",
											on s'aperçoit que ça serait bien d'avoir des mesures
											pour le réduire à ce que cela signifie vraiment.
											Seulement alors,
											on présente cette structure mathématique.
											Les maths alimente la conversation.
											Pas l'inverse.
											Ici, je vous informe que 9 classes sur 10
											sont prêtes à embrayer sur le problème de pente en entier.
											Mais si c'est nécessaire,
											vos étudiants peuvent alors développer ces étapes ensemble.
									","
											Also beginne ich hier mit einem Bild,
											und stelle unmittelbar die Frage:
											Welcher Teil ist der steilste?
											Und das startet eine Konversation
											denn das Bild ist so konstruiert, dass zwei Antworten verteidigt werden können.
											So beginnen die Leute gegeneinander zu argumentieren,
											Freund versus Freund,
											in Paaren, mit Notizen, wie auch immer.
											Und letzendlich erkennen wir,
											dass es ärgerlich ist, über den Schifahrer
											in der unteren linken Ecke des Bildschirms zu reden
											oder über denjenigen über der Mittellinie.
											Und wir erkennen wie großartig es wäre
											wenn wir einige Bezeichnungen A, B, C und D hätten
											um einfacher über sie reden zu können.
											Wenn wir dann beginnen die Bedeutung von 'Steile' zu definieren,
											erkennen wir, dass es nett wäre, einige Maße zu besitzen
											um wirklich eingrenzen zu können, was es genau bedeutet.
											Und dann, und nur dann,
											werfen wir die mathematische Struktur hin.
											Die Mathematik dient der Konversation.
											Die Konversation dient nicht der Mathematik.
											Und an diesem Punkt sind 9 von 10 Schülern startklar und bereit
											die ganze Anstieg- und Steile-Sache anzugehen.
											Aber bei Bedarf
											können Ihre Schüler diese Unterschritte gemeinsam aufstellen.
									",Math class needs a makeover,Dan Meyer,11:39,"TEDx,children,education,math,teaching"
"
","
","
","
","
","
",Math class needs a makeover,Dan Meyer,11:39,"TEDx,children,education,math,teaching"
"
											Do you guys see how this, right here, compared to that —
											which one creates that patient problem solving, that math reasoning?
											It's been obvious in my practice, to me.
											And I'll yield the floor here for a second to Einstein,
											who, I believe, has paid his dues.
											He talked about the formulation of a problem being so incredibly important,
											and yet in my practice, in the U.S. here,
											we just give problems to students;
											we don't involve them in the formulation of the problem.
									","
											Se dan cuenta de como este problema aquí, a comparación de aquel,
											¿Cuál de ellos genera la resolución de problemas, el razonamiento matemático?
											Durante mi practica como maestro esto ha sido obvio para mi.
											Y esto nos da pié para citar por un segundo a Einstein,
											quien, según creo, sabía bastante de matemáticas.
											El decía que la formulación del problema era increíblemente importante,
											sin embargo, según mi experiencia aquí en los E.U.,
											sólo le damos problemas a los alumnos;
											no los involucramos en la formulación de los problemas.
									","
											Vocês vêm como isto aqui, comparado com aquilo ali —
											qual deles cria a resolução paciente do problema, aquele raciocínio matemático?
											Tem sido óbvia a escolha na minha experiência, para mim.
											E agora dou lugar por instantes a Einstein,
											que, penso eu, não ficou a dever nada a ninguém.
											Ele falava sobre a importância extrema da formulação dos problemas, (""A formulação de um problema é regularmente mais essencial que a solução, que poderá ser meramente uma questão de capacidade matemática ou experimental"")
											e ainda assim, da minha experiência, nos E.U.A,
											apenas damos problemas aos alunos;
											não os envolvemos na formulação do problema.
									","
											Bunu, buradaki görüyor musunuz, şuna kıyaslayın —
											sabırlı problem çözme ve matematiksel mantık yürütmeyi öğretiyor.
											Benim deneylerimde, bence bu çok açık.
											Ve bir saniyeliğine lafı Einstein'e bırakıyorum,
											ki, üzerine düşeni yaptığına inanıyorum.
											Problemi formüle dökmenin ne kadar önemli olduğunundan söz etti,
											ve tecrübelerime göre, ABD'de
											öğrencilere sadece problem veriyoruz;
											onlara problemi formüle etmeye yöneltmiyoruz.
									","
											Voyez-vous comment ceci, ici, comparé à cela —
											lequel des deux crée le raisonnement mathématique, la résolution de problème?
											Pour moi, d'expérience, c'est évident.
											Je vais laisser la parole une seconde à Einstein,
											qui, je le crois, en a le droit.
											Il a parlé de la formulation d'un problème si incroyablement important,
											et cependant d'expérience, aux États-Unis,
											nous nous contentons de donner des problèmes aux étudiants;
											nous ne les impliquons pas dans la formulation.
									","
											Sehen Sie das hier, verglichen zu dem —
											welches erzeugt das geduldige Problemlösen, das mathematische Denken?
											Es war für mich klar in meiner Tätigkeit.
											Ich möchte das Feld für eine Sekunde Einstein überlassen,
											der, wie ich glaube, seinen Beitrag geleistet hat.
											Er sprach über die unvorstellbare Wichtigkeit der Formulierung eines Problems,
											und dennoch, hier in den USA, nach meiner Erfahrung,
											geben wir den Schülern die Probleme einfach so;
											wir beziehen sie nicht in die Formulierung des Problems mit ein.
									",Math class needs a makeover,Dan Meyer,11:39,"TEDx,children,education,math,teaching"
"
","
","
","
","
","
",Math class needs a makeover,Dan Meyer,11:39,"TEDx,children,education,math,teaching"
"
											So 90 percent of what I do
											with my five hours of prep time per week
											is to take fairly compelling elements
											of problems like this from my textbook
											and rebuild them in a way that supports math reasoning and patient problem solving.
											And here's how it works.
											I like this question. It's about a water tank.
											The question is: How long will it take you to fill it up?
											First things first, we eliminate all the substeps.
											Students have to develop those,
											they have to formulate those.
											And then notice that all the information written on there is stuff you'll need.
											None of it's a distractor, so we lose that.
											Students need to decide, ""All right, well,
											does the height matter? Does the side of it matter?
											Does the color of the valve matter? What matters here?""
											Such an underrepresented question in math curriculum.
											So now we have a water tank.
											How long will it take you to fill it up? And that's it.
									","
											Así que el 90% de lo que yo hago
											con mis cinco horas semanales para preparar clase
											es tomar elementos suficientemente importantes
											o problemas como este del libro de texto
											y rediseñarlos de manera que fortalezcan el razonamiento matemático y la resolución de problemas.
											Y he aquí cómo funciona.
											Me gusta esta pregunta. Es acerca de un tanque de agua.
											La pregunta es: ¿Cuánto tiempo nos llevará llenarlo? ¿De acuerdo?
											Primero lo primero, eliminamos todos los paso.
											Los alumnos tienen que desarrollarlos.
											Tienen que formularlos.
											Y noten que la información escrita aquí son cosas que después necesitarás.
											Ninguna es un distractor, así que las quitamos.
											Los alumnos deben decidir, entonces
											¿Será importante la altura? ¿Importa el tamaño?
											¿Importa el color de la llave? ¿Qué es lo que importa aquí?
											Esta es una pregunta que rara vez aparece en el programa de matemáticas.
											Así que tenemos un tanque de agua.
											Simplemente, ¿Cuánto tiempo nos tomará llenarlo? es todo.
									","
											Por isso, 90% do que eu faço
											com as minhas cinco horas semanais de preparação
											é pegar em elementos interessantes
											de problemas como este do meu manual
											e reconstruí-los para suportarem o raciocínio matemático e a resolução paciente do problema.
											E funciona assim.
											Gosto desta pergunta. É sobre um reservatório de água.
											A pergunta é: Quanto tempo demora a enchê-lo? Ok?
											Primeiro, eliminamos todos os passos.
											Os alunos é que têm que os desenvolver.
											Têm que os formular.
											E notem que toda a informação ali escrita é tudo coisas que precisam.
											Nada é uma distracção, o que é bom.
											Os alunos precisam de decidir:
											a altura interessa? As dimensões interessam?
											A cor da válvula interessa? O que interessa neste caso?
											Que pergunta tão vaga, tendo em conta o programa de matemática.
											Então, agora temos um repositório de água.
											Quanto tempo demorará a enchê-lo? É isto que temos.
									","
											Haftalık 5 saat olan hazırlık
											zamanımın %90'nında ders kitabından
											böyle zorlayıcı soruları ele alıyorum
											ve sabırlı problem çözme ve
											matematiksel mantık yürütmeyi destekleyen hale getiriyorum.
											Nasıl çalıştığını göstereyim.
											Bu soruyu seviyorum. Su tankı hakkında.
											Soru şöyle: Tank ne kadar sürede dolar? Tamam mı?
											İlk önce, tüm ön adımları eliyoruz.
											Onları öğrenciler yapacak.
											Onları formüle etmek zorundalar.
											Ve orada yazan tüm bilgilerin ihtiyacı olan şeyler olduğunu fark edecekler.
											Hiçbiri dikkat dağıtmıyor, bunu geçiyoruz.
											Öğrenciler karar vermeli, pekala,
											yükseklik önemli mi? Ölçüsü önemli mi?
											Musluğun rengi önemli mi? Burada ne önemlidir?
											Matematik müfredatında yeterince açıklanmamış bir soru.
											Bir su tankımız var.
											Ne kadar zamanda dolacak, hepsi bu.
									","
											Donc 90% de mon travail,
											de mes 5 heures de préparation par semaine,
											consiste à prendre des éléments plutôt difficiles
											de problème celui-ci du livre de cours,
											et les réagencer pour que cela aide au raisonnement et à la résolution.
											Voici comment ça fonctionne.
											J'aime cette question, à propos d'un réservoir.
											La question est : Combien de temps faudra-t-il pour le remplir? OK?
											D'abord, on enlève toutes les étapes intermédiaires.
											Les étudiants devront les développer.
											Ils devront les formuler.
											Remarquez que tout ce qui est écrit ici est une information utile.
											Rien n'est inutile, donc on l'enlève.
											Les étudiants devront décider, c'est tout,
											est-ce que la hauteur a une importance? La taille?
											La couleur de la valve? Qu'est-ce qui a de l'importance ici?
											C'est une question tellement peu présente dans les cours de maths.
											Donc nous avons notre réservoir.
											Combien de temps faudra-t-il pour le remplir, et c'est tout.
									","
											Daher ist 90 Prozent von dem was ich tue,
											in den 5 Stunden Vorbereitungszeit pro Woche,
											diese spannenden Elemente aus ähnlichen Problemen
											aus meinem Textbuch zu nehmen,
											und diese so zu rekonstruieren, dass sie mathematisches Denken und geduldiges Problemlösen unterstützen.
											Und so funktioniert es.
											Mir gefällt diese Frage. Es geht um einen Wassertank.
											Die Frage ist: wie lange wird es dauern, ihn aufzufüllen? Okay?
											Das Wichtigste zuerts; wir eliminieren die Unterschritte.
											Die Schüler müssen diese ausarbeiten.
											Sie müssen sie formulieren.
											Und beachten Sie, dass all diese Daten hier Dinge sind, die Sie brauchen werden.
											Keines davon lenkt ab, also fällt das weg.
											Die Schüler sollen entscheiden, okay, gut,
											ist die Höhe relevant? Ist die Größe relevant?
											Ist die Farbe des Wasserhahns relevant? Was ist relevant hier?
											So eine unterrepräsentierte Frage im Mathematik Lehrplan.
											Wir haben also einen Wassertank.
											Wie lange wird es dauern, ihn aufzufüllen, das ist alles.
									",Math class needs a makeover,Dan Meyer,11:39,"TEDx,children,education,math,teaching"
"
","
","
","
","
","
",Math class needs a makeover,Dan Meyer,11:39,"TEDx,children,education,math,teaching"
