en,pt,fr,tr,de,title,speaker,duration,tags
"
											But when it comes to escaping gravity,
											there’s a loophole.
											If all the mass around us is 
pulling on us all the time,
											how would Earth’s gravity change
											if you tunneled deep below the surface,
											assuming you could do so without being 
cooked or crushed?
											If you hollowed out the center 
of a perfectly spherical Earth—
											which it isn’t, but let’s just say it 
were—
											you’d experience an identical pull from 
all sides.
											And you’d be suspended, weightless,
											only encountering the tiny pulls 
from other celestial bodies.
											So you could escape the Earth’s gravity 
in such a thought experiment—
											but only by heading straight into it.
									","
											Mas, no que respeita a fugir à gravidade,
											há uma falha.
											Se todas as massas à nossa volta
estão sempre a atrair-nos,
											como é que a gravidade da Terra mudaria
											se perfurássemos a superfície
profundamente,
											assumindo que o podíamos fazer
sem ficarmos cozidos ou esmagados?
											Se escavássemos um túnel
até ao centro da Terra,
											numa Terra perfeitamente esférica
											— que não é, façamos de conta que é —
											sentiríamos uma atração idêntica
de todos os lados.
											Ficaríamos suspensos, sem peso,
											sentido apenas as diminutas forças
dos outros corpos celestes.
											Conseguiríamos escapar
à gravidade da Terra
											neste exercício intelectual
											mas só enfiando-nos
mesmo no seu centro.
									","
											Mais quand il s'agit d'échapper
à la gravité,
											il y a une échappatoire.
											Si toute la masse autour de nous 
nous attire tout le temps,
											comment la gravité
de la Terre changerait-elle
											si vous creusiez un tunnel en profondeur,
											en supposant que vous puissiez le faire
sans être cuit ou écrasé ?
											Si vous évidiez le centre
d’une Terre parfaitement sphérique -
											ce qui n’est pas le cas,
mais disons qu'elle l'est -
											vous ressentiriez une attraction
identique de tous les côtés.
											Et vous seriez suspendu, en apesanteur,
											ne ressentant que les petites attractions
d'autres corps célestes.
											Vous pourriez échapper en théorie
à la gravité terrestre,
											mais seulement en allant droit dedans.
									","
											Konu yer çekiminden kaçmaya geldiğinde
											bunun ilginç bir yolu var.
											Eğer etrafımızdaki her şey 
bizi aynı anda çekiyorsa,
											Dünya'nın merkezine kazdığınızda,
											bunu ezilmeden ya da pişmeden 
yapabildiğinizi varsayarsak,
											yer çekimi bundan nasıl etkilenirdi?
											Eğer kusursuz küre şeklinde olan dünyanın
merkezine bir çukur kazsaydınız,
											Dünya'nın şekli öyle değil
ama olduğunu varsayalım,
											tüm yönlerden eşit derecede 
bir çekim hissederdiniz
											ve sadece diğer gök cisimlerinin
uyguladığı az çekim gücü ile
											asılı, ağırlıksız kalırdınız.
											Yani böyle bir düşünce deneyinde
Dünya'nın yer çekiminden kaçmak mümkün—
											ama ancak ona doğru giderek.
									","
											Beim Thema der Flucht
vor der Erdanziehung
											gibt es ein Schlupfloch.
											Wenn alle Masse um uns herum
uns ständig anzieht,
											wie würde sich die Erdanziehung verändern
											würde man tief unter
der Oberfläche graben,
											mit der Annahme, dass man dabei
nicht gekocht oder zerdrückt wird?
											Würde man die Mitte
einer kreisrunden Erde aushöhlen —
											was sie nicht ist,
aber nehmen wir es an —
											würde man eine gleichmäßige Anziehung
von allen Seiten erleben.
											Man würde schweben, schwerelos sein,
											nur auf die winzige Anziehung
von anderen Himmelskörpern treffen.
											Also könnte man der Erdanziehungskraft
in solch einem Gedankenversuch entkommen—
											aber nur, wenn man
genau darauf zusteuert.
									",How far would you have to go to escape gravity?,Rene Laufer,4:39,"science,TED-Ed,space,cosmos,universe,Planets,big bang,solar system"
"
","
","
","
","
",How far would you have to go to escape gravity?,Rene Laufer,4:39,"science,TED-Ed,space,cosmos,universe,Planets,big bang,solar system"
