en,tr,fr,title,speaker,duration,tags
"
											My best man, I told him
he could surprise me,
											and he thought this would be hilarious,
											but this is not something.
											Yeah, we all went to B school together.
											Wharton.
											(Laughter)
									","
											Sağdıcıma dedim ki beni
şaşırtabilirsin
											ve o bunun çok komik
olacağını düşünmüş,
											ama bu bir şey değil.
											Evet hepimiz birlikte
işletme fakültesinde okuduk.
											Wharton.
											(Kahkaha)
									","
											Mon témoin, je lui ai dit
de me faire une surprise,
											et il a pensé que ça serait drôle,
											mais c'est pas important.
											Ouais, on a tous fait
l'école de commerce ensemble.
											Wharton.
											(Rires)
									","One woman, five characters, and a sex lesson from the future",Sarah Jones,25:28,"culture,future,humor,performance,sex"
"
","
","
","One woman, five characters, and a sex lesson from the future",Sarah Jones,25:28,"culture,future,humor,performance,sex"
"
											Yeah, so, dude, can you guys —
											All right, but it's my bachelor party,
											and I can spend it in the parking lot
with Anderson Cooper if I want to.
											All right, I'll see you in there.
									","
											Evet, adamım, arkadaşlar ya biraz—
											Pekala, ama bu benim bekarlığa
veda
											partim ve istersem Anderson Cooper'la
park yerinde konuşarak geçiririm.
											Tamam, içerde görüşürüz.
									","
											Ouais, mec, les mecs vous pouvez —
											D'accord, mais c'est ma soirée,
											et je peux la passer sur le parking
avec Anderson Cooper si je veux.
											OK, je vous rejoins à l'intérieur.
									","One woman, five characters, and a sex lesson from the future",Sarah Jones,25:28,"culture,future,humor,performance,sex"
"
","
","
","One woman, five characters, and a sex lesson from the future",Sarah Jones,25:28,"culture,future,humor,performance,sex"
"
											All right, okay, so Anderson,
											so, like, first of all, stripping,
											but then, like, all the other things
you're talking about,
											prostitution and all that stuff,
that's, like, not the same thing at all.
											You know? Like, you keep calling it
the sex industry or whatever,
											but it's like, if the girl wants
to be an exotic dancer
											and she's 18, like, that's her right.
									","
											Pekala, tamam, ee Anderson,
											yani ilk olarak striptiz,
											ama sonra söylediğin tüm o
diğer şeyler
											fuhuş ve bütün diğer o şeyler,
yani hiç aynı şey değil.
											Anlarsın ya? Yani sürekli
seks endüstrisi falan diyip duruyorsun da
											bir kız egzotik bir dansçı olmak istiyorsa
											ve 18 yaşındaysa, bu onun hakkı.
									","
											D'accord, bon Anderson,
											donc, déjà, faire du strip tease,
											mais après, tous les autres trucs
dont tu parles,
											la prostitution, ce genre de choses,
c'est, genre, pas du tout la même chose.
											Genre, t'arrêtes pas d'appeler ça
l'industrie du sexe ou quoi,
											mais si la fille veut
être une danseuse exotique
											et elle a 18 ans, c'est son droit.
									","One woman, five characters, and a sex lesson from the future",Sarah Jones,25:28,"culture,future,humor,performance,sex"
"
","
","
","One woman, five characters, and a sex lesson from the future",Sarah Jones,25:28,"culture,future,humor,performance,sex"
"
											Whoa, whoa, I hear what you're saying,
but I just feel like people,
											they just want to make it seem
like all dudes are just, like, predators,
											that we would just automatically
go to a prostitute, or whatever.
											Even, like, when I pledged, you know,
like when I rushed my fraternity.
											My brothers who I'm close to,
those guys, they're all like me.
											We're just normal people, but, like,
there's this myth that you must
											be that guy who is kind of an asshole,
and like, all bros before hos or whatever.
											And actually, like, bros before hos,
it doesn't mean like what it sounds like.
											It's actually just like a joking way of
saying that you care about your brothers
											and you put them first.
									","
											Oo dur bir dakika, ne dediğini
anlıyorum ama bence insanlar
											bütün erkekleri birer yırtıcı avcı gibi
göstermek istiyorlar,
											sanki otomatikman bir fahişeye
gidermişiz falan gibi.
											Yani üniversitedeki erkek kardeşlik
evine girme çabalarımda bile.
											Yakın olduğum kardeşlerim, bu adamlar,
hepsi benim gibiler.
											Biz sadece normal insanlarız, ama sanki
bir lavuk, yani tüm kankalar
											kaşarlardan önce gelir havasında bir
erkek olmanız gerektiği gibi mitler var.
											Aslında kaşarlardan önce kankalar bana
duyulduğu gibi bir anlam ifade etmiyor.
											Aslında sadece kankalarına değer verdiğini
ve onlara öncelik verdiğini söyleyen
											bir tür şaka.
									","
											Holà, j'entends ce que tu dis,
mais j'ai l'impression que les gens,
											ils veulent juste donner l'impression
que tous les mecs sont des prédateurs,
											qu'on va tous automatiquement
aller voir une prostituée ou quoi.
											Même quand j'ai juré, tu sais, genre,
quand je suis entré dans ma fraternité,
											mes frères dont je suis proche,
ces mecs, ils sont tous comme moi.
											On est juste des mecs normaux, mais
il y a ce mythe que tu dois
											être ce mec qui est une espèce de salaud,
genre, les potes avant les meufs et tout.
											Et en fait, les potes avant les meufs,
c'est pas ce que les gens croient.
											C'est juste une façon marrante de dire
que les potes sont plus importants
											que tout le reste pour toi.
									","One woman, five characters, and a sex lesson from the future",Sarah Jones,25:28,"culture,future,humor,performance,sex"
"
","
","
","One woman, five characters, and a sex lesson from the future",Sarah Jones,25:28,"culture,future,humor,performance,sex"
"
											Yeah, but, you can't blame
the media, either.
											I mean, like, if you
go watch ""Hangover 2,""
											and you think that's an instruction manual
											for your life, like,
I don't know what to tell you.
											You know? You don't
watch ""Bourne Identity""
											and go drive your car
over a gondola in Venice. (Laughter)
									","
											Evet, ama medyayı da suçlayamazsın.
											Demek istediğim, yani gidip ""Felekten Bir
Gece 2""yi
											izleyip hayatın için bir kullanım kılavuzu
											kabul edersen, e o zaman sana
diyecek bir şeyim yok.
											Anladın mı? ""Geçmişi Olmayan Adam""ı
izleyip
											arabanı Viyana'da bir gondolmuş
gibi kullanmazsın.
									","
											Ouais, mais, tu peux pas en vouloir
aux médias non plus.
											Je veux dire, si tu vas
voir « Very bad trip 2 »,
											et que tu penses que c'est un guide
											pour ta vie, genre,
je sais pas quoi te dire.
											Tu vois ? Tu vas pas voir
« la Mémoire dans la peau »
											et ensuite conduire
sur une gondole à Venise. (Rires)
									","One woman, five characters, and a sex lesson from the future",Sarah Jones,25:28,"culture,future,humor,performance,sex"
"
","
","
","One woman, five characters, and a sex lesson from the future",Sarah Jones,25:28,"culture,future,humor,performance,sex"
"
											Well, yeah, okay, like, if you're
a little kid or whatever,
											of course it's different, but —
									","
											Tabii, evet, tamam, yani eğer küçük
bir çocuk falansan
											tabii ki durum farklı ama—
									","
											Bon, ouais, OK, si t'es
un gosse ou quoi,
											bien sûr c'est différent, mais —
									","One woman, five characters, and a sex lesson from the future",Sarah Jones,25:28,"culture,future,humor,performance,sex"
"
","
","
","One woman, five characters, and a sex lesson from the future",Sarah Jones,25:28,"culture,future,humor,performance,sex"
"
											Yeah, all right, I remember
one thing like that.
											I was at this kid's house
one time playing GTA,
											uh, Grand Theft Auto?
									","
											Evet, pekala, öyle bir şey
hatırlıyorum.
											Bir keresinde bir çocuğun evinde
GTA oynuyordum,
											ıım, Grand Theft Auto?
									","
											Ouais, OK, je me rappelle
d'un truc comme ça.
											J'étais chez un autre gamin
une fois pour jouer à GTA,
											euh, Grand Theft Auto ?
									","One woman, five characters, and a sex lesson from the future",Sarah Jones,25:28,"culture,future,humor,performance,sex"
"
","
","
","One woman, five characters, and a sex lesson from the future",Sarah Jones,25:28,"culture,future,humor,performance,sex"
"
											Dude, are you from Canada? (Laughter)
									","
											Adamım, sen Kanadalı mısın?
									","
											Mec, t'es du Canada ou quoi ? (Rires)
									","One woman, five characters, and a sex lesson from the future",Sarah Jones,25:28,"culture,future,humor,performance,sex"
"
","
","
","One woman, five characters, and a sex lesson from the future",Sarah Jones,25:28,"culture,future,humor,performance,sex"
"
											So, like, whatever, with Grand Theft Auto,
											you're this kid, like, you're this guy
walking around or whatever,
											and you can basically, like,
the more cops you kill,
											the more points you get,
and stuff like that.
											But also, you can find prostitutes
											and obviously you can do
sexual stuff with them,
											but you can, like, kill them
and take your money back.
											Yeah, this kid, I remember he ran over
a couple of them a few times with his car
											and he got all these points.
											We were, like, 10, I think.
											It felt pretty terrible, actually.
											No, I don't think I said anything,
I just finished playing and went home.
									","
											Her neyse, Grand Theft Auto'da
											sen bir adamsın ve
etrafta yürürken
											yani basitçe, ne kadar çok polis
öldürürsen
											o kadar çok puan alıyorsun,
bunun gibi şeyler.
											Aynı zamanda fahişeler de
bulabilirsin
											ve tabii onlarla cinsel şeyler
yaşayabilirsin ama
											onları öldürüp paranı geri de alabilirsin.
											Evet, bu çocuk, hatırlıyorum, birkaç
fahişeyi arabasıyla ezmiş
											ve tüm bu puanları almıştı.
											Sanırım 10 yaşında falandık.
											Açıkçası baya kötü hissetmiştim.
											Hayır, bir şey dediğimi sanmıyorum,
oyunu bitirip eve döndüm.
									","
											Ouais, bref, avec Grand Theft Auto,
											t'es ce gosse, enfin, tu es ce gars,
tu te balades et tout,
											et en gros tu peux, genre,
plus tu tues de flics,
											plus tu gagnes de points,
ce style de trucs.
											Mais aussi, tu peux
trouver des prostituées
											et bien sûr tu peux faire
des trucs sexuels avec elles,
											mais tu peux aussi les tuer
et récupérer ton argent.
											Ouais, ce gosse, il en a écrasé
quelques-unes avec sa voiture
											et il gagnait plein de points.
											On avait 10 ans, je pense.
											J'étais mal à l'aise, en fait.
											Non, je crois que j'ai rien dit,
j'ai fini de jouer et je suis rentré.
									","One woman, five characters, and a sex lesson from the future",Sarah Jones,25:28,"culture,future,humor,performance,sex"
"
","
","
","One woman, five characters, and a sex lesson from the future",Sarah Jones,25:28,"culture,future,humor,performance,sex"
"
											All right class, so then there were men
who had more than just
											a passing relationship to this issue.
(Laughter)
											The next subject described himself
as a reformed and remorseful pimp
											turned motivational speaker,
											life coach and therapist,
											but if you want to know more about him,
you'll have to come to the entire play.
									","
											Tamam sınıf, bir de bu konuya tesadüfiden
daha fazla
											bağlantılı olan adamlar vardı.
(Kahkaha)
											Bir sonraki kişi kendini düzelmiş ve
pişman bir eski pezevenk olarak tanımladı;
											şu an motive edici bir
											konuşmacı, yaşam koçu ve terapist.
											Ama eğer onunla ilgili daha çok şey bilmek
istiyorsanız, tüm oyuna gelmeniz gerek.
									","
											D'accord jeunes gens, il y avait aussi
des hommes qui avaient un lien
											plus fort avec ce sujet.
(Rires)
											Le prochain sujet se décrit
comme étant un ancien souteneur repenti
											qui est devenu
un conférencier de motivation,
											un coach de vie et un thérapeute,
											mais si vous voulez en savoir plus,
vous devez venir à la pièce complète.
									","One woman, five characters, and a sex lesson from the future",Sarah Jones,25:28,"culture,future,humor,performance,sex"
"
","
","
","One woman, five characters, and a sex lesson from the future",Sarah Jones,25:28,"culture,future,humor,performance,sex"
"
											Thank you so much,
you beautiful TED audience.
											I will see you for ""Sell/Buy/Date.""
									","
											Siz güzel TED seyircilerine çok
teşekkür ederim.
											""Al/Sat/Eskit""te görüşürüz.
									","
											Merci beaucoup,
vous êtes un public TED formidable.
											Je vous verrai pour
« vendre/acheter/sortir ».
									","One woman, five characters, and a sex lesson from the future",Sarah Jones,25:28,"culture,future,humor,performance,sex"
"
","
","
","One woman, five characters, and a sex lesson from the future",Sarah Jones,25:28,"culture,future,humor,performance,sex"
"
											(Applause)
									","
											(Alkış)
									","
											(Applaudissements)
									","One woman, five characters, and a sex lesson from the future",Sarah Jones,25:28,"culture,future,humor,performance,sex"
"
","
","
","One woman, five characters, and a sex lesson from the future",Sarah Jones,25:28,"culture,future,humor,performance,sex"
