es,tr,fr,de,title,speaker,duration,tags
"
","
","
","
",How to buy happiness,Michael Norton,10:58,"TEDx,business,community,consumerism,happiness,money,philanthropy,psychology"
