en,es,tr,fr,de,title,speaker,duration,tags
"
											Well, let's go back to this picture.
											There's one challenge symbolized at the top,
											but there's another challenge to science symbolized at the bottom.
											You want to not only synthesize the very large and the very small,
											but we want to understand the very complex.
											And the most complex things are ourselves,
											midway between atoms and stars.
											We depend on stars to make the atoms we're made of.
											We depend on chemistry to determine our complex structure.
											We clearly have to be large, compared to atoms,
											to have layer upon layer of complex structure.
											We clearly have to be small, compared to stars and planets —
											otherwise we'd be crushed by gravity. And in fact, we are midway.
											It would take as many human bodies to make up the sun
											as there are atoms in each of us.
											The geometric mean of the mass of a proton
											and the mass of the sun is 50 kilograms,
											within a factor of two of the mass of each person here.
											Well, most of you anyway.
											The science of complexity is probably the greatest challenge of all,
											greater than that of the very small on the left
											and the very large on the right.
											And it's this science,
											which is not only enlightening our understanding of the biological world,
											but also transforming our world faster than ever.
											And more than that, it's engendering new kinds of change.
									","
											Ahora bien, regresemos a esta imagen.
											Hay un desafío simbolizado en la parte superior,
											pero hay otro desafío para la ciencia en la parte inferior.
											No sólo se quiere sintetizar lo muy grande y lo muy chico,
											sino que queremos entender lo 'muy complejo'.
											Y lo más complejo somos nosotros,
											entre medio de los átomos y las estrellas.
											Dependemos de las estrellas para hacer los atomos de los que estamos hechos.
											Dependemos de la química para determinar nuestra compleja estructura.
											Claramente tenemos que ser grandes, comparados con los átomos,
											Para tener una capa sobre otra y formar una estructura compleja.
											Claramente tenemos que ser pequeños, comparados con las estrellas y planetas —
											de otra forma nos aplastaría la gravedad. Y de hecho, estamos en el medio.
											Requieren tantos cuerpos humanos para llenar el sol
											como átomos hay en cada uno de nosotros.
											La razón geométrica de masa en un protón
											y la masa en el Sol es de 50 kilogramos,
											que es aproximadamente la masa de cada persona aquí.
											Bueno, de la mayoría de ellas.
											La ciencia de lo complejo es probablemente el mayor desafío de todos,
											mayor que el muy pequeño en la izquierda
											y que el muy grande en la derecha.
											Y es esta ciencia,
											la que no sólo ilumina nuestro entendimiento del mundo biológico,
											sino que transforma nuestro mundo más rápido que nuna.
											Aún más, está engendrando nuevos tipos de cambio.
									","
											Peki bu fotoğrafa geri dönelim.
											Tepede bir sorun sembolize ediliyor,
											ama altta da bilim için diğer bir sorun sembolize ediliyor.
											Sadece çok büyük olanı ve çok küçük olanı sentezlemeyi düşünmek değil,
											ama çok karmaşık olanı anlamayı isteriz.
											Ve en karmaşık olan şeyler yıldızlar ve atomlar
											arasındaki bizleriz.
											Bizi oluşturan atomların yapılmasında yıldızlara bağımlıyız.
											Karmaşık yapımızı belirlemede kimyaya bağımlıyız.
											Atomlarla kıyaslandığında, karmaşık yapımızın tabaka tabaka
											yapısına sahip olmak için açık biçimde büyük olmalıyız.
											Gezegenler ve yıldızlarla kıyaslandığında küçük olmalıyız—
											aksi taktirde yer çekimi tarafından ezilirdik. Ve aslında ortadayız.
											Güneşin yüzeyini kaplamak için ne kadar insan gövdesine
											ihtiyaç varsa her birimizin içinde o kadar atom var.
											Bir protonun kütlesinin ve güneşin kütlesinin
											geometrik ortalaması 50 kilogramdır,
											buradaki her kişinin kütlesi bu iki kütlenin (toplamının) arasında temsil edilir.
											Tabii büyük bir bölümünüzün yani.
											Kompleksitenin bilimi muhtemelen bütün bilimlerin en zorlusudur,
											soldaki çok küçük olanınkinden de
											ve sağdaki çok geniş olanınkinden de.
											Ve bu bilimdir ki,
											sadece biyolojik dünya konusundaki anlayışımızı aydınlatmakla kalmıyor
											fakat aynı zamanda dünyamızı her zamankinden daha hızlı dönüştürüyor.
											Ve bundan da fazla, yeni bir tip değişimi de doğuruyor.
									","
											Revenons à cette image.
											Il y a un challenge symbolisé en haut de l'image,
											Mais vous avez un autre challenge pour la science symbolisé en bas de l'image.
											Nous voulons non seulement faire la synthèse du très grand et du très petit,
											mais en plus nous voulons comprendre le très complexe.
											Et la chose la plus complexe c'est nous-mêmes,
											à mi-chemin entre les atomes et les étoiles.
											Nous dépendons des étoiles qui ont créé les atomes qui nous constituent.
											Nous dépendons de la chimie qui détermine notre structure complexe.
											Il est logique que nous soyons grands par rapport aux atomes,
											pour pouvoir constituer cet empilement de structures complexes.
											Il est logique que nous soyons petits par rapport aux étoiles et aux planètes —
											sans quoi nous serions écrasés par la gravité. En réalité, nous sommes à mi-chemin.
											Il faudrait autant de corps humains pour constituer le soleil
											qu'il y a d'atomes en chacun de nous.
											La moyenne géométrique entre la masse d'un proton
											et la masse du soleil est de 50kg,
											ce qui est du même ordre de grandeur que le poids de chaque personne ici.
											Enfin, de la plupart d'entre vous.
											La science de la complexité est probablement le challenge le plus difficile d'entre tous,
											plus difficile que celui du très petit à gauche
											et celui du très grand à droite.
											Et c'est cette même science
											qui en même temps nous éclaire sur notre compréhension du monde biologique,
											et également transforme notre monde plus rapidement que jamais.
											Qui plus est, elle provoque de nouveaux types de changements.
									","
											Schauen wir uns noch einmal das Bild an.
											Eine Herausforderung sehen wir oben.
											eine weitere Herausforderung ist am unteren Rand symbolisiert.
											Wir wollen nicht nur die Synthese zwischen dem sehr Großen und dem sehr Kleinen,
											sondern wir wollen auch das wirklich Komplexe verstehen.
											Und die komplexesten Dinge sind wir selbst,
											irgendwo zwischen den Atomen und den Sternen.
											Wir hängen ab von Sternen, die die Atome produzieren, aus denen wir gemacht sind.
											Wir hängen ab von Chemie, um unsere komplexe Struktur zu bestimmen.
											Im Vergleich zu Atomen müssen wir sehr groß sein
											um Schicht um Schicht von komplexen Strukturen zu haben.
											Im Vergleich zu Sternen und Planeten müssen wir sehr klein sein,
											da wir sonst von der Gravitation zerdrückt würden. Wir sind genau dazwischen.
											Um die Sonne nachzubilden, würde es so viele menschliche Körper benötigen,
											wie Atome in uns sind.
											Das geometrische Mittel zwischen der Masse eines Protons
											und der Masse der Sonne beträgt 50 Kilogramm.
											was im Bereich des Faktors 2 der Masse von jeder Person hier liegen sollte.
											Zumindest für die meisten von Ihnen.
											Die Wissenschaft von der Komplexität ist vermutlich die größte Aufgabe von allen,
											größer als die des sehr Kleinen links
											und die des sehr Großen rechts.
											Und es ist diese Wissenschaft,
											die nicht nur unser Verständnis der biologischen Welt erhellt,
											sondern die unsere Welt schneller als je zuvor verändert.
											Und darüber hinaus bringt sie neue Arten des Wandels hervor.
									",Is this our final century?,Martin Rees,17:26,"astronomy,climate change,complexity,cosmos,science,social change,technology,time,universe"
"
","
","
","
","
",Is this our final century?,Martin Rees,17:26,"astronomy,climate change,complexity,cosmos,science,social change,technology,time,universe"
"
											And I now move on to the second part of my talk,
											and the book ""Our Final Century"" was mentioned.
											If I was not a self-effacing Brit, I would mention the book myself,
											and I would add that it's available in paperback.
									","
											Y ahora paso a la segunda parte de mi charla,
											y el libro 'Nuestro Siglo Final' fue mencionado.
											Si no fuera un Británico auto-adulador, habría mencionado el libro yo mismo,
											y habría agregado que está disponible en tapa de papel.
									","
											Ve ben şimdi konuşmamın ikinci bölümüne geçmek istiyorum,
											ve "" Bizim Son Yüzyılımız"" kitabından söz edildi.
											Eğer tevazu sahibi olmasaydım kitaptan kendim bahsederdim
											ve kitabın karton kapaklı cildinin mevcut olduğunu da eklerdim.
									","
											J'en arrive à la seconde partie de mon exposé,
											et à mon livre ""Notre Dernier Siècle"" (Our Final Century).
											Si je n'avais pas l'humilité légendaire des anglais, je parlerais moi-même de mon livre,
											et j'ajouterais qu'il est disponible en édition de poche.
									","
											Kommen wir jetzt zum zweiten Teil meiner Rede,
											das Buch ""Our Final Century"" [dt. ""Unsere letzte Stunde""] wurde bereits erwähnt.
											Wäre ich nicht so ein extrem bescheidener Brite, hätte ich es selbst erwähnt,
											und hätte ergänzt, dass es auch als Taschenbuch erhältlich ist.
									",Is this our final century?,Martin Rees,17:26,"astronomy,climate change,complexity,cosmos,science,social change,technology,time,universe"
"
","
","
","
","
",Is this our final century?,Martin Rees,17:26,"astronomy,climate change,complexity,cosmos,science,social change,technology,time,universe"
"
											(Laughter)
									","
											(Risas)
									","
											(Gülüşmeler)
									","
											(Rires)
									","
											(Lachen)
									",Is this our final century?,Martin Rees,17:26,"astronomy,climate change,complexity,cosmos,science,social change,technology,time,universe"
"
","
","
","
","
",Is this our final century?,Martin Rees,17:26,"astronomy,climate change,complexity,cosmos,science,social change,technology,time,universe"
"
											And in America it was called ""Our Final Hour""
											because Americans like instant gratification.
									","
											En Estados Unidos lo llamaron 'Nuestra Hora Final'
											porque a los Estadounidenses les gusta la gratificación instantánea.
									","
											Ve Amerikada o "" Bizim Son Saatimiz"" ismiyle biliniyor
											çünkü Amerikalılar hızlı tatmini severler.
									","
											Et aux USA il s'intitule ""Notre Dernière Heure""
											car les américains aiment les plaisirs immédiats.
									","
											In Amerika [und in Deutschland, d.Ü.] wurde es ""Unsere letzte Stunde"" genannt,
											denn die Amerikaner mögen die schnelle Erfüllung.
									",Is this our final century?,Martin Rees,17:26,"astronomy,climate change,complexity,cosmos,science,social change,technology,time,universe"
"
","
","
","
","
",Is this our final century?,Martin Rees,17:26,"astronomy,climate change,complexity,cosmos,science,social change,technology,time,universe"
"
											(Laughter)
									","
											(Risas)
									","
											(Gülüşmeler)
									","
											(Rires)
									","
											(Lachen)
									",Is this our final century?,Martin Rees,17:26,"astronomy,climate change,complexity,cosmos,science,social change,technology,time,universe"
"
","
","
","
","
",Is this our final century?,Martin Rees,17:26,"astronomy,climate change,complexity,cosmos,science,social change,technology,time,universe"
"
											But my theme is that in this century,
											not only has science changed the world faster than ever,
											but in new and different ways.
											Targeted drugs, genetic modification, artificial intelligence,
											perhaps even implants into our brains,
											may change human beings themselves. And human beings,
											their physique and character, has not changed for thousands of years.
											It may change this century.
											It's new in our history.
											And the human impact on the global environment — greenhouse warming,
											mass extinctions and so forth — is unprecedented, too.
											And so, this makes this coming century a challenge.
											Bio- and cybertechnologies are environmentally benign
											in that they offer marvelous prospects,
											while, nonetheless, reducing pressure on energy and resources.
											But they will have a dark side.
											In our interconnected world, novel technology could empower
											just one fanatic,
											or some weirdo with a mindset of those who now design computer viruses,
											to trigger some kind on disaster.
											Indeed, catastrophe could arise simply from technical misadventure —
											error rather than terror.
											And even a tiny probability of catastrophe is unacceptable
											when the downside could be of global consequence.
									","
											Pero en mi tema es que en este sigle,
											no sólo la ciencia ha cambiado el mundo más rápido que nunca,
											sino que en muchos aspectos nuevos y diferentes.
											Drogas, modificación genéticas, inteligencia artificial,
											quizás hasta implantes en nuestros cerebros,
											quizás cambie el ser humano en sí. Y el ser humano,
											su físico y su personalidad, no han cambiado por miles de años.
											Y quizás cambie en este siglo.
											Es nuevo en nuestra historia.
											Y el impacto humano en el medio ambiente — el efecto invernadero,
											extinciones masivas, etc. — tampoco tiene precedentes.
											Y por eso este siglo que se viene es un desafío.
											Bio- y ciber-tecnologías son ambientalmente benignas
											en tanto ofrecen maravillosas propuestas,
											mientras, además, alivian la presión en energía y recursos.
											Pero tendrán un lado oscuro también.
											En nuestro mundo interconectado, las tecnologías nóveles pueden impulsar
											a un fanático,
											o a algún loco con la mente de esos que diseñan viruses de computadoras,
											a desatar algún tipo de desastre.
											Sin duda, la catástrofe también puede desatarse de una falla técnica —
											por error en vez de por terror.
											E incluso la más mínima probabilidad de catástrofe es inaceptable
											si el resultado puede ser una consequencia a nivel global.
									","
											Ama benim konum şu ki, bu yüzyılda
											bilim dünyayı her zaman olduğundan daha hızlı değiştirmekle kalmadı
											aynı zamanda yeni ve farklı yollar da buldu.
											Hedef gözeten ilaçlar, genetik modifikasyon, yapay zeka,
											hatta belki de beyne konan implantlar
											insan kimliğini değiştirecekler. Ve insanlar,
											binlerce yıl boyunca fizik ve karakter değiştirmeseler bile
											Bu yüzyılda değişebilir.
											Tarihimizde yeni bir şey
											Ve global çevre üzerinde insan etkisi— sera gazları,
											türlerin kitlesel dışlanması ve dahaları—-eşi görülmemiş şekilde aynı zamanda.
											Ve bu gelen yüzyılı zorlu yapıyor.
											Biyo-ve-siberteknolojiler çevre-dostudur
											kendi alanlarında etkileyici çözümler sunuyorlar,
											bunları yaparken (aynı zamanda) enerji ve kaynaklar üzerindeki baskıyı da azaltıyorlar.
											Ama karanlık bir tarafları var.
											Her şeyin birbirine bağlandığı dünyamızda, yeni teknoloji
											bir fanatiği
											ya da bilgisayar virüsleri tasarlamayı bilen garip birilerini
											harekete geçirerek bazı felaketleri tetikleyebilir.
											Bu da gerçekte terör amaçlı olmaktan çok basitçe
											teknik bir yanlışlıktan kaynaklanabilir.
											Ve ortaya çıkan olumsuz durumun global bir etkisi olacaksa
											yıkım olasılığı kabul edilemez.
									","
											Mon idée est que dans ce siècle,
											non seulement la science va changer le monde plus rapidement que jamais auparavant,
											mais de manières différentes et nouvelles.
											Des médicaments sur mesure, des modifications génétiques, l'intelligence artificielle,
											peut-être même des implants dans nos cerveaux,
											pourraient changer les êtres humains eux-mêmes. Et l'espèce humaine,
											physiquement et psychologiquement, n'a pas changé depuis des milliers d'années.
											Elle pourrait se transformer pendant ce siècle.
											C'est une nouveauté dans notre histoire.
											Et l'impact de l'homme sur l'environnement — l'effet de serre,
											les extinctions de masse, etc. — est sans précédent également.
											Ce nouveau siècle est donc en lui-même un challenge.
											Les technologies biologiques et cybernétiques sont bienveillantes pour l'environnement,
											car elles ouvrent des perspectives merveilleuses,
											tout en réduisant la pression sur l'énergie et les ressources.
											Mais elles auront leurs côté sombre.
											Dans notre monde interconnecté, une technologie novatrice peut donner le pouvoir
											à un fanatique,
											ou à un hurluberlu avec le même état d'esprit que ceux qui crèent des virus informatiques,
											de déclencher un désastre.
											D'ailleurs, une catastrophe pourrait simplement provenir d'une mésaventure technique —
											l'erreur plutôt que la terreur.
											Même une probabilité infime de catastrophe est inacceptable
											si elle avait des conséquences globales.
									","
											Aber mein Thema ist dieses Jahrhundert.
											Die Wissenschaft hat die Erde schneller als je zuvor geändert,
											und zwar auf neuen und anderen Wegen.
											Zielgerichtete Medikamente, genetische Veränderungen, künstliche Intelligenz,
											vielleicht sogar in unsere Gehirne implantiert,
											werden die Menschen möglicherweise selbst verändern. Und die Menschen,
											ihre Physis und Psyche haben sich über Tausende von Jahren nicht geändert.
											Sie könnten sich in diesem Jahrhundert ändern.
											Das ist neu in unserer Geschichte.
											Und der menschliche Einfluss auf die globale Umwelt – Treibhaus-Effekt,
											Vernichtung von Arten – ist auch beispiellos.
											Und all das macht das kommende Jahrhundert zu einer Herausforderung.
											Bio- und Cybertechnologie sind durch die hervorragenden Aussichten,
											die sie bieten, positiv für die Umwelt,
											während sie weiterhin den Druck auf die Energie und Ressourcen verringern.
											Aber sie werden auch eine dunkle Seite haben.
											In unserer vernetzten Welt könnte die neuartige Technologie
											einen Fanatiker,
											oder andere Spinner mit der Geisteshaltung von Virus-Programmierern
											in die Lage versetzen, ein Desaster anzurichten.
											Tatsächlich könnte eine Katastrophe durch ein technisches Unglück hervorgerufen werden,
											nur durch einen Fehler und nicht durch Terror.
											Und selbst eine kleine Wahrscheinlichkeit für eine Katastrope ist nicht akzeptabel,
											wenn die Kehrseite globale Auswirkungen haben könnte.
									",Is this our final century?,Martin Rees,17:26,"astronomy,climate change,complexity,cosmos,science,social change,technology,time,universe"
"
","
","
","
","
",Is this our final century?,Martin Rees,17:26,"astronomy,climate change,complexity,cosmos,science,social change,technology,time,universe"
