en,es,fr,title,speaker,duration,tags
"
											Two: I had a choice.
											Like a person offered to swallow
a red pill or a blue pill,
											I could choose to see
my daughter's differences as bad;
											I could strive toward the goal
that her therapists called,
											""You'd never know.""
											They loved to pat themselves on the back
when they could say about a kid,
											""You'd never know he was 'delayed'
or 'autistic' or 'different.'""
											I could believe that the good path
was the path that erased
											as many differences as possible.
											Of course, this would have been
a disastrous pursuit,
											because at the cellular level,
my daughter had rare blueprints.
											She wasn't designed
to be like other people.
											She would lead a rare life.
											So, I had another choice:
I could drop my story
											that neurological differences
and developmental delays and disabilities
											were bad,
											which means I could also drop my story
that a more able-bodied life was better.
											I could release my cultural biases
about what made a life good or bad
											and simply watch
my daughter's life as it unfolded
											with openness and curiosity.
									","
											Dos: tenía opciones, como la persona
a la que le ofrecen una píldora roja
											o una píldora azul.
											Podía elegir ver las diferencias
de mi hija como malas,
											podía tratar de alcanzar la meta que
sus terapeutas llamaban ""nunca sabrías"".
											Amaban autofelicitarse
cuando podían decir de un niño:
											""Nunca sabrías que tiene 'retraso'
o autismo o que es 'diferente'"".
											Podía creer que el buen camino
											era el que borraba la mayor cantidad
de diferencias posibles.
											Por supuesto, hubiera sido desastroso
											porque a nivel celular
mi hija tenía un molde inusual.
											No estaba diseñada para ser como
otras personas; tendría una vida inusual.
											Pero tenía otra opción:
											podía abandonar mi cuento de que 
las diferencias neurológicas,
											los retrasos en el desarrollo
y las discapacidades son malas.
											Por lo tanto,
											también podía dejar mi cuento de que
la vida es mejor en un cuerpo más apto.
											Podía dejar mis prejuicios culturales
											sobre lo que hace que una vida
sea buena o mala
											y simplemente observar la vida de mi hija
desarrollarse con apertura y curiosidad.
									","
											Deux : j'avais le choix.
											Comme une personne à qui l'on proposerait
d'avaler une pilule rouge ou bleue,
											je pouvais choisir de voir les différences
de ma fille comme mauvaises ;
											je pouvais aspirer à l'objectif
que ses thérapistes appelaient :
											« On ne dirait pas. »
											Ils adoraient se féliciter
de pouvoir dire d'un enfant :
											« On ne dirait pas qu'il est « retardé »,
« autiste » ou « différent » ».
											Je pouvais croire que le bon chemin
était le chemin qui effaçait
											autant de différences que possible.
											Bien sûr, cela aurait été
une poursuite désastreuse
											car au niveau cellulaire,
ma fille avait une structure rare.
											Elle n'était pas faite
pour être comme les autres.
											Elle allait mener une vie rare.
											J'avais un autre choix :
je pouvais laisser tomber mon histoire
											disant que les différences neurologiques,
les retards développementaux et handicaps
											étaient mauvais,
											ce qui impliquait aussi
de laisser tomber mon histoire
											disant qu'une vie avec un corps
plus valide était meilleure.
											Je pouvais relâcher mes biais culturels
											sur ce qui faisait qu'une vie
était bonne ou mauvaise
											et simplement regarder
la vie de ma fille se dérouler
											avec ouverture et curiosité.
									","""Good"" and ""bad"" are incomplete stories we tell ourselves",Heather Lanier,13:36,"children,disability,family,humanity,parenting,personal growth,society,love"
"
","
","
","""Good"" and ""bad"" are incomplete stories we tell ourselves",Heather Lanier,13:36,"children,disability,family,humanity,parenting,personal growth,society,love"
"
											One afternoon she was lying on her back,
											and she arched her back on the carpet
											stuck her tongue
out of the side of her mouth
											and managed to torque
her body onto her belly.
											Then she tipped over
and rolled back onto her back,
											and once there, she managed
to do it all over again,
											rolling and wiggling her 12-pound self
under a coffee table.
											At first, I thought
she'd gotten stuck there,
											but then I saw her reaching for something
that her eye had been on all along:
											a black electric cord.
											She was a year old.
											Other babies her age were for sure
pulling up to stand and toddling around,
											some of them.
											To some, my kid's situation looked bad:
											a one-year-old who could only roll.
											But screw that.
											My kid was enjoying the new,
limber freedom of mobility.
											I rejoiced.
											Then again, what I watched that afternoon
was a baby yanking on an electric cord,
											so you know,
											good or bad, hard to say.
									","
											Una tarde, Fiona estaba boca arriba
y arqueó su espalda sobre la alfombra,
											sacó su lengua a un lado de la boca
											y consiguió hacer una torsión
y caer sobre su barriga.
											De ahí, se balanceó y rodó de nuevo
hasta caer de espaldas.
											Logró hacerlo una y otra vez,
rodando y arrastrando sus 12 libras
											hasta quedar bajo una mesa.
											Al principio creí que estaba atascada,
pero vi que se estiraba
											para agarrar lo que había sido su objetivo
desde el principio: un cable eléctrico.
											Tenía un año.
											Claro que muchos bebés de su edad
están parándose y empezando a caminar.
											Para algunos la situación
de mi hija era mala:
											una niña de un año
que solo podía girarse.
											Al diablo con eso, mi hija estaba
disfrutando la libertad de su movilidad.
											Me regocijé.
											Por otro lado, lo que vi esa tarde fue
a una bebé tirando un cable eléctrico,
											así que, ya saben,
difícil decir si es bueno o malo.
									","
											Un après-midi, elle était
allongée sur le dos
											et elle a arqué son dos sur le tapis,
											tiré la langue sur le côté de sa bouche
											et a réussi à tordre son corps
pour se mettre sur le ventre.
											Puis elle a basculé
et est revenue sur son dos.
											Une fois sur le dos, elle a recommencé,
											roulant et remuant son corps
de 5,5 kg sous une table de salon.
											Au début, j'ai cru
qu'elle était bloquée là,
											puis je l'ai vu essayant d'atteindre
											ce sur quoi ses yeux
étaient fixés tout du long :
											un fil électrique noir.
											Elle avait un an.
											Les autres bébés de son âge
se levaient et se dandinaient,
											certains en tout cas.
											Pour certains, la situation
de mon enfant semblait mauvaise :
											à un an, elle ne pouvait que rouler.
											Mais peu importe.
											Mon enfant appréciait la nouvelle
et souple liberté de sa mobilité.
											Je me suis réjouie.
											A nouveau, cet après-midi-là, j'ai regardé
un bébé tirer sur un fil électrique,
											alors vous savez,
											bon ou mauvais, difficile à dire.
									","""Good"" and ""bad"" are incomplete stories we tell ourselves",Heather Lanier,13:36,"children,disability,family,humanity,parenting,personal growth,society,love"
"
","
","
","""Good"" and ""bad"" are incomplete stories we tell ourselves",Heather Lanier,13:36,"children,disability,family,humanity,parenting,personal growth,society,love"
"
											(Laughter)
									","
											(Risas)
									","
											(Rires)
									","""Good"" and ""bad"" are incomplete stories we tell ourselves",Heather Lanier,13:36,"children,disability,family,humanity,parenting,personal growth,society,love"
"
","
","
","""Good"" and ""bad"" are incomplete stories we tell ourselves",Heather Lanier,13:36,"children,disability,family,humanity,parenting,personal growth,society,love"
"
											I started seeing
that when I released my grip
											about what made a life good or bad,
											I could watch my daughter's life unfold
and see what it was.
											It was beautiful,
											it was complicated,
											joyful, hard —
											in other words: just another expression
of the human experience.
									","
											Noté que si no me aferraba a una idea
											de lo que hace que una vida
sea buena o mala
											podía observar la vida de mi hija
desenvolverse y verla por lo que era.
											Era hermosa, era complicada,
alegre, difícil...
											en otras palabras: simplemente
otra expresión de la experiencia humana.
									","
											J'ai commencé à voir
que lorsque je relâchais mon étreinte
											sur ce qui rendait la vie
bonne ou mauvaise,
											je pouvais regarder la vie de ma fille
se dérouler et la voir vraiment.
											C'était magnifique.
											C'était compliqué,
											joyeux, difficile —
											en d'autres mots : une autre expression
de l'expérience humaine.
									","""Good"" and ""bad"" are incomplete stories we tell ourselves",Heather Lanier,13:36,"children,disability,family,humanity,parenting,personal growth,society,love"
"
","
","
","""Good"" and ""bad"" are incomplete stories we tell ourselves",Heather Lanier,13:36,"children,disability,family,humanity,parenting,personal growth,society,love"
"
											Eventually, my family and I moved
to a new state in America,
											and we got lucky with a brand-new
batch of therapists.
											They didn't focus on
all that was wrong with my kid.
											They didn't see her differences
as problems to fix.
											They acknowledged her limitations,
											but they also saw her strengths,
											and they celebrated her for who she was.
											Their goal wasn't to make Fiona
as normal as possible;
											their goal was simply to help her
be as independent as possible
											so that she could fulfill her potential,
however that looked for her.
									","
											Finalmente, mi familia y yo
nos mudamos a otro estado de EE.UU.
											y tuvimos suerte con
nuestro nuevo lote de terapeutas.
											No se enfocaban en
lo que estaba mal en mi hija,
											no veían sus diferencias
como problemas a resolver.
											Reconocían sus limitaciones,
pero también veían sus fortalezas
											y la celebraban por quién era.
											La meta de los terapeutas no era
que Fiona fuera lo más normal posible,
											la meta era hacerla
lo más independiente posible
											para que alcance todo su potencial,
como sea que eso luzca para ella.
									","
											Finalement, ma famille et moi
avons déménagé dans un autre État
											et avons eu de la chance
avec un nouveau groupe de thérapeutes.
											Ils ne se concentraient pas
sur ce qui n'allait pas chez mon enfant.
											Ils ne voyaient pas ses différences
comme des problèmes à résoudre.
											Ils reconnaissaient ses limites
											mais voyaient aussi ses forces
											et la célébraient pour qui elle était.
											Leur objectif n'était pas de rendre Fiona
aussi normale que possible :
											leur objectif était de l'aider
à être aussi indépendante que possible
											afin qu'elle exploite
son plein potentiel, quel qu'il soit.
									","""Good"" and ""bad"" are incomplete stories we tell ourselves",Heather Lanier,13:36,"children,disability,family,humanity,parenting,personal growth,society,love"
"
","
","
","""Good"" and ""bad"" are incomplete stories we tell ourselves",Heather Lanier,13:36,"children,disability,family,humanity,parenting,personal growth,society,love"
"
											But the culture at large does not take
this open attitude about disabilities.
											We call congenital differences
""birth defects,""
											as though human beings
were objects on a factory line.
											We might offer pitying expressions
											when we learn that a colleague
had a baby with Down syndrome.
											We hail a blockbuster film
about a suicidal wheelchair user,
											despite the fact that actual
wheelchair users tell us
											that stereotype is unfair and damaging.
											And sometimes our medical institutions
decide what lives are not worth living.
											Such is the case with Amelia Rivera,
											a girl with my daughter's same syndrome.
											In 2012, a famous American
children's hospital
											initially denied Amelia the right
to a lifesaving kidney transplant
											because, according to their form,
											as it said, she was ""mentally retarded.""
											This is the way that the story
of disabilities as bad manifests
											in a culture.
									","
											La sociedad no comparte esta actitud
positiva frente a las discapacidades.
											Llamamos ""defectos de nacimiento""
a las diferencias congénitas
											como si los seres humanos fuéramos
objetos en una línea de ensamblaje.
											A lo mejor sentimos lástima
											cuando nos enteramos que un colega
ha tenido un bebé con síndrome de Down.
											Aclamamos una película taquillera
sobre un suicida en silla de ruedas,
											pese a que la gente real
que usa silla de ruedas
											dice que el estereotipo
es injusto y dañino.
											Y, a veces, nuestras instituciones médicas
deciden qué vidas merecen ser vividas
											como en el caso de Amelia Rivera,
											una niña que tiene
el síndrome de mi hija.
											En el 2012 un famoso hospital de EE.UU.
le negó inicialmente a Amelia
											el derecho a un vital trasplante de riñón
											porque según su formulario
tenía ""retraso mental"".
											Así es como el cuento de que
las discapacidades son malas
											se manifiesta en una cultura.
									","
											Mais la culture en général n'adopte pas
											cette attitude ouverte
envers les handicaps.
											Nous appelons les différences congénitales
« défauts congénitaux »,
											comme si les êtres humains étaient
des objets sur une ligne de production.
											Nous exprimons notre compassion
											quand nous apprenons qu'un collègue
a eu un bébé atteint de trisomie 21.
											Nous acclamons un film à succès
											sur un utilisateur
de fauteuil roulant suicidaire,
											malgré le fait que les utilisateurs
de fauteuils roulants nous disent
											que ce stéréotype
est injuste et préjudiciable.
											Parfois, nos institutions médicales
											décident quelles vies
ne méritent pas d'être vécues.
											C'est le cas d'Amelia Rivera,
											une fille atteinte
du même syndrome que ma fille.
											En 2012, un célèbre
hôpital pour enfants américain
											a initialement refusé à Amelia le droit
à une greffe de rein salvatrice
											car, d'après leur formulaire,
											comme indiqué, elle était
« mentalement retardée ».
											C'est ainsi que l'histoire des handicaps
comme étant mauvais se manifeste
											dans une culture.
									","""Good"" and ""bad"" are incomplete stories we tell ourselves",Heather Lanier,13:36,"children,disability,family,humanity,parenting,personal growth,society,love"
"
","
","
","""Good"" and ""bad"" are incomplete stories we tell ourselves",Heather Lanier,13:36,"children,disability,family,humanity,parenting,personal growth,society,love"
"
											But there's a surprisingly
insidious counterstory —
											the story, especially, that people
with intellectual disabilities are good
											because they are here
to teach us something magical,
											or they are inherently angelic
and always sweet.
											You have heard this ableist trope before:
											the boy with Down syndrome
who's one of God's special children,
											or the girl with the walker
and the communication device
											who is a precious little angel.
											This story rears its head
in my daughter's life
											around Christmastime,
											when certain people get positively giddy
											at the thought of seeing her
in angel's wings and a halo
											at the pageant.
											The insinuation is that these people
don't experience the sticky complexities
											of being human.
											And although at times,
especially as a baby,
											my daughter has, in fact, looked angelic,
											she has grown into the type of kid
											who does the rascally things
that any other kid does,
											such as when she, at age four,
shoved her two-year-old sister.
											My girl deserves the right
to annoy the hell out of you,
											like any other kid.
									","
											Pero hay un cuento contrastante
que es sorprendentemente insidioso,
											el cuento de que la gente con
discapacidades intelectuales es buena
											porque están aquí
para enseñarnos algo mágico
											o que son intrínsecamente angelicales, 
o que siempre son dulces.
											Seguramente han escuchado
este tipo de comentario discriminatorio:
											""Ese niño con síndrome de Down
es uno de los niños especiales de Dios""
											o ""La niña del andador
y el aparato para comunicarse
											es un precioso angelito"".
											Este cuento aparece en la vida
de mi hija alrededor de Navidad
											cuando cierta gente se regocija
											ante la idea de verla con alas de ángel
y aureola en la presentación navideña.
											La insinuación es que estas personas
no sufren las engorrosas complejidades
											de ser humanos.
											Y aunque en ocasiones,
sobre todo cuando era bebé,
											mi hija sí ha lucido angelical,
											ha crecido para convertirse
en el tipo de niño
											que hace picardías,
como cualquier otro niño.
											Como cuando tenía cuatro años
y empujó a su hermanita de dos.
											Mi hija se merece el derecho a
ser fastidiosa, como cualquier otro niño.
									","
											Il y a une contre-histoire
insidieuse surprenante —
											l'histoire selon laquelle les gens
avec des handicaps mentaux sont bons
											car ils sont ici pour nous enseigner
quelque chose de magique
											ou ils sont intrinsèquement
angéliques et toujours gentils.
											Vous avez déjà entendu
cette trope pro-validité :
											le garçon atteint de trisomie 21
qui est l'un des enfants spéciaux de Dieu
											ou la fille avec le déambulateur
et le dispositif de communication
											qui est un précieux petit ange.
											Cette histoire pointe son nez
dans la vie de ma fille
											vers Noël,
											quand certaines personnes sont excitées
											à l'idée de la voir portant
des ailes d'anges et une auréole
											lors du spectacle.
											L'insinuation est que ces personnes
ne connaissent pas les aspects complexes
											liés au fait d'être humain.
											Bien que parfois,
surtout en tant que bébé,
											ma fille ait, en effet,
eu l'air angélique,
											elle a grandi pour devenir
le genre d'enfant
											qui fait les mêmes bêtises
que font tous les autres enfants,
											comme lorsque, à quatre ans,
elle a poussé sa sœur de deux ans.
											Ma fille mérite le droit de vous agacer,
											comme tout autre enfant.
									","""Good"" and ""bad"" are incomplete stories we tell ourselves",Heather Lanier,13:36,"children,disability,family,humanity,parenting,personal growth,society,love"
"
","
","
","""Good"" and ""bad"" are incomplete stories we tell ourselves",Heather Lanier,13:36,"children,disability,family,humanity,parenting,personal growth,society,love"
"
											When we label a person tragic or angelic,
											bad or good,
											we rob them of their humanity,
											along with not only the messiness
and complexity that that title brings,
											but the rights and dignities as well.
											My girl does not exist to teach me things
											or any of us things,
											but she has indeed taught me:
											number one, how many
mozzarella cheese sticks
											a 22-pound human being
can consume in one day —
											which is five, for the record;
											and two, the gift of questioning
my culture's beliefs
											about what makes a life good
											and what makes life bad.
									","
											Cuando etiquetamos a una persona
como terrible o angelical, mala o buena,
											le robamos su humanidad: el desorden
y complejidades que vienen con el título,
											al igual que los derechos
y dignidades correspondientes.
											Mi hija no existe para enseñarme a mí
o a Uds. algo, aunque sí me ha enseñado.
											Número uno: cuántos 'palitos de queso'
											puede comer en un día
un ser humano de 10 kilos...
											la respuesta es 5 palitos,
para su información.
											Y dos: el don de cuestionar
las creencias de mi cultura
											sobre qué hace que una vida sea buena
y qué hace que sea mala.
									","
											Quand nous étiquetons une personne
comme étant tragique ou angélique,
											mauvaise ou bonne,
											nous lui ôtons son humanité,
											ainsi que non seulement le désordre
et la complexité que ce titre octroie,
											mais aussi les droits et dignités.
											Ma fille n'existe pas
pour nous enseigner, moi ou vous,
											quoi que ce soit,
											mais elle m'a appris des choses :
											un, combien de bâtonnets de mozzarella
											un être humain de 10 kg
peut consommer en un jour —
											cinq, pour votre information ;
											et deux, le don de la remise en question
des croyances de ma culture
											sur ce qui rend une vie bonne
											et ce qui rend une vie mauvaise.
									","""Good"" and ""bad"" are incomplete stories we tell ourselves",Heather Lanier,13:36,"children,disability,family,humanity,parenting,personal growth,society,love"
"
","
","
","""Good"" and ""bad"" are incomplete stories we tell ourselves",Heather Lanier,13:36,"children,disability,family,humanity,parenting,personal growth,society,love"
