en,tr,fr,title,speaker,duration,tags
"
											Right. Well, for me though, it was,
as a girl, it started with me dad.
											I mean, half the time, when he
spoke to us, it was just a sort of
											tell us we were all useless rotten idiots
and we had no morals, that type of thing.
											And I certainly didn't
do myself any favors.
											By the time I was 16,
											I had started messing about
with this older fella,
											and he wanted it to be
our little secret,
											and I did as I was told, didn't I,
											and when that got back to me dad, he
had me sent straightaway to the convent.
											Well no, that older fella, he would still
come to find me in the convent.
											Yeah, he'd leave me notes
											tucked into the holes in the brick
at the back of the charity shop
											so we could meet.
											And he'd tell me how
he's leaving his wife,
											and I believed him, until I got pregnant.
											I did, Peter, and I left him a note
about it in our special place there,
											and I never did hear from him again.
											No, I gave it up for adoption
so it could have a decent life,
											and then they wouldn't let me
back into the convent.
									","
											Evet. Ve küçük bir kız iken 
babamla başladı bu.
											Yani, bazen bizimle konuştuğunda
bize yalnızca
											kokmuş, işe yaramaz aptallar olduğumuz ve
hiç terbiyemiz olmadığı gibi şeyler derdi.
											Ve ben de kendime kesinlikle iyilik
yapmazdım.
											16 yaşıma geldiğimde,
											benden büyük bir delikanlıyla
takılmaya başladım.
											O bunun bizim küçük sırrımız olmasını
istedi
											ve ben de söylenileni yaptım,
yapmaz mıyım?
											Sonra babam öğrendiğinde, beni
direk olarak bir manastıra yolladı.
											Ama hayır, o delikanlı beni gelip
manastırda bulurdu.
											Evet, buluşabilmemiz için hayır
											kurumu mağazasının tuğlalarının arasındaki
deliklere sıkıştırılmış
											notlar bırakırdı.
											Ve bana karısını bırakacağını
falan söylerdi,
											ben de ona inandım, ta ki hamile kalana
kadar.
											Evet, hamile kaldım, Peter, ve oradaki
özel yerimizde ona bununla ilgili bir not
											bıraktım, ve bir daha ondan
haber almadım.
											Hayır, iyi bir hayatı olabilmesi için
onu evlatlık olarak bıraktım
											ve sonra beni manastıra geri almadılar.
									","
											D'accord. Bon, pour moi malgré tout,
ça a commencé avec mon père.
											Je veux dire, la moitié du temps,
quand il nous parlait, il disait juste
											qu'on était tous des idiots, des inutiles
et qu'on n'avait pas de morale.
											Et ce qui est sûr,
c'est que je ne me suis pas aidée.
											Quand j'ai eu 16 ans,
											j'ai commencé à traîner
avec ce gars plus âgé,
											et il voulait que ça soit
notre petit secret,
											et j'ai fait ce qu'on m'a dit de faire,
											et quand mon père l'a appris,
il m'a envoyée tout droit au couvent.
											Seulement, l'autre gars, il venait
encore me trouver au couvent.
											Oui, il me laissait des messages
											planqués dans les briques
à l'arrière de la boutique caritative
											pour qu'on se retrouve.
											Et il me racontait
qu'il allait quitter sa femme,
											et moi je le croyais,
jusqu'à ce que je tombe enceinte.
											Et là, Peter, je lui ai laissé un message
dans notre endroit spécial là-bas,
											et je n'ai plus jamais
entendu parler de lui.
											Non, je l'ai fait adopter
pour qu'il ait une vie convenable.
											Après ça, ils ne voulaient plus
que je retourne au couvent.
									","One woman, five characters, and a sex lesson from the future",Sarah Jones,25:28,"culture,future,humor,performance,sex"
"
","
","
","One woman, five characters, and a sex lesson from the future",Sarah Jones,25:28,"culture,future,humor,performance,sex"
"
											No, my one sister Virginia gave me
a fiver for the coach to Dublin,
											and that's how I ended up here.
											Well, surprise, surprise, I fell in love
with another fella much older than me,
											and I always say I was just so happy
because he didn't drink,
											I married the bastard.
									","
											Hayır, Virginia'daki kız kardeşim
Dublin'e giden otobüse binmem için
											bir beşlik verdi ve işte buraya geldim.
											Sürpriz, sürpriz! Benden bayağı büyük
birisine daha aşık oldum
											ve her zaman söylerim, içki içmediği için
o kadar mutluydum ki
											alçak herifle evlendim.
									","
											Non, mon unique sœur Virginia m'a donné
5 livres pour le bus vers Dublin,
											et c'est comme ça
que je me suis retrouvée ici.
											Et, surprise, je suis tombée amoureuse
d'un autre gars bien plus âgé que moi,
											et comme je dis toujours,
j'étais si heureuse qu'il ne boive pas,
											que j'ai épousé ce salaud.
									","One woman, five characters, and a sex lesson from the future",Sarah Jones,25:28,"culture,future,humor,performance,sex"
"
","
","
","One woman, five characters, and a sex lesson from the future",Sarah Jones,25:28,"culture,future,humor,performance,sex"
"
											Well, he didn't drink, but he did have
just the wee heroin problem, didn't he,
											and — That's right, and before I knew it,
											he was the one who turned me on
to the prostitution, my own husband.
											He had me supporting the both of us.
											I was 18.
											Well, it wasn't Pretty Woman,
I can tell you that.
											That Julia Roberts,
											if she'd ever had to sleep with a man
to put a few pounds in her pocket,
											I don't think she'd ever
have made that film.
											Well, for your record,
											my opinion of the legalization,
I'd say I'm against it.
											I just, I don't care what
these young girls say.
											You know, living like that,
you're just lost,
											and, you know, I'm 63 years old.
											I'm still trying to find who I am.
											You know, I never was a wife or a nun,
											or a prostitute even, really, not really.
											Nobody ever asked who I wanted to be.
											They just told me,
											and if you legalize it,
											then you're really telling these girls,
""Go on and get lost for a living,""
											and a lot of them,
they'll do as they're told.
									","
											İçki içmiyordu ama minicik bir eroin
problemi vardı tabii, olmaz mı,
											ve —Bu doğru, ve ben daha ne olup 
bittiğini
											anlayamadan beni fuhuşa sürükleyen oydu,
kendi kocam.
											Benim üzerimden ikimizi birden
geçindiriyor-
											du. 18 yaşındaydım.
											""Özel Bir Kadın"" filmi değildi,
o kadarını söyleyebilirim.
											O Julia Roberts
											cebine birkaç kuruş koyabilmek için bir
adamla yatmak zorunda kalsaydı,
											o filmi kesinlikle yapmazdı.
											Kayıtlarına geçsin,
											yasallaştırmaya karşı olduğumu
söyleyebilirim.
											Yani bu genç kızların ne dediği
umrumda değil.
											O şekilde yaşarken kayıpsın,
											ve ben 63 yaşındayım.
											Hala kim olduğumu bulmaya çalışıyorum.
											Yani hiçbir zaman bir eş ya da rahibe
olmadım,
											ya da bir fahişe bile, evet, pek değil.
											Kimse bana kim olmak istediğim sormadı.
											Sadece söylediler,
											ve eğer bu yasallaşırsa
											o zaman bu kızlara şunu demiş oluyorsunuz:
""Hadi, ekmek parası için kendinizi
											kaybedin!"". Ve çoğu
kendilerine denileni yapacaktır.
									","
											Alors, il ne buvait pas, mais il avait
un problème avec l'héroine, tu vois,
											et — C'est juste,
et avant de m'en rendre compte,
											il a été celui qui m'a amenée
vers la prostitution, mon propre mari.
											Il m'a fait subvenir à nos besoins.
											J'avais 18 ans.
											Et, c'était pas Pretty Woman,
je peux te le dire.
											Cette Julia Roberts,
											si elle avait dû coucher avec un homme
pour avoir quelques livres en poche,
											je pense pas qu'elle aurait
fait ce film.
											Et, pour ton information,
											mon opinion sur la légalisation,
je dirais que je suis contre.
											Ça m'est égal ce que
ces jeunes filles disent.
											Tu sais, quand tu vis comme ça,
t'es juste paumée,
											et, tu vois, j'ai 63 ans.
											J'essaye encore de trouver qui je suis.
											Tu sais, j'ai jamais été
une épouse ou une nonne,
											ou même une prostituée, pas vraiment.
											Personne ne m'a jamais demandé
qui je veux être.
											Ils m'ont juste ordonné,
											et si on légalise ça,
											alors on dit vraiment à ces filles :
« Vas-y, vends ton âme pour vivre. »
											et beaucoup d'entre elles,
elles font ce qu'on leur dit.
									","One woman, five characters, and a sex lesson from the future",Sarah Jones,25:28,"culture,future,humor,performance,sex"
"
","
","
","One woman, five characters, and a sex lesson from the future",Sarah Jones,25:28,"culture,future,humor,performance,sex"
"
											All right, so four perspectives
from four quite — (Applause) —
											four quite different voices there, right?
											One woman saying sex itself is natural
but the sex industry seems to
											mechanize or industrialize it.
											Then the second woman considered
sex work to be empowering,
											liberating, and feminist,
though she, herself, notably,
											did not seem keen to do it.
											The third woman, who actually was
a so-called sex worker
											did not agree that it was liberating
but she wanted the right
											to the economic empowerment,
											and then we hear the fourth woman
saying not only prostitution itself
											but proscribed roles for women in general
											prevented her from ever
finding who she was, right?
									","
											Pekala, dört epeyce değişik sesten
dört — (Alkış) —
											dört bakış açısı, değil mi?
											Seksin başlı başına doğal olduğunu ama
seks endüstrisinin onu mekanikleştirip
											endüstriyelleştirdiğini söyleyen
bir kadın.
											Sonra seks işinin güç verici, özgürleş-
tirici ve feminist olduğunu
											düşünen ikinci kadın, kendisi 
açıkça
											bunu yapmaya pek hevesli olmasa da.
											Sözüm ona gerçek bir seks işçisi olan
üçüncü kadın
											bunun özgürleştirici olduğuna katılmadı
ama ekonomik güce sahip
											olma hakkını istiyordu
											ve sonra fuhuşun yalnızca kadınlara
genel roller vermekle kalmadığını,
											ayrıca onun kim olduğunu bulmasını
											engellediğini söyleyen dördüncü
kadını duyduk, değil mi?
									","
											Bien, donc quatre perspectives
venant de quatre — (Applaudissements) —
											de quatre voix assez différentes, non ?
											Une femme qui dit que le sexe est naturel
mais que l'industrie du sexe paraît
											le mécaniser ou l'industrialiser.
											Puis la seconde femme qui considère
que le travail du sexe est valorisant,
											libérateur, et féministe,
même si elle n'avait pas l'air
											motivée pour le faire personnellement.
											La troisième femme, qui était vraiment
une travailleuse du sexe
											ne trouvait pas ça libérateur
mais elle voulait avoir accès
											à l'émancipation économique,
											et enfin on a entendu la quatrième femme
qui disait que la prostitution
											mais aussi les rôles
imposés aux femmes en général
											l'avaient empêchée de découvrir
qui elle était, vous voyez ?
									","One woman, five characters, and a sex lesson from the future",Sarah Jones,25:28,"culture,future,humor,performance,sex"
"
","
","
","One woman, five characters, and a sex lesson from the future",Sarah Jones,25:28,"culture,future,humor,performance,sex"
"
											So another fact most people did not know
											was the average age of an at-risk girl
being introduced to the sex industry
											was 12 or 13.
									","
											Birçok insanın bilmediği gerçeklik,
											seks endüstrisine sokulma riskinde
bulunan kızların ortalama
											12 ya da 13 yaşında olduklarıydı.
									","
											Sinon, un truc que
beaucoup de gens ne savaient pas,
											c'était que l'âge moyen
auquel une fille à risque
											était exposée à l'industrie du sexe
était 12 ou 13 ans.
									","One woman, five characters, and a sex lesson from the future",Sarah Jones,25:28,"culture,future,humor,performance,sex"
"
","
","
","One woman, five characters, and a sex lesson from the future",Sarah Jones,25:28,"culture,future,humor,performance,sex"
"
											Also consider that the age
when all girls in that society
											first became exposed
to sexualized images of women
											was quite a bit earlier, right?
											This was a doll called Barbie, right?
											I initially thought she was an educational
tool for anorexia prevention —
											(Laughter) —
											but actually she was considered by many
											to be a wholesome symbol of femininity,
											and often young girls began
what was called dieting.
											Remember this? This was
restricting food intake on purpose
											by the age of six,
											and defining themselves
based on attractiveness
											by around that same time. Right?
									","
											O toplumdaki tüm kızların
kadınların cinselleştirilmiş
											görsellerine ilk maruz kaldıkları
zamanın da bir hayli
											erken olduğunu göz önünde
bulundurun, öyle değil mi?
											Bu bebeğin adı Barbie'ydi, değil mi?
											Başta, onu anoreksiyi önlemek 
için bir araç sanmıştım —
											(Kahkaha) —
											ama aslında birçok insan tarafından
											kadınlığın ahlaka uygun bir sembolü
olarak algılandı,
											ve genç kızlar diyet denilen bir şey
yapmaya başladı.
											Bunu hatırladınız mı? Bu, 6 yaşından
itibaren
											yenilen yemek miktarını
											kasıtlıca azaltmak ve aynı zamanlarda
kendilerini çekicilik-
											lerine göre tanımlamaktı,
değil mi?
									","
											Donc on considère que l'âge auquel
toutes les filles de la société
											étaient exposées pour la première fois
à des images sexualisées des femmes
											était un peu plus jeune, d'accord ?
											Ceci était une poupée nommée Barbie, OK ?
											Au début j'ai cru que c'était un outil
pédagogique contre l'anorexie —
											(Rires) —
											mais elle était en fait
considérée par beaucoup
											comme un symbole sain de féminité,
											et souvent les jeunes filles commençaient
ce qui s'appelait un régime —
											Vous vous souvenez ? C'était le fait de
limiter sa nourriture intentionnellement.
											— à l'âge de 6 ans,
											et elles se définissaient
par des critères d'attractivité
											environ au même âge. D'accord ?
									","One woman, five characters, and a sex lesson from the future",Sarah Jones,25:28,"culture,future,humor,performance,sex"
"
","
","
","One woman, five characters, and a sex lesson from the future",Sarah Jones,25:28,"culture,future,humor,performance,sex"
"
											Yes?
											Right, Bradley, okay, excellent point.
											So there was a lucrative market
in that society in convincing all people
											they had to look a certain way
to even have a sex life, right?
											But girls, especially, were expected
to be ""sexy"" while avoiding
											being perceived as ""sluts""
for being sexual. Right?
											So there's that shame piece
we've heard about.
									","
											Doğru mu?
											Doğru, Bradley, tamam, harika bir nokta.
											Yani bu toplumda, bütün insanları bir
seks hayatına sahip olmaları için belirli
											bir şekilde gözükmeleri gerektiğine ikna
eden karlı bir piyasa vardı, değil mi?
											Ama özellikle kızların ""kaşar"" olarak
algılanmaktan sakınarak
											""seksi"" olmaları bekleniyordu.
											İşte önceden duyduğumuz
utanç kısmı bu.
									","
											Oui ?
											Bien, Bradley, oui, très bon point.
											Il y avait donc un marché lucratif
dans la société pour convaincre les gens
											qu'ils devaient avoir un certain physique
pour avoir une vie sexuelle, d'accord ?
											Mais les filles, en particulier, devaient
être « sexy » tout en évitant
											d'être vues comme des « salopes »
car elles étaient sexuelles. D'accord ?
											C'est la partie honte
dont on a déjà parlé.
									","One woman, five characters, and a sex lesson from the future",Sarah Jones,25:28,"culture,future,humor,performance,sex"
"
","
","
","One woman, five characters, and a sex lesson from the future",Sarah Jones,25:28,"culture,future,humor,performance,sex"
"
											Yes.
											Valerie, right? Okay, very good.
											Of course, men were having sex as well,
											but you'll remember from the reading,
											what were male sluts called?
											Very good, they were called men.
											(Laughter) (Applause)
											So not easy living in
a world like that, right?
											Though it was not all bad news either.
											Most women in the early 2000s
considered themselves empowered,
											and men generally felt they were
also evolved in this area,
											and, in fact, most people would have
been aware of issues
											like human trafficking, for example,
											but they would have seen that
as quite separate
											from more recreational
adult entertainment.
											And so we'll just very briefly, class —
we don't have a lot of time —
											we'll just very briefly hear from a man
											on our topic at this stage.
											So this next subject was interviewed
on the night of his bachelor party.
									","
											Evet.
											Valerie, değil mi? Tamam, çok iyi.
											Tabii ki erkekler de seks yapıyordu,
											ama okumadan hatırlarsınız,
											erkek kaşarlara ne deniyordu?
											Çok iyi, onlara sadece erkek deniyordu.
											(Kahkaha) (Alkış)
											Yani böyle bir dünyada yaşamak kolay
değil, değil mi?
											Ama sırf kötü haber de değildi yani.
											2000lerde birçok kadın kendilerini
güçlü olarak değerlendiriyordu
											ve erkekler de genelde bu alanda evrim
geçirdiklerini düşünüyordu
											ve aslına bakarsanız birçok kişi, örneğin
köle ticareti gibi
											konulardan haberdardı
											ama bunu dinlenme amaçlı
yetişkin eğlencesinden
											farklı algılarlardı.
											Sınıf şimdi kısaca, —çok vaktimiz yok—
											kısaca konumuzla ilgili
											bir erkeği dinleyeceğiz.
											Bu adamın röportajı, bekarlığa
veda partisinin gecesinde yapıldı.
									","
											Oui.
											Valérie, oui ? D'accord, très bien.
											Bien sûr, les hommes
avaient du sexe aussi,
											mais vous vous rappelez de la leçon,
											comment on appelait les salopes mâles ?
											Très bien, on les appelait des hommes.
											(Rires) (Applaudissements)
											Donc ce n'était pas facile de vivre
dans un monde comme ça, d'accord?
											Mais, il n'y avait pas que
des mauvaises nouvelles.
											Beaucoup de femmes des années 2000
se considéraient émancipées,
											et les hommes se sentaient en général
également évolués dans ce domaine,
											en fait, la majorité des gens
étaient conscients des problèmes
											tels que la traite des personnes,
											mais ils voyaient ça
comme étant séparé
											des divertissements pour adultes
plus récréatifs.
											Et donc nous allons juste brièvement —
nous n'avons pas beaucoup de temps —
											nous allons juste
brièvement écouter un homme
											parler de notre sujet à ce stade.
											Donc le prochain a été interrogé la nuit
de son enterrement de vie de garçon.
									","One woman, five characters, and a sex lesson from the future",Sarah Jones,25:28,"culture,future,humor,performance,sex"
"
","
","
","One woman, five characters, and a sex lesson from the future",Sarah Jones,25:28,"culture,future,humor,performance,sex"
"
											Dude, can you, all right,
can you just keep it down?
											I'm trying to talk to BERT right now.
											Oh, your name's not BERT.
											BERT's the name of the, oh, all right.
											No, no, no, totally, it's totally fine.
I'm mostly sober,
											so I just want to be helpful.
											Yeah, and I totally believe in causes,
yeah, like, all that stuff.
											(Laughter)
											And actually, I'm wearing Toms right now.
											Yeah, Toms, like, the shoes,
											like, you buy a pair and then
a kid in Africa gets clean water.
											Yeah. Totally.
											But what was the question again? Sorry.
									","
											Adamım, biraz şey yapar mısın, neyse,
biraz sessiz olur musun ya?
											Şu an BERT ile konuşmaya çalışıyorum.
											Haa, ismin BERT değil.
											BERT şeyin ismi, haa, anladım.
											Yoo, yoo, yoo! Tabiki olur.
Büyük oranda ayığım
											ve yardımcı olmak istiyorum.
											Ve kesinlikle böyle amaçlara filan,
böyle şeylere inanıyorum.
											(Kahkaha)
											Ve aslına bakarsanız şu an Toms giyiyorum.
											Evet, Toms, ayakkabı olanlar, hani şey bir
çift
											satın alıyorsunuz sonra Afrika'da
bir çocuk temiz su alıyor falan.
											Evet ya. Kesinlikle.
											Soruyu tekrar alabilir miyim?
Kusura bakmayın.
									","
											Mec, tu peux, OK,
tu peux juste baisser un peu ?
											J'essaye de parler à BERT là.
											Oh, ton nom c'est pas BERT.
											BERT c'est le nom du, oh, d'accord.
											Non, non, parfait, tout va bien.
je suis presque sobre,
											donc je veux juste aider.
											Ouais, je suis à fond dans les causes,
ouais ce style de trucs.
											(Rires)
											Et en fait je porte des Toms là.
											Ouais, Toms, les chaussures,
											style, tu achètes une paire et ensuite
un gamin en Afrique a de l'eau potable.
											Ouais. À fond.
											Mais c'était quoi la question déjà ?
Désolé.
									","One woman, five characters, and a sex lesson from the future",Sarah Jones,25:28,"culture,future,humor,performance,sex"
"
","
","
","One woman, five characters, and a sex lesson from the future",Sarah Jones,25:28,"culture,future,humor,performance,sex"
"
											Of course I believe in women's rights.
I'm marrying a woman.
											(Laughter)
											No, but I mean, like, just because
I'm in a strip club parking lot
											doesn't mean that I'm, like,
a sexist or whatever.
											My fiancee is totally amazing,
she's totally a strong girl, woman,
											smart woman, like, the whole thing.
									","
											Tabii ki kadın haklarına inanıyorum.
Bir kadınla evleniyorum!
											(Kahkaha)
											Hayır, yani demek istediğim, sadece
bir striptiz kulübünün park yerinde olmam
											seksist falan olduğumu göstermez.
											Nişanlım müthiştir, yani kesinlikle
güçlü bir kız, kadındır
											akıllı bir kadın, yani, tamamen. Evet,
									","
											Sûr, je suis pour les droits des femmes.
Je me marie avec une femme.
											(Rires)
											Non mais, juste parce que je suis
sur le parking d'un club de strip tease,
											ça veut pas dire que je suis, genre,
un macho ou un truc du genre.
											Ma fiancée est juste incroyable,
c'est une fille forte, une femme forte,
											intelligente et tout.
									","One woman, five characters, and a sex lesson from the future",Sarah Jones,25:28,"culture,future,humor,performance,sex"
"
","
","
","One woman, five characters, and a sex lesson from the future",Sarah Jones,25:28,"culture,future,humor,performance,sex"
"
											Yeah, she knows I'm here. She's probably
at a strip club herself right now,
											like, as a joke, same as me.
									","
											burada olduğumu biliyor. O da şimdi
muhtemelen bir striptiz kulübündedir,
											yani bir şaka olarak, aynı benim gibi.
									","
											Ouais, elle sait que je suis là. Elle est
probablement dans un club de strip aussi,
											mais pour blaguer, comme moi.
									","One woman, five characters, and a sex lesson from the future",Sarah Jones,25:28,"culture,future,humor,performance,sex"
"
","
","
","One woman, five characters, and a sex lesson from the future",Sarah Jones,25:28,"culture,future,humor,performance,sex"
