en,es,fr,title,speaker,duration,tags
"
											Perhaps more surprisingly, the same type of theory
											applies to biology and medicine,
											parturition, the act of giving birth, epileptic seizures.
											From seven months of pregnancy, a mother
											starts to feel episodic precursory contractions of the uterus
											that are the sign of these maturations
											toward the instability, giving birth to the baby,
											the dragon-king.
											So if you measure the precursor signal,
											you can actually identify pre- and post-maturity problems
											in advance.
											Epileptic seizures also come in a large variety of size,
											and when the brain goes to a super-critical state,
											you have dragon-kings which have a degree of predictability
											and this can help the patient to deal with this illness.
											We have applied this theory to many systems,
											landslides, glacier collapse,
											even to the dynamics of prediction of success:
											blockbusters, YouTube videos, movies, and so on.
											But perhaps the most important application
											is for finance, and this theory
											illuminates, I believe, the deep reason
											for the financial crisis that we have gone through.
											This is rooted in 30 years of history of bubbles,
											starting in 1980, with the global bubble
											crashing in 1987,
											followed by many other bubbles.
											The biggest one was the ""new economy"" Internet bubble
											in 2000, crashing in 2000,
											the real estate bubbles in many countries,
											financial derivative bubbles everywhere,
											stock market bubbles also everywhere,
											commodity and all bubbles, debt and credit bubbles —
											bubbles, bubbles, bubbles.
									","
											Quizás más sorprendente aún, es que el mismo tipo de teoría
											se puede aplicar en biología y en medicina;
											en el parto, el acto de dar a luz, en las crisis epilépticas.
											A los siete meses de gestación, una madre
											empieza a sentir contracciones precursoras episódicas del útero;
											señales de maduración
											hacia la inestabilidad, para dar a luz;
											el dragón rey.
											Así que al medir la señal precursora,
											se pueden identificar problemas pre y post-maduración,
											de antemano.
											Las crisis epilépticas también se dan con una gran variedad de intensidades,
											y cuando el cerebro llega a un estado supercrítico,
											aparecen dragones reyes con un cierto grado de previsibilidad,
											lo cual puede ayudar al paciente a lidiar con la enfermedad.
											Hemos aplicado esta teoría en muchos sistemas;
											deslizamientos de tierra, colapsos de glaciares,
											incluso en la dinámica de la predicción del éxito:
											ventas de taquilla, videos de YouTube, películas, etc.
											Pero quizás la más importante aplicación
											es en las finanzas. Esta teoría
											ilumina, en mi opinión, la razón profunda
											de las crisis financieras que hemos atravesado.
											Esto tiene sus raíces en 30 años de historia de burbujas,
											a partir de 1980, con la burbuja global
											que colapsó en 1987,
											seguida por muchas otras.
											La más grande fue la burbuja de la ""nueva economía"" de Internet
											en el 2000, que colapsó ese año,
											las inmobiliarias en muchos países,
											las de productos financieros en todo el mundo,
											burbujas bursátiles también por todas partes,
											de materias primas y todas las demás, de deuda y crédito, burbujas...
											burbujas, burbujas, burbujas.
									","
											Peut-être plus surprenant, 
le même type de théorie
											s'applique à la biologie et la médecine,
											la parturition, l'accouchement, 
les crises d'épilepsie.
											À partir de sept mois de grossesse, 
une mère
											commence à sentir des contractions 
épisodiques de l'utérus
											qui sont le signe de ces maturations
											vers l'instabilité, donnant naissance à l'enfant,
											le roi-dragon.
											Donc, si vous mesurez le signal précurseur,
											en fait, vous pouvez identifier 
les problèmes pré- et post- maturité
											à l'avance.
											Les crises épileptiques sont aussi 
de tailles très diverses
											et quand le cerveau va vers un état supercritique,
											vous avez rois-dragons, 
qui ont un degré de prédictabilité
											et ça peut aider le patient 
à faire face à cette maladie.
											Nous avons appliqué 
cette théorie à de nombreux systèmes,
											les glissements de terrain, 
l'effondrement d'un glacier,
											même à la dynamique 
de la prédiction de la réussite :
											les grosses productions, les vidéos YouTube, 
films et ainsi de suite.
											Mais peut-être que l'application 
la plus importante
											est dans la finance et cette théorie
											éclaire, je crois, la raison profonde
											de la crise financière que nous avons traversée.
											C'est enraciné dans les 30 ans 
d'histoire de bulles,
											à partir de 1980, avec la bulle mondiale
											qui éclate en 1987,
											suivie de nombreuses autres bulles.
											La plus grande était la bulle internet 
de la « nouvelle économie »
											en 2000, qui a éclaté en 2000,
											les bulles immobilières 
dans de nombreux pays,
											des bulles financières dérivées partout,
											des bulles de marché boursier 
également partout,
											des bulles sur des produits de base 
et toutes les bulles de dettes et crédits —
											des bulles, des bulles, des bulles.
									",How we can predict the next financial crisis,Didier Sornette,17:01,"business,economics,global issues,prediction,markets"
"
","
","
",How we can predict the next financial crisis,Didier Sornette,17:01,"business,economics,global issues,prediction,markets"
"
											We had a global bubble.
											This is a measure of global overvaluation
											of all markets, expressing what I call
											an illusion of a perpetual money machine
											that suddenly broke in 2007.
									","
											Tuvimos una burbuja global.
											Fue una medida de sobrevaluación global
											de todos los mercados, que mostraban lo que yo llamo
											la ilusión de la máquina de dinero perpetuo
											que colapsó repentinamente en 2007.
									","
											Nous avions une bulle mondiale.
											C'est une mesure de surévaluation mondiale
											de tous les marchés,
en exprimant ce que j'appelle
											l'illusion d'une machine à fric perpétuelle
											qui a éclaté tout d'un coup en 2007.
									",How we can predict the next financial crisis,Didier Sornette,17:01,"business,economics,global issues,prediction,markets"
"
","
","
",How we can predict the next financial crisis,Didier Sornette,17:01,"business,economics,global issues,prediction,markets"
"
											The problem is that we see the same process,
											in particular through quantitative easing,
											of a thinking of a perpetual money machine nowadays
											to tackle the crisis since 2008 in the U.S., in Europe,
											in Japan.
											This has very important implications
											to understand the failure of quantitative easing
											as well as austerity measures
											as long as we don't attack the core,
											the structural cause of this perpetual money machine thinking.
									","
											El problema es que ahora estamos viendo el mismo proceso,
											en particular en la política monetaria,
											con la idea de una máquina de dinero perpetuo
											para abordar la crisis desde el año 2008 en los EE.UU., en Europa,
											en Japón.
											Esto tiene implicaciones muy importantes
											para entender el fracaso de la política monetaria
											y de las medidas de austeridad;
											mientras no ataquemos de raíz
											la causa estructural de esta idea de la máquina de dinero perpetuo.
									","
											Le problème est que 
nous voyons le même processus,
											en particulier à travers 
un assouplissement quantitatif,
											d'une idée d'une machine à fric 
perpétuelle de nos jours
											pour lutter contre la crise depuis 2008 
aux États-Unis, en Europe,
											au Japon.
											Cela a des implications très importantes
											pour comprendre l'échec 
de l'assouplissement quantitatif
											ainsi que des mesures d'austérité
											tant que nous ne nous attaquons pas au cœur
											de la cause structurelle de cette idée 
de machine à fric perpétuelle.
									",How we can predict the next financial crisis,Didier Sornette,17:01,"business,economics,global issues,prediction,markets"
"
","
","
",How we can predict the next financial crisis,Didier Sornette,17:01,"business,economics,global issues,prediction,markets"
"
											Now, these are big claims.
											Why would you believe me?
											Well, perhaps because, in the last 15 years
											we have come out of our ivory tower,
											and started to publish ex ante —
											and I stress the term ex ante, it means ""in advance"" —
											before the crash confirmed
											the existence of the bubble or the financial excesses.
											These are a few of the major bubbles
											that we have lived through in recent history.
											Again, many interesting stories for each of them.
											Let me tell you just one or two stories
											that deal with massive bubbles.
									","
											Estas son grandes afirmaciones.
											¿Por qué habrían de creerme?
											Bueno, tal vez porque, en los últimos 15 años
											nos hemos salido de la torre de marfil,
											y hemos comenzado a publicar ex ante
											y subrayo el término ex ante, que significa ""por adelantado"",
											antes de que el colapso confirme
											la existencia de la burbuja o de los excesos financieros.
											Estas son algunas de las grandes burbujas
											que hemos sufrido en la historia reciente.
											Una vez más, muchas historias interesantes para cada una de ellas.
											Déjenme contarles una o dos historias
											que tratan de enormes burbujas.
									","
											Ce sont de grandes revendications.
											Pourquoi me croiriez-vous ?
											Eh bien, peut-être parce que, 
au cours des 15 dernières années
											nous sommes sortis de notre tour d'Ivoire,
											et avons commencé à publier ex ante—
											et j'insiste sur le terme ex ante, il signifie « à l'avance » —
											avant que le krach n'ait confirmé
											l'existence de la bulle ou des excès financiers.
											Voici quelques-unes des grandes bulles
											que nous avons traversées 
dans l'histoire récente.
											Encore une fois, de nombreuses histoires 
intéressantes pour chacune d'elles.
											Laissez-moi vous raconter 
juste une ou deux histoires
											qui traitent des bulles massives.
									",How we can predict the next financial crisis,Didier Sornette,17:01,"business,economics,global issues,prediction,markets"
"
","
","
",How we can predict the next financial crisis,Didier Sornette,17:01,"business,economics,global issues,prediction,markets"
"
											We all know the Chinese miracle.
											This is the expression of the stock market
											of a massive bubble, a factor of three,
											300 percent in just a few years.
											In September 2007,
											I was invited as a keynote speaker of a macro hedge fund
											management conference,
											and I showed to the conference a prediction
											that by the end of 2007, this bubble
											would change regime.
											There might be a crash. Certainly not sustainable.
											Now, how do you believe the very smart,
											very motivated, very informed macro hedge fund managers
											reacted to this prediction?
											You know, they had made billions
											just surfing this bubble until now.
											They told me, ""Didier,
											yeah, the market might be overvalued,
											but you forget something.
											There is the Beijing Olympic Games coming
											in August 2008, and it's very clear that
											the Chinese government is controlling the economy
											and doing what it takes
											to also avoid any wave and control the stock market.""
									","
											Todos conocemos el milagro chino.
											Esta es la expresión de la enorme burbuja
											en el mercado de valores; un factor de tres,
											300% en pocos años.
											En septiembre de 2007
											fui invitado como orador a un congreso de macro
											gestores de fondos de cobertura
											y mostré la predicción
											de que a finales de 2007, esta burbuja
											cambiaría de tendencia.
											Podría haber un colapso. Ciertamente no sostenible.
											¿Cómo creen que los muy inteligentes,
											motivados, e informados gestores de fondos
											reaccionaron a esta predicción?
											Habían hecho miles de millones
											simplemente navegando sobre esta burbuja hasta ese momento.
											Me dijeron, ""Didier,
											sí, el mercado podría estar sobrevaluado,
											pero olvidas algo.
											Vienen los Juegos Olímpicos de Beijing
											en agosto de 2008 y está muy claro que
											el gobierno chino está controlando la economía
											y haciendo lo que se necesita
											para evitar cualquier movimiento, está controlando el mercado de valores"".
									","
											Nous connaissons tous le miracle chinois.
											C'est l'expression du marché boursier
											d'une énorme bulle, un facteur de trois,
											300 % en seulement quelques années.
											En septembre 2007,
											j'ai été invité comme conférencier principal
											à la conférence de management 
d'un fonds spéculatif macro
											et j'ai présenté à la conférence une prédiction
											qu'à la fin de 2007, cette bulle
											changerait de régime.
											Il pourrait y avoir un krach. 
Certainement pas durable.
											Maintenant, comment croyez-vous que
les managers du macro fonds spéculatif
											très intelligents, très motivés, très éclairés
											ont réagi à cette prédiction ?
											Vous savez, ils avaient gagné des milliards
											rien qu'en surfant sur cette bulle jusque là.
											Ils m'ont dit, ""Didier,
											oui, il se pourrait que le marché soit surévalué,
											mais vous oubliez quelque chose.
											Il y a les Jeux olympiques de Beijing bientôt
											en août 2008, et il est très clair que
											le gouvernement chinois contrôle l'économie
											et fait ce qu'il faut
											pour également éviter toute vague 
et contrôler le marché boursier. »
									",How we can predict the next financial crisis,Didier Sornette,17:01,"business,economics,global issues,prediction,markets"
"
","
","
",How we can predict the next financial crisis,Didier Sornette,17:01,"business,economics,global issues,prediction,markets"
"
											Three weeks after my presentation,
											the markets lost 20 percent
											and went through a phase of volatility,
											upheaval, and a total market loss of
											70 percent until the end of the year.
									","
											Tres semanas después de mi presentación,
											los mercados perdieron 20%
											y pasaron por una fase de volatilidad,
											agitación y una pérdida total del mercado del
											70% hacia finales del año.
									","
											Trois semaines après ma présentation,
											les marchés ont perdu 20 %
											et ont traversé une phase d'instabilité,
											un bouleversement et 
une perte de marché totale de
											70 % jusqu'à la fin de l'année.
									",How we can predict the next financial crisis,Didier Sornette,17:01,"business,economics,global issues,prediction,markets"
"
","
","
",How we can predict the next financial crisis,Didier Sornette,17:01,"business,economics,global issues,prediction,markets"
"
											So how can we be so collectively wrong
											by misreading or ignoring the science
											of the fact that when an instability has developed,
											and the system is ripe, any perturbation
											makes it essentially impossible to control?
									","
											Entonces, ¿cómo podemos estar tan colectivamente mal
											por malinterpretar o hacer caso omiso de la ciencia;
											del hecho de que cuando se desarrolla una inestabilidad,
											y el sistema está maduro, cualquier perturbación
											lo hace esencialmente incontrolable?
									","
											Alors, comment peut-on avoir 
si collectivement tort
											en faisant une erreur de lecture
ou en ignorant la science
											du fait que lorsqu'une instabilité s'est développée,
											et que le système est mûr, toute perturbation
											le rend essentiellement impossible à contrôler ?
									",How we can predict the next financial crisis,Didier Sornette,17:01,"business,economics,global issues,prediction,markets"
"
","
","
",How we can predict the next financial crisis,Didier Sornette,17:01,"business,economics,global issues,prediction,markets"
"
											The Chinese market collapsed, but it rebounded.
											In 2009, we also identified that this new bubble,
											a smaller one, was unsustainable,
											so we published again a prediction, in advance,
											stating that by August 2009, the market will correct,
											will not continue on this track.
											Our critics, reading the prediction,
											said, ""No, it's not possible.
											The Chinese government is there.
											They have learned their lesson. They will control.
											They want to benefit from the growth.""
											Perhaps these critics have not learned their lesson previously.
											So the crisis did occur. The market corrected.
									","
											Se derrumbó el mercado chino, pero se recuperó.
											En 2009, identificamos también que esta nueva burbuja,
											una versión más pequeña, era insostenible,
											así que publicamos otra vez una predicción, por adelantado,
											afirmando que hacia agosto de 2009, el mercado se corregiría,
											y no continuaría la tendencia.
											Nuestros críticos leyeron la predicción
											y dijeron, ""No, no es posible.
											El gobierno chino está allí.
											Han aprendido su lección. Lo controlarán.
											Quieren aprovechar el crecimiento"".
											Tal vez estos críticos no habían aprendido su lección anterior.
											Entonces ocurrió la crisis. El mercado se corrigió.
									","
											Le marché chinois s'est effondré, 
mais il a rebondi.
											En 2009, nous avons également identifié 
que cette nouvelle bulle,
											plus petite, était insoutenable,
											donc, nous avons publié 
encore une prédiction, à l'avance,
											indiquant qu'en août 2009, 
le marché corrigerait,
											ne continuerait pas sur cette voie.
											Nos critiques, en lisant la prédiction,
											ont dit, « Non, ce n'est pas possible.
											Le gouvernement chinois est là.
											Ils ont appris leur leçon.
Ils vont contrôler.
											Ils veulent bénéficier de la croissance. »
											Peut-être que ces critiques n'ont pas appris 
leur leçon précédemment.
											La crise s'est donc produite. 
Le marché a corrigé.
									",How we can predict the next financial crisis,Didier Sornette,17:01,"business,economics,global issues,prediction,markets"
"
","
","
",How we can predict the next financial crisis,Didier Sornette,17:01,"business,economics,global issues,prediction,markets"
"
											The same critics then said, ""Ah, yes,
											but you published your prediction.
											You influenced the market.
											It was not a prediction.""
									","
											Los mismos críticos dijeron: ""Ah, sí,
											pero publicaste tu predicción.
											Influiste en el mercado.
											No fue una predicción"".
									","
											Les mêmes critiques ont alors dit : « Ah, oui,
											mais vous avez publié votre prédiction.
											Vous avez influencé le marché.
											Ce n'était pas une prédiction. »
									",How we can predict the next financial crisis,Didier Sornette,17:01,"business,economics,global issues,prediction,markets"
"
","
","
",How we can predict the next financial crisis,Didier Sornette,17:01,"business,economics,global issues,prediction,markets"
"
											Maybe I am very powerful then.
											Now, this is interesting.
											It shows that it's essentially impossible until now
											to develop a science of economics
											because we are sentient beings who anticipate
											and there is a problem of self-fulfilling prophesies.
									","
											Tal vez entonces soy muy poderoso.
											Bien, esto es interesante.
											Demuestra que es esencialmente imposible hasta ahora
											desarrollar la ciencia de la economía
											porque somos seres conscientes que anticipamos
											y existe un problema de profecías autogeneradas.
									","
											Alors peut-être que je suis très puissant.
											Maintenant, ce qui est intéressant.
											Ça montre qu'il est essentiellement impossible 
jusqu'à présent
											de développer une science de l'économie
											parce que nous sommes 
des êtres sensibles qui anticipent
											et il y a un problème de prophétie 
qui s'auto-réalisent.
									",How we can predict the next financial crisis,Didier Sornette,17:01,"business,economics,global issues,prediction,markets"
"
","
","
",How we can predict the next financial crisis,Didier Sornette,17:01,"business,economics,global issues,prediction,markets"
"
											So we invented a new way of doing science.
											We created the Financial Bubble Experiment.
											The idea is the following. We monitor the markets.
											We identify excesses, bubbles.
											We do our work. We write a report
											in which we put our prediction of the critical time.
											We don't release the report. It's kept secret.
											But with modern encrypting techniques,
											we have a hash, we publish a public key,
											and six months later, we release the report,
											and there is authentication.
											And all this is done on an international archive
											so that we cannot be accused of just releasing the successes.
									","
											Así que hemos inventado una nueva forma de hacer ciencia.
											Creamos el experimento de la burbuja financiera.
											La idea es la siguiente. Vigilamos los mercados.
											Identificamos los excesos, las burbujas.
											Hacemos nuestro trabajo. Escribimos un informe
											en el que ponemos nuestra predicción del momento crítico.
											No publicamos el informe. Se mantiene secreto.
											Pero con técnicas modernas de cifrado,
											lo tenemos encriptado y publicamos la clave.
											Seis meses después, liberamos el informe,
											y hay una validación.
											Todo esto se hace en un archivo internacional
											para que no puedan acusarnos de liberar solo los éxitos.
									","
											Donc, nous avons inventé une nouvelle façon 
de faire des sciences.
											Nous avons créé l'expérience de bulle financière.
											L'idée est la suivante. 
Nous surveillons les marchés.
											Nous identifions les excès, les bulles.
											Nous faisons notre travail. 
Nous écrivons un rapport
											dans lequel nous mettons 
notre prédiction du temps critique.
											Nous ne publions pas le rapport. 
Il est gardée secret.
											Mais avec des techniques de cryptage modernes,
											nous avons un hachage, 
nous publions une clé publique,
											et six mois plus tard, 
nous publions le rapport,
											et il y a l'authentification.
											Et tout cela se fait sur une archive internationale
											afin que nous ne puissions pas être accusés 
de ne publier que les réussites.
									",How we can predict the next financial crisis,Didier Sornette,17:01,"business,economics,global issues,prediction,markets"
"
","
","
",How we can predict the next financial crisis,Didier Sornette,17:01,"business,economics,global issues,prediction,markets"
