en,fr,es,title,speaker,duration,tags
"
","
","
",The power to think ahead in a reckless age,Bina Venkataraman,13:10,"humanity,community,future,history,family,memory,world cultures,culture,society"
"
											So in the winter of 2012,
											I went to visit my grandmother's house
											in South India,
											a place, by the way,
											where the mosquitos have a special taste
for the blood of the American-born.
									","
											Pendant l'hiver 2012,
											je suis allée chez ma grand-mère
											dans le Sud de l'Inde.
											Un endroit, au fait, où les moustiques 
ont un penchant particulier
											pour le sang des gens
d'origine américaine.
									","
											En el invierno de 2012,
											fui a visitar la casa de mi abuela
											en en sur de India,
											donde, dicho sea de paso,
											los mosquitos tienen un apetito especial
por la sangre estadounidense.
									",The power to think ahead in a reckless age,Bina Venkataraman,13:10,"humanity,community,future,history,family,memory,world cultures,culture,society"
"
","
","
",The power to think ahead in a reckless age,Bina Venkataraman,13:10,"humanity,community,future,history,family,memory,world cultures,culture,society"
"
											(Laughter)
									","
											(Rires)
									","
											(Risas)
									",The power to think ahead in a reckless age,Bina Venkataraman,13:10,"humanity,community,future,history,family,memory,world cultures,culture,society"
"
","
","
",The power to think ahead in a reckless age,Bina Venkataraman,13:10,"humanity,community,future,history,family,memory,world cultures,culture,society"
"
											No joke.
									","
											Ce n'est pas une blague.
									","
											No es chiste.
									",The power to think ahead in a reckless age,Bina Venkataraman,13:10,"humanity,community,future,history,family,memory,world cultures,culture,society"
"
","
","
",The power to think ahead in a reckless age,Bina Venkataraman,13:10,"humanity,community,future,history,family,memory,world cultures,culture,society"
"
											When I was there,
I got an unexpected gift.
											It was this antique instrument
											made more than a century ago,
											hand-carved from a rare wood,
											inlaid with pearls
											and with dozens of metal strings.
											It's a family heirloom,
											a link between my past,
											the country where my parents were born,
											and the future,
											the unknown places I'll take it.
									","
											Quand j'étais là-bas, 
j'ai eu un cadeau inattendu.
											C'était cet ancien instrument
											fabriqué il y a plus d'un siècle,
											taillé à la main à partir d'un bois rare
											incrusté de perles et
											avec des dizaines de cordes métalliques.
											C'est un bien de famille,
											un lien entre mon passé,
											le pays où mes parents sont nés,
											et le futur,
											les endroits inconnus où je l'emmènerai.
									","
											Durante mi estadía,
recibí un regalo inesperado.
											Este instrumento antiguo
											fabricado hace más de un siglo,
											tallado a mano en una madera poco común,
											decorado con perlas
											y con decenas de cuerdas de metal.
											Es una reliquia familiar,
											un lazo entre mi pasado,
											el país donde nacieron mis padres,
											y el futuro,
											los lugares adonde voy a llevarlo.
									",The power to think ahead in a reckless age,Bina Venkataraman,13:10,"humanity,community,future,history,family,memory,world cultures,culture,society"
"
","
","
",The power to think ahead in a reckless age,Bina Venkataraman,13:10,"humanity,community,future,history,family,memory,world cultures,culture,society"
"
											I didn't actually realize it
at the time I got it,
											but it would later become
a powerful metaphor for my work.
									","
											Je n'avais pas réalisé,
au moment où je l'ai reçu,
											qu'il deviendrait plus tard
une puissante métaphore pour mon travail.
									","
											Cuando me lo dieron no tenía idea
											de que un día se convertiría
en una metáfora de mi trabajo.
									",The power to think ahead in a reckless age,Bina Venkataraman,13:10,"humanity,community,future,history,family,memory,world cultures,culture,society"
"
","
","
",The power to think ahead in a reckless age,Bina Venkataraman,13:10,"humanity,community,future,history,family,memory,world cultures,culture,society"
"
											We all know the saying,
											""There's no time like the present.""
											But nowadays, it can feel
like there's no time but the present.
											What's immediate and ephemeral
seems to dominate our lives,
											our economy and our politics.
											It's so easy to get caught up
in the number of steps we took today
											or the latest tweet
from a high-profile figure.
											It's easy for businesses to get caught up
in making immediate profits
											and neglect what's good
for future invention.
											And it's far too easy
for governments to stand by
											while fisheries and farmland are depleted
											instead of conserved
to feed future generations.
											I have a feeling that, at this rate,
											it's going to be hard for our generation
to be remembered as good ancestors.
											If you think about it,
our species evolved to think ahead,
											to chart the stars,
											dream of the afterlife,
											sow seeds for later harvest.
											Some scientists call this superpower
that we have ""mental time travel,""
											and it's responsible for pretty much
everything we call human civilization,
											from farming to the Magna Carta
											to the internet —
											all first conjured in the minds of humans.
									","
											On connaît tous le proverbe
											« il ne faut pas remettre au lendemain
ce qu’on peut faire le jour même. »
											Mais de nos jours, je sens qu’il n’y a
plus de lendemain, rien que le présent.
											Ce qui est immédiat et éphémère 
semble dominer nos vies,
											notre économie et notre politique.
											Il est si facile d’être happé par le 
nombre de décisions prises aujourd’hui,
											ou par le dernier tweet
d'une personnalité en vue.
											Il est facile pour les entreprises
d’être tenues par les profits immédiats
											et de négliger ce qui est bon
pour l'innovation future.
											Et c’est beaucoup trop facile pour
les gouvernements de ne rien faire,
											alors que la mer et les terres cultivables
sont appauvries,
											au lieu de les préserver
pour nourrir les générations futures.
											J’ai le sentiment qu’à ce rythme,
il va être difficile qu’on se souvienne
											de notre génération 
comme de bons ancêtres.
											Si vous y réfléchissez, 
notre espèce a évolué
											pour penser l'avenir,
pour anticiper les étoiles,
											rêver de l’au-delà, semer des graines
pour la prochaine moisson.
											Certains scientifiques appellent
ce pouvoir magique que nous avons
											le « voyage temporel mental »
											et cela a permis presque
tout ce que nous appelons
											la civilisation humaine,
de l'agriculture à la Magna Carta,
											à Internet –
											tout cela étant d'abord apparu
dans les esprits des humains.
									","
											Ya conocen el dicho:
											""El mejor momento es el presente"".
											Pero, hoy en día, a veces parece
que solo hay tiempo para el presente.
											Lo inmediato, lo efímero
parece dominar nuestras vidas,
											nuestra economía y nuestra política.
											Es tan fácil enfrascarnos
en la cantidad de pasos que dimos hoy
											o en el último tweet
de alguna figura prominente.
											Para las empresas, es fácil
dejarse llevar por el beneficio inmediato
											y dejar de lado cosas
que son buenas para el futuro.
											Y a los Gobiernos les resulta muy fácil
quedarse de brazos cruzados
											mientras se agotan los recursos
marítimos y agropecuarios,
											en lugar de preservarlos
para alimentar a futuras generaciones.
											Tengo la impresión de que, a este ritmo,
											es difícil que nuestra generación
pase a la historia como un buen ancestro.
											Pensándolo bien, nuestra especie
evolucionó para pensar a futuro,
											para estudiar las estrellas,
											soñar con la vida después de la muerte,
											sembrar semillas para cosechar después.
											Para algunos científicos, este superpoder
de ""viajar mentalmente por el tiempo"",
											es la causa de prácticamente todo
lo que llamamos civilización humana.
											Desde la agricultura,
pasando por la Carta Magna
											y hasta hasta Internet:
											todo fue concebido por la mente humana.
									",The power to think ahead in a reckless age,Bina Venkataraman,13:10,"humanity,community,future,history,family,memory,world cultures,culture,society"
"
","
","
",The power to think ahead in a reckless age,Bina Venkataraman,13:10,"humanity,community,future,history,family,memory,world cultures,culture,society"
"
											But let's get real:
											if we look around us today,
											we don't exactly seem to be
using this superpower quite enough,
											and that begs the question: Why not?
											What's wrong is how our communities,
businesses and institutions are designed.
											They're designed in a way
that's impairing our foresight.
											I want to talk to you
about the three key mistakes
											that I think we're making.
									","
											Mais soyons réalistes :
											si nous regardons autour de nous
aujourd'hui,
											il ne semble pas vraiment que nous 
utilisions assez ce superpouvoir,
											d'où la question : pourquoi ?
											Ce qui ne va pas, c’est la façon

											dont nos communautés, nos entreprises
et nos institutions sont conçues.
											Elles sont conçues d’une façon
qui perturbe notre anticipation.
											Je veux vous parler de trois erreurs clés
que, selon moi, nous commettons.
									","
											Pero, seamos realistas,
											si miramos a nuestro alrededor hoy en día
											parece que no estamos usando
este superpoder mucho que digamos.
											La pregunta obvia es: ¿por qué no?
											El error está en el diseño
											de nuestras comunidades,
empresas e instituciones.
											Están diseñadas de forma tal
que reducen con nuestra visión a futuro.
											Quiero hablarles
											de los tres principales errores
que creo que estamos cometiendo.
									",The power to think ahead in a reckless age,Bina Venkataraman,13:10,"humanity,community,future,history,family,memory,world cultures,culture,society"
"
","
","
",The power to think ahead in a reckless age,Bina Venkataraman,13:10,"humanity,community,future,history,family,memory,world cultures,culture,society"
"
											The first mistake is what we measure.
											When we look at the quarterly
profits of a company
											or its near-term stock price,
											that's often not a great measure
											of whether that company
is going to grow its market share
											or be inventive in the long run.
											When we glue ourselves to the test scores
that kids bring back from school,
											that's not necessarily
what's great for those kids' learning
											and curiosity in the long run.
											We're not measuring
what really matters in the future.
									","
											La première erreur est
ce que nous mesurons.
											Quand nous regardons les profits
trimestriels d'une entreprise,
											ou le cours à court terme de ses actions,
											ce n’est souvent pas une bonne mesure
											pour savoir si l'entreprise va 
accroître sa part de marché
											ou être innovante sur le long terme.
											Quand nous restons scotchés
sur les bulletins scolaires des enfants,
											ce n'est pas nécessairement ce qui est bon
pour leur apprentissage
											et leur curiosité sur le long terme.
											Nous ne mesurons pas ce qui compte
vraiment pour le futur.
									","
											El primer error es lo que medimos.
											Los resultados trimestrales de una empresa
											o el valor de sus acciones a corto plazo
											muchas veces no son un buen indicador
											de que vaya a aumentar
su cuota de mercado
											o de que vaya a ser
innovadora a largo plazo.
											Obsesionarnos con los resultados
de los exámenes escolares
											no es necesariamente lo mejor
para la educación y la curiosidad
											de los niños a largo plazo.
											No estamos midiendo lo que es
realmente importante para el futuro.
									",The power to think ahead in a reckless age,Bina Venkataraman,13:10,"humanity,community,future,history,family,memory,world cultures,culture,society"
"
","
","
",The power to think ahead in a reckless age,Bina Venkataraman,13:10,"humanity,community,future,history,family,memory,world cultures,culture,society"
"
											The second mistake we're making
that impairs our foresight
											is what we reward.
											When we celebrate a political leader
or a business leader
											for the disaster she just cleaned up
											or the announcement she just made,
											we're not motivating that leader
											to invest in preventing
those disasters in the first place,
											or to put down payments on the future
by protecting communities from floods
											or fighting inequality
											or investing in research and education.
									","
											Notre deuxième erreur,
qui nuit à notre anticipation,
											c'est ce que nous récompensons.
											Lorsque nous célébrons une leader 
politique ou une cheffe d'entreprise
											pour le désastre qu'elle vient juste 
de réparer
											ou pour la déclaration qu'elle vient 
juste de faire,
											nous ne motivons pas cette leader
											à investir prioritairement 
dans la prévention de ces désastres
											ou à diminuer les paiements futurs
en protégeant les communautés
											des inondations, en combattant l'inégalité
											ou en investissant
dans la recherche et l'éducation.
									","
											El segundo error que cometemos
y nos limita la visión a futuro
											es lo que recompensamos.
											Cuando celebramos
a un político o a un empresario
											por el desastre que acaba de arreglar
											o el anuncio que acaba de hacer,
											no estamos motivando a ese líder
											a que invierta en prevenir
esos desastres en primer lugar,
											o a que invierta en el futuro,
											ya sea protegiendo comunidades
en riesgo de inundación,
											luchando contra la desigualdad
											o haciendo inversiones
en investigación y educación.
									",The power to think ahead in a reckless age,Bina Venkataraman,13:10,"humanity,community,future,history,family,memory,world cultures,culture,society"
"
","
","
",The power to think ahead in a reckless age,Bina Venkataraman,13:10,"humanity,community,future,history,family,memory,world cultures,culture,society"
"
											The third mistake
that impairs our foresight
											is what we fail to imagine.
											Now, when we do think about the future,
											we tend to focus
on predicting exactly what's next,
											whether we're using horoscopes
or algorithms to do that.
											But we spend a lot less time imagining
all the possibilities the future holds.
											When the Ebola outbreak
emerged in 2014 in West Africa,
											public health officials around the world
had early warning signs
											and predictive tools
											that showed how
that outbreak might spread,
											but they failed to fathom that it would,
											and they failed to act
in time to intervene,
											and the epidemic grew
to kill more than 11,000 people.
											When people with lots of resources
and good forecasts
											don't prepare for deadly hurricanes,
											they're often failing to imagine
how dangerous they can be.
									","
											La troisième erreur nuisible
à notre anticipation
											est ce que nous n'arrivons pas à imaginer.
											Quand nous réfléchissons au futur,
											nous avons tendance à viser
la prédiction exacte de ce qui suit,
											que ce soit en utilisant des horoscopes
ou des algorithmes.
											Mais nous passons 
beaucoup moins de temps
											à imaginer toutes les possibilités
qu'offre le futur.
											Quand l'épidémie d'Ebola est apparue
en 2014, en Afrique de l'Ouest,
											les services de santé publics à travers
le monde avaient des signaux d'alarme
											et des outils de prédiction qui montraient
comment cette épidémie pouvait s'étendre,
											mais ils n'ont pas réussi à envisager
qu'elle allait se propager,
											et ils n'ont pas réussi 
à intervenir à temps
											et l'épidémie a crû et a tué
plus de 11 000 personnes.
											Quand des gens dotés
de nombreuses ressources
											et de bonnes prévisions
ne se préparent pas à ouragans meurtriers,
											souvent, ils n'arrivent pas à imaginer
combien ils peuvent être dangereux.
									","
											El tercer error que reduce
nuestra visión a futuro
											es lo que no somos capaces de imaginar.
											Cuando pensamos en el futuro,
											en general, tratamos de predecir
exactamente lo que va a suceder,
											ya sea con horóscopos o algoritmos.
											pero pasamos mucho menos tiempo imaginando
todas las posibilidades del futuro.
											Cuando estalló la crisis del ébola
en África occidental en 2014,
											los organismos públicos en todo el mundo
contaban con señales de alerta temprana
											y herramientas de predicción que mostraban
											cómo podría llegar a propagarse el virus.
											Pero no se dieron cuenta de que lo haría,
											no intervinieron a tiempo
											y la epidemia avanzó
hasta matar 11 000 personas.
											Cuando aquellos que tienen
amplios recursos y buenos pronósticos
											no se preparan para lidiar
con huracanes devastadores,
											es porque, muchas veces,
no son capaces de imaginar
											lo peligrosos que pueden llegar a ser.
									",The power to think ahead in a reckless age,Bina Venkataraman,13:10,"humanity,community,future,history,family,memory,world cultures,culture,society"
"
","
","
",The power to think ahead in a reckless age,Bina Venkataraman,13:10,"humanity,community,future,history,family,memory,world cultures,culture,society"
"
											Now, none of these mistakes
that I've described,
											as dismal as they might sound,
											are inevitable.
											In fact, they're all avoidable.
											What we need to make
better decisions about the future
											are tools that can aid our foresight,
											tools that can help us think ahead.
											Think of these as something
like the telescopes
											that ship captains of yore used
when they scanned the horizon.
											Only instead of for looking
across distance and the ocean,
											these tools are for looking
across time to the future.
											I want to share with you a
few of the tools
											that I've found in my research
											that I think can help us with foresight.
									","
											Maintenant, aucune de ces erreurs
que j'ai décrites,
											aussi lamentables soient-elles,
											n'est inévitable.
											En fait, on peut toutes les éviter.
											Pour mieux décider pour le futur,
											il nous faut des outils qui nous aident
à anticiper, à penser l'avenir.
											Pensez à ces genres de télescopes
											que les capitaines de navires d’antan
utilisaient pour scruter l'horizon.
											Si au lieu de regarder
à travers l'espace et l'océan,
											ces outils permettaient de regarder
à travers le temps et vers le futur.
											Je veux vous partager 
quelques outils
											découverts lors de ma recherche
											qui, selon moi, peuvent nous aider
en termes d'anticipation.
									","
											Ahora bien, estos errores,
											por más deprimentes que suenen,
											no son inevitables.
											En realidad, son todos evitables.
											Para tomar mejores decisiones,
necesitamos herramientas
											que nos ayuden a ver el futuro
y a pensar por adelantado.
											Piensen en los telescopios
											que usaban los marineros de antaño
cuando avistaban el horizonte.
											Solo que, en lugar de mirar
a la distancia en el océano,
											estas herramientas miran
en el tiempo hacia el futuro.
											Quiero hablarles de algunas herramientas
											que he encontrado en mis investigaciones
											y creo que pueden ayudarnos
con nuestra visión a futuro.
									",The power to think ahead in a reckless age,Bina Venkataraman,13:10,"humanity,community,future,history,family,memory,world cultures,culture,society"
"
","
","
",The power to think ahead in a reckless age,Bina Venkataraman,13:10,"humanity,community,future,history,family,memory,world cultures,culture,society"
"
											The first tool I want to share with you
											I think of as making
the long game pay now.
											This is Wes Jackson, a farmer
I spent some time with in Kansas.
											And Jackson knows
											that the way that most crops
are grown around the world today
											is stripping the earth
of the fertile topsoil
											we need to feed future generations.
											He got together
with a group of scientists,
											and they bred perennial grain crops
which have deep roots
											that anchor the fertile topsoil of a farm,
											preventing erosion
and protecting future harvests.
											But they also knew
											that in order to get farmers
to grow these crops in the short run,
											they needed to boost
the annual yields of the crops
											and find companies willing
to make cereal and beer using the grains
											so that farmers could reap profits today
by doing what's good for tomorrow.
									","
											Le premier outil que je veux 
partager avec vous,
											c'est comme si le long terme
se réalisait dès aujourd'hui.
											Voici Wes Jackson, un fermier 
avec qui j’ai passé un moment au Kansas.
											Et Jackson sait que
											la plupart des modes de culture
dans le monde aujourd'hui
											dépouillent la terre
de la fertile couche de terre arable
											nécessaire pour nourrir 
les générations futures.
											Il s’est rapproché
d'un groupe de scientifiques,
											et ils ont cultivé des cultures de 
céréales pérennes avec de longues racines
											qui stabilisent la fertile 
couche arable d'une ferme,
											évitant l’érosion et protégeant
les récoltes futures.
											Mais ils savaient aussi
											que pour trouver des fermiers prêts
à cultiver ces semences à court terme,
											ils avaient besoin d'accroître
les rendements annuels de ces cultures
											et de trouver des entreprises
produisant des céréales et de la bière
											pour que les fermiers 
puissent faire des profits aujourd'hui
											avec ce qui est bon pour demain.
											C'est une stratégie testée et validée.
									","
											La primera herramienta
que quiero compartir
											es algo así como apostar a largo plazo
pero con los resultados ahora.
											Este es Wes Jackson, un agricultor
con quien me encontré en Kansas.
											Jackson sabe
											que la mayoría de los métodos de cultivo
utilizados hoy en día en todo el mundo
											deterioran la capa fértil de la tierra
											que necesitamos para alimentar
a las generaciones futuras.
											Junto con un grupo de científicos
											cultivaron una variedad de grano perenne
											con raíces profundas
que sujetan la capa fértil
											previniendo así la erosión
y protegiendo las futuras cosechas.
											Pero también sabían
											que para incentivar a los agricultores
a cultivar estos granos en el corto plazo
											debían aumentar el rendimiento anual
											y encontrar empresas dispuestas
a hacer cereales y cerveza con ellos
											para que los agricultores pudieran ver hoy
el beneficio de algo bueno para el futuro.
									",The power to think ahead in a reckless age,Bina Venkataraman,13:10,"humanity,community,future,history,family,memory,world cultures,culture,society"
"
","
","
",The power to think ahead in a reckless age,Bina Venkataraman,13:10,"humanity,community,future,history,family,memory,world cultures,culture,society"
