en,es,tr,fr,de,title,speaker,duration,tags
"
											And indeed, for quite a few people,
											taking this NAND2Tetris pilgrimage, if you will,
											has turned into a life-changing experience.
											For example, take Dan Rounds, who is a music
											and math major from East Lansing, Michigan.
											A few weeks ago, Dan posted a victorious post
											on our website, and I'd like to read it to you.
											So here's what Dan said.
									","
											Y, en efecto, para algunas personas
											emprender esta peregrinación del NAND2Tetris, si se quiere,
											se ha convertido en una experiencia que les cambió la vida.
											Por ejemplo, Dan Rounds, músico y especialista
											en matemática de East Lansing, Michigan.
											Hace pocas semanas, Dan publicó un mensaje victorioso
											en nuestro sitio, y me gustaría leérselo.
											Esto es lo que dijo Dan:
									","
											Aslında, birçok insan için
											NAND2Tetris'in kutsal yolculuğuna çıkmak,
tabii eğer yaparsanız,
											hayat değiştiren bir deneyime dönüştü.
											Mesela, Dan Rounds'ı ele alalım.
											Kendisi East Lansing, Michigan'da
bir müzik ve matematik uzmanı.
											Birkaç hafta önce, Dan web sayfamızda
başarılı bir gönderi paylaştı
											ve bunu sizlere okumak istiyorum.
											Dan'ın söylediği şey şu:
									","
											En en effet, pour pas mal de personnes,
											faire ce ""pèlerinage"" NAND2Tetris, si vous voulez,
											s'est transformé en une expérience qui a changé leur vie.
											Par exemple, Dan Rounds, qui étudie la musique et
											les mathématiques à East Lansing, dans le Michigan.
											Il y a quelques semaines, 
Dan a posté un message de victoire
											sur notre site et j'aimerais vous le lire.
											Voici ce que Dan a dit.
									","
											Und tatsächlich ist das,
											was man eine NAND2Tetris-Wallfahrt 
nennen könnte,
											für einige Leute zu einer 
lebensverändernden Erfahrung geworden.
											Nehmen wir beispielsweise Dan Rounds,
											der in Michigan Musik und Mathe 
im Hauptfach studiert.
											Vor einigen Wochen hinterließ Dan 
eine Siegesnachricht
											auf unserer Webseite 
und ich möchte sie gern vorlesen.
											Dies hat Dan gesagt:
									",The self-organizing computer course,Shimon Schocken,16:25,"computers,education,open-source,technology,code"
"
","
","
","
","
",The self-organizing computer course,Shimon Schocken,16:25,"computers,education,open-source,technology,code"
"
											""I did the coursework because understanding computers
											is important to me, just like literacy and numeracy,
											and I made it through. I never worked harder on anything,
											never been challenged to this degree.
											But given what I now feel capable of doing,
											I would certainly do it again.
											To anyone considering NAND2Tetris,
											it's a tough journey, but you'll be profoundly changed.""
									","
											""Hice el curso porque entender la computación es tan importante
											para mí como la alfabetización y la aritmética,
											y lo logré. Nunca antes había trabajado tan arduamente en algo,
											nunca antes enfrenté semejante desafío.
											Pero sabiendo como ahora sé de lo que soy capaz,
											sin duda lo volvería a hacer.
											Para quien esté considerando hacer NAND2Tetris,
											es un viaje difícil, pero te cambiará significativamente"".
									","
											""Sınıf çalışmasını yaptım,
çünkü bilgisayarları anlamak
											benim için çok önemli.
Tıpkı okuma-yazma ve matematik gibi
											ve üstesinden geldim.
Hiçbir şeye daha çok çalışmamıştım,
											hiç bu derecede zorlanmamıştım.
											Ama şu an hissettiğim
yapabilme yeteneğine bakılırsa,
											kesinlikle yine yapardım.
											NAND2Tetris'i düşünenler için
											bu zorlu bir yolculuk
ama derinden değişmiş olacaksınız.""
									","
											""J'ai suivi le cours en ligne parce que 
comprendre les ordinateurs
											est important pour moi, tout comme les compétences en lecture et en calcul,
											et j'ai réussi. Je n'ai jamais travaillé aussi dur,
											je n'ai jamais été autant mis à l'épreuve.
											Mais étant donné ce dont je me sens capable désormais,
											je le referais certainement.
											A ceux qui envisagent de se lancer avec NAND2Tetris,
											c'est un parcours difficile mais vous en ressortirez profondément changés.""
									","
											""Ich habe den Kurs gemacht, 
weil es für mich wichtig ist,
											einen Computer zu verstehen,
genau wie Schreiben und Rechnen.
											Und ich habe es geschafft. Ich habe 
noch nie so hart an etwas gearbeitet,
											hatte noch nie eine 
so große Herausforderung.
											Doch es hat mir gezeigt, 
wozu ich eigentlich fähig bin,
											und ich würde es ganz bestimmt 
noch einmal tun.
											Für alle, die NAND2Tetris 
in Betracht ziehen,
											es ist ein harter Weg, 
doch er wird dich zutiefst verändern.""
									",The self-organizing computer course,Shimon Schocken,16:25,"computers,education,open-source,technology,code"
"
","
","
","
","
",The self-organizing computer course,Shimon Schocken,16:25,"computers,education,open-source,technology,code"
"
											So Dan demonstrates the many self-learners
											who take this course off the Web, on their own traction,
											on their own initiative, and it's quite amazing because
											these people cannot care less about
											grades.
											They are doing it because of one motivation only.
											They have a tremendous passion to learn.
									","
											Dan demostró que muchos autodidactas
											toman este curso desconectados, a su propio ritmo,
											por iniciativa propia, y es muy sorprendente porque
											a estas personas no podría importarles menos
											las calificaciones.
											Lo hacen motivados por una sola cosa.
											Sienten una enorme pasión por aprender.
									","
											Yani Dan, bu dersi özel ilgiyle,
özel inisiyatifle alan
											web dışında kendi başına öğrenen
birçok kişiyi gösteriyor
											ve bu oldukça şaşırtıcı.
											Çünkü bu insanlar
											notları hiç de umursamazlar.
											Bunu sadece tek bir
motivasyonla yapıyorlar.
											Öğrenmek için muazzam bir tutkuları var.
									","
											Dan décrit les nombreux autodidactes
											qui prennent ce cours en ligne, de leur propre volonté,
											de leur propre initiative et c'est vraiment étonnant car
											ces gens ne se préoccupent absolument pas
											des notes.
											Ils le font uniquement par motivation personnelle.
											Ils ont une incroyable passion pour apprendre.
									","
											Dan verkörpert also die vielen Autodidakten,
											die diesen Kurs im Internet 
auf eigene Faust gemacht haben,
											aus eigener Initiative, 
und es ist einfach erstaunlich,
											denn diesen Leuten sind Noten ganz und gar
											egal.
											Sie tun es aus einem einzigen Grund:
											Sie haben die Leidenschaft zu lernen.
									",The self-organizing computer course,Shimon Schocken,16:25,"computers,education,open-source,technology,code"
"
","
","
","
","
",The self-organizing computer course,Shimon Schocken,16:25,"computers,education,open-source,technology,code"
"
											And with that in mind,
											I'd like to say a few words about traditional college grading.
											I'm sick of it.
											We are obsessed with grades
											because we are obsessed with data,
											and yet grading takes away all the fun from failing,
											and a huge part of education
											is about failing.
											Courage, according to Churchill,
											is the ability to go from one defeat to another
											without losing enthusiasm. (Laughter)
											And [Joyce] said that mistakes
											are the portals of discovery.
											And yet we don't tolerate mistakes,
											and we worship grades.
											So we collect your B pluses and your A minuses
											and we aggregate them into a number like 3.4,
											which is stamped on your forehead
											and sums up who you are.
											Well, in my opinion, we went too far with this nonsense,
											and grading became degrading.
									","
											Y con eso en mente,
											me gustaría decir unas palabras sobre las calificaciones universitarias tradicionales.
											Estoy harto de ellas.
											Las calificaciones nos obsesionan,
											porque nos obsesionan los datos.
											Las calificaciones le quitan la diversión al fracaso,
											y la educación en gran medida
											consiste en fracasar.
											El valor, según Churchill,
											es la capacidad de ir de un fracaso a otro
											sin perder el entusiasmo. (Risas)
											Y [Joyce] dijo que los errores
											son los portales del descubrimiento.
											Y, sin embargo, no toleramos los errores
											y adoramos las calificaciones.
											Juntamos los regulares y los buenos
											y los consolidamos en un número como 3,4
											que está estampado en tu frente
											y resume lo que eres.
											Bueno, en mi opinión, fuimos demasiado lejos con esta tontería
											y la calificación se tornó ""des-calificación"".
									","
											Bunu hesaba katarsak,
											geleneksel okul notlandırması hakkında
birkaç kelime söylemek istiyorum.
											Bundan bıktım.
											Kafayı notlarla bozduk,
											çünkü verilerle kafayı bozduk,
											hâl böyleyken notlandırma,
başarısızlığın getirdiği
											tüm eğlenceyi götürüyor ve 
eğitimin büyük bir kısmı
											başarısızlık üzerine.
											Churchill'e göre cesaret,
											hevesini kaybetmeden,
bir yenilgiden diğerine
											geçme yeteneğidir. (Gülüşmeler)
											[Joyce] şöyle demişti;
											hatalar keşfin giriş kapılarıdır.
											Hâl böyleyken hataları hoş görmüyoruz
											ve notlara tapıyoruz.
											Sizin B artılarınızı ve
A eksilerinizi biriktiriyoruz
											ve onları 3,4 gibi bir sayı
şeklinde topluyoruz.
											Alnınıza damgalanmış olan
											ve kim olduğunuzu özetleyen bir sayı.
											Bana göre, bu saçmalıkta
çok ileriye gittik
											ve notlandırma aşağılayıcı hâle geldi.
									","
											Et en gardant ça à l'esprit,
											j'aimerais dire quelques mots à propos du système de notation traditionnel des universités.
											Il me rend malade.
											Nous sommes obsédés par les notes
											parce que nous sommes obsédés par les données,
											et donner une note ôte tout l'aspect positif de l'échec,
											et pourtant une grande partie de l'éducation
											est liée à l'échec.
											D'après Churchill, le courage
											est la capacité d'aller d'une défaite à une autre
											sans perdre de son enthousiasme. (Rires)
											Et [Joyce] a dit que les erreurs
											sont les portails de la découverte.
											Et pourtant, nous ne tolérons pas les erreurs,
											et nous vénérons les notes.
											Alors nous collectons vos bonnes notes
											et nous les agrégeons toutes en un seul nombre, 
par exemple 13,
											qui est tamponné sur votre front
											et définit qui vous êtes.
											A mon avis, nous sommes allés bien trop loin 
avec cette absurdité,
											et donner des notes est devenu dégradant.
									","
											Und angesichts dessen
											würde ich gerne einige Worte über das übliche 
Bewertungssystem am College sagen:
											Ich habe es satt.
											Wir sind besessen von Bewertungen,
											weil wir besessen von Daten sind,
											und doch nimmt die Notenvergabe 
den ganzen Spaß am Scheitern weg,
											und ein riesiger Teil von Bildung
											ist das Scheitern.
											Mut ist laut Churchill
											die Fähigkeit, von einer Niederlage 
zu einer anderen zu gelangen
											ohne die Begeisterung zu verlieren. 
(Gelächter)
											Und [Joyce] sagte, dass Fehler
											die Tore zur Entdeckung sind.
											Dennoch dulden wir keine Fehler
											und verehren Noten.
											Also sammeln wir 
eine ""2+"" und eine ""1-""
											und verwandeln sie 
in einen Durchschnittswert,
											der einem auf die Stirn gestempelt wird,
											und zusammenfasst, wer man ist.
											Meiner Meinung nach haben wir es 
mit diesem Unsinn zu weit getrieben,
											und die Bewertung mit Noten wurde 
zu einer Abwertung unserer selbst.
									",The self-organizing computer course,Shimon Schocken,16:25,"computers,education,open-source,technology,code"
"
","
","
","
","
",The self-organizing computer course,Shimon Schocken,16:25,"computers,education,open-source,technology,code"
"
											So with that, I'd like to say a few words about upgrading,
											and share with you a glimpse from my current project,
											which is different from the previous one,
											but it shares exactly the same characteristics
											of self-learning, learning by doing,
											self-exploration and community-building,
											and this project deals with K-12 math education,
											beginning with early age math,
											and we do it on tablets because we believe that
											math, like anything else, should be taught hands on.
									","
											Con eso, me gustaría decir unas palabras sobre la actualización,
											y compartir con Uds. una idea de mi proyecto actual,
											que es diferente del anterior,
											pero comparte las mismas características
											de aprender haciéndolo uno mismo,
											de la exploración personal y el desarrollo comunitario
											y abarca la educación inicial y primaria en matemáticas.
											Empieza con matemáticas a temprana edad
											y con tabletas porque creemos que la matemática,
											como todo, debe enseñarse con las manos en la masa.
									","
											Bunun üzerine yükseltme hakkında
birkaç kelime söylemek
											ve güncel projemden,
bir öncekinden farklı olan
											kısa bir görüntü paylaşmak istiyorum.
											Fakat kendi kendine öğrenmenin,
yaparak öğrenmenin,
											kendi kendine keşfetmenin
ve topluluk kurmanın
											aynı özelliklerini tamamen paylaşıyor
											ve bu proje matematiğin
ilk dönemlerinden başlayarak,
											K-12 matematik eğitimini ele alıyor
											ve bunu tablet üzerinde yapıyoruz.
											Çünkü inanıyoruz ki matematik, 
her şey gibi uygulamalı öğretilmelidir.
									","
											Donc j'aimerais dire quelques mots sur l'amélioration,
											et partager avec vous un aperçu de mon projet actuel,
											qui est différent du précédent,
											mais en partage exactement les mêmes caractéristiques
											d'auto-apprentissage, d'apprentissage par la pratique,
											d'auto-exploration et de conscience communautaire,
											et ce projet traite de la formation en mathématiques 
jusqu'au niveau lycée,
											en débutant avec les maths pour les jeunes enfants,
											et nous le faisons sur des tablettes car nous pensons que
											les maths, comme tout le reste, devraient être enseignées par la pratique.
									","
											Angesichts dessen würde ich gerne 
einige Worte über Aufwertung sagen,
											und ein wenig über 
mein neues Projekt erzählen.
											Dieses Projekt ist anders als das vorherige,
											aber beide fördern genau 
die gleichen Eigenschaften
											des Selbstlernen, des Lernen durch Erfahren,
											der Selbsterforschung und 
den Aufbau von Gemeinschaften.
											Dieses Projekt beschäftigt sich 
mit Mathematik für alle Schulstufen,
											angefangen bei der Vorschule.
											Wir tun dies auf Tablet-PCs, 
weil wir glauben,
											dass Mathe, so wie alles andere, 
praxisbezogen unterrichtet werden sollte.
									",The self-organizing computer course,Shimon Schocken,16:25,"computers,education,open-source,technology,code"
"
","
","
","
","
",The self-organizing computer course,Shimon Schocken,16:25,"computers,education,open-source,technology,code"
"
											So here's what we do. Basically, we developed
											numerous mobile apps, every one of them explaining
											a particular concept in math.
											So for example, let's take area.
											When you deal with a concept like area —
											well, we also provide a set of tools that the child
											is invited to experiment with in order to learn.
											So if area is what interests us, then one thing
											which is natural to do is to tile the area
											of this particular shape and simply count
											how many tiles it takes to cover it completely.
											And this little exercise here gives you a first
											good insight of the notion of area.
									","
											Por eso, en esencia, desarrollamos
											muchas aplicaciones móviles, cada una dedicada
											a un concepto matemático particular.
											Por ejemplo, tomemos ""área"".
											Cuando uno trabaja un concepto como área...
											bueno, siempre brindamos unas herramientas que invitan al chico
											a experimentar para aprender.
											Así, si lo que nos interesa es el área, lo
											que resulta natural es dividirla
											en piezas con esta forma y simplemente contar
											cuántas piezas se requieren para cubrir el área.
											Y este pequeño ejercicio da una buena idea preliminar
											del concepto de área.
									","
											İşte yaptığımız şey de bu.
											Her biri matematiğin
belirli bir kavramını açıklayan
											sayısız mobil uygulama geliştirdik.
											Mesela, alanı ele alalım.
											Alan gibi bir kavramla uğraştığınız zaman,
											ayrıca çocuğun öğrenmesi için çağrıldığı
											birlikte deney yapacağı
bir araç grubu sağlıyoruz.
											Yani bizi ilgilendiren şey alan ise,
											yapılacak tek doğal şey,
											belirli bir şeklin alanını kaplamak
											ve şeklin kaç tane karo ile 
kaplandığını basitçe saymak.
											Buradaki bu küçük uygulama
											size iyi bir alan bilgisi kavramı verir.
									","
											Ce que nous faisons: en gros, nous avons développé
											de nombreuses applications mobiles, 
chacune d'elles expliquant
											un concept particulier des mathématiques.
											Par exemple, prenons l'aire.
											Quand on a affaire à un concept tel que l'aire —
											nous fournissons aussi un ensemble d'outils que l'enfant
											est invité à essayer, utiliser, explorer pour apprendre.
											Et donc si on s'intéresse à l'aire,
											une chose facile à faire est de morceler l'aire
											de cette forme et de simplement compter
											combien de morceaux il faut pour la couvrir entièrement.
											Et ce petit exercice vous donne un premier
											véritable aperçu de la notion d'aire.
									","
											Wir haben also im Wesentlichen
											mehrere Mobile-Apps entwickelt, jede erklärt
											ein bestimmtes mathematisches Konzept.
											Nehmen wir beispielsweise 
den Flächeninhalt.
											Wenn Sie mit einem Konzept
wie Flächeninhalt zu tun haben —
											wir stellen auch einige Werkzeuge 
zur Verfügung,
											mit denen wir das Kind einladen 
zu experimentieren und so zu lernen.
											Wenn uns also nun der Flächeninhalt interessiert, 
dann ist eine Möglichkeit,
											die Fläche in gleichförmige Kästchen 
aufzuteilen
											und dann zählt man einfach,
											wie viele Kästchen man braucht, 
um die Fläche komplett auszufüllen.
											Und mit dieser kleinen Aufgabe bekommt man
											einen guten ersten Eindruck 
von der Idee der Flächen.
									",The self-organizing computer course,Shimon Schocken,16:25,"computers,education,open-source,technology,code"
"
","
","
","
","
",The self-organizing computer course,Shimon Schocken,16:25,"computers,education,open-source,technology,code"
"
											Moving along, what about the area of this figure?
											Well, if you try to tile it, it doesn't work too well, does it.
											So instead, you can experiment
											with these different tools here by some process
											of guided trial and error,
											and at some point you will discover that one thing
											that you can do among several legitimate transformations
											is the following one. You can cut the figure,
											you can rearrange the parts, you can glue them
											and then proceed to tile just like we did before.
											(Applause)
											Now this particular transformation
											did not change the area of the original figure,
											so a six-year-old who plays with this
											has just discovered a clever algorithm
											to compute the area of any given parallelogram.
									","
											Continuando, ¿qué pasa con el área de esta figura?
											Bueno, si tratamos de cuadricularla eso no funciona bien, ¿no?
											En cambio, podemos experimentar
											con estas herramientas, siguiendo una guía,
											por ensayo y error,
											hasta que en un momento descubriremos que,
											entre las varias transformaciones legítimas,
											existe una en la que si cortamos la figura
											podemos reagrupar las partes, pegarlas,
											y luego cuadricular el área como hicimos antes.
											(Aplausos)
											Pero esta transformación particular
											no cambió el área de la figura original así que
											niñas y niños de 6 años que juegan con esto
											han descubierto un algoritmo ingenioso
											para calcular el área de cualquier paralelogramo.
									","
											Devam edersek, peki ya bu şeklin alanı?
											Eğer bu şekli karolarla kaplamaya 
çalışırsanız, bu çok işe yaramaz.
											Bunun yerine, bu farklı araçlarla
											rehber eşliğindeki bazı
deneme yanılma işlemleriyle
											deney yapabilirsiniz
											ve belli yerlerde, birçok geçerli
											dönüşümler içerisinde
yapabileceğiniz bir şeyin
											sıradaki olduğunu keşfedeceksiniz.
											Şekli kesebilir, parçaları düzenleyebilir,
onları yapıştırabilirsiniz
											ve sonra tıpkı önceden yaptığımız gibi
kaplamaya devam edebilirsiniz.
											(Alkışlar)
											Bu belirli dönüşüm,
											asıl şeklin alanını değiştirmedi.
											Yani bununla oynayan 6 yaşındaki biri,
											herhangi bir paralelkenarın
alanını hesaplamak için
											sadece zeki bir algoritma keşfetti.
									","
											Continuons, qu'en est-il de l'aire de cette figure ?
											Si l'on essaie de la morceler, 
ça ne marche pas très bien.
											Alors à la place, on peut faire des essais
											avec les différents outils sur la tablette en suivant
											un processus guidé d'apprentissage par expérimentation,
											et à un moment donné vous découvrirez qu'une des choses
											que vous pouvez faire parmi de nombreuses transformations justifiées
											est la suivante. Vous pouvez couper la figure,
											vous pouvez réarranger les morceaux, 
vous pouvez les recoller
											et ensuite procéder au morcellement exactement comme nous l'avions fait auparavant.
											(Applaudissements)
											Alors, cette transformation en particulier
											n'a pas changé l'aire de la figure originale,
											et donc un enfant de six ans qui joue avec ça
											vient de découvrir un algorithme très intelligent
											servant à calculer l'aire de n'importe quel parallélogramme.
									","
											Weiter geht's, was ist 
der Flächeninhalt dieser Figur?
											Wenn man jetzt versucht, sie in Kästchen 
aufzuteilen, funktioniert das nicht so einfach.
											Stattdessen kann man mit diesen
											verschiedenen Werkzeugen experimentieren
											und es durch Versuch und Irrtum herausfinden.
											Irgendwann erkennt man,
											dass eine der vielen erlaubten 
möglichen Veränderungen
											die folgende ist. 
Man kann die Figur zerschneiden,
											man kann Teile verschieben, 
man kann sie zusammenkleben
											und dann mit dem Aufteilen 
in Kästchen fortfahren wie vorher.
											(Applaus)
											Diese bestimme Veränderung
											hat den Flächeninhalt 
der ursprünglichen Figur nicht geändert,
											also hat ein Sechsjähriger, der damit spielt,
											einen cleveren Algorithmus entdeckt,
											um die Fläche von irgendeinem 
Parallelogramm zu berechnen.
									",The self-organizing computer course,Shimon Schocken,16:25,"computers,education,open-source,technology,code"
"
","
","
","
","
",The self-organizing computer course,Shimon Schocken,16:25,"computers,education,open-source,technology,code"
