en,fr,es,title,speaker,duration,tags
"
											And this is a tried-and-true strategy.
											In fact, it was used
by George Washington Carver
											in the South of the United States
after the Civil War
											in the early 20th century.
											A lot of people have probably heard
of Carver's 300 uses for the peanut,
											the products and recipes
that he came up with
											that made the peanut so popular.
											But not everyone knows
why Carver did that.
											He was trying to help
poor Alabama sharecroppers
											whose cotton yields were declining,
											and he knew that planting
peanuts in their fields
											would replenish those soils
											so that their cotton yields
would be better a few years later.
											But he also knew it needed
to be lucrative for them in the short run.
									","
											En fait, George Washington Carver
l'a utilisée
											dans le sud des États-Unis
après la guerre de Sécession
											au début du XXe siècle.
											Beaucoup ont probablement
déjà entendu parler de ses 300 usages
											de la cacahuète,
de ses produits et de ses recettes,
											qui ont rendu la cacahuète si populaire.
											Mais peu savent pourquoi Carver 
a fait cela.
											Il essayait d’aider
les pauvres métayers d’Alabama
											dont les rendements cotonniers déclinaient
											et il savait que s'ils plantaient
des cacahuètes,
											ils enrichiraient ces sols
											et qu'ainsi, les rendements en coton
s'amélioreraient par la suite.
											Mais il savait aussi qu’il fallait que
ce soit lucratif pour eux à court terme.
									","
											Se ha demostrado
que la estrategia funciona.
											De hecho, la usó George Washington Carver
											en el sur de los EE. UU.
luego de la guerra civil
											a principios del siglo XX.
											Muchos habrán oído hablar
de los 300 usos para el maní de Carver,
											los productos y recetas que él inventó
											y tanta popularidad le dieron al maní.
											Pero no todos saben por qué lo hizo.
											Estaba tratando de ayudar
a los pobres agricultores en Alabama,
											porque sus cosechas de algodón
perdían rendimiento
											y él sabía que, si plantaban maní,
el suelo se recuperaría
											y el rendimiento del algodón
mejoraría en los años subsiguientes.
											Pero también sabía que necesitaban
un ingreso en el corto plazo.
									",The power to think ahead in a reckless age,Bina Venkataraman,13:10,"humanity,community,future,history,family,memory,world cultures,culture,society"
"
","
","
",The power to think ahead in a reckless age,Bina Venkataraman,13:10,"humanity,community,future,history,family,memory,world cultures,culture,society"
"
											Alright, so let's talk
about another tool for foresight.
											This one I like to think of
as keeping the memory of the past alive
											to help us imagine the future.
											So I went to Fukushima, Japan
											on the sixth anniversary
of the nuclear reactor disaster there
											that followed the Tohoku earthquake
and tsunami of 2011.
											When I was there, I learned
about the Onagawa Nuclear Power Station,
											which was even closer
to the epicenter of that earthquake
											than the infamous Fukushima Daiichi
that we all know about.
											In Onagawa, people in the city
actually fled to the nuclear power plant
											as a place of refuge.
											It was that safe.
											It was spared by the tsunamis.
											It was the foresight of just one engineer,
											Yanosuke Hirai,
											that made that happen.
											In the 1960s, he fought
to build that power plant
											farther back from the coast
											at higher elevation
and with a higher sea wall.
											He knew the story of his hometown shrine,
											which had flooded
in the year 869 after a tsunami.
											It was his knowledge of history
that allowed him to imagine
											what others could not.
									","
											Passons à un autre outil d'anticipation.
											Celui-là, j'aime le penser comme celui qui
garde vivante la mémoire du passé
											pour nous aider à imaginer le futur.
											Je suis donc allée à Fukushima, au Japon,
											pour le sixième anniversaire
de la catastrophe nucléaire,
											consécutive du tremblement de terre 
Tohoku et du tsunami de 2011.
											Quand j’étais là-bas, j’ai entendu parler
de la centrale nucléaire d’Onagawa
											qui était encore plus proche 
de l’épicentre du tremblement de terre
											que la tristement célèbre Fukushima 
Daiichi, que nous connaissons tous.
											A Onagawa, les habitants, en fait,
											ont fui vers la centrale nucléaire 
pour s'y réfugier.
											C'était si sûr.
											C'était épargné par les tsunamis.
											C'est l’anticipation d’un seul ingénieur,
Yanosuke Hirai,
											qui rendit cela possible.
											Dans les années 60, il s'est battu
pour construire cette centrale
											plus loin de la côte
											à un niveau plus élevé
et derrière une digue plus haute.
											Il connaissait l’histoire du temple
de sa ville natale,
											qui avait été englouti en 869 
après un tsunami.
											C’était sa connaissance de l’histoire
qui lui a permis d’imaginer
											ce que les autres n'ont pas pu penser.
									","
											Hablemos ahora de otra herramienta
para la visión de futuro.
											Esta se trata de mantener vivo
el recuerdo del pasado
											para ayudarnos a imaginar el futuro.
											Fui a Fukushima, Japón,
											para el sexto aniversario
del desastre nuclear
											que ocurrió luego del terremoto
y del tsunami en Tohoku en 2011.
											Durante mi estadía me enteré
de la central nuclear de Onagawa,
											que estaba aún más cerca
del epicentro del terremoto
											que la infame Fukushima Daiichi,
que todos conocemos.
											En Onagawa, la gente huyó de la ciudad
											para refugiarse en la central nuclear.
											Era así de seguro.
											Quedó a salvo del tsunami.
											Fue la previsión de un solo ingeniero,
											Yanosuke Hirai,
											que lo hizo posible.
											En los años 60
											él abogó para que la planta
se construyera más lejos de la costa,
											en un punto más elevado
y con una escollera más alta.
											Conocía la historia del santuario
en su ciudad natal,
											que se había inundado en el año 869
como consecuencia de un tsunami.
											Su conocimiento de la historia
											le permitió imaginar
lo que otros no podían.
									",The power to think ahead in a reckless age,Bina Venkataraman,13:10,"humanity,community,future,history,family,memory,world cultures,culture,society"
"
","
","
",The power to think ahead in a reckless age,Bina Venkataraman,13:10,"humanity,community,future,history,family,memory,world cultures,culture,society"
"
											OK, one more tool of foresight.
											This one I think of
as creating shared heirlooms.
											These are lobster fishermen
on the Pacific coast of Mexico,
											and they're the ones who taught me this.
											They have protected
their lobster harvest there
											for nearly a century,
											and they've done that
by treating it as a shared resource
											that they're passing on to their collected
children and grandchildren.
											They carefully measure what they catch
											so that they're not taking
the breeding lobster out of the ocean.
											Across North America,
there are more than 30 fisheries
											that are doing something
vaguely similar to this.
											They're creating long-term stakes
in the fisheries known as catch shares
											which get fishermen to be motivated
											not just in taking whatever they can
from the ocean today
											but in its long-term survival.
									","
											OK, un autre outil d’anticipation.
											Celui-ci, j'y pense comme
à la création d'un patrimoine partagé.
											Voici des pêcheurs de homards
sur la côte pacifique du Mexique,
											et ce sont eux qui m'ont enseigné cela.
											Ils ont protégé leurs prises de homards
											pendant presque d'un siècle,
											et ils l’ont fait en les traitant
comme une ressource partagée
											qu’ils transmettent
à leurs enfants et petits-enfants.
											Ils mesurent avec précaution
ce qu'ils attrapent
											de façon à ce qu'ils n'éteignent pas
la reproduction des homards dans l'océan.
											A travers l’Amérique du Nord,
il y a plus de 30 pêcheries
											qui font quelque chose
d'à peu près similaire.
											Ils créent des jalons à long terme dans
les pêcheries, dits « parts de prises »
											ce qui amène les pêcheurs 
à être motivés
											pas uniquement par une pêche maximale
											mais par sa durabilité à long terme.
									","
											OK, una herramienta más
para la visión a futuro.
											Esta se trata de crear
reliquias compartidas.
											Estos pescadores de langosta
en la costa del Pacífico en México,
											son los que me enseñaron esto.
											Han estado protegiendo
esta cosecha de langosta
											durante casi un siglo,
											y lo han conseguido porque lo ven
como un recurso compartido
											que pasa a las manos
de sus hijos y nietos.
											Miden cuidadosamente lo que pescan
											para asegurarse de agotar
la langosta en el océano.
											En América del Norte,
hay más de 30 pesquerías
											que están haciendo algo similar a esto.
											Están implementando cuotas de captura
											que motivan a los pescadores,
											no solo a capturar lo que puedan hoy,
											sino también a pensar
en el futuro del océano.
									",The power to think ahead in a reckless age,Bina Venkataraman,13:10,"humanity,community,future,history,family,memory,world cultures,culture,society"
"
","
","
",The power to think ahead in a reckless age,Bina Venkataraman,13:10,"humanity,community,future,history,family,memory,world cultures,culture,society"
"
											Now there are many,
many more tools of foresight
											I would love to share with you,
											and they come from all kinds of places:
											investment firms that look
beyond near-term stock prices,
											states that have freed their elections
											from the immediate interests
of campaign financiers.
											And we're going to need to marshal
as many of these tools as we can
											if we want to rethink what we measure,
											change what we reward
											and be brave enough
to imagine what lies ahead.
									","
											Il y a beaucoup
plus d’outils d’anticipation
											que j’aimerais partager avec vous,
											et ils viennent de tous horizons :
											des sociétés de placement qui
regardent au-delà du court terme,
											des États qui ont libéré leurs élections
											des intérêts immédiats
de ceux qui financent les campagnes.
											Et il va nous falloir rassembler
le maximum de ces outils
											si nous voulons repenser
ce que nous mesurons,
											changer ce que nous valorisons,
											et être assez courageux pour imaginer
ce qu'il y a devant nous.
									","
											Hay muchas más herramientas
para la visión a futuro
											que me encantaría compartir
											y que son muy variadas:
											inversionistas que ven más allá
del valor de las acciones a corto plazo,
											países que han liberado sus elecciones
											de los intereses inmediatos
de quienes financian la campaña.
											Vamos a necesitar tantas herramientas
como podamos conseguir
											si queremos repensar lo que medimos,
											cambiar lo que recompensamos
											y ser lo suficientemente valientes
como para imaginar lo que viene.
									",The power to think ahead in a reckless age,Bina Venkataraman,13:10,"humanity,community,future,history,family,memory,world cultures,culture,society"
"
","
","
",The power to think ahead in a reckless age,Bina Venkataraman,13:10,"humanity,community,future,history,family,memory,world cultures,culture,society"
"
											Not all this is going to be easy,
as you can imagine.
											Some of these tools
we can pick up in our own lives,
											some we're going to need to do
in businesses or in communities,
											and some we need to do as a society.
											The future is worth this effort.
									","
											Tout ne va pas être simple,
comme vous pouvez l'imaginer.
											Certains de ces outils, nous pouvons
les trouver dans nos propres vies,
											pour d'autres, ce sera dans les
entreprises ou dans les communautés,
											et pour certains, c'est la société
qui doit les chercher.
											Le futur mérite cet effort.
									","
											Todo esto no siempre será fácil,
como se imaginarán.
											Algunas de estas herramientas
las podemos adoptar en nuestras vidas,
											otras las tendremos que trabajar
con las empresas y las comunidades,
											y otras son para trabajar en sociedad.
											Vale la pena el esfuerzo por el futuro.
									",The power to think ahead in a reckless age,Bina Venkataraman,13:10,"humanity,community,future,history,family,memory,world cultures,culture,society"
"
","
","
",The power to think ahead in a reckless age,Bina Venkataraman,13:10,"humanity,community,future,history,family,memory,world cultures,culture,society"
"
											My own inspiration to keep up this effort
is the instrument I shared with you.
											It's called a dilruba,
											and it was custom-made
for my great-grandfather.
											He was a well-known
music and art critic in India
											in the early 20th century.
											My great-grandfather had the foresight
to protect this instrument
											at a time when my great-grandmother
was pawning off all their belongings,
											but that's another story.
											He protected it by giving it
to the next generation,
											by giving it to my grandmother,
											and she gave it to me.
									","
											Ce qui inspire mon effort, c'est
l’instrument que j'ai partagé avec vous.
											Son nom est dilruba,
											et il a été fait sur mesure
pour mon arrière-grand-père.
											Il était un célèbre critique musical
et artistique en Inde
											au début du XXe siècle.
											Mon arrière-grand-père a eu
la clairvoyance de protéger cet instrument
											à une époque où mon arrière-grand-mère
mettait en gage tous ses biens,
											mais c’est une autre histoire.
											Il le protégea en l’offrant
à la génération suivante,
											en le donnant à ma grand-mère,
											et elle me l'a donné.
									","
											My propia fuente de inspiración para esto
es ese instrumento que les mostré.
											Se llama ""dilruba"",
											y fue hecho a medida para mi bisabuelo.
											Él fue un músico y crítico
muy conocido en la India
											a principios del siglo XX.
											Mi bisabuelo tuvo la previsión
de proteger este instrumento
											en una época cuando mi bisabuela
estaba empeñando todas sus pertenencias,
											pero eso es otra historia.
											Lo protegió dándoselo
a la próxima generación:
											se lo dio a mi abuela,
											y ella me lo dio a mí.
									",The power to think ahead in a reckless age,Bina Venkataraman,13:10,"humanity,community,future,history,family,memory,world cultures,culture,society"
"
","
","
",The power to think ahead in a reckless age,Bina Venkataraman,13:10,"humanity,community,future,history,family,memory,world cultures,culture,society"
"
											When I first heard
the sound of this instrument,
											it haunted me.
											It felt like hearing a wanderer
in the Himalayan fog.
											It felt like hearing
a voice from the past.
									","
											Quand j’ai entendu le son de cet
instrument pour la première fois,
											ça m’a hantée.
											C'’était comme entendre un vagabond
dans le brouillard himalayen.
											C’était comme entendre une voix 
venue du passé.
									","
											La primera vez que escuché
el sonido de este instrumento,
											me pareció muy evocador.
											Era como escuchar a un vagabundo
en la niebla de los Himalayas.
											Era como oír una voz del pasado.
									",The power to think ahead in a reckless age,Bina Venkataraman,13:10,"humanity,community,future,history,family,memory,world cultures,culture,society"
"
","
","
",The power to think ahead in a reckless age,Bina Venkataraman,13:10,"humanity,community,future,history,family,memory,world cultures,culture,society"
"
											(Music)
									","
											(Musique)
									","
											(Música)
									",The power to think ahead in a reckless age,Bina Venkataraman,13:10,"humanity,community,future,history,family,memory,world cultures,culture,society"
"
","
","
",The power to think ahead in a reckless age,Bina Venkataraman,13:10,"humanity,community,future,history,family,memory,world cultures,culture,society"
"
											(Music ends)
									","
											(Fin de la musique)
									","
											(Fin de música)
									",The power to think ahead in a reckless age,Bina Venkataraman,13:10,"humanity,community,future,history,family,memory,world cultures,culture,society"
"
","
","
",The power to think ahead in a reckless age,Bina Venkataraman,13:10,"humanity,community,future,history,family,memory,world cultures,culture,society"
"
											That's my friend Simran Singh
playing the dilruba.
											When I play it, it sounds
like a cat's dying somewhere,
											so you're welcome.
									","
											C’est mon ami Simran Singh
qui joue du dilruba.
											Quand j’en joue, on dirait un chat
en train de mourir quelque part
											donc, s'il vous plaît !
									","
											Ese es mi amigo Simran Singh
tocando el dilruba.
											Cuando lo toco yo, suena
como si estuvieran matando a un gato,
											así que de nada.
									",The power to think ahead in a reckless age,Bina Venkataraman,13:10,"humanity,community,future,history,family,memory,world cultures,culture,society"
"
","
","
",The power to think ahead in a reckless age,Bina Venkataraman,13:10,"humanity,community,future,history,family,memory,world cultures,culture,society"
"
											(Laughter)
									","
											(Rires)
									","
											(Risas)
									",The power to think ahead in a reckless age,Bina Venkataraman,13:10,"humanity,community,future,history,family,memory,world cultures,culture,society"
"
","
","
",The power to think ahead in a reckless age,Bina Venkataraman,13:10,"humanity,community,future,history,family,memory,world cultures,culture,society"
"
											This instrument is in my home today,
											but it doesn't actually belong to me.
											It's my role to shepherd it in time,
											and that feels more meaningful to me
than just owning it for today.
											This instrument positions me
as both a descendant and an ancestor.
											It makes me feel part of a story
bigger than my own.
									","
											Cet instrument est chez moi aujourd’hui,
											mais en fait, il ne m’appartient pas.
											C’est mon rôle de le guider dans le temps,
											et cela me semble avoir plus de sens 
que de juste le posséder.
											Cet instrument me positionne à la fois
comme un descendant et un ancêtre.
											Il me fait me sentir partie prenante
d'une histoire plus grande que la mienne.
									","
											Este instrumento hoy está en mi casa,
											pero no me pertenece a mí.
											Mi rol es conducirlo a través del tiempo,
											y eso me parece más significativo
que ser simplemente su dueña hoy.
											Este instrumento me posiciona
como descendiente y como ancestro.
											Me hace sentir parte de una historia
que es más grande que la mía.
									",The power to think ahead in a reckless age,Bina Venkataraman,13:10,"humanity,community,future,history,family,memory,world cultures,culture,society"
"
","
","
",The power to think ahead in a reckless age,Bina Venkataraman,13:10,"humanity,community,future,history,family,memory,world cultures,culture,society"
"
											And this, I believe,
											is the single most powerful way
we can reclaim foresight:
											by seeing ourselves
as the good ancestors we long to be,
											ancestors not just to our own children
											but to all humanity.
											Whatever your heirloom is,
											however big or small,
											protect it
											and know that its music
can resonate for generations.
									","
											Et ça, je crois,
											est simplement la façon la plus puissante
de réhabiliter l'anticipation :
											en nous voyant comme les bons ancêtres
que nous voulons être,
											les ancêtres pas seulement 
de nos propres enfants
											mais de toute l’humanité.
											Quel que soit votre patrimoine,
											qu'il soit grand ou petit,
											protégez-le
											et sachez que sa musique peut résonner
pendant des générations.
									","
											Y esta, a mi entender,
											es la forma más poderosa que tenemos
de recuperar la visión a futuro:
											vernos como los buenos ancestros
que queremos ser.
											ancestros no solo de nuestros hijos,
											sino de toda la humanidad.
											Sea cual fuere su reliquia,
											grande o pequeña,
											protéjanla,
											y sepan que su música
puede resonar por generaciones.
									",The power to think ahead in a reckless age,Bina Venkataraman,13:10,"humanity,community,future,history,family,memory,world cultures,culture,society"
"
","
","
",The power to think ahead in a reckless age,Bina Venkataraman,13:10,"humanity,community,future,history,family,memory,world cultures,culture,society"
"
											Thank you.
									","
											Merci.
									","
											Gracias.
									",The power to think ahead in a reckless age,Bina Venkataraman,13:10,"humanity,community,future,history,family,memory,world cultures,culture,society"
"
","
","
",The power to think ahead in a reckless age,Bina Venkataraman,13:10,"humanity,community,future,history,family,memory,world cultures,culture,society"
"
											(Applause)
									","
											(Applaudissements)
									","
											(Aplausos)
									",The power to think ahead in a reckless age,Bina Venkataraman,13:10,"humanity,community,future,history,family,memory,world cultures,culture,society"
"
","
","
",The power to think ahead in a reckless age,Bina Venkataraman,13:10,"humanity,community,future,history,family,memory,world cultures,culture,society"
