en,pt,fr,de,title,speaker,duration,tags
"
											Now, let me connect the dots.
											We will face a global workforce crisis
											which consists
of an overall labor shortage
											plus a huge skill mismatch,
											plus a big cultural challenge.
											And this global workforce crisis
is approaching very fast.
											Right now, we are
just at the turning point.
											So what can we, what can governments,
what can companies do?
											Every company,
											but also every country,
											needs a people strategy,
											and to act on it immediately,
											and such a people strategy
consists of four parts.
											Number one, a plan
											for how to forecast supply and demand
for different jobs and different skills.
											Workforce planning will become 
more important than financial planning.
											Two, a plan for
how to attract great people:
											generation Y, women, but also retirees.
											Three, a plan for how to educate
and upskill them.
											There's a huge
upskilling challenge ahead of us.
											And four,
											for how to retain the best people,
											or in other words,
											how to realize an appreciation
and relationship culture.
									","
											Agora, vou ligar o fio à meada.
											Vamos enfrentar uma crise global 
de força de trabalho
											que consiste numa escassez genérica 
de força de trabalho
											mais uma enorme falta 
de competências adequadas,
											mais um grande desafio cultural.
											Esta crise global de força de trabalho 
está a aproximar-se muito depressa.
											Neste momento, 
estamos no ponto de viragem.
											O que é que podemos fazer, 
nós, os governos, as empresas?
											Todas as empresas,
											mas também todos os países,
											precisam duma estratégia de pessoas
											e de aplicá-la imediatamente.
											Essa estratégia de pessoas 
consiste em quatro passos.
											Número um: um plano
											para como prever a procura e a oferta
											de diferentes trabalhos 
e diferentes competências.
											O planeamento da força de trabalho 
passará a ser mais importante
											do que o planeamento financeiro.
											Número dois: um plano 
para como atrair gente competente:
											a geração Y, as mulheres, 
mas também os reformados.
											Número três: um plano para formá-los 
e aumentar as suas competências.
											Enfrentamos um enorme desafio 
de aumento de competências.
											Número quatro:
											como reter as melhores pessoas,
											ou, por outras palavras,
											como conceber uma cultura 
de apreço e de relacionamento.
									","
											Je vais maintenant relier tout ça.
											Nous allons faire face
à une crise mondiale de la main-d’œuvre
											qui consistera en une pénurie générale
de travailleurs
											ajoutée à un énorme
manque de qualification,
											plus un gros problème culturel.
											Et cette crise mondiale de la main-d’œuvre
arrivera très vite.
											Aujourd'hui,
nous sommes à un tournant.
											Que pouvons-nous, que peuvent faire
les gouvernements et les entreprises ?
											Chaque entreprise,
											mais aussi chaque pays,
											doit élaborer une stratégie démographique,
											et agir immédiatement en conséquence.
											Cette stratégie démographique
doit comporter quatre points.
											Premièrement,
un plan qui permettra
											de prévoir l'offre et la demande
dans les différents métiers
											et les différentes compétences.
											La planification de la ressource humaine
va devenir plus importante
											que la planification financière.
											Deuxièmement, un plan qui permettra
d'attirer des gens de qualité :
											la génération Y, les femmes,
mais également les retraités.
											Troisièmement, un plan qui permettra

											de les éduquer
et d'augmenter leurs compétences.
											Il y aura un énorme défi à relever
dans l'amélioration des compétences.
											Et quatrièmement, un plan
											qui permettra de retenir les meilleurs,
											ou, en d'autres termes,
											comment construire une culture
de la reconnaissance
											et des relations humaines ?
									","
											Verbinden wir jetzt die Punkte.
											Wir werden eine globale
Arbeitskräftekrise haben,
											die aus einem generellen
Arbeitskräftemangel besteht
											sowie einem gigantischen
Qualifikations-Ungleichgewicht
											und einer großen
kulturellen Herausforderung.
											Diese globale Arbeitskräftekrise
rückt sehr schnell heran.
											Jetzt sind wir erst am Wendepunkt.
											Was können wir, Regierungen, 
Unternehmen tun?
											Jedes Unternehmen, aber auch jedes Land,
											braucht eine Menschen-Strategie
											und muss diese sofort umsetzen.
											Solch eine Menschen-Strategie
besteht aus vier Teilen.
											Nummer eins: ein Plan, wie man
Angebot und Nachfrage
											für verschiedene Stellen und
Qualifizierungen vorhersagen kann.
											Arbeitskräfteplanung wird noch
wichtiger als die Finanzplanung.
											Zwei: ein Plan, wie man
diese Menschen anwirbt.
											Generation Y, Frauen, aber auch Rentner.
											Drei: ein Plan, wie man sie
ausbildet und weiterbildet.
											Es kommt eine große Herausforderung 
in der Weiterbildung auf uns zu.
											Vier: wie man die besten
Menschen behalten kann.
											Mit anderen Worten,
											wie man eine Kultur der Anerkennung
und Beziehungen umsetzt.
									",The workforce crisis of 2030 — and how to start solving it now,Rainer Strack,12:47,"business,global issues,productivity,work"
"
","
","
","
",The workforce crisis of 2030 — and how to start solving it now,Rainer Strack,12:47,"business,global issues,productivity,work"
"
											However, one crucial underlying factor
is to change our attitudes.
											Employees are resources, are assets,
											not costs, not head counts,
											not machines,
											not even the Germans.
									","
											Porém, há um fator crucial subjacente, 
que vai mudar as nossas atitudes.
											Os empregados 
são um recurso, são um ativo.
											Não são um custo, 
não são um quadro de números.
											Não são máquinas,
											nem mesmo os alemães.
									","
											Cependant, un facteur déterminant
et sous-jacent
											sera le changement d'attitude
de notre part.
											Les employés sont des ressources,
des atouts,
											pas des coûts,
pas des têtes de bétail,
											pas des machines,
											pas même les Allemands.
									","
											Ein wichtiger unterschwelliger Faktor
ist die Veränderung unserer Einstellungen.
											Angestellte sind Ressourcen, sind Kapital,
											nicht Kosten, nicht Personalstand,
nicht Maschinen,
											auch nicht die Deutschen.
									",The workforce crisis of 2030 — and how to start solving it now,Rainer Strack,12:47,"business,global issues,productivity,work"
"
","
","
","
",The workforce crisis of 2030 — and how to start solving it now,Rainer Strack,12:47,"business,global issues,productivity,work"
"
											Thank you.
									","
											Obrigado.
									","
											Merci.
									","
											Danke.
									",The workforce crisis of 2030 — and how to start solving it now,Rainer Strack,12:47,"business,global issues,productivity,work"
"
","
","
","
",The workforce crisis of 2030 — and how to start solving it now,Rainer Strack,12:47,"business,global issues,productivity,work"
"
											(Applause)
									","
											(Aplausos)
									","
											(Applaudissements)
									","
											(Applaus)
									",The workforce crisis of 2030 — and how to start solving it now,Rainer Strack,12:47,"business,global issues,productivity,work"
"
","
","
","
",The workforce crisis of 2030 — and how to start solving it now,Rainer Strack,12:47,"business,global issues,productivity,work"
