en,tr,es,title,speaker,duration,tags
"
											Where in the world
is it easiest to get ...
											rich?
											That's the question I asked my professor
when I studied sociology in the early 90s
											because he was having a lecture
											about social democracies,
the Scandinavian welfare state,
											and he was a classical
left-wing sociology professor,
											and he could not hide his enthusiasm
											when he talked about
these egalitarian societies
											with no rich people and no poor people.
											But I, on the other hand, I was writing
my master's thesis about rich people.
											When I interviewed my informants
from the upper classes,
											they all said the same thing:
											""Life in Scandinavia is tough.""
											(Laughter)
											""We have to work twice
as hard to earn money
											because we have to struggle against:
											high taxes,
											strong unions controlling the wages
											and a generous welfare state
that makes people lazy.""
											As one rich guy told me,
											he said, ""They call it
a social security net.
											Well, I call it a hammock.""
											(Laughter)
											And as every aspiring social scientist,
I started to go native;
											I started to feel sympathy
for these rich people.
											And that's why I raised my hand
and asked my professor,
											""Well, what if you don't care
so much about equality?
											What if your dream is to become rich?
											Where in the world should I have been born
to become really rich?""
											I still remember the puzzled look
on my professor's face.
											But he answered the best he could.
											Something like,
""Well, if that's your goal in life,
											you should probably
have been born in a society
											with free markets, low taxes,
											and minimal government intervention.
											And he added, ""If you want to become rich,
											you should probably not study sociology.""
											(Laughter)
											That was a good answer
and the best guess we had back then.
											That is until I saw that the University
of Oslo professor in Economy, Karl Moene,
											actually had checked the facts:
											""Where in the world
is it easiest to get rich?""
											And before I share with you
											where you should go to earn money,
											we have to define ""rich.""
											The UN talks about the poverty line.
											You know, if you earn
less than one dollar a day,
											maybe two dollars a day.
											But we have to define the richness line.
											It's a more fun line, actually.
											And the most reliable report,
when it comes to rich people,
											the Wealth Report,
											they set the richness line
											at individuals with net worth
more than 30 million USD.
											In the consultant jargon,
these people are called UHNWI's.
											That is Ultra High Net Worth Individuals.
											That guy, by the way, is not rich.
He is just a model.
											(Laughter)
											Actually, on the lower part of the model.
											(Laughter)
											And I have saved some money
by keeping the watermark there as well.
											(Laughter)
											Smart.
											(Laughter) (Applause)
											So, according to The Wealth Report,
											there are more than 170, 000
											UHNWI's in the world.
											And here is the top five list
of countries with the richest people.
											Number five: China, with more than 8,000.
											UK, Germany, Japan,
											and on top, of course, the United States
with more than 40,000 rich people.
											But of course, we are not interested 
in the absolute numbers here.
											We are interested in rich people
per capita, per million inhabitants.
											And if we leave out the pure tax havens,
											like Cyprus, and Switzerland,
Hong Kong, Singapore, Monaco -
											where we have an artificially
huge share of rich people -
											it turns out that we have
on number 5 Denmark -
											with 179 rich people
per one million inhabitants -
											Canada, New Zealand, Sweden
and on top: Norway.
											(Laughter)
											But where's the US?
											On place 13.
											So what happened to my old professor's,
you know, social democracies?
											There are no rich people there.
											But OK. 30 million dollars,
											that's just pocket money
in a country like the US,
											where people can get insanely rich.
											(Laughter)
											Look at the watermark again?
											(Laughter)
											So, let's raise the richness line
up from 30 million dollars up to ...
											1 billion dollars.
											And the most reliable source here
is the Forbes billionaires list.
											And according to the Forbes,
											if you look at billionaires
per million inhabitants.
											Number 5, Germany: 1.2 billionaires.
											1.2 billionaires per million inhabitants.
											The United States 1.7, Norway 2, Sweden,
											and on top Iceland with 3.1
											(Laughter)
											With a single billionaire:
Thor Björgólfsson.
											(Laughter) (Applause)
											He could have been a model.
											(Laughter)
											But the point is, the United States: 1.7
Scandinavia taken as a whole: 2.1
											And the big mystery is ...
											How can this be?
											How can Bernie Sanders' dream societies,

											these socialist paradises
											be such a breeding place for rich people?
											(Laughter)
											That's a mystery.
											(Laughter)
											There are two reasons.
											Reason number one is free education.
											Social democracies give free
higher education to everybody,
											and cheap student loans, and grants.
											That enables more people
to use their talents and earn money.
											We can see this
in the social mobility numbers.
											Imagine all fathers in a society,
											and we divide them into five groups
based on income:
											from the bottom fifth up to the top fifth.
											Then we look at their sons,
											and divide their income into five steps,
											and we see how many sons of the fathers
from the bottom income
											end up on top.
											How many sons go from rags to riches?
											If it was perfect social mobility,
											if talents and opportunities
were equally distributed,
											20% from the bottom would end up
on each of these five ladders.
											So let's look at the numbers
for the different countries.
											In Denmark, they are pretty close
to perfect social mobility
											with 14% that goes from rags to riches.
											In Norway 12, Sweden 11,
the United States 8.
											Because of free education,
											there are more self-made men
in Scandinavia than in the US.
											And if we look at those sons who don't
end up on top but stay at the bottom,
											that go from rags to rags.
											Again, 20% would be perfect mobility.
											In Denmark, 25% ends up at the bottom,
											Sweden a bit more. Norway.
											And look at the United States.
											This is because education
in the United States is very expensive.
											But the second and
most important explanation
											for Scandinavia being such
a breeding place for rich people is this:
											Have you ever noticed
if you have been to the United States,
											when you drive around
and drive through a toll plaza,
											there are actually people sitting there
taking your money.
											Compare that to my local toll plaza.
											(Laughter)
											Just a sign with some
gizmo attached to it.
											And when you go to a supermarket
in the United States,
											there are actually people there helping
to pack your things into your bags.
											It's very friendly and convenient
compared to my local grocery store.
											Like this.
											(Laughter)
											There's nobody there.
											(Laughter)
											The biggest shock I had
when I went to the US for the first time,
											when I went to the restroom,
											there were actually people working there.
											Compare that to my local public toilet.
											(Laughter)
											There's not even a cleaner there;
it cleans itself automatically.
											And the reason for this difference
											is that Scandinavian unions
are pressing up the minimum wages.
											It's so expensive to have
these people working there.
											In Norway, tollbooth operators,
supermarket packers,
											and a restroom janitor
											would earn almost three times
as much as in the US.
											And that's why we have replaced
these people with machines.
											That is why I was surprised
when I saw this article
											in The New York Times in 2014.
											Preparing for Chip-and-PIN Cards
in the United States.
											(Laughter)
											Because in the United States
people are still using paper checks
											as a method of payment,
											while Scandinavian banks have made us 
start using Chip-and-PIN cards long ago.
											Because the minimum wages
here are so high.
											So Scandinavian banks can't afford
having people manually control the checks.
											So Scandinavian companies,
											because of the unions
pressing up the wages,
											they have to downsize
and introduce new technology or else ...
											they will go broke.
											And new technology increases
the productivity in a society,
											which in the long run
also increases profit.
											And on the upper end of the wage ladder,
											in the name of solidarity,
											Scandinavian unions hold back the highest
salaries of the skilled workers.
											So for example,
a Norwegian senior engineer -
											it's my uncle, by the way.
											(Laughter)
											That's why there's no watermark there.
											(Laughter)
											Actually, he would look cooler
with a watermark, better.
											(Laughter)
											He earns, on average per year,
76,000 dollars,
											while his American colleague earns
more than 100,000 dollars.
											So American engineers ...
											(Laughter)
											They are not only more good-looking,
but they are more expensive.
											Of course, this wage restraint
on high-skilled work is good for profit.
											So, the unions are in effect
subsidizing the capitalists.
											I wish I knew all this when I gave up
a career in social science
											because the beauty and the irony
of these findings, I think, is amazing.
											On the one hand,
you have my rich informants
											that complain about how hard
it is to get rich in Scandinavia.
											They had it all wrong.
											Not only is it easier to get rich
in a social democracy,
											but they are critical
to the very institutions
											that have helped them get rich.
											High taxes, which gives free education
and more talent into the economy.
											Strong unions that are helping
to increase productivity,
											and a generous welfare state
that makes the unions accept downsizing
											because they know that their members
will be well taken care of.
											So the unions cooperate
because of the safety net.
											So rich people are a bit like
Immanuel Kant's famous bird,
											who thinks she could fly
even faster in airless space,
											forgetting that it's the air itself
that gives her lift.
											On the other part
of the political spectrum,
											when Bernie Sanders is praising
Scandinavian societies,
											he forgets that these are not anti-rich
or anti-capitalist systems.
											Because the welfare state and the unions
work in tandem with capitalist dynamics.
											And I think that is the most
important lesson here.
											The economy is not a zero-sum game.
											We are in this together.
											And that is why Scandinavia
is a better place
											to fulfill the American dream ...
											(Laughter)
											than America itself.
											Thank you so much.
											(Applause) (Cheering)
									","
											Dünyanın neresinde zengin olmak
											daha kolay?
											Bu, 90'ların başında sosyoloji okurken
profesörüme sorduğum soruydu.
											Çünkü o, sosyal demokrasiler
											ve İskandinav refah devleti
hakkında ders veriyordu.
											Klasik solcu bir sosyoloji profesörüydü ve
											zengin ve yoksul insanların olmadığı
											bu eşitlikçi toplumlardan bahsederken
											heyecanını gizleyemiyordu.
											Öte yandan ben yüksek lisans tezimi
zengin insanlar üzerine yazıyordum.
											Üst sınıflardan deneklerle
görüşme yaptığımda
											hepsi aynı şeyi söyledi:
											""İskandinavya'da hayat çok zor.""
											(Gülüşmeler)
											""Para kazanmak için iki kat
daha fazla çalışmamız gerek,
											çünkü şunlara karşı
mücadele etmemiz gerek:
											Yüksek vergiler,
											ücretleri kontrol eden
güçlü sendikalar
											ve insanları tembelleştiren
cömert refah devleti.
											Zengin bir adam bana şunu dedi:
											""Onlar buna sosyal güvenlik 'ağı' diyor.
											Ben 'hamak' diyorum.""
											(Gülüşmeler)
											Her hevesli sosyal bilimci gibi
onlardan biri gibi olmaya başladım.
											Bu zengin insanlar için
sempati duymaya başladım.
											Bu yüzden elimi kaldırıp
profesörüme şunu sordum
											""Peki ya eşitliği bu kadar
önemsemeseydiniz?
											Ya hayaliniz zengin olmak olsaydı?
											Gerçekten zengin olmak için dünyanın
neresinde doğmuş olmam gerekirdi?""
											Profesörümün suratındaki
şaşkın ifadeyi hâlâ hatırlarım.
											Elinden gelen en iyi şekilde cevapladı.
											""Pekâlâ, eğer hayattaki amacın bu ise
											muhtemelen serbest piyasa, düşük vergiler
											ve asgari düzeyde hükumet müdahalesi olan
											bir toplumda doğmuş olman gerekirdi.""
											Ve ekledi: ""Eğer zengin olmak istiyorsan,
											muhtemelen sosyoloji okumamalısın.""
											(Gülüşmeler)
											İyi bir cevaptı ve o zamanlar
elimizdeki en iyi varsayımdı.
											Ta ki Oslo Üniversitesi'nde ekonomi
profesörü olan Karl Moene
											bunların doğruluğunu
kontrol edene kadar.
											""Dünyanın neresinde
zengin olmak daha kolay?""
											Para kazanmak için
											nereye gitmeniz gerektiğini
paylaşmadan önce,
											""zengin"" kelimesini tanımlamamız gerek.
											BM yoksulluk sınırından söz ediyor.
											Bilirsiniz, eğer günde
1 dolar ya da 2 dolardan
											az kazanırsanız falan.
											Ancak bizim zenginlik
sınırını tanımlamamız gerek.
											Daha eğlenceli bir sınır doğrusu.
											Zengin insanlar söz konusu
olduğunda en güvenilir rapor olan
											Varlık Raporu,
											zenginlik sınırını,
											net serveti 30 milyon Amerikan
dolarından fazla olanlara göre belirliyor.
											Uzman jargonunda bu
insanlara UYNVB deniyor.
											Ultra Yüksek Net Varlıklı Bireyler demek.
											Bu adam zengin değil bu arada.
Sadece model.
											(Gülüşmeler)
											Modelliğin de düşük seviyesinde.
											(Gülüşmeler)
											Ayrıca filigranı orada bırakarak
biraz para tasarrufu da yaptım.
											(Gülüşmeler)
											Kurnaz.
											(Gülüşmeler) (Alkış)
											Varlık Raporu'na göre,
											dünyada 170.000'den fazla
											UYNVB bulunuyor.
											İşte en zengin insanlara sahip
ülkelerde ilk beş şöyle:
											8.000'den fazla zengin ile beşinci Çin.
											Birleşik Krallık, Almanya, Japonya
											ve zirvede 40.000'den fazla
zengin insan ile ABD var.
											Tabii ki bu mutlak
sayılarla ilgilenmiyoruz.
											Kişi başına, bir milyon kişi başına
düşen zengin insanlarla ilgileniyoruz.
											Eğer zengin insanların büyük
yapay katılımının olduğu
											Kıbrıs, İsviçre, Hong Kong,
Singapur, Monako gibi
											vergi cennetlerini hariç tutarsak,
											5 numarada bir milyon kişi başına düşen
											179 zengin insan ile Danimarka var.
											Kanada, Yeni Zelanda,
İsveç ve zirvede Norveç.
											(Gülüşmeler)
											Fakat ABD nerede?
											13. sırada.
											Eski profesörümün sosyal
demokrasilerine ne oldu?
											Oralarda zengin insan bulunmaz.
											Tamam hadi. 30 milyon dolar,
											ABD gibi insanların
delicesine zengin olabildiği
											bir ülkede sadece cep harçlığı.
											(Gülüşmeler)
											Filigrana tekrar bakın.
											(Gülüşmeler)
											Zenginlik sınırını 30 milyon dolardan
											1 milyar dolara çıkaralım.
											Burada en güvenilir kaynak,
Forbes'un milyarderler listesi.
											Forbes'a göre,
											eğer bir milyon kişi başına
düşen milyarderlere bakarsak,
											1.2 milyarder ile Almanya beşinci sırada.
											1 milyon kişi başına düşen 1.2 milyarder.
											ABD 1.7, Norveç 2, İsveç
											ve zirvede 3.1 ile İzlanda.
											(Gülüşmeler)
											Tek milyarder ile: Thor Björgólfsson.
											(Gülüşmeler) (Alkış)
											Model olabilirmiş.
											(Gülüşmeler)
											Asıl nokta şu. ABD 1.7 ve
İskandinavya bütün olarak 2.1.
											Büyük muamma ise...
											Bu nasıl olabilir?
											Bernie Sanders'ın hayalindeki toplumlar,
											bu sosyalist cennetler
											nasıl olur da zengin insanların
çoğaldığı bir yer olur?
											(Gülüşmeler)
											Bu bir muamma.
											(Gülüşmeler)
											İki nedeni var.
											Birinci neden eğitimin ücretsiz olması.
											Sosyal demokrasiler herkese
ücretsiz yüksek öğrenim,
											ucuz öğrenci kredisi ve burslar veriyor.
											Bu da, daha çok insanın yeteneklerini
kullanmasını ve para kazanmasını sağlıyor.
											Bunu toplumsal hareketlilik
rakamlarında görebiliyoruz.
											Bir toplumdaki bütün babaları düşünün.
											Onları gelirlerine göre
beş gruba ayırıyoruz,
											alttaki beşinciden üstteki beşinciye.
											Sonra oğullarına bakıyoruz
											ve gelirlerini beş basamağa ayırıyoruz.
											En alttaki gelire sahip
babaların kaçının oğlunun
											üste geldiğini görüyoruz.
											Kaç oğul yoksulluktan zenginliğe geçiyor?
											Eğer bu, kusursuz bir toplumsal
hareketlilik olsaydı,
											eğer yetenekler ve fırsatlar
eşit olarak dağıtılmış olsaydı,
											alttakilerin %20'si bu beş
basamaktan birinde olurdu.
											Farklı ülkelerdeki rakamlara bakalım.
											Danimarka'da kusursuz toplumsal
hareketliliğe oldukça yakınlar,
											yoksulluktan zenginliğe geçen %14 ile.
											Norveç'te 12, İsveç'te 11, ABD'de 8.
											Ücretsiz eğitim sayesinde,
											İskandinavya'da ABD'den daha çok kendi
çabalarıyla bir yere gelmiş insan var.
											Zirveye gelmemiş, altta kalan,
											yoksulken yoksul olan oğlanlara bakalım.
											Tekrar söylüyorum, %20
kusursuz hareketlilik.
											Danimarka'da %25 en altta kalıyor.
											İsveç biraz daha fazla. Norveç.
											Ve ABD'ye bakın.
											Bunun nedeni ABD'de
eğitimin çok pahalı olması.
											İskandinavya'nın zengin
insanların çoğaldığı
											bir yer olmasının ikinci ve
en önemli nedeni ise şu:
											ABD'ye gittiyseniz hiç fark ettiniz mi,
											arabayla dolaştığınızda ve ücretli
geçiş gişesinden geçtiğinizde
											orada oturup paranızı alan insanlar var.
											Benim semtimdeki ücretli
geçiş gişesiyle kıyaslayın.
											(Gülüşmeler)
											Üzerine zımbırtılar
tutturulmuş bir levha sadece.
											ABD'de bir süpermarkete gittiğinizde,
											aldıklarınızı poşetlerinize koymanıza
yardım eden insanlar var.
											Benim semtimdeki markete
kıyasla oldukça kibar ve işe yarar.
											Böyle.
											(Gülüşmeler)
											Kimse yok.
											(Gülüşmeler)
											ABD'ye ilk kez gittiğimde
yaşadığım en büyük şok,
											tuvalete gittiğimde
											orada çalışan insanların olmasıydı.
											Benim semtimdeki umumi
tuvalet ile kıyaslayın.
											(Gülüşmeler)
											Temizleyen biri bile yok.
Kendi kendini temizliyor.
											Bu farklılığın nedeni,
											İskandinav sendikaların asgari
ücretleri arttırıyor olması.
											Bu insanları orada çalıştırmak çok pahalı.
											Norveç'te gişe operatörleri,
süpermarket poşetleyicileri
											ve tuvalet temizlik görevlisi
											ABD'dekinden neredeyse üç
kat daha fazla kazanacaktır.
											Bu yüzden bu insanların
yerini makinelere verdik.
											Bu yüzden, 2014'te 
The New York Times'da
											şu makaleyi görünce şaşırmıştım.
											ABD'de Chip&amp;PIN'li
kartlar için hazır olun.
											(Gülüşmeler)
											Çünkü ABD'de insanlar
ödeme yöntemi olarak
											hâlâ kağıt çekler kullanıyorlar.
											İskandinav bankaları bize Chip&amp;PIN
kullandırmaya başlayalı uzun zaman oldu.
											Çünkü burada asgari ücretler çok yüksek.
											İskandinav bankalar, çekleri elde
kontrol eden insanları çalıştıramıyor.
											Sendikalar ücretleri yükselttiğinden,
											İskandinav şirketler
											küçülmeye gitmek ve yeni
teknolojiler sunmak zorunda kalıyor,
											aksi halde batarlar.
											Yeni teknoloji bir toplumdaki
üretkenliği arttırır,
											ki bu da uzun vadede kârı arttırır.
											İskandinav sendikalar,
											dayanışma adına,
											ücret basamağının en üstünde kalifiye
çalışanların en yüksek maaşlarını tutuyor.
											Örneğin Norveçli kıdemli bir mühendis,
											Bu arada bu benim amcam.
											(Gülüşmeler)
											Bu yüzden üzerinde filigran yok.
											(Gülüşmeler)
											Aslına bakarsanız filigranla
daha havalı görünürdü.
											(Gülüşmeler)
											Yıllık ortalama 76.000 dolar kazanıyor,
											Amerikan meslektaşı ise 100.000
dolardan fazla kazanıyor.
											Yani Amerikalı mühendisler,
											(Gülüşmeler)
											Daha yakışıklı olmakla kalmıyorlar,
bir de daha pahalıya çalışıyorlar.
											Çok yetenek isteyen işle sınırlı
kalan bu ücret, kâr için iyi.
											Yani sendikalar aslında
kapitalistleri finanse ediyor.
											Sosyal bilimlerde kariyer yapmaktan
vazgeçtiğimde bunu bilmeyi isterdim
											çünkü bu bulguların güzelliği
ve ironisi bence inanılmaz.
											Bir yandan İskandinavya'da zengin olmanın
											ne kadar zor olduğundan şikayetçi
olan deneklerimi gördünüz.
											Olayı tamamen yanlış anlamışlar.
											Sadece sosyal demokraside daha
kolay zengin olunduğunu değil,
											zengin olmalarına yardım etmiş olan
											kurumlar için önemli olduklarını da.
											Ücretsiz eğitim veren ve ekonomiye daha
çok yetenek kazandıran yüksek vergiler,
											üretkenliği arttırmaya yardımcı
olan güçlü sendikalar
											ve sendikaları küçülmeye ikna
eden cömert refah devleti
											çünkü biliyorlar ki
üyelerine iyi bakılacak.
											Bu yüzden sendikalar güvenlik
ağı sayesinde işbirliği yapıyor.
											Zengin insanlar birazcık Immanuel Kant'ın,
											havasız yerde daha hızlı
uçabileceğini düşünen
											ve onu uçuran şeyin hava
olduğunu unutan ünlü kuşu gibiler.
											Siyasi yelpazenin diğer tarafında,
											Bernie Sanders İskandinav
toplumlarını övdüğünde
											bunların zengin karşıtı ya da kapitalist
karşıtı sistemler olmadığını unutuyor.
											Refah devleti ve sendikalar, kapitalist
dinamiğiyle koordinasyon içinde çalışıyor.
											Buradan çıkarmamız gereken
en önemli ders bu bence.
											Ekonomi, biri kazanırken
diğerinin kaybettiği oyun değil.
											Bu işte beraberiz.
											Bu yüzden İskandinavya
											Amerikan rüyasını gerçekleştirmek için
											(Gülüşmeler)
											Amerika'dan daha iyi bir yer.
											Çok teşekkür ederim.
											(Alkış) (Tezahürat)
									","
											¿Dónde es más fácil en el mundo
											hacerse rico?
											Esa es la pregunta que hice a mi profesor
cuando estudiaba sociología en los 90s
											porque él estaba dando una conferencia
											sobre las democracias sociales,
el estado de bienestar escandinavo,
											y él era un clásico profesor 
de sociología de izquierda,
											y no podía ocultar su entusiasmo
											cuando hablaba de estas
sociedades igualitarias
											sin gente rica y sin gente pobre.
											Pero yo, por otro lado, estaba escribiendo
mi tesis de maestría sobre personas ricas.
											Cuando entrevisté a mis informantes
de las clases altas,
											todos decían lo mismo:
											""La vida en Escandinavia es dura"".
											(Risas)
											""Tenemos que trabajar el doble
para ganar dinero,
											porque tenemos que luchar contra:
											impuestos elevados,
											sindicatos fuertes
que controlan los salarios,
											y un generoso estado de bienestar
que hace que la gente sea perezosa"".
											Como me dijo un tipo rico:
											""Lo llaman una red de seguridad social.
											Bien, yo lo llamo una hamaca"".
											(Risas)
											Y como todo aspirante a científico social,
empecé a adoptar las costumbres.
											Empecé a sentir simpatía
por esta gente rica.
											Y es por eso que levanté mi mano
y le pregunté a mi profesor:
											""Bueno, ¿y si no le importa
mucho la igualdad?
											¿Qué pasa si su sueño es ser rico?
											¿Dónde en el mundo debería haber nacido
para realmente hacerme rico?""
											Aún recuerdo la mirada perpleja
en la cara de mi profesor.
											Pero respondió lo mejor que pudo.
											Algo así como, ""Bueno, 
si ese es tu objetivo en la vida,
											probablemente deberías
haber nacido en una sociedad
											con mercados libres, impuestos bajos,
											y mínima intervención gubernamental.
											Y agregó: ""Si quieres ser rico,
											probablemente no deberías 
estudiar sociología"".
											(Risas)
											Esa fue una buena respuesta,
y la mejor conjetura que tuvimos entonces.
											Eso es, hasta que vi
que el profesor de economía Karl Moene,
											de la Universidad de Oslo
											había efectivamente revisado los datos:
											""¿Dónde en el mundo 
es más fácil hacerse rico?""
											Y antes de compartir con Uds.
											dónde deberían ir para ganar dinero,
											tenemos que definir ""rico"".
											La ONU define la línea de pobreza.
											Ya saben, si ganas
menos de un dólar por día,
											quizás dos dólares por día.
											Pero tenemos que definir 
la línea de riqueza.
											Es realmente una línea más divertida.
											Y el informe más confiable,
cuando se trata de gente rica,
											el Informe de Riqueza,
											establece la línea de riqueza
											a personas con un patrimonio neto
de más de USD 30 millones.
											En la jerga del consultor,
estas personas se llaman PAVN.
											Esto es, Personas de Alto Valor Neto.
											Ese tipo, por cierto, no es rico.
Es solo un modelo.
											(Risas)
											Realmente, de la escala
inferior del modelo.
											(Risas)
											Y he ahorrado algo de dinero
manteniendo la marca de agua allí también.
											(Risas)
											Astuto.
											(Risas) (Aplausos)
											Entonces, de acuerdo al Informe de Riqueza,
											hay más de 170 000
											PAVN en el mundo.
											Y aquí está la lista de los cinco primeros
países con las personas más ricas.
											Número cinco: China, con más de 8000.
											Reino Unido, Alemania, Japón,
											y en la cima, por supuesto, EE.UU.,
con más de 40 000 personas ricas.
											Pero por supuesto, no estamos interesados
en los números absolutos aquí.
											Estamos interesados ​​en personas ricas
per cápita, por millón de habitantes.
											Y si dejamos fuera 
las guaridas fiscales puras,
											como Chipre y Suiza,
Hong Kong, Singapur, Mónaco
											—donde tenemos una proporción
artificial de personas ricas—
											resulta que tenemos
en el número 5 a Dinamarca
											con 179 personas ricas
por millón de habitantes;
											Canadá, Nueva Zelanda, Suecia
y en el primer puesto: Noruega.
											(Risas)
											Pero, ¿dónde está EE.UU.?
											En el puesto 13.
											Entonces, ¿qué pasó con las democracias
sociales de mi antiguo profesor?
											No hay gente rica allí.
											Pero está bien. USD 30 millones,
											eso es solo cambio chico
en un país como EE.UU.,
											donde las personas pueden 
volverse absurdamente ricas.
											(Risas)
											¿Miraron la marca de agua de nuevo?
											(Risas)
											Entonces, elevemos la línea de riqueza
de USD 30 millones...
											a USD 1000 millones.
											Y la fuente más confiable aquí es la 
lista de multimillonarios de Forbes.
											De acuerdo a Forbes,
											si miras multimillonarios
por millón de habitantes.
											Número 5, Alemania: 1,2 multimillonarios.
											1,2 multimillonarios
por millón de habitantes.
											EE.UU. 1,7, Noruega 2, Suecia [2,4]
											y en la cima, Islandia con 3,1.
											(Risas)
											Con un solo multimillonario: 
Thor Björgólfsson.
											(Risas) (Aplausos)
											Pudo haber sido un modelo.
											(Risas)
											Pero la idea es, EE.UU.: 1,7.
Escandinavia tomada como un todo: 2,1.
											Y el gran misterio es...
											¿Cómo puede ser esto?
											¿Cómo pueden las sociedades 
soñadas por Bernie Sanders,
											estos paraísos socialistas
											ser un lugar de crianza para ricos?
											(Risas)
											Eso es un misterio.
											(Risas)
											Existen dos razones.
											La razón número uno 
es la educación gratuita.
											Las democracias sociales
dan educación superior gratis para todos,
											y préstamos estudiantiles baratos, 
y becas.
											Eso permite que más personas
puedan usar sus talentos y ganar dinero.
											Podemos ver esto en los números
de movilidad social.
											Imaginen a todos los padres 
en una sociedad,
											y los dividimos en cinco grupos
con base en el ingreso:
											desde la quinta parte inferior
a la quinta superior.
											Luego observamos a sus hijos,
											y dividimos sus ingresos en cinco niveles,
											y vemos cuántos hijos de los padres
desde el ingreso inferior
											terminan en la cima.
											¿Cuántos hijos van 
de la pobreza a la riqueza?
											Si fuese una movilidad social perfecta,
											si talentos y oportunidades
fueron distribuidos por igual,
											20 % de la parte inferior terminaría
en cada uno de estos cinco niveles.
											Así que veamos los números
para los diferentes países
											En Dinamarca, están bastante cerca
de perfeccionar la movilidad social
											con un 14 % que va de harapos a opulencia.
											En Noruega 12 %, Suecia 11 %, EE.UU. 8 %.
											Debido a la educación gratuita,
											hay más hombres hechos a sí mismos
en Escandinavia que en EE.UU.
											Y si miramos a esos hijos que no terminan
en la parte superior sino al final,
											que van de harapos a harapos.
											Nuevamente, 20 % sería
una movilidad perfecta.
											En Dinamarca, el 25 %
termina en la parte inferior,
											Suecia un poco más. Noruega.
											Y observen EE.UU.
											Esto es porque la educación
en EE.UU. es muy costosa.
											Pero la segunda
y más importante explicación
											para que Escandinavia sea un lugar
de crianza para los ricos es esta:
											¿Alguna vez han notado,
si han estado en EE.UU.,
											cuando conducen por ahí
y atraviesan un control de peaje,
											hay personas sentadas allí
tomando tu dinero?
											Compara eso con mi puesto de peaje local.
											(Risas)
											Solo un letrero con algún aparato adosado.
											Y cuando van a un supermercado en EE.UU.,
											en realidad, hay personas allí ayudando
a empacar tus compras en las bolsas.
											Es muy amigable y conveniente,
comparado con mi proveedor local.
											Como este.
											(Risas)
											No hay nadie allí.
											(Risas)
											El mayor shock que tuve cuando 
fui a EE.UU. por primera vez,
											cuando fui al baño,
											había realmente personas trabajando allí.
											Compara eso con mi baño público local.
											(Risas)
											Ni siquiera hay un limpiador allí;
se limpia automáticamente.
											Y la razón de esta diferencia
											es que los sindicatos escandinavos
están presionando los salarios mínimos.
											Es muy caro tener
estas personas trabajando allí.
											En Noruega, operadores de peaje,
empacadores de supermercado,
											y conserje de baño
											ganarían casi tres veces más
que en EE.UU.
											Y es por eso que hemos reemplazado
esas personas por máquinas.
											Por eso me sorprendió
cuando vi este artículo
											en The New York Times en 2014.
											Preparación para tarjetas 
con chip y PIN en EE.UU.
											(Risas)
											Porque en EE.UU. la gente 
todavía usa cheques de papel
											como método de pago,
											mientras que los bancos escandinavos
ya nos han hecho usar tarjetas chip y PIN
											porque los salarios mínimos
aquí son tan altos
											que los bancos escandinavos
no pueden permitirse pagar personas
											que controlen manualmente los cheques.
											Así que las empresas escandinavas,
											debido a los sindicatos
que presionan sobre los salarios,
											tienen que reducir su tamaño
e introducir nueva tecnología, o bien...
											irán a la quiebra.
											La nueva tecnología aumenta
la productividad en una sociedad
											y eso, en el largo plazo,
también aumenta el beneficio.
											Y en el extremo superior 
de la escala salarial,
											en nombre de la solidaridad,
											los sindicatos escandinavos retrasan 
los salarios de trabajadores calificados.
											Así, por ejemplo,
un ingeniero adulto noruego...
											es mi tío, por cierto.
											(Risas)
											Es por eso que no hay marca de agua allí.
											(Risas)
											En realidad, se vería más fresco
y mejor con una marca de agua.
											(Risas)
											Él gana, en promedio por año, USD 76 000,
											mientras que su colega estadounidense
gana más de USD 100 000.
											Entonces los ingenieros estadounidenses...
											(Risas)
											No solo son más guapos,
sino también más caros.
											Por supuesto, este límite salarial 
en el trabajo altamente calificado,
											¡es bueno para obtener ganancias!
											Entonces, los sindicatos están en efecto 
subsidiando a los capitalistas.
											Ojalá hubiera sabido todo esto cuando dejé
una carrera en ciencias sociales,
											porque la belleza y la ironía
de estos hallazgos, creo, es sorprendente.
											Por un lado, tienen mis informantes ricos
											que se quejan de lo difícil 
que es hacerse rico en Escandinavia.
											¡Se equivocaban por completo!
											No solo es más fácil hacerse rico 
en una democracia social,
											sino que son críticos 
hacia las mismas instituciones
											que los han ayudado a hacerse ricos.
											Impuestos altos, lo que brinda educación 
gratuita y más talento a la economía.
											Sindicatos fuertes que están ayudando 
a aumentar la productividad,
											y un generoso estado de bienestar que hace
a los sindicatos aceptar la reducción,
											porque saben que sus miembros 
estarán bien atendidos.
											Entonces los sindicatos cooperan
debido a la red de seguridad.
											Así que los ricos son un poco como
el famoso pájaro de Immanuel Kant,
											que piensa que podría volar 
aún más rápido en un espacio sin aire,
											olvidando que es el aire mismo 
lo que le da impulso.
											En la otra parte del espectro político,
											cuando Bernie Sanders está alabando
a las sociedades escandinavas,
											olvida que estos no son sistemas 
anti-ricos o anti-capitalistas.
											Porque el estado de bienestar
y los sindicatos
											operan en tándem
con la dinámica capitalista.
											Y creo que esa es la lección 
más importante aquí.
											La economía no es un juego de suma cero.
											Estamos juntos en esto.
											Y es por eso que Escandinavia 
es un lugar mejor
											para cumplir el ""sueño americano"".
											(Risas)
											que EE.UU. mismo.
											Muchas gracias.
											(Aplausos) (Ovación)
									",Where in the world is it easiest to get rich?,Harald Eia,15:42,"global issues,capitalism,global development,economics,government"
