en,es,tr,fr,de,title,speaker,duration,tags
"
											But I'm more of the revolutionary,
											and I should be; I'm from Iceland.
											We have a long history
											of strong, courageous, independent women,
											ever since the Viking age.
											And I want to tell you when
											I first realized that women matter to the economy
											and to the society,
											I was seven — it happened to be my mother's birthday —
											October 24, 1975.
											Women in Iceland took the day off.
											From work or from home, they took the day off,
											and nothing worked in Iceland.
											(Laughter)
											They marched into the center of Reykjavik,
											and they put women's issues onto the agenda.
											And some say this was the start of a global movement.
											For me it was the start of a long journey,
											but I decided that day to matter.
											Five years later,
											Iceland elected Vigdis Finnbogadottir as their president —
											first female to become head of state,
											single mom,
											a breast cancer survivor
											who had had one of her breasts removed.
											And at one of the campaign sessions,
											she had one of her male contenders
											allude to the fact that she couldn't become president —
											she was a woman, and even half a woman.
											That night she won the election,
											because she came back —
											not just because of his crappy behavior —
											but she came back and said,
											""Well, I'm actually not going to breastfeed the Icelandic nation;
											I'm going to lead it.""
									","
											Yo soy más bien revolucionaria,
											como debe ser; soy islandesa.
											Tenemos una historia larga
											de mujeres fuertes, valientes e independientes
											desde la época de los vikingos.
											Y quiero contarles cuándo me di cuenta
											por primera vez que las mujeres importan en la economía
											y en la sociedad.
											Yo tenía 7 años, justo era el cumpleaños de mi madre,
											24 de octubre de 1975.
											Las mujeres islandesas se tomaron el día libre.
											En el trabajo y en la casa se tomaron el día libre
											y nada funcionó en Islandia.
											(Risas)
											Manifestaron en el centro de Reykjavik,
											y pusieron los temas de la mujer en la agenda.
											Y algunos dicen que fue el inicio de un movimiento global.
											Para mí fue el comienzo de un largo viaje
											pero decidí que ese día importaría.
											Cinco años después
											Islandia eligió a Vigdís Finnbogadóttir como presidenta,
											primera mujer en ser jefe de Estado,
											madre soltera,
											sobreviviente de cáncer de mama,
											a quién se le tuvo que extirpar un seno.
											Y en una de las etapas de la campaña,
											uno de sus contendientes masculinos
											aludió al hecho de que no podía ser presidente
											por ser mujer, e incluso media mujer.
											Esa noche ganó las elecciones,
											porque le respondió,
											no sólo por ese comportamiento ruin,
											sino que ella respondió y dijo:
											""Bueno, en realidad no voy a amamantar a la nación islandesa,
											la voy a liderar"".
									","
											Ama ben biraz daha radikalim,
											ve olmalıyım da; ben İzlandalıyım.
											Ve bizim tarihimiz
											güçlü, cesaretli ve bağımsız kadınlarla dolu;
											Viking çağından beri.
											Size kadınların ekonomiye
											ve topluma ne kadar önemli olduğunu anladığım
											zamanı anlatmak istiyorum.
											Henüz yedi yaşındaydım, ve o gün şans eseri annemin yaş günüydü.
											Ekim 24, 1975.
											Kadınlar günübirlik bir izin aldılar.
											İşten veya evden, bir günlük izin yaptılar
											ve İzlanda'da hayat durdu.
											(Kahkahalar)
											Reykjavik'in merkezine yürüdüler
											ve kadın haklarını ajandaya yerleştirdiler.
											Ve bazıları bunun global bir hareketin başlangıcı olduğunu söyleyebilir.
											Benim için uzun bir yolculuğun başlangıcıydı,
											ama o günün önemli olduğu kararına vardım.
											Beş yıl sonra,
											İzlanda Vigdis Finnbogadottir'i
											ilk kadın cumhurbaşkanı olarak seçti.
											göğüs kanserini yenmiş
											ve bir göğsünü aldırmış
											boşanmış bir anne.
											Kampanya sezonu sırasında
											erkek rakiplerinden biri
											onun başkanlık görevini yapamacağını iddia etti;
											çünkü o bir kadındı, hatta yarım bir kadındı.
											Seçimi kazandığı gece
											rakibini cevaplamak için—-
											sadece küstahlığı için değil—
											rakibine şu cevabı verdi:
											""Aslına bakarsanız, İzlandalıları emzirecek değilim,
											onlara liderlik edeceğim.""
									","
											Mais je suis plus encline à la révolution,
											et c'est normal, je suis islandaise.
											Nous avons une longue histoire
											de femmes indépendantes, courageuses et fortes,
											depuis l'époque viking.
											Et je veux vous raconter le moment
											où je me suis rendu compte pour la première fois que les femmes ont de l'importance dans l'économie
											et dans la société,
											j'avais sept ans — c'était le jour de l'anniversaire de ma mère —
											le 24 octobre 1975.
											Les femmes en Islande ont pris une journée de congé.
											Elles ont pris une journée de congé, du travail ou de la maison,
											et rien n'a fonctionén en Islande.
											(Rires)
											Elles ont manifesté en plein centre de Reykjavik,
											et elles ont mis les questions des femmes à l'ordre du jour.
											Et certains disent que c'était le début d'un mouvement mondial.
											Pour moi, c'était le début d'un long voyage,
											mais j'ai décidé que ce jour aurait de l'importance.
											CInq ans plus tard,
											L'isalnde a élu Vigdis Finnbogadottir comme présidente —
											la première femme a devenir chef d'état,
											mère célibataire,
											qui avait survécu à un cancer du sein,
											à qui on avait enlevé un sein.
											Et lors d'une des réunions de sa campagne,
											un de ses opposants homme
											a fait allusion au fait qu'elle ne pouvait pas devenir présidente;
											elle était une femme, et même une demi femme.
											Cette nuit-là, elle a gagné les élections,
											parce qu'elle a répliqué —
											pas seulement à cause de ce comportement merdique —
											mais elle a répliqué, et elle a dit,
											""Et bien, en fait, je ne vais pas allaiter la nation islandaise,
											je vais la diriger.""
									","
											Ich bin aber eher der Revolutionär,
											und ich sollte es sein; ich bin aus Island.
											Wir haben eine lange Geschichte
											starker, couragierter, unabhängiger Frauen,
											die bis in die Wikingertage zurückreicht.
											Ich möchte Ihnen sagen, wann ich
											zum ersten Mal begriff, dass Frauen einen Unterschied in der Wirtschaft
											und Gesellschaft bewirken.
											Ich war sieben, es war zufällig der Geburtstag meiner Mutter,
											der 24. Oktober 1975.
											Frauen in Island nahmen sich diesen Tag frei.
											Von der Arbeit oder dem Haushalt nahmen sie sich frei,
											und nichts ging mehr in Island.
											(Lachen)
											Sie marschierten ins Zentrum von Reykjavik
											und setzten Frauenthemen auf die Tagesordnung.
											Einige sagen, das war der Beginn einer weltweiten Bewegung.
											Für mich war es der Beginn einer langen Reise,
											und ich entschied, dass dieser Tag wichtig sein sollte.
											Fünf Jahre später
											wählte Island Vigdis Finnbogadottir zur Präsidentin,
											zum ersten Mal eine Frau im obersten Amt,
											eine alleinerziehende Mutter,
											die Brustkrebs überlebt hatte,
											nachdem man eine ihrer Brüste entfernt hatte.
											Auf einer der Wahlveranstaltungen
											spielte einer ihrer männlichen Herausforderer darauf an,
											dass sie nicht Präsident werden könne;
											sie sei eine Frau, und das sogar nur halb.
											In dieser Nacht gewann sie die Wahl,
											denn sie schlug zurück -
											nicht nur wegen dieses beschissenen Verhaltens -
											sondern sie schlug zurück, indem sie sagte:
											""Nun, ich will das isländische Volk ja nicht an die Brust legen,
											sondern führen.""
									",A feminine response to Iceland's financial crash,Halla Tómasdóttir,9:45,"business,feminism,politics,women,women in business"
"
","
","
","
","
",A feminine response to Iceland's financial crash,Halla Tómasdóttir,9:45,"business,feminism,politics,women,women in business"
"
											(Applause)
									","
											(Aplausos)
									","
											(Alkışlar)
									","
											(Applaudissementsç)
									","
											(Applaus)
									",A feminine response to Iceland's financial crash,Halla Tómasdóttir,9:45,"business,feminism,politics,women,women in business"
"
","
","
","
","
",A feminine response to Iceland's financial crash,Halla Tómasdóttir,9:45,"business,feminism,politics,women,women in business"
"
											So I've had incredibly many
											women role models
											that have influenced who I am and where I am today.
											But in spite of that,
											I went through the first 10 or 15 years of my career
											mostly in denial of being a woman.
											Started in corporate America,
											and I was absolutely convinced
											that it was just about the individual,
											that women and men would have just the same opportunities.
											But I've come to conclude lately
											that it isn't like that.
											We are not the same,
											and it's great. Because of our differences,
											we create and sustain life.
											So we should embrace our difference and aim for challenge.
									","
											Así que he tenido muchos
											ejemplos femeninos
											que han influido en quién soy y dónde estoy hoy en día.
											Pero a pesar de eso
											pasé por los primeros 10 o 15 años de mi carrera
											casi negando mi condición de mujer.
											Empecé en el mundo corporativo de EE.UU.
											y estaba absolutamente convencida
											de que todo dependía del individuo,
											que mujeres y hombres tendrían las mismas oportunidades.
											Pero últimamente llegué a la conclusión
											de que no es así.
											No somos iguales.
											Y eso es genial; gracias a nuestras diferencias
											creamos y sostenemos la vida.
											Así que deberíamos abrazar las diferencias y buscar el desafío.
									","
											Kısacası, şimdiye kadar çok fazla
											kadın idolüm
											benim bugün olduğum kişi olmamda etken oldu.
											Fakat buna rağmen,
											kariyerimin ilk 10 veya 15 yılını
											kadın olduğumu gözardı ederek geçirdim.
											Kurumsal Amerika'da başladım
											ve kesinlikle bireyin
											en önemli olduğuna inandım —
											kadın ve erkeğin eşit fırsatlara sahip olduğundan emindim.
											Ama son zamanlarda
											bunun böyle olmadığı kararına vardım.
											Biz aynı değiliz.
											Ve bu harika bişey —çünkü farklılıklarımız sayesinde
											hayatı yaratıp, devam ettirebiliyoruz.
											Yani farklılıklarımızı kabul edip ♪
									","
											Et j'ai donc eu un nombre incroyable
											de femmes comme modèles
											qui ont influencé qui je suis et où je suis aujourd'hui.
											Mais malgré ça,
											j'ai passé les 10 ou 15 premières années de ma carrière
											essentiellement à nier le fait d'être une femme.
											J'ai commencé dans l'Amérique des entreprises,
											et j'étais absolument convaincue
											que seul comptait l'individu,
											que les hommes et les femmes avaient les mêmes chances.
											Mais plus tard j'ai conclus que
											ce n'étais pas le cas.
											Nous ne sommes pas pareils.
											Et c'est génial — à cause de nos différences,
											nous créons et maintenons la vie.
											Aussi nous devrions embrasser nos différences et viser le défi,
									","
											Ich hatte also unglaublich viele
											Frauen zum Vorbild,
											die beeinflusst haben, wer ich heute bin und wo ich heute stehe.
											Dennoch habe ich
											in den ersten 10 oder 15 Jahren meiner Karriere
											weitgehend die Augen davor verschlossen, eine Frau zu sein.
											Als ich in der Geschäftswelt Amerikas begann,
											war ich vollkommen überzeugt,
											dass es nur um die Person ging,
											dass Frauen und Männern die gleichen Möglichkeiten offen stehen.
											Mir ist aber jüngst aufgegangen,
											dass dem nicht so ist.
											Wir sind nicht gleich.
											Und das ist großartig, denn wegen unserer Unterschiede
											schaffen und erhalten wir Leben.
											Wir sollten also unsere Unterschiedlichkeit annehmen und nach Herausforderung streben.
									",A feminine response to Iceland's financial crash,Halla Tómasdóttir,9:45,"business,feminism,politics,women,women in business"
"
","
","
","
","
",A feminine response to Iceland's financial crash,Halla Tómasdóttir,9:45,"business,feminism,politics,women,women in business"
"
											The final thought I want to leave with you
											is that I'm fed up with this tyranny
											of either/or choices in life —
											either it's men or it's women.
											We need to start embracing the beauty of balance.
											So let's move away
											from thinking about business here and philanthropy there,
											and let's start thinking about
											doing good business.
											That's how we change the world. That's the only sustainable future.
									","
											La idea final que quiero dejarles
											es que estoy harta de esta tiranía
											de las opciones excluyentes en la vida:
											son los hombres o son las mujeres.
											Tenemos que empezar a apreciar la belleza del equilibrio.
											Dejemos entonces
											de pensar en los negocios por un lado y la filantropía por otro
											y empecemos a pensar
											en hacer buenos negocios.
											Así vamos a cambiar el mundo. Es el único futuro sostenible.
									","
											Sizleri son bir düşünce ile bırakmak istiyorum.
											O da, hayatımızdaki ""ya/ya da"" kararlarından
											bıktım.
											Ya erkek, ya da kadın ♪
											Bizim dengedenin güzelliğini kabullenmeliyiz.
											O zaman artık işletmenin ve hayırseverliğin farklı şeyler olduğunu
											düşünmekten vazgeçip
											iyi iş yapmak hakkında
											düşünelim.
											Dünyayı bu şekilde değiştirebiliriz. Sürdürülebilir tek gelecek bu.
									","
											Je evux vous laisser sur une dernière pensée,
											et c'est que je suis lasse de la tyrannie
											des choix uniques dans la vie —
											soit ce sont les hommes, soit ce sont les femmes.
											nous devons commencer à embrasser la beauté de l'équilibre.
											Alors cessons de penser
											business d'un côté et philanthropie de l'autre,
											et commençons à penser
											à faire du bon business.
											C'est comme cela que nous changerons le monde. C'est le seul futur durable.
									","
											Ein letzter Gedanke, den ich noch loswerden möchte,
											ist der, dass ich diese Tyrannei
											der Entweder-oder-Entscheidungen satt bin -
											entweder Männer oder Frauen.
											Wir müssen anfangen, die Schönheit der Ausgewogenheit für uns zu entdecken.
											Kommen wir also weg davon,
											hier ans Geschäft und dort an die Menschlichkeit zu denken,
											sondern lassen Sie uns beginnen,
											über wirklich gute Geschäfte nachzudenken.
											So können wir die Welt verändern. Das ist die einzige nachhaltige Zukunft.
									",A feminine response to Iceland's financial crash,Halla Tómasdóttir,9:45,"business,feminism,politics,women,women in business"
"
","
","
","
","
",A feminine response to Iceland's financial crash,Halla Tómasdóttir,9:45,"business,feminism,politics,women,women in business"
"
											Thank you.
									","
											Gracias.
									","
											Teşekkürler.
									","
											Merci.
									","
											Ich danke Ihnen.
									",A feminine response to Iceland's financial crash,Halla Tómasdóttir,9:45,"business,feminism,politics,women,women in business"
"
","
","
","
","
",A feminine response to Iceland's financial crash,Halla Tómasdóttir,9:45,"business,feminism,politics,women,women in business"
"
											(Applause)
									","
											(Aplausos)
									","
											(Alkışlar)
									","
											(Applaudissements)
									","
											(Applaus)
									",A feminine response to Iceland's financial crash,Halla Tómasdóttir,9:45,"business,feminism,politics,women,women in business"
"
","
","
","
","
",A feminine response to Iceland's financial crash,Halla Tómasdóttir,9:45,"business,feminism,politics,women,women in business"
