fr,en,pt,es,tr,title,speaker,duration,tags
"
","
","
","
","
",What is Zeno's Dichotomy Paradox?,Colm Kelleher,3:56,"philosophy,TED-Ed,animation"
"
											Voici Zénon d'Élée,
											un philosophe grec
											célèbre pour avoir inventé 
un certain nombre de paradoxes,
											des arguments qui semblent logiques,
											mais dont la conclusion 
est absurde ou contradictoire.
											Depuis plus de 2 000 ans,
											les énigmes hallucinantes 
de Zénon ont inspiré
											mathématiciens et philosophes
											à mieux comprendre la nature de l'infini.
											L'un des plus connus 
des problèmes de Zénon
											on appelle le paradoxe de la dichotomie,
											ce qui signifie, « le paradoxe 
de couper en deux » en grec ancien.
											Il dit à peu près ceci :
											Après une longue journée 
assis à réfléchir,
											Zénon décide de marcher 
de sa maison jusqu'au parc.
											L'air frais clarifie son esprit
											et l'aide à mieux réfléchir.
											Pour accéder au parc,
											il doit d'abord arriver 
à mi-chemin du parc.
											Cette partie de son trajet
											prend un certain laps de temps.
											Une fois qu'il arrive à mi-chemin,
											il a besoin de parcourir 
la moitié restante de la distance.
											Encore une fois, 
cela prend un laps de temps.
											Une fois qu'il y arrive, 
il a encore besoin de parcourir
											la moitié de la distance qui reste,
											qui prend un autre laps de temps.
											Cela se produit encore et encore et encore.
											Vous pouvez voir que nous pouvons 
continuer comme ça à l'infini,
											divisant la distance restante
quelle qu'elle soit
											en de plus en plus petits bouts,
											chacun prenant 
un laps de temps à traverser.
											Alors, combien de temps faut-il à Zénon
pour rejoindre le parc ?
											Eh bien, pour le savoir, 
vous devez additionner les temps
											de chacun des bouts du trajet.
											Le problème est qu'il y a une infinité 
de ces bouts de taille finie.
											Alors, la durée totale 
ne doit-elle pas être infinie ?
											Cet argument, d'ailleurs, 
est complètement général.
											Il dit que se déplacer d'un endroit quelconque
à un autre endroit quelconque
											devrait prendre un laps de temps infini.
											En d'autres termes, il dit 
que tout mouvement est impossible.
											Cette conclusion 
est manifestement absurde,
											mais où est la faille dans la logique ?
											Pour résoudre le paradoxe,
											il est utile de transformer l'histoire 
en un problème de mathématiques.
											Supposons que la maison de Zénon 
est à 1,6 km du parc
											et que Zénon marche à 1,6 km/h.
											Le bon sens nous dit que 
le temps pour le trajet
											devrait être une heure.
											Mais, regardons les choses 
du point de vue de Zénon
											et divisons le trajet en bouts.
											La première moitié du trajet 
prend une demi-heure,
											la partie suivante prend 
un quart d'heure,
											la troisième partie prend 
un huitième d'une heure,
											et ainsi de suite.
											Si on récapitule tous ces temps,
											on obtient une série 
qui ressemble à ceci.
											« Maintenant », pourrait dire Zénon,
											« puisqu'il y a une infinité de termes
											du côté droit de l'équation,
											et chaque terme individuel est fini,
											la somme doit être égale à l'infini, pas vrai ? »
											C'est le problème avec l'argument de Zénon.
											Comme les mathématiciens 
s'en sont rendu compte depuis,
											il est possible d'ajouter à l'infini
de nombreux termes de taille finie
											et toujours obtenir une réponse finie.
											« Comment ? » demandez-vous.
											Eh bien, réfléchissons-y 
de la manière suivante.
											Commençons par un carré 
qui a une surface d'un mètre.
											Maintenant coupons le carré en deux,
											et puis coupez l'autre moitié en deux,
											et ainsi de suite.
											Alors que nous faisons ça,
											gardons une trace 
des surfaces des bouts.
											La première tranche crée deux parties,
											chacune d'une superficie de moitié.
											La tranche suivante divise 
une de ces moitiés en deux,
											et ainsi de suite.
											Mais, peu importe combien de fois 
nous coupons les boîtes,
											la superficie totale est toujours la somme 
des surfaces de tous les bouts.
											Maintenant vous pouvez voir pourquoi 
nous avons choisi cette façon particulière
											de couper le carré.
											Nous avons obtenu la même série infinie
											que pour le temps de trajet de Zénon.
											Quand nous construisons 
de plus en plus de bouts bleus,
											pour utiliser le jargon des mathématiques,
											quand nous prenons la limite où 
n tend vers l'infini,
											le carré entier est recouvert de bleu.
											Mais la surface du carré est une seule unité,
											donc la somme infinie doit être égale à un.
											Pour en revenir au trajet de Zénon,
											nous pouvons maintenant voir 
comment le paradoxe est résolu.
											Non seulement la somme de la série infinie 
aboutit à une réponse finie,
											mais cette réponse finie est la même que celle
											que le bon sens nous dit vraie.
											Le trajet de Zénon prend une heure.
									","
											This is Zeno of Elea,
											an ancient Greek philosopher
											famous for inventing a number of paradoxes,
											arguments that seem logical,
											but whose conclusion is absurd or contradictory.
											For more than 2,000 years,
											Zeno's mind-bending riddles have inspired
											mathematicians and philosophers
											to better understand the nature of infinity.
											One of the best known of Zeno's problems
											is called the dichotomy paradox,
											which means, ""the paradox of cutting in two"" in ancient Greek.
											It goes something like this:
											After a long day of sitting around, thinking,
											Zeno decides to walk from his house to the park.
											The fresh air clears his mind
											and help him think better.
											In order to get to the park,
											he first has to get half way to the park.
											This portion of his journey
											takes some finite amount of time.
											Once he gets to the halfway point,
											he needs to walk half the remaining distance.
											Again, this takes a finite amount of time.
											Once he gets there, he still needs to walk
											half the distance that's left,
											which takes another finite amount of time.
											This happens again and again and again.
											You can see that we can keep going like this forever,
											dividing whatever distance is left
											into smaller and smaller pieces,
											each of which takes some finite time to traverse.
											So, how long does it take Zeno to get to the park?
											Well, to find out, you need to add the times
											of each of the pieces of the journey.
											The problem is, there are infinitely many of these finite-sized pieces.
											So, shouldn't the total time be infinity?
											This argument, by the way, is completely general.
											It says that traveling from any location to any other location
											should take an infinite amount of time.
											In other words, it says that all motion is impossible.
											This conclusion is clearly absurd,
											but where is the flaw in the logic?
											To resolve the paradox,
											it helps to turn the story into a math problem.
											Let's supposed that Zeno's house is one mile from the park
											and that Zeno walks at one mile per hour.
											Common sense tells us that the time for the journey
											should be one hour.
											But, let's look at things from Zeno's point of view
											and divide up the journey into pieces.
											The first half of the journey takes half an hour,
											the next part takes quarter of an hour,
											the third part takes an eighth of an hour,
											and so on.
											Summing up all these times,
											we get a series that looks like this.
											""Now"", Zeno might say,
											""since there are infinitely many of terms
											on the right side of the equation,
											and each individual term is finite,
											the sum should equal infinity, right?""
											This is the problem with Zeno's argument.
											As mathematicians have since realized,
											it is possible to add up infinitely many finite-sized terms
											and still get a finite answer.
											""How?"" you ask.
											Well, let's think of it this way.
											Let's start with a square that has area of one meter.
											Now let's chop the square in half,
											and then chop the remaining half in half,
											and so on.
											While we're doing this,
											let's keep track of the areas of the pieces.
											The first slice makes two parts,
											each with an area of one-half
											The next slice divides one of those halves in half,
											and so on.
											But, no matter how many times we slice up the boxes,
											the total area is still the sum of the areas of all the pieces.
											Now you can see why we choose this particular way
											of cutting up the square.
											We've obtained the same infinite series
											as we had for the time of Zeno's journey.
											As we construct more and more blue pieces,
											to use the math jargon,
											as we take the limit as n tends to infinity,
											the entire square becomes covered with blue.
											But the area of the square is just one unit,
											and so the infinite sum must equal one.
											Going back to Zeno's journey,
											we can now see how how the paradox is resolved.
											Not only does the infinite series sum to a finite answer,
											but that finite answer is the same one
											that common sense tells us is true.
											Zeno's journey takes one hour.
									","
											Este é Zenão de Eleia,
											um antigo filósofo grego
											famoso por inventar
uma série de paradoxos:
											argumentos que parecem lógicos,
											mas cuja conclusão
é absurda ou contraditória.
											Durante mais de 2000 anos,
											os quebra-cabeças complexos de Zenão
											inspiraram matemáticos e filósofos
											a compreender melhor
a natureza do infinito.
											Um dos problemas mais conhecidos de Zenão
											é o chamado paradoxo da dicotomia,
											que, em grego antigo, quer dizer
""o paradoxo de partir em dois"".
											É algo deste género:
											Depois de um longo dia a pensar,
											Zenão decide ir de sua casa ao parque.
											O ar fresco ajuda-o a limpar a mente
e a pensar melhor.
											Para chegar ao parque,
											primeiro tem que chegar
a meio do caminho.
											Esta parte da sua viagem
demora um tempo finito
											Quando ele chega ao meio,
											tem que caminhar
metade da restante distância.
											Novamente, isto demora um tempo finito.
											Quando chega aí, ainda tem que caminhar
											metade da restante distância,
											o que volta a demorar
um período finito de tempo.
											Isto repete-se uma e outra e outra vez.
											Como podem ver,
podemos continuar isto para sempre,
											dividindo a distância que sobrar
											em pedaços cada vez mais pequenos
											sendo que cada um demora um 
tempo finito a ser percorrido.
											Então, quando tempo demora Zenão
a chegar ao parque?
											Para descobrirmos, 
temos que adicionar os tempos
											de cada uma das partes da viagem.
											O problema é que há infinitas partes
de tempo finito.
											Portanto, o total
não deveria ser infinito?
											Já agora, este argumento
é completamente geral.
											Diz que qualquer viagem
de um ponto para outro
											deveria demorar um tempo infinito.
											Por outras palavras, diz que qualquer 
movimento é impossível.
											Esta conclusão é claramente absurda,
											mas onde é que está o erro na lógica?
											Para resolver o paradoxo,
											vamos transformar a história 
num problema matemático.
											Vamos supor que a casa de Zenão
está a um quilómetro do parque
											e que Zenão anda a
um quilómetro por hora.
											O senso comum diz-nos
que o tempo da viagem
											deverá ser de uma hora.
											Mas vamos ver a questão
do ponto de vista de Zenão
											e dividir a viagem
em partes mais pequenas.
											A primeira metade da viagem
demora meia hora,
											a parte seguinte demora um quarto de hora,
											a terceira demora um oitavo de uma hora,
e assim por diante.
											Somando todos estes tempos,
											obtemos uma série com este aspeto.
											""Agora""– diria Zenão –
											""como o número de termos é infinito
do lado direito da equação,
											""e cada termo individual é finito,
											""a soma deveria ser
igual ao infinito, certo?""
											Este é o problema
com o argumento de Zenão.
											Como os matemáticos vieram a descobrir,
											é possível somar um número infinito
de termos finitos
											e, mesmo assim, obter uma resposta finita.
											""Como assim?"" — perguntam vocês.
											Vamos ver as coisas desta forma.
											Vamos começar com um quadrado 
com um metro de área.
											Agora vamos partir o quadrado ao meio,
											e depois dividir o restante ao meio,
e assim por diante.
											Enquanto fazemos isto,
											vamos anotar as áreas das peças.
											O primeiro corte divide em duas partes,
											cada uma com uma área de uma metade.
											O próximo corte divide uma dessas 
metades em metade,
											e assim por diante.
											Mas, por mais vezes
que dividamos as caixas,
											a área total é sempre
a soma de todas as peças.
											Já percebem porque é que escolhemos 
esta forma específica de cortar o quadrado.
											Obtemos a mesma série infinita
											que tínhamos com o tempo
da viagem de Zenão.
											Ao construirmos mais e mais peças azuis,
											e usando o jargão matemático,
											quando chegamos ao limite 
com ""n"" a tender para o infinito,
											todo o quadrado fica coberto de azul.
											Mas a área do quadrado é de apenas uma unidade,
											e por isso a soma do infinito
tem que ser igual a um.
											Voltando à viagem de Zenão,
											podemos ver como o paradoxo é resolvido.
											Não só obtemos uma resposta finita
da soma da série infinita,
											como essa resposta finita é a mesma
											que o senso comum nos dá.
											A viagem do Zenão demora uma hora.
									","
											Este es Zenón de Elea,
											un antiguo filósofo griego
											famoso por inventar
una serie de paradojas,
											argumentos que parecen lógicos,
											pero cuya conclusión
es absurda o contradictoria.
											Durante más de 2000 años,
											los enigmas alucinantes
de Zenón inspiraron
											a matemáticos y filósofos
											a comprender mejor
la naturaleza del infinito.
											Uno de los problemas
más conocidos de Zenón
											es la paradoja dicotómica,
											que en griego antiguo significa
""la paradoja de cortar en dos"".
											Dice así:
											Después de pasar
un largo día pensando,
											Zenón decide caminar desde
su casa hacia el parque.
											El aire fresco despeja su mente
											y le ayuda a pensar mejor.
											Para llegar al parque
											primero tiene que llegar
a la mitad del camino al parque.
											Esta porción de su viaje
											lleva un tiempo finito.
											Una vez que llega
a la mitad del camino
											tiene que caminar
la mitad de la distancia.
											De nuevo, esto lleva
un tiempo finito.
											Una vez que llega allí,
tiene que caminar
											la mitad de la distancia
que le queda,
											lo cual lleva
un tiempo finito.
											Esto ocurre
una y otra vez.
											Puede verse que podemos
seguir así indefinidamente
											dividiendo la distancia que queda
											en distancias cada vez más pequeñas
											cada uno requiere
un tiempo de recorrido.
											Entonces, ¿cuánto tiempo tarda
Zenón para llegar al parque?
											Bueno, para averiguarlo,
hay que sumar los tiempos
											de cada una de las etapas del viaje.
											El problema es que hay infinitas
etapas en el viaje.
											Entonces, ¿no debería ser
infinito el tiempo total?
											Este argumento, por cierto,
es completamente general.
											Dice que viajar
de un lugar a otro lugar
											debería llevar un tiempo infinito.
											En otras palabras, dice que
el movimiento es imposible.
											Esta conclusión
es claramente absurda
											pero, ¿dónde está
el error de lógica?
											Para resolver la paradoja
											ayuda transformar la historia
en problema matemático.
											Supongamos que la casa de Zenón
está a 1,6 km del parque
											y que Zenón camina
a 1,6 km por hora.
											El sentido común nos dice
que el tiempo de viaje
											debería ser de una hora.
											Pero veamos las cosas desde
el punto de vista de Zenón
											y dividamos el viaje en etapas.
											La primera parte del viaje
lleva media hora,
											la siguiente lleva
un cuarto de hora,
											la tercera lleva
un octavo de hora,
											etc.
											Sumando todos estos tiempos,
											obtenemos una serie como esta.
											""Ahora"", podría decir Zenón,
											""dado que hay infinitos términos
											a la derecha de la ecuación,
											y que cada término es finito,
											la suma debería ser infinita, ¿no?""
											Este es el problema
del argumento de Zenón.
											Como ya se han dado cuenta
los matemáticos,
											es posible sumar infinitos
términos de tamaño finito
											y obtener una respuesta finita.
											""¿Cómo?"", se preguntarán.
											Bien, pensémoslo así.
											Empecemos con un cuadrado
cuya área es de un metro.
											Ahora partamos
el cuadro por la mitad,
											luego partamos la mitad
restante por la mitad,
											y así siguiendo.
											Conforme lo hacemos
											sigamos la pista
de las áreas de las etapas.
											La primera porción tiene dos partes,
											cada una con un área de 1/2.
											La siguiente porción divide
una de ellas por la mitad,
											y así siguiendo.
											Pero, no importa cuántas veces
cortemos las cajas,
											la superficie total todavía es la suma
de las áreas de todas las etapas.
											Ahora podemos ver por qué
elegimos esta forma particular
											de cortar el cuadrado.
											Obtuvimos la misma serie infinita
											que tuvimos en el tiempo
del viaje de Zenón.
											Conforme construimos
más y más piezas azules,
											para usar jerga matemática,
											conforme tomamos el límite
cuando n tiende a infinito,
											todo el cuadrado
se cubre de azul.
											Pero el área del cuadrado
es una unidad,
											por eso la suma infinita
debe dar 1.
											Volviendo al viaje de Zenón,
											ahora podemos ver cómo
se resuelve la paradoja.
											No sólo la serie infinita da
un número finito como respuesta
											sino que el resultado es el mismo
											que indica el sentido común.
											El viaje de Zenón lleva una hora.
									","
											Bu Elealı Zeno,
											kurduğu argümanları mantıklı
											ama sonuçları absürd veya çelişkili olan
											çeşitli paradokslarıyla ünlü
											bir Antik Yunan filozofu.
											2000 yılı aşkın bir süredir
											Zeno'nun akıl çelici bilmeceleri,

											matematikçilere ve filozoflara
											sonsuzluğu daha iyi anlama
konusunda ilham vermiştir.
											Zeno'nun en bilinen problemlerinden biri,
											Antik Yunancada ""ikiye ayırma paradoksu""
											anlamına gelen dikotomi paradoksudur.
											Şöyle bir paradokstur:
											Tüm gün boyunca oturup düşündükten sonra
											Zeno evinden parka yürümeye karar verir.
											Temiz hava aklını ferahlatır
											ve daha iyi düşünmesini sağlar.
											Parka varabilmek için
											önce yolun yarısını yürümesi 
gerekmektedir.
											Yolculuğunun bu kısmı
											belirli bir süre alır.
											Orta noktaya geldiği zaman,
											kalan uzaklığın yarısını
yürümesi gerekmektedir.
											Aynı şekilde bu da belirli bir zaman alır.
											İkinci noktaya vardığında hala
											kalan mesafenin yarısını yürümelidir,
											bu da aynı şekilde belirli bir zaman alır.
											Bu tekrar ve tekrar gerçekleşir.
											Gördüğünüz gibi, her bir geçişi belirli
											bir süre alan mesafeleri giderek,
											daha küçük parçalara bölerek
											bunu sonsuza kadar yapabiliriz.
											Öyleyse Zeno'nun parka varması 
ne kadar sürer?
											Bunu anlamak için
yolculuğun her parçasının
											aldığı zamanı toplamalısınız.
											Buradaki problem, bu küçük parçalardan
sonsuz tane olması.
											Dolayısıyla toplam zaman
sonsuz olmalı, değil mi?
											Bu arada, buradaki argüman tamamen genel.
											Paradoksa göre herhangi bir lokasyondan
											bir diğerine gitmek sonsuz zaman almalı.
											Başka bir deyişle,
her hareket imkansızdır.
											Bu sonuç bariz bir şekilde absürt,
											ama mantığındaki kusur nerede?
											Paradoksu çözmek için
											hikayeyi matematik sorusuna 
çevirmek yardımcı olabilir.
											Zeno'nun evinin parktan
bir kilometre uzakta olduğunu
											ve Zeno'nun saatte bir kilometre
yürüdüğünü farz edelim.
											Genel bilgimize göre bu yolculuk
											bir saat kadar sürmeli.
											Hadi olaya bir de Zeno'nun 
bakış açısından bakalım
											ve yolu parçalara bölelim.
											Yolculuğun ilk yarısı yarım saat alır,
											ikinci kısmı 15 dakika sürer,
											üçüncü kısmı ise bir saatin 1/8'i kadar
											ve bu böyle gider.
											Tüm bu süreleri toplayınca
											buna benzer bir düzen elde ederiz.
											Zeno şöyle diyebilirdi:
											""Şimdi, sağ tarafta
elemanlardan sonsuz tane
											olduğundan ve her eleman
											sonlu olduğundan,
											toplam sonsuza eşit olmalı, değil mi?""
											Zeno'nun argümanındaki
sıkıntı işte burada.
											Matematikçilerin de artık bildiği gibi,
											sonsuz tane sonlu elemanı toplayıp
											sonlu bir cevap elde etmek mümkün.
											Nasıl mı?
											Şöyle düşünelim:
											Bir metrekarelik alanı olan
bir kareyle başlayalım.
											Şimdi kareyi ortadan ikiye bölelim,
											sonra da kalan yarıyı ikiye bölelim
											ve böyle devam edelim.
											Bunu yaparken de
											parçaların alanlarını gözlemleyelim.
											İlk bölme iki parça oluşturur,
											iki parçanın da alanı yarımdır.
											İkinci bölüş de bu yarımlardan
birini yarıya böler
											ve bu düzen devam eder.
											Ama kutuları ne kadar bölersek bölelim,
											toplam alan hala tüm parçaların 
alanlarının toplamıdır.
											Şimdi neden kareyi kesmek için bu yöntemi
											seçtiğimizi anlayabilirsiniz.
											Zeno'nun yolculuğundaki zamanda
											elde ettiğimiz sonsuz diziyi elde ettik.
											Gittikçe daha fazla mavi
parça oluştururken
											matematik jargonunu kullanırsak
											ve n sonsuza giderken limitini alırsak
											bütün kare maviyle kaplanır.
											Ama karenin alanı sadece 1 birimdir,
											bü yüzden de sonsuz toplam 
1'e eşit olmalıdır.
											Zeno'nun yolculuğuna dönersek
											paradoksun nasıl
çözüldüğünü şimdi anlayabiliriz.
											Sonsuz serinin toplamı yalnızca
sonlu bir cevap vermekle kalmıyor,
											o sonlu cevap aynı zamanda
											sağduyumuzun bize doğru
olduğunu söylediği cevap.
											Zeno'nun yolcuğulu bir saat sürüyor.
									",What is Zeno's Dichotomy Paradox?,Colm Kelleher,3:56,"philosophy,TED-Ed,animation"
"
","
","
","
","
",What is Zeno's Dichotomy Paradox?,Colm Kelleher,3:56,"philosophy,TED-Ed,animation"
