en,es,tr,fr,de,title,speaker,duration,tags
"
											You can see the moral electromagnet operating in the U.S. Congress.
											This is a graph that shows the degree to which voting
											in Congress falls strictly along the left-right axis,
											so that if you know how liberal or conservative someone is,
											you know exactly how they voted on all the major issues.
											And what you can see is that,
											in the decades after the Civil War,
											Congress was extraordinarily polarized,
											as you would expect, about as high as can be.
											But then, after World War I, things dropped,
											and we get this historically low level of polarization.
											This was a golden age of bipartisanship,
											at least in terms of the parties' ability to work together
											and solve grand national problems.
											But in the 1980s and '90s, the electromagnet turns back on.
											Polarization rises.
											It used to be that conservatives and moderates and liberals
											could all work together in Congress.
											They could rearrange themselves, form bipartisan committees,
											but as the moral electromagnet got cranked up,
											the force field increased,
											Democrats and Republicans were pulled apart.
											It became much harder for them to socialize,
											much harder for them to cooperate.
											Retiring members nowadays say that it's become like gang warfare.
											Did anybody notice that in two of the three debates,
											Obama wore a blue tie and Romney wore a red tie?
											Do you know why they do this?
											It's so that the Bloods and the Crips will know which side to vote for. (Laughter)
									","
											Pueden ver al electromagnetismo moral operando 
en el Congreso de los Estados Unidos.
											Este es un gráfico que muestra 
el grado en el que la votación
											en el Congreso recae estrictamente 
en el eje derecha-izquierda,
											de manera que si saben qué tan liberal 
o conservador es alguien,
											saben exactamente cómo han votado 
sobre todas las cuestiones importantes.
											Y lo que pueden ver es que,
											en las décadas siguientes a la Guerra Civil,
											el Congreso estuvo extraordinariamente polarizado,
											como era de esperar, casi tan alto como puede ser.
											Pero luego, después de la Primera Guerra Mundial, 
las cosas bajaron,
											y tuvimos este histórico nivel bajo de polarización.
											Esta fue una época de oro del bipartidismo,
											por lo menos en términos de la capacidad 
de los partidos para trabajar juntos
											y resolver los grandes problemas nacionales.
											Pero en los años 1980's y 90's, 
el electromagnetismo vuelve a encenderse.
											La polarización aumenta.
											Solía ser que los conservadores y 
los moderados y los liberales
											podían trabajar juntos en el Congreso.
											Podían reorganizarse, formar comités bipartidistas,
											pero a medida que el imán moral se intensificó,
											el campo de fuerza aumentó,
											los demócratas y republicanos se repelían.
											Se les hizo mucho más difícil socializar,
											más difícil cooperar entre sí.
											Los miembros jubilados actuales dicen 
que se ha vuelto como una guerra de pandillas.
											¿Alguien notó que en dos de los tres debates,
											Obama lucía una corbata azul 
y Romney lucía una corbata roja?
											¿Saben por qué hacen esto?
											Es para que los Cripsy los Bloods
sepan por quién votar. (Risas)
									","
											Amerikan kongresindeki etik elektro mıknatısların çalışmasını görebilirsin.
											Kongredeki hangi oylamanın sağ-sol ekseninde
											düştüğünü gösterip, özgürlükçü ya da muhafazakar birinin
											bütün önemli konularda nasıl oy verdiklerini gösteren de
											bu grafiktir.
											Göreceğin şudur ki, iç savaştan onlarca yıl sonra
											Kongre alışılmamış bir şekilde,
											olabileceği en yüksek değerlerde
											kutuplaşmıştı.
											Ama 1.Dünya Savaşı'ndan sonra işler değişti,
											kutuplaşmalar tarihi bir şekilde düştü.
											Partizanlıkta altın çağdı bu.
											Yani hiç olmazsa bir araya gelip
											ulusal sorunları çözmekte altın çağdı.
											Ama 1980 ve 1990'larda elektromıknatıs geri döner.
											Kutuplaşma yükselir.
											Eskiden muhafazakarlar, ılımlılar ve özgürlükçüler
											Kongrede birlikte çalışabilirlerdi.
											Partizan komitelerden kendilerini tekrar düzenleyebilirlerdi.
											Ama etik elektromıknatıs hareket attikçe
											kuvvet alanı yükseldi,
											Demokratlar ve Cumhuriyetçiler ayrı taraflara çekildiler.
											Onlar için sosyalleştirmek ve birlikte çalışmak
											daha da zor bir hal aldı.
											Emekli üyeler Kongre'nin şu sıralar çete savaşlarına döndüğünü söylüyorlar.
											3 tartışmadan 2 sinde Obama'nın mavi, Romney'in
											kırmızı kravat taktığına dikkat edeniniz oldu mu?
											Bunu neden yapıyorlar biliyor musunuz?
											Blood ve Crip çetelerinin üyeleri hangi tarafa oy verdiklerini bilsinler diye. (Kahkahalar)
									","
											Vous pouvez voir l'électro-aimant moral en
action au Congrès des États-Unis
											Voici un graphique qui montre à quel degré le Congrès
											vote selon un axe partisan gauche-droite,
											donc si vous connaissez la position libérale ou conservatrice d'un membre,
											vous pouvez savoir comment il a voté sur toutes les questions majeures.
											Et vous pouvez constater que,
											dans les décennies suivant la guerre de sécession,
											le Congrès était extraordinairement polarisé,
											ce qui est prévisible, aussi polarisé que possible.
											Mais ensuite, après la première guerre mondiale,
les choses changèrent,
											et nous en sommes arrivés à ce niveau historiquement bas.
											Ce fut l'âge d'or du bi-partisanisme,
											du moins en ce qui concerne la capacité des partis
de travailler ensemble
											afin de résoudre les grands problèmes nationaux.
											Mais dans les années 80 et 90, l'électro-aimant se remet en marche.
											Le niveau de polarisation remonte.
											Il était une époque ou les conservateurs,
les modérés et les libéraux
											pouvaient travailler ensemble au Congrès.
											Ils pouvaient s'organiser, former des comités bi-partisans,
											mais plus l'électro-aimant moral s'activait,
											plus le champ magnétique se renforçait,
											plus les démocrates et républicains se trouvaient divisés.
											Il devint beaucoup plus difficile pour eux de s'entendre,
											beaucoup plus difficile de coopérer.
											Les membres à la retraite en parlent de nos jours
comme d'une guerre des gangs.
											Quelqu'un a-t-il remarqué que sur deux des trois
débats de la présidentielle,
											Obama portait une cravate bleue et Romney une rouge ?
											Savez-vous pourquoi ?
											C'est pour que les gangs des Bloods et des Crips
sachent pour qui voter. (Rires)
									","
											Sie können den moralischen Elektromagnet 
im US-Kongress beobachten.
											Dieses Diagramm zeigt den Grad, 
mit dem Abstimmung
											im Kongress strikt entlang der 
Links-Rechts-Achse geschieht,
											sodass wenn man weiß, wie liberal 
oder konservativ jemand ist,
											man genau weiß, wie sie in 
den wichtigen Fragen gewählt haben.
											Wir sehen hier, dass
											in den Jahrzehnten nach dem Bürgerkrieg
											der Kongress erwartungsgemäß
											so extrem wie möglich polarisiert war.
											Aber nach dem 1. Weltkrieg fiel das ab
											und es gab einen historischen 
Tiefstand an Polarisation.
											Es war das goldene Zeitalter 
der Überparteilichkeit,
											zumindest was die Fähigkeit 
der Parteien zur Zusammenarbeit
											und zur Lösung großer 
nationaler Probleme betrifft.
											Aber in den 1980ern und '90ern 
setzt der Elektromagnet wieder ein.
											Die Polarisierung steigt.
											Einstmals konnten Konservative, 
Gemäßigte und Liberale
											alle zusammen im Kongress arbeiten.
											Sie konnten sich neu gruppieren, 
überparteiliche Komitees bilden,
											aber als der moralische 
Elektromagnet angekurbelt wurde,
											verstärkte sich das Kraftfeld
											und Demokraten und Republikaner 
wurden auseinandergerissen.
											Es wurde viel schwerer für sie 
miteinander zu verkehren,
											viel schwerer zu kooperieren.
											Ausscheidende Mitglieder sagen heute, 
dass es einem Bandenkrieg gleicht.
											Hat irgendjemand bemerkt, 
dass in zwei von drei Debatten
											Obama eine blaue und Romney 
eine rote Krawatte trägt?
											Wissen Sie, warum sie das tun?
											Damit die Bloods und die Crips wissen, 
für welche Seite sie stimmen sollen. (Lachen)
									",How common threats can make common (political) ground,Jonathan Haidt,20:01,"global issues,politics,society,psychology"
"
","
","
","
","
",How common threats can make common (political) ground,Jonathan Haidt,20:01,"global issues,politics,society,psychology"
"
											The polarization is strongest among our political elites.
											Nobody doubts that this is happening in Washington.
											But for a while, there was some doubt as to whether it was happening among the people.
											Well, in the last 12 years it's become
											much more apparent that it is.
											So look at this data. This is from the American National Elections Survey.
											And what they do on that survey is they ask
											what's called a feeling thermometer rating.
											So, how warm or cold do you feel about, you know,
											Native Americans, or the military, the Republican Party,
											the Democratic Party, all sorts of groups in American life.
											The blue line shows how warmly Democrats feel
											about Democrats, and they like them.
											You know, ratings in the 70s on a 100-point scale.
											Republicans like Republicans. That's not a surprise.
											But when you look at cross-party ratings,
											you find, well, that it's lower, but actually,
											when I first saw this data, I was surprised.
											That's actually not so bad. If you go back to the Carter and even Reagan administrations,
											they were rating the other party 43, 45. It's not terrible.
											It drifts downwards very slightly,
											but now look what happens under George W. Bush and Obama.
											It plummets. Something is going on here.
											The moral electromagnet is turning back on,
											and nowadays, just very recently,
											Democrats really dislike Republicans.
											Republicans really dislike the Democrats. We're changing.
											It's as though the moral electromagnet is affecting us too.
											It's like put out in the two oceans and it's pulling the whole country apart,
											pulling left and right into their own territories
											like the Bloods and the Crips.
									","
											La polarización es más fuerte aún 
entre nuestra élite política.
											Nadie duda de que esto 
esté ocurriendo en Washington.
											Pero por un tiempo, hubo dudas de 
si esto estaba ocurriendo entre las personas.
											Bueno, en los últimos 12 años se ha vuelto
											mucho más obvio que sí está ocurriendo.
											Miren estos datos de la Encuesta Nacional 
de Elecciones de los Estados Unidos.
											Lo que hacen en esa encuesta es preguntar sobre
											el llamado termómetro de 
calificación de sentimiento.
											Así que, qué tan cálido o frío 
se sienten sobre, ya saben,
											nativos estadounidenses, o los militares, 
el Partido Republicano,
											el Partido Demócrata, todo tipo de grupos 
en la vida de los EEUU.
											La línea azul muestra qué tan cálidos 
se sienten los demócratas
											con respecto a los demócratas, y les gustan.
											Ya saben, calificaciones en los 70s 
en una escala de 100 puntos.
											A los republicanos les gustan los republicanos. 
Esa no es ninguna sorpresa.
											Pero cuando miras las calificaciones 
cruzadas entre partidos,
											encuentran, bueno, que la calificación es menor, 
aunque en realidad,
											cuando vi por primera vez estos datos,
me sorprendieron.
											Eso en realidad no es tan malo. Si nos remontamos a las administraciones de Carter e inclusive de Reagan,
											calificaban al otro partido con 43, 45. No es terrible.
											Se desplaza hacia abajo lentamente,
											pero miren lo que ocurre ahora 
con George W. Bush y Obama.
											Se desploma. Algo está ocurriendo aquí.
											El imán moral se está encendiendo de nuevo,
											y hoy en día, muy recientemente,
											a los demócratas realmente 
les desagradan los republicanos.
											A los Republicanos les desagradan 
los demócratas. Estamos cambiando.
											Es como si el imán moral 
nos afectara también a nosotros.
											Está como puesto entre los dos océanos 
y dividiendo al país entero,
											tirando a izquierda y derecha 
hacia sus propios territorios
											como los Crips y los Bloods.
									","
											Kutuplaşma siyasi elitlerde en güçlüdür.
											Bunun da Washington'da olduğundan kimsenin şüphesi yok.
											Ama bir süreliğine, bunun insanlar arasında mı olduğuna dair şüpheler vardı.
											Son 12 yılda daha da
											belirginleşti bu.
											Şu verilere bakın. Bunlar Amerikan Ulusal Elektronik Araştırmalarından.
											Bu çalışmada ısı ölçer denilen hisle
											ne yapıldığı sorulmuştur.
											Yani, Yerli Amerikalılara, orduya, Cumhuriyetçi partiye,
											Demokrat partiye, Amerika'daki her çeşitten partiye karşı
											ne kadar sıcak ya da soğuk hissettiğin sorulmuştur.
											Mavi çizgi Demokratların, demokratlar hakkında nasıl hissettiğini gösteriyor,
											ve onlar Demokratları seviyorlar.
											Bilirsiniz, 70 'lerde 100 üzerinden oylamada,
											Cumhuriyetçiler cumhuriyetçileri seviyorlar. Bu bir sürpriz değil.
											Ama birbirlerine olan sempatilerine baktığımızda
											görüyorsunuz, daha düşük, ama aslında,
											bu veriyi ilk gördüğümde, şaşırmıştım.
											Aslıda o kadar da kötü değil. Carter ve hatta Reagen dönemindeki yönetimlere bakarsak,
											diğer partiye karşı olan oran 43, 45. O kadar da berbat değil.
											Oranlar hafifçe aşağı yukarı hareket ediyor,
											ama George W. Bush ve Obama zamanında nasıl olduğuna bir bakın.
											Birden aşağı düşüyor. Burada bir şey oluyor.
											Etik elektromıknatıs geri geliyor,
											ve şu sıralar, tam da şu anlarda,
											Demokratlar Cumhuriyetçileri gerçekten sevmiyorlar.
											Cumhuriyetçiler Demokratları gerçekten sevmiyorlar. Biz değişiyoruz.
											Sanki bu etik elektromıknatıs bizi de etkiliyor gibi.
											Sanki iki okyanus tüm ülkeyi çekip ayırıyormuş,
											Sanki, sağı ve solu Blood ve Crip çeteleri gibi
											iki mıntıkaya ayırıyormuş gibi.
									","
											La polarisation est au plus haut parmi nos élites politiques.
											Personne ne doute de ce qui se passe à Washington.
											Mais depuis un certain temps, on se demande si cela se passe aussi dans notre population.
											Et bien durant les douze dernières années il est apparu
											que cela est bien plus le cas qu'il n'y paraît.
											Regardez ces données. Elles proviennent de l'Enquête Nationale sur les Élections Américaines.
											Et ce qu'ils étudient dans cette étude est
											ce que l'on nomme un thermomètre du ressenti.
											À quel point vous êtes « chaud » ou « froid »
concernant différents sujets, comme par exemple,
											la question des Indiens d'Amérique, les militaires,
le parti Républicain,
											le parti Démocrate, toutes sortes de sujets
de tous les jours aux États-Unis.
											La ligne bleue indique à quel point
les démocrates sont chaleureux
											envers les autres démocrates,
à quel point ils les apprécient.
											Voilà les chiffres depuis les années 70 sur
une échelle de zéro à 100.
											Les républicains aiment les autres républicains.
Jusque ici pas de surprise.
											Mais quand vous regarder les avis sur l'autre parti,
											on voit que c'est plus « froid », mais qu'en fait,
											et la première fois que j'ai vu ces données j'ai été surpris.
											Ce n'est pas si mal que ça. À l'époque de Carter
et même de l'administration Reagan,
											ils évaluaient leurs opposants 43 ou 45.
Rien de dramatique.
											La tendance est légèrement à la baisse,
											mais ensuite regardez ce qui arrive avec
George W. Bush et Obama.
											La courbe plonge. Quelque chose est
en train de se passer ici.
											L'électro-aimant moral se réactive,
											et actuellement, tout récemment,
											les démocrates détestent vraiment les républicains.
											Et les républicains détestent vraiment les démocrates.
Nous sommes en train de changer.
											C'est comme si l'électro-aiment moral nous affectait aussi.
											C'est comme s'il était de part et d'autre du continent
et qu'il déchirait le pays en deux,
											séparant la gauche et la droite dans
leurs territoires respectifs
											comme les gangs des Bloods et des Crips.
									","
											Die Polarisierung ist in unserer 
politischen Elite am stärksten.
											Keiner wundert sich, dass 
das in Washington passiert.
											Aber eine Zeit lang gab es Zweifel, 
ob es zwischen den Menschen abläuft.
											Nun, in den letzten 12 Jahren wurde
											immer offensichtlicher, dass es so ist.
											Schauen Sie sich diese Daten an. Sie sind 
aus dem American National Elections Survey.
											In der Studie fragen sie nach etwas,
											das Gefühlsthermometer-Bewertung heißt.
											Etwa welche warmen oder 
kalten Gefühle Sie gegenüber
											den nordamerikanischen Indianern, 
dem Militär, der Republikanischen Partei,
											der Demokratischen Partei und den verschiedensten Gruppen des amerikanischen Lebens hegen.
											Die blaue Linie zeigt, welche 
herzlichen Gefühle Demokraten
											gegenüber Demokraten fühlen, und sie mögen sie.
											Die Werte liegen um die 70 
auf einer 100-Punkte-Skala.
											Republikaner mögen Republikaner. 
Das ist keine Überraschung.
											Aber wenn man parteiübergreifende 
Bewertungen betrachtet,
											sieht man, dass sie niedriger sind.
											Als ich die Daten zum ersten 
Mal sah, war ich überrascht.
											Das ist nicht schlimm. Blickt man auf die Regierungszeiten von Carter oder Reagan zurück,
											bewerteten sie die andere Partei 
mit 43, 45. Das ist nicht furchtbar.
											Es wanderte langsam abwärts,
											aber sehen Sie, was unter 
George W. Bush und Obama passiert.
											Es stürzt ab. Etwas passiert hier.
											Der moralische Elektromagnet 
schaltet sich wieder ein
											und heutzutage, erst in jüngster Zeit,
											lehnen Demokraten die 
Republikaner wirklich ab.
											Und Republikaner hassen die 
Demokraten. Wir ändern uns.
											Der moralische Elektromagnet 
beeinflusst scheinbar auch uns.
											Er erstreckt sich über beide Ozeane 
und reißt das ganze Land auseinander,
											er zieht links und rechts in ihre eigenen Gebiete,
											wie die Bloods und die Crips.
									",How common threats can make common (political) ground,Jonathan Haidt,20:01,"global issues,politics,society,psychology"
"
","
","
","
","
",How common threats can make common (political) ground,Jonathan Haidt,20:01,"global issues,politics,society,psychology"
"
											Now, there are many reasons why this is happening to us,
											and many of them we cannot reverse.
											We will never again have a political class
											that was forged by the experience of fighting together
											in World War II against a common enemy.
											We will never again have just three television networks,
											all of which are relatively centrist.
											And we will never again have a large group of conservative southern Democrats
											and liberal northern Republicans making it easy,
											making there be a lot of overlap for bipartisan cooperation.
											So for a lot of reasons, those decades after the Second World War
											were an historically anomalous time.
											We will never get back to those low levels of polarization, I believe.
									","
											Ahora, hay muchas razones 
por las cuales esto nos ocurre,
											y muchas de ellas no las podemos revertir.
											Nunca más tendremos una clase política
											forjada por la experiencia de haber luchado juntos
											en la Segunda Guerra Mundial 
contra un enemigo común.
											Nunca más tendremos sólo 
tres cadenas de televisión,
											todas de relativo centralismo.
											Y nunca más tendremos un gran grupo 
de sureños demócratas conservadores
											y norteños republicanos liberales haciéndolo fácil,
											haciendo que haya bastante superposición 
de cooperación bipartidista.
											Así que por muchas razones, esas décadas 
después de la Segunda Guerra Mundial
											fueron un tiempo de anomalía histórica.
											Nunca más volveremos a esos bajos niveles 
de polarización, creo yo.
									","
											Şimdi, bunların bizim başımıza neden geldiğinin
											bir çok sebebi var, bazılarını geri döndüremeyiz.
											1. Dünya Savaşı'ndaki gibi, ortak düşmana birlikte savaşma
											dersi verecek, sahte deneyimlerimizden oluşan
											politik bir sınıfımız bir daha asla olmayacak.
											Bir daha asla, 3 TV kanalından oluşan,
											hepsi merkezci televizyonumuz olmayacak.
											Ve bir daha asla, partizanlara işbirliği fırsatı veren,
											tutucu güneyli Demokratlarımız,
											özgürlükçü kuzeyli Cumhuriyetçilerimiz olmayacak.
											İkinci Dünya Savaşı'ndan sonraki bu yıllara kural dışı
											denmesinin bir çok sebebi var.
											O eski düşük partizan seviyelerine bir daha dönemeyeceğiz düşüncesindeyim.
									","
											Il existe beaucoup de raisons pour expliquer pourquoi cela nous arrive,
											et beaucoup d'entre elles ne peuvent pas être corrigées.
											Nous n'aurons plus jamais une classe politique
											qui a été formée par l'expérience d'un combat commun
											durant la seconde guerre mondiale contre un ennemi commun.
											Nous n'aurons plus jamais uniquement
3 chaines de télé
											chacune relativement modérée.
											Et nous n'aurons plus jamais de grands groupes
de centre gauche au sud du pays
											et de grands groupes de centre droit au nord du pays qui facilitent,
											qui participent à une coopération bi-partisane.
											Ainsi pour beaucoup de raisons, ces quelques
décennies d'après guerre
											furent des temps historiquement anormaux.
											Je crois que nous ne parviendrons plus jamais à des niveaux aussi bas de polarisation.
									","
											Es gibt viele Gründe, warum uns das passiert
											und viele davon können wir nicht umkehren.
											Wir werden nie wieder 
eine politische Klasse haben,
											die durch die Erfahrung vom
gemeinsamen Kampf gegen
											einen gemeinsamen Feind im 
Zweiten Weltkrieg geformt wurde.
											Wir werden nie wieder nur 
drei Fernsehsender haben,
											die alle relativ gemäßigt waren.
											Und wir werden nie wieder eine große Gruppe 
konservativer Demokraten aus dem Süden
											und liberaler Republikaner aus dem Norden haben,
											die zu vielen Überschneidungen für 
parteiübergreifende Kooperation führen.
											Aus vielen Gründen waren die Jahrzehnte 
nach dem Zweiten Weltkrieg
											eine historisch anormale Zeit.
											Wir werden nie wieder diese niedrigen 
Polarisierungsniveaus erreichen.
									",How common threats can make common (political) ground,Jonathan Haidt,20:01,"global issues,politics,society,psychology"
"
","
","
","
","
",How common threats can make common (political) ground,Jonathan Haidt,20:01,"global issues,politics,society,psychology"
