en,es,tr,fr,de,title,speaker,duration,tags
"
","
","
","
","
",(Re)touching lives through photos,Becci Manson,9:49,"Asia,culture,disaster relief,memory,photography,storytelling"
"
											Before March, 2011, I was a photographic retoucher
											based in New York City.
											We're pale, gray creatures.
											We hide in dark, windowless rooms,
											and generally avoid sunlight.
											We make skinny models skinnier, perfect skin more perfect,
											and the impossible possible,
											and we get criticized in the press all the time,
											but some of us are actually talented artists
											with years of experience
											and a real appreciation for images and photography.
									","
											Antes de marzo del 2011, hacía retoques fotográficos
											en la ciudad de Nueva York.
											Somos criaturas pálidas, grises.
											Nos escondemos en la oscuridad, en cuartos sin ventanas
											y, por lo general, evitamos la luz solar.
											Hacemos a las modelos delgadas todavía más delgadas, la piel perfecta todavía más perfecta
											hacemos lo imposible, posible
											y nos critican en la prensa todo el tiempo
											pero algunos de nosotros somos realmente artistas con talento
											con muchos años de experiencia
											y un gusto verdadero por las imágenes y la fotografía.
									","
											Mart 2011'den önce New York'ta yaşayan bir
											fotoğraf rötuşçusuydum.
											Bizler solgun, gri yaratıklarız.
											Karanlıkta, penceresiz odalarda saklanırız
											ve genellikle güneş ışığından kaçınırız.
											Sıska mankenleri daha sıska, mükemmel tenleri daha mükemmel
											ve imkansızı mümkün hale getiririz,
											ve basın tarafından sürekli eleştiriliriz,
											fakat bazılarımız yılların deneyimine sahip
											gerçekten yetenekli sanatçılarız ve
											görüntüleri ve fotoğrafı gerçekten takdir ederiz.
									","
											Avant mars 2011, j'étais un retoucheur photographique
											basé à New York.
											Nous sommes des créatures pâles, grises.
											Nous nous cachons dans des salles sombres, sans fenêtre,
											et généralement nous évitons les rayons du soleil.
											Nous rendons encore plus maigres des mannequins maigres, encore plus parfaites des peaux parfaites,
											et possible l'impossible,
											on nous critique dans la presse tout le temps,
											mais certains d'entre nous sont en fait des artistes de talent
											avec des années d'expérience,
											et une vraie connaissance des images et de la photographie.
									","
											Vor März 2011 war ich eine Foto-Retuscheurin
											mit Sitz in New York.
											Wir sind blasse, düstere Kreaturen.
											Wir verstecken uns in dunklen, fensterlose Räumen,
											und versuchen uns vom Sonnenlicht fernzuhalten.
											Wir machen dünne Models dünner,
perfekte Haut perfekter
											und das Unmögliche möglich
											und wir werden in der Presse dauern kritisiert,
											jedoch sind einige von uns 
tatsächlich talentierte Künstler
											mit jahrelanger Erfahrung,
											die Bilder und Fotografie wirklich wertschätzen.
									",(Re)touching lives through photos,Becci Manson,9:49,"Asia,culture,disaster relief,memory,photography,storytelling"
"
","
","
","
","
",(Re)touching lives through photos,Becci Manson,9:49,"Asia,culture,disaster relief,memory,photography,storytelling"
"
											On March 11, 2011, I watched from home, as the rest
											of the world did, as the tragic events unfolded in Japan.
											Soon after, an organization I volunteer with,
											All Hands Volunteers, were on the ground, within days,
											working as part of the response efforts.
											I, along with hundreds of other volunteers,
											knew we couldn't just sit at home,
											so I decided to join them for three weeks.
									","
											El 11 de marzo del 2011, vi desde mi casa, al igual que el resto
											del mundo, los trágicos eventos que sucedían en Japón.
											Poco tiempo después, una organización donde era voluntaria,
											All Hands Volunteers, estuvo en el lugar
											trabajando como parte del equipo de respuesta.
											Yo, junto con cientos de otros voluntarios
											supimos que no podíamos quedarnos sentados en casa,
											así que decidí unirme al grupo por tres semanas.
									","
											11 Mart 2011'de, dünyadaki herkes gibi, ben de Japonya'da
											meydana gelen trajik olayları evden izledim.
											Kısa bir süre sonra, gönüllü olduğum bir kuruluş olan
											All Hands (Tüm Eller) Gönüllüleri olay yerindeydi, birkaç gün içinde
											müdahale çalışmalarının bir parçası olmuşlardı.
											Diğer yüzlerce gönüllüyle birlikte, ben de
											sadece evde oturamayacağımızı biliyordum,
											böylece üç haftalığına onlara katılmaya karar verdim.
									","
											Le 11 mars 2011, j'ai vu depuis chez moi, comme le reste du monde,
											les événements tragiques qui se sont déroulés au Japon.
											Peu de temps après, une organisation dans laquelle je suis bénévole,
											All Hands Volunteers, était sur le terrain, en quelques jours,
											et participait aux opérations de secours.
											Je savais, ainsi que des centaines d'autres bénévoles,
											que nous ne pouvions pas rester à la maison,
											j'ai donc décidé de me joindre à eux pendant trois semaines.
									","
											Am 11. März 2011 sah ich von zuhause aus –
											wie der Rest der Welt –
die tragischen Ereignisse in Japan.
											Kurze Zeit später, innerhalb von Tagen, 
war ""All Hands Volunteers"",
											eine Organisation, in der ich 
ehrenamtlich tätig bin, vor Ort,
											und arbeitete als Teil der humanitären Hilfe.
											Wie andere Hunderte von Freiwilligen wusste ich,
											dass wir nicht einfach zu Hause 
herumsitzen konnten,
											und so entschloss ich mich, 
für drei Wochen mitzuhelfen.
									",(Re)touching lives through photos,Becci Manson,9:49,"Asia,culture,disaster relief,memory,photography,storytelling"
"
","
","
","
","
",(Re)touching lives through photos,Becci Manson,9:49,"Asia,culture,disaster relief,memory,photography,storytelling"
"
											On May the 13th, I made my way to the town of Ōfunato.
											It's a small fishing town in Iwate Prefecture,
											about 50,000 people,
											one of the first that was hit by the wave.
											The waters here have been recorded at reaching
											over 24 meters in height,
											and traveled over two miles inland.
											As you can imagine, the town had been devastated.
									","
											El 13 de mayo viajé a Ofunato.
											Es un pequeño pueblo de pescadores ubicado en la prefectura de Iwate
											de casi 50 000 personas,
											uno de los primeros pueblos afectados por la ola.
											El nivel de agua registrado alcanzó
											más de 24 m de altura
											y más de tres km tierra adentro.
											Como pueden imaginar, el pueblo fue devastado.
									","
											13 Mayıs'ta, Ōfunato kasabasına yol aldım.
											Burası Iwate Bölgesinde, yaklaşık 50,000 kişinin yaşadığı
											küçük bir balıkçı kasabası,
											dalgaların ilk vurduğu yerlerden biri.
											Suların burada 24 metreyi aşan yükseğe ulaştığı
											ve iç kısımlara doğru
											üç kilometreden fazlar ilerlediği kaydedildi.
											Tahmin edebileceğiniz gibi, kasaba harap olmuştu.
									","
											Le 13 mai, je suis arrivée dans la ville d'Ōfunato.
											C'est une petite ville dans la préfecture d'Iwate,
											d'environ 50 000 habitants,
											une des premières touchées par la vague.
											Ici, on a mesuré que les eaux avaient atteint
											plus de 24 mètres de hauteur,
											et avaient parcouru plus de trois kilomètres à l'intérieur des terres.
											Comme vous pouvez l'imaginer, la ville était dévastée.
									","
											Am 13. Mai reiste ich nach Ōfunato.
											Das ist ein kleines Fischerdorf in der Präfektur Iwate,
											etwa 50 000 Menschen,
											eines der ersten Dörfer, die von 
der Welle getroffen wurden.
											Das Wasser hat dort eine Höhe
											von mehr als 24 Metern erreicht
											und hat sich mehr als drei km landeinwärts erstreckt.
											Wie Sie sich vorstellen können, 
war die Stadt verwüstet.
									",(Re)touching lives through photos,Becci Manson,9:49,"Asia,culture,disaster relief,memory,photography,storytelling"
"
","
","
","
","
",(Re)touching lives through photos,Becci Manson,9:49,"Asia,culture,disaster relief,memory,photography,storytelling"
"
											We pulled debris from canals and ditches.
											We cleaned schools. We de-mudded and gutted homes
											ready for renovation and rehabilitation.
											We cleared tons and tons of stinking, rotting fish carcasses
											from the local fish processing plant.
											We got dirty, and we loved it.
									","
											Sacamos escombros de los canales y las zanjas.
											Limpiamos escuelas. Quitamos el lodo y dejamos las casas
											listas para ser renovadas y rehabilitadas.
											Quitamos toneladas y toneladas de pescado muerto, apestoso, podrido
											de la fábrica local.
											Nos ensuciamos y nos encantó.
									","
											Kanallardan ve hendeklerden enkaz çıkardık.
											Okulları temizledik. Evleri çamurdan arındırdık ve temizleyip
											yenileme ve iyileştirmeye hazır hale getirdik.
											Yerel balık işleme tesisinden tonlarca ve tonlarca kokuşmuş, çürümüş
											balık leşlerini temizledik.
											Kirlendik ve bu hoşumuza gitti.
									","
											Nous avons sorti des débris des canaux et des fossés.
											Nous avons nettoyé les écoles, enlevé la boue et vidé les maisons
											pour qu'elles soient prêtes à être rénovées et réhabilitées.
											Nous avons dégagé des tonnes et des tonnes de carcasses de poissons puantes en décomposition
											qui provenanient de l'usine locale de transformation du poisson.
											Nous nous sommes salis, et nous avons adoré ça.
									","
											Wir zogen Schutt aus Kanälen 
und Straßengräben.
											Wir säuberten Schulen. Wir demontierten 
und befreiten Häuser von Schlamm,
											um sie für Restaurierung und 
Sanierung vorzubereiten.
											Wir räumten tonnenweise stinkende, 
verrottende Fischkadaver
											aus der dortigen Fischverarbeitungsfabrik.
											Wir machten uns schmutzig 
und wir hatten Spaß daran.
									",(Re)touching lives through photos,Becci Manson,9:49,"Asia,culture,disaster relief,memory,photography,storytelling"
"
","
","
","
","
",(Re)touching lives through photos,Becci Manson,9:49,"Asia,culture,disaster relief,memory,photography,storytelling"
"
											For weeks, all the volunteers and locals alike
											had been finding similar things.
											They'd been finding photos and photo albums
											and cameras and SD cards.
											And everyone was doing the same.
											They were collecting them up, and handing them in to
											various places around the different towns for safekeeping.
									","
											Durante semanas, tanto los voluntarios como los vecinos
											encontraron cosas similares.
											Encontraron fotos y álbumes de fotos
											y cámaras y tarjetas SD.
											Todos hicieron lo mismo.
											Recogerlas y llevarlas a diferentes lugares
											de los pueblos de alrededor para guardarlas.
									","
											Haftalarca, tüm gönüllüler ve yerliler
											benzer şeyler buluyorlardı.
											Fotoğraflar ve fotoğraf albümleri, kameralar ve
											SD kartlar buluyorlardı.
											Ve herkes aynı şeyi yapıyordu.
											Bunları biriktiriyorlardı ve farklı kasabalardaki birçok yere
											bunları saklamaları için teslim ediyorlardı.
									","
											Pendant des semaines, tous les bénévoles et la population locale
											avaient tous trouvé les mêmes objets.
											Ils avaient trouvé des photos, des albums photos,
											des appareils photos et des cartes SD.
											Tout le monde faisait la même chose.
											Ils les collectaient et les rapportaient
											à différents endroits dans ces villes pour les garder en lieu sûr.
									","
											Wochen lang hatten alle Freiwilligen, 
genauso wie die Einheimischen,
											ähnliche Dinge gefunden.
											Sie hatten Fotos und Fotoalben gefunden
											und Kameras und SD-Karten.
											Und alle machten das Gleiche.
											Sie sammelten sie 
und brachten sie zur Aufbewahrung
											zu verschiedenen Orten 
in den verschiedenen Städten.
									",(Re)touching lives through photos,Becci Manson,9:49,"Asia,culture,disaster relief,memory,photography,storytelling"
"
","
","
","
","
",(Re)touching lives through photos,Becci Manson,9:49,"Asia,culture,disaster relief,memory,photography,storytelling"
"
											Now, it wasn't until this point that I realized
											that these photos were such a huge part
											of the personal loss these people had felt.
											As they had run from the wave, and for their lives,
											absolutely everything they had,
											everything had to be left behind.
									","
											No fue hasta entonces que me di cuenta
											de que esas fotos representaban una parte enorme
											de las pérdidas personales que esa gente había sufrido.
											Mientras huían de la ola, y para salvar sus vidas,
											tuvieron que abandonar
											absolutamente todo lo que tenían.
									","
											İşte, o ana kadar bu fotoğrafların bu insanların
											kişisel kayıplarının ne kadar büyük bir bölümünü
											oluşturduğunu fark edememiştim.
											Dalgalardan hayatlarını kurtarmak için kaçarken
											sahip oldukları her şey,
											hem de her şeyin geride bırakılması gerekiyordu.
									","
											Ce n'est qu'à ce moment-là que je me suis rendue compte
											que ces photos étaient une part si énorme
											de la perte personnelle que ces gens avaient ressentie.
											En courant pour échapper à la vague et sauver leurs vies,
											ils avaient été obligés
											de laisser derrière eux absolument tout ce qu'ils avaient.
									","
											Erst zu diesem Zeitpunkt wurde mir klar,
											dass diese Fotos einen solch großen Teil
											des persönlichen Verlustes darstellten, 
den diese Leute erlebt hatten.
											Als sie vor der Welle wegrannten, 
und um ihr Leben rannten,
											mussten sie einfach alles, 
was sie besaßen,
											zurücklassen.
									",(Re)touching lives through photos,Becci Manson,9:49,"Asia,culture,disaster relief,memory,photography,storytelling"
"
","
","
","
","
",(Re)touching lives through photos,Becci Manson,9:49,"Asia,culture,disaster relief,memory,photography,storytelling"
"
											At the end of my first week there, I found myself
											helping out in an evacuation center in the town.
											I was helping clean the onsen, the communal onsen,
											the huge giant bathtubs.
											This happened to also be a place in the town where
											the evacuation center was collecting the photos.
											This is where people were handing them in,
											and I was honored that day that they actually trusted me
											to help them start hand-cleaning them.
									","
											Al final de mi primera semana empecé a
											ayudar en un centro de evacuación del pueblo.
											Ayudé a limpiar los baños comunales
											las enormes, gigantescas bañeras.
											Este lugar resultó ser además el lugar del pueblo
											donde el centro de evacuación recogía las fotos.
											Allí las llevaban
											y tuve el honor de que ese día confiaran en mí
											para limpiar a mano las fotos.
									","
											Oradaki ilk haftamın sonunda, kendimi kasabadaki
											bir tahliye merkezine yardım ederken buldum.
											Kaplıcayı, halka açık olan kaplıcayı, büyük devasa küvetleri
											temizlemelerine yardım ediyordum.
											Burası aynı zamanda kasabada fotoğrafları toplayan
											tahliye merkezlerinden biriydi.
											Burası insanların fotoğrafları teslim ettikleri yerdi
											ve o gün, fotoğrafları elle temizlemeye başlamak için onlara yardım
											etmem konusunda bana güvenmeleri, beni onurlandırdı.
									","
											À la fin de ma première semaine, je me suis retrouvée
											à aider dans un centre d'évacuation de la ville.
											J'aidais à nettoyer l'onsen, l'onsen communal,
											les baignoires géantes .
											Il se trouvait que c'était aussi un lieu dans la ville où
											le Centre d'évacuation collectait les photos.
											C'est là que les gens les ramenaient,
											et j'ai eu l'honneur ce jour-là qu'on me fasse confiance
											pour aider à commencer à les nettoyer à la main.
									","
											Am Ende meiner ersten Woche dort
											half ich in einem Evakuierungszentrum in der Stadt.
											Ich half dabei, die Onsen, 
die kommunalen Onsen,
											die riesengroßen Badewannen zu säubern.
											Das war zufällig auch der Ort in der Stadt,
											an dem das Evakuationszentrum die Fotos sammelte.
											Dort gaben die Leute sie ab,
											und ich fühlte mich geehrt an dem Tag, 
an dem sie mir anvertraut wurden,
											um dabei zu helfen, 
sie von Hand zu reinigen.
									",(Re)touching lives through photos,Becci Manson,9:49,"Asia,culture,disaster relief,memory,photography,storytelling"
"
","
","
","
","
",(Re)touching lives through photos,Becci Manson,9:49,"Asia,culture,disaster relief,memory,photography,storytelling"
"
											Now, it was emotional and it was inspiring,
											and I've always heard about thinking outside the box,
											but it wasn't until I had actually gotten outside of my box
											that something happened.
											As I looked through the photos, there were some
											were over a hundred years old,
											some still in the envelope from the processing lab,
											I couldn't help but think as a retoucher
											that I could fix that tear and mend that scratch,
											and I knew hundreds of people who could do the same.
											So that evening, I just reached out on Facebook
											and asked a few of them, and by morning
											the response had been so overwhelming and so positive,
											I knew we had to give it a go.
											So we started retouching photos.
									","
											Esto fue emocionante e inspirador,
											había escuchado la expresión pensar más allá de los horizontes,
											pero no fue hasta traspasar yo misma mis horizontes
											que algo sucedió.
											Al observar las fotos, encontré algunas que tenían
											más de cien años
											algunas todavía estaban en el sobre del laboratorio,
											no pude evitar pensar como retocadora
											cómo arreglar ese rasgón y reparar aquel rasguño
											y conocía a cientos de personas que podían hacer lo mismo.
											Así es que esa noche entré en Facebook
											contacté con algunos de ellos, y a la mañana siguiente
											la respuesta fue tan abrumadora y positiva,
											que sabía que teníamos que intentarlo.
											Así que comenzamos a retocar las fotos.
									","
											Evet, duygusaldı ve ilham vericiydi,
											her zaman, kalıpların dışında düşünmeyi duyardım ,
											fakat gerçekten de kendi kalıplarımın dışına çıktığımda
											bir şey oldu.
											Fotoğraflara bakarken bazılarının
											yüzyıldan eski olduğunu, bazılarının
											hala baskı stüdyosundan gelen zarf içinde olduğunu gördüm,
											bir rötuşçu olarak, yırtıkları düzeltip çizikleri onarabileceğimi
											düşünmekten kendimi alıkoyamadım,
											ve bunu yapabilecek yüzlerce insan tanıyordum.
											O akşam, Facebook üzerinden birkaç kişiye ulaştım
											ve sordum; ertesi sabah, gelen yanıtlar oldukça
											fazlaydı ve hepsi çok olumluydu,
											bunu denememiz gerektiğini biliyordum.
											Böylece fotoğraflara rötuş yapmaya başladık.
									","
											C'était émouvant et exhaltant,
											j'avais toujours entendu parler de réfléchir différemment,
											mais c'est seulement quand j'ai vraiment commencé à le faire
											que quelque chose s'est passé.
											Alors que je parcourais les photos du regard, il y en avait
											qui avaient plus de cent ans,
											certaines encore dans l'enveloppe du laboratoire de traitement,
											je ne pouvais pas m'empêcher de penser qu'en tant que retoucheur
											je pourrais réparer telle déchirure et telle éraflure,
											je connaissais des centaines de personnes qui pouvaient faire de même.
											Alors ce soir-là, j'ai lancé un appel sur Facebook
											à quelques-uns d'entre eux; le lendemain matin,
											j'avais tant de réponses positives
											que j'ai su que nous devions le tenter.
											Nous avons donc commencé à retoucher des photos.
									","
											Das war sehr ergreifend 
und es war beeindruckend,
											und ich hatte immer vom ""über den 
Tellerrand hinausschauen"" gehört,
											aber erst als ich über meinen 
eigenen Tellerrand hinauskam,
											geschah etwas.
											Als ich diese Fotos durchsah und einige fand,
											die mehr als hundert Jahre alt waren,
											einige immer noch im Umschlag vom Fotolabor,
											konnte ich nicht umhin, zu denken, 
dass ich als Retuscheurin
											diesen Riss ausbessern, 
jenen Kratzer nacharbeiten könnte,
											und ich kannte Hunderte von Leuten, 
die das Gleiche tun konnten.
											An jenem Abend verbreitete ich also 
die Idee auf Facebook
											und fragte ein paar dieser Leute, 
und am nächsten Morgen
											hatte ich eine so überwältigende und 
positive Reaktion erhalten,
											dass ich wusste, wir mussten es versuchen.
											Also fingen wir an, Fotos zu retuschieren.
									",(Re)touching lives through photos,Becci Manson,9:49,"Asia,culture,disaster relief,memory,photography,storytelling"
"
","
","
","
","
",(Re)touching lives through photos,Becci Manson,9:49,"Asia,culture,disaster relief,memory,photography,storytelling"
"
											This was the very first.
											Not terribly damaged, but where the water had caused
											that discoloration on the girl's face
											had to be repaired with such accuracy and delicacy.
											Otherwise, that little girl isn't going to look
											like that little girl anymore, and surely that's as tragic
											as having the photo damaged.
											(Applause)
									","
											Esta fue la primera de todas.
											No estaba demasiado estropeada, pero donde el agua había
											decolorado la cara de la niña
											debía arreglarse con mucha precisión y delicadeza.
											De otro modo, esa niñita no tendría el aspecto
											de ella misma, y eso sería tan trágico
											como tener la foto estropeada.
											(Aplausos)
									","
											Bu, ilkiydi.
											Aşırı zarar görmemişti, fakat kızın yüzünde suyun
											neden olduğu renk bozukluğu
											büyük bir incelik ve hassasiyetle onarılmalıydı.
											Aksi takdirde, o küçük kız artık o küçük kız gibi
											görünmeyecekti ve bu da en az fotoğrafın hasar görmüş
											olması kadar trajikti.
											(Alkış)
									","
											Celle-là a été la toute première.
											Pas terriblement abîmée, mais la décoloration
											causée par l'eau sur le visage de la jeune fille
											devait être réparée avec grande précision et délicatesse.
											Ou alors, cette petite fille ne ressemblera plus
											à cette petite fille et c'est tout aussi tragique
											que d'avoir la photo abîmée.
											(Applaudissements)
									","
											Das hier war das Allererste.
											Nicht heillos beschädigt, aber die Stellen, 
an denen das Wasser
											das Gesicht des Mädchens verfärbt hatte,
											mussten mit solcher Präzision und 
Sorgfalt ausgebessert werden.
											Sonst würde das kleine Mädchen nicht mehr
											wie das kleine Mädchen aussehen, 
und das wäre sicherlich genauso tragisch
											wie das beschädigte Foto.
											(Beifall)
									",(Re)touching lives through photos,Becci Manson,9:49,"Asia,culture,disaster relief,memory,photography,storytelling"
"
","
","
","
","
",(Re)touching lives through photos,Becci Manson,9:49,"Asia,culture,disaster relief,memory,photography,storytelling"
