en,pt,fr,de,title,speaker,duration,tags
"
											Now, the next thing we looked into
was robots, automation, technology.
											Will technology change this picture
and boost productivity?
											Now, the short answer would be
											that our numbers already include
a significant growth in productivity
											driven by technology.
											A long answer would go like this.
											Let's take Germany again.
											The Germans have
a certain reputation in the world
											when it comes to productivity.
											In the '90s, I worked in our Boston office
for almost two years,
											and when I left, an old senior partner
told me, literally,
											""Send me more of these Germans,
they work like machines.""
											(Laughter)
											That was 1998.
											Sixteen years later,
you'd probably say the opposite.
											""Send me more of these machines.
They work like Germans.""
											(Laughter) (Applause)
									","
											Uma outra coisa que observámos 
foram os robôs, a automação, a tecnologia.
											Será que a tecnologia 
vai mudar esta imagem
											e aumentar a produtividade?
											A resposta curta poderá ser
											que os nossos números já incluem
											um crescimento significativo 
da produtividade
											motivado pela tecnologia.
											Uma resposta mais longa será assim:
											Voltemos à Alemanha.
											Os alemães têm uma certa reputação mundial
											no que se refere à produtividade.
											Nos anos 90, eu trabalhei 
no nosso gabinete em Boston,
											durante quase dois anos.
											Quando saí, um sócio mais velho 
disse-me, literalmente:
											""Mande-me mais alemães, 
eles trabalham como máquinas"".
											(Risos)
											Isto foi em 1998.
											Dezasseis anos depois, 
provavelmente diremos o contrário.
											""Mande-me mais máquinas, 
elas trabalham como os alemães"".
											(Risos)
											(Aplausos)
									","
											Ensuite, nous nous sommes intéressés
aux robots,
											à l'automatisation, à la technologie.
											Est-ce que la technologie va modifier
le tableau, et stimuler la productivité ?
											Une réponse courte serait de dire
											que nos chiffres intègrent déjà
une augmentation significative
											de la productivité
entraînée par la technologie.
											Une réponse plus longue
dirait ceci.
											Prenons à nouveau l'Allemagne.
											Les Allemands ont
une certaine réputation mondiale
											en ce qui concerne la productivité.
											Dans les années 90, j'ai travaillé
dans notre bureau de Boston,
											pendant presque 2 ans,
											et quand j'en suis parti, un des associés
principaux m'a dit, littéralement :
											« Envoyez-moi davantage de ces Allemands,
ils travaillent comme des machines. »
											(Rires)
											C'était en 1998.
											Seize ans plus tard,
on dirait plutôt l'inverse :
											« Envoyez-moi davantage de ces machines,
elles travaillent comme des Allemands. »
											(Rires)
(Applaudissements)
									","
											Als Nächstes haben wir uns Roboter, 
Automatisierung und Technologie angesehen.
											Wird Technologie das Bild verändern
und die Produktivität ankurbeln?
											Die kurze Antwort wäre,
											dass unsere Zahlen schon ein bedeutendes
Produktivitätswachstum beinhalten,
											das durch Technologie angetriebenen wird.
											Die lange Antwort sieht so aus:
											Nehmen wir wieder Deutschland.
											Die Deutschen haben einen
gewissen Ruf in der Welt,
											was Produktivität anlangt.
											In den 90ern habe ich fast zwei Jahre
in unserem Büro in Boston gearbeitet.
											Als ich ging, hat mir ein älterer
hochrangiger Kollege wortwörtlich gesagt:
											""Schick mir mehr von den Deutschen,
sie arbeiten wie Maschinen.""
											(Lachen)
											Das war 1998.
											16 Jahre später würde man
wahrscheinlich das Gegenteil sagen:
											""Schick mir mehr von den Maschinen,
die arbeiten wie die Deutschen.""
											(Lachen) (Applaus)
									",The workforce crisis of 2030 — and how to start solving it now,Rainer Strack,12:47,"business,global issues,productivity,work"
"
","
","
","
",The workforce crisis of 2030 — and how to start solving it now,Rainer Strack,12:47,"business,global issues,productivity,work"
"
											Technology will replace
a lot of jobs, regular jobs.
											Not only in the production industry,
											but even office workers are in jeopardy
											and might be replaced by robots,
											artificial intelligence,
big data, or automation.
											So the key question is not
if technology replaces some of these jobs,
											but when, how fast, and to what extent?
											Or in other words,
											will technology help us
to solve this global workforce crisis?
											Yes and no.
											This is a more sophisticated
version of ""it depends.""
											(Laughter)
									","
											A tecnologia vai substituir 
muitos postos de trabalho,
											postos de trabalho habituais.
											Não só na indústria de produção,
											mas os administrativos 
também estão em perigo
											e podem vir a ser substituídos por robôs,
											pela inteligência artificial, 
pelos metadados, pela automação.
											Portanto, a questão chave não é
											se a tecnologia vai substituir 
alguns desses postos de trabalho,
											mas quando, a que ritmo e até que ponto?
											Por outras palavras,
											a tecnologia irá ajudar-nos a resolver 
esta crise global de força de trabalho?
											Sim e não.
											Isto é uma versão 
mais sofisticada do ""depende"".
											(Risos)
									","
											La technologie va remplacer beaucoup
d'emplois, des emplois ordinaires.
											Pas seulement
dans le secteur de l'industrie,
											même les employés de bureau
sont en danger
											et pourraient être remplacés
par des robots,
											par l'intelligence artificielle,
le <i>big data</i>, ou l'automatisation.
											La question n'est pas de savoir
si la technologie
											va remplacer certains de ces emplois,
											mais quand, avec quelle rapidité,
et jusqu'à quel point ?
											En d'autres termes,
											est-ce que la technologie
va nous aider à résoudre
											cette pénurie mondiale de main-d’œuvre ?
											Oui et non.
											C'est une version plus sophistiquée
de « Ça dépend ».
											(Rires)
									","
											Technologie wird viele unserer
alltäglichen Arbeitsstellen ersetzen.
											Nicht nur in der Produktionsbranche,
auch Bürostellen sind gefährdet
											und könnten durch Roboter,
											künstliche Intelligenz, Big Data oder 
Automatisierung ersetzt werden.
											Die Frage ist nicht, ob Technologie
einige dieser Stellen ersetzen wird,
											sondern wann, wie schnell
und in welchem Umfang?
											Mit anderen Worten:
											Wird Technologie uns helfen, 
diese globale Arbeitskräftekrise zu lösen?
											Ja und nein.
											Das ist die raffiniertere Form von
""Es kommt darauf an.""
											(Lachen)
									",The workforce crisis of 2030 — and how to start solving it now,Rainer Strack,12:47,"business,global issues,productivity,work"
"
","
","
","
",The workforce crisis of 2030 — and how to start solving it now,Rainer Strack,12:47,"business,global issues,productivity,work"
"
											Let's take the automotive industry
as an example,
											because there, more than 40 percent
of industrial robots are already working
											and automation has already taken place.
											In 1980, less than 10 percent
of the production cost of a car
											was caused by electronic parts.
											Today, this number is more than 30 percent
											and it will grow
to more than 50 percent by 2030.
											And these new electronic parts
and applications
											require new skills
and have created a lot of new jobs,
											like the cognitive systems engineer
											who optimizes the interaction
between driver and electronic system.
											In 1980, no one had the slightest clue
that such a job would ever exist.
											As a matter of fact,
											the overall number of people
involved in the production of a car
											has only changed slightly
in the last decades,
											in spite of robots and automation.
									","
											Vamos tomar como exemplo 
a indústria automóvel,
											porque nela, já há mais de 40% 
de robôs industriais a trabalhar
											e a automação já ocupou o seu lugar.
											Em 1980, menos de 10% 
do custo de produção de um automóvel
											era causada por partes eletrónicas.
											Hoje, esse número está acima dos 30%
											e vai passar para mais de 50% em 2030.
											Estas novas partes 
e aplicações eletrónicas
											exigem novas competências e criaram 
muitos novos postos de trabalho,
											tais como os sistemas 
de engenharia cognitiva
											que otimizam a interação 
entre condutor e sistema eletrónico.
											Em 1980, ninguém fazia a menor ideia 
de que pudesse existir um trabalho destes.
											Na realidade,
											o número geral de pessoas, envolvidas 
na produção de um automóvel
											só mudou ligeiramente nas últimas décadas,
											apesar dos robôs e da automação.
									","
											Prenons l'industrie automobile,
par exemple,
											parce que là, plus de 40 % des postes
sont déjà tenus par des robots,
											et l'automatisation s'est déjà produite.
											En 1980, moins de 10 %
du coût de production d'une voiture
											venait des éléments électroniques.
											Aujourd'hui,
ce chiffre est supérieur à 30 %
											et il augmentera jusqu'à plus de 50 %
en 2030.
											Et ces nouveaux éléments électroniques
et leurs applications
											requièrent de nouvelles compétences,
											et ont donné naissance
à plein de nouveaux métiers,
											tels que les ingénieurs
en systèmes cognitifs
											qui optimisent l'interaction
entre le conducteur
											et les systèmes électroniques.
											En 1980, personne n'avait la moindre idée
qu'un tel métier existerait un jour.
											En fait,
											le nombre global
de personnes impliquées
											dans la fabrication d'une voiture
											n'a que très peu changé
au cours des dernières décennies,
											malgré les robots
et l'automatisation.
									","
											Nehmen wir die Autobranche als Beispiel,
											dort arbeiten bereits mehr als
40 Prozent der Industrieroboter
											und Automatisierung
hat bereits stattgefunden.
											1980 machten die elektronischen
Teile weniger als 10 Prozent
											der Produktionskosten eines Autos aus.
											Heute sind es über 30 Prozent
											und diese Zahl wird bis 2030
auf über 50 Prozent ansteigen.
											Diese neuen elektronischen
Teile und Anwendungen
											bedürfen neuer Qualifikationen und haben
viele neue Arbeitsplätze geschaffen,
											wie den Informatik-Ingenieur,
											der die Interaktion zwischen Fahrer
und elektronischem System optimiert.
											1980 hätte niemand gedacht, 
dass so ein Beruf je existieren würde.
											Tatsächlich hat sich 
die Zahl der Menschen,
											die an der Produktion
eines Autos beteiligt sind,
											in den letzten Jahrzehnten
nur wenig verändert,
											trotz der Roboter und Automatisierung.
									",The workforce crisis of 2030 — and how to start solving it now,Rainer Strack,12:47,"business,global issues,productivity,work"
"
","
","
","
",The workforce crisis of 2030 — and how to start solving it now,Rainer Strack,12:47,"business,global issues,productivity,work"
"
											So what does this mean?
											Yes, technology
will replace a lot of jobs,
											but we will also see a lot of new jobs
and new skills on the horizon,
											and that means technology will worsen
our overall skill mismatch.
											And this kind of de-averaging
											reveals the crucial challenge
for governments and businesses.
									","
											Então, o que é que isso significa?
											Sim, a tecnologia vai substituir 
muitos postos de trabalho,
											mas também veremos no horizonte 
muitos novos empregos e novas competências.
											Isso significa que a tecnologia
											vai agravar a nossa falta 
de competências, em geral.
											Este tipo de análise pormenorizada
											revela o desafio crucial 
para os governos e para a indústria.
									","
											Que faut-il en conclure ?
											Oui, la technologie
va remplacer beaucoup d'emplois,
											mais on verra arriver également
beaucoup de nouveaux métiers
											et de nouvelles compétences,
											et cela veut dire que la technologie
va aggraver
											notre manque global de compétences.
											Ce genre d'étude détaillée
											révèle la difficulté cruciale qui se pose
aux gouvernements et aux entreprises.
									","
											Was bedeutet das?
											Ja, Technologie wird viele
Arbeitsstellen ersetzen,
											aber wir werden auch viele neue Berufe 
und neue Qualifikationen sehen.
											Technologie wird unser Ungleichgewicht 
bei Qualifikationen verschlimmern.
											Diese Art von Ent-durchschnittlichung
											offenbart die zentrale Herausforderung
für Regierungen und Unternehmen.
									",The workforce crisis of 2030 — and how to start solving it now,Rainer Strack,12:47,"business,global issues,productivity,work"
"
","
","
","
",The workforce crisis of 2030 — and how to start solving it now,Rainer Strack,12:47,"business,global issues,productivity,work"
"
											So people, high-skilled people,
											talents, will be the big thing
in the next decade.
											If they are the scarce resource,
we have to understand them much better.
											Are they actually willing to work abroad?
											What are their job preferences?
									","
											As pessoas altamente especializadas,
											os talentos, serão o mais importante, 
nos próximos dez anos.
											Se forem um recurso escasso, 
temos que tentar percebê-los muito melhor.
											Estarão dispostos a ir trabalhar 
para o estrangeiro?
											Quais são as suas 
preferências profissionais?
									","
											Ainsi, ce qui comptera
dans les dix prochaines années,
											ce seront les gens,
les gens hautement qualifiés, les talents.
											Et si ce sont eux la ressource limitée,
											nous devons chercher à les comprendre
beaucoup mieux.
											Est-ce qu'ils sont vraiment prêts
à s'expatrier ?
											Quels emplois préfèrent-ils ?
									","
											Menschen, hoch qualifizierte 
Menschen und Talente
											werden in den nächsten
10 Jahren das große Thema sein.
											Wenn sie die knappe Ressource sind,
müssen wir sie besser verstehen.
											Sind sie tatsächlich gewillt
zum Arbeiten ins Ausland zu gehen?
											Was sind ihre Vorlieben bei Berufen?
									",The workforce crisis of 2030 — and how to start solving it now,Rainer Strack,12:47,"business,global issues,productivity,work"
"
","
","
","
",The workforce crisis of 2030 — and how to start solving it now,Rainer Strack,12:47,"business,global issues,productivity,work"
"
											To find out, this year we conducted
a global survey
											among more than 200,000 job seekers
from 189 countries.
											Migration is certainly
one key measure to close a gap,
											at least in the short term,
											so we asked about mobility.
											More than 60 percent
of these 200,000 job seekers
											are willing to work abroad.
											For me, a surprisingly high number.
											If you look at the employees
aged 21 to 30,
											this number is even higher.
											If you split this number up by country,
											yes, the world is mobile, but only partly.
											The least mobile countries
are Russia, Germany and the U.S.
											Now where would these people like to move?
											Number seven is Australia,
where 28 percent could imagine moving.
											Then France, Switzerland,
Germany, Canada, U.K.,
											and the top choice
worldwide is the U.S.
									","
											Para saber isso, fizemos este ano 
uma sondagem global
											entre mais de 200 000 candidatos 
a emprego, em 189 países.
											A migração é certamente uma medida chave 
para preencher o fosso,
											pelo menos, a curto prazo.
											Portanto, inquirimos quanto à mobilidade.
											Mais de 60% desses 200 000 candidatos 
a um emprego
											estão dispostos 
a trabalhar no estrangeiro.
											Para mim, foi um número 
surpreendentemente alto.
											Se olharmos apenas para os candidatos 
entre os 21 e os 30 anos,
											esse número ainda é mais alto.
											Se dividirmos esse número por países,
											sim, o mundo é móvel, 
mas apenas em parte.
											Os países menos móveis são 
a Rússia, a Alemanha e os EUA.
											Para onde é que essas pessoas 
gostavam de ir?
											Em sétimo lugar está a Austrália.
											Há 28% que pensam poder ir para lá.
											Depois, a França, a Suíça, 
a Alemanha, o Canadá, o Reino Unido
											e o país de eleição, 
em todo o mundo, os EUA.
									","
											Pour le savoir, nous avons effectué
une étude à l'échelle mondiale,
											portant sur plus de 200 000
demandeurs d'emploi
											dans 189 pays.
											L'immigration est certainement
une mesure-clé pour combler le manque,
											en tout cas à court terme,
											nous avons donc posé la question
de la mobilité.
											Plus de 60 %
de ces 200 000 demandeurs d'emploi
											sont prêts à s'expatrier.
											J'ai été étonné par ce chiffre élevé.
											Si l'on prend les employés
âgés de 21 à 30 ans,
											leur nombre est encore plus élevé.
											Si on étudie 
chaque pays séparément,
											le monde est mobile, oui,
mais en partie seulement.
											Les pays les moins mobiles sont
la Russie, l'Allemagne et les États-Unis.
											Ensuite, quelles sont
leurs destinations préférées ?
											En septième vient l'Australie,
où 28% des gens auraient envie d'aller,
											puis la France, la Suisse,
l'Allemagne, le Canada, le Royaume-Uni,
											puis la destination préférée
dans le monde,
											les États-Unis.
									","
											Um das herauszufinden, führten wir
dieses Jahr eine globale Umfrage durch.
											Über 200 000 Arbeitssuchende
in 189 Ländern wurden befragt.
											Migration ist sicherlich eine wichtige
Maßnahme, um die Lücke zu schließen —
											jedenfalls auf kurze Sicht —
											also fragten wir nach Mobilität.
											Über 60 Prozent dieser
200 000 Arbeitssuchenden
											sind bereit im Ausland zu arbeiten.
											Für mich war das
eine überraschend hohe Zahl.
											Wenn man die Angestellten
zwischen 21 und 30 ansieht,
											dann ist die Zahl sogar noch höher.
											Wenn man die Zahl
auf die Länder aufteilt —
											Ja, die Welt ist mobil,
aber nur teilweise.
											Die am wenigsten mobilen Länder sind
Russland, Deutschland und die USA.
											Wohin würden diese Menschen gerne ziehen?
											Auf Platz 7 ist Australien. 28 Prozent
können sich vorstellen, dort hinzuziehen.
											Dann Frankreich, die Schweiz, Deutschland,
Kanada, Großbritannien und Nordirland,
											und auf Platz eins weltweit sind die USA.
									",The workforce crisis of 2030 — and how to start solving it now,Rainer Strack,12:47,"business,global issues,productivity,work"
"
","
","
","
",The workforce crisis of 2030 — and how to start solving it now,Rainer Strack,12:47,"business,global issues,productivity,work"
"
											Now, what are the job preferences
of these 200,000 people?
											So, what are they looking for?
											Out of a list of 26 topics,
salary is only number eight.
											The top four topics
are all around culture.
											Number four,
											having a great relationship with the boss;
											three, enjoying a great work-life balance;
											two, having a great relationship
with colleagues;
											and the top priority worldwide
											is being appreciated for your work.
											So, do I get a thank you?
											Not only once a year
with the annual bonus payment,
											but every day.
											And now, our global workforce crisis
becomes very personal.
											People are looking for recognition.
											Aren't we all looking
for recognition in our jobs?
									","
											Quais são as preferências profissionais 
dessas 200 000 pessoas?
											De que é que andam à procura?
											Numa lista de 26 tópicos, 
o salário só aparece em oitavo lugar.
											Os quatro tópicos do topo 
são todos sobre cultura.
											Em quarto lugar,
											ter uma boa relação com o chefe.
											Em terceiro, ter um bom equilíbrio
trabalho-vida.
											Em segundo, ter uma boa relação 
com os colegas.
											E a prioridade das prioridades, 
a nível mundial,
											é ser apreciado pelo trabalho que se faz.
											Ou seja, não me agradecem?
											Não basta uma vez por ano, 
com o pagamento de um bónus anual,
											mas todos os dias.
											Agora, a nossa crise global 
de força de trabalho
											torna-se muito pessoal.
											As pessoas procuram o reconhecimento.
											Não andamos todos nós à procura 
de reconhecimento no nosso trabalho?
									","
											Quelles sont leurs préférences
en matière d'emploi ?
											Que cherchent-ils ?
											Sur une liste de 26 thèmes,
le salaire n'est que 8e.
											Les quatre premiers thèmes
tournent tous autour de la culture.
											En quatrième,
											avoir une bonne relation
avec son patron ;
											troisième, bénéficier d'un bon équilibre
entre le travail et la vie personnelle ;
											second, avoir une bonne relation
avec ses collègues ;
											et la priorité
dans le monde entier
											est d'être reconnu pour son travail.
											C'est-à-dire :
est-ce qu'on me dit merci ?
											Pas seulement une fois par an
avec le bonus annuel,
											mais chaque jour.
											Ainsi, la crise mondiale
de la main-d’œuvre
											devient très personnelle.
											Les gens recherchent
la reconnaissance.
											Ne cherchons-nous pas tous
à être reconnus pour notre travail ?
									","
											Was sind die Jobpräferenzen 
dieser 200 000 Menschen?
											Was suchen sie?
											Aus einer Liste mit 26 Punkten
liegt das Gehalt nur auf Platz acht.
											Platz eins bis vier haben
alle mit Kultur zu tun.
											Platz vier: ""Eine gute 
Beziehung zum Chef"";
											drei: ""ein guter Ausgleich
zwischen Arbeit und Privatleben"";
											zwei: ""eine gute 
Beziehung zu Kollegen"",
											und auf Platz eins weltweit steht:
											""für die eigene Arbeit
Wertschätzung erfahren"".
											Also: ""Bekomme ich ein Dankeschön?""
											Nicht nur einmal im Jahr 
mit der jährlichen Bonuszahlung,
											sondern jeden Tag.
											Jetzt wird unsere globale
Arbeitskräftekrise sehr persönlich.
											Menschen suchen nach Anerkennung.
											Suchen wir nicht alle nach 
Anerkennung in unserer Arbeit?
									",The workforce crisis of 2030 — and how to start solving it now,Rainer Strack,12:47,"business,global issues,productivity,work"
"
","
","
","
",The workforce crisis of 2030 — and how to start solving it now,Rainer Strack,12:47,"business,global issues,productivity,work"
