en,es,fr,title,speaker,duration,tags
"
											However, the question of when
a household is considered ""connected""
											is not quite clear-cut.
											So, for example, last year
the Indian Prime Minister Narendra Modi
											declared all of the villages
in India electrified,
											the criteria for electrification being
											a transformer in every village
plus its public centers
											and 10 percent — 10 percent —
of its households connected.
											Meanwhile,
											the International Energy Agency,
which tracks progress against SDG 7,
											defines energy access as
50 kilowatt hours per person per year.
											That's enough to power
some light bulbs and charge a phone,
											perhaps run a low-watt TV or fan
for a few hours a day.
											Now, providing entry-level access
is an important first step,
											but let's not romanticize the situation.
											By any standard, a few lights
and not much else
											is still living in energy poverty.
											And what's more,
											these energy poverty
indicators and targets
											cover only residential use.
											And yet, households account
for just about one quarter
											of the world's electricity consumption.
											That's because most of our power
is used in industries and for commerce.
									","
											Sin embargo, los parámetros que evalúan
si una casa está conectada o no
											no están muy bien definidos.
											Por ejemplo, el año pasado,
											la primera ministra de India, 
Narendra Modi,
											declaró que todas los pueblos
de India contaban con electricidad,
											tomando como parámetro la instalación
de un transformador en cada lugar
											y en sus centros públicos,
											pero el 10 %, tan solo el 10 %
de las casas tiene conexión eléctrica.
											Por otro lado, la Agencia 
Internacional de Energía,
											que registra los avances según el ODS 7,
											considera que el acceso a la energía
											debe ser de 50 kilovatios-hora 
por persona y por año.
											Ese volumen alcanza para encender
lámparas, cargar un teléfono
											y quizá hacer funcionar una TV 
de bajo consumo o un ventilador
											varias horas al día.
											Ahora bien, este nivel de acceso
es un primer paso muy importante,
											pero es preciso ser realistas.
											Bajo cualquier punto de vista,
un par de lámparas y no mucho más
											siguen indicando
que existe pobreza energética.
											Y, peor aún,
											estos indicadores y objetivos
de la pobreza energética
											se refieren tan solo
al consumo residencial.
											Pero este consumo doméstico
representa tan solo un cuarto
											del consumo a nivel mundial.
											Esto es así porque el mayor
consumo energético
											se da en la industria y el comercio,
									","
											Mais quand un foyer est-il
considéré « relié » ?
											Ce n'est pas très clair.
											Par exemple, le Premier Ministre de l'Inde
a déclaré l'année dernière
											que tous les villages de son pays
avaient l'électricité,
											son critère étant
											un transformateur dans chaque village,
ses bâtiments publics
											et 10 % - je dis bien 10 % -
des foyers électrifiés.
											De même,
											pour l'Agence internationale de l'énergie,
qui suit les progrès concernant l'ODD 7,
											l'accès à l'énergie c'est :
50 kWh par personne et par an.
											C'est suffisant pour alimenter
quelques ampoules, charger un portable,
											voire une télé basse intensité
ou un ventilateur pour quelques heures.
											Certes, fournir un premier accès
est une étape essentielle
											mais n'idéalisons pas les choses.
											Quel que soit le critère, ne disposer
que de quelques lampes,
											c'est toujours la précarité énergétique.
											En plus,
											ces indicateurs et objectifs
											ne ciblent que l'usage des particuliers,
											alors que les foyers
ne représentent qu'un quart
											de la consommation électrique mondiale.
											En effet, on utilise surtout notre énergie
pour l'industrie et le commerce.
									","How to bring affordable, sustainable electricity to Africa",Rose M. Mutiso,13:00,"Africa,energy,global issues,solar energy,innovation,potential,sustainability,development"
"
","
","
","How to bring affordable, sustainable electricity to Africa",Rose M. Mutiso,13:00,"Africa,energy,global issues,solar energy,innovation,potential,sustainability,development"
"
											Which brings me to my main point:
											countries cannot grow out of poverty
without access to abundant,
											affordable and reliable electricity
to power these productive centers,
											or what I call ""Energy for Growth.""
											As you can see from this graph,
											there's simply no such thing
as a low-energy, high-income country.
											It doesn't exist.
											And yet, three billion people in the world
											currently live in countries without
reliable, affordable electricity —
											not just to power their homes
but also their factories,
											their office buildings, their data centers
											and other economic activities.
											Merely electrifying households
and microenterprises
											cannot solve this deeper energy poverty.
											To solve energy poverty,
											we need to deliver reliable,
affordable electricity at scale,
											to power economy-wide job creation
and income growth.
									","
											lo cual me da pie
para el siguiente planteo:
											los países no pueden salir de la pobreza
sin acceso a una electricidad abundante,
											asequible y confiable para suministrar
energía a estos centros de producción,
											o lo que yo llamo 
""energía para el crecimiento"".
											Como se aprecia en este gráfico,
											simplemente no existe un país
de altos ingresos y bajo consumo.
											No existe.
											Sin embargo, 3 mil millones 
de personas en el mundo
											viven actualmente en países 
sin electricidad confiable y asequible,
											no solo para tener energía
en cada casa sino también en las fábricas,
											los edificios de oficinas,
los centros de datos
											y otras actividades económicas.
											Proveer energía a cada casa 
y a los microemprendimientos
											no es suficiente para resolver
la pobreza energética.
											Este profundo problema debe abordarse
											con el suministro de electricidad
confiable, asequible y a gran escala
											para incentivar la creación 
de empleo en toda la economía
											y aumentar los ingresos.
									","
											Ce qui m'amène à mon argument principal :
											un pays ne peut pas sortir de la pauvreté
sans accès à une électricité abondante,
											peu chère et fiable pour alimenter
ses centres productifs,
											ce que j'appelle
« l'énergie pour la croissance ».
											Vous le voyez sur ce graphique,
											il n'y a pas de pays à revenu élevé
qui consomme peu,
											Ça n'existe pas.
											Pourtant, trois milliards
de gens sur Terre
											vivent actuellement
sans électricité fiable et bon marché
											pour alimenter leur foyer
mais aussi leurs usines,
											leurs bureaux, leurs datacenters
											ou leurs autres activités économiques.
											Électrifier les foyers et
les microentreprises
											ne suffit pas pour éradiquer
la précarité énergétique.
											Pour cela,
											il faut fournir une électricité
fiable et bon marché à grande échelle
											pour stimuler les emplois dans
toute l'économie ainsi que la croissance.
									","How to bring affordable, sustainable electricity to Africa",Rose M. Mutiso,13:00,"Africa,energy,global issues,solar energy,innovation,potential,sustainability,development"
"
","
","
","How to bring affordable, sustainable electricity to Africa",Rose M. Mutiso,13:00,"Africa,energy,global issues,solar energy,innovation,potential,sustainability,development"
"
											This need, however, bumps
against an emerging narrative that,
											faced with climate change,
											we all need to transition
from large, centralized power systems
											to small-scale distributed power.
											The growth of off-grid solar in Africa —
											and let me repeat,
off-grid solar is a good thing —
											but that growth fits nicely
into this narrative
											and has led to those claims that Africa
is leapfrogging the old ways of energy
											and building its power system
from the ground up,
											one solar panel at a time.
									","
											Pero esta necesidad se da de bruces
contra una narrativa emergente
											según la cual, en virtud
del cambio climático,
											debemos pasar de sistemas energéticos
de gran escala y centralizados,
											a una electricidad distribuida
de baja escala.
											El auge de la energía solar
autónoma en África,
											reitero, es muy buena,
											pero encaja perfectamente
en esta narrativa
											de que África está dejando atrás
las formas viejas de energía
											y construyendo su sistema 
energético desde cero,
											con sus paneles solares, uno a uno.
									","
											Mais cette nécessité se heurte
au discours récent selon lequel,
											vu le changement climatique,
											on doit tous passer de grands
systèmes d'énergie centralisés
											à une distribution à petite échelle.
											L'énergie solaire hors réseau en Afrique -
											et je répète, c'est une bonne chose -
											s'intègre parfaitement dans ce discours
											qui prétend que l'Afrique
saute les étapes énergétiques anciennes
											et construit son système énergétique
en partant de rien,
											un panneau solaire à la fois.
									","How to bring affordable, sustainable electricity to Africa",Rose M. Mutiso,13:00,"Africa,energy,global issues,solar energy,innovation,potential,sustainability,development"
"
","
","
","How to bring affordable, sustainable electricity to Africa",Rose M. Mutiso,13:00,"Africa,energy,global issues,solar energy,innovation,potential,sustainability,development"
"
											It's a nice, solicitous narrative,
but also quite naïve.
											Like many narratives
of technological disruption,
											often inspired by Silicon Valley,
											it takes for granted the existing systems
that underpin all of this transformation.
											You see, when it comes
to innovating and energy,
											the West is working around the edges
of a system that is tried and tested.
											And so all the sexy stuff —
											the rooftop solar,
											the smart household devices,
the electric vehicles —
											all of this is built on top of a massive
and absolutely essential grid,
											which itself exists within
a proven governance framework.
											Even the most advanced
countries in the world
											don't have an example of an energy system
that is all edges and no center at scale.
									","
											Es un argumento atractivo y complaciente,
pero también bastante ingenuo.
											Como todas las narrativas
de los cambios tecnológicos,
											generalmente impulsadas 
por Silicon Valley,
											da por sentado los sistemas existentes
que respaldan esta transformación.
											Sucede que, cuando de innovación
y energía se trata,
											Occidente transita por el camino
de un sistema que ya fue probado.
											Y todas las cosas atractivas,
											como los techos solares,
											los electrodomésticos inteligentes,
los vehículos eléctricos,
											están construidas sobre la base 
de una red enorme y fundamental
											que, a su vez, existe dentro de un marco
de gestión pública establecida.
											Ni siquiera los países 
más avanzados del mundo
											tienen un sistema energético distribuido
y descentralizado a gran escala.
									","
											C'est un discours bien joli et
attentionné mais très naïf.
											Comme beaucoup des discours
sur les progrès technologiques,
											souvent influencés par la Silicon Valley,
											il tient pour acquis
											les systèmes existants soutenant
toute cette transition.
											Vous comprenez, dans les domaines
de l'innovation et de l'énergie,
											l'Occident utilise un système
qui a été testé et qui fonctionne.
											Et les trucs sympas -
											le système solaire de toiture,
											les systèmes domestiques intelligents,
les voitures électriques -
											tout cela repose sur un énorme
réseau absolument fondamental,
											qui existe lui-même au sein 
d'un cadre gouvernemental reconnu.
											Même les pays les plus modernes
											ne disposent pas d'un système énergétique
sans base solide en son cœur.
									","How to bring affordable, sustainable electricity to Africa",Rose M. Mutiso,13:00,"Africa,energy,global issues,solar energy,innovation,potential,sustainability,development"
"
","
","
","How to bring affordable, sustainable electricity to Africa",Rose M. Mutiso,13:00,"Africa,energy,global issues,solar energy,innovation,potential,sustainability,development"
"
											So ultimately, no approach —
											be it centralized or distributed,
renewable or fossil-based —
											can succeed in solving energy poverty
											without finding a way to deliver
reliable, affordable electricity
											to Africa's emerging industrial
and commercial sectors.
											So, it's not just lights
in every rural home.
											It's power for Africa's cities
that are growing fast
											and increasingly full
of young, capable people
											in desperate need of a job.
											This in turn will require
significant interconnectivity
											and economies of scale,
											making a robust and modern grid
											a crucial piece of any
energy poverty solution.
									","
											En definitiva, ningún sistema,
											sea centralizado o distribuido,
renovable o a base de fósiles,
											puede contribuir a resolver
la pobreza energética
											sin antes encontrar la manera de brindar
electricidad confiable y asequible
											a los sectores emergentes 
de la industria y el comercio en África.
											Es decir, no basta con llevar
luz a cada casa de las zonas rurales.
											Se trata de llevar energía
a ciudades de rápida expansión en África,
											donde hay cada vez 
más gente joven y dispuesta
											con la imperiosa necesidad de un empleo.
											A su vez, esto requerirá 
de una importante interconectividad
											y de economías a escala,
											para construir una red sólida y moderna,
											que es una pieza fundamental
para resolver toda pobreza energética.
									","
											En fin de compte, aucune approche -
											centralisée ou non,
renouvelable ou fossile -
											ne peut mettre fin
à la précarité énergétique
											sans trouver un moyen de fournir
une électricité fiable et bon marché
											aux secteurs industriel et commercial
en développement en Afrique.
											Ça ne veut pas seulement dire
des lampes dans chaque foyer rural.
											Il faut de l'énergie dans les villes
africaines en plein développement,
											de plus en plus peuplées,
par des jeunes gens compétents
											cherchant désespérément du travail.
											Pour cela, il faut
une interconnexion plus importante
											et des économies d'échelle
											pour créer un réseau moderne et solide,
											essentiel à toute solution
à la précarité énergétique.
									","How to bring affordable, sustainable electricity to Africa",Rose M. Mutiso,13:00,"Africa,energy,global issues,solar energy,innovation,potential,sustainability,development"
"
","
","
","How to bring affordable, sustainable electricity to Africa",Rose M. Mutiso,13:00,"Africa,energy,global issues,solar energy,innovation,potential,sustainability,development"
"
											So, our second mistake is falling
for the allure of the quick fix.
											You see, energy poverty exists
											within a complex socioeconomic
and political context.
											And part of the appeal
of new electrification models
											such as off-grid solar, for example,
											is they can often bypass the glacial pace
and inefficiency of government.
											See, with small systems you can skip
the bureaucracies and the utilities
											and sell directly to customers.
											But to confront energy poverty,
											you cannot ignore governments,
you cannot ignore institutions,
											you cannot ignore the many players
involved in making, moving
											and using electricity at scale,
											which is a way to say that when it comes
to providing energy for growth,
											it's not just about
innovating the technology,
											it's about the slow and hard work
of improving governance, institutions
											and the broader macroenvironment.
									","
											Ahora bien, el segundo error es caer
en la tentación de las soluciones rápidas.
											Sabemos que la pobreza energética
											existe en un complejo contexto
socioeconómico y político.
											Y parte del atractivo 
de los nuevos modelos energéticos,
											como la energía solar autónoma,
											es que no están atados a los tiempos
increíblemente lentos
											ni a la ineficiencia gubernamental.
											En los sistemas pequeños se puede
saltear la burocracia y las empresas,
											y vender directamente a los consumidores.
											Pero para enfrentar la pobreza energética,
											no se puede ignorar a los gobiernos,
ni tampoco a las instituciones,
											ni a los muchos actores que participan
en la producción, el transporte
											y el consumo
de electricidad a gran escala.
											Significa que, para brindar energía
que permita el crecimiento,
											no basta con innovar en tecnología.
											Se trata de un trabajo lento y arduo
para mejorar la gestión, las instituciones
											y el macroentorno más amplio.
									","
											Notre deuxième erreur : céder à l'attrait
des solutions provisoires.
											La précarité énergétique existe
											au sein d'un contexte socio-économique
et politique complexe.
											L'un des attraits
des nouveaux modèles d'électrification,
											comme l'énergie solaire hors réseau,
											est la possibilité d'éviter la lenteur
et l'inefficacité du gouvernement.
											Avec des petits systèmes, on peut éviter
la paperasse et les charges
											et vendre directement au consommateur.
											Mais pour faire face
à la précarité énergétique,
											on ne peut pas ignorer les gouvernements,
les institutions,
											tous les acteurs impliqués dans
la production, le déplacement
											et l'utilisation de l'électricité
à grande échelle.
											En bref, quand il faut fournir
de l'énergie pour la croissance,
											il ne suffit pas d'inventer
des technologies innovantes
											il faut améliorer lentement
le gouvernement, les institutions
											et l'écosystème tout autour.
									","How to bring affordable, sustainable electricity to Africa",Rose M. Mutiso,13:00,"Africa,energy,global issues,solar energy,innovation,potential,sustainability,development"
"
","
","
","How to bring affordable, sustainable electricity to Africa",Rose M. Mutiso,13:00,"Africa,energy,global issues,solar energy,innovation,potential,sustainability,development"
"
											OK, so this is all good and nice, you say.
											But what about climate change?
											How do we ensure a high-energy
future for everyone
											while also curbing our emissions?
											Well, we'll have to make
some complex tradeoffs,
											but I believe that
a high-energy future for Africa
											is not mutually exclusive
to a low-carbon future.
											And make no mistake:
											the world cannot expect Africa
to remain in energy poverty
											because of climate change.
									","
											Ahora bien, puede parecer
un discurso muy bonito,
											pero ¿qué hay del cambio climático?
											¿Cómo se puede asegurar un futuro
de alta producción energética
											y a la vez disminuir las emisiones?
											Pues bien, habrá que hacer
algunas complejas concesiones,
											pero creo que un futuro de alta
producción energética en África
											no es incompatible con un futuro
reducido en carbono.
											Y no nos engañemos:
											el mundo no debe pretender que África
siga en la pobreza energética
											por el cambio climático.
									","
											Vous allez me dire :
« C'est bien joli tout ça,
											mais quid du changement climatique ? »
											Comment assurer l'efficacité énergétique
pour tous à l'avenir
											tout en diminuant la pollution ?
											Eh bien, il faudra faire
des compromis difficiles,
											mais je crois que
le futur énergétique en Afrique
											n'est pas incompatible avec
une faible consommation en carbone.
											Ne vous y trompez pas :
le monde ne doit pas s'attendre
											à ce que l'Afrique reste pauvre en énergie
à cause du changement climatique.
									","How to bring affordable, sustainable electricity to Africa",Rose M. Mutiso,13:00,"Africa,energy,global issues,solar energy,innovation,potential,sustainability,development"
"
","
","
","How to bring affordable, sustainable electricity to Africa",Rose M. Mutiso,13:00,"Africa,energy,global issues,solar energy,innovation,potential,sustainability,development"
"
											(Applause)
									","
											(Aplausos)
									","
											(Applaudissements)
									","How to bring affordable, sustainable electricity to Africa",Rose M. Mutiso,13:00,"Africa,energy,global issues,solar energy,innovation,potential,sustainability,development"
"
","
","
","How to bring affordable, sustainable electricity to Africa",Rose M. Mutiso,13:00,"Africa,energy,global issues,solar energy,innovation,potential,sustainability,development"
"
											Actually, the facts show
that the opposite is true.
											Energy will be essential for Africa
to adapt to climate change
											and build resilience.
											You see, rising temperatures will mean
increased demand for space cooling
											and cold storage.
											Declining water tables will mean
increased pumped irrigation.
											And extreme weather and rising sea levels
will require a significant expansion
											and reinforcement of our infrastructure.
											These are all energy-intensive activities.
											So balancing climate change
and Africa's pressing need
											to transition to a high-energy future
											will be tough.
											But doing so is nonnegotiable;
we will have to find a way.
											The first step is broadening
the terms of the debate
											away from this either-or framing.
											And we also must stop
romanticizing solutions
											that distract us from the core challenges.
									","
											En realidad, los datos muestran
que es exactamente al revés.
											La energía será fundamental para que
África se adapte al cambio climático
											y pueda hacerle frente.
											Las mayores temperaturas incrementarán
la demanda para refrigerar espacios
											y sitios de almacenamiento.
											La disminución de las capas freáticas
aumentará el riego por bombeo.
											Los climas extremos 
y el aumento del nivel del mar
											nos obligarán a expandir
y reforzar nuestra infraestructura
											de manera considerable.
											Todas estas actividades 
son de alto consumo energético.
											Compatibilizar el cambio climático
con la imperiosa necesidad de África
											para tener un futuro
de alta producción energética
											será muy difícil.
											Pero es un compromiso no negociable;
habrá que encontrar el camino.
											El primer paso es abrir
los términos del debate
											y dejar de lado los planteos binarios.
											También hay que descartar
las soluciones idealistas
											que nos distraen 
de los desafíos importantes.
									","
											La réalité montre que
c'est l'inverse qui va se produire.
											L'énergie sera essentielle à l'Afrique
											pour s'adapter au climat qui change
et devenir plus forte.
											En effet, la hausse des températures va
augmenter la demande en climatisation
											et en réfrigération.
											La baisse des nappes phréatiques
va demander une irrigation accrue.
											La météo extrême et la montée des océans
va demander un développement
											et un renforcement
important de nos structures.
											Des activités qui consomment
beaucoup d'énergie.
											Concilier le réchauffement climatique
et les besoins énergétiques urgents
											pour passer
à une production d'énergie élevée
											sera difficile.
											Mais il faut trouver un moyen,
c'est indispensable.
											D'abord, il faut élargir le débat :
											il n'y a pas que deux choix possibles.
											Et il faut aussi arrêter
d'idéaliser les solutions
											qui nous éloignent des véritables défis.
									","How to bring affordable, sustainable electricity to Africa",Rose M. Mutiso,13:00,"Africa,energy,global issues,solar energy,innovation,potential,sustainability,development"
